"cond-mat/9707003","Piers Coleman","P. Coleman and A. M. Tsvelik","Local Moments in an Interacting Environment","Latex file with two postscript figures. Revised version, with more
  fully detailed calculations","Phys. Rev. B, Vol. 59, 12757 (1998)","10.1103/PhysRevB.57.12757",,"cond-mat.str-el",,"  We discuss how local moment physics is modified by the presence of
interactions in the conduction sea. Interactions in the conduction sea are
shown to open up new symmetry channels for the exchange of spin with the
localized moment. We illustrate this conclusion in the strong-coupling limit by
carrying out a Schrieffer Wolff transformation for a local moment in an
interacting electron sea, and show that these corrections become very severe in
the approach to a Mott transition. As an example, we show how the Zhang Rice
reduction of a two-band model is modified by these new effects.
","[{""version"":""v1"",""created"":""Tue, 1 Jul 1997 13:43:41 GMT""},{""version"":""v2"",""created"":""Wed, 9 Jul 1997 09:55:21 GMT""},{""version"":""v3"",""created"":""Fri, 31 Oct 1997 04:18:47 GMT""}]","2009-10-30"
"cond-mat/9707004","Sangboo Nam","Sang Boo Nam (Pohang University of Science and Technology)","New Vortex with Zero Fluxoid Quantum in a Superconductor Anomalous Hall
  Effect in High T_c and Low T_c Superconductors","13 pages, LaTex, no figure",,,,"cond-mat.supr-con",,"  It is shown that there are three kinds of vortices in a superconductor; a
vortex with the fluxoid quantum 1 (VF), a new vortex with 0 (VZF), and a vortex
with -1 (VAF), respectively. The Hall field via three vortices is studied and
found to change its sign, depending of the relative strength of contributions
via VF and VAF, similar to that of a system with two kinds of carriers. VZF is
suggested to act as a domain wall between VF and VAF regions, accounting for
the flux and antiflux regions observed in Nb films.
","[{""version"":""v1"",""created"":""Tue, 1 Jul 1997 07:44:36 GMT""}]","2008-02-03"
"cond-mat/9707005","Bertrand Eynard","B. Eynard (Saclay)","Eigenvalue distribution of large random matrices, from one matrix to
  several coupled matrices","31p, Latex-file",,"10.1016/S0550-3213(97)00452-5","SPhT 97/031","cond-mat",,"  It has been observed that the statistical distribution of the eigenvalues of
random matrices possesses universal properties, independent of the probability
law of the stochastic matrix. In this article we find the correlation functions
of this distribution in two classes of random hermitian matrix models: the
one-matrix model, and the two-matrix model, although it seems that the methods
and conclusions presented here will allow generalization to other multi-matrix
models such as the chain of matrices, or the O(n) model. We recover the
universality of the two point function in two regimes: short distance regime
when the two eigenvalues are separated by a small number of other eigenvalues,
and on the other hand the long range regime, when the two eigenvalues are far
away in the spectrum, in this regime we have to smooth the short scale
oscillations. We also discuss the universality properties of more than two
eigenvalues correlation functions.
","[{""version"":""v1"",""created"":""Tue, 1 Jul 1997 08:23:42 GMT""}]","2009-10-30"
"cond-mat/9707006","Marianne Houbiers","M. Houbiers, R. Ferwerda, H.T.C. Stoof, W.I. McAlexander, C.A.
  Sackett, and R.G. Hulet","The Superfluid State of Atomic Li6 in a Magnetic Trap","16 pages Revtex including 10 figures, submitted to Phys. Rev. A",,"10.1103/PhysRevA.56.4864","THU97/18","cond-mat.supr-con",,"  We report on a study of the superfluid state of spin-polarized atomic Li6
confined in a magnetic trap. Density profiles of this degenerate Fermi gas, and
the spatial distribution of the BCS order parameter are calculated in the local
density approximation. The critical temperature is determined as a function of
the number of particles in the trap. Furthermore we consider the mechanical
stability of an interacting two-component Fermi gas, both in the case of
attractive and repulsive interatomic interactions. For spin-polarized Li6 we
also calculate the decay rate of the gas, and show that within the mechanically
stable regime of phase space, the lifetime is long enough to perform
experiments on the gas below and above the critical temperature if a bias
magnetic field of about 5 T is applied. Moreover, we propose that a measurement
of the decay rate of the system might signal the presence of the superfluid
state.
","[{""version"":""v1"",""created"":""Tue, 1 Jul 1997 10:23:52 GMT""}]","2009-10-30"
"cond-mat/9707007","Are Strandlie","Mark Burgess, Haarek Haugerud and Are Strandlie","Object orientation and visualization of physics in two dimensions","12 pages, 10 figures",,"10.1063/1.168655",,"cond-mat comp-gas nlin.CG",,"  We present a generalized framework for cellular/lattice based visualizations
in two dimensions based on state of the art computing abstractions. Our
implementation takes the form of a library of reusable functions written in C++
which hides complex graphical programming issues from the user and mimics the
algebraic structure of physics at the Hamiltonian level. Our toolkit is not
just a graphics library but an object analysis of physical systems which
disentangles separate concepts in a faithful analytical way. It could be
rewritten in other languages such as Java and extended to three dimensional
systems straightforwardly. We illustrate the usefulness of our analysis with
implementations of spin-films (the two-dimensional XY model with and without an
external magnetic field) and a model for diffusion through a triangular
lattice.
","[{""version"":""v1"",""created"":""Tue, 1 Jul 1997 10:57:59 GMT""}]","2009-10-30"
"cond-mat/9707009","Peter Nielaba","J.L. Lebowitz (Rutgers University), A. Mazel (Rutgers University), P.
  Nielaba (University of Mainz, Germany), L. Samaj (Courant Institute, NYU)","Ordering and Demixing Transitions in Multicomponent Widom-Rowlinson
  Models","26 pages, 15 postscript figures","Physical Review E 52, 5985 (1995)","10.1103/PhysRevE.52.5985",,"cond-mat.stat-mech",,"  We use Monte Carlo techniques and analytical methods to study the phase
diagram of multicomponent Widom-Rowlinson models on a square lattice: there are
M species all with the same fugacity z and a nearest neighbor hard core
exclusion between unlike particles. Simulations show that for M between two and
six there is a direct transition from the gas phase at z < z_d (M) to a demixed
phase consisting mostly of one species at z > z_d (M) while for M \geq 7 there
is an intermediate ``crystal phase'' for z lying between z_c(M) and z_d(M). In
this phase, which is driven by entropy, particles, independent of species,
preferentially occupy one of the sublattices, i.e. spatial symmetry but not
particle symmetry is broken. The transition at z_d(M) appears to be first order
for M \geq 5 putting it in the Potts model universality class. For large M the
transition between the crystalline and demixed phase at z_d(M) can be proven to
be first order with z_d(M) \sim M-2 + 1/M + ..., while z_c(M) is argued to
behave as \mu_{cr}/M, with \mu_{cr} the value of the fugacity at which the one
component hard square lattice gas has a transition, and to be always of the
Ising type. Explicit calculations for the Bethe lattice with the coordination
number q=4 give results similar to those for the square lattice except that the
transition at z_d(M) becomes first order at M>2. This happens for all q,
consistent with the model being in the Potts universality class.
","[{""version"":""v1"",""created"":""Tue, 1 Jul 1997 13:06:17 GMT""}]","2009-10-30"
"cond-mat/9707010",,"R. Bulla (1), Th. Pruschke (2) and A.C. Hewson (1) ((1) Imperial
  College, London, (2) Universitaet Regenburg)","Anderson impurity in pseudo-gap Fermi systems","8 pages, LaTeX, 4 figures includes as eps-files","J. Phys.: Condens. Matter 9 (1997) 10463","10.1088/0953-8984/9/47/014",,"cond-mat.str-el",,"  We use the numerical renormalization group method to study an Anderson
impurity in a conduction band with the density of states varying as rho(omega)
\propto |omega|^r with r>0. We find two different fixed points: a local-moment
fixed point with the impurity effectively decoupled from the band and a
strong-coupling fixed point with a partially screened impurity spin. The
specific heat and the spin-susceptibility show powerlaw behaviour with
different exponents in strong-coupling and local-moment regime. We also
calculate the impurity spectral function which diverges (vanishes) with
|omega|^{-r} (|\omega|^r) in the strong-coupling (local moment) regime.
","[{""version"":""v1"",""created"":""Tue, 1 Jul 1997 14:40:16 GMT""}]","2009-10-30"
"cond-mat/9707011","Kontani Hiroshi","Hiroshi Kontani, Morio Miyazawa and Kosaku Yamada","Theory of Anomalous Hall Effect in a Heavy fermion System with a Strong
  Anisotropic Crystal Field","4 pages, revtex, to be published in J. Phys. Soc. Jpn. (No.8)",,"10.1143/JPSJ.66.2252",,"cond-mat.str-el",,"  In a heavy fermion system, there exists the anomalous Hall effect caused by
localized $f$-orbital freedom, in addition to the normal Hall effect due to the
Lorentz force. In 1994, we found that the Hall coefficient caused by the
anomalous Hall effect ($R_H^{AHE}$) is predominant and the relation $R_H^{AHE}
\propto \rho^2$ ($\rho$ is the electrical resistivity) holds at low
temperatures in many compounds. In this work, we study the system where the
magnetic susceptibility is highly anisotropic due to the strong crystalline
electric field on $f$-orbitals. Interestingly, we find that $R_H^{AHE}$ is
nearly isotropic in general. This tendency is frequently observed
experimentally, which has casted suspicion that the anomalous Hall effect may
be irrelevant in real materials. Our theory corresponds to corrections and
generalizations of the pioneering work on ferromagnetic metals by Karplus and
Luttinger.
","[{""version"":""v1"",""created"":""Tue, 1 Jul 1997 14:05:10 GMT""}]","2009-10-30"
"cs/9707101",,"D. L. Mammen, T. Hogg","A New Look at the Easy-Hard-Easy Pattern of Combinatorial Search
  Difficulty","See http://www.jair.org/ for any accompanying files","Journal of Artificial Intelligence Research, Vol 7, (1997), 47-66",,,"cs.AI",,"  The easy-hard-easy pattern in the difficulty of combinatorial search problems
as constraints are added has been explained as due to a competition between the
decrease in number of solutions and increased pruning. We test the generality
of this explanation by examining one of its predictions: if the number of
solutions is held fixed by the choice of problems, then increased pruning
should lead to a monotonic decrease in search cost. Instead, we find the
easy-hard-easy pattern in median search cost even when the number of solutions
is held constant, for some search methods. This generalizes previous
observations of this pattern and shows that the existing theory does not
explain the full range of the peak in search cost. In these cases the pattern
appears to be due to changes in the size of the minimal unsolvable subproblems,
rather than changing numbers of solutions.
","[{""version"":""v1"",""created"":""Tue, 1 Jul 1997 00:00:00 GMT""}]","2008-02-03"
"cs/9707102",,"T. Drakengren, P. Jonsson","Eight Maximal Tractable Subclasses of Allen's Algebra with Metric Time","See http://www.jair.org/ for an online appendix and other files
  accompanying this article","Journal of Artificial Intelligence Research, Vol 7, (1997), 25-45",,,"cs.AI",,"  This paper combines two important directions of research in temporal
resoning: that of finding maximal tractable subclasses of Allen's interval
algebra, and that of reasoning with metric temporal information. Eight new
maximal tractable subclasses of Allen's interval algebra are presented, some of
them subsuming previously reported tractable algebras. The algebras allow for
metric temporal constraints on interval starting or ending points, using the
recent framework of Horn DLRs. Two of the algebras can express the notion of
sequentiality between intervals, being the first such algebras admitting both
qualitative and metric time.
","[{""version"":""v1"",""created"":""Tue, 1 Jul 1997 00:00:00 GMT""}]","2008-02-03"
"cs/9707103",,"J. Y. Halpern","Defining Relative Likelihood in Partially-Ordered Preferential
  Structures","See http://www.jair.org/ for any accompanying files","Journal of Artificial Intelligence Research, Vol 7, (1997), 1-24",,,"cs.AI",,"  Starting with a likelihood or preference order on worlds, we extend it to a
likelihood ordering on sets of worlds in a natural way, and examine the
resulting logic. Lewis earlier considered such a notion of relative likelihood
in the context of studying counterfactuals, but he assumed a total preference
order on worlds. Complications arise when examining partial orders that are not
present for total orders. There are subtleties involving the exact approach to
lifting the order on worlds to an order on sets of worlds. In addition, the
axiomatization of the logic of relative likelihood in the case of partial
orders gives insight into the connection between relative likelihood and
default reasoning.
","[{""version"":""v1"",""created"":""Tue, 1 Jul 1997 00:00:00 GMT""}]","2016-08-31"
"gr-qc/9707001",,"S.Ansoldi, A.Aurilia, R.Balbinot, E.Spallucci","Effective dynamics of self-gravitating extended objects","13 pages, no figures, ReVTeX","Phys.Essays 9 (1996) 556","10.4006/1.3029270",,"gr-qc hep-th",,"  We introduce an effective Lagrangian which describes the classical and
semiclassical dynamics of spherically symmetric, self-gravitating objects that
may populate the Universe at large and small (Planck) scale. These include
wormholes, black holes and inflationary bubbles. We speculate that such objects
represent some possible modes of fluctuation in the primordial spacetime foam
out of which our universe was born. Several results obtained by different
methods are encompassed and reinterpreted by our effective approach. As an
example, we discuss: i) the gravitational nucleation coefficient for a pair of
Minkowski bubbles, and ii) the nucleation coefficient of an inflationary vacuum
bubble in a Minkowski background
","[{""version"":""v1"",""created"":""Tue, 1 Jul 1997 10:22:18 GMT""}]","2015-06-25"
"gr-qc/9707002","Riccardo Giannitrapani","E.Fabri and R.Giannitrapani","Combinatorial Tools for Regge Calculus","5 pages, LaTeX, no figures. To appear on the Proceedings of the 12th
  Italian Conference on General Relativity and Gravitational Physics",,,,"gr-qc",,"  In this short note we briefly review some recent mathematical results
relevant to the classical Regge Calculus evolution problem.
","[{""version"":""v1"",""created"":""Tue, 1 Jul 1997 14:33:47 GMT""}]","2007-05-23"
"hep-ex/9706027",,"D. Norman (representing the D0 Collaboration)","Search for Leptoquarks at D0","23 pages, Latex, Submitted to the proceedings of the Hadron Collider
  Physics conference, June 4-11, 1997, Stony Brook, NY",,,"FERMILAB-Conf-97/224-E","hep-ex",,"  We present in this paper the current status of searches for leptoquarks at
D0. These results include the use of next leading order theoretical predictions
for the cross section for pair production of leptoquarks at hadron colliders.
We also present a new optimized analysis for first generation leptoquarks with
significant increase in sensitivity relative to earlier searches using D0 data.
The mass limits derived from this first generation leptoquark search are
relevant to the recently reported high mass events at HERA.
","[{""version"":""v1"",""created"":""Mon, 30 Jun 1997 19:25:51 GMT""}]","2007-05-23"
"hep-ex/9706028","Kathy Streets","Kathleen Streets (New York University)","D0 Results on W Boson Properties","15 pages, Latex, 16 postscript figures",,,"Fnal-Conf-97-222-E","hep-ex",,"  Results from analyses of events with W and Z bosons are presented for the D0
Tevatron run 1B data samples. From the leptonic decays of the W and Z, the W
and Z production cross sections and the W width are determined. Events in which
the W decays into a tau and neutrino are used to determine the ratio of the
electroweak gauge coupling constants as a measure of lepton universality. Using
W and Z decays into electrons, the the W boson mass is measured.
","[{""version"":""v1"",""created"":""Mon, 30 Jun 1997 21:14:47 GMT""},{""version"":""v2"",""created"":""Tue, 1 Jul 1997 19:11:49 GMT""}]","2008-02-03"
"hep-ex/9707002","J. A. Lauber","J.A. Lauber (UCL), L. Lonnblad (NORDITA), M.H. Seymour (RAL)","Tuning MC Models to Fit DIS e-gamma Scattering Events","5 pages including 10 figures",,,"UCL/HEP 97-02 NORDITA 97/36P RAL-97-025","hep-ex",,"  Monte Carlo models of DIS e-gamma scattering must describe hard emissions as
well as the soft and collinear limits. Comparison with the observed
experimental hadronic energy flow has shown that various models underestimate
the high-p_T contribution, in particular at low-x. We have attempted to tune
the Herwig, Pythia and Ariadne models to improve the agreement with the data,
and to understand the physical implications of the changes required. Unless the
physics of these processes is understood it will not be possible to unfold the
photon structure functions F_2^\gamma from the e^+e^- data without large model
dependent systematic errors.
","[{""version"":""v1"",""created"":""Tue, 1 Jul 1997 11:12:20 GMT""}]","2007-05-23"
"hep-ex/9707003","J. A. Lauber","A.M. Rooke (UCL) (for the OPAL collaboration)","Energy Flows and Jet Production in Tagged e-gamma Events at LEP","1 pages including 1 figures",,,"UCL/HEP 97-03","hep-ex",,"  It has already been shown that the energy flow distributions in tagged events
disagree with those predicted by QCD models, generating serious systematic
errors in the unfolding of the photon structure function $F_{2}^{\gamma}$. This
new analysis uses the jet structure in the hadronic final state to identify the
class of events which is in worst agreement with the models. A cone jet finder
is used to select events with 0,1 or 2 jets whose transverse energy is greater
than 3 GeV. Tagged electrons are detected in the OPAL forward detector at
angles between 60 and 120 milliradians. As well as the QCD-based Monte Carlo
models, HERWIG and PYTHIA, the simple F2GEN program is used to give a
comparison sample of events with purely pointlike photon-quark coupling.
","[{""version"":""v1"",""created"":""Tue, 1 Jul 1997 12:31:10 GMT""}]","2019-08-14"
"hep-ph/9706538","Zvi Bern","Z. Bern, P. Gondolo, M. Perelstein","Neutralino Annihilation into Two Photons","Latex, 12 pages","Phys.Lett.B411:86-96,1997","10.1016/S0370-2693(97)00990-8","UCLA/97/TEP/11, MPI-PhT/97-36","hep-ph astro-ph",,"  We compute the annihilation cross-section of two neutralinos at rest into two
photons, which is of importance for the indirect detection of neutralino dark
matter in the galactic halo through a quasi-monochromatic gamma-ray line. We
include all diagrams to one-loop level in the minimal supersymmetric extension
of the standard model. We use the helicity formalism, the background-field
gauge, and an efficient loop-integral reduction method. We confirm the result
recently obtained by Bergstrom and Ullio in a different gauge, which disagrees
with other published calculations.
","[{""version"":""v1"",""created"":""Mon, 30 Jun 1997 19:47:40 GMT""}]","2008-11-26"
"hep-ph/9706541","Sourendu Gupta","Sourendu Gupta and Prakash Mathews","Chi_1 and Polarisation Asymmetries for Quarkonia at High Orders in
  Non-relativistic QCD","21 pages LaTeX including 2 figures","Phys. Rev. D 56, 7341 (1997)","10.1103/PhysRevD.56.7341","TIFR/TH/97-32","hep-ph",,"  We study doubly polarised asymmetries of c-cbar and b-bbar mesons in hadro-
and photo-production at low transverse momentum in non-relativistic QCD to high
orders in the relative velocity of the pair, v. We give the complete set of
expressions required for the asymmetries up to order v^9. The asymmetries in
the production of eta_{c,b} states are a stable measure of the polarised gluon
densities. The asymmetries for chi_{c,b}, J/psi, psi', and the various Upsilon
states are stringent tests of the NRQCD scaling relations.
","[{""version"":""v1"",""created"":""Mon, 30 Jun 1997 18:30:46 GMT""}]","2016-08-25"
"hep-ph/9706550","Robin Stuart","Robin G. Stuart (Randall Laboratory of Physics)","Gauge Invariance and the Unstable Particle","8 pages LaTeX. Uses aipproc.sty and epsfig.sty. Talk presented at 1st
  Latin American Symposium on High-energy Physics, SILAFAE-I, Merida, November
  1--5, 1996",,"10.1063/1.53257",,"hep-ph",,"  It is shown how to construct exactly gauge-invariant S-matrix elements for
processes involving unstable gauge particles such as the $Z^0$ boson. The
results are applied to derive a physically meaningful expression for the
cross-section $\sigma(e^+e^-\to Z^0Z^0)$ and thereby provide a solution to the
long-standing problem of the unstable particle.
","[{""version"":""v1"",""created"":""Mon, 30 Jun 1997 16:42:29 GMT""}]","2009-10-30"
"hep-ph/9706551","Gerhard Hellstern","G. Hellstern, R. Alkofer and H. Reinhardt","Diquark confinement in an extended NJL model","17 pages, LaTeX, 4 figures, uses epsf.sty","Nucl.Phys.A625:697-712,1997","10.1016/S0375-9474(97)00412-0","UNITU-THEP-11/97, TU-GK-5/97","hep-ph nucl-th",,"  In a Nambu-Jona-Lasinio model supplemented with an infrared cutoff in
addition to the ultraviolet cutoff we study the issue whether diquarks are
confined when the model is extended beyond the rainbow-ladder approximation.
The gap equation, obtained in a truncation scheme motivated via a nontrivial
quark-gluon vertex function, is solved to determine the constituent quark mass
if chiral symmetry is spontaneously broken. In a second step, the
Bethe-Salpeter equations for mesons and diquarks beyond ladder approximation
are derived, taking care to preserve Goldstone's theorem in the pion channel.
While the obtained masses of pseudoscalar and vector mesons are only moderately
shifted compared to the values in ladder approximation, we observe that scalar
diquarks disappear from the physical spectrum and therefore are confined. For
axialvector diquarks we observe indications, that the same mechanism may also
work, but the NJL model allows no conclusive answer in this channel.
","[{""version"":""v1"",""created"":""Mon, 30 Jun 1997 16:47:05 GMT""}]","2008-11-26"
"hep-ph/9706552","Vittorio Del Duca","Vittorio Del Duca","BFKL: a minireview","LaTeX, 6 pages To appear in the Proceedings of DIS97",,"10.1063/1.53687","EDINBURGH 97/8","hep-ph",,"  We summarize the state of the art of resummation techniques in the small-$x$
limit of perturbative QCD.
","[{""version"":""v1"",""created"":""Mon, 30 Jun 1997 18:15:31 GMT""}]","2009-10-30"
"hep-ph/9706553",,"D. Pocanic and E. Frlez (Univ. of Virginia)","pi-N charge exchange and pi(+)-pi(0) scattering at low energies","Talk given by D. Pocanic at QULEN97, Osaka, 20-23 May 1997; 4 pages,
  2 PostScript figures, writen in LaTeX 2e, uses packages ""epsfig"" and
  ""espcrc1""","Nucl.Phys. A629 (1998) 201c-204c","10.1016/S0375-9474(97)00687-8","UVA-INPP-97-04 [30 Jun 1997]","hep-ph nucl-ex",,"  pi-N and pi-pi interactions near threshold are uniquely sensitive to the
chiral symmetry breaking part of the strong interaction. The pi-N sigma-term
value with its implications for nucleon quark structure and the recent
controversy concerning the size of the scalar quark condensate have renewed the
experimental interest in these two fundamental systems. We report new
differential cross sections for the reaction $pi^-p \to \pi^0n$ at 27.5 MeV
pion incident kinetic energy, measured between $\theta_{CM} = 0^\circ$ and
$55^\circ$. Our results are in excellent agreement with the existing
comprehensive pi-N phase shift analysis. We also report on a Chew-Low analysis
of exclusive $\pi^+ p \to \pi^+\pi^0p$ data at 260 MeV pion incident energy.
","[{""version"":""v1"",""created"":""Mon, 30 Jun 1997 19:15:38 GMT""}]","2015-06-25"
"hep-ph/9706554","Markus Luty","Markus A. Luty","Simple Gauge-mediated Models with Local Minima","8 pages, LaTeX2e, no figures. Clarifications and references added;
  results unaffected","Phys.Lett. B414 (1997) 71-76","10.1016/S0370-2693(97)01104-0","UMD-PP 97-132","hep-ph",,"  We describe a simple class of supersymmetric gauge theories that can act as
supersymmetry-breaking sectors for gauge-mediated supersymmetry breaking. The
models have a local supersymmetry-breaking minimum along a direction in field
space where a singlet gets a large expectation value. The potential along this
direction has a runaway behavior stabilized by supersymmetry breaking in the
effective low-energy theory. The supersymmetric vacua are at infinite field
values, and cosmological bounds on false vacuum decay are easily satisfied. The
models have no dimensionful parameters, and all mass scales arise through
strong coupling dynamics. Simple variants of the model are compatible with
perturbative unification, can naturally have dynamical supersymmetry breaking
at a scale as low as 10 TeV, and can solve the R axion problem without
appealing to Planck-scale effects.
","[{""version"":""v1"",""created"":""Mon, 30 Jun 1997 19:58:17 GMT""},{""version"":""v2"",""created"":""Tue, 1 Jul 1997 20:05:20 GMT""},{""version"":""v3"",""created"":""Fri, 25 Jul 1997 15:10:32 GMT""}]","2009-10-30"
