"hep-ph/9707201",,"K.-I. Izawa, M. Kawasaki and T. Yanagida","Dynamical Tuning of the Initial Condition for New Inflation in
  Supergravity","16 pages, latex","Phys.Lett. B411 (1997) 249-255","10.1016/S0370-2693(97)01040-X","UT-780","hep-ph",,"  We point out that for a class of `new inflation' models in supergravity the
required initial value of the inflaton field is dynamically set if there is
another inflation (`pre-inflation') before the `new inflation'. We study the
dynamics of both inflatons by taking a hybrid inflation model for the
`pre-inflation' as an example. We find out that our `new inflation' model
provides reheating temperatures T_R \simeq 10 MeV - 10^4 GeV low enough to
avoid the gravitino problem even in gauge-mediated supersymmetry-breaking
models. We also construct a model where the scale for the `new inflation' is
generated by nonperturbative dynamics of a supersymmetric gauge theory.
","[{""version"":""v1"",""created"":""Tue, 1 Jul 1997 05:28:24 GMT""}]","2009-10-30"
"hep-ph/9707202","Gabriel Lopez","G. Lopez Castro and G. Toledo Sanchez","Effects of the magnetic dipole moment of charged vector mesons in their
  radiative decay distribution","Latex, 11 pages incl. 3 .ps figures, to appear in Phys. Rev. D","Phys.Rev. D56 (1997) 4408-4411","10.1103/PhysRevD.56.4408","UCL-IPT-97-10","hep-ph",,"  We consider the effects of anomalous magnetic dipole moments of vector mesons
in the decay distribution of photons emitted in two-pseudoscalar decays of
charged vector mesons. By choosing a kinematical configuration appropriate to
isolate these effects from model-dependent and dominant bremsstrahlung
contributions, we show that this method can provide a valid alternative for a
measurement of the unknown magnetic dipole moments of charged vector mesons.
","[{""version"":""v1"",""created"":""Tue, 1 Jul 1997 08:12:41 GMT""}]","2009-10-30"
"hep-ph/9707203","Masafumi Koike","Masafumi Koike and Joe Sato","CP- and T-Violation Effects in Long Baseline Neutrino Oscillation
  Experiments","22 pages + 12 eps figures, LaTeX. To appear in ""Proceedings of the
  KEK meetings on CP Violation and its Origin"". Errors are corrected and
  references are updated",,,"ICRR-Report-393-97-16, UT-779","hep-ph",,"  We examine how large CP- and T-violation effects are allowed in long baseline
neutrino experiments with three generations of neutrinos, considering both the
solar neutrino deficit and the atmospheric neutrino anomaly. We considerd two
cases: When we attribute only the atmospheric neutrino anomaly to neutrino
oscillation and assume the constant transition probability of electron neutrino
to explain the solar neutrino deficit, we may have large CP-violation effect.
When we attribute both the atmospheric neutrino anomaly and the solar neutrino
deficit to neutrino oscillation, we can see sizable T-violation effects. In
this case, however, we cannot ignore the matter effect and we will not see the
pure CP-violation effect. We also show simple methods how to separate pure CP
violating effect from the matter effect. We give compact formulae for neutrino
oscillation probabilities assuming one of the three neutrino masses (presumably
tau neutrino mass) to be much larger than the other masses and the effective
mass due to matter effect. Two methods are shown: One is to observe envelopes
of the curves of oscillation probabilities as functions of neutrino energy; a
merit of this method is that only a single detector is enough to determine the
presence of CP violation. The other is to compare experiments with at least two
different baseline lengths; this has a merit that it needs only narrow energy
range of oscillation data.
","[{""version"":""v1"",""created"":""Tue, 1 Jul 1997 09:24:35 GMT""},{""version"":""v2"",""created"":""Mon, 7 Jul 1997 09:21:28 GMT""},{""version"":""v3"",""created"":""Wed, 16 Jul 1997 05:33:59 GMT""},{""version"":""v4"",""created"":""Tue, 3 Aug 1999 09:53:13 GMT""}]","2008-02-03"
"hep-ph/9707204","Karim Benakli","I. Antoniadis and K. Benakli","Erratum for ""Fractionally Charged Particles and Supersymmetry Breaking
  in 4D Strings.""","2 pages, TeX",,"10.1016/S0370-2693(97)00755-7",,"hep-ph",,"  The original paper (hep-th/9209020) contains an early example of gauge
mediated supersymmetry breaking motivated by string model building. In this
erratum we point out an important misprint in the abstract of the published
version (Phys. Lett. B295 (1992) 219) which may confuse the reader. We also
correct the computation of scalar masses and the numerical examples.
Qualitative results remain the same.
","[{""version"":""v1"",""created"":""Tue, 1 Jul 1997 11:23:35 GMT""}]","2009-10-30"
"hep-ph/9707205","Colin Froggatt","C. D. Froggatt, H. B. Nielsen and D. J. Smith","Dynamical Determination of the Top Quark and Higgs Masses and Fermion
  Masses in the Anti-Grand Unification Model","uuencoded 4 page LaTeX file plus 2 postscript figures, uses
  psfig.sty, epsfig.sty and stwol.sty; published in Proceedings of 28th
  International Conference on High Energy Physics (ICHEP 96), Warsaw: 1127-1130",,,,"hep-ph",,"  The multiple point criticality principle is applied to the pure Standard
Model (SM), with a desert up to the Planck scale. We are thereby led to impose
the constraint that the effective Higgs potential should have two degenerate
minima, one of which should have a vacuum expectation value of order unity in
Planck units. In this way we predict a top quark mass of $173 \pm 5$ GeV and a
Higgs particle mass of $135 \pm 9$ GeV. The quark and lepton mass matrices are
considered in the anti-grand unified extension of the SM based on the gauge
group $SMG^3 \otimes U(1)_f$; this group contains three copies of the SM gauge
group SMG, one for each generation, and an abelian flavour group $U(1)_f$. The
9 quark and lepton masses and 3 mixing angles are fitted using 3 free
parameters, with the overall mass scale set by the electroweak interaction. It
is pointed out that the same results can be obtained in an anomaly free $SMG
\otimes U(1)^3$ model.
","[{""version"":""v1"",""created"":""Tue, 1 Jul 1997 14:35:35 GMT""}]","2007-05-23"
"hep-ph/9707206","Sandra Klevansky","S.P. Klevansky and R.H. Lemmer","Spectral Density Functions and Their Sum Rules in an Effective Chiral
  Field Theory","100 Pages Revtex, Figures available upon request",,,"HD-TVP-97/05","hep-ph",,"  The validity of Weinberg's two sum rules for massless QCD, as well as the six
additional sum rules introduced into chiral perturbation theory by Gasser and
Leutwyler, are investigated for the extended Nambu-Jona-Lasinio chiral model
that includes vector and axial vector degrees of freedom. A detailed analysis
of the vector, axial vector and coupled pion plus longitudinal axial vector
modes is given. We show that, under Pauli-Villars regularization of the meson
polarization amplitudes that determine the spectral density functions, all of
the sum rules involving inverse moments higher than zero are automatically
obeyed by the model spectral densities. By contrast, the zero moment sum rules
acquire a non-vanishing right hand side that is proportional to the quark
condensate density of the non-perturbative groundstate. We use selected sum
rules in conjunction with other calculations to obtain explicit expressions for
the scale-independent coupling constants $\bar l_i$ of chiral perturbation
theory in the combination $\bar l_i+\ln(m^2_\pi/\mu^2)$, to evaluate the
Das-Guralnik-Mathur-Low-Young current algebra expression for the
electromagnetic mass difference of the pion, and to compute the pion electrical
polarizability $\alpha_E$. The sum rule calculations %of $\alpha_E$ set an
upper limit of $\alpha_E\leq \alpha/(8\pi^2m_\pi f^2_\pi) \approx
6\times10^{-4}$fm$^3$ on this quantity, that is independent of the quark mass
up to ${\cal O}(m^2_\pi/m^2)$, and only depends on the fundamental constants:
pion mass $m_\pi$ and pion decay constant $f_\pi$, in addition to fine
structure constant $\alpha\approx 1/137$.
","[{""version"":""v1"",""created"":""Tue, 1 Jul 1997 15:17:51 GMT""}]","2009-09-25"
"hep-ph/9707207","Martin Hirsch","M. Hirsch, H.V. Klapdor-Kleingrothaus and S.G. Kovalenko","R-parity Conserving Supersymmetry, Neutrino Mass and Neutrinoless Double
  Beta Decay","LATEX, 29 pages + 4 (uuencoded) figures appended","Phys.Rev. D57 (1998) 1947-1961","10.1103/PhysRevD.57.1947",,"hep-ph",,"  We consider contributions of R-parity conserving softly broken supersymmetry
(SUSY) to neutrinoless double beta ($\znbb$) decay via the (B-L)-violating
sneutrino mass term. The latter is a generic ingredient of any weak-scale SUSY
model with a Majorana neutrino mass. The new R-parity conserving SUSY
contributions to $\znbb$ are realized at the level of box diagrams. We derive
the effective Lagrangian describing the SUSY-box mechanism of $\znbb$-decay and
the corresponding nuclear matrix elements. The 1-loop sneutrino contribution to
the Majorana neutrino mass is also derived.
  Given the data on the $\znbb$-decay half-life of $^{76}$Ge and the neutrino
mass we obtain constraints on the (B-L)-violating sneutrino mass. These
constraints leave room for accelerator searches for certain manifestations of
the 2nd and 3rd generation (B-L)-violating sneutrino mass term, but are most
probably too tight for first generation (B-L)-violating sneutrino masses to be
searched for directly.
","[{""version"":""v1"",""created"":""Tue, 1 Jul 1997 15:26:19 GMT""}]","2009-10-30"
"hep-ph/9707208","Yuji Koike","A. Hayashigaki, Y. Kanazawa and Yuji Koike (Niigata U.)","Next-to-leading order Q^2-evolution of the transversity distribution
  h_1(x, Q^2)","28 pages, Latex. 10 figures. Submitted for publication some time ago","Phys. Rev. D 56, 7350 (1997)","10.1103/PhysRevD.56.7350",,"hep-ph",,"  We present a calculation of the two-loop anomalous dimension for the
transversity distribution h_1(x,Q^2), $\gamma^{h(1)}_n$, in the MS scheme of
the dimensional regularization. Due to the chiral-odd nature, h_1 does not mix
with the gluon distributions, and thus our result is the same for the
flavor-singlet and nonsinglet distributions. At small n (moment of h_1),
$\gamma^{h(1)}_n$ is significantly larger than $\gamma^{f(1)}_n$ (the anomalous
dimension for the nonsinglet f_1), but approaches $\gamma^{f(1)}_n$ very
quickly at large n, keeping the relation $\gamma^{h(1)}_n > \gamma^{f(1)}_n$.
This feature is in parallel to the relation between the one-loop anomalous
dimension for f_1 and h_1.
","[{""version"":""v1"",""created"":""Tue, 1 Jul 1997 14:30:23 GMT""}]","2016-08-25"
"hep-ph/9707209","Carlos Munoz","A. Brignole, L.E. Iba\~nez, C. Mu\~noz","Soft supersymmetry-breaking terms from supergravity and superstring
  models","24 pages, to appear in the book `Perspectives on Supersymmetry',
  World Scientific, Editor G. Kane; some comments and references added",,"10.1142/9789812839657_0003","CERN-TH/97-143, KAIST-TH-97/7, FTUAM 97/7","hep-ph hep-th",,"  We review the origin of soft supersymmetry-breaking terms in N=1 supergravity
models of particle physics. We first consider general formulae for those terms
in general models with a hidden sector breaking supersymmetry at an
intermediate energy scale. The results for some simple models are given. We
then consider the results obtained in some simple superstring models in which
particular assumptions about the origin of supersymmetry breaking are made.
These are models in which the seed of supersymmetry breaking is assumed to be
originated in the dilaton/moduli sector of the theory.
","[{""version"":""v1"",""created"":""Tue, 1 Jul 1997 14:16:35 GMT""},{""version"":""v2"",""created"":""Mon, 14 Jul 1997 17:22:55 GMT""},{""version"":""v3"",""created"":""Thu, 25 Sep 1997 09:47:08 GMT""}]","2016-11-03"
"hep-ph/9707211","Charles A. Nelson","Charles A. Nelson, Brian T. Kress, Marco Lopes, and Thomas P. McCauley","General Tests for t ---> W+ b couplings at Hadron Colliders","Minor clarifications. Expressions for r_{+-}, rho_{+-}, and \xi for (
  L + S-P) coupling corrected. 36 pages LaTex + Tables + 14 Figs","Phys.Rev. D56 (1997) 5928-5944","10.1103/PhysRevD.56.5928","SUNY BING 5/28/97","hep-ph",,"  The modularity property of the helicity formalism is used to provide
amplitude expressions and stage-two spin-correlation functions which can easily
be used in direct experimental searches for electro-weak symmetries and
dynamics in the decay processes $t \to W^+ b$, $\bar t \to W^- \bar b$. The
formalism is used to describe the decay sequences $t\to W^{+}b\to (l^{+}\nu)b$,
and $t\to W^{+}b\to (j_{\bar d}j_u)b$. Helicity amplitudes for $t \to W^+ b $
are obtained for the most general $J_{\bar b t}$ current. Thereby, the most
general Lorentz-invariant decay-density-matrix for $t\to W^{+}b\to
(l^{+}\nu)b$, or for $t\to W^{+}b\to (j_{\bar d}j_u)b$, is expressed in terms
of eight helicity parameters and, equivalently, in terms of the structures of
the $J_{\bar b t}$ current. The parameters are physically defined in terms of
partial-width-intensities for polarized-final-states in \newline $t\to W^{+}b$
decay. The full angular distribution for the reactions $q \bar q$ and $g g \to
t \bar t \to (W^+ b) (W^- \bar b) \to ...$ can be used to measure these
parameters. Since this adds on spin-correlation information from the next stage
of decays in the decay sequence, such an energy-angular distribution is called
a stage-two spin-correlation (S2SC) function.
","[{""version"":""v1"",""created"":""Tue, 1 Jul 1997 15:30:16 GMT""},{""version"":""v2"",""created"":""Wed, 2 Jul 1997 18:06:49 GMT""},{""version"":""v3"",""created"":""Sat, 2 Aug 1997 15:50:18 GMT""}]","2009-10-30"
"hep-th/9706221","Alessandra Buonanno","A. Buonanno, K.A. Meissner, C. Ungarelli, G. Veneziano","Classical Inhomogeneities in String Cosmology","32 pages, Revtex, 1 figure included, epsfig.sty needed; one reference
  added","Phys.Rev. D57 (1998) 2543-2556","10.1103/PhysRevD.57.2543","CERN-TH/97-124","hep-th gr-qc",,"  We generalize previous work on inhomogeneous pre-big bang cosmology by
including the effect of non-trivial moduli and antisymmetric-tensor/axion
fields. The general quasi-homogeneous asymptotic solution---as one approaches
the big bang singularity from perturbative initial data---is given and its
range of validity is discussed, allowing us to give a general quantitative
estimate of the amount of inflation obtained during the perturbative pre-big
bang era. The question of determining early-time ``attractors'' for generic
pre-big bang cosmologies is also addressed, and a motivated conjecture is
advanced. We also discuss S-duality-related features of the solutions, and
speculate on the way an asymptotic T-duality symmetry may act on moduli space
as one approaches the big bang.
","[{""version"":""v1"",""created"":""Mon, 30 Jun 1997 16:20:28 GMT""},{""version"":""v2"",""created"":""Thu, 24 Jul 1997 16:39:08 GMT""}]","2009-10-30"
"hep-th/9706222","Martin Schaden","Martin Schaden, Alexander Rozenberg (New York University)","Confinement in Covariant Gauges","45 pages, Latex, uses psfig.sty and epsfig.sty to include
  postscript-figures","Phys.Rev.D57:3670-3693,1998","10.1103/PhysRevD.57.3670","NYU-TH/97/06/30","hep-th",,"  We examine the weak coupling limit of Euclidean SU(n) gauge theory in
covariant gauges. Following an earlier suggestion, an equivariant
BRST-construction is used to define the continuum theory on a finite torus. The
equivariant gauge fixing introduces constant ghost fields as moduli of the
model. We study the parameter- and moduli- space perturbatively. For $n_f \leq
n$ quark flavors, the moduli flow to a non-trivial fixed point in certain
critical covariant gauges and the one-loop effective potential indicates that
the global SU(n) color symmetry of the gauge fixed model is spontaneously
broken to $U(1)^{n-1}$. Ward identities and renormalization group arguments
imply that the longitudinal gauge boson propagator at long range is dominated
by $n(n-1)$ Goldstone bosons in these critical covariant gauges. In the large
$n$ limit, we derive a nonlinear integral equation for the expectation value of
large Wilson loops assuming that the exchange of Goldstone bosons dominates the
interaction at long range in critical covariant gauges. We find numerically
that the expectation value of large circular Wilson loops decreases
exponentially with the enclosed area in the absence of dynamical fermions. The
gauge invariance of this mechanism for confinement in critical covariant gauges
is discussed.
","[{""version"":""v1"",""created"":""Mon, 30 Jun 1997 16:20:53 GMT""}]","2008-11-26"
"hep-th/9706223","Joao Nunes","A. Jevicki, M. Mihailescu and J. P. Nunes","Large N WZW Field Theory Of N=2 Strings","This is the final version. By editorial mistake at Phys.Lett.B an
  older version was published in print","Phys.Lett. B416 (1998) 334-340","10.1016/S0370-2693(97)01251-3","BROWN-HET-1051","hep-th",,"  We explore the quantum properties of self-dual gravity formulated as a large
$N$ two-dimensional WZW sigma model. Using a non-trivial classical background,
we show that a $(2,2)$ space-time is generated. The theory contains an infinite
series of higher point vertices. At tree level we show that, in spite of the
presence of higher than cubic vertices, the on-shell 4 and higher point
functions vanish, indicating that this model is related with the field theory
of closed N=2 strings. We examine the one-loop on-shell 3-point amplitude and
show that it is ultra-violet finite.
","[{""version"":""v1"",""created"":""Mon, 30 Jun 1997 20:43:32 GMT""},{""version"":""v2"",""created"":""Wed, 2 Jul 1997 19:35:13 GMT""},{""version"":""v3"",""created"":""Wed, 9 Jul 1997 20:07:47 GMT""},{""version"":""v4"",""created"":""Thu, 13 Nov 1997 19:13:46 GMT""},{""version"":""v5"",""created"":""Tue, 24 Feb 1998 22:33:00 GMT""}]","2009-10-30"
"hep-th/9706224","Miao Li","Miao Li (Univ. of Chicago) and Yong-Shi Wu (Univ. of Utah)","Master Ward Identity for Nonlocal Symmetries in D=2 Principal Chiral
  Models","12 pages, harvmac, minors corrections","Found.Phys. 27 (1997) 1571-1583","10.1007/BF02551501","EFI-97-29, UU-HEP/97-3","hep-th",,"  We derive, in path integral approach, the (anomalous) master Ward identity
associated with an infinite set of nonlocal conservation laws in
two-dimensional principal chiral models
","[{""version"":""v1"",""created"":""Mon, 30 Jun 1997 21:05:24 GMT""},{""version"":""v2"",""created"":""Sun, 6 Jul 1997 14:08:02 GMT""}]","2009-10-30"
"hep-th/9706225","Matthias Blau","Matthias Blau, George Thompson","Euclidean SYM Theories by Time Reduction and Special Holonomy Manifolds","21 pages, LaTeX file","Phys.Lett. B415 (1997) 242-252","10.1016/S0370-2693(97)01163-5",,"hep-th",,"  Euclidean supersymmetric theories are obtained from Minkowskian theories by
performing a reduction in the time direction. This procedure elucidates certain
mysterious features of Zumino's N=2 model in four dimensions, provides
manifestly hermitian Euclidean counterparts of all non-mimimal SYM theories,
and is also applicable to supergravity theories. We reanalyse the twists of the
4d N=2 and N=4 models from this point of view. Other applications include SYM
theories on special holonomy manifolds. In particular, we construct a twisted
SYM theory on Kaehler 3-folds and clarify the structure of SYM theory on
hyper-Kaehler 4-folds.
","[{""version"":""v1"",""created"":""Mon, 30 Jun 1997 21:47:20 GMT""}]","2009-10-30"
"hep-th/9706226","Theory Group Associate","Philip Candelas and Harald Skarke","F-theory, SO(32) and Toric Geometry","11 pages, Latex2e, uses epsf, references added","Phys.Lett. B413 (1997) 63-69","10.1016/S0370-2693(97)01047-2","UTTG-21-97","hep-th",,"  We show that the F-theory dual of the heterotic string with unbroken
Spin(32)/Z_2 symmetry in eight dimensions can be described in terms of the same
polyhedron that can also encode unbroken E_8\times E_8 symmetry. By considering
particular compactifications with this K3 surface as a fiber, we can reproduce
the recently found `record gauge group' in six dimensions and obtain a new
`record gauge group' in four dimensions. Our observations relate to the toric
diagram for the intersection of components of degenerate fibers and our
definition of these objects, which we call `tops', is more general than an
earlier definition by Candelas and Font.
","[{""version"":""v1"",""created"":""Mon, 30 Jun 1997 22:59:07 GMT""},{""version"":""v2"",""created"":""Tue, 8 Jul 1997 01:34:50 GMT""}]","2009-10-30"
"hep-th/9707001",,"Seung-geun Lee and Sang-Jin Sin","p-Branes and Exact solutions in Brans-Dicke cosmology with matter","13 pages, two figures, revtex","J.KoreanPhys.Soc.32:102-108,1998",,,"hep-th",,"  We study the effect of the solitonic degree of freedom in string cosmology
following the line of Rama. The gas of solitonic p-brane is treated as a
perfect fluid in a Brans-Dicke type theory.
  In this paper, we find analytic solutions for a few solvable cases of
equation of states with general Brans-Dicke parameter $\omega$ and study the
cosmology of the solutions. In some cases the solutions are free from initial
singularity.
","[{""version"":""v1"",""created"":""Tue, 1 Jul 1997 06:47:34 GMT""}]","2016-09-06"
"hep-th/9707002","Tamiaki Yoneya","Tamiaki Yoneya","D-Particles, D-Instantons, and A Space-Time Uncertainty Principle in
  String Theory","Talk given at the APCTP-ICTP Joint International Conference '97 (May
  26-30, Seoul, Korea), 17pages, latex in mprocl.sty, no figures",,,"UT-KOMABA/97-10","hep-th",,"  The purpose of this talk is to review some considerations by the present
author on the possible role of a simple space-time uncertainty relation toward
nonperturbative string theory. We first motivate the space-time uncertainty
relation as a simple space-time characterization of the fundamental string
theory. We then argue that the relation captures some of the important aspects
of the short-distance dynamics of D-particles described by the effective super
Yang-Mills matrix quantum mechanics, and also that the recently proposed type
IIB matrix model can be regarded as a possible realization of the space-time
uncertainty principle.
","[{""version"":""v1"",""created"":""Tue, 1 Jul 1997 06:35:11 GMT""}]","2007-05-23"
"hep-th/9707004","A. K. Mishra","R. P. Malik, A. K. Mishra and G. Rajasekaran","Dynamics in a noncommutative phase space","LaTeX-twice, 16 pages","Int.J.Mod.Phys.A13:4759-4776,1998","10.1142/S0217751X98002249",,"hep-th math.QA q-alg",,"  Dynamics has been generalized to a noncommutative phase space. The
noncommuting phase space is taken to be invariant under the quantum group
$GL_{q,p}(2)$. The $q$-deformed differential calculus on the phase space is
formulated and using this, both the Hamiltonian and Lagrangian forms of
dynamics have been constructed. In contrast to earlier forms of $q$-dynamics,
our formalism has the advantage of preserving the conventional symmetries such
as rotational or Lorentz invariance.
","[{""version"":""v1"",""created"":""Tue, 1 Jul 1997 09:09:19 GMT""}]","2014-11-18"
"hep-th/9707005","Haruhiko Terao","Kenichi Konishi, Haruhiko Terao","CP, Charge Fractionalizations and Low Energy Effective Actions in the
  SU(2) Seiberg-Witten Theories with Quarks","38 pages, LaTex file with 3 PostScript figures","Nucl.Phys. B511 (1998) 264-294","10.1016/S0550-3213(97)00739-6","GEF-Th-6/1997, KANAZAWA 97-11","hep-th hep-ph",,"  Several dynamical aspects of the SU(2) Seiberg-Witten models with N_f quark
hypermultiplets are explored. We first clarify the meaning of the number of the
singularities of the space of vacua. CP invariance of the theories are then
studied and periodicities of theories in \theta with and without bare quark
masses are obtained ((4-N_f)\pi and \pi, respectively). CP noninvariance at a
generic point of QMS manifests itself as the electric and quark-number charge
fractionalizations for the dyons; we show that the exact Seiberg-Witten
solution contains such effects correctly, in agreement with the semiclassical
analysis recently made by F.Ferrari. Upon N=1 perturbation the low energy
effective theories at the singularities display confinement, and in most cases
chiral symmetry breaking as a consequence. In one of the vacua for N_f=3
confinement is not accompanied by chiral symmetry breaking: we interpret it as
an example of oblique confinement of 't Hooft. We discuss further the
consistency of the physical picture found here by studying the effects of soft
supersymmetry breaking as well as the behavior of the theory in the N=1 limit.
","[{""version"":""v1"",""created"":""Tue, 1 Jul 1997 09:28:54 GMT""}]","2009-10-30"
"hep-th/9707006",,"Alexander A.Vlasov","Classical Electrodynamics: Problems of Radiation Reaction","18 pages, LATEX","enlarged version of talk given at XX International Workshop on the
  Fundamental Problems of High Energy Physics and Field Theory, 24-26 June
  1997, Protvino, Russia",,,"hep-th",,"  There are known problems of Lorentz-Dirac equation for moving with
acceleration charged particle in classical electrodynamics. The model of
extended in one dimension particle is proposed and shown that electromagnetic
self-interaction can lead (with appropriate choice of retarded and advanced
interactions) to zero change in particle momentum. The hypothesis is
formulated: all relativistic internal forces of various nature can give zero
change in particle momentum
","[{""version"":""v1"",""created"":""Tue, 1 Jul 1997 09:26:22 GMT""}]","2007-05-23"
