"hep-th/9707072","Paolo Valtancoli","L. Lusanna and P. Valtancoli","Dirac's Observables for the SU(3)XSU(2)XU(1) Standard Model","90 pages, RevTeX, no figures","Int.J.Mod.Phys. A13 (1998) 4605-4690","10.1142/S0217751X98002213","DFF 8/7/97","hep-th",,"  The complete, missing, Hamiltonian treatment of the standard SU(3)xSU(2)xU(1)
model with Grassmann-valued fermion fields in the Higgs phase is given. We
bypass the complications of the Hamiltonian theory in the Higgs phase,
resulting from the spontaneous symmetry breaking with the Higgs mechanism, by
studying the Hamiltonian formulation of the Higgs phase for the gauge
equivalent Lagrangian in the unitary gauge. A canonical basis of Dirac's
observables is found and the reduced physical Hamiltonian is evaluated. Its
self-energy part is nonlocal for the electromagnetic and strong interactions,
but local for the weak ones. Therefore, the Fermi 4-fermion interaction
reappears at the nonperturbative level.
","[{""version"":""v1"",""created"":""Tue, 8 Jul 1997 08:27:39 GMT""}]","2009-10-30"
"hep-th/9707073","Matt Visser","Carmen Molina-Paris (Los Alamos) and Matt Visser (Washington
  University)","Casimir effect in dielectrics: Surface area contribution","12 pages; ReV-Tex in double-column format","Phys.Rev. D56 (1997) 6629-6639","10.1103/PhysRevD.56.6629",,"hep-th",,"  In this paper we take a deeper look at the technically elementary but
physically robust viewpoint in which the Casimir energy in dielectric media is
interpreted as the change in the total zero point energy of the electromagnetic
vacuum summed over all states. Extending results presented in previous papers
[hep-th/9609195; hep-th/9702007] we approximate the sum over states by an
integral over the density of states including finite volume corrections. For an
arbitrarily-shaped finite dielectric, the first finite-volume correction to the
density of states is shown to be proportional to the surface area of the
dielectric interface and is explicitly evaluated as a function of the
permeability and permitivity. Since these calculations are founded in an
elementary and straightforward way on the underlying physics of the Casimir
effect they serve as an important consistency check on field-theoretic
calculations. As a concrete example we discuss Schwinger's suggestion that the
Casimir effect might be the underlying physical basis behind sonoluminescence}.
The recent controversy concerning the relative importance of volume and surface
contributions is discussed. For sufficiently large bubbles the volume effect is
always dominant. Furthermore we can explicitly calculate the surface area
contribution as a function of refractive index.
","[{""version"":""v1"",""created"":""Tue, 8 Jul 1997 07:59:19 GMT""}]","2009-10-30"
"hep-th/9707074","Suzuki Junji","G. Juettner, A. Kluemper (Cologne) and J. Suzuki(Tokyo)","From Fusion Hierarchy to Excited State TBA","Plain Tex, 17pages, 2 postscript figures will be sent upon request","Nucl.Phys.B512:581-600,1998","10.1016/S0550-3213(97)00772-4",,"hep-th cond-mat",,"  Functional relations among the fusion hierarchy of quantum transfer matrices
give a novel derivation of the TBA equations, namely without string hypothesis.
This is demonstrated for two important models of 1D highly correlated electron
systems, the supersymmetric $t-J$ model and the supersymmetric extended Hubbard
model. As a consequence, ""the excited state TBA"" equations, which characterize
correlation lengths, are explicitly derived for the $t-J$ model. To the
authors' knowledge, this is the first explicit derivation of excited state TBA
equations for 1D lattice electron systems.
","[{""version"":""v1"",""created"":""Tue, 8 Jul 1997 07:58:24 GMT""}]","2009-09-25"
"hep-th/9707075","Angel Uranga","L.E.Ibanez, A.M.Uranga","D=6, N=1 String Vacua and Duality","52 pages, plain Latex. To appear in the proceedings of the APCTP
  Winter School on Duality, Mt. Sorak (Korea), February 1997",,"10.1142/9789814447287_0006","FTUAM-97/9","hep-th",,"  We review the structure $D=6, N=1$ string vacua with emphasis on the
different connections due to T-dualities and S-dualities. The topics discussed
include: Anomaly cancellation; K3 and orbifold $D=6, N=1$ heterotic
compactifications; T-dualities between $E_8\times E_8$ and $Spin(32)/Z_2$
heterotic vacua; non-perturbative heterotic vacua and small instantons; N=2
Type-II/Heterotic duality in D=4 ; F-theory/heterotic duality in D=6; and
heterotic/heterotic duality in six and four dimensions.
","[{""version"":""v1"",""created"":""Tue, 8 Jul 1997 13:55:01 GMT""}]","2016-11-03"
"hep-th/9707076",,"Wang-Chang Su","A Comment on Duality in SUSY SU(N) Gauge Theory with a Symmetric Tensor","12 pages, LaTex, 1 figure",,,,"hep-th",,"  We suggest an alternative approach to deconfine N =1 SU(N) supersymmetric
gauge theory with a symmetric tensor, fundamentals, anti-fundamentals, and no
superpotential. It is found that although the dual prescription derived by this
new method of deconfinement is different from that by the original method, both
dual prescriptions are connected by duality transformations. By deforming the
theory, it is shown that both dual theories flow properly so that the Seiberg's
duality is preserved.
","[{""version"":""v1"",""created"":""Tue, 8 Jul 1997 13:30:47 GMT""}]","2007-05-23"
"hep-th/9707077","Heinrich Saller","Heinrich Saller (MPI f. Physik)","Realizations of Causal Manifolds by Quantum Fields","36 pages, latex, macros included","Int.J.Theor.Phys. 36 (1997) 2783-2826","10.1007/BF02435710","MPI-PhT/97-42","hep-th",,"  Quantum mechanical operators and quantum fields are interpreted as
realizations of timespace manifolds. Such causal manifolds are parametrized by
the classes of the positive unitary operations in all complex operations, i.e.
by the homogenous spaces $\D(n)=\GL(\C^n_\R)/\U(n)$ with $n=1$ for mechanics
and $n=2$ for relativistic fields. The rank $n$ gives the number of both the
discrete and continuous invariants used in the harmonic analysis, i.e. two
characteristic masses in the relativistic case. 'Canonical' field theories with
the familiar divergencies are inappropriate realizations of the real
4-dimensional causal manifold $\D(2)$. Faithful timespace realizations do not
lead to divergencies. In general they are reducible, but nondecomposable - in
addition to representations with eigenvectors (states, particle) they
incorporate principal vectors without a particle (eigenvector) basis as
exemplified by the Coulomb field.
","[{""version"":""v1"",""created"":""Tue, 8 Jul 1997 13:59:24 GMT""}]","2009-10-30"
"hep-th/9707078","Harutada Sato","H. Tochimura and H-T. Sato","On thermal phase structure of deformed Gross-Neveu model","13 pages plus 6 figures","Mod.Phys.Lett. A11 (1996) 3091-3102","10.1142/S0217732396003076",,"hep-th",,"  We illustrate the phase structure of a deformed two-dimensional Gross-Neveu
model which is defined by undeformed field contents plus deformed Pauli
matrices. This deformation is based on two motives to find a more general
polymer model and to estimate how $q$-deformed field theory affects on its
effective potential. There found some regions where chiral symmetry breaking
and restoration take place repeatedly as temperature increasing.
","[{""version"":""v1"",""created"":""Tue, 8 Jul 1997 14:08:58 GMT""}]","2015-06-26"
"nucl-th/9707014",,"Bao-An Li, Che Ming Ko and Wolfgang Bauer","Isospin Physics in Heavy-Ion Collisions at Intermediate Energies","101 pages with embedded epsf figures, review article for
  ""International Journal of Modern Physics E: Nuclear Physics"". Send request
  for a hard copy to 1/authors","Int.J.Mod.Phys. E7 (1998) 147-230","10.1142/S0218301398000087",,"nucl-th nucl-ex",,"  In nuclear collisions induced by stable or radioactive neutron-rich nuclei a
transient state of nuclear matter with an appreciable isospin asymmetry as well
as thermal and compressional excitation can be created. This offers the
possibility to study the properties of nuclear matter in the region between
symmetric nuclear matter and pure neutron matter. In this review, we discuss
recent theoretical studies of the equation of state of isospin-asymmetric
nuclear matter and its relations to the properties of neutron stars and
radioactive nuclei. Chemical and mechanical instabilities as well as the
liquid-gas phase transition in asymmetric nuclear matter are investigated. The
in-medium nucleon-nucleon cross sections at different isospin states are
reviewed as they affect significantly the dynamics of heavy ion collisions
induced by radioactive beams. We then discuss an isospin-dependent transport
model, which includes different mean-field potentials and cross sections for
the proton and neutron, and its application to these reactions. Furthermore, we
review the comparisons between theoretical predictions and available
experimental data. In particular, we discuss the study of nuclear stopping in
terms of isospin equilibration, the dependence of nuclear collective flow and
balance energy on the isospin-dependent nuclear equation of state and cross
sections, the isospin dependence of total nuclear reaction cross sections, and
the role of isospin in preequilibrium nucleon emissions and subthreshold pion
production.
","[{""version"":""v1"",""created"":""Mon, 7 Jul 1997 18:17:38 GMT""}]","2015-06-26"
"patt-sol/9707002","Ken Nakanishi","H. Hayakawa, and K. Nakanishi","Nonequilibrium phase separation in traffic flows","11 pages, 2 ps figures, RevTeX",,,,"patt-sol nlin.PS",,"  Traffic jam in an optimal velocity model with the backward reference function
is analyzed. An analytic scaling solution is presented near the critical point
of the phase separation. The validity of the solution has been confirmed from
the comparison with the simulation of the model.
","[{""version"":""v1"",""created"":""Tue, 8 Jul 1997 09:28:19 GMT""}]","2008-02-03"
"q-alg/9707008","Chongying Dong","C. Dong, R.L. Griess Jr. and G. Hoehn","Framed vertex operator algebras, codes and the moonshine module","Latex, 54 pages","Comm. Math. Phys. 193 (1998), 407-448","10.1007/s002200050335",,"q-alg hep-th math.QA",,"  For a simple vertex operator algebra whose Virasoro element is a sum of
commutative Virasoro elements of central charge 1/2, two codes are introduced
and studied. It is proved that such vertex operator algebras are rational. For
lattice vertex operator algebras and related ones, decompositions into direct
sums of irreducible modules for the product of the Virasoro algebras of central
charge 1/2 are explicitly described. As an application, the decomposition of
the moonshine vertex operator algebra is obtained for a distinguished system of
48 Virasoro algebras.
","[{""version"":""v1"",""created"":""Mon, 7 Jul 1997 21:26:13 GMT""}]","2009-10-30"
"q-alg/9707009","Gorelik Maria","Maria Gorelik","The prime spectrum of a quantum Bruhat cell translate","AMS-LaTeX v1.2 (Compatibility mode), 35 pages",,,,"q-alg math.QA",,"  The prime spectra of two families of algebras, $S^w$ and $\check{S}^w$, $w\in
W,$ indexed by the Weyl group $W$ of a semisimple finitely dimensional are
studied. The algebras $S^w$ have been introduced by A.~Joseph; they are
$q$-analogues of the algebras of regular functions on $w$-translates of the
open Bruhat cell of a semisimple Lie group $G$ corresponding to the Lie algebra
$\fg$.
  We define a stratification of the spectra into components indexed by pairs
$(y_1,y_2)$ of elements of the Weyl group satisfying $y_1\leq w\leq y_2$. Each
component admits a unique minimal ideal which is explicitly described. We show
the inclusion relation of closures to be that induced by Bruhat order.
","[{""version"":""v1"",""created"":""Tue, 8 Jul 1997 07:33:30 GMT""},{""version"":""v2"",""created"":""Thu, 10 Jul 1997 05:57:32 GMT""}]","2008-02-03"
"quant-ph/9707017","Vladimir Privman","V. Privman, I. D. Vagner and G. Kventsel","Quantum Computation in Quantum-Hall Systems","12 pages in LaTeX + 1 PostScript figure","Phys.Lett.A239:141-146,1998","10.1016/S0375-9601(97)00974-2",,"quant-ph cond-mat",,"  We describe a quantum information processor (quantum computer) based on the
hyperfine interactions between the conduction electrons and nuclear spins
embedded in a two-dimensional electron system in the quantum-Hall regime.
Nuclear spins can be controlled individually by electromagnetic pulses. Their
interactions, which are of the spin-exchange type, can be possibly switched on
and off pair-wise dynamically, for nearest neighbors, by controlling
impurities. We also propose the way to feed in the initial data and explore
ideas for reading off the final results.
","[{""version"":""v1"",""created"":""Tue, 8 Jul 1997 13:59:23 GMT""},{""version"":""v2"",""created"":""Wed, 7 Jan 1998 14:36:49 GMT""}]","2014-11-18"
"quant-ph/9707018",,"Stefano Mancini, Paolo Tombesi (Dipartimento di Matematica e Fisica,
  Universita' di Camerino, Italy) and Vladimir I. Man'ko (Lebedev Physical
  Institute, Moscow, Russia)","Beyond the Standard ""Marginalizations"" of Wigner Function","12 pages, LaTex, no figures, to appear in Quantum and Semiclass. Opt","Quant.Semiclass.Opt. 9 (1997) 987","10.1088/1355-5111/9/6/011",,"quant-ph",,"  We discuss the problem of finding ""marginal"" distributions within different
tomographic approaches to quantum state measurement, and we establish
analytical connections among them.
","[{""version"":""v1"",""created"":""Tue, 8 Jul 1997 15:34:14 GMT""}]","2009-10-30"
"solv-int/9707005","Alexander Turbiner","Marcos Rosenbaum, Alexander Turbiner and Antonio Capella","Solvability of the G_2 Integrable System","18 pages, LaTeX, some minor typos corrected","Int.J.Mod.Phys. A13 (1998) 3885-3904","10.1142/S0217751X98001815","Mexico ICN-UNAM 97-05","solv-int cond-mat hep-th nlin.SI",,"  It is shown that the 3-body trigonometric G_2 integrable system is
exactly-solvable. If the configuration space is parametrized by certain
symmetric functions of the coordinates then, for arbitrary values of the
coupling constants, the Hamiltonian can be expressed as a quadratic polynomial
in the generators of some Lie algebra of differential operators in a
finite-dimensional representation. Four infinite families of eigenstates,
represented by polynomials, and the corresponding eigenvalues are described
explicitly.
","[{""version"":""v1"",""created"":""Mon, 7 Jul 1997 18:37:19 GMT""},{""version"":""v2"",""created"":""Thu, 11 Sep 1997 15:49:21 GMT""},{""version"":""v3"",""created"":""Mon, 20 Oct 1997 17:18:18 GMT""},{""version"":""v4"",""created"":""Tue, 8 Sep 1998 17:02:14 GMT""}]","2009-10-30"
