"alg-geom/9707004","Robert Friedman","Robert Friedman, John W. Morgan, Edward Witten","Principal G-bundles over elliptic curves","AMS-TeX, 20 pages, amsppt style; minor errors corrected","Math.Res.Lett.5:97-118,1998",,,"alg-geom hep-th math.AG",,"  Let $G$ be a simple and simply connected complex Lie group. We discuss the
moduli space of holomorphic semistable principal $G$ bundles over an elliptic
curve $E$. In particular we give a new proof of a theorem of Looijenga and
Bernshtein-Shvartsman, that the moduli space is a weighted projective space.
The method of proof is to study the deformations of certain unstable bundles
coming from special maximal parabolic subgroups of $G$. We also discuss the
associated automorphism sheaves and universal bundles, as well as the relation
between various universal bundles and spectral covers.
","[{""version"":""v1"",""created"":""Mon, 7 Jul 1997 17:43:09 GMT""},{""version"":""v2"",""created"":""Mon, 23 Feb 1998 15:31:46 GMT""}]","2010-04-07"
"astro-ph/9707081","J. Robert Buchler","J. R. Buchler, P. A. Yecko, Z. Kollath (University of Florida)","The Nature of Strange Modes in Classical Variable Stars","14 pages, including figures. Home Page
  http://www.phys.ufl.edu/~buchler Revised with minor corrections","A&A 326, 669 (1997)",,,"astro-ph chao-dyn nlin.CD",,"  Strange modes have been found in the radial spectrum of many luminous stars,
most recently in Cepheids and RR Lyrae. We show that there is nothing strange
about these modes -- they must exist even in the adiabatic limit.
  With a change of variables and without approximation the adiabatic linear
pulsation equation is reduced to a Schroedinger equation in which the radial
coordinate is the local sound-traversal time. In this formulation, the narrow
hydrogen partial ionization region is seen to act as a potential barrier,
separating the star into two regions. Resonances between the two regions result
in the strange modes, for which the ratio of interior to exterior amplitude is
at a minimum. The relative location of the barrier changes with the stellar
parameters, and this gives rise to avoided level-crossings along a sequence of
models. 2 The appearance of strange modes and the associated level crossings
are exhibited with an analytic toy-model with the potential barrier
approximated by a delta function. This toy-model is readily extensible to
nonadiabatic modes.
  Hydrodynamical calculations find that pure strange mode limit-cycles have
extremely small photospheric velocities and luminosity variations in the
milli-magnitude range. They are therefore expected to be difficult to observe.
","[{""version"":""v1"",""created"":""Mon, 7 Jul 1997 17:05:27 GMT""},{""version"":""v2"",""created"":""Wed, 24 Sep 1997 19:51:32 GMT""}]","2008-02-03"
"astro-ph/9707082","Chris Reynolds","C.S.Reynolds (JILA, Boulder) and A.C.Fabian (IoA, Cambridge)","Special relativistic effects on the strength of the fluorescent K-alpha
  iron line from black hole accretion disks","5 pages, 3 postscript figures. Accepted for publication in MNRAS
  (pink pages). Also available at
  http://rocinante.Colorado.EDU/~chris/html_papers/special/special.html",,"10.1093/mnras/290.1.L1",,"astro-ph",,"  The broad iron K$\alpha$ emission line, commonly seen in the X-ray spectrum
of Seyfert nuclei, is thought to originate when the inner accretion disk is
illuminated by an active disk-corona. We show that relative motion between the
disk and the X-ray emitting material can have an important influence on the
observed equivalent width (EW) of this line via special relativistic aberration
and Doppler effects. We suggest this may be relevant to understanding why the
observed EW often exceeds the prediction of the standard X-ray reflection
model. Several observational tests are suggested that could disentangle these
special relativistic effects from iron abundance effects.
","[{""version"":""v1"",""created"":""Mon, 7 Jul 1997 16:02:43 GMT""}]","2016-01-13"
"astro-ph/9707083","Fred Walter : Astronomy","F.M. Walter, F.J. Vrba, S.J. Wolk, R.D. Mathieu, & R. Neuhauser","X-Ray Sources in Regions of Star Formation. VI. The R CrA Association as
  Viewed by EINSTEIN","LATEX text (aaspp4 style) and 7 postscript figures. Accepted for
  publication in the Astronomical Journal, October 1997. Also available by
  anonymous ftp to sbast3.ess.sunysb.edu (cd pub/fred; get cra.tar.gz) or on
  the WWW at http://sbast3.ess.sunysb.edu/~fwalter/plan.html",,"10.1086/118584",,"astro-ph",,"  We report on optical identifications of X-ray sources in the vicinity of the
R~CrA association. We identify 11 low-mass pre-main-sequence stars as
counterparts of 9 X-ray sources. We also find X-ray emission from coordinates
consistent with the position of 3 bright late-B stars, although the emission
may come from lower mass companions. The X-ray-selected stars lie along a
narrow locus in the luminosity-temperature diagram at an age of about 7~Myr,
which is considerably older than the estimated ages of the higher mass stars or
of the IR-excess stars. We determine the physical characteristics of these
stars, including masses, ages, and Lithium abundances. We estimate that the
complete membership of the R~CrA association amounts to about 90 stars, mostly
older naked T~Tauri stars, and that the population is consistent with the
standard IMF.
","[{""version"":""v1"",""created"":""Mon, 7 Jul 1997 16:24:49 GMT""}]","2009-10-30"
"astro-ph/9707084","Melinda Weil","Melinda L. Weil (University of Oxford), Jonathan Bland-Hawthorn and
  David F. Malin (Anglo-Australian Observatory)","Diffuse Stellar Light at 100 kpc Scales in M87","24 pages, Latex (aaspp4.sty), with 15 figures. Accepted for
  publication in ApJ",,"10.1086/304886",,"astro-ph",,"  In a new survey of nearby galaxies from stacked photographic images, M87
shows a diffuse fan of stellar material which extends along the projected SE
(major) axis out to about 100 kpc at a limiting (B) surface brightness of $28
\hbox{mag arcsec}^{-2}$. We suggest that disruption of a small spheroidal
galaxy within a larger potential is the most likely explanation for the diffuse
structure. Our simulations include a rigid primary potential with
characteristics similar to those derived for M87 and a populated intruder. The
orbit is required to pass close to the center of the potential to produce a fan
which nearly aligns with the major axis and has a large opening angle, as seen
in M87. The structure of the dark matter at large galactic radii is
investigated by representing M87 with different potentials. The morphology and
luminosity of the fan and the kinematics of debris in the center of the primary
potential are analyzed and compared with substructure in M87. The short
lifetimes (t_fan < 5 10^8 years) of the simulated diffuse fans indicate that
several accretion events could be hidden in galaxies.
","[{""version"":""v1"",""created"":""Mon, 7 Jul 1997 17:33:24 GMT""}]","2009-10-30"
"astro-ph/9707085","Ebakker","E.J. Bakker","Circumstellar Molecular Spectra towards Evolved Stars","7 pages, 1 figure, 1 table. CCP7/UMIST workshop on ""Dust and
  Molecules in Evolved Stars""","Astrophys.Space Sci. 251 (1997) 73-80","10.1023/A:1000707916589",,"astro-ph",,"  In this paper we discuss the relevance of, and possible scientific gains
which can be acquired from studying circumstellar molecular spectra toward
evolved stars. Where can we expect circumstellar molecular spectra, why would
we want to study these spectra, which molecules might be present, and what can
we learn from these studies? We present an overview of reported detections, and
discuss some of the results.
","[{""version"":""v1"",""created"":""Mon, 7 Jul 1997 18:39:53 GMT""}]","2009-10-30"
"astro-ph/9707086","Lih-Sin The","L.-S. The, M.D. Leising, D.H. Hartmann (Clemson Univ.), J.D. Kurfess
  (NRL), P. Blanco (UCSD), D. Bhattacharya (UC Riverside)","Hard X-ray Emission from Cassiopeia A SNR","5 pages, 2 postscript figures, 1 postscript table, latex uses
  epsfig.sty, aipproc.sty, to appear in the proc. of the 4th COMPTON symposium,
  held in Williamsburg, VA, April 27-30, 1997. Minor correction for SN1006's
  power-law index in Table 2",,"10.1063/1.53930",,"astro-ph",,"  We report the results of extracting the hard X-ray continuum spectrum of Cas
A SNR from RXTE/PCA Target of Opportunity (TOO) observations and CGRO/OSSE
observations. The data can rule out the single thermal bremsstrahlung model for
Cas A continuum between 2 and 150 keV. The single power law model gives a
mediocre fit (~5%) to the data with a power-law index, $\Gamma$ =
2.94$\pm$0.02. A model with two component (bremsstrahlung + bremsstrahlung or
bremsstrahlung + power law) gives a good fit. The power law index is quite
constrained suggesting that this continuum might not be the X-ray thermal
bremmstrahlung from accelerated MeV electrons at shock fronts (Asvarov et al.
1989) which would have $\Gamma\simeq$2.26. With several SNRs detected by ASCA
showing a hard power-law nonthermal X-ray continuum, we expect a similar
situation for Cas A SNR which has $\Gamma$=2.98$\pm$0.09. We discuss the
implication of the hardest nonthermal X-rays detected from Cas A to the
synchrotron radiation model.
","[{""version"":""v1"",""created"":""Mon, 7 Jul 1997 18:52:44 GMT""},{""version"":""v2"",""created"":""Mon, 21 Jul 1997 19:41:42 GMT""}]","2009-10-30"
"astro-ph/9707087","Andrew Cohen","A.G. Cohen, A. De Rujula, S.L. Glashow","A Matter-Antimatter Universe?","28 pages, 5 figures, uses graphicx package; updated for Ap. J.
  version. Includes additional discussion of turbulence","Astrophys.J.495:539-549,1998","10.1086/305328","BUHEP-97-19","astro-ph hep-ph",,"  We ask whether the universe can be a patchwork consisting of distinct regions
of matter and antimatter. We demonstrate that, after recombination, it is
impossible to avoid annihilation near regional boundaries. We study the
dynamics of this process to estimate two of its signatures: a contribution to
the cosmic diffuse gamma-ray background and a distortion of the cosmic
microwave background. The former signal exceeds observational limits unless the
matter domain we inhabit is virtually the entire visible universe. On general
grounds, we conclude that a matter-antimatter symmetric universe is empirically
excluded.
","[{""version"":""v1"",""created"":""Mon, 7 Jul 1997 20:28:30 GMT""},{""version"":""v2"",""created"":""Sat, 15 Nov 1997 16:33:23 GMT""}]","2011-09-30"
"astro-ph/9707088","Jos de Bruijne","R. Hoogerwerf (1), J.H.J. de Bruijne (1), A.G.A. Brown (1), J. Lub
  (1), A. Blaauw (1,2), P.T. de Zeeuw (1) ((1) Sterrewacht Leiden, Leiden, (2)
  Kapteyn Astronomical Inst., Groningen)","New Results for Three Nearby OB Associations","4 pages, 7 Postscript figures, LaTeX using venice97.sty,
  twocolumn.sty; to appear in Proceedings of the Hipparcos Venice '97
  Symposium, ESA-SP 402",,,,"astro-ph",,"  We have developed a new procedure to identify moving groups, and have applied
it to carry out a census of the nearby OB associations based on Hipparcos
parallaxes and proper motions (see de Bruijne et al. and de Zeeuw et al.
elsewhere in this volume). Here we present three illustrative cases. For
$\alpha$ Persei our method allows us to refine the bright end of the membership
list, while for Collinder 121 the Hipparcos data change the whole appearance of
the association. Finally, we report the discovery of a new association in the
field of Cepheus OB2.
","[{""version"":""v1"",""created"":""Tue, 8 Jul 1997 07:07:44 GMT""}]","2007-05-23"
"astro-ph/9707089","Jos de Bruijne","P.T. de Zeeuw (1), A.G.A. Brown (1), J.H.J. de Bruijne (1), R.
  Hoogerwerf (1), J. Lub (1), R.S. Le Poole (1), A. Blaauw (1,2) ((1)
  Sterrewacht Leiden, Leiden, (2) Kapteyn Astronomical Inst., Groningen)","Structure and Evolution of Nearby OB Associations","6 pages, 4 Postscript figures, LaTeX using venice97.sty,
  twocolumn.sty; to appear in Proceedings of the Hipparcos Venice '97
  Symposium, ESA-SP 402",,,,"astro-ph",,"  We present the first results of a comprehensive census of the stellar content
of the nearby OB associations based on Hipparcos positions, proper motions and
parallaxes for 12842 candidate member stars distributed over 21 fields on the
sky. We use a new method to identify moving groups in these fields (see de
Bruijne et al., these proceedings). Previously, astrometric membership in
nearly all the nearby OB associations was known only for stars with spectral
types earlier than B5. The Hipparcos measurements now allow us to identify
members down to late F. This census provides a firm basis for studies of
galactic and extragalactic star forming regions.
","[{""version"":""v1"",""created"":""Tue, 8 Jul 1997 07:07:43 GMT""}]","2007-05-23"
"astro-ph/9707090","Jos de Bruijne","J.H.J. de Bruijne (1), R. Hoogerwerf (1), A.G.A. Brown (1), L.A.
  Aguilar (2), P.T. de Zeeuw (1) ((1) Sterrewacht Leiden, Leiden, (2) Inst. de
  Astronomia, UNAM, Mexico)","Improved Methods for Identifying Moving Groups","4 pages, 3 Postscript figures, LaTeX using venice97.sty,
  twocolumn.sty; to appear in Proceedings of the Hipparcos Venice '97
  Symposium, ESA-SP 402",,,,"astro-ph",,"  We present a new procedure for the identification of moving groups. It is a
combination of two independent member selection methods. One is a modern
implementation of a classical convergent point method for proper motion data.
The other objectively identifies moving groups in velocity space using proper
motions and parallaxes. We briefly describe both methods, and illustrate their
power by applying them to Hipparcos measurements of a field containing the
Upper Scorpius subgroup of the Scorpio-Centaurus association (Sco OB2). We show
how our membership selection procedure not only improves the list of previously
known B and A-type members, but also identifies many new members, including a
significant number of F stars. We apply our procedure to other nearby OB
associations elsewhere in these proceedings (Hoogerwerf et al.; de Zeeuw et
al.).
","[{""version"":""v1"",""created"":""Tue, 8 Jul 1997 07:07:47 GMT""}]","2007-05-23"
"astro-ph/9707091","Wendy L. Freedman","Barry F. Madore and Wendy L. Freedman","Hipparcos Parallaxes and the Cepheid Distance Scale","15 pages, 4 figures, Ap. J. Letters, in press","Astrophys.J.492:110-115,1998","10.1086/305041",,"astro-ph",,"  Hipparcos parallaxes have recently become available for a sample of Galactic
Cepheids, and we have used these new distances to calibrate the Cepheid
period-luminosity (PL) relation at six wavelengths (BVIJHK). Comparing these
calibrations with previously published multiwavelength PL relations we find
agreement to within 0.07 +/- 0.14 mag, or 4 +/- 7% in distance. Unfortunately,
the current parallax errors for the fundamental pulsators (ranging in
signal-to-noise = pi /sigma_pi from 0.3 to 5.3, at best) preclude an
unambiguous interpretation of the observed differences, which may arise from a
combination of true distance modulus, reddening and/or metallicity effects. We
explore these effects and discuss their implications for the distance to the
Large Magellanic Cloud (LMC) and the Cepheid-based extragalactic distance
scale. These results suggest a range of LMC moduli between 18.44 +/-0.35 and
18.57 +/-0.11 mag; however, other effects on the Cepheid PL relation (e.g.,
extinction, metallicity, statistical errors) are still as significant as any
such reassessment of its zero point.
","[{""version"":""v1"",""created"":""Tue, 8 Jul 1997 09:45:32 GMT""}]","2014-10-13"
"astro-ph/9707092","Takehisa Fujita","Kimiyo Fukasaku and Takehisa Fujita","Reexamination of standard solar model to the solar neutrino problems","13 pages, 2 figures, Latex","Prog.Theor.Phys. 98 (1997) 1251-1259","10.1143/PTP.98.1251",,"astro-ph",,"  We examine the calculation of the solar neutrino flux based on the standard
solar model (SSM). It is found that the solar neutrino data (KAMIOKANDE
experiment) can be well described by the SSM with careful employment of nuclear
data of $^7Be (p,\gamma) ^{8} B$. The main point is that the simple-minded
product ansatz of Coulomb plus nuclear parts should have a few percent
uncertainties which induce the large reduction of the neutrino flux from $^8
B$. Also, if the electron capture of $^7 Be$ inside the sun is suppressed, then
the GALLEX experiment can be understood by the SSM calculation.
","[{""version"":""v1"",""created"":""Tue, 8 Jul 1997 09:51:02 GMT""}]","2009-10-30"
"astro-ph/9707093","Houjun Mo","H.J. Mo, Shude Mao, Simon D.M. White (MPA, Garching)","The Formation of Galactic Disks","47 pages, Latex, aaspp4.sty, 14 figs included, submitted to MNRAS","Mon.Not.Roy.Astron.Soc.295:319,1998","10.1046/j.1365-8711.1998.01227.x",,"astro-ph",,"  We study the population of galactic disks expected in current hierarchical
clustering models for structure formation. A rotationally supported disk with
exponential surface density profile is assumed to form with a mass and angular
momentum which are fixed fractions of those of its surrounding dark halo. We
assume that haloes respond adiabatically to disk formation, and that only
stable disks can correspond to real systems. With these assumptions the
predicted population can match both present-day disks and the damped Lyman
alpha absorbers in QSO spectra. Good agreement is found provided: (i) the
masses of disks are a few percent of those of their haloes; (ii) the specific
angular momenta of disks are similar to those of their haloes; (iii)
present-day disks were assembled recently (at z<1). In particular, the observed
scatter in the size-rotation velocity plane is reproduced, as is the slope and
scatter of the Tully-Fisher relation. The zero-point of the TF relation is
matched for a stellar mass-to-light ratio of 1 to 2 h in the I-band, consistent
with observational values derived from disk dynamics. High redshift disks are
predicted to be small and dense, and could plausibly merge together to form the
observed population of elliptical galaxies. In many (but not all) currently
popular cosmogonies, disks with rotation velocities exceeding 200 km/s can
account for a third or more of the observed damped Lyman alpha systems at
z=2.5. Half of the lines-of-sight to such systems are predicted to intersect
the absorber at r>3kpc/h and about 10% at r>10kpc/h. The cross-section for
absorption is strongly weighted towards disks with large angular momentum and
so large size for their mass. The galaxy population associated with damped
absorbers should thus be biased towards low surface brightness systems.
","[{""version"":""v1"",""created"":""Tue, 8 Jul 1997 09:54:51 GMT""}]","2009-10-30"
"astro-ph/9707094","Osmi Vilhu","O.Vilhu, J.Nevalainen, J.Poutanen, M.Gilfanov, Ph.Durouchoux,
  M.Vargas, R.Narayan, A.Esin","Two-phase spectral modelling of 1E1740.7-2942","5 pages. The zipped PS-file of the paper williams.vilhu.ps.gz can be
  obtained also by anonymous ftp from astar.astro.helsinki.fi/pub/vilhu Fourth
  Compton Symposium, Williamsburg April 1997, AIP in press",,"10.1063/1.54158",,"astro-ph",,"  Combined ASCA and SIGMA data of 1E1740.7-2942 during the standard state
(September 1993 and 1994) were fitted with two-phase models (ISMBB/Poutanen at
al. and ADAF/Narayan et al.). In ISMBB's, the radius of the spherical hot (Te =
150 - 200 KeV) corona lies between 200 - 250 km where it joins the classical
inner disc. The disc radiates 40 per cent of the total luminosity with 1.7 per
cent of the Eddington accretion rate of 10 solar mass black hole. ADAF's need
an extra component to reproduce the soft part of the spectrum. However, the
origin of the soft excess remains somewhat uncertain, although special care was
taken in the background elimination.
","[{""version"":""v1"",""created"":""Tue, 8 Jul 1997 12:05:33 GMT""}]","2009-10-30"
"astro-ph/9707095","Francis Bernardeau","E. Gaztanaga (IEEC/CSIC) and F. Bernardeau (SPhT Saclay)","The skewness and kurtosis of the projected density distribution
  function: validity of perturbation theory","9 pages, LaTeX; Submitted to Astronomy and Astrophysics","Astron.Astrophys.331:829-837,1998",,,"astro-ph",,"  We study the domain of validity of Perturbation Theory (PT), by comparing its
predictions for the reduced skewness, s_3, and kurtosis, s_4, of the projected
cosmological density field, with the results of N-body simulations. We
investigate models with different linear power spectra and consider as physical
applications both angular galaxy catalogues and weak lensing surveys. We first
find that the small-angle approximation for the predicted skewness provides a
good match to the exact numerical PT results. On the other hand, results from
non-linear simulated catalogues agree well with PT results on quasi-linear
angular scales, which correspond to scales larger than about 1 degree in the
applications we have considered. We also point out that, on smaller scale, the
projection effects tend to attenuate the effects of the strong nonlinearities
in the angular skewness and kurtosis.
","[{""version"":""v1"",""created"":""Tue, 8 Jul 1997 12:17:53 GMT""}]","2011-05-23"
"astro-ph/9707096","Wei Cui","Wei Cui (1), W. A. Heindl (2), J. H. Swank (3), D. M. Smith (4), E. H.
  Morgan (1), R~.Remillard (1), and F. E. Marshall (3) ((1) MIT, (2) UCSD, (3)
  GSFC, (4) UC-Berkeley)","Rxte Observations of a New X-Ray Transient: GRS 1737-31","12 pages, including 4 figures. To appear in ApJ Letters",,"10.1086/310866",,"astro-ph",,"  We present the results from RXTE observations of a new X-ray transient, GRS
1737-31, near the Galactic center during an outburst. Over a span of two weeks,
the source was seen to vary significantly on time scales down to a few seconds.
The rapid flares in the light curves bear resemblance to those observed for
Cygnus X-1, a well-known black hole candidate (BHC). The power-density spectrum
is also very typical of BHCs in the HARD (or LOW) state: it is flat below a
characteristic break frequency of ~0.03 Hz, and becomes roughly a 1/f power law
above. The observed X-ray spectrum can be characterized by a simple power law
with a photon index of ~1.7 over a broad energy range 2-200 keV, which is
remarkably similar to that of Cyg X-1 in the HARD state. The similarities to
Cyg X-1 make GRS 1737-31 a likely BHC. However, unlike most transient BHCs, GRS
1737-31 does not seem to reach a ``soft state'' even during an outburst. We
discuss this phenomenon in light of the comparison to a class of hard X--ray
BHCs including transients GRO J0422+32, V404Cyg and GRO J1719-24, and
persistent sources 1E1740.7-2942 and GRS 1758-258.
","[{""version"":""v1"",""created"":""Tue, 8 Jul 1997 14:27:15 GMT""}]","2009-10-30"
"astro-ph/9707097","Francesco Villante","G. Fiorentini (1,2), M. Moretti (1,2) and F. L. Villante (1,2) ((1)
  University of Ferrara - Italy, (2) INFN - Sezione di Ferrara -Italy)","Superkamiokande and solar antineutrinos","7 pages, 1 figure, Latex","Phys.Lett. B413 (1997) 378-381","10.1016/S0370-2693(97)01123-4",,"astro-ph hep-ph",,"  We propose to exploit the angular distribution of the positrons emitted in
the inverse beta decay to extract a possible antineutrino signal from the
Superkamiokande background. From the statistics collected in just 101.9 days
one obtains a model independent upper bound on the antineutrino flux (for
energy greater than 8.3 MeV) Phi < 9*10^4 cm^-2 s^-1 at the 95% C.L. By
assuming the same energy spectrum as for the 8B neutrinos, the 95% C.L. bound
is Phi < 6*10^4 cm^-2 s^-1. Within three years of data taking, the sensitivity
to neutrino-antineutrino transition probability will reach the 1% level, thus
providing a stringent test of hybrid oscillation models.
","[{""version"":""v1"",""created"":""Tue, 8 Jul 1997 14:41:41 GMT""}]","2009-10-30"
"cond-mat/9707070","James R. Chapman","J.R.Chapman (1), N.F.Johnson (1), V.N.Nicopoulos (1) ((1) Clarendon
  Laboratory, Oxford University, UK)","Photoluminescence signatures of negatively charged magnetoexcitons","29 pages LaTeX, 18 ps figures. Minor alterations. To appear in
  Physical Review B",,"10.1103/PhysRevB.57.1762",,"cond-mat",,"  The negatively charged quasi-two-dimensional exciton ($X^-$) is studied
numerically in the presence of a uniform B-field and various in-plane
confinements. The corresponding photoluminescence (PL) spectra, including
shakeup processes, are calculated. These calculations provide a quantitative
explanation of recent experimental PL spectra. The photoluminescence signatures
of charged excitons in quantum dots are also examined. Electron-hole pair
distriution functions are calculated which show the structure of the charged
exciton states (both ground and excited states). Increasing excitation reflects
a competition between two effects: partial ionization of either one or two
electrons.
","[{""version"":""v1"",""created"":""Mon, 7 Jul 1997 17:15:41 GMT""},{""version"":""v2"",""created"":""Wed, 1 Oct 1997 16:06:28 GMT""}]","2009-10-30"
"cond-mat/9707071","Mike Black","M.J. Black, B.W. Alphenaar and H. Ahmed","Evidence for Supercurrent Quantization in Interfacial Josephson
  Junctions","Submitted to PRL 8 pages, 4 figures. Text file is paper.tex and Figs.
  1 - 4 are GIF files",,"10.1103/PhysRevLett.80.596",,"cond-mat.supr-con cond-mat.mes-hall",,"  We observe a series of discontinuities in the above gap current/voltage
characteristics of highly transmissive Nb/Si superconductor/semiconductor
interfaces. The bias at which each switch occurs decreases in quantized steps
as a function of temperature and magnetic field. The observed step-size is the
same for both dependencies. We propose that the steps correspond to
supercurrent quantization through granular Josephson junctions formed near the
interface.
","[{""version"":""v1"",""created"":""Mon, 7 Jul 1997 19:15:19 GMT""},{""version"":""v2"",""created"":""Tue, 29 Jul 1997 14:26:08 GMT""}]","2009-10-30"
