"hep-th/9707121","Sergei Nechaev","Michael Monastyrsky, Sergei Nechaev","Correlation functions for some conformal theories on Riemann surfaces","11 pages, LaTeX, 1 Postscript figure","Mod.Phys.Lett. A12 (1997) 589-596","10.1142/S0217732397000613",,"hep-th",,"  We discuss the geometrical connection between 2D conformal field theories,
random walks on hyperbolic Riemann surfaces and knot theory. For the wide class
of CFTs with monodromies being the discrete subgroups of SL(2,R), the
determination of four-point correlation functions are related to construction
of topological invariants for random walks on multipunctured Riemann surfaces
","[{""version"":""v1"",""created"":""Sat, 12 Jul 1997 00:10:06 GMT""}]","2015-06-26"
"math/9707219",,"Cristian Lenart","The combinatorics of Steenrod operations on the cohomology of
  Grassmannians",,,,"MSRI 1997-079","math.AT",,"  The study of the action of the Steenrod algebra on the mod $p$ cohomology of
spaces has many applications to the topological structure of those spaces. In
this paper we present combinatorial formulas for the action of Steenrod
operations on the cohomology of Grassmannians, both in the Borel and the
Schubert picture. We consider integral lifts of Steenrod operations, which lie
in a certain Hopf algebra of differential operators. The latter has been
considered recently as a realization of the Landweber-Novikov algebra in
complex cobordism theory; it also has connections with the action of the
Virasoro algebra on the boson Fock space. Our formulas for Steenrod operations
are based on combinatorial methods which have not been used before in this
area, namely Hammond operators and the combinatorics of Schur functions. We
also discuss several applications of our formulas to the geometry of
Grassmannians.
","[{""version"":""v1"",""created"":""Sat, 12 Jul 1997 00:00:00 GMT""}]","2009-09-25"
"nucl-th/9707015","Gerald A. Miller","Gerald A. Miller (U. of Washington) and Anthony W. Thomas (U. of
  Adelaide)","Electromagnetic Gauge Invariance of the Cloudy Bag Model","8 pages, RevTex, 1 figure, to be published in Phys. Rev. C","Phys.Rev.C56:2329-2331,1997","10.1103/PhysRevC.56.2329","DOE/ER/40427-08-N96, DOE/ER/40561-263-INT96-19-04, ADP-96-18/T221","nucl-th",,"  We examine the question of the gauge invariance of electromagnetic form
factors calculated within the cloudy bag model. One of the assumptions of the
model is that electromagnetic form factors are most accurately evaluated in the
Breit frame. This feature is used to show that gauge invariance is respected in
this frame.
","[{""version"":""v1"",""created"":""Fri, 11 Jul 1997 18:32:22 GMT""}]","2008-11-26"
"nucl-th/9707016","Jim Friar","J.L. Friar, J. Martorell, and D.W.L. Sprung","Nuclear Sizes and the Isotope Shift","17 pages, latex, 1 figure -- Submitted to Phys. Rev. A -- epsfig.sty
  required","Phys.Rev.A56:4579-4586,1997","10.1103/PhysRevA.56.4579","LA-UR-97-2330","nucl-th physics.atom-ph",,"  Darwin-Foldy nuclear-size corrections in electronic atoms and nuclear radii
are discussed from the nuclear-physics perspective. Interpretation of precise
isotope-shift measurements is formalism dependent, and care must be exercised
in interpreting these results and those obtained from relativistic electron
scattering from nuclei. We strongly advocate that the entire nuclear-charge
operator be used in calculating nuclear-size corrections in atoms, rather than
relegating portions of it to the non-radiative recoil corrections. A
preliminary examination of the intrinsic deuteron radius obtained from
isotope-shift measurements suggests the presence of small meson-exchange
currents (exotic binding contributions of relativistic order) in the nuclear
charge operator, which contribute approximately 1/2%.
","[{""version"":""v1"",""created"":""Fri, 11 Jul 1997 22:34:01 GMT""}]","2008-11-26"
