"cond-mat/9707133","T. Lubensky","T.C. Lubensky, David Pettey, Nathan Currier, and Holger Stark","Topological Defects and Interactions in Nematic Emulsions","17 double column pages prepared by RevTex, 15 eps figures included in
  text, 2 gif figures for Fig. 14",,"10.1103/PhysRevE.57.610",,"cond-mat.soft",,"  Inverse nematic emulsions in which surfactant-coated water droplets are
dispersed in a nematic host fluid have distinctive properties that set them
apart from dispersions of two isotropic fluids or of nematic droplets in an
isotropic fluid. We present a comprehensive theoretical study of the
distortions produced in the nematic host by the dispersed droplets and of
solvent mediated dipolar interactions between droplets that lead to their
experimentally observed chaining. A single droplet in a nematic host acts like
a macroscopic hedgehog defect. Global boundary conditions force the nucleation
of compensating topological defects in the nematic host. Using variational
techniques, we show that in the lowest energy configuration, a single water
droplet draws a single hedgehog out of the nematic host to form a tightly bound
dipole. Configurations in which the water droplet is encircled by a
disclination ring have higher energy. The droplet-dipole induces distortions in
the nematic host that lead to an effective dipole-dipole interaction between
droplets and hence to chaining.
","[{""version"":""v1"",""created"":""Fri, 11 Jul 1997 22:46:33 GMT""},{""version"":""v2"",""created"":""Sat, 12 Jul 1997 14:40:57 GMT""}]","2009-10-30"
"cond-mat/9707134","Ewout ter Haar","Ewout ter Haar, Valdir Bindilatti, Nei F. Oliveira Jr., G.H. McCabe,
  Y. Shapira, Z. Golacki, S. Charar, M. Averous, E.J. McNiff Jr","Eu-Eu exchange interaction and Eu distribution in Pb_(1-x)Eu_(x)Te from
  magnetization steps","9 pages, 6 figs, Revtex, accepted for publication in Phys. Rev. B",,"10.1103/PhysRevB.56.8912",,"cond-mat",,"  The magnetization of Pb_{1-x}Eu_{x}Te samples with x = 1.9, 2.6 and 6.0% was
measured at 20 mK in fields up to 50 kOe, and at 0.6 K in fields up to 180 kOe.
The 20 mK data show the magnetization steps (MSTs) arising from pairs and from
triplets. The pair MSTs are used to obtain the dominant Eu-Eu antiferromagnetic
exchange constant, J/k_{B} = -0.264 \pm 0.018 K. The exchange constant for
triplets is the same. Comparison of the magnetization curves with theoretical
simulations indicates that the Eu ions are not randomly distributed over all
the cation sites. The deviation from a random distribution is much smaller if J
is assumed to be the nearest-neighbor exchange constant J_{1} rather than the
next-nearest-neighbor exchange constant J_{2}. On this basis, J is tentatively
identified as J_{1}. To obtain agreement with the data, it must be assumed that
the Eu ions tend to bunch together. Comparision with microprobe data indicates
that the length scale for these concentration variations is smaller than a few
micrometer. The theoretical simulations in the present work improve on those
performed earlier by including clusters larger than three spins.
","[{""version"":""v1"",""created"":""Fri, 11 Jul 1997 23:16:03 GMT""}]","2009-10-30"
"cond-mat/9707135","Heinz Schulz","H. J. Schulz (Orsay), B. S. Shastry (Bangalore)","A new class of exactly solvable interacting fermion models in one
  dimension","11 pages, revtex 3.0, no figures, some typos corrected","Phys.Rev.Lett. 80 (1998) 1924","10.1103/PhysRevLett.80.1924",,"cond-mat",,"  We investigate a model containing two species of one-dimensional fermions
interacting via a gauge field determined by the positions of all particles of
the opposite species. The model can be solved exactly via a simple unitary
transformation. Nevertheless, correlation functions exhibit nontrivial
interaction-dependent exponents. A similar model defined on a lattice is
introduced and solved. Various generalizations, e.g. to the case of internal
symmetries of the fermions, are discussed. The present treatment also clarifies
certain aspects of Luttinger's original solution of the ``Luttinger model''.
","[{""version"":""v1"",""created"":""Sat, 12 Jul 1997 13:51:33 GMT""},{""version"":""v2"",""created"":""Mon, 29 Sep 1997 14:42:21 GMT""}]","2009-10-30"
"cond-mat/9707136","Grigori Volovik","G.E. Volovik","Comment on ""Magnus Force in Superfluids and Superconductors""","Comment to the paper by E.B. Sonin in Phys. Rev. B 55, 485 (1997)
  [cond-mat/9606099], revtex file, 3 pages, no figures",,,,"cond-mat.supr-con",,"  The effective action for the Josephson junction arrays should contain the
topological term, which violates the particle-hole symmetry. This term is
responsible for the nonzero Magnus force acting on the vortex. The Magnus force
is however small because the parameter of the particle-hole asymmetry in
superconductors is small.
","[{""version"":""v1"",""created"":""Sat, 12 Jul 1997 12:17:33 GMT""}]","2008-02-03"
"funct-an/9707001","Brian Treadway","Palle E.T. Jorgensen and Gestur \'Olafsson","Unitary Representations of Lie Groups with Reflection Symmetry","49 pages, LaTeX article style, 11pt size option","J. Funct. Anal. 158 (1998), 26--88","10.1006/jfan.1998.3285",,"funct-an math.FA math.RT",,"  We consider the following class of unitary representations $\pi $ of some
(real) Lie group $G$ which has a matched pair of symmetries described as
follows: (i) Suppose $G$ has a period-2 automorphism $\tau $, and that the
Hilbert space $\mathbf{H} (\pi)$ carries a unitary operator $J$ such that $J\pi
=(\pi \circ \tau)J$ (i.e., selfsimilarity). (ii) An added symmetry is implied
if $\mathbf{H} (\pi)$ further contains a closed subspace $\mathbf{K}_0 $ having
a certain order-covariance property, and satisfying the $\mathbf{K}_0
$-restricted positivity: $< v \mid Jv > \ge 0$, $\forall v\in \mathbf{K}_0 $,
where $< \cdot \mid \cdot >$ is the inner product in $\mathbf{H} (\pi)$. From
(i)--(ii), we get an induced dual representation of an associated dual group
$G^c$. All three properties, selfsimilarity, order-covariance, and positivity,
are satisfied in a natural context when $G$ is semisimple and hermitean; but
when $G$ is the $(ax+b)$-group, or the Heisenberg group, positivity is
incompatible with the other two axioms for the infinite-dimensional irreducible
representations. We describe a class of $G$, containing the latter two, which
admits a classification of the possible spaces $\mathbf{K}_0 \subset \mathbf{H}
(\pi)$ satisfying the axioms of selfsimilarity and order-covariance.
","[{""version"":""v1"",""created"":""Fri, 11 Jul 1997 17:04:50 GMT""}]","2016-08-15"
"funct-an/9707002","Brian Treadway","Ola Bratteli (University of Oslo), Palle E. T. Jorgensen (University
  of Iowa), and Derek W. Robinson (Australian National University)","Spectral asymptotics of periodic elliptic operators","27 pages, LaTeX article style","Math. Z. 232 (1999), 621--650",,"MRR 002--97","funct-an math.OA",,"  We demonstrate that the structure of complex second-order strongly elliptic
operators $H$ on ${\bf R}^d$ with coefficients invariant under translation by
${\bf Z}^d$ can be analyzed through decomposition in terms of versions $H_z$,
$z\in{\bf T}^d$, of $H$ with $z$-periodic boundary conditions acting on
$L_2({\bf I}^d)$ where ${\bf I}=[0,1>$. If the semigroup $S$ generated by $H$
has a H\""older continuous integral kernel satisfying Gaussian bounds then the
semigroups $S^z$ generated by the $H_z$ have kernels with similar properties
and $z\mapsto S^z$ extends to a function on ${\bf C}^d\setminus\{0\}$ which is
analytic with respect to the trace norm. The sequence of semigroups $S^{(m),z}$
obtained by rescaling the coefficients of $H_z$ by $c(x)\to c(mx)$ converges in
trace norm to the semigroup $\hat{S}^z$ generated by the homogenization
$\hat{H}_z$ of $H_z$. These convergence properties allow asymptotic analysis of
the spectrum of $H$.
","[{""version"":""v1"",""created"":""Fri, 11 Jul 1997 21:57:04 GMT""}]","2008-02-03"
"hep-ex/9707026","Ann Heinson","A.P. Heinson (UC Riverside)","Measuring the CKM Matrix Element Vtb at DZero and CDF","8 pages. To appear in the proceedings of the 2nd International
  Conference on B Physics and CP Violation, Honolulu, Hawaii, March 1997",,"10.1142/9789814503952_0032","FERMILAB-Conf-97/238-E, D0-Conf-97-26, UCR/D0/97-12","hep-ex",,"  I present measurements by the CDF collaboration of the Standard Model three
generation CKM matrix element Vtb and of a special case extension with
additional assumptions, using current Tevatron ttbar data. I then show how we
can significantly improve the precision on Vtb and at the same time extend the
measurement so it is not constrained by Standard Model assumptions, using
single top production at the upgraded Tevatron.
","[{""version"":""v1"",""created"":""Sat, 12 Jul 1997 15:07:58 GMT""}]","2016-11-03"
"hep-lat/9707009","Stephen R. Sharpe","C. Dawson, G. Martinelli, G.C. Rossi, C.T. Sachrajda, S. Sharpe, M.
  Talevi and M. Testa","New lattice approaches to the $\Delta I=1/2$ rule","22 pages, 1 figure, uses epsfig","Nucl.Phys.B514:313-335,1998","10.1016/S0550-3213(97)00756-6","EDINBURGH 97/6, ROME1-1174/97, ROM2F/97/25, SHEP 97/15, UW/PT 97-17","hep-lat",,"  Lattice QCD should allow a derivation of the $\Delta I=1/2$ rule from first
principles, but numerical calculations to date have been plagued by a variety
of problems. After a brief review of these problems, we present several new
methods for calculating $K\to\pi\pi$ amplitudes. These are designed for Wilson
fermions, though they can be used also with staggered fermions. They all
involve a non-perturbative determination of matching coefficients. We show how
problems of operator mixing can be greatly reduced by using point-split
hadronic currents, and how CP violating parts of the $K\to\pi\pi$ amplitudes
can be calculated by introducing a fake top quark. Many of the methods can also
be applied to the calculation of two body non-leptonic B-meson decays.
","[{""version"":""v1"",""created"":""Fri, 11 Jul 1997 23:36:48 GMT""}]","2009-10-09"
"hep-ph/9707315","Sourendu Gupta","Sourendu Gupta","Single Polarisation Asymmetries for Quarkonia in Non-relativistic QCD","Plain LaTeX with one figure (ps)","Phys. Rev. D 57, 1858 (1998)","10.1103/PhysRevD.57.1858","TIFR/TH/97-36","hep-ph",,"  We find that single spin asymmetries in NRQCD are non-vanishing in general.
They are proportional to the imaginary parts of some non-perturbative matrix
elements. With statistics of about 10^6 identified J/psi's, or 10^5 identified
chi_2, it is possible to measure these imaginary parts even if they are an
order of magnitude smaller than the real parts. Such statistics are quite
reasonable at polarised HERA N and other future experiments.
","[{""version"":""v1"",""created"":""Fri, 11 Jul 1997 20:09:39 GMT""}]","2016-08-25"
"hep-ph/9707327","Lorenz von Smekal","Lorenz von Smekal (1), Andreas Hauck (2), and Reinhard Alkofer (2)
  ((1) Argonne National Laboratory, (2) Universitaet Tuebingen)","A Solution to Coupled Dyson-Schwinger Equations for Gluons and Ghosts in
  Landau Gauge","60 pages, LaTeX209, 17 figures (epsfig.sty), to appear in Ann. Phys.,
  some typos corrected. In particular, in Eqs. (83), (85) and (90) a factor
  1/(4 kappa) that was erroneously inserted in the original typing process had
  to be removed. We are indebted to A. Cucchieri for helping us become aware of
  this typo","Annals Phys. 267 (1998) 1; Erratum-ibid. 269 (1998) 182","10.1006/aphy.1998.5806","ANL-PHY-8758-TH-97, UNITU-THEP-12/1997","hep-ph hep-th nucl-th",,"  A truncation scheme for the Dyson-Schwinger equations of QCD in Landau gauge
is presented which implements the Slavnov-Taylor identities for the 3-point
vertex functions. Neglecting contributions from 4-point correlations such as
the 4-gluon vertex function and irreducible scattering kernels, a closed system
of equations for the propagators is obtained. For the pure gauge theory without
quarks this system of equations for the propagators of gluons and ghosts is
solved in an approximation which allows for an analytic discussion of its
solutions in the infrared: The gluon propagator is shown to vanish for small
spacelike momenta whereas the ghost propagator is found to be infrared
enhanced. The running coupling of the non-perturbative subtraction scheme
approaches an infrared stable fixed point at a critical value of the coupling
alpha_c of approx. 9.5. The gluon propagator is shown to have no Lehmann
representation. The results for the propagators obtained here compare favorably
with recent lattice calculations.
","[{""version"":""v1"",""created"":""Fri, 11 Jul 1997 16:18:32 GMT""},{""version"":""v2"",""created"":""Mon, 8 Dec 1997 16:08:42 GMT""},{""version"":""v3"",""created"":""Fri, 10 Jul 1998 15:10:50 GMT""}]","2009-10-30"
"hep-ph/9707328","Michael A. Doncheski","M. A. Doncheski and R. W. Robinett","Leptoquark production in ultrahigh-energy neutrino interactions
  revisited","12 pages, LaTeX, 3 separate postscript figures. Added 1 reference
  plus discussion, updated another reference","Phys.Rev. D56 (1997) 7412-7415","10.1103/PhysRevD.56.7412","PSU/TH/185","hep-ph",,"  The prospects for producing leptoquarks (LQs) in ultrahigh-energy (UHE)
neutrino nucleon collisions are re-examined in the light of recent
interpretations of HERA data in terms of leptoquark production. We update
predictions for cross-sections for the production of first- and
second-generation leptoquarks in UHE nu-N and nubar-N collisions including
  (i) recent experimental limits on masses and couplings from the LEP and
TEVATRON colliders as well as rare processes,
  (ii) modern parton distributions, and
  (iii) radiative corrections to single leptoquark production.
  If the HERA events are due to an SU(2) doublet leptoquark which couples
mainly to (e+,q) states, we argue that there are likely other LQ states which
couple to neutrinos which are close in mass, due to constraints from precision
electroweak measurements.
","[{""version"":""v1"",""created"":""Fri, 11 Jul 1997 18:51:10 GMT""},{""version"":""v2"",""created"":""Wed, 16 Jul 1997 13:42:34 GMT""},{""version"":""v3"",""created"":""Tue, 22 Jul 1997 13:15:46 GMT""}]","2016-09-06"
"hep-ph/9707329","Viatcheslav Belyaev","V.M. Belyaev and Mikkel B. Johnson","Pion Light-Cone Wave Functions and Light-Front Quark Model","11 pages and 2 PS-figures in one gz-compressed .tar file. Minor
  change","Phys.Lett. B423 (1998) 379-384","10.1016/S0370-2693(98)00152-X",,"hep-ph",,"  We discuss a relation between the light-front quark model and QCD. We argue
that this model can be used for an evaluation of the light-cone wave functions
for moderate values of ""u"", but that it is inapplicable for this purpose in the
region near the ends points u=0,1. We find additional support for a recent
analysis in which it was claimed that the twist-two pion wave function attains
its asymptotic form. The asymptotic twist-four two-particle wave function is
also in good agreement with the light-front quark model.
","[{""version"":""v1"",""created"":""Fri, 11 Jul 1997 19:38:56 GMT""},{""version"":""v2"",""created"":""Fri, 5 Dec 1997 11:28:45 GMT""}]","2016-09-06"
"hep-ph/9707330","Antonio Riotto","Antonio Riotto","Inflation and the Nature of Supersymmetry Breaking","25 pages, LaTeX file","Nucl.Phys.B515:413-435,1998","10.1016/S0550-3213(98)00039-X","FERMILAB-PUB-97/234-A","hep-ph",,"  The scale at which supersymmetry is broken and the mechanism by which
supersymmetry breaking is fed down to the observable sector has rich
implications on the way Nature may have chosen to accomplish inflation. We
discuss a simple model for slow rollover inflation which is minimal in the
sense that the inflaton may be identified with the field responsible for the
generation of the $\mu$-term. Inflation takes place at very late times and is
characterized by a very low reheating temperature. This property is crucial to
solve the gravitino problem and may help to ameliorate the cosmological moduli
problem. The COBE normalized value of the vacuum energy driving inflation is
naturally of the order of $10^{11}$ GeV. This favors the N=1 supergravity
scenario where supersymmetry breaking is mediated by gravitational
interactions. Nonetheless, smaller values of the vacuum energy are not excluded
by present data on the temperature anisotropy and the inflationary scenario may
be implemented in the context of new recent ideas about gauge mediation where
the standard model gauge interactions can serve as the messangers of
supersymmetry breaking. In this class of models supersymmetry breaking masses
are usually prop ortional to the F-term of a gauge singlet superfield. The same
F-term may provide the vacuum energy density necessary to drive inflation. The
spectrum of density perturbations is characterized by a spectral index which is
significantly displaced from one. The measurements of the temperature
anisotropies in the cosmic microwave background radiation at the accuracy
expected to result from the planned missions will be able to confirm or
disprove this prediction and to help in getting some deeper insight into the
nature of supersymmetry breaking.
","[{""version"":""v1"",""created"":""Fri, 11 Jul 1997 21:54:30 GMT""}]","2014-11-17"
"hep-ph/9707331","Jaewan Kim","Jaewan Kim, Jorge L. Lopez, D.V. Nanopoulos, Raghavan Rangarajan, and
  A. Zichichi","Light-Gravitino Production at Hadron Colliders","25 pages, including 8 figures. Typeset in LaTex2e. Replaced with
  corrected figures, and some minor rewrites","Phys.Rev.D57:373-382,1998","10.1103/PhysRevD.57.373","ACT-11/97;CERN-TH/97-120;CTP-TAMU-30/97;DOE/ER/40717-44","hep-ph",,"  We consider the production of gravitinos ($\widetilde G$) in association with
gluinos ($\tilde g$) or squarks ($\tilde q$) at hadron colliders, including the
three main sub-processes: $q \bar q -> \tilde g\widetilde G$, $qg -> \tilde
q\widetilde G$, and $gg -> \tilde g\widetilde G$. These channels become
enhanced to the point of being observable for sufficiently light gravitino
masses ($m_{\widetilde G} < 10^{-4} eV$), as motivated by some supersymmetric
explanations of the CDF $ee\gamma\gamma+ E_{T,miss}$ event. The characteristic
signal of such events would be monojets, as opposed to dijets obtained in the
more traditional supersymmetric process $p \bar p -> \tilde g\tilde g$.
Searches for such events at the Tevatron can impose lower limits on the
gravitino mass. In the Appendix, we provide a complete set of Feynman rules for
gravitino interactions used in our calculation.
","[{""version"":""v1"",""created"":""Fri, 11 Jul 1997 22:37:35 GMT""},{""version"":""v2"",""created"":""Sat, 12 Jul 1997 09:38:42 GMT""}]","2009-08-25"
"hep-ph/9707332",,"Frank X. Lee (U. of Colorado)","Predicative Ability of QCD Sum Rules for Decuplet Baryons","13 pages, RevTeX, 5 PS figures embedded with psfig.sty","Phys.Rev.C57:322-328,1998","10.1103/PhysRevC.57.322","CU-NPL-1147","hep-ph nucl-th",,"  QCD sum rules for decuplet baryon two-point functions are investigated using
a comprehensive Monte-Carlo based procedure. In this procedure, all
uncertainties in the QCD input parameters are incorporated simultaneously,
resulting in realistic estimates of the uncertainties in the extracted
phenomenological parameters. Correlations between the QCD input parameters and
the phenomenological parameters are studied by way of scatter plots. The
predicted couplings are useful in evaluating matrix elements of decuplet
baryons in the QCD sum rule approach. They are also used to check a cubic
scaling law between baryon couplings and masses, as recently found by Dey and
coworkers. The results show a significant reduction in the scaling constant and
some possible deviations from the cubic law.
","[{""version"":""v1"",""created"":""Fri, 11 Jul 1997 23:51:07 GMT""},{""version"":""v2"",""created"":""Sat, 12 Jul 1997 18:26:34 GMT""}]","2009-09-25"
"hep-ph/9707333","Lars Bergstrom","P. Ullio (Stockholm U. & Uppsala U.), L. Bergstrom (Stockholm U.)","Neutralino Annihilation into a Photon and a Z boson","19 pages, LaTeX, 6 eps figures. Some formulas corrected, improved
  discussion of halo models, results and conclusions unchanged. Version to
  appear in Phys. Rev. D","Phys.Rev.D57:1962-1971,1998","10.1103/PhysRevD.57.1962",,"hep-ph astro-ph",,"  A full one-loop calculation of neutralino S-wave annihilation into the
$Z\gamma$ final state is performed in the minimal supersymmetric extension of
the Standard Model. This process, like the similar one with two photons in the
final state, may be of importance for the indirect detection of supersymmetric
dark matter through the very narrow $\gamma$ ray line that would result from
neutralino annihilations in the galactic halo.
  We give the complete analytical formulas for this loop-induced process and
treat the case of a pure Higgsino as a first application of our expressions.
Predictions for the gamma line flux are given for the halo model which is of
the form suggested by Kravtsov et al. and for the profile proposed by Navarro,
Frenk and White.
  For heavy neutralinos, the lines from $2\gamma$ and $Z\gamma$ would have
indistiguishable energy in a realistic detector, making the fluxes add and
facilitating discovery. For lighter neutralinos, the positions and relative
strengths of the two lines would give valuable information on the nature of the
supersymmetric dark matter particles.
","[{""version"":""v1"",""created"":""Sat, 12 Jul 1997 00:39:10 GMT""},{""version"":""v2"",""created"":""Fri, 28 Nov 1997 07:52:38 GMT""}]","2010-11-30"
"hep-th/9707113","Tomas Ortin Miguel","Tomas Ortin, (CERN)","A Note on the D-2-Brane of the Massive Type IIA Theory and Gauged Sigma
  Models","Latex file. A reference added","Phys.Lett. B415 (1997) 39-44","10.1016/S0370-2693(97)01214-8","CERN-TH/97-161","hep-th",,"  Gauging the M-2-brane effective action with respect to an Abelian isometry in
such a way that the invariance under gauge transformations of the 3-form
potential is maintained (slightly modified) we obtain a fully covariant action
with 11-dimensional target space that gives the massive D-2-brane effective
action upon dimensional reduction in the direction of the gauged isometry.
","[{""version"":""v1"",""created"":""Fri, 11 Jul 1997 16:41:02 GMT""},{""version"":""v2"",""created"":""Wed, 16 Jul 1997 15:28:52 GMT""},{""version"":""v3"",""created"":""Thu, 31 Jul 1997 13:51:13 GMT""}]","2009-10-30"
"hep-th/9707117","Marcos Alvarez","Marcos Alvarez","Physical states of dyons","9 pages, no figures",,,"SWAT-97-156","hep-th",,"  It is shown that physical states of a non-abelian Yang-Mills-Higgs dyon are
invariant under large gauge transformations that do not commute with its
magnetic field. This result is established within an enlarged Hamiltonian
formalism where surface terms are kept as dynamical variables. These additional
variables are parameters of large gauge transformations, and are potential
collective coordinates for the quantization of the monopole. Our result implies
that there are no physical effects associated to some large gauge
transformations and therefore their parameters should not be counted as
collective coordinates.
","[{""version"":""v1"",""created"":""Fri, 11 Jul 1997 16:05:30 GMT""}]","2007-05-23"
"hep-th/9707118","Jose M. Figueroa-O'Farrill","BS Acharya, JM Figueroa-O'Farrill, M O'Loughlin and B Spence","Euclidean D-branes and higher-dimensional gauge theory","23 pages (some changes in section 4.5 -- equations 27 and 28 change
  slightly) (missing bibliography added!)","Nucl.Phys. B514 (1998) 583-602","10.1016/S0550-3213(97)00727-X","QMW-PH-97-20, IC/97/59","hep-th dg-ga math.DG",,"  We consider euclidean D-branes wrapping around manifolds of exceptional
holonomy in dimensions seven and eight. The resulting theory on the
D-brane---that is, the dimensional reduction of 10-dimensional supersymmetric
Yang-Mills theory---is a cohomological field theory which describes the
topology of the moduli space of instantons. The 7-dimensional theory is an N_T
= 2 (or balanced) cohomological theory given by an action potential of
Chern-Simons type. As a by-product of this method, we construct a related
cohomological field theory which describes the monopole moduli space on a
7-manifold of G_2 holonomy.
","[{""version"":""v1"",""created"":""Fri, 11 Jul 1997 17:07:46 GMT""},{""version"":""v2"",""created"":""Mon, 3 Nov 1997 15:16:06 GMT""},{""version"":""v3"",""created"":""Wed, 5 Nov 1997 13:31:16 GMT""}]","2009-10-30"
"hep-th/9707119","John Schwarz","John H. Schwarz","Remarks on the M5-Brane","11 pages, latex, no figures; talk presented at Strings`97","Nucl.Phys.Proc.Suppl. 68 (1998) 279-284","10.1016/S0920-5632(98)00161-3","CALT-68-2126","hep-th",,"  The fivebrane of M theory -- the M5-brane -- is an especially interesting
object. It plays a central role in a geometric understanding of the
Seiberg-Witten solution of N=2 D=4 gauge theories as well as in certain new 6d
quantum theories. The low energy effective action is an interacting theory of a
(2,0) tensor multiplet. The fact that this multiplet contains a two-form gauge
field with a self-dual field strength poses special challenges. Recent progress
in addressing those challenges is reviewed.
","[{""version"":""v1"",""created"":""Fri, 11 Jul 1997 18:11:12 GMT""}]","2009-10-30"
