"cond-mat/9707190",,"JB Pendry (Blackett Laboratory, Imperial College, London)","Shearing the Vacuum - Quantum Friction","21 pages, Latex, 8 figures, submitted to J. Phys. C: Solid State
  Physics",,"10.1088/0953-8984/9/47/001","CMTH/9697/17","cond-mat",,"  We consider two perfectly smooth featureless surfaces at T=0, defined only by
their respective dielectric functions, separated by a finite distance, and ask
the question whether they can experience any friction when sheared parallel to
their interface. We find large frictional effects comparable to everyday
frictional forces provided that the materials have resistivities of the order
of 1 m-Ohm and that the surfaces are in close proximity. The friction depends
solely on the reflection coefficients of the surfaces to electromagnetic waves
and its detailed behaviour with shear velocity and separation is dictated by
the dispersion of the reflectivity with frequency.
","[{""version"":""v1"",""created"":""Fri, 18 Jul 1997 13:21:44 GMT""},{""version"":""v2"",""created"":""Mon, 21 Jul 1997 19:06:18 GMT""}]","2009-10-30"
"cond-mat/9707191","Loktev V. M.","V.M. Loktev (Bogolyubov Institute for Theoretical Physics) and V.M.
  Turkowski(Shevchenko Kyiv University)","On the Theory of the Pseudogap Formation in 2D Attracting Fermion
  Systems","19 pages, 2 figures (emtex)",,"10.1134/1.558663",,"cond-mat.supr-con",,"  Two-dimensional system of the fermions with the indirect Einstein
phonon-exchange attraction and added local four-fermion interaction is
considered. It is shown that in such a system at resulting attraction between
particles a new nonsuperconducting phase arises along with the normal and
superconducting phases. In this, called ""abnormal normal"", or pseudogap, phase
the absolute value of the order parameter is finite but its phase is a random
quantity. It is important that the new phase really exists at low carrier
density only, i.e. it shrinks with doping increasing in the case of phonon
attraction. The relevance of the results for high-temperature superconductors
is speculated.
  Key words: 2D metal, arbitrary carrier density, normal phase, abnormal normal
phase, pseudogap, suderconducting phase, Berezinskii-Kosterlitz-Thouless phase,
electron-electron and electron-hole pairing
","[{""version"":""v1"",""created"":""Fri, 18 Jul 1997 13:01:54 GMT""}]","2009-10-30"
"cond-mat/9707192","Johannes Hager","Johannes Hager (University-Essen, Germany)","Relaxation of Surface Profiles by Evaporation Dynamics","6 pages, Revtex, 5 Postscript figures, to appear in PRB 15, October
  1997",,"10.1103/PhysRevB.56.12499",,"cond-mat",,"  We present simulations of the relaxation towards equilibrium of one
dimensional steps and sinusoidal grooves imprinted on a surface below its
roughening transition. We use a generalization of the hypercube stacking model
of Forrest and Tang, that allows for temperature dependent
next-nearest-neighbor interactions. For the step geometry the results at T=0
agree well with the t^(1/4) prediction of continuum theory for the spreading of
the step. In the case of periodic profiles we modify the mobility for the tips
of the profile and find the approximate solution of the resulting free boundary
problem to be in reasonable agreement with the T=0 simulations.
","[{""version"":""v1"",""created"":""Fri, 18 Jul 1997 14:53:47 GMT""}]","2009-10-30"
"cond-mat/9707193","Michael Ignatiev","Michael Ignatiev, Lei Gu and Bulbul Chakraborty","Relaxation Spectra at the Glass Transition: Origin of Power Laws","ReVTEX file with 2 figures",,,,"cond-mat.stat-mech cond-mat.dis-nn",,"  We propose a simple dynamical model of the glass transition based on the
results from a non-randomly frustrated spin model which is known to form a
glassy state below a characteristic quench temperature. The model is
characterized by a multi-valleyed free-energy surface which is modulated by an
overall curvature. The transition associated with the vanishing of this overall
curvature is reminiscent of the glass transition. In particular, the
frequency-dependent response evolves from a Debye relaxation peak to a function
whose high-frequency behavior is characterized by a non-trivial power law. We
present both an analytical form for the response function and numerical results
from Langevin simulations.
","[{""version"":""v1"",""created"":""Fri, 18 Jul 1997 15:18:52 GMT""}]","2008-02-03"
"cond-mat/9707195","Coen van Duin","C. N. A. van Duin and J. Zaanen","Charge- versus spin driven stripe order: the role of transversal spin
  fluctuations","4 pages Revtex, 2 figures","Phys. Rev. Lett., 80 (1998) 1513","10.1103/PhysRevLett.80.1513",,"cond-mat.supr-con",,"  The separation of the charge- and spin ordering temperatures of the stripe
phase in cuprate superconductors has been used to argue that the striped phase
is charge driven. Scaling analysis of a non-linear sigma model shows that the
effect of spatial anisotropy on the transversal spin fluctuations is much more
drastic at finite temperatures than at zero temperature. These results suggest
that the spin fluctuations prohibit the spin system to condense at the charge
ordering temperature, despite a possible dominance of charge-spin coupling in
the longitudinal channel.
","[{""version"":""v1"",""created"":""Fri, 18 Jul 1997 15:21:02 GMT""}]","2009-10-30"
"dg-ga/9707012","John Lott","John Lott","Remark About Heat Diffusion on Periodic Spaces","7 pages, AMS-Latex",,,,"dg-ga math.DG",,"  Let M be a complete Riemannian manifold with a free cocompact Z^k-action. Let
k(t,x,y) be the heat kernel on M. We compute the asymptotics of k(t,x,y) in the
limit in which t goes to infinity and d(x,y) is comparable to sqrt{t}. We show
that in this limit, the heat diffusion is governed by an effective Euclidean
metric on R^k coming from the Hodge inner product on H^1(M/Z^k; R).
","[{""version"":""v1"",""created"":""Fri, 18 Jul 1997 13:46:37 GMT""}]","2008-02-03"
"gr-qc/9707041","Novak","J. Novak (DARC, CNRS, Observatoire de Paris)","Spherical neutron star collapse toward a black hole in tensor-scalar
  theory of gravity","23 pages, LaTeX, 21 PostScript figures, uses RevTeX, accepted for
  publication in Physical Review D Numerical appendix added, sec.III rewritten,
  figures changed","Phys.Rev. D57 (1998) 4789-4801","10.1103/PhysRevD.57.4789",,"gr-qc astro-ph",,"  Complete tensor-scalar and hydrodynamic equations are presented and
integrated, for a self-gravitating perfect fluid. The initial conditions
describe unstable-equilibrium neutron star configuration, with a polytropic
equation of state. They are necessary in order to follow the gravitational
collapse (including full hydrodynamics) of this star toward a black hole and to
study the resulting scalar gravitational wave. The amplitude of this wave, as
well as the radiated energy dramatically increase above some critical value of
the parameter of the coupling function, due to the spontaneous scalarization,
an effect not present in Brans-Dicke theory. In most cases, the pressure of the
collapsing fluid does not have a significant impact on the resulting signal.
These kind of sources are not likely to be observed by future laser
interferometric detectors (such as VIRGO or LIGO) of gravitational waves, if
they are located at more than a few 100 kpc. However, spontaneous scalarization
could be constrained if such a gravitational collapse is detected by its
quadrupolar gravitational signal, since this latter is quite lower than the
monopolar one.
","[{""version"":""v1"",""created"":""Fri, 18 Jul 1997 15:15:59 GMT""},{""version"":""v2"",""created"":""Fri, 23 Jan 1998 14:01:28 GMT""}]","2009-10-30"
"gr-qc/9707042","Sebastiaan de Haro Olle","S. de Haro (University of Utrecht)","Non-Commutative Black Hole Algebra and String Theory from Gravity","19 pages, LaTeX. Journal reference corrected","Class.Quant.Grav. 15 (1998) 519-535","10.1088/0264-9381/15/3/006",,"gr-qc hep-th",,"  We generalize the action found by 't Hooft, which describes the gravitational
interaction between ingoing and outgoing particles in the neighbourhood of a
black hole. The effect of this back-reaction is that of a shock wave, and it
provides a mechanism for recovering information about the momentum of the
incoming particles. The new action also describes particles with transverse
momenta and takes into account the transverse curvature of the hole, and has
the form of a string theory action. Apart from the Polyakov term found by 't
Hooft, we also find an antisymmetric tensor, which is here related to the
momentum of the particles. At the quantum level, the identification between
position and momentum operators leads to four non-commuting coordinates. A
certain relation to M(atrix) theory is proposed.
","[{""version"":""v1"",""created"":""Fri, 18 Jul 1997 15:57:14 GMT""},{""version"":""v2"",""created"":""Mon, 12 Jan 1998 11:13:10 GMT""},{""version"":""v3"",""created"":""Mon, 16 Mar 1998 10:37:11 GMT""}]","2009-10-30"
"gr-qc/9707043","Takeshi Chiba","Takeshi Chiba, Shinji Mukohyama, and Takashi Nakamura","Anisotropy of the Cosmic Background Radiation implies the Violation of
  the Strong Energy Condition in Bianchi type I Universe","9 pages, to appear in Physics Letters B","Phys.Lett. B408 (1997) 47-51","10.1016/S0370-2693(97)00782-X","YITP-97-3","gr-qc astro-ph",,"  We consider the horizon problem in a homogeneous but anisotropic universe
(Bianchi type I). We show that the problem cannot be solved if (1) the matter
obeys the strong energy condition with the positive energy density and (2) the
Einstein equations hold. The strong energy condition is violated during
cosmological inflation.
","[{""version"":""v1"",""created"":""Fri, 18 Jul 1997 12:35:05 GMT""}]","2009-10-30"
"hep-ex/9707031","Preprints Libr/pam","CLEO Collaboration, J. Gronberg et al","Measurements of the Meson-Photon Transition Form Factors of Light
  Pseudoscalar Mesons at Large Momentum Transfer","30 page postscript file, postscript file also available through
  http://w4.lns.cornell.edu/public/CLNS","Phys.Rev.D57:33-54,1998","10.1103/PhysRevD.57.33","CLNS 97/1477, CLEO 97-7","hep-ex",,"  Using the CLEO~II detector, we have measured the differential cross sections
for exclusive two-photon production of light pseudoscalar mesons $\pi^0$,
$\eta$, and $\eta^{\prime}$. From our measurements we have obtained the form
factors associated with the electromagnetic transitions $\gamma^*\gamma$ $\to$
meson. We have measured these form factors in the momentum transfer ranges from
1.5 to 9, 20, and 30 GeV$^2$ for $\pi^0$, $\eta$, and $\eta^{\prime}$,
respectively, and have made comparisons to various theoretical predictions.
","[{""version"":""v1"",""created"":""Thu, 17 Jul 1997 19:40:40 GMT""},{""version"":""v2"",""created"":""Fri, 18 Jul 1997 15:51:16 GMT""}]","2010-04-08"
"hep-ex/9707032","Neville Harnew","D.S. Bailey (1), R.C. Carter (2), B. Foster (1), N. Harnew (3), G.P.
  Heath (1), M.D. Jeffs (2), T. Khatri (3), M. Lancaster (3), J.B. Lane (4),
  I.C. McArthur (3), J.D. McFall (3), R. Milborrow (2), C.J.S. Morgado (1),
  M.C. Morrissey (2), J. Nash (3), G. Nixon (4), D.A. Phillips (2), M.
  Postranecky (4), S.P.H. Quinton (2), P.D. Shield (3), S. Topp-Jorgensen (3),
  G. Westlake (2), D.J. White (2), F.F. Wilson (3). ((1) University of Bristol,
  (2) Rutherford Appleton Laboratory, (3) University of Oxford, (4) University
  College, London.)","The Design and Performance of the ZEUS Central Tracking Detector
  z-by-Timing System","49 pages, 32 figures. Accepted for publication in NIM-A","Nucl.Instrum.Meth. A396 (1997) 320-349","10.1016/S0168-9002(97)00790-0",,"hep-ex",,"  The ZEUS Central Tracking Detector utilizes a time difference measurement to
provide a fast determination of the z-coordinate of each hit. The z-by-timing
measurement is achieved by using a Time-to-Amplitude Converter which has an
intrinsic timing resolution of 36 ps, has pipelined readout, and has a multihit
capability of 48 ns. In order to maintain the required sub-nanosecond timing
accuracy, the technique incorporates an automated self-calibration system. The
readout of the z-by-timing data utilizes a fully customized timing control
system which runs synchronously with the HERA beam-crossing clock, and a data
acquisition system implemented on a network of Transputers. Three dimensional
space-points provided by the z-by-timing system are used as input to all three
levels of the ZEUS trigger and for offline track reconstruction. The average
z-resolution is determined to be 4.4 cm for multi-track events from
positron-proton collisions in the ZEUS detector.
","[{""version"":""v1"",""created"":""Fri, 18 Jul 1997 14:55:27 GMT""}]","2009-10-30"
"hep-lat/9707021","Gerrit Schierholz","M. G\""ockeler, R. Horsley, H. Perlt, P. Rakow, G. Schierholz, A.
  Schiller and P. Stephenson","Scaling of Non-Perturbatively O(a) Improved Wilson Fermions: Hadron
  Spectrum, Quark Masses and Decay Constants",,"Phys.Rev.D57:5562-5580,1998","10.1103/PhysRevD.57.5562","DESY 97-125, HUB-EP-97/38","hep-lat hep-ph",,"  We compute the hadron mass spectrum, the quark masses and the meson decay
constants in quenched lattice QCD with non-perturbatively $O(a)$ improved
Wilson fermions. The calculations are done for two values of the coupling
constant, $\beta = 6.0$ and 6.2, and the results are compared with the
predictions of ordinary Wilson fermions. We find that the improved action
reduces lattice artifacts as expected.
","[{""version"":""v1"",""created"":""Thu, 17 Jul 1997 16:17:50 GMT""}]","2008-11-26"
"hep-lat/9707022","Herbert Neuberger","Herbert Neuberger (Rutgers)","Exactly massless quarks on the lattice","7 pages, plain TeX; references corrected","Phys.Lett. B417 (1998) 141-144","10.1016/S0370-2693(97)01368-3","RU-97-63","hep-lat",,"  It is suggested that the fermion determinant for a vector-like gauge theory
with strictly massless quarks can be represented on the lattice as
$\det{{1+V}\over 2}$, where $V=X(X^\dagger X)^{-1/2}$ and $X$ is the
Wilson-Dirac lattice operator with a negative mass term. There is no undesired
doubling and no need for any fine tuning. Several other appealing features of
the formula are pointed out.
","[{""version"":""v1"",""created"":""Thu, 17 Jul 1997 21:23:53 GMT""},{""version"":""v2"",""created"":""Tue, 5 Aug 1997 16:34:29 GMT""},{""version"":""v3"",""created"":""Mon, 27 Oct 1997 20:50:21 GMT""}]","2009-10-30"
"hep-lat/9707023","Frithjof Karsch","B. Beinlich, F. Karsch, E. Laermann and A. Peikert","String Tension and Thermodynamics with Tree Level and Tadpole Improved
  Actions","20 pages, LaTeX2e File, 8 coloured Postscript figures, new analysis
  added, recent Wilson action string tension results included, figures replaced","Eur.Phys.J.C6:133-140,1999","10.1007/s100520050326","BI-TP 97/18","hep-lat",,"  We calculate the string tension, deconfinement transition temperature and
bulk thermodynamic quantities of the SU(3) gauge theory using tree level and
tadpole improved actions. Finite temperature calculations have been performed
on lattices with temporal extent N_tau = 3 and 4. Compared to calculations with
the standard Wilson action on this size lattices we observe a drastic reduction
of the cut-off dependence of bulk thermodynamic observables at high
temperatures. In order to test the influence of improvement on long-distance
observables at T_c we determine the ratio T_c/sqrt(sigma). For all actions,
including the standard Wilson action, we find results which differ only little
from each other. We do, however, observe an improved asymptotic scaling
behaviour for the tadpole improved action compared to the Wilson and tree level
improved actions.
","[{""version"":""v1"",""created"":""Fri, 18 Jul 1997 07:50:13 GMT""},{""version"":""v2"",""created"":""Thu, 26 Mar 1998 13:27:20 GMT""}]","2011-09-13"
"hep-lat/9707024","Christian B. Lang","C. B. Lang and T. K. Pany (Univ. Graz, Austria)","Fixed point action for the massless lattice Schwinger model","17 pages (LaTeX), 6 figures (EPS); update to the published version
  (sorry, one year too late!)","Nucl.Phys.B513:645-657,1998","10.1016/S0550-3213(97)00720-7","UNIGRAZ-UTP-18-07-97","hep-lat",,"  We determine non-perturbatively the fixed-point action for fermions in the
two-dimensional U(1) gauge (Schwinger) model. This is done by iterating a block
spin transformation in the background of non-compact gauge field configurations
sampled according to the (perfect) Gaussian measure. The resulting action has
123 independent couplings, is bilinear in the Grassmann fields, gauge-invariant
by considered the compact gauge transporters and localized within a $7\times 7$
lattice centered around one of the fermions. We then simulate the model at
various values of $\beta$ and compare with results obtained with the Wilson
fermion action. We find excellent improvement for the studied observables
(propagators and masses).
","[{""version"":""v1"",""created"":""Fri, 18 Jul 1997 12:22:40 GMT""},{""version"":""v2"",""created"":""Wed, 23 Dec 1998 09:49:16 GMT""}]","2010-11-19"
"hep-lat/9707025","Vittorio Lubicz","M. Crisafulli, V. Lubicz and A. Vladikas","Improved Renormalization of Lattice Operators: A Critical Reappraisal","54 pages, Latex, 5 figures. Minor changes in text between eqs.(86)
  and (88)","Eur.Phys.J.C4:145-171,1998","10.1007/s100520050194","CERN-TH/97-15, ROME prep. 1163/97, ROM2F/97/23","hep-lat",,"  We systematically examine various proposals which aim at increasing the
accuracy in the determination of the renormalization of two-fermion lattice
operators. We concentrate on three finite quantities which are particularly
suitable for our study: the renormalization constants of the vector and axial
currents and the ratio of the renormalization constants of the scalar and
pseudoscalar densities. We calculate these quantities in boosted perturbation
theory, with several running boosted couplings, at the ""optimal"" scale q*. We
find that the results of boosted perturbation theory are usually (but not
always) in better agreement with non-perturbative determinations of the
renormalization constants than those obtained with standard perturbation
theory. The finite renormalization constants of two-fermion lattice operators
are also obtained non-perturbatively, using Ward Identities, both with the
Wilson and the tree-level Clover improved actions, at fixed cutoff ($\beta$=6.4
and 6.0 respectively). In order to amplify finite cutoff effects, the quark
masses (in lattice units) are varied in a large interval 0<am<1. We find that
discretization effects are always large with the Wilson action, despite our
relatively small value of the lattice spacing ($a^{-1} \simeq 3.7$ GeV). With
the Clover action discretization errors are significantly reduced at small
quark mass, even though our lattice spacing is larger ($a^{-1} \simeq 2$ GeV).
However, these errors remain substantial in the heavy quark region. We have
implemented a proposal for reducing O(am) effects, which consists in matching
the lattice quantities to their continuum counterparts in the free theory. We
find that this approach still leaves appreciable, mass dependent,
discretization effects.
","[{""version"":""v1"",""created"":""Fri, 18 Jul 1997 13:44:35 GMT""},{""version"":""v2"",""created"":""Tue, 13 Jan 1998 11:47:35 GMT""}]","2011-09-13"
"hep-ph/9707365","Sean Fleming","Sean Fleming (University of Wisconsin, Madison), Thomas Mehen (Johns
  Hopkins University)","Leptoproduction of J/psi","33 pages latex. 10 figures. Uses revtex, epsf, and rotate macros.
  This paper is also available via the UW phenomenology archives at
  http://phenom.physics.wisc.edu/pub/preprints/","Phys.Rev. D57 (1998) 1846-1857","10.1103/PhysRevD.57.1846","JHU--TIPAC--96022, MADPH-97-994","hep-ph hep-ex",,"  We study leptoproduction of $J/\psi$ at large $Q^2$ within the
nonrelativistic QCD (NRQCD) factorization formalism. The cross section is
dominated by color-octet terms that are of order $\alpha_s$. The color-singlet
term, which is of order $\alpha^2_s$, is shown to be a small contribution to
the total cross section. We also calculate the tree diagrams for color-octet
production at order $\alpha^2_s$ in a region of phase space where there is no
leading color-octet contribution. We find that in this regime the color-singlet
contribution dominates. We argue that non-perturbative corrections arising from
diffractive leptoproduction, higher twist effects, and higher order terms in
the NRQCD velocity expansion should be suppressed as $Q^2$ is increased.
Therefore, the color-octet matrix elements $< {\cal O}_8^{\psi}(^1S_0)>$ and
$<{\cal O}_8^{\psi}(^3P_0)>$ can be reliably extracted from this process.
Finally, we point out that an experimental measurement of the polarization of
leptoproduced $J/\psi$ will provide an excellent test of the NRQCD
factorization formalism.
","[{""version"":""v1"",""created"":""Thu, 17 Jul 1997 21:42:46 GMT""}]","2009-10-30"
"hep-ph/9707378","George Lazarides","G. Lazarides","Supersymmetry and Inflation","5 pages LaTeX 1 eps figure. Talk presented at SUSY 96,Maryland,May
  1996. Published in Nuclear Physics B(Proc.Suppl.) 52A(1997)242-245","Nucl.Phys.Proc.Suppl.52A:242-245,1997","10.1016/S0920-5632(96)00571-3",,"hep-ph",,"  A variant of hybrid inflation which is applicable in a wide class of
supersymmetric grand unified models and reproduces the observed temperature
perturbations of cosmic background radiation with natural values of the
parameters is presented. The theory is consistent with the unification of the
minimal supersymmetric standard model gauge couplings as measured at LEP. The
termination of inflation is smooth and does not produce any topological
defects. Numerical investigation of the cosmological evolution of the system
shows that for almost all initial values of the fields we do get an adequate
amount of inflation. Finally, the ""reheating"" process following inflation and
the production of the baryon asymmetry of the universe via a primordial lepton
asymmetry are briefly discussed and some important implications for right
handed neutrino Majorana masses are investigated.
","[{""version"":""v1"",""created"":""Thu, 17 Jul 1997 16:14:26 GMT""}]","2009-10-30"
"hep-ph/9707379","J. Gunion","J.F. Gunion (U.C. Davis)","Muon Colliders: The Machine and The Physics","18 pages, full postscript file is available via anonymous ftp at
  ftp://ucdhep.ucdavis.edu/gunion/bsmv.ps","AIP Conf.Proc. 415 (1997) 234-251","10.1063/1.54477","UCD-97-17","hep-ph hep-ex",,"  A review of muon colliders is presented. Basic features of the accelerator
and detector are outlined, and the very exciting physics prospects are
reviewed.
","[{""version"":""v1"",""created"":""Thu, 17 Jul 1997 22:28:19 GMT""},{""version"":""v2"",""created"":""Fri, 18 Jul 1997 02:16:38 GMT""}]","2009-10-30"
"hep-ph/9707380",,"V. Agrawal, S.M. Barr, J.F. Donoghue, and D. Seckel","The anthropic principle and the mass scale of the Standard Model","28 pages, LaTeX. No changes from version originally submitted to
  archive, except that problem with figure file has been corrected","Phys.Rev.D57:5480-5492,1998","10.1103/PhysRevD.57.5480","BA-97-26","hep-ph",,"  In theories in which different regions of the universe can have different
values of the the physical parameters, we would naturally find ourselves in a
region which has parameters favorable for life. We explore the range of
anthropically allowed values of the mass parameter in the Higgs potential,
$\mu^2$. For $\mu^2<0$, the requirement that complex elements be formed
suggests that the Higgs vacuum expectation value $v$ must have a magnitude less
than 5 times its observed value. For $\mu^2>0$, baryon stability requires that
$|\mu|<<M_P$, the Planck Mass. Smaller values of $|\mu^2|$ may or may not be
allowed depending on issues of element synthesis and stellar evolution. We
conclude that the observed value of $\mu^2$ is reasonably typical of the
anthropically allowed range, and that anthropic arguments provide a plausible
explanation for the closeness of the QCD scale and the weak scale.
","[{""version"":""v1"",""created"":""Thu, 17 Jul 1997 20:24:56 GMT""},{""version"":""v2"",""created"":""Tue, 29 Jul 1997 20:32:40 GMT""}]","2011-05-12"
"hep-ph/9707381","Misha Eides","Michael I. Eides (Petersburg Nuclear Physics Institute, Russia, and
  Pennsylvania State University, USA) and Howard Grotch (Pennsylvania State
  University, USA)","Radiative Correction to the Nuclear-Size Effect and Hydrogen-Deuterium
  Isotopic Shift","5 pages, REVTEX, replaced with the final version, to be published in
  Phys.Rev. A, two references added","Phys.Rev.A56:2507-2509,1997","10.1103/PhysRevA.56.R2507","PSU/TH/186","hep-ph physics.atom-ph",,"  The radiative correction to the nuclear charge radius contribution to the
Lamb shift of order $\alpha(Z\alpha)^5m_r^3<r^2>$ is calculated. In view of the
recent high precision experimental data, this theoretical correction produces a
significant contribution to the hydrogen-deuterium isotopic shift.
","[{""version"":""v1"",""created"":""Thu, 17 Jul 1997 20:38:51 GMT""},{""version"":""v2"",""created"":""Fri, 19 Sep 1997 16:55:14 GMT""}]","2014-11-17"
"hep-ph/9707382",,"S. J. Brodsky and G. A. Miller","Is J/psi-Nucleon Scattering Dominated by the Gluonic van der Waals
  Interaction?","LaTex, 12 pages","Phys.Lett.B412:125-130,1997","10.1016/S0370-2693(97)01045-9","SLAC-PUB-7553, DOE/ER/40561-330-INT97-19-07, DOE/ER/41014-16-N97","hep-ph nucl-th",,"  The gluon-exchange contribution to $J/\psi$-nucleon scattering is shown to
yield a sizeable scattering length of about -0.25 fm, which is consistent with
the sparse available data. Hadronic corrections to gluon exchange which are
generated by $\rho\pi$ and $D\bar D$ intermediate states of the $J/\psi$ are
shown to be negligible. We also propose a new method to study $J/\psi$-nucleon
elastic scattering in the reaction $\pi^+ d\to J/\psi p p$.
","[{""version"":""v1"",""created"":""Thu, 17 Jul 1997 21:49:08 GMT""}]","2009-09-11"
