"hep-ph/9707383","Gavin Salam","G.P. Salam","Angular ordering and small-x evolution","9 pages, LaTeX, 6 figures. Talk presented at Ringberg workshop: New
  trends in HERA Physics, Germany, May 1997. Minor modifications made to text",,,"IFUM-577-FT","hep-ph",,"  This talks examines the effect of angular ordering on the small-x evolution
of the unintegrated gluon distribution, and discusses the characteristic
function for the CCFM equation, as well as some preliminary results on
final-state properties.
","[{""version"":""v1"",""created"":""Thu, 17 Jul 1997 23:07:05 GMT""},{""version"":""v2"",""created"":""Fri, 18 Jul 1997 18:37:30 GMT""}]","2008-02-03"
"hep-ph/9707384","Davison E. Soper","Davison E. Soper","Diffraction in DIS and Elsewhere","Talk at DIS97 Conference, Chicago, April 1997. Eleven pages including
  nine figures",,"10.1063/1.53586",,"hep-ph",,"  I review some of the results presented in the working group on diffraction at
DIS97, with a particular emphasis on the theory of diffractive hard scattering.
","[{""version"":""v1"",""created"":""Thu, 17 Jul 1997 22:32:54 GMT""}]","2009-10-30"
"hep-ph/9707385","Susan Gardner","S. Gardner and H.B. O'Connell (Kentucky)","Rho-Omega Mixing and the Pion Form Factor in the Time-like Region","20 pages, REVTeX, epsfig, 2 ps figures, minor changes","Phys.Rev.D57:2716-2726,1998; Erratum-ibid.D62:019903,2000;
  Phys.Rev.D62:019903,2000","10.1103/PhysRevD.57.2716 10.1103/PhysRevD.62.019903","UK/TP 97-10","hep-ph nucl-th",,"  We determine the magnitude, phase, and $s$-dependence of $\rho$-$\omega$
``mixing'' in the pion form factor in the time-like region through fits to
$e^+e^- \ra \pi^+ \pi^-$ data. The associated systematic errors in these
quantities, arising from the functional form used to fit the $\rho$ resonance,
are small. The systematic errors in the $\rho$ mass and width, however, are
larger than previously estimated.
","[{""version"":""v1"",""created"":""Fri, 18 Jul 1997 02:57:17 GMT""},{""version"":""v2"",""created"":""Fri, 17 Apr 1998 02:05:03 GMT""}]","2014-11-17"
"hep-ph/9707386","Witold Skiba","Csaba Csaki, Lisa Randall and Witold Skiba (MIT)","Composite Intermediary and Mediator Models of Gauge-Mediated
  Supersymmetry Breaking","20 pages, LaTeX, 1 figure","Phys.Rev.D57:383-390,1998","10.1103/PhysRevD.57.383","MIT-CTP-2654","hep-ph",,"  We discuss gauge-mediated models which employ a tree-level mass term in the
superpotential. We give explicit composite realizations in which the mass terms
are not fundamental. Instead, they arise as effective terms in the
superpotential from confining gauge dynamics.
","[{""version"":""v1"",""created"":""Fri, 18 Jul 1997 02:33:57 GMT""}]","2009-09-15"
"hep-ph/9707387","Wally Melnitchouk","W. Melnitchouk (U. Maryland) and A.W. Thomas (U. Adelaide)","HERA Anomaly and Hard Charm in the Nucleon","extra figure included, version to appear in Phys. Lett. B","Phys.Lett.B414:134-139,1997","10.1016/S0370-2693(97)01150-7","UMD PP 98-003, ADP-97-25/T260","hep-ph nucl-th",,"  We explore the possibility that the excess neutral and charged current events
seen by the H1 and ZEUS Collaborations at HERA at large x and Q^2 could arise
from a hard charm component of the nucleon. While the symmetric intrinsic charm
hypothesis is unable to account for the HERA anomaly, a non-symmetric charm
distribution generated non-perturbatively, for which c-bar is much harder than
c, can produce significant enhancement of cross sections at the HERA
kinematics.
","[{""version"":""v1"",""created"":""Fri, 18 Jul 1997 02:54:18 GMT""},{""version"":""v2"",""created"":""Mon, 15 Sep 1997 05:56:52 GMT""}]","2008-11-26"
"hep-ph/9707388",,"F. Coester, D. O. Riska","Poincare Covariant Quark Models of Baryon Form Factors","Acknowledgments expanded","Few Body Syst.25:29-43,1998","10.1007/s006010050092",,"hep-ph",,"  Poincare covariant quark models of the the nucleon, the $\Delta$ resonance
and their excitations are explored. The baryon states are represented by
eigenfunctions of the four-velocity and a confining mass operator, which
reproduces the empirical spectrum up to $\sim$ 1700 MeV to an accuracy of $\sim
6%$. Models of constituent quark currents provide the relations between
ground-state properties and transition amplitudes.
","[{""version"":""v1"",""created"":""Fri, 18 Jul 1997 05:52:39 GMT""},{""version"":""v2"",""created"":""Tue, 22 Jul 1997 11:52:06 GMT""}]","2010-11-19"
"hep-ph/9707389","Daniele Treleani","Giorgio Calucci and Daniele Treleani","Minijets and the Two-Body Parton Correlation","19 pages, plane tex, no figures","Phys.Rev. D57 (1998) 503-511","10.1103/PhysRevD.57.503",,"hep-ph",,"  A large number of double parton scatterings have been recently measured by
CDF. The double parton scattering process measures $\sigma_{eff}$, a non
perturbative quantity related to the hadronic transverse size and with the
dimensions of a cross section. The actual value measured by CDF is considerably
smaller as compared with the naive expectation, namely the value of the
inelastic non diffractive cross section. The small value of $\sigma_{eff}$ may
be an effect of the hadron structure in transverse plane. We discuss the
problem by taking into account, at all orders, the two-body parton correlations
in the many-body parton distributions.
","[{""version"":""v1"",""created"":""Fri, 18 Jul 1997 08:15:57 GMT""}]","2009-10-30"
"hep-ph/9707390",,"G. Camici and M. Ciafaloni (Dipartimento di Fisica, Universita` di
  Firenze and INFN, Sezione di Firenze)","Irreducible part of the next-to-leading BFKL kernel","16 pages, LaTex2e, including 3 eps figures","Phys.Lett. B412 (1997) 396-406; Erratum-ibid. B417 (1998) 390","10.1016/S0370-2693(97)01073-3",,"hep-ph",,"  On the basis of previous work by Fadin, Lipatov, and collaborators, and of
our group, we extract the ""irreducible"" part of the next-to-leading (NL) BFKL
kernel, we compute its (IR finite) eigenvalue function, and we discuss its
implications for small-x structure functions. We find consistent running
coupling effects and sizable NL corrections to the Pomeron intercept and to the
gluon anomalous dimension. The qualitative effect of such corrections is to
smooth out the small-x rise of structure functions at low values of Q2. A more
quantitative analysis will be possible after the extraction of some additional,
energy-scale dependent contributions to the kernel, which are not treated here.
","[{""version"":""v1"",""created"":""Fri, 18 Jul 1997 09:01:25 GMT""}]","2009-10-30"
"hep-ph/9707391","Kordian Andrzej Smolinski","Pawel Caban, Jakub Rembielinski, and Kordian A. Smolinski","Decays of spacelike neutrinos","RevTeX 3.1, 14 pages, 12 figures",,,"KFT UL 1/97","hep-ph astro-ph",,"  In this paper we consider the hypothesis that neutrinos are fermionic
tachyons with helicity 1/2. We propose an effective model of interactions of
these neutrinos and analyze dominant effects under the above hypothesis: the
three-body neutrino decay, the radiative decay and briefly discuss beta-decay
with tachyonic antineutrino. We calculate the corresponding amplitudes and the
mean life time for decays, as well as the differential decay width. In addition
we apply the neutrino three-body decay to the solar neutrino problem and we
obtain a remarkable change of energy spectrum of the neutrino flux at the Earth
ground (assuming no neutrino oscillation). We compare the results with the
Standard Solar Model predictions and solar neutrino experiments to estimate an
upper bound for the taonic neutrino.
","[{""version"":""v1"",""created"":""Fri, 18 Jul 1997 09:28:50 GMT""}]","2007-05-23"
"hep-ph/9707392","Nicos Stefanis","G.C. Gellas, A.I. Karanikas, C.N. Ktorides, and N.G. Stefanis","Worldline approach to Sudakov-type form factors in non-Abelian gauge
  theories","18 pages. RevTex is used. No figures","Phys.Lett. B412 (1997) 95-103","10.1016/S0370-2693(97)01055-1","UA/NPPS-97-06, RUB-TPII-04/97","hep-ph",,"  We calculate Sudakov-type form factors for isolated spin-1/2 particles
(fermions) entering non-Abelian gauge-field systems. We consider both the on-
and the off-mass-shell case using a methodology which rests on a worldline
casting of field theories. The simplicity and utility of our approach derives
from the fact that we are in a position to make, a priori, a more transparent
separation (factorization), with respect to a given scale, between short- and
long-distance physics than diagramatic methods.
","[{""version"":""v1"",""created"":""Fri, 18 Jul 1997 13:00:58 GMT""}]","2009-10-30"
"hep-ph/9707393","Sergio Lupia","Sergio Lupia and Wolfgang Ochs (Max-Planck-Inst. fuer Physik, Munich)","Unified QCD Description of Hadron and Jet Multiplicities","LaTeX, 15 pages, 3 figures","Phys.Lett. B418 (1998) 214-222","10.1016/S0370-2693(97)01388-9","MPI-PhT/97-46","hep-ph",,"  The evolution equation for parton multiplicities in quark and gluon jets
which takes into account the soft gluon interference is solved numerically
using the initial conditions at threshold. If the k_T-cutoff Q_c is lowered
towards the hadronic scale Q_0 of a few hundred MeV, the jets are fully
resolved into hadrons. Both hadron and jet multiplicities in e+e- annihilation
are well described with a common normalization. Evidence is presented within
this perturbative approach that the coupling \alpha_s(k_T) rises by an order of
magnitude when approaching the low energy region. The ratio of hadron
multiplicities in gluon and quark jets is found smaller than in previous
approximate solutions of the evolution equation.
","[{""version"":""v1"",""created"":""Fri, 18 Jul 1997 14:41:10 GMT""}]","2009-10-30"
"hep-th/9707151",,"A. Ushveridze","New Fundamental Symmetries of Integrable Systems and Partial Bethe
  Ansatz","49 pages, LaTeX","Annals Phys. 266 (1998) 81-134","10.1006/aphy.1998.5797",,"hep-th cond-mat math-ph math.MP math.QA nlin.SI q-alg solv-int",,"  We introduce a new concept of quasi-Yang-Baxter algebras. The quantum
quasi-Yang-Baxter algebras being simple but non-trivial deformations of
ordinary algebras of monodromy matrices realize a new type of quantum dynamical
symmetries and find an unexpected and remarkable applications in quantum
inverse scattering method (QISM). We show that applying to quasi-Yang-Baxter
algebras the standard procedure of QISM one obtains new wide classes of quantum
models which, being integrable (i.e. having enough number of commuting
integrals of motion) are only quasi-exactly solvable (i.e. admit an algebraic
Bethe ansatz solution for arbitrarily large but limited parts of the spectrum).
These quasi-exactly solvable models naturally arise as deformations of known
exactly solvable ones. A general theory of such deformations is proposed. The
correspondence ``Yangian --- quasi-Yangian'' and ``$XXX$ spin models ---
quasi-$XXX$ spin models'' is discussed in detail. We also construct the
classical conterparts of quasi-Yang-Baxter algebras and show that they
naturally lead to new classes of classical integrable models. We conjecture
that these models are quasi-exactly solvable in the sense of classical inverse
scattering method, i.e. admit only partial construction of action-angle
variables.
","[{""version"":""v1"",""created"":""Thu, 17 Jul 1997 17:02:41 GMT""}]","2009-10-30"
"hep-th/9707157","David Kastor","David Kastor and Jennie Traschen","A Very Effective String Model?","19 pages, harvmac (b)","Phys. Rev. D 57, 4862 (1998)","10.1103/PhysRevD.57.4862","UMHEP-444","hep-th",,"  Additional evidence is presented for a recently proposed effective string
model, conjectured to hold throughout the parameter space of the basic 5
dimensional, triply charged black holes, which includes the effects of brane
excitations, as well as momentum modes. We compute the low energy spacetime
absorption coefficient $\sigma$ for the scattering of a triply-charged scalar
field in the near extremal case, and conjecture an exact form for $\sigma$. It
is shown that this form of $\sigma$ arises simply from the effective string
model. This agreement encompasses both statistical factors coming from the Bose
distributions of string excitations and a prefactor which depends on the
effective string radius. An interesting feature of the effective string model
is that the change in mass of the effective string system in an emission
process is not equal to the change in the energies of the effective string
excitations. If the model is valid, this may hold clues towards understanding
back reaction due to Hawking radiation. A number of weak spots and open
questions regarding the model are also noted.
","[{""version"":""v1"",""created"":""Thu, 17 Jul 1997 16:00:02 GMT""}]","2016-08-25"
"hep-th/9707158","Seiberg","Duiliu-Emanuel Diaconescu and Nathan Seiberg","The Coulomb Branch of (4,4) Supersymmetric Field Theories in Two
  Dimensions","18 pages, minor changes","JHEP 9707:001,1997","10.1088/1126-6708/1997/07/001","IAS-97-84, RU-97-62","hep-th",,"  We study (4,4) supersymmetric field theories in two dimensions with a one
dimensional Coulomb branch. These theories have applications in string theory.
Our analysis explains the known relation between $A-D-E$ groups and modular
invariants of affine SU(2).
","[{""version"":""v1"",""created"":""Thu, 17 Jul 1997 18:42:44 GMT""},{""version"":""v2"",""created"":""Tue, 22 Jul 1997 06:45:00 GMT""},{""version"":""v3"",""created"":""Wed, 6 Aug 1997 15:24:38 GMT""}]","2015-06-26"
"hep-th/9707159","Andre Leclair","A. LeClair, A. Ludwig, and G. Mussardo","Integrability of Coupled Conformal Field Theories","23 pages, four figures","Nucl.Phys. B512 (1998) 523-542","10.1016/S0550-3213(97)00724-4","ITP/97-081, ISAS/90/97/EP","hep-th cond-mat",,"  The massive phase of two-layer integrable systems is studied by means of RSOS
restrictions of affine Toda theories. A general classification of all possible
integrable perturbations of coupled minimal models is pursued by an analysis of
the (extended) Dynkin diagrams. The models considered in most detail are
coupled minimal models which interpolate between magnetically coupled Ising
models and Heisenberg spin-ladders along the $c<1$ discrete series.
","[{""version"":""v1"",""created"":""Thu, 17 Jul 1997 23:19:08 GMT""},{""version"":""v2"",""created"":""Fri, 18 Jul 1997 20:34:58 GMT""}]","2009-10-30"
"hep-th/9707160","Keith Dienes","Julie D. Blum and Keith R. Dienes (Institute for Advanced Study,
  Princeton)","Strong/Weak Coupling Duality Relations for Non-Supersymmetric String
  Theories","7 ounces by weight, LaTeX, 15 figures","Nucl.Phys.B516:83-159,1998","10.1016/S0550-3213(97)00803-1","IASSNS-HEP-97/80 (July 1997)","hep-th hep-ph",,"  Both the supersymmetric $SO(32)$ and $E_8\times E_8$ heterotic strings in ten
dimensions have known strong-coupling duals. However, it has not been known
whether there also exist strong-coupling duals for the non-supersymmetric
heterotic strings in ten dimensions. In this paper, we construct explicit
open-string duals for the circle-compactifications of several of these
non-supersymmetric theories, among them the tachyon-free $SO(16)\times SO(16)$
string. Our method involves the construction of heterotic and open-string
interpolating models that continuously connect non-supersymmetric strings to
supersymmetric strings. We find that our non-supersymmetric dual theories have
exactly the same massless spectra as their heterotic counterparts within a
certain range of our interpolations. We also develop a novel method for
analyzing the solitons of non-supersymmetric open-string theories, and find
that the solitons of our dual theories also agree with their heterotic
counterparts. These are therefore the first known examples of strong/weak
coupling duality relations between non-supersymmetric, tachyon-free string
theories. Finally, the existence of these strong-coupling duals allows us to
examine the non-perturbative stability of these strings, and we propose a phase
diagram for the behavior of these strings as a function of coupling and radius.
","[{""version"":""v1"",""created"":""Fri, 18 Jul 1997 03:21:31 GMT""}]","2009-08-18"
"hep-th/9707161","Hirofumi Yasuta","Hirofumi Yasuta (Ibaraki University)","Resummation of Vacuum Bubble Diagrams in Gaussian Propagator Model","8 pages, 5 figures, REVTeX","Phys.Lett. B418 (1998) 145-148","10.1016/S0370-2693(97)01493-7","IU-MSTP/22","hep-th quant-ph",,"  An imaginary part of the false-vacuum energy density in a metastable system,
i.e., the decay width due to quantum tunneling, might be reproduced by Borel
resummation of vacuum bubble diagrams. We examine the convergence of this
prescription in the Gaussian propagator model, in which the analytical
expression of vacuum bubbles to the ninth order of loop expansion is available.
","[{""version"":""v1"",""created"":""Fri, 18 Jul 1997 08:12:27 GMT""}]","2009-10-30"
"hep-th/9707162","Nofumi Kitsunezaki","Naofumi Kitsunezaki and Jun Nishimura (Nagoya Univ.)","Unitary IIB Matrix Model and the Dynamical Generation of the Space Time","30 pages, 1 Postscript figure, The final version accepted by NPB","Nucl.Phys. B526 (1998) 351-377","10.1016/S0550-3213(98)00404-0","DPNU-97-32","hep-th",,"  We propose a unitary matrix model as a regularization of the IIB matrix model
of Ishibashi-Kawai-Kitazawa-Tsuchiya (IKKT). The fermionic part is incorporated
using the overlap formalism in order to avoid unwanted ``doublers'' while
preserving the global gauge invariance. This regularization, unlike the one
adopted by IKKT, has manifest U(1)^10 symmetry, which corresponds to the
ten-dimensional translational invariance of the space time. We calculate
one-loop effective action around some typical BPS-saturated configurations in
the weak coupling limit. We also discuss a possible scenario for the dynamical
generation of the four-dimensional space time through spontaneous breakdown of
the U(1)^10 symmetry in the double scaling limit.
","[{""version"":""v1"",""created"":""Fri, 18 Jul 1997 08:37:42 GMT""},{""version"":""v2"",""created"":""Mon, 18 May 1998 07:38:06 GMT""}]","2009-10-30"
"hep-th/9707163","Anton Rebhan","A. Rebhan and P. van Nieuwenhuizen","No saturation of the quantum Bogomolnyi bound by two-dimensional
  supersymmetric solitons","23 pages, LATeX","Nucl.Phys. B508 (1997) 449-467","10.1016/S0550-3213(97)00625-1","TUW-97-12, ITP-SB 97-37","hep-th",,"  We reanalyse the question whether the quantum Bogomolnyi bound is saturated
in the two-dimensional supersymmetric kink and sine-Gordon models. Our starting
point is the usual expression for the one-loop correction to the mass of a
soliton in terms of sums over zero-point energies. To regulate these sums, most
authors put the system in a box with suitable boundary conditions, and impose
an ultraviolet cut-off. We distinguish between an energy cut-off and a mode
number cut-off, and show that they lead to different results. We claim that
only the mode cut-off yields correct results, and only if one considers exactly
the same number of bosonic and fermionic modes in the total sum over
bound-state and zero-point energies. To substantiate this claim, we show that
in the sine-Gordon model only the mode cut-off yields a result for the quantum
soliton mass that is consistent with the exact result for the spectrum as
obtained by Dashen et al. from quantising the so-called breather solution. In
the supersymmetric case, our conclusion is that contrary to previous claims the
quantum Bogomolnyi bound is not saturated in any of the two-dimensional models
considered.
","[{""version"":""v1"",""created"":""Fri, 18 Jul 1997 12:33:37 GMT""}]","2009-10-30"
"hep-th/9707164","Suresh Govindarajan","Suresh Govindarajan (University of Bonn, Germany)","Heterotic M(atrix) theory at generic points in Narain moduli space","LaTeX, 28 pages, no figures, Secs. 4.1 and 5.2 slightly modified,
  same conclusions","Nucl.Phys. B507 (1997) 589-608","10.1016/S0550-3213(97)00600-7","BONN-TH-97-08","hep-th",,"  Type II compactifications with varying string coupling can be described
elegantly in F-theory/M-theory as compactifications on U - manifolds. Using a
similar approach to describe Super Yang-Mills with a varying coupling constant,
we argue that at generic points in Narain moduli space, the $E_8 \times E_8$
Heterotic string compactified on $T^2$ is described in M(atrix) theory by N=4
SYM in 3+1 dimensions with base $S^1 \times CP^1$ and a holomorphically varying
coupling constant. The $CP^1$ is best described as the base of an elliptic K3
whose fibre is the complexified coupling constant of the Super Yang-Mills
theory leading to manifest U-duality. We also consider the cases of the
Heterotic string on $S^1$ and $T^3$. The twisted sector seems to (almost)
naturally appear at precisely those points where enhancement of gauge symmetry
is expected and need not be postulated. A unifying picture emerges in which the
U-manifolds which describe type II orientifolds (dual to the Heterotic string)
as M- or F- theory compactifications play a crucial role in Heterotic M(atrix)
theory compactifications.
","[{""version"":""v1"",""created"":""Fri, 18 Jul 1997 13:10:01 GMT""},{""version"":""v2"",""created"":""Wed, 30 Jul 1997 11:53:22 GMT""}]","2009-10-30"
"hep-th/9707165","Rainer Haeussling","Rainer H\""au{\ss}ling and Stephan Kappel","Complete control of gauge parameter dependence in the Abelian Higgs
  model","LaTeX 34pp","Eur.Phys.J.C4:543-556,1998","10.1007/s100520050227",,"hep-th",,"  We examine the dependence on all gauge parameters in the example of the
Abelian Higgs model by applying a general algebraic method which roots in an
extension of the usual Slavnov-Taylor identity. This method automatically
yields all information about the gauge parameter dependence of Green functions
and therefore especially allows to control the range of ``good'' normalization
conditions. In this context we show that the physical on-shell normalization
conditions are in complete agreement with the restrictions dictated by the
enlarged Slavnov-Taylor identity and that the coupling can be fixed in an
easily handleable way on the Ward identity of local gauge invariance. As an
application of the general method we also study the Callan-Symanzik equation
and the renormalization group equation of the Abelian Higgs model.
","[{""version"":""v1"",""created"":""Fri, 18 Jul 1997 13:45:49 GMT""}]","2016-08-15"
"hep-th/9707166","Andreas U. Schnmidt","Andreas U. Schmidt","Mathematical Problems of Gauge Quantum Field Theory: A Survey on the
  Schwinger Model","22 pages, AMSTeX with PICTeX macros. Typos corrected, reference
  added. v3: further references added, introduction and abstract updated","Universitatis Iagellonicae Acta Math., Fasc. XXXIV, 113-134 (1997)",,,"hep-th funct-an math.FA",,"  This extended write-up of a talk gives an introductory survey of mathematical
problems of the quantization of gauge systems. Using the Schwinger model as an
exactly tractable but nontrivial example which exhibits general features of
gauge quantum field theory, I cover the following subjects: The axiomatics of
quantum field theory, formulation of quantum field theory in terms of Wightman
functions, reconstruction of the state space, the local formulation of gauge
theories, indefiniteness of the Wightman functions in general and in the
special case of the Schwinger model, the state space of the Schwinger model,
special features of the model. New results are contained in the Mathematical
Appendix, where I consider in an abstract setting the Pontrjagin space
structure of a special class of indefinite inner product spaces - the so called
quasi-positive ones. This is motivated by the indefinite inner product space
structure appearing in the above context and generalizes results of Morchio and
Strocchi [J. Math. Phys. 31 (1990) 1467], and Dubin and Tarski [J. Math. Phys.
7 (1966) 574].
","[{""version"":""v1"",""created"":""Fri, 18 Jul 1997 14:24:44 GMT""},{""version"":""v2"",""created"":""Thu, 20 Dec 2001 15:55:29 GMT""},{""version"":""v3"",""created"":""Mon, 4 Mar 2002 11:47:20 GMT""}]","2008-02-03"
"hep-th/9707167","Sangmin Lee","Sangmin Lee and Larus Thorlacius (Princeton University)","Strings and D-Branes at High Temperature","8 pages, LaTeX, 1 figure","Phys.Lett.B413:303-310,1997","10.1016/S0370-2693(97)01105-2","PUPT-1708","hep-th",,"  The thermodynamics of a gas of strings and D-branes near the Hagedorn
transition is described by a coupled set of Boltzmann equations for weakly
interacting open and closed long strings. The resulting distributions are
dominated by the open string sector, indicating that D-branes grow to fill
space at high temperature.
","[{""version"":""v1"",""created"":""Fri, 18 Jul 1997 15:00:41 GMT""}]","2008-11-26"
"nucl-th/9707027",,"H. Nakada and Y. Alhassid","Total and Parity-Projected Level Densities of Iron-Region Nuclei in the
  Auxiliary Fields Monte Carlo Shell Model","14 pages, 3 Postscript figures included, RevTex","Phys.Rev.Lett. 79 (1997) 2939-2942","10.1103/PhysRevLett.79.2939",,"nucl-th",,"  We use the auxiliary-fields Monte Carlo method for the shell model in the
complete $(pf+0g_{9/2})$-shell to calculate level densities. We introduce
parity projection techniques which enable us to calculate the parity dependence
of the level density. Results are presented for $^{56}$Fe, where the calculated
total level density is found to be in remarkable agreement with the
experimental level density. The parity-projected densities are well described
by a backshifted Bethe formula, but with significant dependence of the
single-particle level-density and backshift parameters on parity. We compare
our exact results with those of the thermal Hartree-Fock approximation.
","[{""version"":""v1"",""created"":""Thu, 17 Jul 1997 20:54:58 GMT""}]","2009-10-30"
