"nucl-th/9707028","A. M. Sandorfi","A.M. Sandorfi, J. Tonnison and S. Hoblit","Constraining the (gamma,pi) amplitude for E2 N->delta","Submitted as a Comment to Physical Review Letters; RevTEX file/1 page",,,,"nucl-th",,"  A recent analysis of pion photo-production multipoles using p(g,pi0) data
from Mainz is repeated, successively adding constraints from other observables
and varying the number of fitted partial waves. The original analysis is shown
to have been underconstrained and suffered from ambiguities. The inclusion of
additional observables in our analysis results in a very different, but stable,
ratio of E2/M1 multipoles at the delta that is consistent with the Mainz data
set.
","[{""version"":""v1"",""created"":""Thu, 17 Jul 1997 23:41:09 GMT""},{""version"":""v2"",""created"":""Fri, 18 Jul 1997 01:00:52 GMT""}]","2008-02-03"
"nucl-th/9707029","U. Meissner","C. Hanhart, J. Haidenbauer, M. Hoffmann, Ulf-G. Mei{\ss}ner, J.Speth","The reactions $pp\to pp\pi^0$ and $pp\to d\pi^+$ at threshold: The role
  of the isoscalar $\pi N$ scattering amplitude","12 pp, LaTeX file, 4 figures (uses epsf), enlarged version, accepted
  for publication in Phys. Lett. B","Phys.Lett. B424 (1998) 8-14","10.1016/S0370-2693(98)00216-0","KFA-IKP(TH)-1997-14","nucl-th",,"  We examine the role of the elementary isoscalar pion--nucleon scattering
amplitude in the description of the processes $pp \to pp\pi^0$ and $pp\to
d\pi^+$ at threshold. We argue that the presently used tree level dimension two
approximation used in chiral perturbation theory is insufficient as input by
direct comparison with the $\pi$N scattering data. We also show that a
successful semi--phenomenological boson--exchange model does better in the
description of these data. The influence of the violation of crossing symmetry
in the meson--exchange model has to be studied in more detail. We stress that
further investigations of the process $pp\to d\pi^+$ can pave the way to a
deeper understanding of the pion dominated part of the transition operator.
","[{""version"":""v1"",""created"":""Fri, 18 Jul 1997 07:50:05 GMT""},{""version"":""v2"",""created"":""Tue, 28 Apr 1998 14:55:51 GMT""}]","2009-10-30"
"q-alg/9707024","Oh Choo Hiap","L.C. Kwek and C.H. Oh","Some comments on $q$-deformed oscillators and $q$-deformed $su(2)$
  algebras","Needs Ljour2.sty and subeqnarray. Changes made to text with some
  references added. To appear in Z. Phys. 1998",,"10.1007/s100529800816",,"q-alg hep-th math.QA",,"  The various relations between $q$-deformed oscillators algebras and the
$q$-deformed $su(2)$ algebras are discussed. In particular, we exhibit the
similarity of the $q$-deformed $su(2)$ algebra obtained from $q$-oscillators
via Schwinger construction and those obtained from $q$-Holstein-Primakoff
transformation and show how the relation between $su_{\sqrt{q}}(2)$ and Hong
Yan $q$-oscillator can be regarded as an special case of In\""{o}u\""{e}- Wigner
contraction. This latter observation and the imposition of positive norm
requirement suggest that Hong-Yan $q$-oscillator algebra is different from the
usual $su_{\sqrt{q}}(2)$ algebra, contrary to current belief in the literature.
","[{""version"":""v1"",""created"":""Fri, 18 Jul 1997 03:16:03 GMT""},{""version"":""v2"",""created"":""Tue, 16 Dec 1997 06:59:15 GMT""}]","2015-06-26"
"quant-ph/9707036","Judy Mack","Susumu Okubo","Lorentz-Invariant Hamiltonian and Riemann Hypothesis","13 pages, TEX","J.Phys.A31:1049-1057,1998","10.1088/0305-4470/31/3/015","UR-1502","quant-ph",,"  We have given some arguments that a two-dimensional Lorentz-invariant
Hamiltonian may be relevant to the Riemann hypothesis concerning zero points of
the Riemann zeta function. Some eigenfunction of the Hamiltonian corresponding
to infinite-dimensional representation of the Lorentz group have many
interesting properties. Especially, a relationship exists between the zero zeta
function condition and the absence of trivial representations in the wave
function.
","[{""version"":""v1"",""created"":""Thu, 17 Jul 1997 16:01:22 GMT""}]","2008-11-26"
"quant-ph/9707037","Manfred Leubner","C.W. Gardiner, P. Zoller, R.J. Ballagh and M.J. Davis","Kinetics of Bose-Einstein Condensation in a Trap","9 pages, Revtex","Phys.Rev.Lett. 79 (1997) 1793-1796","10.1103/PhysRevLett.79.1793",,"quant-ph",,"  The formation process of a Bose-Einstein condensate in a trap is described
using a master equation based on quantum kinetic theory, which can be well
approximated by a description using only the condensate mode in interaction
with a thermalized bath of noncondensate atoms. A rate equation of the form n =
2W(n)[(1-exp((mu_n - mu)/kT))n + 1] is derived, in which the difference between
the condensate chemical potential mu_n and the bath chemical potential mu gives
the essential behavior. Solutions of this equation, in conjunction with the
theoretical description of the process of evaporative cooling, give a
characteristic latency period for condensate formation and appear to be
consistent with the observed behavior of both rubidium and sodium condensate
formation.
","[{""version"":""v1"",""created"":""Fri, 18 Jul 1997 12:15:14 GMT""}]","2009-10-30"
