"adap-org/9707007","Grant Lythe","G.D. Lythe (DAMTP, University of Cambridge)","Noise and dynamic transitions","Plain Tex, 7 pages, 2 postscript figures included",,,,"adap-org nlin.AO",,"  A parabolic stochastic PDE is studied analytically and numerically, when a
bifurcation parameter is slowly increased through its critical value. The aim
is to understand the effect of noise on delayed bifurcations in systems with
spatial degrees of freedom. Realisations of the nonautonomous stochastic PDE
remain near the unstable configuration for a long time after the bifurcation
parameter passes through its critical value, then jump to a new configuration.
The effect of the nonlinearity is to freeze in the spatial structure formed
from the noise near the critical value.
","[{""version"":""v1"",""created"":""Thu, 31 Jul 1997 05:13:42 GMT""}]","2008-02-03"
"adap-org/9707008","Grant Lythe","G.D. Lythe (DAMTP, University of Cambridge)","A noise-controlled dynamic bifurcation","Plain Tex, 10 pages, 2 postscript figures included",,,,"adap-org nlin.AO",,"  We consider a slow passage through a point of loss of stability. If the
passage is sufficiently slow, the dynamics are controlled by additive random
disturbances, even if they are extremely small. We derive expressions for the
`exit value' distribution when the parameter is explicitly a function of time
and the dynamics are controlled by additive Gaussian noise. We derive a new
expression for the small correction introduced if the noise is coloured
(exponentially correlated). There is good agreement with results obtained from
simulation of sample paths of the appropriate stochastic differential
equations. Multiplicative noise does not produce noise-controlled dynamics in
this fashion.
","[{""version"":""v1"",""created"":""Thu, 31 Jul 1997 06:11:25 GMT""}]","2008-02-03"
"alg-geom/9707017","Andre. Hirschowitz","A. Hirschowitz and S. Ramanan","New evidence for Green's conjecture on syzygies of canonical curves","Tex-type: LaTeX",,,,"alg-geom math.AG",,"  We prove that two weakened forms of Green's conjectures for canonical curves
are equivalent when the genus $g$ is odd.
","[{""version"":""v1"",""created"":""Thu, 31 Jul 1997 11:27:37 GMT""}]","2008-02-03"
"astro-ph/9707336","Katherine Blundell","Katherine M. Blundell, Steve Rawlings (Oxford), Stephen A. Eales
  (Cardiff), Gregory B. Taylor (NRAO-Socorro) and Alistair D. Bradley (Oxford,
  Birmingham)","A sample of 6C radio sources designed to find objects at redshift > 4:
  the radio data","18 pages, LaTeX; also available at
  http://www-astro.physics.ox.ac.uk/research/preprints/ To appear in MNRAS",,"10.1046/j.1365-8711.1998.01143.x",,"astro-ph",,"  We describe the selection of a sample of 34 radio sources from the 6C survey
(Hales, Baldwin & Warner 1993) from a region of sky covering 0.133 sr. The
selection criteria for this sample, hereafter called 6C*, were chosen to
optimise the chances of finding radio galaxies at redshift z > 4. Optical
follow-up observations have already led to the discovery of the most distant
known radio galaxy at z = 4.41 (Rawlings et al. 1996). We present VLA radio
maps and derive radio spectra for all the 6C* objects.
","[{""version"":""v1"",""created"":""Wed, 30 Jul 1997 20:25:07 GMT""}]","2009-10-30"
"astro-ph/9707338","Ron Remillard","Ronald A. Remillard and Alan M. Levine","The RXTE All Sky Monitor: First Year of Performance","6 pages Latex including 4 postscript figures. To be published in
  ""All-Sky X-ray Observations in the Next Decade"", proceedinmg of the Roiken
  Workshop held in Waco, Japan, March, 1997. Eds. M. Matsuoka and N. Kawai",,,,"astro-ph",,"  The RXTE All Sky Monitor provides a public database that includes more than
one year of X-ray monitoring observations (2-12 keV) of X-ray binaries and a
few active galactic nuclei. The instrument operates with a 40% duty cycle, and
the exposures yield roughly 5 celestial scans per day. There have been 109
source detections, including 16 X-ray transients, the majority of which are
recurrent cases. The two sources of relativistic radio jets have exhibited
particularly complex light curves and new types of emission states. Progress
has been achieved in understanding the outburst mechanism via the reported
detection of an optical precursor to the April 1996 X-ray outburst in GRO
J1655-40. The ASM has also detected state changes in both Cyg X-1 and Cyg X-3,
leading to new constraints on the accretion disk geometry associated with the
``soft/high'' state. X-ray variations are seen in extragalactic nuclei, such as
NGC4151 and Mkn501, providing new opportunities for multifrequency timing or
spectral studies. The ASM archive empowers observers with the opportunity for
state-dependent observing programs with RXTE and other instruments. The ASM
also provides a long-term context for source behavior, and this knowledge may
be crucial in shaping the interpretation of brief observations with other
telescopes.
","[{""version"":""v1"",""created"":""Wed, 30 Jul 1997 17:49:38 GMT""}]","2009-09-25"
"astro-ph/9707339","Mike Balogh","Mike. L. Balogh, Simon L. Morris, H. K. C. Yee, R. G. Carlberg and E.
  Ellingson","Star Formation in Cluster Galaxies at 0.2<z<0.55","aasms4 latex, 3 postscript figures, accepted for publication in ApJ
  Letters. Also available at http://astrowww.phys.uvic.ca/~balogh/","Astrophys.J.488:L75-L78,1997","10.1086/310927",,"astro-ph",,"  The rest frame equivalent width of the [OII]3727 emission line, W(OII), has
been measured for cluster and field galaxies in the CNOC redshift survey of
rich clusters at 0.2<z<0.55. Emission lines of any strength in cluster galaxies
at all distances from the cluster centre, out to 2R_{200}, are less common than
in field galaxies. The mean W(OII) in cluster galaxies more luminous than
M_r^k<-18.5 + 5\log h (q_o=0.1) is 3.8 \pm 0.3 A (where the uncertainty is the
1 sigma error in the mean), significantly less than the field galaxy mean of
11.2 \pm 0.3 A. For the innermost cluster members (R<0.3R_{200}), the mean
W(OII) is only 0.3 \pm 0.4 A. Thus, it appears that neither the infall process
nor internal tides in the cluster induce detectable excess star formation in
cluster galaxies relative to the field. The colour-radius relation of the
sample is unable to fully account for the lack of cluster galaxies with
W(OII)>10 A, as expected in a model of cluster formation in which star
formation is truncated upon infall. Evidence of supressed star formation
relative to the field is present in the whole cluster sample, out to 2 R_{200},
so the mechanism responsible for the differential evolution must be acting at a
large distance from the cluster centre, and not just in the core. The mean star
formation rate in the cluster galaxies with the strongest emission corresponds
to an increase in the total stellar mass of less than about 4% if the star
formation is due to a secondary burst lasting 0.1 Gyr.
","[{""version"":""v1"",""created"":""Wed, 30 Jul 1997 19:49:14 GMT""}]","2009-10-05"
"astro-ph/9707340",,"H. T. Freudenreich","COBE's Galactic Bar and Disk","30 pages, LaTeX, with 15 figures, 3 JPG and 12 GIF. Accepted by ApJ.
  Corrected a factor-of-2 error in total luminosity and replaced 2 corrupted
  JPEG files. Relevant images of the Galactic J-K and K-L colors can be found
  at http://www.gsfc.nasa.gov/astro/cobe/dirbe_image.html","Astrophys.J.492:495-510,1998","10.1086/305065",,"astro-ph",,"  A model of the bar and old stellar disk of the Galaxy has been derived from
the survey of the Diffuse Infrared Background Experiment (DIRBE) of the Cosmic
Background Explorer at wavelengths of 1.25, 2.2, 3.5, and 4.9 microns. It
agrees very well with the data, except in directions in which the near-
infrared optical depth is high. Among the conclusions drawn from the model: The
Sun is located approximately 16.5 pc above the midpoint of the Galactic plane.
The disk has an outer edge four kpc from the Sun, and is warped like the HI
layer. It has a central hole roughly the diameter of the inner edge of the
""three-kiloparsec"" molecular cloud ring, and within that hole lies a bright,
strong, ""early-type"" bar, tilted approximately 14 degrees from the Sun-Galactic
center line. The model has 47 free parameters. The model is discussed in detail
and contour plots and images of the residuals presented.
","[{""version"":""v1"",""created"":""Wed, 30 Jul 1997 19:42:46 GMT""},{""version"":""v2"",""created"":""Thu, 31 Jul 1997 19:33:38 GMT""},{""version"":""v3"",""created"":""Mon, 4 Aug 1997 19:26:49 GMT""}]","2009-07-09"
"astro-ph/9707341","Steve Zepf","Stephen E. Zepf (UC Berkeley and Yale), Reinaldo R. de Carvalho
  (Observatorio Nacional, Brazil), Andre L.B. Ribeiro (DAS/INPE, Brazil)","The Faint End of the Luminosity Function of Galaxies in Compact Groups","8 LaTex pages and 3 postscript figures, to appear in ApJ Letters",,,,"astro-ph",,"  We study the luminosity function of galaxies in Hickson groups using our
recent redshift survey of galaxies in and around 17 of these groups. We find
that the galaxies in these regions have a luminosity function with M* = -19.5 +
5 log h, and alpha = -1.0, where M* and alpha are the usual parameters in the
standard Schechter form of the luminosity function, and the magnitudes are
measured in the B band. The formal 95% confidence intervals for M* and alpha
range from (-19.3,-0.8), to (-19.7,-1.2) and are highly correlated as is usual
for these fits. This luminosity function for galaxies in our Hickson group
sample is very similar from that found in large surveys covering a range of
environments. These values are also consistent with our earlier estimates based
on a photometric analysis with statistical background correction, and do not
support previous suggestions of an underabundance of intrinsically faint
galaxies in compact groups. We confirm our earlier finding that the fainter
galaxies are more diffusely distributed within individual groups than the
brighter ones. This can be interpreted either as evidence for mass segregation
within the groups or as the result of the selection procedure for Hickson
groups.
","[{""version"":""v1"",""created"":""Wed, 30 Jul 1997 23:46:16 GMT""}]","2007-05-23"
"astro-ph/9707342","Litvine D. Litvak M. or Alisov A.","I. G. Mitrofanov (Space Research Institute, Moscow, Russia)","Resent Models of Cosmic Gamma Ray Bursts and Needs for Future
  Observations","Invited talk at the workshop on ""All-sky X-ray observations in the
  next decade"", held at RIKEN,Tokyo,March 3-5, 1997; 20 pages, Latex, uses
  aasms4.sty",,,,"astro-ph",,"  The paper presents the nowdays definition of the phenomenon of cosmic gamma
ray bursts, refers to the main alternative models of their origin and proposes
three promising domains of new observations in the incoming decade.
","[{""version"":""v1"",""created"":""Thu, 31 Jul 1997 07:18:20 GMT""}]","2007-05-23"
"astro-ph/9707343","Andreas Burkert","A. Burkert (MPIA, Heidelberg), J. Silk (UC, Berkeley)","Dark baryons and rotation curves","16 pages LaTeX, 2 postscript figures. To be published in The
  Astrophysical Journal, Letters",,"10.1086/310935",,"astro-ph",,"  The best measured rotation curve for any galaxy is that of the dwarf
spiralXXXX DDO 154, which extends out to about 20 disk scale lengths. It
provides an ideal laboratory for testing the universal density profile
prediction from high resolution numerical simulations of hierarchical
clustering in cold dark matter dominated cosmological models. We find that the
observed rotation curve cannot be fit either at small radii, as previously
noted, or at large radii. We advocate a resolution of this dilemma by
postulating the existence of a dark spheroid of baryons amounting to several
times the mass of the observed disk component and comparable to that of the
cold dark matter halo component. Such an additional mass component provides an
excellent fit to the rotation curve provided that the outer halo is still cold
dark matter-dominated with a density profile and mass-radius scaling relation
as predicted by standard CDM-dominated models. The universal existence of such
dark baryonic spheroidal components provides a natural explanation of the
universal rotation curves observed in spiral galaxies, may have a similar
origin and composition to the local counterpart that has been detected as
MACHOs in our own galactic halo via gravitational microlensing, and is
consistent with, and even motivated by, primordial nucleosynthesis estimates of
the baryon fraction.
","[{""version"":""v1"",""created"":""Thu, 31 Jul 1997 11:02:17 GMT""}]","2009-10-30"
"astro-ph/9707344","Shude Mao","S. Mao and H.J. Mo","On the Physical Connections between Galaxies of Different Types","21 pages with 4 figures (reference list updated)",,"10.1046/j.1365-8711.1998.01406.x",,"astro-ph",,"  Galaxies can be classified in two broad sequences which are likely to reflect
their formation mechanism. The `main sequence', consisting of spirals,
irregulars and all dwarf galaxies, is probably produced by gas settling within
dark matter haloes. We show that the sizes and surface densities along this
sequence are primarily determined by the distributions of the angular momentum
and formation time of dark haloes. They are well reproduced by current
cosmogonies provided that galaxies form late, at $z \la 2$. In this scenario,
dwarf ellipticals were small `disks' at $z\sim 1$ and become `ellipticals'
after they fall into cluster environments. The strong clustering of dwarf
ellipticals is then a natural by-product of the merging and transformation
process. The number of dwarf galaxies predicted in a cluster such as Virgo is
in good agreement with the observed number. On the other hand, the `giant
branch', consisting of giant ellipticals and bulges, is probably produced by
the merging of disk galaxies. Based on the observed phase-space densities of
galaxies, we show that the main bodies of all giant ellipticals can be produced
by dissipationless mergers of high-redshift disks. However, high-redshift
disks, although denser than present-day ones, are still not compact enough to
produce the high central phase space density of some low-luminosity
ellipticals. Dissipation must have occurred in the central parts of these
galaxies during the merger which formed them.
","[{""version"":""v1"",""created"":""Thu, 31 Jul 1997 12:03:04 GMT""},{""version"":""v2"",""created"":""Mon, 4 Aug 1997 16:30:41 GMT""}]","2009-10-30"
"astro-ph/9707345","Ofer Lahav","O. Lahav, N. Brosch, E. Goldberg, G.K.T. Hau, R.C. Kraan-Korteweg, and
  A.J. Loan","Galaxy Candidates in the Zone of Avoidance","11 pages; Latex + 5 figures (gif format), Submitted to MNRAS",,"10.1046/j.1365-8711.1998.01686.x",,"astro-ph",,"  Motivated by recent discoveries of nearby galaxies in the Zone of Avoidance,
we conducted a pilot study of galaxy candidates at low Galactic latitude, near
Galactic longitude $l \sim 135^0$, where the Supergalactic Plane is crossed by
the Galactic Plane. We observed with the 1m Wise Observatory in the I-band 18
of the `promising' candidates identified by visual examination of Palomar red
plates by Hau et al. (1995). A few candidates were also observed in R or B
bands, or had spectroscopic observations performed at the Isaac Newton
Telescope and at the Wise Observatory. Our study suggests that there are
probably 10 galaxies in this sample. We also identify a probable Planetary
Nebula. The final confirmation of the nature of these sources must await the
availability of full spectroscopic information. The success rate of $\sim 50%$
in identifying galaxies at Galactic latitude $|b|<5^\circ$ indicates that the
ZOA is a bountiful region to discover new galaxies.
","[{""version"":""v1"",""created"":""Thu, 31 Jul 1997 14:02:23 GMT""}]","2009-10-30"
"astro-ph/9707347","Monica Colpi","M. Colpi and A. Pallavicini","Drag on a satellite moving across a spherical galaxy. I. Tidal and
  frictional forces in shortlived encounters","22 pages, Tex + 5 .ps figures Submitted to The Astrophysical Journal",,"10.1086/305877",,"astro-ph",,"  We derive a formalism, within the theory of linear response, for the analysis
of the interaction of a satellite (the perturber) with a spherical galaxy whose
equilibrium is described by a one-particle distribution function. We compute
the formal expression of the force on the satellite including the self-gravity
of the stars and the shift of the stellar center of mass. We apply the
perturbative technique to the case of a satellite moving at high speed across a
stellar system and find a natural decomposition of the force into a global
component resulting from the tidal interaction and a component that is related
to dynamical friction. When the satellite orbits outside the galaxy, we derive
the force in the impulse approximation. In penetrating shortlived encounters,
the wake excited in the density field is responsible for most of the
deceleration. We find that dynamical friction rises from a memory effect
involving only those stars perturbed along the path. The force can be written
in terms of an effective Coulomb logarithm which now depends on the dynamical
history. It is derived for two simple equilibrium density distributions. In the
case of a homogeneous cloud, we compute the total energy loss: Tides excited by
the satellite in the galaxy reduce the value of the energy loss by friction.
","[{""version"":""v1"",""created"":""Thu, 31 Jul 1997 15:40:06 GMT""}]","2009-10-30"
"astro-ph/9707348","Monica Colpi","M. Colpi","Accretion of a satellite onto a spherical galaxy. II. Binary evolution
  and orbital decay","13 pages, Tex,+ 10 .ps figures Submitted to The Astrophysical Journal",,"10.1086/305878",,"astro-ph",,"  We study the dynamical evolution of a satellite orbiting outside of a
companion spherical galaxy. The satellite is subject to a back-reaction force
resulting from the density fluctuations excited in the primary stellar system.
We evaluate this force using the linear response theory developed in Colpi and
Pallavicini (1997). The force is computed in the reference frame comoving with
the primary galaxy and is expanded in multipoles. To capture the relevant
features of the physical process determining the evolution of the detached
binary, we introduce in the Hamiltonian the harmonic potential as interaction
potential among stars. The dynamics of the satellite is computed
self-consistently. We determine the conditions for tidal capture of a satellite
from an asymptotic free state. If the binary comes to existence as a bound
pair, stability against orbital decay is lost near resonance. The time scale of
binary coalescence is computed as a function of the eccentricity and mass
ratio. In a comparison with Weinberg's perturbative technique we demonstrate
that pinning the center of mass of the galaxy would induce a much larger torque
on the satellite.
","[{""version"":""v1"",""created"":""Thu, 31 Jul 1997 15:41:00 GMT""}]","2009-10-30"
"cond-mat/9707315","Paolo Tommasini","Arthur K. Kerman and Paolo Tommasini","Gaussian Time-Dependent Variational Principle for Bosons I - Uniform
  Case","28 pages, 1 figure to appear in Annals of Physics",,"10.1006/aphy.1997.5723",,"cond-mat",,"  We investigate the Dirac time-dependent variational method for a system of
non-ideal Bosons interacting through an arbitrary two body potential. The
method produces a set of non-linear time dependent equations for the
variational parameters. In particular we have considered small oscillations
about equilibrium. We obtain generalized RPA equations that can be understood
as interacting quasi-bosons, usually mentioned in the literature as having a
gap. The result of this interaction provides us with scattering properties of
these quasi-bosons including possible bound-states, which can include zero
modes. In fact the zero mode bound state can be interpreted as a new
quasi-boson with a gapless dispersion relation. Utilizing these results we
discuss a straightforward scheme for introducing temperature.
","[{""version"":""v1"",""created"":""Wed, 30 Jul 1997 16:09:31 GMT""}]","2016-08-31"
"cond-mat/9707316",,"Anirvan M. Sengupta","Spin in a Fluctuating Field: The Bose (+Fermi) Kondo models","4 pages, 2 eps figures (uses epsfig)",,,,"cond-mat.str-el",,"  I consider models with an impurity spin coupled to a fluctuating gaussian
field with or without additional Kondo coupling of the conventional sort. In
the case of isotropic fluctuations, the renormalisation group flows for these
models have controlled fixed points when the autocorrelation of the gaussian
field $h(t)$, $<T h(t) h(0)> \sim {1\over t^{2-\epsilon}}$ with small positive
$\epsilon$. In absence of any additional Kondo coupling, I get powerlaw decay
of spin correlators, $<T S(t) S(0)> \sim {1\over t^{\epsilon}}$ . For negative
$\epsilon$, the spin autocorrelation is constant in long time limit. The
results agree with calculations in Schwinger Boson mean field theory. In
presence of a Kondo coupling to itinerant electrons, the model shows a phase
transition from a Kondo phase to a field fluctuation dominated phase. These
models are good starting points for understanding behaviour of impurities in a
system near a zero-temperature magnetic transition. They are also useful for
understanding the dynamical local mean field theory of Kondo lattice with
Heisenberg (spin-glass type) magnetic interactions.
","[{""version"":""v1"",""created"":""Wed, 30 Jul 1997 16:17:10 GMT""}]","2008-02-03"
"cond-mat/9707317","Ronald Fisch","Ronald Fisch","Power-law correlations and orientational glass in random-field
  Heisenberg models","8 pages, 12 Postscript figures","Phys. Rev. B, 57 (1998) 269","10.1103/PhysRevB.57.269",,"cond-mat.dis-nn cond-mat.stat-mech",,"  Monte Carlo simulations have been used to study a discretized Heisenberg
ferromagnet (FM) in a random field on simple cubic lattices. The spin variable
on each site is chosen from the twelve [110] directions. The random field has
infinite strength and a random direction on a fraction x of the sites of the
lattice, and is zero on the remaining sites. For x = 0 there are two phase
transitions. At low temperatures there is a [110] FM phase, and at intermediate
temperature there is a [111] FM phase. For x > 0 there is an intermediate phase
between the paramagnet and the ferromagnet, which is characterized by a
|k|^(-3) decay of two-spin correlations, but no true FM order. The [111] FM
phase becomes unstable at a small value of x. At x = 1/8 the [110] FM phase has
disappeared, but the power-law correlated phase survives.
","[{""version"":""v1"",""created"":""Wed, 30 Jul 1997 16:19:52 GMT""}]","2009-10-30"
"cond-mat/9707318","Paolo Tommasini","Arthur K. Kerman and Paolo Tommasini","Gaussian Time-Dependent Variational Principle for Bosons Contact
  Interaction in one dimension","29 pages, 5 figures",,"10.1103/PhysRevB.56.14733",,"cond-mat",,"  We investigate the Dirac time-dependent variational method using a Gaussian
trial functional for an infinite one dimensional system of Bosons interacting
through a repulsive contact interaction. The method produces a set of
non-linear time dependent equations for the variational parameters. By solving
the static equations we have calculated the ground state energy per particle.
We have also considered small oscillations about equilibrium and obtain mode
equations which lead us to a gapless dispersion relation. The existence of an
exact numerical solution for the ground state energy and excitations obtained
by Lieb allow us to compare with the Gaussian results. We can also, as the
system becomes less dilute, see the improvement of the results as compared with
the Bogoliubov scheme.
","[{""version"":""v1"",""created"":""Wed, 30 Jul 1997 16:24:53 GMT""}]","2009-10-30"
"cond-mat/9707319","Paolo Tommasini","Eddy Timmermans and Paolo Tommasini","Thomas-Fermi Description of Incoherent Light Scattering from an
  Atomic-Trap BEC","12 pages,1 figure",,,,"cond-mat",,"  We present a Thomas-Fermi treatment of resonant incoherent scattering of
low-intensity light by a dilute spatially confined Bose-Einstein condensate.
The description gives simple analytical results and allows scattering data from
finite-size condensates to be interpreted in terms of the properties of the
homogeneous BEC-system. As an example, we show how the energy dispersion of the
elementary excitations can be measured from scattering by a finite-size
atomic-trap condensate. As a second example, we point out that a near-resonant
scattering experiment can observe quasi-particle creation caused by particle
annihilation.
","[{""version"":""v1"",""created"":""Wed, 30 Jul 1997 20:17:34 GMT""},{""version"":""v2"",""created"":""Thu, 31 Jul 1997 17:43:04 GMT""}]","2008-02-03"
