"cond-mat/9707320","Ben Yu-Kuang Hu","Ben Yu-Kuang Hu","Optical phonon induced frictional drag in coupled two-dimensional
  electron gases","Revtex, 14 pages, 2 postscript figures",,,"MIC-BYKH-97-3","cond-mat.mes-hall",,"  The role of optical-phonons in frictional drag between two adjacent but
electrically isolated two-dimensional electron gases is investigated. Since the
optical-phonons in III-V materials have a considerably larger coupling to
electrons than acoustic phonons (which are the dominant drag mechanism at low T
and large separations) it might be expected that the optical phonons will give
a large effect high temperatures. The two key differences between optical and
acoustic phonon mediated drag are: (1) the optical phonon mediated interlayer
interaction is short-ranged due to their negligible group velocity at the
Brillouin zone center; and (2) the typical momentum transfer for an optical
phonon mediated scattering is relatively large. These considerations make
optical phonon mediated drag difficult to see in single subband GaAs systems,
but it may be possible to see the effect in double subband GaAs systems or
single subband quantum wells in a material with a lower effective mass and
lower optical phonon energy such as InSb.
","[{""version"":""v1"",""created"":""Wed, 30 Jul 1997 20:37:35 GMT""}]","2008-02-03"
"cond-mat/9707321","Eddy Timmermans","Eddy Timmermans and Paolo Tommasini","Resonant Light Scattering to Measure BEC-Pairing","11 pages,1 figure",,,,"cond-mat",,"  We present a single-scattering formalism for incoherent resonant light
scattering by dilute quantum gas systems such as the atomic-trap Bose-Einstein
condensates. We show that resonant scattering gives access to more information
than the dynamical structure factor, familiar from non-resonant scattering. In
particular, we show that the detuning dependence of the incoherent scattering
cross-section allows the direct determination of the BEC pairing density $<
\psi \psi >$, which is a broken symmetry and provides evidence that the
condensate is not in a good number state.
","[{""version"":""v1"",""created"":""Wed, 30 Jul 1997 20:54:43 GMT""}]","2009-09-25"
"cond-mat/9707322","Eddy Timmermans","Eddy Timmermans and Paolo Tommasini","Quasi-Homogeneous Dynamical Structure Factor for Atomic-Trap Bose
  Condensates","13 pages, 1 figure",,,,"cond-mat",,"  The essence of the Thomas-Fermi model is the assumption that the local
behavior of a many-body system can be approximated by that of a homogeneous
system. In this paper, we present the natural extension of the static
Thomas-Fermi treatment of dilute Bose condensates, by describing the dynamical
behavior of the condensate in the same quasi-homogeneous approximation. In
particular, we calculate the dynamical structure factor $S(q, \omega)$ of a
low-temperature condensate, confined in a harmonic oscillator trap. The result
is a remarkably simple analytical function, which, with the proper
interpretation, gives a powerful and insightful description of the scattering
properties of the BEC-system.
","[{""version"":""v1"",""created"":""Wed, 30 Jul 1997 21:02:10 GMT""}]","2009-09-25"
"cond-mat/9707323","Eddy Timmermans","E. Timmermans and R. Cote","Superfluidity in sympathetic cooling with atomic Bose condensates","13 pages,2 figures",,"10.1103/PhysRevLett.80.3419",,"cond-mat",,"  The dynamical structure of an atomic Bose-Einstein condensate limits the
efficiency of the condensate in cooling slow impurity atoms. To illustrate the
point, we show that an impurity atom moving in a homogeneous zero-temperature
condensate is not scattered incoherently if its velocity is lower than the
condensate sound velocity $c$, limiting cooling to velocities $v \geq c$. This
striking effect is an expression of superfluidity and provides a direct means
to detect the fundamental property of superfluidity in atomic condensates.
Furthermore, we show that the fermionic lithium-isotope, $^{6}$Li, is a
reasonable candidate for sympathetic cooling by a $^{23}$Na-condensate.
","[{""version"":""v1"",""created"":""Wed, 30 Jul 1997 21:15:35 GMT""}]","2009-10-30"
"cond-mat/9707324","R. J. Radtke","R. J. Radtke, S. Das Sarma and A. H. MacDonald","Mode Mixing in Antiferromagnetically Correlated Double Quantum Wells","12 pages, 6 figures, submitted to Phys. Rev. B",,"10.1103/PhysRevB.57.2342",,"cond-mat.mes-hall",,"  We examine the robustness of a recently predicted exchange-induced zero-field
magnetic phase in semiconductor double quantum wells in which each well is
spin-polarized and the polarization vectors are antiparallel. Magnetic
instabilities are a general feature of Coulombic double quantum well systems at
low densities. We argue that this antiferromagnetic phase is stabilized
relative to ferromagnetic ones by an effective superexchange interaction
between the wells. Detailed self-consistent Hartree-Fock calculations using a
point-contact model for the interaction show that the antiferromagnetic phase
survives intra-subband repulsion matrix elements neglected in earlier work in a
large portion of the model's parameter space. We also examine the role of
asymmetry due to biasing or to differences in the widths of the two quantum
wells. The asymmetry creates a mode coupling between the intra- and
inter-subband collective spin-density excitations (SDEs) which changes the
Raman spectroscopy signature of the phase transition from a complete softening
of the inter-subband SDE to a cusp as the density is tuned through the
transition. This cusp may be detectable in inelastic light scattering
experiments in samples of sufficient quality at low enough temperatures and
densities.
","[{""version"":""v1"",""created"":""Wed, 30 Jul 1997 21:50:48 GMT""}]","2009-10-30"
"cond-mat/9707325","Christopher Jarzynski","C. Jarzynski","Equilibrium free energy differences from nonequilibrium measurements: a
  master equation approach","29 pages + 9 figures, to appear in Phys Rev E","Phys Rev E 56, 5018 (1997)","10.1103/PhysRevE.56.5018","LA-UR-97-2235","cond-mat.stat-mech physics.chem-ph",,"  It has recently been shown that the Helmholtz free energy difference between
two equilibrium configurations of a system may be obtained from an ensemble of
finite-time (nonequilibrium) measurements of the work performed in switching an
external parameter of the system. Here this result is established, as an
identity, within the master equation formalism. Examples are discussed and
numerical illustrations provided.
","[{""version"":""v1"",""created"":""Wed, 30 Jul 1997 22:18:29 GMT""}]","2009-10-30"
"cond-mat/9707326","Chris L. Henley","C. L. Henley (Cornell Univ.)","Cluster maximization, non-locality, and random tilings","4 pages, LaTeX; two eps figures; to appear, Proceedings of the 6th
  International Conference on Quasicrystals (Tokyo, 1997)",,,,"cond-mat",,"  Jeong and Steinhardt (JS) implement local rules by selecting the sub-ensemble
of tilings which have the maximum occurrences of a chosen pattern (``cluster'')
C It is unknown how to prove that a given C implies a given sub-ensemble;
counterexamples given here demonstrate this problem is nonlocal, and show the
JS results depend on periodic boundary conditions. Sub-ensembles which are
tilings of supertiles are at least as interesting, mathematically and
physically, as the ideal cases emphasized by JS; the case C = star-decagon is
explored here. Finally, I suggest minimizing the frequency of chosen intersite
distances as a more physical alternative to the cluster approach.
","[{""version"":""v1"",""created"":""Wed, 30 Jul 1997 22:42:58 GMT""}]","2007-05-23"
"cond-mat/9707327","Steven Kivelson","S. A. Kivelson (UCLA), E. Fradkin (UIUC), and V. J. Emery (BNL)","Electronic Liquid Crystal Phases of a Doped Mott Insulator","5 pages in RevTex with two figures in eps","Nature 393, 550-553 (1998).","10.1038/31177",,"cond-mat",,"  The character of the ground state of an antiferromagnetic insulator is
fundamentally altered upon addition of even a small amount of charge. The added
charges agglomerate along domain walls at which the spin correlations, which
may or may not remain long-ranged, suffer a $\pi$ phase shift. In two
dimensions, these domain walls are ``stripes'' which are either insulating, or
conducting, i.e. metallic rivers with their own low energy degrees of freedom.
However, quasi one-dimensional metals typically undergo a transition to an
insulating ordered charge density wave (CDW) state at low temperatures. Here it
is shown that such a transition is eliminated if the zero-point energy of
transverse stripe fluctuations is sufficiently large in comparison to the CDW
coupling between stripes. As a consequence, there exist novel,
liquid-crystalline low-temperature phases -- an electron smectic, with
crystalline order in one direction, but liquid-like correlations in the other,
and an electron nematic with orientational order but no long-range positional
order. These phases, which constitute new states of matter, can be either high
temperature supeconductors or two-dimensional anisotropic ``metallic''
non-Fermi liquids. Evidence for the new phases may already have been obtained
by neutron scattering experiments in the cuprate superconductor,
La_{1.6-x}Nd_{0.4}Sr_xCuO_{4}.
","[{""version"":""v1"",""created"":""Wed, 30 Jul 1997 22:56:14 GMT""}]","2009-10-30"
"cond-mat/9707328","Yigal Meir","Walter Kohn, Yigal Meir and Dmitrii E. Makarov","Van der Waals Energies in Density Functional Theory","4 pages, 1 postscript figure (included)",,"10.1103/PhysRevLett.80.4153",,"cond-mat physics.atm-clus",,"  In principle, density functional theory yields the correct ground-state
densities and energies of electronic systems under the action of a static
external potential.
  However, traditional approximations fail to include Van der Waals energies
between separated systems. This paper proposes a practical procedure for
remedying this difficulty. Our method allows seamless calculations between
small and large inter-system distances. The asymptotic H-He and He--He
interactions are calculated as a first illustration, with very accurate
results.
","[{""version"":""v1"",""created"":""Wed, 30 Jul 1997 23:49:26 GMT""}]","2016-08-31"
"cond-mat/9707329","Matthias Fuchs","Matthias Fuchs (Physik-Department, Technische Universitaet Muenchen,
  Germany) and Kenneth S. Schweizer (Department of Materials Science and
  Engineering, University of Illinois, USA)","Polymer-Mode-Coupling Theory of Finite-Size-Fluctuation Effects in
  Entangled Solutions, Melts and Gels. I. General Formulation and Predictions","Latex, figures and styles files included; Macromolecules, in press
  (1997)",,"10.1021/ma970234b",,"cond-mat",,"  The transport coefficients of dense polymeric fluids are approximately
calculated from the microscopic intermolecular forces. The following finite
molecular weight effects are discussed within the Polymer-Mode-Coupling theory
(PMC) and compared to the corresponding reptation/ tube ideas: constraint
release mechanism, spatial inhomogeneity of the entanglement constraints, and
tracer polymer shape fluctuations. The entanglement corrections to the single
polymer Rouse dynamics are shown to depend on molecular weight via the ratio
N/N_e, where the entanglement degree of polymerization, N_e, can be measured
from the plateau shear modulus. Two microscopically defined non-universal
parameters, an entanglement strength 1/alpha and a length scale ratio, delta=
xi_rho/b, where xi_rho and b are the density screening and entanglement length
respectively, are shown to determine the reduction of the entanglement effects
relative to the reptation- -like asymptotes of PMC theory. Large finite size
effects are predicted for reduced degrees of polymerization up to N/N_e\le10^3.
Effective power law variations for intermediate N/N_e of the viscosity, eta\sim
N^x, and the diffusion constant, D\sim N^{-y}, can be explained with exponents
significantly exceeding the asymptotic, reptation-like values, x\ge 3 and
y\ge2, respectively. Extensions of the theory to treat tracer dielectric
relaxation, and polymer transport in gels and other amorphous systems, are also
presented.
","[{""version"":""v1"",""created"":""Thu, 31 Jul 1997 09:50:20 GMT""}]","2009-10-30"
"cond-mat/9707330","Matthias Fuchs","Matthias Fuchs (Physik-Department, Technische Universitaet Muenchen,
  Germany) and Kenneth S. Schweizer (Department of Materials Science and
  Engineering, University of Illinois, USA)","Polymer-Mode-Coupling Theory of Finite-Size-Fluctuation Effects in
  Entangled Solutions, Melts and Gels. II. Comparison with Experiment","Latex, figures and styles files included; Macromolecules, in press
  (1997)",,"10.1021/ma9702354",,"cond-mat",,"  The predictions of the polymer mode coupling theory for the finite size
corrections to the transport coefficients of entangled polymeric systems are
tested in comparisons with various experimental data. It is found that
quantitative descriptions of the viscosities, eta, dielectric relaxation time,
tau_e, and diffusion coefficients, D, of polymer melts can be achieved with two
microscopic structural fit parameters whose values are in the range expected
from independent theoretical or experimental information. An explanation for
the (apparent) power law behaviors of eta, taue, and D in (chemically distinct)
melts for intermediate molecular weights as arising from finite size
corrections, mainly the self-consistent constraint release mechanism, is given.
The variation of tracer dielectric relaxation times from Rouse to
reptation-like behavior upon changes of the matrix molecular weight is
analyzed. Self and tracer diffusion constants of entangled polymer solutions
can be explained by the theory as well, if one further parameter of the theory
is adjusted. The anomalous scaling of the tracer diffusion coefficients in
semidilute and concentrated polystyrene solutions, D\sim N^{-2.5}, is predicted
to arise due to the spatial correlations of the entanglement constraints,
termed ``constraint porosity''. Extensions of the theory to polymer tracer
diffusion through polyvinylmethylether and polyacrylamide gels provide an
explanation of the observation of anomalously high molecular weight scaling
exponents in a range where the size of the tracer, R_g, already considerably
exceeds the gel pore size, xi_g.
","[{""version"":""v1"",""created"":""Thu, 31 Jul 1997 09:50:35 GMT""}]","2009-10-30"
"cond-mat/9707331","Assa Auerbach","Assa Auerbach","Which tunnel faster across a quantum Hall strip: fractional charges or
  electrons?","5 pages, 3 Postscript Figures, uses epsf and psfig",,,,"cond-mat.mes-hall",,"  The tunneling rate of fractional charge across a Laughlin state on the
cylinder is computed numerically. The decay with strip width Y is fitted to
exp[- a (Y/ l)**2/12] where l is the Landau length, and a is approximately 1.0.
This rate is exponentially LARGER than the electron tunneling rate and can be
interpreted by analogy to a superfluid vortex tunneling problem. Experimental
implications include the ``law of corresponding states'', periodicity of
Aharonov-Bohm resistance oscillations and charge measurements by quantum shot
noise.
","[{""version"":""v1"",""created"":""Thu, 31 Jul 1997 10:40:40 GMT""}]","2008-02-03"
"cond-mat/9707332","Dr. Shouhei Kakigi","Hiroshi Kuratsuji and Shouhei Kakigi (Ritsumeikan Univ.)","Maxwell-Schroedinger Equation for Polarized Light and Evolution of the
  Stokes Parameters","5 pages, 2 EPS figures, uses REVTeX and epsfig.sty","Phys. Rev. Lett., 80 (1998) 1888","10.1103/PhysRevLett.80.1888",,"cond-mat",,"  By starting with the Maxwell theory of electromagnetism, we study the change
of polarization state of light transmitting through optically anisotropic
media. The basic idea is to reduce the Maxwell equation to the Schroedinger
like equation for two levels (or states) representing polarization. By using
the quantum mechanical technique, the density matrix, and path integral, the
evolution of the Stokes parameters results in the equation of motion for a
pseudospin representing a point on the Poincare sphere. Two typical examples
relevant to actual experiments are considered; the one gives the generalized
Faraday effect, and the other realizes an optical analog of magnetic resonance.
","[{""version"":""v1"",""created"":""Thu, 31 Jul 1997 10:59:15 GMT""},{""version"":""v2"",""created"":""Fri, 8 Aug 1997 18:45:32 GMT""},{""version"":""v3"",""created"":""Wed, 11 Feb 1998 15:34:00 GMT""}]","2009-10-30"
"cond-mat/9707333","Zeev Olami","O. Zik (1), Z. Olami (2) and E. Moses (1,2) ((1) Department of Physics
  of Complex Systems and (2) Department of Chemical Physics, The Weizmann
  Institute of Science, Rehovot, Israel)","Fingering Instability in Combustion",,,"10.1103/PhysRevLett.81.3868",,"cond-mat",,"  A thin solid (e.g., paper), burning against an oxidizing wind, develops a
fingering instability with two decoupled length scales. The spacing between
fingers is determined by the P\'eclet number (ratio between advection and
diffusion). The finger width is determined by the degree two dimensionality.
Dense fingers develop by recurrent tip splitting. The effect is observed when
vertical mass transport (due to gravity) is suppressed. The experimental
results quantitatively verify a model based on diffusion limited transport.
","[{""version"":""v1"",""created"":""Thu, 31 Jul 1997 12:25:46 GMT""}]","2009-10-30"
"cond-mat/9707334",,"Kingshuk Ghosh, Arnab Majumdar and Debashish Chowdhury","Distributions of Time Headways in Particle-hopping Models of Vehicular
  Traffic",,,,,"cond-mat.stat-mech",,"  We report the first analytical calculation of the distribution of the time
headways in some special cases of a particle-hopping model of vehicular traffic
on idealized single-lane highways and compare with the corresponding results of
our computer simulation. We also present numerical results for the time-headway
distribution in more general situations in this model. We compare our results
with the empirical data available in the literature.
","[{""version"":""v1"",""created"":""Thu, 31 Jul 1997 14:44:52 GMT""}]","2008-02-03"
"cond-mat/9707335",,"G. Sierra, M.A. Martin-Delgado, J. Dukelsky, S.R. White, D.J.
  Scalapino","The Dimer-Hole-RVB State of the 2-Leg t-J Ladder: A Recurrent
  Variational Ansatz","REVTEX file, 17 pages, 14 PS figures",,,,"cond-mat.supr-con cond-mat.str-el hep-th",,"  We present a variational treatment of the ground state of the 2-leg t-J
ladder, which combines the dimer and the hard-core boson models into one
effective model. This model allows us to study the local structure of the hole
pairs as a function of doping. A second order recursion relation is used to
generate the variational wave function, which substantially simplifies the
computations. We obtain good agreement with numerical density matrix
renormalization group results for the ground state energy in the strong
coupling regime. We find that the local structure of the pairs depends upon
whether the ladder is slightly or strongly dopped.
","[{""version"":""v1"",""created"":""Thu, 31 Jul 1997 12:37:54 GMT""}]","2008-02-03"
"cond-mat/9707336","Ferenc Szalma","W. Selke (1), F. Szalma (2), P. Lajko (2), F. Igloi (3 and 2) ((1)
  RWTH Aachen Germany, (2) Szeged University Hungary, (3) KFKI Budapest
  Hungary)","Surface critical behavior of two-dimensional dilute Ising models","6 pages in RevTex, 3 ps figures, to appear in Journal of Stat. Phys","J. Stat. Phys., 89 (1997) 1079","10.1007/BF02764223",,"cond-mat.dis-nn cond-mat.stat-mech",,"  Ising models with nearest-neighbor ferromagnetic random couplings on a square
lattice with a (1,1) surface are studied, using Monte Carlo techniques and
star-tiangle transformation method. In particular, the critical exponent of the
surface magnetization is found to be close to that of the perfect model,
beta_s=1/2. The crossover from surface to bulk critical properties is
discussed.
","[{""version"":""v1"",""created"":""Thu, 31 Jul 1997 14:33:14 GMT""}]","2009-10-30"
"cond-mat/9707337","Olivier Parcollet","Olivier Parcollet, Antoine Georges","Transition from overscreening to underscreening in the multichannel
  Kondo model: exact solution at large N","4 pages, RevTeX3.0, 2 EPS figures. Published version","Phys. Rev. Lett. 79 (1997) 4665","10.1103/PhysRevLett.79.4665","LPTENS 97/40","cond-mat.str-el",,"  A novel large-N limit of the multichannel Kondo model is introduced, for
representations of the impurity spin described by Schwinger bosons. Three cases
are found, associated with underscreening, overscreening and exact Kondo
screening of the impurity. The saddle-point equations derived in this limit are
reminiscent of the ``non-crossing approximation'', but preserve the
Fermi-liquid nature of the model in the exactly screened case. Several physical
quantities are computed, both numerically, and analytically in the low-\omega,T
limit, and compared to other approaches.
","[{""version"":""v1"",""created"":""Thu, 31 Jul 1997 14:04:55 GMT""},{""version"":""v2"",""created"":""Wed, 17 Dec 1997 17:44:31 GMT""}]","2009-10-30"
"cond-mat/9707338","Pascal Lederer","Pascal Lederer, PUC-Rio, UFRJ (Brazil) and Physique des Solides,
  Orsay, (France)","New Magneto-Roton Modes in the ""Ribault Phase"" of the Ultra Quantum
  Crystal","4 pages, LateX, 2 figures. Changes are minor misprint corrections,
  reference reordering, and format change (from 10 pages preprint to 4 pages).
  Figure 2 is modified slightly so as to be a more accurate account of the
  results. Submitted to Phys. Rev. Lett",,,,"cond-mat.mtrl-sci cond-mat.mes-hall",,"  The Ultra Quantum Crystal phases observed in quasi-one-dimensional conductors
of the Bechgaard salts family under magnetic field exhibit both Spin Density
Wave order and a Quantized Hall Effect. As a result, they also possess a
Magneto-Roton mode within the single particle gap, and the usual Goldstone
modes. The sign reversals of the Quantum Hall Effect have recently been
explained within the Quantized Nesting Model. I show here that the sign
reversed phases of the Ultra Quantum Crystal (the ""Ribault Phases"") have novel
properties compared to the majority sign phases. They exhibit at least two
Magneto-Roton modes, the energy of which, relative to the single particle gap,
vary linearly with the magnetic field, with opposite signs, in contrast to the
field dependence in the majority sign phases
","[{""version"":""v1"",""created"":""Thu, 31 Jul 1997 13:53:18 GMT""},{""version"":""v2"",""created"":""Mon, 11 Aug 1997 14:02:10 GMT""}]","2008-02-03"
"cond-mat/9707339","Ceyhun Bulutay","C. Bulutay and M. Tomak (Middle East Technical University, Ankara,
  Turkey)","Valley Phase Transition in Si MOSFETs","1 page, in REVTEX, no figures",,,,"cond-mat.str-el",,"  We draw attention to the past literature on valley phase transition in
Si(100) MOSFETs. The recent experiments performed by Kravchenko and co-workers
indicating metal-insulator transition in Si MOSFETs are also in accord with the
valley phase transition mechanism.
","[{""version"":""v1"",""created"":""Thu, 31 Jul 1997 14:06:36 GMT""}]","2008-02-03"
"cond-mat/9707340","M. K. Hari","M. R. Evans, Y. Kafri, H. M. Koduvely, and D. Mukamel","Phase Separation in One-Dimensional Driven Diffusive Systems","4 Pages, Revtex, 2 Figures included, Submitted to Physical Review
  Letters","Phys. Rev. Lett., 80 (1998) 425","10.1103/PhysRevLett.80.425",,"cond-mat.stat-mech",,"  A driven diffusive model of three types of particles that exhibits phase
separation on a ring is introduced. The dynamics is local and comprises nearest
neighbor exchanges that conserve each of the three species. For the case in
which the three densities are equal, it is shown that the model obeys detailed
balance. The Hamiltonian governing the steady state distribution in this case
is given and is found to have long range asymmetric interactions. The partition
sum and bounds on some correlation functions are calculated analytically
demonstrating phase separation.
","[{""version"":""v1"",""created"":""Thu, 31 Jul 1997 14:25:18 GMT""}]","2009-10-30"
"cond-mat/9707341",,"Alexander O. Gogolin, Alexander A. Nersesyan, Alexei M. Tsvelik, and
  Lu Yu","Zero Modes and Thermodynamics of Disordered Spin-1/2 Ladders","26 pages, 1 Postscript figure, LaTeX",,,,"cond-mat.dis-nn cond-mat.str-el",,"  The influence of nonmagnetic doping on the thermodynamic properties of
two-leg S = 1/2 spin ladders is studied in this paper. It is shown that, for a
weak interchain coupling, the problem can be mapped onto a model of random mass
Dirac (Majorana) fermions. We investigate in detail the structure of the
fermionic states localized at an individual mass kink (zero modes) in the
framework of a generalized Dirac model. The low-temperature thermodynamic
properties are dominated by these zero modes. We use the single-fermion density
of states, known to exhibit the Dyson singularity in the zero-energy limit, to
construct the thermodynamics of the spin ladder. In particular, we find that
the magnetic susceptibility $\chi$ diverges at $T\to 0$ as $1/T\ln^2(1/T)$, and
the specific heat behaves as $C\propto 1/\ln^3(1/T)$. The predictions on
magnetic susceptibility are consistent with the most recent results of quantum
Monte Carlo simulations on doped ladders with randomly distributed impurities.
We also calculate the average staggered magnetic susceptibility induced in the
system by such defects.
","[{""version"":""v1"",""created"":""Thu, 31 Jul 1997 15:39:44 GMT""}]","2008-02-03"
