"cond-mat/9707342","Amaral","L.A.N. Amaral (MIT), S.V. Buldyrev (Boston Univ), S. Havlin (BU), M.A.
  Salinger (BU), and H.E. Stanley (BU)","Power Law Scaling for a System of Interacting Units with Complex
  Internal Structure","4 pages with 4 postscript figures (uses Revtex 3.1, Latex2e,
  multicol.sty, epsf.sty and rotate.sty). Submitted to PRL",,"10.1103/PhysRevLett.80.1385",,"cond-mat.stat-mech adap-org nlin.AO",,"  We study the dynamics of a system composed of interacting units each with a
complex internal structure comprising many subunits. We consider the case in
which each subunit grows in a multiplicative manner. We propose a model for
such systems in which the interaction among the units is treated in a mean
field approximation and the interaction among subunits is nonlinear. To test
the model, we identify a large data base spanning 20 years, and find that the
model correctly predicts a variety of empirical results.
","[{""version"":""v1"",""created"":""Thu, 31 Jul 1997 15:35:08 GMT""}]","2009-10-30"
"cond-mat/9707343","K. P. N. Murthy","K.P.N.Murthy and K.W.Kehr","Relaxation at late stages in an entropy barrier model for glassy systems","9 pages no figures. to appear in J.Phys. A: Math. and Gen",,"10.1088/0305-4470/30/19/010",,"cond-mat.stat-mech cond-mat.soft",,"  The ground state dynamics of an entropy barrier model proposed recently for
describing relaxation of glassy systems is considered. At stages of evolution
the dynamics can be described by a simple variant of the Ehrenfest urn model.
Analytical expression for the relaxation times from an arbitrary state to the
ground state is derived. Upper and lower bounds for the relaxation times as a
function of system size are obtained.
","[{""version"":""v1"",""created"":""Thu, 31 Jul 1997 15:41:45 GMT""}]","2009-10-30"
"dg-ga/9707023","Reyer Sjamaar","Eckhard Meinrenken (Massachusetts Institute of Technology), Reyer
  Sjamaar (Cornell University)","Singular Reduction and Quantization","67 pages, 3 figures, LaTeX-2e","Topology 38 (1999), 699-762",,,"dg-ga math.DG",,"  Consider a compact prequantizable symplectic manifold M on which a compact
Lie group G acts in a Hamiltonian fashion. The ``quantization commutes with
reduction'' theorem asserts that the G-invariant part of the equivariant index
of M is equal to the Riemann-Roch number of the symplectic quotient of M,
provided the quotient is nonsingular. We extend this result to singular
symplectic quotients, using partial desingularizations of the symplectic
quotient to define its Riemann-Roch number. By similar methods we also compute
multiplicities for the equivariant index of the dual of a prequantum bundle,
and furthermore show that the arithmetic genus of a Hamiltonian G-manifold is
invariant under symplectic reduction.
","[{""version"":""v1"",""created"":""Wed, 30 Jul 1997 18:38:45 GMT""}]","2008-02-03"
"dg-ga/9707024","Vladimir Retakh","Israel Gelfand (Rutgers University), Vladimir Retakh (University of
  Arkansas) and M. Shubin (Northeastern University)","Fedosov Manifolds","Plain Tex, 32 pp. An enlarged version. A number of references were
  added",,,"FM-1-97; FI-ML1997-001","dg-ga alg-geom hep-th math.AG math.DG",,"  In this paper we study geometry of symmetric torsion-free connections which
preserve a given symplectic form
","[{""version"":""v1"",""created"":""Wed, 30 Jul 1997 19:19:56 GMT""},{""version"":""v2"",""created"":""Fri, 5 Sep 1997 18:33:08 GMT""}]","2008-02-03"
"dg-ga/9707025","Berceanu Stef","S. Berceanu","A remark on Berezin's quantization and cut locus","8 pages, Latex2e, ams fonts, to appear in ""Quantizations,
  Deformations and Coherent States"", Edited by S. Twareque Ali, A. Odzijewicz
  and A. Strasburger, Proceedings of the XV Workshop on Geometric Methods in
  Physics, Bia\l owie\.{z}a, Poland, 1-7 july 1996, Rep. Math. Phys.",,"10.1016/S0034-4877(97)85912-5",,"dg-ga math.DG",,"  The consequences for Berezin's quantization on symmetric spaces of the
identity of the set of coherent vectors orthogonal to a fixed one with the cut
locus are stated precisely. It is shown that functions expressing the coherent
states, the covariant symbols of operators, the diastasis function, the
characteristic and two-point functions are defined when one variable does not
belong to the cut locus of the other one.
","[{""version"":""v1"",""created"":""Thu, 31 Jul 1997 06:01:31 GMT""}]","2009-10-30"
"gr-qc/9707062","Larry Ford","L.H. Ford","Quantum Field Theory in Curved Spacetime","Lectures given at the IX Jorge Andre Swieca Summer School, Campos dos
  Jordao, SP, Brazil, February 1997, and at Soochow University, Taipei, Taiwan,
  June 1997. To be published in the proceedings of the Swieca School. 44 pages,
  Latex, 5 figures, uses epsf",,,"TUTP-97-9","gr-qc hep-th",,"  These lectures deal with selected aspects of quantum field theory in curved
spacetime including the following topics: (1) Quantization of fields on a
curved background, particle creation by gravitational fields, particle creation
in an expanding universe; moving mirror radiation. (2) The Hawking effect -
particle creation by black holes. (3) Ultraviolet and infrared divergences,
renormalization of the expectation value of the stress tensor; global symmetry
breaking in curved spacetime. (4) Negative energy in quantum field theory, its
gravitational effects, and inequalities which limit negative energy densities
and fluxes. (5) The semiclassical theory of gravity and its limitations,
breakdown of this theory due to metric fluctuations, lightcone fluctuations.
","[{""version"":""v1"",""created"":""Wed, 30 Jul 1997 18:09:11 GMT""}]","2007-05-23"
"hep-ex/9707042","Ryoji Enomoto","Ryuji Suda et al","Monte-Carlo Simulation for an Aerogel Cherenkov Counter","40 pages, latex(article), 19 figures","Nucl.Instrum.Meth.A406:213-226,1998","10.1016/S0168-9002(98)91983-0","KEK preprint-97-102","hep-ex",,"  We have developed a Monte-Carlo simulation code for an aerogel \v Cerenkov
Counter which is operated under a strong magnetic field such as 1.5T. This code
consists of two parts: photon transportation inside aerogel tiles, and
one-dimensional amplification in a fine-mesh photomultiplier tube. It simulates
the output photoelectron yields as accurately as 5% with only a single free
parameter. This code is applied to simulations for a B-Factory
particle-identification system.
","[{""version"":""v1"",""created"":""Thu, 31 Jul 1997 08:48:39 GMT""}]","2014-11-17"
"hep-lat/9707032","Yamada Atsushi","Atsushi Yamada","Weak coupling expansion of a chiral gauge theory on a lattice in the
  overlap formulation","LaTeX, 23 pages","Nucl.Phys. B514 (1998) 399-418","10.1016/S0550-3213(97)00760-8",,"hep-lat",,"  Weak coupling expansion of a chiral gauge theory on a lattice is discussed in
the overlap formulation. We analyze the fermion propagator and the
fermion-fermion-gauge boson vertex in the one loop level. The chiral properties
of the propagator and vertex are correctly preserved without tuning the
parameters involved even after the one-loop renormalization, and the
ultraviolet divergent parts agree with the continuum theory. Our analysis,
together with the existing studies on the vacuum polarization and the gauge
boson n-point functions, completes the proof of the renormalizability of this
formulation to the one loop level.
","[{""version"":""v1"",""created"":""Wed, 30 Jul 1997 16:24:02 GMT""}]","2009-10-30"
"hep-lat/9707033","Janne Peisa","J. Peisa","Phase Diagram of 3d U(1)+Higgs Theory","5 pages, 3 figures. To appear in the Proceedings of Strong and
  Electroweak Matter '97, Eger, Hungary, 21-25 May 1997",,,"LTH-402","hep-lat",,"  We study the properties of the phase transition in three dimensional
U(1)+Higgs theory or Ginzburg-Landau model of superconductivity. Special
attention is paid to large values of scalar self coupling (Type II
superconductors), where the nature of the transition is unclear. We present
some evidence for an unusual transition in this regime.
","[{""version"":""v1"",""created"":""Thu, 31 Jul 1997 10:02:21 GMT""}]","2007-05-23"
"hep-lat/9707034","Kari Rummukainen","K. Rummukainen (Bielefeld University)","Dimensional Reduction and Hot QCD: Calculating the Debye Mass
  Non-Perturbatively","5 pages, Latex, uses sprocl.sty, Talk given at the conference
  ``Strong and Electroweak Matter '97'', 21--25 May 1997, Eger, Hungary",,,"BI-TP 97/27","hep-lat",,"  We study the phase diagram of the 3-dimensional SU(2) + adjoint Higgs theory,
and investigate to what extent it can be used as an effective theory of the
4-dimensional high-T SU(2) QCD. The relation between the parameters in 4 and 3
dimensions is obtained through dimensional reduction. The high-T (deconfined)
QCD phase corresponds to the symmetric phase of the 3-D Higgs theory. In the
relevant parameter region the symmetric phase is not stable, but the
metastability is strong enough to make precise measurements possible. In
particular, we measure the Debye mass using a gauge invariant operator.
","[{""version"":""v1"",""created"":""Thu, 31 Jul 1997 11:55:10 GMT""}]","2007-05-23"
"hep-ph/9707516",,"David Kaiser","Resonance Structure for Preheating with Massless Fields","13pp, revtex. Minor revisions. Forthcoming in Phys Rev D","Phys.Rev. D57 (1998) 702-711","10.1103/PhysRevD.57.702","HUTP-97/A041","hep-ph astro-ph gr-qc",,"  We extend recent work on the resonance structure for post-inflation
reheating, providing an analytic treatment for models in which both the
inflaton and the fields into which it decays are massless. Solutions are
derived which are valid for either a spatially-flat or spatially-open metric.
Closed-form solutions are given for the characteristic exponent, which measures
the rate of particle production during preheating. It is demonstrated that in
certain regions of parameter space, the maximum values of the characteristic
exponent in an open universe are several times greater than the maximum values
in a spatially-flat universe. It is further demonstrated that the solutions
found here by means of a simple algebraic construction match the two
previously-known exact solutions, which were derived in terms of special
functions.
","[{""version"":""v1"",""created"":""Wed, 30 Jul 1997 20:14:50 GMT""},{""version"":""v2"",""created"":""Mon, 17 Nov 1997 14:54:22 GMT""}]","2009-10-30"
"hep-ph/9707517","Apostolos Pilaftsis","Zoltan Gagyi-Palffy (Mainz Univ.), Apostolos Pilaftsis (MPI, Munich)
  and Karl Schilcher (Univ. of California, San Diego)","Gauge-Independent Analysis of K_L --> e \mu in Left-Right Models","44 pages, LaTeX, six encapsulated figures included","Nucl.Phys. B513 (1998) 517-554","10.1016/S0550-3213(97)00764-5","MZ-TH/97-28, MPI/PhT/97-47, UCSD/97-18","hep-ph",,"  The lepton-flavour-violating decay K_L --> e \mu is studied in detail within
the context of SU(2)_R x SU(2)_L x U(1)_(B-L) models, which include heavy
Majorana neutrinos. Particular attention is paid to the gauge independence of
this decay process to one loop. In analogy with earlier studies on the
K^0\bar{K}^0 mixing, it is explicitly shown how restoration of gauge invariance
occurs in the decay amplitude containing the box diagrams, when the relevant
Higgs-dependent self-energy and vertex graphs are taken into account in the
on-shell skeleton renormalization scheme. Based on the analytic expressions so
derived, we find that the branching ratio B(K_L --> e \mu) can be considerably
enhanced due to the presence of left- and right-handed currents in the loop,
and can reach values close to or even larger than the present experimental
limit 3.3 x 10^{-11} in the manifest left-right symmetric model. Constraints on
the parameter space of typical left-right models are derived from the possible
decay K_L --> e \mu and a global analysis of other low-energy data.
","[{""version"":""v1"",""created"":""Wed, 30 Jul 1997 16:38:25 GMT""}]","2009-10-30"
"hep-ph/9707518",,"R. N. Mohapatra","Left-right symmetry just beyond the MSSM, electric dipole moment of
  neutron and HERA leptoquarks","24 pages and 4 figures; invited talks at the ""Beyond97"" workshop in
  the Ringberg castle, Germany, June 8-13, 1997 and :3~""NANP97"" workshop in
  Dubna, Russia, July 7-12, 1997","Phys.Atom.Nucl.61:963-974,1998; Yad.Fiz.61:1056-1068,1998",,,"hep-ph",,"  The supersymmetric left-right (SUSYLR) models solve several of the
unnaturalness problems of the MSSM such as the R-parity and SUSY CP problems.
If further the $W_R$ mass is in the TeV range, then it also provides a solution
to the strong CP problem without the need for an axion. A crucial prediction of
this model is the electric dipole moment of the neutron $\simeq
10^{-25}-10^{-26}$ ecm arising from the one loop contribution to the strong CP
parameter $\bar{theta}$. Other predictions of the model are a light doubly
charged Higgs boson and its fermionic partner with masses in the several
hundred GeV range. We then show this model can be extended to include the
leptoquarks that can explain the HERA high $Q^2$ anomaly without giving up
R-parity conservation.
","[{""version"":""v1"",""created"":""Wed, 30 Jul 1997 16:52:57 GMT""}]","2014-11-17"
"hep-ph/9707519","John Morris","J.R. Morris","Nested Domain Defects","14 pages, revtex, no figures; to appear in IJMPA","Int.J.Mod.Phys. A13 (1998) 1115-1128","10.1142/S0217751X98000494",,"hep-ph hep-th",,"  An example of a supersymmetric model involving two interacting chiral
superfields is presented here which allows for solutions describing string-like
``domain ribbon'' defects embedded within a domain wall. It is energetically
favorable for the fermions within the wall to populate the domain ribbons, and
an explicit solution is found for the fermion zero modes. The Fermi gas within
ribbons can allow them to stabilize in the form of small loops.
","[{""version"":""v1"",""created"":""Wed, 30 Jul 1997 19:30:54 GMT""}]","2009-10-30"
"hep-ph/9707520","Robin Stuart","R. Akhoury, Paresh Malde, Robin G. Stuart (Randall Laboratory of
  Physics)","Order $N_f\alpha^2$ Corrections in Low-Energy Electroweak Processes","10 pages LaTeX. 4 figures. Uses amsmath.sty, cite.sty and epsfig.sty",,,,"hep-ph",,"  We provide a compendium of techniques that can be used to compute
$O(N_f\alpha^2)$ corrections to low-energy electroweak processes. Specifically,
these are the 2-loop electroweak corrections containing a light fermion loop.
It is shown that the vast majority of such corrections can be reduced to
expressions involving a universal master integral for which an exact analytic
form in dimensional regularization is given. The only exceptions are certain
photon vacuum polarization diagrams. Examples are presented for diagrams that
occur in a variety of processes of practical interest.
","[{""version"":""v1"",""created"":""Wed, 30 Jul 1997 19:14:52 GMT""}]","2007-05-23"
"hep-ph/9707521",,"Amol S. Dighe (University of Chicago), Michael Gronau (CERN and The
  Technion), and Jonathan L. Rosner (University of Chicago)","B Decays Involving $\eta$ and $\eta'$ in the Light of the $B \to K
  \eta'$ Process","8 pages, latex, no figures. Updated data and references","Phys.Rev.Lett. 79 (1997) 4333-4336","10.1103/PhysRevLett.79.4333","CERN-TH/97-185, EFI-97-33","hep-ph",,"  The observation by the CLEO Collaboration of the decays $B^{(+,0)} \to
K^{(+,0)} \eta'$ is shown to imply a significant but still uncertain
contribution from the flavor-SU(3)-singlet component of the $\eta'$. By
comparing the rate for these decays with others for decays of B mesons to two
pseudoscalar mesons, it is shown that the prospects for observing CP-violating
asymmetries in certain modes such as $B^+ \to \pi^+ \eta$ and $B^+ \to \pi^+
\eta'$ are quite bright.
","[{""version"":""v1"",""created"":""Wed, 30 Jul 1997 19:32:38 GMT""},{""version"":""v2"",""created"":""Tue, 5 Aug 1997 16:01:50 GMT""},{""version"":""v3"",""created"":""Wed, 1 Oct 1997 17:17:08 GMT""}]","2009-10-30"
"hep-ph/9707522","Mark Wise","Mark B. Wise","Recent Progress in Effective Field Theory","13 pages, uses epsf, lprocl.sty. Talk given at the VII Blois Workshop
  on Hadronic Physics, Seoul, Korea. References added",,,"CALT-68-2130","hep-ph",,"  Applications of effective field theory to nucleon-nucleon scattering,
quarkonia decay and production and B meson decay are discussed. Some unresolved
issues are considered.
","[{""version"":""v1"",""created"":""Wed, 30 Jul 1997 20:14:37 GMT""},{""version"":""v2"",""created"":""Fri, 1 Aug 1997 01:18:58 GMT""}]","2008-02-03"
"hep-ph/9707523","Josep Taron","L. Lellouch, E. de Rafael, J. Taron","How small can the light quark masses be?",,"Phys.Lett.B414:195-204,1997","10.1016/S0370-2693(97)01138-6",,"hep-ph hep-lat",,"  We derive lower bounds for the combination of light quark masses m_s +m_u and
m_d +m_u. The derivation is based on first principles: the analyticity
properties of two-point functions of local current operators and the positivity
of the corresponding hadronic spectral functions. The bounds follow from the
restriction of the sum over all possible hadronic states which can contribute
to the hadronic spectral functions to those with the lowest invariant mass.
These hadronic contributions are well known phenomenologically, either from
experiment or from chiral perturbation theory calculations. The results we find
cast serious doubts on the reliability of some of the lattice QCD
determinations which have been recently reported.
","[{""version"":""v1"",""created"":""Wed, 30 Jul 1997 21:07:56 GMT""}]","2008-11-26"
"hep-ph/9707524","shunzo Kumano","S. Kumano (Saga University, SLAC until Aug.13)","Antiquark Flavor Asymmetry with New Accelerator Facilities","1+6 pages, LATEX2e. Talk given at the International Workshop on
  Exciting Physics with New Accelerator Facilities, Spring-8, Nishi-Harima,
  Japan, Mar.11-13, 1997. Complete postscript file is also available at
  ftp://ftp.cc.saga-u.ac.jp/pub/paper/riko/quantum1 or at
  http://www.cc.saga-u.ac.jp/saga-u/riko/physics/quantum1/structure.html Email:
  kumanos@cc.saga-u.ac.jp",,,"SAGA-HE-118-97","hep-ph hep-ex nucl-th",,"  Flavor asymmetry in light antiquark distributions is discussed. In
particular, recent progress on the u-bar/d-bar asymmetry is explained. Then, we
discuss possible future experimental studies.
  1. Introduction
  2. Present situation
  3. Future u-bar/d-bar asymmetry studies
  3.1 Drell-Yan process
  3.2 Charged-hadron production
  3.3 W charge asymmetry
  3.4 Deuteron acceleration at HERA
","[{""version"":""v1"",""created"":""Wed, 30 Jul 1997 22:43:09 GMT""}]","2007-05-23"
"hep-ph/9707525","Martin C. Smith","Martin C. Smith, T. Stelzer, and S. Willenbrock","Nonperturbative Effects in Quarkonia Associated with Large Orders in
  Perturbation Theory","6 pages, 2 figures","Phys.Lett. B413 (1997) 405-409","10.1016/S0370-2693(97)01093-9",,"hep-ph",,"  We show that the perturbation series for quarkonia energies diverges at large
orders. This results in a perturbative ambiguity in the energy that scales as
e^(-1/a*Lambda) where a is the Bohr radius of quarkonium and Lambda is the QCD
scale parameter. This ambiguity is associated with a nonperturbative
contribution to the energy from distances of order 1/Lambda and greater. This
contribution is separate from that of the gluon condensate.
","[{""version"":""v1"",""created"":""Thu, 31 Jul 1997 14:34:28 GMT""}]","2009-10-30"
"hep-ph/9707526","George W. S. Hou","George Wei-Shu Hou","The Case for a Vector Glueball","4 pages, latex, one eps figures (included) [NOTE ADDED: Talk
  presented at the YITP International Workshop ``Recent Developments in QCD and
  Hadron Physics"", Kyoto, Japan, December 16-18, 1996]",,,"NTUTH-97-02","hep-ph",,"  We argue that the $1^{--}$ glueball $O$ is much cleaner than other glueball
candidates. Anomalously large $J/\psi \to \rho\pi, K^*\bar K$ decays and the
scalar glueball mass scale suggest that $m_{O} \simeq m_{J/\psi}$.
","[{""version"":""v1"",""created"":""Thu, 31 Jul 1997 01:16:13 GMT""},{""version"":""v2"",""created"":""Sat, 2 Aug 1997 07:24:35 GMT""}]","2008-02-03"
"hep-ph/9707527","George W. S. Hou","George Wei-Shu Hou","Perspective on FCNC: From Rare to Well-done","6 pages, latex (uses sprocl.sty), no figures [NOTE ADDED: Talk
  presented at FCNC97 Workshop, Santa Monica, USA, February 19--21, 1997]",,,"NTUTH-97-03","hep-ph",,"  We briefly review the phenomenology of FCNC, from the very rare $\mu/K$,
through the medium $b$, to the ""pseudo-well-done"" case of $b'$, extending to
the possibility of large tree level FCNC at weak scale.
","[{""version"":""v1"",""created"":""Thu, 31 Jul 1997 01:37:14 GMT""},{""version"":""v2"",""created"":""Sat, 2 Aug 1997 06:04:10 GMT""}]","2008-02-03"
"hep-ph/9707528","George W. S. Hou","George Wei-Shu Hou","Perspectives on Quark Mass and Mixing Relations","16 pages, latex, two eps figures (included). [NOTE ADDED: Talk
  presented at the Workshop on Masses and Mixings of Quarks and Leptons,
  University of Shizuoka, Japan, March 19 - 21, 1997]",,,"NTUTH-97-04","hep-ph",,"  Two down-up perspectives on quark mass-mixing relations are reviewed. The
modified Fritzsch path relates $V_{cb}$ and $V_{ub}$ to $M_u$, but has trouble
with the low $V_{cb} \simeq 0.04$ value. The modified Wolfenstein path focuses
on the change in $V_{ub}$ from $\lambda^3 { (ca. 1983)} \leadsto \lambda^4 {
(ca. 1994)}$. The relations $m_d/m_s\sim m_s/m_b \sim \delta \sim \lambda^2
\simeq | V_{cb}| \simeq | V_{us}|^2$ and $m_u/m_c\sim m_c/m_t \sim \delta^2
\sim \lambda^4 \sim | V_{ub}|$ suggest a clean separation of the origin of
$V_{KM}$: $| V_{us}| \equiv \lambda$ and $| V_{cb}| \equiv \delta$ arise from
$M_d$ while $V_{ub} \equiv B\lambda^4 e^{-i\phi}$ comes from $M_u$. Five to six
parameters might suffice for ten mass-mixing parameters, with $\delta$
seemingly the more sensible expansion parameter, while $\lambda \simeq
\sqrt{m_d/m_s}$ is tied empirically to $(M_d)_{11} = 0$. The approximate
relations suggest a near weak scale origin of flavor.
","[{""version"":""v1"",""created"":""Thu, 31 Jul 1997 02:00:39 GMT""},{""version"":""v2"",""created"":""Sat, 2 Aug 1997 05:57:54 GMT""}]","2008-02-03"
"hep-ph/9707529","Yan Hua-gang","Chao-Shang Huang and Hua-Gang Yan","Polarized \Lambda_b \to X_c \tau \nu in the SM and THDM","Revtex,11 pages,5 figures","Phys.Rev. D56 (1997) 5981-5990","10.1103/PhysRevD.56.5981","AS-ITP-97-16","hep-ph",,"  The inclusive rate and $\tau$ spectrum for a polarized $\Lambda_b$ -baryon to
decay to charm hadronic final states and leptons $\tau \nu$ in the SM and a
two-Higgs doublet model are computed.The $O(\alpha_s)$ QCD corrections to
$\tau$ spectrum in the two-Higgs model are also given.
","[{""version"":""v1"",""created"":""Thu, 31 Jul 1997 05:59:17 GMT""},{""version"":""v2"",""created"":""Sat, 2 Aug 1997 01:59:10 GMT""}]","2009-10-30"
"hep-ph/9707530","Makoto Oka","Makoto Oka","Roles of Quark Degrees of Freedom in Hypernuclei","Talk presented at the International Conference on Quark Lepton
  Nuclear Physics (QULEN 97), Osaka, May 20-23, 1997 9 pages, 4 eps figures","Nucl.Phys. A629 (1998) 379c-387c","10.1016/S0375-9474(97)00713-6","TIT-HEP/374/NP","hep-ph nucl-th",,"  The quark model description of the hyperon nucleon forces, especially the
antisymmetric spin-orbit forces, is studied from the spin-flavor SU(6) and the
flavor SU(3) symmetry point of view. It is pointed out that the quark exchange
interaction predicts strong antisymmetric spin-orbit force between the hyperon
and nucleon.
","[{""version"":""v1"",""created"":""Thu, 31 Jul 1997 07:48:19 GMT""}]","2009-10-30"
"hep-ph/9707531","Ramon Toldra. Ifae","J. A. Grifols, E. Masso, R. Toldra","Contact Interactions Involving Right-handed Neutrinos and SN1987A","7 pages, latex, no figures. Minor corrections to match final version
  to appear in Phys. Rev. D","Phys.Rev. D57 (1998) 2005-2008","10.1103/PhysRevD.57.2005","UAB-FT-420","hep-ph",,"  We consider lepton-quark contact interactions in models with right-handed
neutrinos, and find that observational data from SN1987A restricts the scale of
such interactions to be at least $\Lambda>90$ TeV.
","[{""version"":""v1"",""created"":""Thu, 31 Jul 1997 13:06:18 GMT""},{""version"":""v2"",""created"":""Wed, 5 Nov 1997 14:45:26 GMT""}]","2009-10-30"
"hep-ph/9707532","Giuseppe Marchesini","Yu.L. Dokshitzer, A. Lucenti, G. Marchesini and G.P. Salam","Universality of 1/Q corrections to jet-shape observables rescued","21 pages, no figures, LaTeX. This revised version corrects a mistake
  in the calculation of the two-loop correction factor. The conclusions remain
  unchanged","Nucl.Phys. B511 (1998) 396-418; Erratum-ibid. B593 (2001) 729-730","10.1016/S0550-3213(97)00650-0","IFUM-573-FT","hep-ph",,"  We address the problem of potential non-universality of the leading 1/Q power
corrections to jet shapes emerging from the non-inclusive character of these
observables. We consider the thrust distribution as an example and analyse the
non-inclusive contributions which emerge at the two-loop level. Although
formally subleading in $\as$, they modify the existing na{\""\i}ve one-loop
result for the expected magnitude of the power term by a factor of order unity.
Such a promotion of a subleading correction into a numerical factor is natural
since the non-perturbative power terms are explicitly proportional to powers of
the QCD scale $\Lambda$ which can be fixed precisely only at the two-loop
level. The ``jet-shape scaling factor'' depends on the observable but remains
perturbatively calculable. Therefore it does not undermine the universal nature
of 1/Q power corrections, which remain expressible in terms of the universal
running coupling and universal soft-gluon emission.
","[{""version"":""v1"",""created"":""Thu, 31 Jul 1997 12:51:43 GMT""},{""version"":""v2"",""created"":""Tue, 17 Oct 2000 17:27:11 GMT""}]","2009-10-30"
