"cond-mat/9712089","Haas","Stephan Haas","Spectral Analysis of Correlated One-Dimensional Systems with Impurities","RevTex, 4 pages with 4 eps figures",,"10.1103/PhysRevLett.80.4052",,"cond-mat.str-el",,"  An averaging procedure is proposed to account for spectral features of
correlated one-dimensional systems in the presence of non-magnetic impurities.
The dynamical spin structure factor for a corresponding random ensemble of
Heisenberg chain segments is calculated by exact numerical diagonalization. It
is shown that a few-pole approximation is sufficient to describe the numerical
results. A similar analysis is proposed for the discussion of experimental
spectra, such as obtained by inelastic neutron scattering measurements on
Zn-doped CuO chains. By examination of the disorder-induced pseudo-gap, the
loss of spectral weight, and the discrete peak structures due to
smallest-cluster contributions, the underlying impurity distribution function
can be determined.
","[{""version"":""v1"",""created"":""Mon, 8 Dec 1997 16:34:55 GMT""}]","2009-10-30"
"cond-mat/9712090","Leticia Cugliandolo","Leticia F. Cugliandolo and Gustavo Lozano","Quantum aging in mean-field models","4 pages, Revtex, 3 figs. included","Phys. Rev. Lett., 80, 4979 (1998)","10.1103/PhysRevLett.80.4979","LPTENS 97/54, LPTHE 97/50","cond-mat",,"  We study the real-time dynamics of quantum models with long-range
interactions coupled to a heat-bath within the closed-time path-integral
formalism. We show that quantum fluctuations depress the transition
temperature. In the subcritical region there are two asymptotic time-regimes
with (i) stationary, and (ii) slow aging dynamics. We extend the quantum
fluctuation-dissipation theorem to the nonequilibrium case in a consistent way
with the notion of an effective temperature that drives the system in the aging
regime. The classical results are recovered for $\hbar\to 0$.
","[{""version"":""v1"",""created"":""Mon, 8 Dec 1997 16:49:13 GMT""}]","2009-10-30"
"cond-mat/9712091","Tom H. Johansen","T.H. Johansen, J. Lothe and H. Bratsberg","Shape Distortion by Irreversible Flux-Pinning-Induced Magnetostriction","4 pages, 4 graphs",,"10.1103/PhysRevLett.80.4757",,"cond-mat.supr-con cond-mat.mtrl-sci",,"  Exact analytical results are obtained for the flux-pinning-induced
magnetostriction in cylindrical type-II superconductors placed in parallel
magnetic field. New modes of irreversible deformation are found: In contrast to
the circular cylinder where shape is conserved, it is shown that a square
cross-section deforms with considerable distortion. During a field cycle both
concave, convex, and even more complicated distortions are predicted. Strong
implications for dilatometric measurements on crystals are emphasized. The main
results are valid for any critical-state model, j_c = j_c(B).
","[{""version"":""v1"",""created"":""Mon, 8 Dec 1997 17:27:33 GMT""}]","2009-10-30"
"cond-mat/9712092","Arnaud Buhot","Arnaud Buhot, Werner Krauth","Numerical Solution of Hard-Core Mixtures","4 pages, 2 figures","Phys. Rev. Lett. 80, 3787 (1998)","10.1103/PhysRevLett.80.3787",,"cond-mat.stat-mech",,"  We study the equilibrium phase diagram of binary mixtures of hard spheres as
well as of parallel hard cubes. A superior cluster algorithm allows us to
establish and to access the demixed phase for both systems and to investigate
the subtle interplay between short-range depletion and long-range demixing.
","[{""version"":""v1"",""created"":""Mon, 8 Dec 1997 17:57:16 GMT""},{""version"":""v2"",""created"":""Thu, 26 Feb 1998 15:02:13 GMT""}]","2009-10-30"
"cond-mat/9712093","Srikanth Hariharan","H. Srikanth, B. Revcolevschi, S. Sridhar (Northeastern University,
  Boston) L. Pinsard, A. Revcolevschi (University of Paris-Sud, Orsay, France)","High frequency magneto-electrodynamics of La_(1-x)Sr_xMnO3 single
  crystals","Submitted to 1997 MRS fall meeting Proceedings, HTML, Paper also
  available at http://sagar.physics.neu.edu/preprints.html",,,,"cond-mat",,"  The radio frequency (RF) response of La1-xSrxMnO3 single crystals reveal a
variety of features associated with the structural, electronic and magnetic
properties of the system. The resonance technique operating at ~ 4 MHz employed
in this study is sensitive to small changes in both the magnetic susceptibility
and resistivity of the samples. Very sharp changes in frequency are observed at
the ferromagnetic (FM) and structural phase transitions in both the metallic (x
= 0.175) and insulating (0.125) crystals studied. In addition to the known
transitions identified as FM and orthorhombic distortions, our experiments show
rich structures which are not observed in conventional DC magnetization and
transport experiments. Our results demonstrate that RF experiments are ideally
suited to investigate the complex phase diagram in the manganites. The colossal
frequency change that we observe at the FM transition in the La1-xSrxMnO3
crystals is indicative of the enormous potential for using these materials in
high frequency switching applications.
","[{""version"":""v1"",""created"":""Mon, 8 Dec 1997 22:44:43 GMT""}]","2007-05-23"
"cond-mat/9712094","Denis Golosov","D. I. Golosov, M. R. Norman, and K. Levin","A Theory of Magnets with Competing Double Exchange and Superexchange
  Interactions","4 pages, Latex-Revtex, 3 PostScript figures. Please see report
  cond-mat/9805238",,"10.1063/1.367798",,"cond-mat",,"  We study the competition between ferromagnetic double exchange (DE) and
nearest-neighbour antiferromagnetic exchange in CMR materials. Towards this
end, a single site mean field theory is proposed which emphasizes the
hopping-mediated nature of the DE contribution. We find that the competition
between these two exchange interactions leads to ferro- or antiferromagnetic
order with incomplete saturation of the (sub)lattice magnetization. This
conclusion is in contrast to previous results in the literature which find a
canted spin arrangement under similar circumstances. We attribute this
difference to the highly anisotropic exchange interactions used elsewhere. The
associated experimental implications are discussed.
","[{""version"":""v1"",""created"":""Mon, 8 Dec 1997 22:55:31 GMT""}]","2009-10-30"
"cond-mat/9712095","Yigit Gunduc","Fatih Ya\c{s}ar, Yi\u{g}it G\""und\""u\c{c} and Tar{\i}k \c{C}elik","Softening of Phase Transition in 2D Potts Model Under Quenched Bond
  Randomness","9 pages, latex, three postscript figures, submitted to Phys. Rev.
  Lett",,"10.1103/PhysRevE.58.4210",,"cond-mat hep-lat",,"  We have simulated, by using cluster algorithm, the $q=8$ state Potts model in
two-dimension with varying amount of quenched bond randomness. We have shown
that there exist a finite size dependent threshold value of the introduced
quenched bond randomness for rounding the first-order phase transition and this
threshold value becomes smaller as the system size increased.
","[{""version"":""v1"",""created"":""Tue, 9 Dec 1997 12:28:59 GMT""}]","2016-08-15"
"cond-mat/9712096","J. F. McCann","B. Jackson, J. F. McCann, and C. S. Adams","Vortex formation in weakly-interacting inhomogeneous Bose condensates","4 pages, 5 figures",,,"DUR-97-1","cond-mat.stat-mech",,"  We solve the time-dependent Gross-Pitaevskii in 2-D to simulate the flow of
an object through a dilute Bose condensate trapped in a harmonic well. We
demonstrate vortex formation and analyze the process in terms of the
accumulation of phase-slip and the evolution of the fluid velocity.
","[{""version"":""v1"",""created"":""Tue, 9 Dec 1997 13:56:29 GMT""}]","2007-05-23"
"cond-mat/9712097","Hans Thomas Elze","H.-Th. Elze, T. Kodama and J. Rafelski","The Sound of Sonoluminescence","25 pages; LaTex and 6 attached ps figure files. Accepted for
  publication in Physical Review E","Phys. Rev. E, 57 (1998) 4170","10.1103/PhysRevE.57.4170",,"cond-mat.soft physics.flu-dyn",,"  We consider an air bubble in water under conditions of single bubble
sonoluminescence (SBSL) and evaluate the emitted sound field nonperturbatively
for subsonic gas-liquid interface motion. Sound emission being the dominant
damping mechanism, we also implement the nonperturbative sound damping in the
Rayleigh-Plesset equation for the interface motion. We evaluate numerically the
sound pulse emitted during bubble collapse and compare the nonperturbative and
perturbative results, showing that the usual perturbative description leads to
an overestimate of the maximal surface velocity and maximal sound pressure. The
radius vs. time relation for a full SBSL cycle remains deceptively unaffected.
","[{""version"":""v1"",""created"":""Tue, 9 Dec 1997 14:00:17 GMT""}]","2009-10-30"
"dg-ga/9712005","Paul Feehan","Paul M. N. Feehan and Thomas G. Leness","PU(2) monopoles. II: Top-level Seiberg-Witten moduli spaces and Witten's
  conjecture in low degrees","Journal fur die Reine und Angewandte Mathematik, to appear; 65 pages.
  Revision of sections 4-7 of version v1 (December 1997)","Journal f\""ur die Reine und Angew\""andte Mathematik 538 (2001),
  135-212","10.1515/crll.2001.064",,"dg-ga alg-geom hep-th math.AG math.DG",,"  In this article we complete the proof---for a broad class of
four-manifolds---of Witten's conjecture that the Donaldson and Seiberg-Witten
series coincide, at least through terms of degree less than or equal to c-2,
where c is a linear combination of the Euler characteristic and signature of
the four-manifold. This article is a revision of sections 4--7 of an earlier
version, while a revision of sections 1--3 of that earlier version now appear
in a separate companion article (math.DG/0007190). Here, we use our
computations of Chern classes for the virtual normal bundles for the
Seiberg-Witten strata from the companion article (math.DG/0007190), a
comparison of all the orientations, and the PU(2) monopole cobordism to compute
pairings with the links of level-zero Seiberg-Witten moduli subspaces of the
moduli space of PU(2) monopoles. These calculations then allow us to compute
low-degree Donaldson invariants in terms of Seiberg-Witten invariants and
provide a partial verification of Witten's conjecture.
","[{""version"":""v1"",""created"":""Mon, 8 Dec 1997 22:38:53 GMT""},{""version"":""v2"",""created"":""Mon, 31 Jul 2000 14:23:41 GMT""},{""version"":""v3"",""created"":""Fri, 9 Feb 2001 11:03:39 GMT""}]","2016-04-08"
"funct-an/9712002","N. Christopher Phillips","Eberhard Kirchberg (Humboldt-Universit\""at zu Berlin), N. Christopher
  Phillips (University of Oregon)","Embedding of exact C*-algebras and continuous fields in the Cuntz
  algebra O_2","AMS-LaTeX, 48 pages",,,,"funct-an math.OA",,"  We prove that any separable exact C*-algebra is isomorphic to a subalgebra of
the Cuntz algebra ${\cal O}_2.$ We further prove that if $A$ is a simple
separable unital nuclear C*-algebra, then ${\cal O}_2 \otimes A \cong {\cal
O}_2,$ and if, in addition, $A$ is purely infinite, then ${\cal O}_{\infty}
\otimes A \cong A.$
  The embedding of exact C*-algebras in $\OA{2}$ is continuous in the following
sense. If $A$ is a continuous field of C*-algebras over a compact manifold or
finite CW complex $X$ with fiber $A (x)$ over $x \in X,$ such that the algebra
of continuous sections of $A$ is separable and exact, then there is a family of
injective homomorphisms $\phi_x : A (x) \to {\cal O}_2$ such that for every
continuous section $a$ of $A$ the function $x \mapsto \phi_x (a (x))$ is
continuous. Moreover, one can say something about the modulus of continuity of
the functions $x \mapsto \phi_x (a (x))$ in terms of the structure of the
continuous field. In particular, we show that the continuous field $\theta
\mapsto A_{\theta}$ of rotation algebras posesses unital embeddings
$\phi_{\theta}$ in ${\cal O}_2$ such that the standard generators $u (\theta)$
and $v (\theta)$ are mapped to $\operatorname{Lip}^{1/2}$ functions.
","[{""version"":""v1"",""created"":""Tue, 9 Dec 1997 09:07:41 GMT""}]","2016-08-15"
"funct-an/9712003","Vladimir Kisil","Vladimir V. Kisil (Odessa University, Ukraine)","Analysis in $R^{1,1}$ or the Principal Function Theory","25 pages, 2 figures. 14/12/97: Language corrections","Complex Variables Theory Appl., 40(1999), no.2, pp. 93--118",,,"funct-an math.CV math.FA",,"  We explore a function theory connected with the principal series
representation of SL(2,R) in contrast to standard complex analysis connected
with the discrete series.
  We construct counterparts for the Cauchy integral formula, the Hardy space,
the Cauchy-Riemann equation and the Taylor expansion.
  Keywords: Complex analysis, Cauchy integral formula, Hardy space, Taylor
expansion, Cauchy-Riemann equations, Dirac operator, group representations,
SL(2,R), discrete series, principal series, wavelet transform, coherent states.
","[{""version"":""v1"",""created"":""Tue, 9 Dec 1997 15:31:32 GMT""},{""version"":""v2"",""created"":""Sun, 14 Dec 1997 17:21:23 GMT""}]","2007-05-23"
"gr-qc/9712037","Luciano Rezzolla","L. Rezzolla(1), A. M. Abrahams(1), T. W. Baumgarte(1), G. B. Cook(2),
  M. A. Scheel(2), S. L. Shapiro(1) and S. A. Teukolsky(2) ((1) University of
  Illinois at Urbana-Champaign, (2) Cornell University)","Waveform propagation in black hole spacetimes: evaluating the quality of
  numerical solutions","13 pages, RevTeX, to appear in Phys. Rev. D","Phys.Rev. D57 (1998) 1084-1091","10.1103/PhysRevD.57.1084",,"gr-qc",,"  We compute the propagation and scattering of linear gravitational waves off a
Schwarzschild black hole using a numerical code which solves a generalization
of the Zerilli equation to a three dimensional cartesian coordinate system.
Since the solution to this problem is well understood it represents a very good
testbed for evaluating our ability to perform three dimensional computations of
gravitational waves in spacetimes in which a black hole event horizon is
present.
","[{""version"":""v1"",""created"":""Mon, 8 Dec 1997 16:20:27 GMT""}]","2009-10-30"
"gr-qc/9712040","Iosif B. Khriplovich","I.B. Khriplovich and A.A. Pomeransky","Tail of Gravitational Radiation and Coulomb Final-State Interaction","4 pages, latex","Phys.Lett. A252 (1999) 17-19","10.1016/S0375-9601(98)00922-0","BINP 97-97","gr-qc",,"  We present a simple intuitive derivation of the corrections to the intensity
of gravitational radiation due to the so-called tail effect.
","[{""version"":""v1"",""created"":""Tue, 9 Dec 1997 04:48:11 GMT""}]","2009-10-30"
"gr-qc/9712041","Shahar Hod","Shahar Hod and Tsvi Piran","Late-Time Evolution of Charged Gravitational Collapse and Decay of
  Charged Scalar Hair - I","14 pages, latex, no figures","Phys.Rev. D58 (1998) 024017","10.1103/PhysRevD.58.024017",,"gr-qc",,"  We study analytically the asymptotic evolution of charged fields around a
Reissner-Nordstr\""om black-hole. Following the no-hair theorem we focus
attention on the dynamical mechanism by which the charged hair is radiated
away. We find an inverse power-law relaxation of the charged fields at future
timelike infinity, along future null infinity and an oscillatory inverse
power-law relaxation along the future outer horizon. We show that a charged
hair is shedd slower than a neutral one. Our results are also of importance to
the study of mass inflation and the stability of Cauchy horizons during a
dynamical gravitational collapse of charged matter to form a charged black-hole
","[{""version"":""v1"",""created"":""Tue, 9 Dec 1997 10:32:44 GMT""}]","2009-10-30"
"hep-ex/9712010","Preprints Libr/pam","CLEO Collaboration, D. Bliss et al","New Limits for Neutrinoless Tau Decays","11 page postscript file, postscript file also available through
  http://w4.lns.cornell.edu/public/CLNS","Phys.Rev.D57:5903-5907,1998","10.1103/PhysRevD.57.5903","CLNS 97/1530, CLEO 97-29","hep-ex",,"  Neutrinoless 3-prong tau lepton decays into a charged lepton and either two
charged particles or one neutral meson have been searched for using 4.79
fb^{-1} of data collected with the CLEO II detector at CESR. This analysis
represents an update of a previous study and the addition of six decay
channels. In all channels the numbers of events found are compatible with
background estimates and branching fraction upper limits are set for 28
different decay modes. These limits are either more stringent than those set
previously or represent the first attempt to find these decays.
","[{""version"":""v1"",""created"":""Mon, 8 Dec 1997 20:28:48 GMT""}]","2010-04-08"
"hep-ex/9712011","Eichler Ralph","R. Eichler","Soft and Diffractive Phenomena","10 pages, 11 Figures",,,"ETHZ-IPP 97-08","hep-ex",,"  Recent results on hard diffraction at HERA and the Tevatron are presented.
Charged particle multiplicities in diffraction and differences in multiplicity
in quark and gluon jets measured at LEP are discussed. Spin effects in the
fragmentation of leading quarks show some interesting features.
","[{""version"":""v1"",""created"":""Tue, 9 Dec 1997 12:48:54 GMT""}]","2007-05-23"
"hep-lat/9712009","Tomohiro Hotta","T. Hotta, T. Izubuchi and J. Nishimura","Single massless Majorana fermion in the domain-wall formalism","9 pages, LaTeX, 3 figures, elsart.sty, epsf.sty","Mod.Phys.Lett. A13 (1998) 1667-1674","10.1142/S0217732398001741","UT-Komaba 97-16, DPNU-97-58","hep-lat",,"  We study the domain-wall formalism with additional Majorana mass term for the
unwanted zero mode, which has recently been proposed for lattice construction
of 4D N=1 super Yang-Mills theory without fine-tuning. Switching off the gauge
field, we study the dispersion relation of the energy eigenstates numerically,
and find that the method works for reasonable values of Majorana mass. We point
out, however, that a problem arises for too large Majorana mass, which can be
understood in terms of the seesaw mechanism.
","[{""version"":""v1"",""created"":""Tue, 9 Dec 1997 04:38:42 GMT""}]","2009-10-30"
"hep-lat/9712010","Kari Rummukainen","MILC Collaboration: Claude Bernard, Tom Blum, Thomas A. DeGrand,
  Carleton DeTar, Steven Gottlieb, Urs M. Heller, James Hetrick, Craig McNeile,
  K. Rummukainen, Bob Sugar, Doug Toussaint","Quenched hadron spectroscopy with improved staggered quark action","New references added","Phys.Rev.D58:014503,1998","10.1103/PhysRevD.58.014503","NORDITA-97/84P, IUHET-374, FSU-SCRI-97-130, AZPH-TH/97-13","hep-lat",,"  We investigate light hadron spectroscopy with an improved quenched staggered
quark action. We compare the results obtained with an improved gauge plus an
improved quark action, an improved gauge plus standard quark action, and the
standard gauge plus standard quark action. Most of the improvement in the
spectroscopy results is due to the improved gauge sector. However, the improved
quark action substantially reduces violations of Lorentz invariance, as
evidenced by the meson dispersion relations.
","[{""version"":""v1"",""created"":""Tue, 9 Dec 1997 12:47:26 GMT""},{""version"":""v2"",""created"":""Thu, 11 Dec 1997 17:45:54 GMT""}]","2008-11-26"
"hep-lat/9712011","Ray L. Renken","Ray L. Renken, Simon M. Catterall, and John B. Kogut","Phase Structure of Dynamical Triangulation Models in Three Dimensions",,"Nucl.Phys. B523 (1998) 553-568","10.1016/S0550-3213(98)00142-4",,"hep-lat",,"  The dynamical triangulation model of three-dimensional quantum gravity is
shown to have a line of transitions in an expanded phase diagram which includes
a coupling mu to the order of the vertices. Monte Carlo renormalization group
and finite size scaling techniques are used to locate and characterize this
line. Our results indicate that for mu < mu1 ~ -1.0 the model is always in a
crumpled phase independent of the value of the curvature coupling. For mu < 0
the results are in agreement with an approximate mean field treatment. We find
evidence that this line corresponds to first order transitions extending to
positive mu. However, the behavior appears to change for mu > mu2 ~ 2-4. The
simplest scenario that is consistent with the data is the existence of a
critical end point.
","[{""version"":""v1"",""created"":""Tue, 9 Dec 1997 14:53:23 GMT""}]","2009-10-30"
"hep-ph/9712282","David Delphenich","David Delphenich (Syracuse U.), Joseph Schechter (Syracuse U.)","Remark on the Potential Function of the Linear Sigma Model","26 pages, 11 figures (gzipped)","Phys.Rev. D57 (1998) 3962-3970","10.1103/PhysRevD.57.3962","SU-4240-669","hep-ph",,"  It is shown that the potential functions for the ordinary linear sigma model
can be divided into two topographically different types depending on whether
the quantity $R\equiv(m_\sigma/m_\pi)^2$ is greater than or less than nine.
  Since the Wigner-Weyl mode (R=1) and the Nambu-Goldstone mode ($R=\infty$
belong to different regions, we speculate that this classification may provide
a generalization to the broken symmetry situation, which could be convenient
for roughly characterizing different possible applications of the model. It is
noted that a more complicated potential does not so much change this picture as
add different new regions.
","[{""version"":""v1"",""created"":""Mon, 8 Dec 1997 23:48:03 GMT""}]","2009-10-30"
"hep-ph/9712287","David Atwood","David Atwood and Amarjit Soni","The Possibility of Large Direct CP Violation in B to K pi-Like Modes Due
  to Long Distance Rescattering Effects and Implications for the Angle gamma","45 pages; 5 figures. In replacement we have : 1) corrected many
  typos, 2) added references, 3) decided to subdivide Simple CP into 2
  categories and 4) Modified figure 3 to explain that","Phys.Rev.D58:036005,1998","10.1103/PhysRevD.58.036005","AMES-HET 97-10","hep-ph",,"  We consider the strong rescattering effects that can occur in the decays such
as B -> K pi, K* pi, K rho... and their impact on direct CP violation in these
modes. First we discuss, in general, how the CPT theorem constrains the
resulting pattern of partial rate asymmetries leading to different brands of
direct CP. Traditional discussions have centered around the absorptive part of
the penguin graph which has Delta I=0 in b -> s transitions and as a result
causes ``simple'' CP violation; long-distance final state rescattering effects,
in general, will lead to a different pattern of CP: ``compound'' CP violation.
Predictions of simple CP are quite distinct from that of compound CP. Final
states rescattering phases in B decays are unlikely to be small possibly
causing large compound CP violating partial rate asymmetries in these modes.
CPT theorem requires a cancellation of PRA due to compound CP amongst the
$K\pi$ states themselves; thus there can be no net cancellation with other
states such as K*\pi, K\rho etc. Therefore, each class of such modes, namely K
pi, K rho, K^*pi, K a_1 etc. can have large direct CP emanating from
rescattering effects. Various repercussions for the angle $\gamma$ are also
discussed.
","[{""version"":""v1"",""created"":""Mon, 8 Dec 1997 23:46:24 GMT""},{""version"":""v2"",""created"":""Wed, 17 Dec 1997 04:01:59 GMT""}]","2014-11-17"
"hep-ph/9712299","Brian W. Harris","B. W. Harris and J. F. Owens (Florida State University)","Jet photoproduction and the structure of the photon","20 pages including 11 figures. Latex using revtex and psfig macros.
  Several references added. Submitted to Phys. Rev. D","Phys.Rev. D57 (1998) 5555-5561","10.1103/PhysRevD.57.5555","FSU-HEP-971020","hep-ph",,"  Various jet observables in photoproduction are studied and compared to data
from HERA. The feasibility of using a dijet sample for constraining the parton
distributions in the photon is then studied. For the current data the
experimental and theoretical uncertainties are comparable to the variation due
to changing the photon parton distribution set.
","[{""version"":""v1"",""created"":""Mon, 8 Dec 1997 16:01:03 GMT""},{""version"":""v2"",""created"":""Mon, 19 Jan 1998 21:24:26 GMT""}]","2009-10-30"
"hep-ph/9712300","Ellwanger","U. Ellwanger and C. Hugonie","Neutralino Cascades in the (M+1)SSM","25 pages (LaTeX2e), 8 figs., explanations added","Eur.Phys.J.C5:723-737,1998","10.1007/s100520050316","Orsay LPTHE-97-68","hep-ph",,"  In the (M+1)SSM an additional gauge singlet Weyl spinor appears in the
neutralino sector. For a large part of the parameter space this approximative
eigenstate is the true LSP. Then most sparticle decays proceed via an
additional cascade involving the NLSP -> LSP transition, where the NLSP is the
non-singlet next-to-lightest neutralino. We present a comprehensive list of all
processes, which contribute to the NLSP -> LSP transition, the partial widths
and the total NLSP decay rate. We perform a scan of the parameters of the model
compatible with universal soft terms, and find that the NLSP life time can be
quite large, leading to macroscopically displaced vertices. Our results imply
that the signatures for sparticle production in the (M+1)SSM can be very
different from the MSSM, and are important for calculations of the abundance of
dark matter in this model.
","[{""version"":""v1"",""created"":""Mon, 8 Dec 1997 16:15:28 GMT""},{""version"":""v2"",""created"":""Fri, 13 Mar 1998 11:59:59 GMT""}]","2011-09-13"
