"hep-ph/9712301","Robin Devenish","A. M. Cooper-Sarkar, R. C. E. Devenish and A. De Roeck","Structure Functions of the Nucleon and their Interpretation","196 pages, 79 figures, uses ijmpa.sty and psfig.tex (included)","Int.J.Mod.Phys.A13:3385-3586,1998","10.1142/S0217751X98001670","OUNP-97-10, DESY 97-226","hep-ph",,"  The current status of measurements of the nucleon structure functions and
their understanding is reviewed. The fixed target experiments E665, CCFR and
NMC and the HERA experiments H1 and ZEUS are discussed in some detail. The
extraction of parton momentum distribution functions from global fits is
described, with particular attention paid to much improved information on the
gluon momentum distribution. The status of alpha_s measurements from deep
inelastic data is reviewed. Models and non-perturbative approaches for the
parton input distributions are outlined. The impact on the phenomenology of QCD
of the data at very low values of the Bjorken x variable is discussed in
detail. Recent advances in the understanding of the transition from deep
inelastic scattering to photoproduction are summarised. Some brief comments are
made on the recent HERA measurements of the ep NC and CC cross-sections at very
high Q2.
","[{""version"":""v1"",""created"":""Mon, 8 Dec 1997 16:37:24 GMT""}]","2010-03-25"
"hep-ph/9712302","Martin Beneke","M. Beneke (CERN), A. Signer (CERN) and V.A. Smirnov (Moscow State U.)","Two-loop Correction to the Leptonic Decay of Quarkonium","7 pages, LaTeX, 1 figure included via epsf.sty","Phys.Rev.lett.80:2535-2538,1998","10.1103/PhysRevLett.80.2535","CERN-TH/97-353","hep-ph",,"  Applying asymptotic expansions at threshold, we compute the two-loop QCD
correction to the short-distance coefficient that governs the leptonic decay
$\psi\to l^+ l^-$ of a S-wave quarkonium state and discuss its impact on the
relation between the quarkonium non-relativistic wave function at the origin
and the quarkonium decay constant in full QCD.
","[{""version"":""v1"",""created"":""Mon, 8 Dec 1997 18:30:40 GMT""}]","2008-11-26"
"hep-ph/9712303","Alexander Belyaev","A.S.Belyaev, A.V.Gladyshev, A.V.Semenov","Minimal Supersymmetric Standard Model within CompHEP software package","11 pages, LaTeX, submitted to Comp. Phys. Communication",,,"IFT - P.075/97","hep-ph",,"  The Minimal Supersymmetric Standard Model is presented as a model for the
CompHEP software package as a set of files containing the complete Lagrangian
of the MSSM, particle contents and parameters. All resources of CompHEP with a
user-friendly interface are now available for the phenomenological study of the
MSSM. Various special features of the model are discussed.
","[{""version"":""v1"",""created"":""Mon, 8 Dec 1997 19:15:25 GMT""},{""version"":""v2"",""created"":""Tue, 9 Dec 1997 13:07:03 GMT""}]","2007-05-23"
"hep-ph/9712304","A. B. Balantekin","A.B. Balantekin","Exact Solutions for Matter-Enhanced Neutrino Oscillations","Submitted to Physical Review D. Latex file, 8 pages. This paper is
  also available at http://nucth.physics.wisc.edu/preprints/","Phys.Rev.D58:013001,1998","10.1103/PhysRevD.58.013001","MAD-NT-97-09, DOE/ER/40561-347-INT97-00-186","hep-ph",,"  The analogy between supersymmetric quantum mechanics and matter-enhanced
neutrino oscillations is exploited to obtain exact solutions for a class of
electron density profiles. This integrability condition is analogous to the
shape-invariance in supersymmetric quantum mechanics. This method seems to be
the most direct way to obtain the exact survival probabilities for a number of
density profiles of interest, such as linear and exponential density profiles.
The resulting neutrino amplitudes can also be utilized as comparison amplitudes
for the uniform semiclassical treatment of neutrino propagation in arbitrary
electron density profiles.
","[{""version"":""v1"",""created"":""Mon, 8 Dec 1997 20:30:51 GMT""}]","2009-12-30"
"hep-ph/9712305",,"Howard Baer, Michal Brhlik, Diego Castano and Xerxes Tata","$b\to s\gamma$ Constraints on the Minimal Supergravity Model with Large
  $\tan\beta$","14 page REVTEX file plus 6 PS figures","Phys.Rev. D58 (1998) 015007","10.1103/PhysRevD.58.015007","FSU-HEP-971104, UH-511-887-97, UM-TH-97-19","hep-ph",,"  In the minimal supergravity model (mSUGRA), as the parameter $\tan\beta$
increases, the charged Higgs boson and light bottom squark masses decrease,
which can potentially increase contributions from $tH^\pm$, $\tg\tb_j$ and
$\tz_i\tb_j$ loops in the decay $b\to s\gamma$. We update a previous QCD
improved $b\to s\gamma$ decay calculation to include in addition the effects of
gluino and neutralino loops. We find that in the mSUGRA model, loops involving
charginos also increase, and dominate over $tW$, $tH^\pm$, $\tg\tq$ and
$\tz_i\tq$ contributions for $\tan\beta\agt 5-10$. We find for large values of
$\tan\beta \sim 35$ that most of the parameter space of the mSUGRA model for
$\mu <0$ is ruled out due to too large a value of branching ratio $B(b\to
s\gamma)$. For $\mu >0$ and large $\tan\beta$, most of parameter space is
allowed, although the regions with the least fine-tuning (low $m_0$ and
$m_{1/2}$) are ruled out due to too low a value of $B(b\to s\gamma)$. We
compare the constraints from $b\to s\gamma$ to constraints from the neutralino
relic density, and to expectations for sparticle discovery at LEP2 and the
Fermilab Tevatron $p\bar p$ colliders. Finally, we show that non-universal GUT
scale soft breaking squark mass terms can enhance gluino loop contributions to
$b\to s\gamma$ decay rate even if these are diagonal.
","[{""version"":""v1"",""created"":""Mon, 8 Dec 1997 21:28:04 GMT""}]","2009-10-30"
"hep-ph/9712306","Yuval Grossman","Yuval Grossman and Helen R. Quinn","Bounding the effect of penguin diagrams in $a_{CP}(B^0 \to \pi^+\pi^-)$","10 pages, revtex + axodraw, 2 figures included","Phys.Rev.D58:017504,1998","10.1103/PhysRevD.58.017504","SLAC-PUB-7713","hep-ph",,"  A clean determination of the angle $\alpha$ of the unitary triangle from
$B\to \pi\pi$ decays requires an isospin analysis. If the $B \to \pi^0\pi^0$
and $\bar B \to \pi^0\pi^0$ decay rates are small it may be hard to carry out
this analysis. Here we show that an upper bound on the error on $\sin 2\alpha$
due to penguin diagram effects can be obtained using only the measured rate
$\BR(B^\pm \to \pi^\pm \pi^0)$ and an upper bound on the combined rate $\BR(B
\to \pi^0 \pi^0) + \BR(\bar B \to \pi^0 \pi^0)$. Since no b flavor tagging is
needed to measure this combined rate, the bound that can be achieved may be
significantly better than any approach which requires separate flavor-tagged
neutral pion information.
","[{""version"":""v1"",""created"":""Mon, 8 Dec 1997 22:14:36 GMT""}]","2010-11-23"
"hep-ph/9712307","Kaladi Babu","K.S. Babu (Institute for Advanced Study, Princeton), J.C. Pati
  (University of Maryland) and F. Wilczek (Institute for Advanced Study,
  Princeton)","Suggested new modes in supersymmetric proton decay","17 pages LateX, includes 4 figures","Phys.Lett. B423 (1998) 337-347","10.1016/S0370-2693(98)00108-7","IASSNS-HEP-97-136, UMD-PP-98-55","hep-ph",,"  We show that in supersymmetric unified theories such as SO(10),
implementation of the see-saw mechanism for neutrino masses introduces a new
set of color triplet fields and thereby a new source of d=5 proton decay
operators. For neutrino masses in a plausible range, these operators are found
to have the right strength to yield observable, but not yet excluded, proton
decay rates. The flavor structure of the new operators is distinctive. Proton
decay modes into a charged lepton, such as l^+ \pi^0, l^+ K^0 and l^+ \eta
where l = e or \mu, can become prominent, even for low or moderate values of
tan(\beta) < 10, along with the \nu K^+ and \nu \pi^+ modes. A distinctive
feature is the charged lepton modes involving an e^+ and/or a \mu^+ with the
ratio \Gamma(l^+ K^0):\Gamma(l^+ \pi^0) = 2:1.
","[{""version"":""v1"",""created"":""Mon, 8 Dec 1997 22:55:05 GMT""}]","2009-10-30"
"hep-ph/9712308","Robin Stuart","Robin G. Stuart (Randall Laboratory of Physics)","$O(N_f\alpha^2)$ Radiative Corrections in Low-Energy Electroweak
  Processes","4 pages LaTeX. 2 figures. Uses prhep97.sty, amsmath.sty and
  epsfig.sty. Talk presented at the International Europhysics Conference on
  High-Energy Physics, Jerusalem, Isreal, 19-26, August 1997",,,,"hep-ph",,"  Of the the three best-measured electroweak observables, $\alpha$, $G_\mu$ and
$M_Z$, the first two are extracted from low-energy processes. Both $G_\mu$ and
$M_Z$ are now known to an accuracy of about 2 parts in $10^5$ and there is a
proposal to improve the measurement of the muon lifetime by a factor of 10 in
an experiment at Brookhaven. Yet calculations of electroweak radiative
corrections currently do no better than a few parts in $10^3$--$10^4$ and
therefore cannot exploit to available experimental precision. We report on the
calculation of the ${\cal O}(N_f\alpha^2)$ corrections to Thomson scattering
and the muon lifetime from which $\alpha$ and $G_\mu$, respectively, are
obtained. The ${\cal O}(N_f\alpha^2)$ corrections are expected to be a dominant
gauge-invariant subset of 2-loop corrections.
","[{""version"":""v1"",""created"":""Mon, 8 Dec 1997 22:55:53 GMT""}]","2007-05-23"
"hep-ph/9712309","Hubert Spiesberger","G. Kramer, D. Michelsen and H. Spiesberger","Production of Hard Photons and Jets in Deep Inelastic Lepton Proton
  Scattering at Order O(\alpha_s)","20 pages Latex, 12 postscript figures and axodraw.sty included","Eur.Phys.J.C5:293-301,1998","10.1007/s100520050272","DESY 97-242, BI-TP 97/56","hep-ph",,"  We calculate the O(\alpha_s) corrections to the production of a hard and
isolated photon accompanied by one or two jets in deep inelastic lepton nucleon
scattering at HERA. Numerical results are presented and the potential of this
process for studies of parton distribution functions is discussed.
","[{""version"":""v1"",""created"":""Tue, 9 Dec 1997 10:34:13 GMT""}]","2011-09-13"
"hep-ph/9712310","Dima Bardin","D. Bardin, L. Kalinovskaya","QED Corrections for Polarized Elastic MU-E Scattering",,,,,"hep-ph",,"  We present a new study of polarized elastic muon-electron scattering. The
Born cross-section is calculated for arbitrary polarization of muon and
electron. The complete photonic O(alpha) radiative corrections are determined
for the case of longitudinally polarized muons and electrons. All calculations
are done by two methods: semianalytic, which allows an implementation of the
experimental cuts used for the analysis of MU-E scattering data from the beam
polarimeter of the SMC experiment at CERN and completely analytic, which is
used for cross checks The FORTRAN code MUELA realizes formulae of both
approaches. We prove that certain experimental cuts lead to negligible
radiative corrections in the muon beam polarization experiment.
","[{""version"":""v1"",""created"":""Tue, 9 Dec 1997 11:20:08 GMT""}]","2007-05-23"
"hep-ph/9712311","Dmitry Ostrovsky","A.V. Leonidov, D.M. Ostrovsky (Theoretical Department, Lebedev Physics
  Institute, Moscow)","Nonperturbative Violation of Factorial Moments Scaling in Dissipative
  QCD jets","11 pages, 7 eps figures","Phys.Atom.Nucl. 62 (1999) 701-707; Yad.Fiz. 62 (1999) 750-757",,"FIAN/TD-24/97","hep-ph",,"  The nonperturbative modification of the evolution equation for QCD generating
functional is applied to the analysis of the factorial moments of the intrajet
particle distributions in QCD. Nonperturbative preasymptotic correction to the
factorial moments scaling (F-scaling) is calculated. The results are compared
with the available experimental data. The data show the possible presence of
such a nonperturbative effect.
","[{""version"":""v1"",""created"":""Tue, 9 Dec 1997 11:22:08 GMT""}]","2007-05-23"
"hep-ph/9712312","Per Osland","P.N. Burrows (MIT) and P. Osland (Bergen and DESY)","Event Orientation in e+e- Annihilation","8 pages, LaTeX, 4 figures, uses epsf, to appear in the Proceedings of
  the XIIth International Workshop on High Energy Physics and Quantum Field
  Theory, 4-10 September 1997, Samara, Russia",,,"DESY 97-244","hep-ph hep-ex",,"  We review the orientation of e+e- \to q\bar q g events in terms of the polar
and azimuthal angles of the event plane w.r.t. the electron beam direction. The
asymmetry of the azimuthal-angle distribution is, like the left-right
forward-backward polar-angle asymmetry, sensitive to parity-violating effects
in three-jet events; these are presently being explored experimentally. We
present these observables at O(\alpha_s) in perturbative QCD and discuss their
dependence on longitudinal beam polarisation and c.m. energy. A moments
analysis in terms of the orientation angles allows a more detailed test of QCD
by isolating the independent helicity cross-sections.
","[{""version"":""v1"",""created"":""Tue, 9 Dec 1997 11:48:45 GMT""}]","2007-05-23"
"hep-th/9712071","Savdeep Sethi","Ori J. Ganor and Savdeep Sethi","New Perspectives on Yang-Mills Theories With Sixteen Supersymmetries","44 pages, harvmac; references added","JHEP 9801:007,1998","10.1088/1126-6708/1998/01/007",,"hep-th",,"  We describe various approaches that give matrix descriptions of compactified
NS five-branes. As a result, we obtain matrix models for Yang-Mills theories
with sixteen supersymmetries in dimensions $2,3,4$ and 5. The equivalence of
the various approaches relates the Coulomb branch of certain gauge theories to
the moduli space of instantons on $T^4$. We also obtain an equivalence between
certain six-dimensional string theories. Further, we discuss how various
perturbative and non-perturbative features of these Yang-Mills theories appear
in their matrix formulations. The matrix model for four-dimensional Yang-Mills
is manifestly S-dual. In this case, we describe how electric fluxes, magnetic
fluxes and the interaction between vector particles are realized in the matrix
model.
","[{""version"":""v1"",""created"":""Mon, 8 Dec 1997 18:46:29 GMT""},{""version"":""v2"",""created"":""Tue, 23 Dec 1997 15:11:48 GMT""}]","2010-02-03"
"hep-th/9712074","Shiraz Minwalla","Shiraz Minwalla","Restrictions Imposed by Superconformal Invariance on Quantum Field
  Theories","66 pages, harvmac. v2: New section on applications added. d=6 results
  slightly tightened","Adv.Theor.Math.Phys.2:781-846,1998",,"PUPT-1748","hep-th",,"  We derive unitarity restrictions on the scaling dimensions of primary
operators in a superconformal quantum field theory, in d=3,4,5,6.
","[{""version"":""v1"",""created"":""Mon, 8 Dec 1997 20:42:12 GMT""},{""version"":""v2"",""created"":""Mon, 16 Mar 1998 04:15:07 GMT""}]","2008-11-26"
"hep-th/9712080","David McMullan","Emili Bagan, Martin Lavelle, David McMullan","Soft Dynamics and Gauge Theories","10 pages, 8 figures; version to appear in Phys. Rev. D [RC], minor
  clarifications","Phys.Rev.D57:4521-4524,1998","10.1103/PhysRevD.57.4521","UAB-FT-417","hep-th hep-ph",,"  Infra-red divergences obscure the underlying soft dynamics in gauge theories.
They remove the pole structures associated with particle propagation in the
various Green's functions of gauge theories. Here we present a solution to this
problem. We give two equations which describe how charged particles must be
dressed by gauge degrees of freedom. One follows from gauge invariance, the
other, which is new, from velocity superselection rules familiar from the heavy
quark effective theory. The solution to these equations in the abelian theory
is proven to lead to on-shell Green's functions that are free of soft
divergences at all orders in perturbation theory.
","[{""version"":""v1"",""created"":""Mon, 8 Dec 1997 16:22:29 GMT""},{""version"":""v2"",""created"":""Tue, 17 Feb 1998 16:39:13 GMT""}]","2009-12-30"
"hep-th/9712081","Jose Carlos Brunelli","J. C. Brunelli and Ashok Das","A Lax Representation for the Born-Infeld Equation","Latex, 14 pages, Note and references added, incorporating connection
  with hyperbolic Monge-Amp\`ere equations","Phys.Lett. B426 (1998) 57-63","10.1016/S0370-2693(98)00265-2",,"hep-th nlin.SI solv-int",,"  We study the Born-Infeld equation from a Lagrangian point of view emphasizing
the duality symmetry present in such systems. We obtain the Hamiltonian
formulation directly from the Lagrangian. We also show that this system admits
a dispersionless nonstandard Lax representation which directly leads to all the
conserved charges (including the ones not previously obtained). We also present
the generating function for these charges and point out various other
properties of this system.
","[{""version"":""v1"",""created"":""Mon, 8 Dec 1997 16:47:45 GMT""},{""version"":""v2"",""created"":""Thu, 22 Jan 1998 11:16:52 GMT""}]","2009-10-30"
"hep-th/9712082","Kasper Peeters","B. de Wit, K. Peeters and J.C. Plefka","Supermembranes and Supermatrix Models","LaTeX, sprocl.sty. Contribution to the proceedings of the Valencia
  workshop 'Beyond the standard model; from theory to experiment', October
  13-17, 1997. 8 pages. Typos and omission in eq. (3) corrected and one
  reference added",,,"THU-97/40, NIKHEF 97-050","hep-th",,"  We briefly review recent developments in the theory of supermembranes and
supermatrix models. In a second part we discuss their interaction with
background fields. In particular, we present the full background field coupling
for the bosonic case. This is a short summary of the talk at the workshop. A
more extended version will appear elsewhere.
","[{""version"":""v1"",""created"":""Mon, 8 Dec 1997 16:48:08 GMT""},{""version"":""v2"",""created"":""Tue, 6 Jan 1998 09:50:25 GMT""},{""version"":""v3"",""created"":""Fri, 13 Feb 1998 18:06:20 GMT""}]","2007-05-23"
"hep-th/9712083","Yasha Shnir","Ya.M. Shnir (DAMTP, Cambridge)","Forced kink of $\lambda \phi ^4$ mode","3 pages, LaTeX, to appear in Proceedings 5th Wigner Symposium,
  Vienna, Aug 97",,,,"hep-th",,"  The motion of a one-dimensional kink and its energy losses are considered as
a model of interaction of nontrivial topological field configurations with
external fields.
","[{""version"":""v1"",""created"":""Mon, 8 Dec 1997 18:04:37 GMT""}]","2007-05-23"
"hep-th/9712084","Niels Obers","N.A. Obers, B. Pioline and E. Rabinovici","M-Theory and U-duality on T^d with Gauge Backgrounds","27 pages, LaTeX2e; version to appear in Nucl. Phys. B, discussion of
  spectral flow in Section 2 significantly improved, minor corrections","Nucl.Phys.B525:163-181,1998","10.1016/S0550-3213(98)00264-8","CERN-TH/97-357, CPTH-S586.1297, RI-12-97","hep-th",,"  The full U-duality symmetry of toroidally compactified M-theory can only be
displayed by allowing non-rectangular tori with expectation values of the gauge
fields. We construct an E_d(Z) U-duality invariant mass formula incorporating
non-vanishing gauge backgrounds of the M-theory three-form C. We interpret this
mass formula from the point of view of the Matrix gauge theory, and identify
the coupling of the three-form to the gauge theory as a topological theta term,
in agreement with earlier conjectures. We give a derivation of this fact from
D-brane analysis, and obtain the Matrix gauge theory description of other gauge
backgrounds allowed by the Discrete Light-Cone Quantization. We further show
that the conjectured extended U-duality symmetry of Matrix theory on T^d in the
Discrete Light-Cone Quantization has an implementation as an action of
E_{d+1}(Z) on the BPS spectrum. Some implications for the proper interpretation
of the rank N of the Matrix gauge theory are discussed.
","[{""version"":""v1"",""created"":""Mon, 8 Dec 1997 18:25:41 GMT""},{""version"":""v2"",""created"":""Mon, 15 Dec 1997 15:34:45 GMT""},{""version"":""v3"",""created"":""Thu, 16 Apr 1998 09:52:31 GMT""}]","2010-11-19"
"hep-th/9712085","Beatriz Gato","Matthias Doerrzapf and Beatriz Gato-Rivera","Transmutations between Singular and Subsingular Vectors of the N=2
  Superconformal Algebras","21 pages, Latex. Minor improvements. Very similar to the version
  published in Nucl. Phys. B","Nucl.Phys. B557 (1999) 517-534","10.1016/S0550-3213(99)00380-6","HUTP-97/A055, IMAFF-FM-97/04, Nucl. Phys. B 557 [PM] (1999) 517","hep-th alg-geom funct-an math-ph math.MP q-alg",,"  We present subsingular vectors of the N=2 superconformal algebras other than
the ones which become singular in chiral Verma modules, reported recently by
Gato-Rivera and Rosado. We show that two large classes of singular vectors of
the Topological algebra become subsingular vectors of the Antiperiodic NS
algebra under the topological untwistings. These classes consist of BRST-
invariant singular vectors with relative charges $q=-2,-1$ and zero conformal
weight, and no-label singular vectors with $q=0,-1$. In turn the resulting NS
subsingular vectors are transformed by the spectral flows into subsingular and
singular vectors of the Periodic R algebra. We write down these singular and
subsingular vectors starting from the topological singular vectors at levels 1
and 2.
","[{""version"":""v1"",""created"":""Mon, 8 Dec 1997 23:49:35 GMT""},{""version"":""v2"",""created"":""Mon, 13 Dec 1999 18:45:34 GMT""}]","2009-10-30"
"hep-th/9712086","Michael B. Green","Constantin P. Bachas, Michael B. Green and Adam Schwimmer","(8,0) Quantum mechanics and symmetry enhancement in type I' superstrings","30 pages LaTeX, Five figures. Two references added as well as some
  Comments in section4. v4: Missing backslashes added to four reference
  citations!","JHEP 9801:006,1998","10.1088/1126-6708/1998/01/006","CPTH/S570.1297; DAMTP/97-50; WIS/97-34","hep-th",,"  The low-energy supersymmetric quantum mechanics describing D-particles in the
background of D8-branes and orientifold planes is analyzed in detail, including
a careful discussion of Gauss' law and normal ordering of operators. This
elucidates the mechanism that binds D-particles to an orientifold plane, in
accordance with the predictions of heterotic/type I duality. The ocurrence of
enhanced symmetries associated with massless bound states of a D-particle with
one orientifold plane is illustrated by the enhancement of $SO(14) \times U(1)$
to $E_8$ and $SO(12)\times U(1)$ to $E_7$ at strong type I' coupling.
Enhancement to higher-rank groups involves both orientifold planes. For
example, the enhanced $E_8 \times E_8 \times SU(2)$ symmetry at the self-dual
radius of the heterotic string is seen as the result of two D8-branes
coinciding midway between the orientifold planes, while the enhanced $SU(18)$
symmetry results from the coincidence of all sixteen D8-branes and $SO(34)$
when they also coincide with an orientifold plane. As a separate by-product,
the s-rule of brane-engineered gauge theories is derived by relating it through
a chain of dualities to the Pauli exclusion principle.
","[{""version"":""v1"",""created"":""Mon, 8 Dec 1997 20:27:06 GMT""},{""version"":""v2"",""created"":""Fri, 20 Feb 1998 14:14:34 GMT""},{""version"":""v3"",""created"":""Sun, 22 Feb 1998 20:24:26 GMT""},{""version"":""v4"",""created"":""Mon, 2 Mar 1998 18:56:42 GMT""}]","2014-11-18"
"hep-th/9712087","Martin Stock","R. Jackiw and S.-Y. Pi","Reducing the Chern-Simons term by a symmetry","Email correspondence to jackiw@mitlns.mit.edu ; 7 pages, REVTeX","Phys.Lett.B423:364-368,1998","10.1016/S0370-2693(98)00104-X","MIT-CTP-2696","hep-th",,"  Reducing a 3-dimensional Chern-Simons term by a symmetry yields other
topologically interesting structures. Specifically, reducing by radial symmetry
results in a 1-dimensional quantum mechanical model, which has recently been
used in an analysis of finite-temperature Chern-Simons theory. The radially
symmetric expression may be inserted into 3-dimensional monopole or
(2+1)-dimensional instanton equations, where it eliminates the monopole or
instanton solutions.
","[{""version"":""v1"",""created"":""Mon, 8 Dec 1997 20:41:25 GMT""}]","2014-11-18"
"hep-th/9712088","Antal Jevicki","Antal Jevicki","Light-Front Partons and Dimensional Reduction in Relativistic Field
  Theory","10 pages, phyzzx, replaced version includes corrections to some minor
  misprints in original","Phys.Rev.D57:5955-5958,1998","10.1103/PhysRevD.57.5955","BROWN-HET-1106","hep-th",,"  We present a simple discussion of the appearance of light-front partons in
local field theory.The description in terms of partons provides a dimensional
reduction which relates a 2+1 with a 3+1 dimensional theory for example. The
possibility for existence of Lorentz symmetry and a connection to the
relativistic membrane is described. It is shown how the reconstruction of the
full relativistic field theory is possible with a proper treatment of the
parton configuration space. Compared with the case of identical particles this
involves keeping configurations where the partons are at the same points.
","[{""version"":""v1"",""created"":""Tue, 9 Dec 1997 03:50:29 GMT""},{""version"":""v2"",""created"":""Fri, 2 Jan 1998 21:43:32 GMT""}]","2009-12-30"
"hep-th/9712091","Tigran Hakobyan","Aram A. Saharian","Higher Loop String Cosmology with Moduli and Antisymmetric Tensor Field","26 pages, LATEX file, 1 EPS figure included","Class.Quant.Grav.15:1951-1970,1998","10.1088/0264-9381/15/7/012","YSU-97-18","hep-th gr-qc",,"  The classical evolution of a homogeneous cosmological model is investigated
within the framework of low - energy effective string gravity with higher genus
corrections. Various conformal frames are considered. For the general case of
correction functions in the Lagrangian we give the cosmological solutions with
arbitrary curvature and dilaton, modulus and Kalb-Ramond fields. They
generalize previously known tree level solutions. The features of the solutions
are discussed.
","[{""version"":""v1"",""created"":""Tue, 9 Dec 1997 10:36:08 GMT""}]","2008-11-26"
