"cond-mat/9712170","Alex Bratkovski","Alexander Bratkovsky (HP Labs, Palo Alto)","Spin Tunneling in Conducting Oxides","13 pp., 4 figures via epsf, bibtmp.sty (incl.). Invited talk at the
  MRS Fall meeting in Boston, December 1-5, 1997","Science and Technology of Magnetic Oxides, Eds.:M.Hundley,
  J.Nickel, R.Ramesh, Y.Tokura (MRS, Vol.494, 1998).",,,"cond-mat",,"  Direct tunneling in ferromagnetic junctions is compared with
impurity-assisted, surface state assisted, and inelastic contributions to a
tunneling magnetoresistance (TMR). Theoretically calculated direct tunneling in
iron group systems leads to about a 30% change in resistance, which is close to
experimentally observed values. It is shown that the larger observed values of
the TMR might be a result of tunneling involving surface polarized states. We
find that tunneling via resonant defect states in the barrier radically
decreases the TMR (down to 4% with Fe-based electrodes), and a resonant tunnel
diode structure would give a TMR of about 8%. With regards to inelastic
tunneling, magnons and phonons exhibit opposite effects: one-magnon emission
generally results in spin mixing and, consequently, reduces the TMR, whereas
phonons are shown to enhance the TMR. The inclusion of both magnons and phonons
reasonably explains an unusual bias dependence of the TMR.
  The model presented here is applied qualitatively to half-metallics with 100%
spin polarization, where one-magnon processes are suppressed and the change in
resistance in the absence of spin-mixing on impurities may be arbitrarily
large. Even in the case of imperfect magnetic configurations, the resistance
change can be a few 1000 percent. Examples of half-metallic systems are
CrO$_2$/TiO$_2$ and CrO$_2$/RuO$_2$, and an account of their peculiar band
structures is presented. The implications and relation of these systems to CMR
materials which are nearly half-metallic, are discussed.
","[{""version"":""v1"",""created"":""Mon, 15 Dec 1997 17:27:47 GMT""},{""version"":""v2"",""created"":""Tue, 16 Dec 1997 01:16:48 GMT""}]","2007-05-23"
"cond-mat/9712171","D. E. Steinhauer","D. E. Steinhauer, C. P. Vlahacos, S. K. Dutta, B. J. Feenstra, F. C.
  Wellstood, and Steven M. Anlage","Quantitative Imaging of Sheet Resistance with a Scanning Near-Field
  Microwave Microscope","6 pages, 3 figures; To be published in Appl. Phys. Lett. (2/16/98);
  See also Steinhauer et al., Appl. Phys. Lett., vol. 71, p. 1736 (1997)
  cond-mat/9712142; See also
  http://www.csr.umd.edu/research/hifreq/micr_microscopy.html","Appl. Phys. Lett., vol. 72, no. 7, p. 861 (1998)","10.1063/1.120918",,"cond-mat.mtrl-sci cond-mat.supr-con",,"  We describe quantitative imaging of the sheet resistance of metallic thin
films by monitoring frequency shift and quality factor in a resonant scanning
near-field microwave microscope. This technique allows fast acquisition of
images at approximately 10 ms per pixel over a frequency range from 0.1 to 50
GHz. In its current configuration, the system can resolve changes in sheet
resistance as small as 0.6 Ohms/sq for 100 Ohms/sq films. We demonstrate its
use at 7.5 GHz by generating a quantitative sheet resistance image of a
YBa2Cu3O7 (YBCO) thin film on a 5 cm-diameter sapphire wafer.
","[{""version"":""v1"",""created"":""Mon, 15 Dec 1997 20:12:50 GMT""}]","2009-10-30"
"cond-mat/9712172","Thierry Jolicoeur","C. Monthus (Orsay), O. Golinelli, Th. Jolicoeur (Saclay)","Phases of random antiferromagnetic spin-1 chains","29 pages, 12 encapsulated Postscript figures, REVTeX 3.0","Phys. Rev. B, 58, 805-815 (1998).","10.1103/PhysRevB.58.805","SPhT/97-161","cond-mat.str-el",,"  We formulate a real-space renormalization scheme that allows the study of the
effects of bond randomness in the Heisenberg antiferromagnetic spin-1 chain.
There are four types of bonds that appear during the renormalization flow. We
implement numerically the decimation procedure. We give a detailed study of the
probability distributions of all these bonds in the phases that occur when the
strength of the disorder is varied. Approximate flow equations are obtained in
the weak-disorder regime as well as in the strong disorder case where the
physics is that of the random singlet phase.
","[{""version"":""v1"",""created"":""Mon, 15 Dec 1997 18:09:50 GMT""}]","2009-10-30"
"cond-mat/9712173","Michael R. Geller","Michael R. Geller, Carlos Wexler, and David J. Thouless","Transverse force on a quantized vortex in a superconductor","4 pages, Revtex, 1 figure",,"10.1103/PhysRevB.57.R8119",,"cond-mat",,"  The total transverse force acting on a quantized vortex in a type-II
superconductor determines the Hall response in the mixed state, yet a consensus
as to its correct form is still lacking. In this paper we present an
essentially exact expression for this force, valid in the superclean limit,
which was obtained by generalizing the recent work by Thouless, Ao, and Niu [D.
J. Thouless, P. Ao, and Q. Niu, Phys. Rev. Lett. 76, 3758 (1996)] on the Magnus
force in a neutral superfluid. We find the transverse force per unit length to
be $f = \rho K \times V$, where $\rho = \rho_{n} + \rho_{s}$ is the sum of the
mass densities of the normal and superconducting components, $K$ is a vector
parallel to the line vortex with a magnitude equal to the quantized
circulation, and $V$ is the vortex velocity.
","[{""version"":""v1"",""created"":""Mon, 15 Dec 1997 19:31:40 GMT""}]","2009-10-30"
"cond-mat/9712174","Drechsler S.-L.","S.V. Shulga, S.-L. Drechsler, G. Fuchs, K.-H. Mueller, K. Winzer, M.
  Heinecke, K. Krug","Upper critical field pecularities of superconducting YNi2B2C and
  LuNi2B2C","4 pages, 2 figures, Phys. Rev. Lett. accepted",,"10.1103/PhysRevLett.80.1730",,"cond-mat.supr-con",,"  We present new upper critical field Hc2(T) data in a broad temperature region
from 0.3K to Tc for LuNi2B2C and YNi2B2C single crystals with well
characterized low impurity scattering rates. The absolute values for all T, in
particular Hc2(0), and the sizeable positive curvature (PC) of Hc2(T) at high
and intermediate T are explained quantitatively within an effective two-band
model. The failure of the isotropic single band approach is discussed in
detail. Supported by de Haas van Alphen data, the superconductivity reveals
direct insight into details of the electronic structure. The observed maximal
PC near Tc gives strong evidence for clean limit type II superconductors.
","[{""version"":""v1"",""created"":""Mon, 15 Dec 1997 19:39:54 GMT""}]","2009-10-30"
"cond-mat/9712175","Prabhakar Pradhan","Prabhakar Pradhan (UCLA) and N. Kumar (RRI)","Geometric phase for a dimerized disordered continuum: Topological shot
  noise","10 pages(LATEX) + 1 figure, (revised version). Will appear in
  Europhys. Lett","Europhys. Lett. 44, 131 (1998)","10.1209/epl/i1998-00446-x",,"cond-mat",,"  Geometric phase shift associated with an electron propagating through a
dimerized-disordered continuum is shown to be 0, or $\pm \pi$ (modulo 2$\pi$),
according as the associated circuit traversed in the two-dimensional parameter
space excludes, or encircles a certain singularity. This phase-shift is a
topological invariant. Its discontinuous dependence on the electron energy and
disorder implies a statistical spectral and conductance fluctuation in a
corresponding mesoscopic system. Inasmuch as the fluctuation derives from the
discreteness of the phase shift, it may aptly be called a topological
shot-noise.
","[{""version"":""v1"",""created"":""Mon, 15 Dec 1997 19:44:25 GMT""},{""version"":""v2"",""created"":""Wed, 16 Sep 1998 04:02:38 GMT""}]","2009-10-30"
"cond-mat/9712176","Lorenzo De Santis","L. De Santis and R. Resta","N-representability and density-functional construction in curvilinear
  coordinates","6 pages, 2 figures",,,,"cond-mat.mtrl-sci",,"  In practical implementations of density-functional theory, the only term
where an orbital description is needed is the kinetic one. Even this term in
principle depends on the density only, but its explicit form is unknown. We
provide a novel solution of the N-representability problem for an extended
system, which implies an explicit form for the Kohn-Sham kinetic energy in
terms of the density. Our approach is based on a periodic coordinate mapping,
uniquely defined by the Fourier coefficients of the metric. The density
functional is thus expressed as an explicit functional of the metric tensor:
since N-representability is enforced, our constructive recipe provides a
variational approximation. Furthermore, we show that our geometric viewpoint is
quite naturally related to the electron localization function (ELF), which
provides a very informative analysis of the electron distribution. Studies of
ELF, as obtained from accurate Kohn-Sham orbitals in real materials, allow an
appraisal of the variational approximate density functional. We show that the
value of an approximate functional-either the present geometric-based one or
some previous ones based on different constructive recipes-strongly depends on
the nature of the chemical bonding in the material.
","[{""version"":""v1"",""created"":""Mon, 15 Dec 1997 19:47:55 GMT""}]","2007-05-23"
"cond-mat/9712177","Renato Vicente","Silvia Kuva, Osame Kinouchi and Nestor Caticha","Learning a spin glass: determining Hamiltonians from metastable states","5 pages, 1 figure, to appear in Physica A","Physica A 257 (1998) 28-35","10.1016/S0378-4371(98)00126-5",,"cond-mat.dis-nn",,"  We study the problem of determining the Hamiltonian of a fully connected
Ising Spin Glass of $N$ units from a set of measurements, whose sizes needs to
be ${\cal O}(N^2)$ bits. The student-teacher scenario, used to study learning
in feed-forward neural networks, is here extended to spin systems with
arbitrary couplings. The set of measurements consists of data about the local
minima of the rugged energy landscape. We compare simulations and analytical
approximations for the resulting learning curves obtained by using different
algorithms.
","[{""version"":""v1"",""created"":""Mon, 15 Dec 1997 20:36:01 GMT""}]","2010-06-10"
"cond-mat/9712178","Claude Godreche","I Dornic and C Godreche","Large deviations and nontrivial exponents in coarsening systems","23 pages, plain tex, revised and augmented","J. Phys. A 31, 5413 (1998)","10.1088/0305-4470/31/24/004",,"cond-mat.stat-mech",,"  We investigate the statistics of the mean magnetisation, of its large
deviations and persistent large deviations in simple coarsening systems. We
consider more specifically the case of the diffusion equation, of the Ising
chain at zero temperature and of the two dimensional voter model. For the
diffusion equation, at large times, the mean magnetisation has a limit law,
which is studied analytically using the independent interval approximation. The
probability of persistent large deviations, defined as the probability that the
mean magnetisation was, for all previous times, greater than some level $x$,
decays algebraically at large times, with an exponent $\theta(x)$ continuously
varying with $x$. When $x=1$, $\theta(1)$ is the usual persistence exponent.
Similar behaviour is found for the Glauber-Ising chain at zero temperature. For
the two dimensional Voter model, large deviations of the mean magnetisation are
algebraic, while persistent large deviations seem to behave as the usual
persistence probability.
","[{""version"":""v1"",""created"":""Mon, 15 Dec 1997 20:50:58 GMT""},{""version"":""v2"",""created"":""Wed, 24 Dec 1997 16:58:22 GMT""}]","2009-10-30"
"cond-mat/9712179","James P. Sethna","Joachim Jacobsen and James P. Sethna","Pulsed sputtering during homoepitaxial surface growth: layer-by-layer
  forever","Five pages, four figures",,"10.1016/S0039-6028(98)00477-4",,"cond-mat.mtrl-sci cond-mat.stat-mech",,"  The homoepitaxial growth of initially flat surfaces has so far always led to
surfaces which become rougher and rougher as the number of layers increases:
even in systems exhibiting ``layer by layer'' growth the registry of the layers
is gradually lost. We propose that pulsed glancing-angle sputtering, once per
monolayer, can in principle lead to layer-by-layer growth that continues
indefinitely, if one additional parameter is controlled. We illustrate our
suggestion with a fairly realistic simulation of the growth of a Pt (111)
surface, coupled with a simplified model for the sputtering process.
","[{""version"":""v1"",""created"":""Mon, 15 Dec 1997 22:46:37 GMT""}]","2009-10-30"
"cond-mat/9712180","Massimo Rontani","Franca Manghi and Massimo Rontani (Istituto Nazionale per la Fisica
  della Materia and Dipartimento di Fisica, Universita` degli Studi di Modena,
  Italy)","3-Body Scattering (3BS) theory of on-site correlation in narrow band
  materials","LaTeX 2.09, 12 pages, 4 LaTeX figures","Newsletter n. 24, December 1997, ""Highlight of the Month"", PSIK
  Network",,"INFM Unita' di Modena 97-12","cond-mat.str-el",,"  We present the results of a recently developed approach where the interplay
between the itinerant and localized character of electrons in narrow band
materials is described by adding on-site correlation effects to a first
principle band calculation: the single particle band states are treated as mean
field solutions of a multi-orbital Hubbard Hamiltonian and the many-body term
associated to localized e-e interaction is described in a
configuration-interaction scheme. The method allows to calculate hole and
electron spectral functions which can be directly compared with spectroscopical
results.
","[{""version"":""v1"",""created"":""Mon, 15 Dec 1997 23:32:25 GMT""}]","2007-05-23"
"cond-mat/9712181","Sharad Ramanathan","Sharad Ramanathan and Daniel S. Fisher","Onset of Propagation of Planar Cracks in Heterogeneous Media","51 pages + 20 figure",,"10.1103/PhysRevB.58.6026",,"cond-mat.dis-nn cond-mat.soft",,"  The dynamics of planar crack fronts in hetergeneous media near the critical
load for onset of crack motion are investigated both analytically and by
numerical simulations. Elasticity of the solid leads to long range stress
transfer along the crack front which is non-monotonic in time due to the
elastic waves in the medium. In the quasistatic limit with instantaneous stress
transfer, the crack front exhibits dynamic critical phenomenon, with a second
order like transition from a pinned to a moving phase as the applied load is
increased through a critical value. At criticality, the crack-front is
self-affine, with a roughness exponent $\zeta =0.34\pm 0.02$. The dynamic
exponent $z$ is found to be equal to $ 0.74\pm 0.03$ and the correlation length
exponent $\nu =1.52\pm 0.02$. These results are in good agreement with those
obtained from an epsilon expansion. Sound-travel time delays in the stress
transfer do not change the static exponents but the dynamic exponent $z$
becomes exactly one. Real elastic waves, however, lead to overshoots in the
stresses above their eventual static value when one part of the crack front
moves forward. Simplified models of these stress overshoots are used to show
that overshoots are relevant at the depinning transition leading to a decrease
in the critical load and an apparent jump in the velocity of the crack front
directly to a non-zero value. In finite systems, the velocity also shows
hysteretic behaviour as a function of the loading. These results suggest a
first order like transition. Possible implications for real tensile cracks are
discussed.
","[{""version"":""v1"",""created"":""Tue, 16 Dec 1997 00:31:57 GMT""}]","2009-10-30"
"cond-mat/9712182","Ikuo Ichinose","M.onoda, I.Ichinose, and T.Matsui","Resistivity in the spin-gap state of the t-J model","Revtex, 4 pages",,"10.1143/JPSJ.67.2606","UT-Komaba 97-15","cond-mat",,"  Being motivated by recent experimental data on YBaCuO, we calculate dc
resistivity in the spin-gap state of charge- spin-separated t-J model by using
a massive gauge theory of holons and spinons.The result shows it deviates
downward from the T-linear behavior below the spin-gap onset temperature.
","[{""version"":""v1"",""created"":""Tue, 16 Dec 1997 07:23:02 GMT""}]","2009-10-30"
"cond-mat/9712183","Carlo Vanderzande","F. Daerden, C. Vanderzande","Sandpiles on the Sierpinski gasket","11 pages (Latex), 7 figures, submitted to Physica A",,"10.1016/S0378-4371(98)00210-6","TF-97-12","cond-mat.stat-mech",,"  We perform extensive simulations of the sandpile model on a Sierpinski
gasket. Critical exponents for waves and avalanches are determined. We extend
the existing theory of waves to the present case. This leads to an exact value
for the exponent $\tau_w$ which describes the distribution of wave sizes:
$\tau_w = \ln{(9/5)}/\ln{3}$. Numerically, it is found that the number of waves
in an avalanche is proportional to the number of distinct sites toppled in the
avalanche. This leads to a conjecture for the exponent $\tau$ that determines
the distribution of avalanche sizes: $\tau=1+\tau_w = \ln{(27/5)}/\ln{3}$. Our
predictions are in good agreement with the numerical results.
","[{""version"":""v1"",""created"":""Tue, 16 Dec 1997 14:03:25 GMT""}]","2015-06-25"
"cond-mat/9712184","Michel Caffarel","Michel Caffarel and R\'emy Mosseri","Hubbard model on d-dimensional hypercubes: Exact solution for the
  two-electron case","5 pages, Latex, with 2 eps figures",,"10.1103/PhysRevB.57.R12651","LCT-97-030","cond-mat.str-el",,"  The Hubbard model is exactly solved for two particles with opposite spins on
d-dimensional hypercubes. It is shown that the spectrum can be separated into
two parts: a trivial (U-independent) part resulting from symmetries of
hypercubes and a non-trivial part expressed as a single-impurity problem on a
set of finite chains of size $d^\prime+1$ ($d^\prime \le d$). The exact
expression for the one-particle Green's function is given. Finally, we discuss
the extension of these results to standard hypercubic lattices with periodic
boundary conditions.
","[{""version"":""v1"",""created"":""Tue, 16 Dec 1997 10:39:04 GMT""}]","2009-10-30"
"cond-mat/9712185","Ludger Santen","W. Knospe, L. Santen, A. Schadschneider, M. Schreckenberg","Disorder Effects in CA-Models for Traffic Flow","6 pages, 4 postscript figures, Proceedings of the conference ""Traffic
  and Granular Flow '97"", Duisburg, Germany, October 5-8, 1997",,,,"cond-mat.stat-mech",,"  We investigate the effect of quenched disorder in the Nagel-Schreckenberg
model of traffic flow. Spatial inhomogenities, i.e. lattice sites where the
braking probability is enlarged, are considered as well as particle disorder,
i.e. cars of a different maximum velocity. Both types of disorder lead to
segregated states.
","[{""version"":""v1"",""created"":""Tue, 16 Dec 1997 12:26:36 GMT""}]","2007-05-23"
"cond-mat/9712186","Miguel Angel Munoz","Raffaele Cafiero, Andrea Gabrielli, and Miguel A. Mu\~noz","Study of the disordered one-dimensional contact process","18 Figures (fig. 1 and 9 not available), LateX",,"10.1103/PhysRevE.57.5060",,"cond-mat",,"  New theoretical and numerical analysis of the one-dimensional contact process
with quenched disorder are presented.
  We derive new scaling relations, different from their counterparts in the
pure model, which are valid not only at the critical point but also away from
it due to the presence of generic scale invariance. All the proposed scaling
laws are verified in numerical simulations. In addition we map the disordered
contact process into a Non-Markovian contact process by using the so called Run
Time Statistic, and write down the associated field theory. This turns out to
be in the same universality class as one derived by Janssen for the quenched
system with a Gaussian distribution of impurities.
  Our findings here support the lack of universality suggested by the field
theoretical analysis: generic power-law behaviors are obtained, evidence is
shown of the absence of a characteristic time away from the critical point, and
the absence of universality is put forward. The intermediate sublinear regime
predicted by Bramsom et al. is also found.
","[{""version"":""v1"",""created"":""Tue, 16 Dec 1997 13:22:00 GMT""}]","2016-08-15"
"cond-mat/9712187","Grigori Volovik","N.B. Kopnin and G.E. Volovik","Critical velocity and event horizon in pair-correlated systems with
  ""relativistic"" fermionic quasiparticles","RevTex file, 4 pages, 1 Figure","JETP Lett. 67 (1998) 528-532; Pisma Zh.Eksp.Teor.Fiz. 67 (1998)
  124-129","10.1134/1.567637",,"cond-mat.supr-con gr-qc hep-ph",,"  The condition for the appearance of event horizon is considered in such
pair-correlated systems (superfluids and superconductors) where the fermionic
quasiparticles obey the ""relativistic"" equations. In these systems, the Landau
critical velocity of superflow corresponds to the speed of light. In
conventional systems, such as s-wave superconductors, the superflow remains
stable even above the Landau treshold. We showed that in the ""relativistic""
systems however the quantum vacuum becomes unstable and the superflow collapses
after the ""speed of light"" is reached, so that horizon cannot appear. Thus an
equilibrium dissipationless superfluid flow state and the horizon are
incompatible due to quantum effects. This negative result is consistent with
the quantum Hawking radiation from the horizon, which would lead to the
dissipation of the flow.
","[{""version"":""v1"",""created"":""Tue, 16 Dec 1997 13:56:04 GMT""}]","2009-10-30"
"cond-mat/9712188","Dr. Juergen Schnack","J. Schnack (U. of Osnabrueck)","Molecular dynamics investigations on a quantum system in a thermostat","11 pages, 8 postscript figures, uses 'epsfig.sty'. Submitted to
  PHYSICA A. More information available at
  http://obelix.physik.uni-osnabrueck.de/~schnack","Physica A 259 (1998) 49-58","10.1016/S0378-4371(98)00236-2",,"cond-mat.stat-mech",,"  The model quantum system of fermions in a one dimensional harmonic oscillator
potential is investigated by a molecular dynamics method at constant
temperature. Although in quantum mechanics the equipartition theorem cannot be
used like in the Nose-Hoover-thermostat it is possible to couple an additional
degree of freedom to the system which acts as a thermometer and drives the
system towards the desired temperature via complex time steps.
","[{""version"":""v1"",""created"":""Tue, 16 Dec 1997 14:37:02 GMT""}]","2015-06-25"
"cond-mat/9712189","C. Panagopoulos","C.Panagopoulos, J.R. Cooper and T. Xiang","Systematic behaviour of the in-plane penetration depth in d-wave
  cuprates","4 pages, 4 figures",,"10.1103/PhysRevB.57.13422",,"cond-mat.supr-con",,"  We report the temperature T and oxygen concentration dependences of the
penetration depth of grain-aligned YBa_2Cu_3O_{7-\delta} with \delta= 0.0, 0.3
and 0.43. The values of the in-plane \lambda_{ab}(0) and out-of-plane
\lambda_{c}(0) penetration depths, the low temperature linear term in
\lambda_{ab}(T), and the ratio \lambda_{c}(0) /\lambda_{ab}(T) were found to
increase with increasing $\delta$. The systematic changes of the linear term in
\lambda_{ab}(T) with T_c found here and in recent work on HgBa_2Ca_{n-1}
Cu_nO_{2n+2+\delta} (n = 1 and 3) are discussed.
","[{""version"":""v1"",""created"":""Tue, 16 Dec 1997 15:49:55 GMT""}]","2016-08-31"
"funct-an/9712005","Joachim Kupsch","Joachim Kupsch and Oleg G. Smolyanov","Hilbert norms for graded algebras","8 pages, extended introduction and list of references","Proc. Amer. Math. Soc. 128 (1999) 1647-1653",,,"funct-an math.OA",,"  This paper presents a solution to a problem from superanalysis about the
existence of Hilbert-Banach superalgebras. Two main results are derived: 1)
There exist Hilbert norms on some graded algebras (infinite-dimensional
superalgebras included) with respect to which the multiplication is continuous.
2) Such norms cannot be chosen to be submultiplicative and equal to one on the
unit of the algebra.
","[{""version"":""v1"",""created"":""Mon, 15 Dec 1997 18:58:47 GMT""},{""version"":""v2"",""created"":""Wed, 13 Dec 2000 11:33:01 GMT""}]","2007-05-23"
"gr-qc/9712063","Frank Gronwald","Frank Gronwald, Uwe Muench, Alfredo Mac\'ias, Friedrich W. Hehl","Volume elements of spacetime and a quartet of scalar fields","7 pages RevTEX, submitted to Phys. Rev. D","Phys. Rev. D 58, 084021 (1998)","10.1103/PhysRevD.58.084021",,"gr-qc hep-th",,"  Starting with a `bare' 4-dimensional differential manifold as a model of
spacetime, we discuss the options one has for defining a volume element which
can be used for physical theories. We show that one has to prescribe a scalar
density \sigma. Whereas conventionally \sqrt{|\det g_{ij}|} is used for that
purpose, with g_{ij} as the components of the metric, we point out other
possibilities, namely \sigma as a `dilaton' field or as a derived quantity from
either a linear connection or a quartet of scalar fields, as suggested by
Guendelman and Kaganovich.
","[{""version"":""v1"",""created"":""Mon, 15 Dec 1997 18:52:04 GMT""}]","2016-08-25"
