"astro-ph/9712197","James S. Graber","James S. Graber","Dual Accretion Disks in Alternate Gravity Theories","4 pages, to appear in ""Accretion Processes in Astrophysical Systems"",
  Proc.of the 8th Annual Astrophysics Conference in Maryland, S. S. Holt & T.
  Kallman (eds.)",,"10.1063/1.55888",,"astro-ph",,"  The interior of gravitationally collapsed objects in alternate theories of
gravity in which event horizons and singularities do not occur in strong field
gravity were generically investigated. These objects, called red holes, were
found to contain dynamic configurations of matter, radiation and spacetime
similar to inside out accretion disks well inside the photon orbit.
Applications to astrophysical phenomena are briefly described.
","[{""version"":""v1"",""created"":""Mon, 15 Dec 1997 23:38:11 GMT""}]","2009-10-30"
"astro-ph/9712198","Spencer Klein","Spencer R. Klein","Bremsstrahlung and Pair Creation: Suppression Mechanisms and How They
  Affect EHE Air Showers","16 pages, including 8 figures",,,"LBNL-41167","astro-ph hep-ph",,"  Most calculations of air shower development have been based on the
Bethe-Heitler cross sections for bremsstrahlung and pair production. However,
for energetic enough particles, a number of different external factors can
reduce these cross sections drastically, slowing shower development and
lengthening the showers. Four mechanisms that can suppress bremsstrahlung and
pair production cross sections are discussed, and their effect on extremely
high energy air showers considered. Besides lengthening the showers, these
mechanisms greatly increase the importance of fluctuations in shower
development, and can increase the angular spreading of showers.
","[{""version"":""v1"",""created"":""Tue, 16 Dec 1997 00:49:49 GMT""},{""version"":""v2"",""created"":""Tue, 16 Dec 1997 01:01:11 GMT""},{""version"":""v3"",""created"":""Mon, 11 Dec 2000 22:40:43 GMT""}]","2009-09-25"
"astro-ph/9712199","Oleg Y. Gnedin","Nickolay Y. Gnedin, Oleg Y. Gnedin","Cosmological Neutrino Background Revisited","An error is corrected, figure revised; submitted to ApJ","Astrophys.J. 509 (1998) 11-15","10.1086/306469","POP-740","astro-ph",,"  We solve the Boltzmann equation for cosmological neutrinos around the epoch
of the electron-positron annihilation in order to verify the freeze-out
approximation and to compute accurately the cosmological neutrino distribution
function. We find the radiation energy density to be about 0.3% higher than the
one predicted by the freeze-out approximation. As a result, the spectrum of the
Cosmic Microwave Background anisotropies changes by 0.3-05%, depending on the
angular scale, and the amplitude of the mass fluctuations on scales below about
100 h^{-1} Mpc decreases by about 0.2-0.3%.
","[{""version"":""v1"",""created"":""Tue, 16 Dec 1997 01:43:30 GMT""},{""version"":""v2"",""created"":""Thu, 12 Feb 1998 03:10:55 GMT""},{""version"":""v3"",""created"":""Tue, 30 Jun 1998 17:16:05 GMT""},{""version"":""v4"",""created"":""Fri, 15 Oct 1999 15:45:55 GMT""}]","2009-10-30"
"astro-ph/9712200","Daniel Eisenstein","Daniel J. Eisenstein and Piet Hut (IAS, Princeton)","HOP: A New Group-Finding Algorithm for N-body Simulations","LaTeX, 18 pages, 7 Postscript figures included. ApJ, in press. Source
  code available from http://www.sns.ias.edu/~eisenste/hop/hop.html","Astrophys.J.498:137-142,1998","10.1086/305535",,"astro-ph",,"  We describe a new method (HOP) for identifying groups of particles in N-body
simulations. Having assigned to every particle an estimate of its local
density, we associate each particle with the densest of the N_hop particles
nearest to it. Repeating this process allows us to trace a path, within the
particle set itself, from each particle in the direction of increasing density.
The path ends when it reaches a particle that is its own densest neighbor; all
particles reaching the same such particle are identified as a group. Combined
with an adaptive smoothing kernel for finding the densities, this method is
spatially adaptive, coordinate-free, and numerically straight-forward. One can
proceed to process the output by truncating groups at a particular density
contour and combining groups that share a (possibly different) density contour.
While the resulting algorithm has several user-chosen parameters, we show that
the results are insensitive to most of these, the exception being the outer
density cutoff of the groups.
","[{""version"":""v1"",""created"":""Tue, 16 Dec 1997 01:53:41 GMT""}]","2010-04-06"
"astro-ph/9712201","Lex Kaper","Lex Kaper","Winds in OB-type stars","8 pages, latex, ps-figures and style files included; Invited Review
  ""Ultraviolet astrophysics beyond the IUE final archive"", Sevilla, November
  1997",,,,"astro-ph",,"  The International Ultraviolet Explorer satellite has made a tremendous
contribution to the study of hot-star winds. Its long lifetime has resulted in
the collection of ultraviolet spectra for a large sample of OB stars. Its
unique monitoring capability has enabled detailed time-series analyses to
investigate the stellar-wind variability for individual objects. IUE has also
been a major driver for the development of the radiation-driven-wind theory;
the synergy between theory and observations is one of the main reasons for the
large progress that has been made in our understanding of hot-star winds and
their impact on the atmospheres and evolution of massive stars.
","[{""version"":""v1"",""created"":""Tue, 16 Dec 1997 09:52:24 GMT""}]","2007-05-23"
"astro-ph/9712202","Jean-Pierre Lasota","Jean-Pierre Lasota (Paris-Meudon) and Jean-Marie Hameury (Strasbourg)","Disk Instability Models","10 pages, LaTex, 3 eps figures; to appear in ""Accretion Processes in
  Astrophysics - Some Like it Hot"", eds. S. Holt & T. Kallman",,"10.1063/1.55920",,"astro-ph",,"  We review various aspects of disk instability models. We discuss problems and
difficulties and present ways that have been suggested to solve them.
","[{""version"":""v1"",""created"":""Tue, 16 Dec 1997 10:57:26 GMT""}]","2009-10-30"
"astro-ph/9712203","Koji Uryu","Koji Uryu (ICTP) and Yoshiharu Eriguchi (University of Tokyo)","Stationary states of irrotational binary neutron star systems and their
  evolution due to gravitational wave emission","5 pages including 11 bitmapped Postscript figures, uses mn.sty and
  epsf.sty, accepted for publication in MNRAS Letter. Summary of previous work
  done by other authours and related statement of the article have been
  corrected","Mon.Not.Roy.Astron.Soc. 296 (1998) L1","10.1046/j.1365-8711.1998.01385.x","IC/97/173","astro-ph gr-qc",,"  We have succeeded in obtaining exact configurations of irrotational binary
systems for compressible (polytropic) equations of state. Our models correspond
to binaries of equal mass neutron star systems in the viscosity free limit. By
using the obtained sequences of stationary states, the evolution of binary
systems of irrotational neutron stars due to gravitational wave emission has
been examined. For inviscid binary systems the spin angular velocity of each
component in a detached phase is smaller than the orbital angular velocity at a
contact phase. Thus the irrotational approximation during evolution of binary
neutron stars due to gravitational wave emission can be justified. Our
computational results show that the binary will never reach a dynamically
unstable state before a contact phase even for rather stiff polytropes with the
index N > 0.7, as the separation of two components decreases due to
gravitational wave emission. This conclusion is quantitatively different from
that of Lai, Rasio & Shapiro who employed approximate solutions for polytropic
binary systems.
","[{""version"":""v1"",""created"":""Tue, 16 Dec 1997 11:27:38 GMT""},{""version"":""v2"",""created"":""Mon, 29 Dec 1997 15:34:15 GMT""}]","2009-10-30"
"astro-ph/9712204","Manel Ignasi Forcada-Miro","M.I. Forcada-Miro and S.D.M. White","Radiative shocks in galaxy formation. I: Cooling of a primordial plasma
  with no sources of heating","27 pages, 13 figures, LaTeX with MNRAS style",,,"MPA-1071","astro-ph",,"  We use a 1-D Lagrangian code which follows both a gaseous and a dark
component to study the radiative shocks that appear in the evolution of
spherical scale-free perturbations in an Einstein-de Sitter Universe. The
detailed behaviour of the shock depends on whether the radiative cooling is
dominated by bremsstrahlung or line cooling. Bremsstrahlung is the main energy
loss mechanism for systems with circular velocity $V_{c} > 100 km s^{-1}$. In
this case, we can reproduce the kinematics of the shock and of the cooling wave
to a high degree of accuracy with a simple analytic model. When line cooling
dominates, the shock front can be unstable to oscillations. The period and
amplitude of the oscillations increase in time as the universe expands. For
such systems, our analytic model provides only a rough estimate of the mean
evolution. We believe that now we fully understand the effect radiative cooling
has in the shocks that appear in spherical models for galaxy formation.
","[{""version"":""v1"",""created"":""Tue, 16 Dec 1997 13:04:00 GMT""},{""version"":""v2"",""created"":""Wed, 17 Dec 1997 10:26:38 GMT""}]","2009-09-25"
"astro-ph/9712205","Manel Ignasi Forcada-Miro","M.I. Forcada-Miro","Radiative shocks in galaxy formation. II: Effects of a metagalactic UV
  background","9 pages, 5 figures, LaTeX with MNRAS style",,,"MPA-1071","astro-ph",,"  I use a 1-D Lagrangian code which follows both a gaseous and a dark component
to study the effects of a metagalactic UV background on the formation of dwarf
galaxies. In the case of an ionising background consistent with the existing
observational constraints no effect has been found in halos with circular
velocity above 60 km/s. The effect is very mild in halos with $40 <
V_{\mboxs{c}} < 60$ km/s, and the reduction in the total gas mass which cools
below 8000 K never surpasses 30 %. Below the circular velocity 40 km/s there is
a sharp transition towards the case in which the gas does not cool but it is
gravitationally confined by the potential well of the dark halo. Halos with a
virial temperature below the equilibrium photoionisation temperature cannot
confine the gas.
","[{""version"":""v1"",""created"":""Tue, 16 Dec 1997 13:51:18 GMT""},{""version"":""v2"",""created"":""Wed, 17 Dec 1997 10:33:11 GMT""}]","2009-09-25"
"astro-ph/9712206","Steve Zepf","Stephen E. Zepf (Yale), Keith M. Ashman (Kansas)","Globular Cluster Systems of Elliptical Galaxies","8 pages, Invited Review for IAU Symp. 186, ""Galaxy Interactions at
  Low and High Redshift"" ed. Sanders & Barnes",,,,"astro-ph",,"  We review the observed properties of globular cluster systems and their
implications for models of galaxy formation. Observations show that globular
clusters form in gas-rich mergers, and that bimodal metallicity distributions
are common in the globular cluster systems of ellipticals, with the metal-poor
population more extended than the metal-rich one. These are three of the four
predictions of the simple merger model of Ashman & Zepf (1992). The fourth
prediction concerns the properties of the globular cluster systems of spirals,
and is still to be tested by observation. Adopting Occam's razor, the
confirmation of the fundamental predictions of the merger model from both young
and old globular cluster systems is strong evidence that typical elliptical
galaxies formed from the mergers of spiral galaxies. However, the simplifying
assumptions of the Ashman-Zepf merger model limit its applicability to certain
complex situations such as the formation of cD galaxies. We conclude this
review by introducing new observational and theoretical programs that will
further the understanding of the physical mechanisms of globular cluster and
galaxy formation.
","[{""version"":""v1"",""created"":""Tue, 16 Dec 1997 13:55:32 GMT""}]","2007-05-23"
"astro-ph/9712207","Corinne Charbonnel","Corinne Charbonnel (1,2), Jeffery A. Brown (3,4), George Wallerstein
  (3,5) ((1)Laboratoire d'Astrophysique de Toulouse, France, (2)Space Telescope
  Science Institute, USA, (3)Dept. of Astronomy, University of Washington, USA
  (4)Washington State University, Pullman, USA)","Mixing processes during the evolution of red giants with moderate metal
  deficiencies : the role of molecular-weight barriers","Accepted for publication by Astronomy & Astrophysics, 12 pages, 8
  figures",,,,"astro-ph",,"  We have assembled accurate abundance data for Li, C, and N as well as the
12C/13C ratio for five field giants with [Fe/H]=-0.6 including Arcturus and two
stars in the globular cluster 47 Tuc. Using their very precise Mbol values
obtained from HIPPARCOSparallaxes, we can place them into an evolutionary
sequence. The sequence shows that the 12C/13C ratios ratios drops from 20 to
near 7 between Mbol=+1 and +0.5, while Li disappears. At the same time the
12C/14N ratio diminishes by 0.2 to 0.4 dex. The two stars in 47 Tuc with Mbol
near -2.0 show even lower 12C14N ratios by 0.4 dex indicating further mixing as
they evolved to the top of the red giant branch. These observations confirm the
existence of an extra-mixing process that becomes efficient on the red giant
branch only when the low-mass stars reach the so-called luminosity function
bump. We use the values of the carbon isotopic ratio observed in our sample to
get constraints on the mu-barriers that may shield the central regions of a
star from extra-mixing. We show that the same value of the critical gradient of
molecular weight leads to 12C/13C ratios observed at different metallicities.
This ``observational critical mu-gradient'' is in very good agreement with the
one which is expected to stabilize meridional circulation. This result provides
strong clues on the nature of the extra-mixing which occurs on the RGB, and
indicates that it is related to rotation.
","[{""version"":""v1"",""created"":""Tue, 16 Dec 1997 14:18:17 GMT""}]","2007-05-23"
"astro-ph/9712208","C. Motch","C. Motch, P. Guillout, F. Haberl, J. Krautter, M.W. Pakull, W.
  Pietsch, K. Reinsch, W. Voges, F.-J. Zickgraf","Identification of selected sources from the ROSAT Galactic Plane Survey
  - I","18 pages, 7 figures, Postscript. Optical spectra and finding charts
  available at ftp://cdsarc.u-strasbg.fr/pub/xray/rgps_idI.ps.gz Submitted to
  Astronomy & Astrophysics, Supplement Series",,"10.1051/aas:1998299",,"astro-ph",,"  We report on optical searches in the error circles of 93 ROSAT survey sources
located at low galactic latitudes (|b| < 20 deg). These sources were extracted
from the ROSAT Galactic Plane Survey using various selection criteria on
hardness ratio, X-ray and optical brightness and integrated galactic absorption
in the direction of the source. We find optical identifications in 76 cases,
among which are 25 new AGN, 6 new CVs and a new Be/X-ray binary. In order to
illustrate the relevance of the source selections applied here, we
cross-correlated the ROSAT all-sky survey bright source list with SIMBAD.
Different classes of X-ray emitters populate distinct regions of a multi
dimensional parameter space involving flux ratios, galactic latitude and Nh.
This relatively good segregation offers the possibility to build source samples
with enhanced probability of identification with a given class. Complete
optical identification of such subsamples could eventually be used to compute
meaningful probabilities of identification for all sources using as basis a
restricted set of multi-wavelength information.
","[{""version"":""v1"",""created"":""Tue, 16 Dec 1997 14:51:08 GMT""}]","2016-08-30"
"astro-ph/9712209","Beth A. Brown","Beth A. Brown, Joel N. Bregman (University of Michigan)","X-Ray Emission from Early-Type Galaxies: A Complete Sample Observed by
  ROSAT","Accepted for publication in ApJ Letters. 11 pages AASTeX + 2 figures
  + 1 table; added more processing info, brief comparison to ASCA data, added
  references",,"10.1086/311223",,"astro-ph",,"  To test the cooling flow model of early-type galaxies, we obtained a complete
magnitude-limited sample of 34 early-type galaxies, observed with the PSPC and
HRI on ROSAT. The X-ray to optical distribution of galaxies implies a lower
envelope that is consistent with the stellar emission inferred from Cen A. When
this stellar component is removed, the gaseous emission is related to the
optical luminosity by Lx proportional to L_B^m, where m = 3.0-3.5,
significantly steeper than the standard theory (m = 1.7). The dispersion about
the correlation is large, with a full range of 30-100 in Lx for a fixed L_B.
The X-ray temperature is related to the velocity dispersion temperature as Tx
proportional to Tsigma^n, where n = 1.43 +/- 0.21, although for several
galaxies, Tx is about twice Tsigma. The excessively hot galaxies are generally
the most luminous and are associated with the richest environments. We suggest
a model whereby environment influences the X-ray behavior of these galaxies:
early-type galaxies attempt to drive partial or total galactic winds, which can
be stifled by the pressure of their environment. Stifled winds should lead to
hotter and higher luminosity systems, which would occur most commonly in the
richest environments, as observed.
","[{""version"":""v1"",""created"":""Tue, 16 Dec 1997 15:35:39 GMT""},{""version"":""v2"",""created"":""Fri, 16 Jan 1998 18:58:58 GMT""}]","2009-10-30"
"chao-dyn/9712013","Fausto Borgonovi","Fausto Borgonovi, Italo Guarneri, Felix Izrailev","Quantum-Classical Correspondence in Energy Space: Two Interacting
  Spin-Particles","RevTeX, 13 pages, 16 figures",,"10.1103/PhysRevE.57.5291",,"chao-dyn cond-mat.stat-mech nlin.CD",,"  The Hamiltonian conservative system of two interacting particles has been
considered both in classical and quantum description. The quantum model has
been realized using a symmetrized two-particle basis reordered in the
unperturbed energy. Main attention is paid to the structure of chaotic
eigenfunctions (EF) and to the local spectral density of states (LDOS). A
remarkable correspondence has been found for the shapes of EF and LDOS in the
energy representation, to their classical counterparts. Comparison with the
Band Random Matrix theory predictions has revealed quite significant
differences which are due to dynamical nature of the model. On the other hand,
a partial agreement is found by inserting randomness `` ad hoc '' in the
dynamical model for two-body matrix elements. This shows that, at least for
small number of particles, care must be taken when classical correlations are
neglected. The question of quantum localization in the energy space is
discussed both for dynamical and random model.
","[{""version"":""v1"",""created"":""Tue, 16 Dec 1997 10:28:16 GMT""}]","2009-10-30"
"cond-mat/9712147","Carlo Canali","C. Basu, (International Center for Theoretical Physics), C.M. Canali
  (Chalmers University of Technology), V.E. Kravtsov (International Center for
  Theoretical Physics and Landau Institute for Theoretical Physics), and I.V.
  Yurkevich (University of Birmingham)","Level Curvature Distribution and the Structure of Eigenfunctions in
  Disordered Systems","34 pages (RevTeX), 8 figures (postscript)",,"10.1103/PhysRevB.57.14174","APR 97-86","cond-mat.mes-hall",,"  The level curvature distribution function is studied both analytically and
numerically for the case of T-breaking perturbations over the orthogonal
ensemble. The leading correction to the shape of the curvature distribution
beyond the random matrix theory is calculated using the nonlinear
supersymmetric sigma-model and compared to numerical simulations on the
Anderson model. It is predicted analytically and confirmed numerically that the
sign of the correction is different for T-breaking perturbations caused by a
constant vector-potential equivalent to a phase twist in the boundary
conditions, and those caused by a random magnetic field. In the former case it
is shown using a nonperturbative approach that quasi-localized states in weakly
disordered systems can cause the curvature distribution to be nonanalytic. In
$2d$ systems the distribution function $P(K)$ has a branching point at K=0 that
is related to the multifractality of the wave functions and thus should be a
generic feature of all critical eigenstates. A relationship between the
branching power and the multifractality exponent $d_{2}$ is suggested. Evidence
of the branch-cut singularity is found in numerical simulations in $2d$ systems
and at the Anderson transition point in $3d$ systems.
","[{""version"":""v1"",""created"":""Mon, 15 Dec 1997 18:32:58 GMT""}]","2009-10-30"
"cond-mat/9712156","Daniel L. Miller","Daniel L. Miller","Crossover from Selberg's type to Ruelle's type Zeta function in
  classical kinetics","4 pages, multicol.sty, references added",,,,"cond-mat.stat-mech chao-dyn nlin.CD",,"  The decay rates of the density-density correlation function are computed for
a chaotic billiard with some amount of disorder inside. In the case of the
clean system the rates are zeros of Ruelle's Zeta function and in the limit of
strong disorder they are roots of Selberg's Zeta function. We constructed the
interpolation formula between two limiting Zeta functions by analogy with the
case of the integrable billiards. The almost clean limit is discussed in some
detail. PACS numbers: 05.20.Dd, 05.45.+b, 51.10.+y
","[{""version"":""v1"",""created"":""Mon, 15 Dec 1997 22:36:45 GMT""},{""version"":""v2"",""created"":""Thu, 18 Dec 1997 06:36:50 GMT""},{""version"":""v3"",""created"":""Mon, 2 Mar 1998 16:34:44 GMT""}]","2007-05-23"
"cond-mat/9712161","Jinwu Ye","Jinwu Ye (Johns Hopkins) and Subir Sachdev (Yale)","Coulomb interactions at quantum Hall critical points of systems in a
  periodic potential","12 pages, REVTEX, 1 figure","Physical Review Letters, 80, 5409 (1998)","10.1103/PhysRevLett.80.5409",,"cond-mat.mes-hall",,"  We study the consequences of long-range Coulomb interactions at the critical
points between integer/fractional quantum Hall states and an insulator. We use
low energy theories for such transitions in anyon gases in the presence of an
external periodic potential. We find that Coulomb interactions are marginally
irrelevant for the integer quantum Hall case. For the fractional case,
depending upon the anyon statistics parameter, we find behavior similar to the
integer case, or flow to a novel line of fixed points with exponents $z=1$,
$\nu > 1$ stable against weak disorder in the position of the critical point,
or run-away flow to strong coupling.
","[{""version"":""v1"",""created"":""Tue, 16 Dec 1997 01:02:46 GMT""},{""version"":""v2"",""created"":""Tue, 16 Dec 1997 04:02:17 GMT""},{""version"":""v3"",""created"":""Mon, 29 Jun 1998 22:41:21 GMT""}]","2009-10-30"
"cond-mat/9712168",,"O. Heinonen (University of Central Florida), J.M. Kinaret (Goteborg
  University and Chalmers University of Technology), M.D. Johnson (University
  of Central Florida)","Ensemble Density Functional Approach to Charge-Spin Textures in
  Inhomogeneous Quantum Hall Systems","26 pages (revtex), 5 eps figures, submitted to Phys Rev B",,,"UCF-CM-97-002","cond-mat.mes-hall",,"  We extend our ensemble density functional approach to quantum Hall systems to
include non-collinear spins to study charge-spin textures in inhomogeneous
quantum Hall systems. We have studied the edge reconstruction in quantum dots
at unit bulk filling factor and at 1/3 bulk filling factor as a function of the
stiffness of an external confining potential. For soft enough edges, these
systems reconstruct to a state in which the electron spins rotate gently as the
edge is approached, with a non-trivial spin-charge texture at the edge of the
system.
","[{""version"":""v1"",""created"":""Mon, 15 Dec 1997 16:49:24 GMT""}]","2007-05-23"
"cond-mat/9712169","Vincent Pasquier","V. Pasquier (CEA/Saclay, SPhT, France), F.D.M. Haldane","A dipole interpretation of the $\nu =1/2$ state","flatex t157_txt.tex, 1 file Submitted to: Nucl. Phys. B",,"10.1016/S0550-3213(98)00069-8","SPhT-T97/157","cond-mat",,"  We consider the problem of Bosonic particles interacting repulsively in a
strong magnetic field at the filling factor $\nu=1$. We project the system in
the Lowest Landau Level and set up a formalism to map the dynamics into an
interacting Fermion system. Within a mean field approximation we find that the
composite Fermions behave as a gas of neutral dipoles and we expect that the
low energy limit also describes the physical $\nu=1/2$ Fermionic state.
","[{""version"":""v1"",""created"":""Mon, 15 Dec 1997 16:55:48 GMT""}]","2009-10-30"
