"adap-org/9712005","Mark Newman","M. E. J. Newman (Santa Fe Institute) and Robin Engelhardt (University
  of Copenhagen)","Effects of neutral selection on the evolution of molecular species","16 pages including 4 postscript figures, typeset in LaTeX2e using the
  Elsevier macro package elsart.cls","Proc. R. Soc. London B 265, 1333-1338 (1998)",,"Santa Fe Institute Working Paper 98-01-001","adap-org nlin.AO q-bio",,"  We introduce a new model of evolution on a fitness landscape possessing a
tunable degree of neutrality. The model allows us to study the general
properties of molecular species undergoing neutral evolution. We find that a
number of phenomena seen in RNA sequence-structure maps are present also in our
general model. Examples are the occurrence of ""common"" structures which occupy
a fraction of the genotype space which tends to unity as the length of the
genotype increases, and the formation of percolating neutral networks which
cover the genotype space in such a way that a member of such a network can be
found within a small radius of any point in the space. We also describe a
number of new phenomena which appear to be general properties of neutrally
evolving systems. In particular, we show that the maximum fitness attained
during the adaptive walk of a population evolving on such a fitness landscape
increases with increasing degree of neutrality, and is directly related to the
fitness of the most fit percolating network.
","[{""version"":""v1"",""created"":""Mon, 15 Dec 1997 22:31:36 GMT""}]","2007-05-23"
"alg-geom/9712015","H. Esnault","H\'el\`ene Esnault, V. Srinivas, Eckart Viehweg","The universal regular quotient of the Chow group of 0-cycles on a
  singular projective variety","Latex 2e",,,,"alg-geom math.AG",,"  We show the existence of a regular universal quotient as a smooth commutative
algebraic group of the Chow group of 0-cycles on a projective reduced variety,
and give over the field of complex numbers an analytic description of it. This
generalizes the classical theory of the Albanese. The Chow group of 0-cycles is
then isomorphic to this smooth algebraic group if and only if it is finite
dimensional in the sense of Mumford. This generalizes the classical theorem of
Roitman.
","[{""version"":""v1"",""created"":""Mon, 15 Dec 1997 17:23:17 GMT""}]","2007-05-23"
"alg-geom/9712016","Yum-Tong Siu","Yum-Tong Siu (Harvard University)","Invariance of Plurigenera","13 pages, LaTeX file",,"10.1007/s002220050276",,"alg-geom math.AG",,"  The following conjecture on the deformation invariance of plurigenera is
proved. For a smooth projective holomorphic family of compact complex manifolds
over the open unit 1-disk such that all the fibers are of general type, every
plurigenus of the fiber is independent of the fiber.
  The proof uses Nadel's multiplier ideal sheaves, Skoda's result on the
generation of ideals with L2 estimates with respect to a plurisubharmonic
weight, and the extension theorem of Ohsawa-Takegoshi-Manivel for holomorphic
top-degree forms which are L2 with respect to a plurisubharmonic weight.
","[{""version"":""v1"",""created"":""Mon, 15 Dec 1997 22:00:39 GMT""}]","2009-10-30"
"alg-geom/9712017","Dmitri O. Orlov","Dmitri Orlov","Derived categories of coherent sheaves on abelian varieties and
  equivalences between them","25 pages, TeX file, second version, published in Izvestia RAN,
  Ser.Mat., v.66, N3 (2002) 131-158, translated by journal","Izv. RAN, Ser. Mat., v.66, N3 (2002)",,,"alg-geom math.AG","http://arxiv.org/licenses/nonexclusive-distrib/1.0/","  We study derived categories of coherent sheaves on abelian varieties. We give
a criterion for the equivalence of the derived categories on two abelian
varieties. We describe the autoequivalence group for the derived category of
coherent sheaves of an abelian variety.
","[{""version"":""v1"",""created"":""Tue, 16 Dec 1997 15:13:59 GMT""},{""version"":""v2"",""created"":""Fri, 27 Feb 2004 11:14:50 GMT""},{""version"":""v3"",""created"":""Fri, 6 Mar 2009 17:07:05 GMT""}]","2009-03-06"
"astro-ph/9712178","Ue-Li Pen","Ue-Li Pen, Abraham Loeb, Neil Turok","Gamma Ray Bursts from Baryon Decay in Neutron Stars","15 pages including 1 figure","Astrophys.J. 509 (1998) 537-543","10.1086/306511",,"astro-ph hep-ph",,"  The standard unbroken electroweak theory is known to erase baryon number. The
baryon number symmetry can be restored in the core of a neutron star as its
density diverges via gravitational instability due to a binary merger event. We
argue that for certain double Higgs models with discrete symmetries, this
process may result in an expanding self-sustained burning front which would
convert the entire neutron matter into radiation. This process would release
~10^{54} ergs in electromagnetic radiation over ~10^{-4} sec, with negligible
baryonic contamination. The resulting fireball would have all the properties
necessary to produce a gamma-ray burst as a result of its interaction with
ambient interstellar gas. The subsequent Higgs decay would produce a
millisecond burst of ~10^{52} ergs in ~100 GeV neutrinos which might be
observable. The above mechanism may have also caused electroweak baryogenesis
in the early universe, giving rise to the observed matter-antimatter asymmetry
today.
","[{""version"":""v1"",""created"":""Mon, 15 Dec 1997 22:34:46 GMT""}]","2009-10-30"
"astro-ph/9712183","Joao Pulido","Joao Pulido","Possible Tomography of the Sun's Magnetic Field with Solar Neutrinos","Several minor corrections performed, sunspot anticorrelation
  discussed, references added, 29 pages including 8 figures in PostScript","Phys.Rev. D57 (1998) 7108-7119","10.1103/PhysRevD.57.7108","FISIST/12-97/CFIF","astro-ph hep-ph",,"  The data from solar neutrino experiments together with standard solar model
predictions are used in order to derive the possible profile of the magnetic
field inside the Sun, assuming the existence of a sizeable neutrino magnetic
moment and the resonant spin flavour mechanism. The procedure is based on the
relationship between resonance location and the energy dependent neutrino
suppression, so that a large neutrino suppression at a given energy is taken to
be connected to a large magnetic field in a given region of the Sun. In this
way it is found that the solar field must undergo a very sharp increase by a
factor of at least 6 - 7 over a distance no longer than 7 - 10% of the solar
radius, decreasing gradually towards the surface. The range in which this sharp
increase occurs is likely to be the bottom of the convective zone. There are
also indications in favour of the downward slope being stronger at the start
and more moderate on approaching the solar surface. Typical ranges for the
magnetic moment are from a few times 10^{-13}\mu_B to its laboratory upper
bounds while the mass square difference between neutrino flavours is of order
(0.6-1.9) x 10^{-8}eV^2.
","[{""version"":""v1"",""created"":""Mon, 15 Dec 1997 16:04:11 GMT""},{""version"":""v2"",""created"":""Mon, 2 Mar 1998 16:11:47 GMT""}]","2009-10-30"
"astro-ph/9712184","Lauro Moscardini","Lauro Moscardini, Peter Coles, Francesco Lucchin and Sabino Matarrese","Modelling galaxy clustering at high redshift","26 pages, Latex using MN style, 10 figures enclosed. Version accepted
  for publication in MNRAS. Figures correctly included","Mon.Not.Roy.Astron.Soc. 299 (1998) 95-110","10.1046/j.1365-8711.1998.01728.x",,"astro-ph",,"  We discuss the theoretical interpretation of observational data concerning
the clustering of galaxies at high redshifts. Building on the theoretical
machinery developed by Matarrese et al. (1997), we make detailed quantitative
predictions of galaxy clustering statistics for a variety of cosmological
models, taking into account differences in spatial geometry and initial
fluctuation spectra and exploring the role of bias as a complicating factor in
these calculations. We demonstrate that the usual description of evolution (in
terms of the parameters $\epsilon$ and $r_0$) is not useful for realistic
galaxy clustering models. We compare the detailed predictions of the variation
of correlation functions with redshift against current observational data to
constrain available models of structure formation. Theories that fit the
present-day abundance of rich clusters are generally compatible with the
observed redshift evolution of galaxy clustering if galaxies are no more than
slightly biased at $z\sim 1$. We also discuss the interpretation of a
concentration of Lyman-break galaxies found by Steidel et al. (1998), coming to
the conclusion that such concentrations are not unexpected in `standard' models
of structure formation.
","[{""version"":""v1"",""created"":""Mon, 15 Dec 1997 18:30:11 GMT""},{""version"":""v2"",""created"":""Wed, 8 Apr 1998 17:44:32 GMT""},{""version"":""v3"",""created"":""Thu, 9 Apr 1998 06:28:06 GMT""}]","2009-10-30"
"astro-ph/9712185","John K. Cannizzo","John K. Cannizzo","Accretion Disks in Transient Systems","16 pages, 0 figures",,,,"astro-ph",,"  I review recent advances in our understanding of accretion disks in transient
systems - the dwarf novae and the soft X-ray transients. The primary theme will
be the ongoing development of theory in response to the observations. The
accretion disk limit cycle model appears to provide a unifying framework within
which we may begin to understand what is seen in different types of interacting
binary stars, and also to constrain parameters which enter into the theory.
","[{""version"":""v1"",""created"":""Mon, 15 Dec 1997 16:53:39 GMT""}]","2007-05-23"
"astro-ph/9712186","Rudy Wijnands","Rudy Wijnands & Michiel van der Klis","KiloHertz Quasi-Periodic Oscillations in the Z sources GX 340+0, Cygnus
  X-2, GX 17+2, GX 5-1, and Scorpius X-1","Aipproc LaTeX (4 pages, 2 ps-figures), to appear in ""Accretion
  Processes in Astrophysical Systems"", Proc. of the 8th Annual Astrophysics
  Conference in Maryland, S. S. Holt & T. Kallman (eds.)",,"10.1063/1.55921",,"astro-ph",,"  We have discovered kiloHertz quasi-periodic oscillations (kHz QPOs) in five Z
sources: GX 340+0, Cygnus X-2, GX 17+2, GX 5-1, and Scorpius X-1. In all
sources the properties of these kHz QPOs are very similar and closely related
to the position of the sources on the Z track traced out in the X-ray
color-color diagram and the hardness-intensity diagram. The frequencies of the
kHz QPOs increase when the sources move from the left end of the horizontal
branch to horizontal/normal branch vertex, thus with inferred mass accretion
rate. Only for Scorpius X-1 the kHz QPOs have been observed down the normal
branch unto the flaring branch. The strength and the FWHM of the
higher-frequency kHz QPOs decrease with mass accretion rate, but when the
lower-frequency kHz QPOs are detected the strength and the FWHM of this QPO
stay approximately constant with mass accretion rate. In Scorpius X-1 the
frequency separation between the kHz QPOs decreases with mass accretion rate,
but in the other Z sources the separation remains approximately constant,
although a similar decrease in peak separation as found in Scorpius X-1 can not
be excluded.
","[{""version"":""v1"",""created"":""Mon, 15 Dec 1997 17:43:39 GMT""}]","2009-10-30"
"astro-ph/9712187","Gerhard Hensler","S. Ehlerova (1), J. Palous (1), Ch. Theis (2), G. Hensler (2) ((1)
  Astron. Inst., Academy of Sciences of the Czech Republic, (2) Inst. f.
  Theor.Physik u. Astrophysik, University of Kiel)","Fragmentation of Expanding Shells in Spiral and Irregular Galaxies","9 pages, 7 figures included; pdf file","(1997) A&A 328, 121",,,"astro-ph",,"  Conditions for the fragmentation of expanding shells due to gravitational
instability are discussed. The self-similar analytical solution is compared
with the results of 3-dimensional computer simulations for the expansion into
homogeneous media. For realistic galactic disks we show that the formation of
fragments is influenced by the amount of energy supply from the final number of
young stars in an OB association, the value of the sound speed, the
stratification and density of the ambient medium, the galactic differential
rotation and the gravitational force perpendicular to the galactic plane. The
typical size of gravitationally unstable shells is 1 kpc for an ambient gas
density n=1 cm^-3. In thick disk galaxies the fragmentation occurs in nearly
the whole shell while in thin disks it is restricted to the galactic equator.
Unstable fragments may become molecular and trigger the formation of molecular
clouds, and finally new star formation. We conclude that in dwarf galaxies the
star formation may propagate in all directions turning the system into a star-
burst. Contrary to that, the star formation in spiral galaxies propagates only
in some directions in a thin strip near the symmetry plane, basically at the
tips of the expanding shell.
","[{""version"":""v1"",""created"":""Mon, 15 Dec 1997 18:24:01 GMT""}]","2007-05-23"
"astro-ph/9712188","Jay A. Frogel","Jay A. Frogel (The Ohio State University)","A History of Infrared Extinction at CTIO, Chile, and A Possible
  Connection with the el Nin~o Phenomenon","Replaced html version with more readable PS format; 17 pages of text
  and tables plus 7 Figures; all in postscript generated with MS WORD97 and
  SigmaPlot; to appear in PASP, February 1998",,"10.1086/316119","OSU-astro-jaf-1","astro-ph",,"  Extinction coefficients and sensitivity values in the JHKL band-passes
measured on nearly 200 nights of observing between 1978 and 1992 on the
1.5-meter and the Blanco 4- meter telescopes at Cerro Tololo Inter-American
Observatory are presented and discussed. Analysis of these data shows the
following: There are seasonal variations in both the extinction coefficients
and sensitivity values that are qualitatively consistent with expected
variations in the amount of H2O in the atmosphere - relatively high in the
summer months, lower in the winter months. The linear correlation coefficients
between most of these quantities are statistically significant. The yearly mean
values of these quantities also show significant variability of a few
hundredths of a magnitude. The correlations between these yearly means are
again consistent with variations in the H2O content of the atmosphere. At least
some of these longer term variations are closely correlated with quantitative
measures of the strength of the atmospheric and oceanic El Nin~o/Southern
Oscillation phenomenon.
","[{""version"":""v1"",""created"":""Mon, 15 Dec 1997 18:56:33 GMT""},{""version"":""v2"",""created"":""Tue, 16 Dec 1997 21:13:16 GMT""}]","2009-10-30"
"astro-ph/9712189","Lee Smolin","Lee Smolin","Using neutron stars and primordial black holes to test theories of
  quantum gravity","Latex, 10 pages, no figures, references added, typos fixed",,,,"astro-ph",,"  Three observational tests of cosmological natural selection, a theory that
follows from some hypotheses about quantum gravity, are described. If true,
this theory explains the choices of the parameters of the standard model of
particle physics. The first, the observation of a pulsar with mass greater than
$2.5 M_\circ$, would cleanly refute the theory. The second and third, having to
do with primordial black holes and early massive star formation, could do so
given likely developments in the near future. However given present knowledge
these arguments do not presently refute the theory. This shows that
cosmological natural selection has not so far been refuted, in spite of being
very vulnerable to falsification by possible observations.
","[{""version"":""v1"",""created"":""Mon, 15 Dec 1997 19:28:44 GMT""},{""version"":""v2"",""created"":""Tue, 6 Jan 1998 23:18:43 GMT""}]","2007-05-23"
"astro-ph/9712190","Piotr Zycki","P.T. Zycki, C. Done (Univ. of Durham), D. A. Smith (Univ. of
  Leicester)","Geometry of accretion in Soft X-ray Transients","Aipproc LaTeX (4 pages, 4 figures), to appear in Proc. of the 8th
  October Astrophysics Conference in Maryland, ""Accretion Processes in
  Astrophysical Systems"", S. S. Holt & T. Kallman (eds.)",,"10.1063/1.55912",,"astro-ph",,"  We present results of modelling Ginga data of a number of Soft X-ray
Transient sources performed with the aim of constraining the geometry of
accretion during various stages of the sources' evolution. Assuming a generic
geometry of a central, extended X-ray source with an external, optically thick
accretion disk, we use consistent models of X-ray reprocessing to constrain the
inner radius of the accretion disk and its ionization state. We show that the
evolution of GS 1124-68 (Nova Muscae 1991) and GS 2000+25 agree qualitatively
with the recent ideas linking the high/low state transition with changing the
inner radius of the optically thick disk, but the case of GS 2023+33 (V404 Cyg)
poses a problem for any model.
","[{""version"":""v1"",""created"":""Mon, 15 Dec 1997 20:02:18 GMT""}]","2009-10-30"
"astro-ph/9712191","Jay A. Frogel","Jay A. Frogel (The Ohio State University), Patricia A. Whitelock
  (South African Astronomical Observatory)","Long Period Variables in Globular Clusters and the Galactic Bulge: Their
  Dependence on Metallicity","20 pages of text plus tables in PS format created by MS WORD97; 9
  figures in PS format generated by SigmaPlot; all in one gzipped tar file;
  originally submitted to ApJ but has now been accepted and is in press at the
  AJ with minor revisions and some amplifications from previous version",,"10.1086/300478","OSU-astro-jaf2","astro-ph",,"  We derive the frequency of occurrence of luminous long period variables
(LLPVs) in globular clusters and in the Baade's Window field of the Galactic
bulge. LLPVs occur only in clusters with [Fe/H]>/= -1.0. In these clusters
their frequency of occurrence relative to the number of giant stars appears to
be independent of metallicity. Integrated over all metallicities, Baade's
Window appears to be deficient in LLPVs. We estimate [Fe/H] values for Baade's
Window LLPVs from their period and a log P vs. [Fe/H] relation derived from
cluster variables and find that LLPVs with [Fe/H]>/= 0.0 are absent from
Baade's Window. We propose that this is because of enhanced mass loss rates in
these LLPVs with a consequently abbreviated lifetime compared to lower
metallicity LLPVs. A typical lifetime for cluster LLPVs is about 3 x10^5 yrs.
Finally, we call attention to the need for a much more complete survey for
LLPVs in globular clusters.
","[{""version"":""v1"",""created"":""Mon, 15 Dec 1997 19:57:39 GMT""},{""version"":""v2"",""created"":""Tue, 16 Dec 1997 21:23:32 GMT""},{""version"":""v3"",""created"":""Fri, 15 May 1998 19:23:42 GMT""}]","2009-10-30"
"astro-ph/9712192","Robert J. Scherrer","Robert J. Scherrer and David H. Weinberg","Constraints on the Effects of Locally-biased Galaxy Formation","17 pages, no figures","Astrophys.J. 504 (1998) 607-611","10.1086/306113",,"astro-ph",,"  While it is well-known that ""biased galaxy formation"" can increase the
strength of galaxy clustering, it is less clear whether straightforward biasing
schemes can change the shape of the galaxy correlation function on large
scales. Here we consider ""local"" biasing models, in which the galaxy density
field $\delta_g$ at a point is a function of the matter density field $\delta$
at that point: $\delta_g = f(\delta)$. We consider both deterministic biasing,
where $f$ is simply a function, and stochastic biasing, in which the galaxy
density is a random variable whose distribution depends on the matter density:
$\delta_g=X(\delta)$. We show that even when this mapping is performed on a
highly nonlinear density field with a hierarchical correlation structure, the
correlation function $\xi$ is simply scaled up by a constant, as long as $\xi
<< 1$. In stochastic biasing models, the galaxy autocorrelation function
behaves exactly as in deterministic models, with the mean value of $X$ for a
given value of $\delta$ taking the role of the deterministic bias function. We
extend our results to the power spectrum P(k), showing that for sufficiently
small k, the effect of local biasing is equivalent to the multiplication of
P(k) by a constant, with the addition of a constant term. If a cosmological
model predicts a large-scale mass correlation function in conflict with the
shape of the observed galaxy correlation function, then the model cannot be
rescued by appealing to a complicated but local relation between galaxies and
mass.
","[{""version"":""v1"",""created"":""Mon, 15 Dec 1997 21:42:05 GMT""}]","2009-10-30"
"astro-ph/9712193","David L. Band","David L. Band (UCSD)","The Gamma-Ray Burst Mystery","20 pages, 5 figures, LATEX with mprocl.sty, to appear in the
  proceedings of ""The Eight Marcel Grossmann Meeting on General Relativity""
  held in Jerusalem, Israel, in June 1997",,,,"astro-ph",,"  Gamma-ray bursts are transient events from beyond the solar system. Besides
the allure of their mysterious origin, bursts are physically fascinating
because they undoubtedly require exotic physics. Optical transients coincident
with burst positions show that some, and probably all, bursts originate at
cosmological distances, and not from a large Galactic halo. Observations of
these events' spectral and temporal behavior will guide and constrain the study
of the physical processes producing this extragalactic phenomenon.
","[{""version"":""v1"",""created"":""Mon, 15 Dec 1997 21:52:59 GMT""}]","2007-05-23"
"astro-ph/9712194","Demos Kazanas","Demosthenes Kazanas, Xin-Min Hua (NASA/GSFC)","Modeling the Time Variability of Black Hole Candidates","Contributed paper to 8th Annual October Astrophysics Conference in
  Maryland, ""Accretion Processes in Astrophysical Systems: Some Like It Hot"", 4
  pages latex, 2 .eps figures, aipproc.sty, available at
  ftp://ftp.aip.org/ems/tex/macros/proceedings/8.5x11",,"10.1111/j.1749-6632.1998.tb11264.x",,"astro-ph",,"  We present model light curves, Power Spectral Densities (PSD) and time lags
of accreting Black Hole Candidates (BHC) based on a recent model of these
sources. According to our model the observed variability is due, to a large
extent, to the stochastic nature of Comptonization, the basic process
responsible also for the emission of high energy radiation. Our additional
assumption is that the Comptonization process takes place in an extended but
non-uniform atmosphere around the compact object. Our model reproduces the
observed light curves well, in that it provides a good fit to the PSDs and the
overall light curve morphology, indicating, in accordance with observation,
that most of the power resides at time scales $\gsim$ a few seconds while at
the same time one can distinguish shots of a few msec in duration. We suggest
that refinement of this type of model along with spectral and phase lag
information can be used to probe the structure of this class of high energy
sources.
","[{""version"":""v1"",""created"":""Mon, 15 Dec 1997 22:22:32 GMT""}]","2009-10-30"
"astro-ph/9712195","Martin White","Martin White, John E. Carlstrom, Mark Dragovan, William L. Holzapfel","Interferometric Observation of Cosmic Microwave Background Anisotropies","25 pages, 5 figures, minor changes to reflect final version accepted
  by ApJ","Astrophys.J.514:12,1999","10.1086/306911","UIUC-THC-1","astro-ph",,"  We present a formalism for analyzing interferometric observations of Cosmic
Microwave Background (CMB) anisotropy and polarization data. The formalism is
based upon the ell-space expansion of the angular power spectrum favoured in
recent years. Explicit discussions of maximum likelihood analysis, power
spectrum reconstruction, parameter estimation, imaging and polarization are
given. As an example, several calculations for the Degree Angular Scale
Interferometer (DASI) and Cosmic Background Interferometer (CBI) experiments
are presented.
","[{""version"":""v1"",""created"":""Mon, 15 Dec 1997 22:50:48 GMT""},{""version"":""v2"",""created"":""Mon, 31 Aug 1998 16:06:21 GMT""}]","2009-08-18"
"astro-ph/9712196","David Crampton","F. Rigaut, D. Salmon, R. Arsenault, J. Thomas, O. Lai, D. Rouan, J.P.
  Veran, P. Gigan, D. Crampton, J.M. Fletcher, J. Stilburn, C. Boyer, P.
  Jagourel","Performance of the CFHT Adaptive Optics Bonnette","18 pages plus 12 postscript figures. Accepted by PASP. Also available
  at http://www.hia.nrc.ca/science/preprint/preprint.html",,,"HIA-9727","astro-ph",,"  Extensive results from the commissioning phase of PUEO, the adaptive optics
instrument adaptor for the Canada-France-Hawaii telescope, are presented and
discussed. Analyses of more than 750 images recorded with a CCD and a near-IR
camera on 16 nights in wavelengths from B to H are used to derive the
properties of the compensated wavefront and images in a variety of conditions.
The performance characteristics of the system are analyzed and presented in
several ways, in terms of delivered Strehl ratios, full-width-half-maxima, and
quantities describing the improvements of both. A qualitative description is
given of how the properties of the corrected images result from the structure
function of the compensated phase. Under median seeing conditions, PUEO
delivers essentially diffraction-limited images at H and K, images with FWHM
~0.1"" at J and I, and provides significant gains down to B, with guide stars as
faint as R = 14. During good conditions, substantial gains were realized with
guide stars as faint as R = 17. A simple user-interface and software which
automatically and continuously optimizes the mode gains during observations
makes the operational efficiency extremely high. A few astronomical examples
are briefly discussed.
","[{""version"":""v1"",""created"":""Mon, 15 Dec 1997 23:10:15 GMT""}]","2007-05-23"
