"astro-ph/9712247","Heino Falcke","Heino Falcke (Univ. Maryland & MPIfR Bonn), M. J. Rieke, G. H. Rieke
  (Steward Observatory, Arizona), Chris Simpson (JPL, Pasadena), Andrew S.
  Wilson (Univ. Maryland)","Molecular Hydrogen and Paschen-alpha Emission in Cooling Flow Galaxies","ApJ Letters, in press, AAS LaTex, preprint also available at
  http://www.astro.umd.edu/~hfalcke/publications.html#nirgal",,"10.1086/311176","hfa/eprint/No.23","astro-ph",,"  We present near-infrared spectra obtained to search for Pa-alpha and
molecular hydrogen lines in edge-darkened (FR I-type) radio galaxies with
bright Halpha emission in the redshift range 0.0535<z<0.15. We find that all
three galaxies in our sample (PKS 0745-191, PKS 1346+26, & PKS2322-12) which
are associated with strong cooling flows also have strong Pa-alpha and H_2
(1-0) S(1) through S(5) emission, while other radio galaxies do not. Together
with earlier observations this confirms claims that cooling flow galaxies are
copious emitters of molecular hydrogen with large H_2 (1-0) S(3)/Pa-alpha
ratios in the range 0.5 to 2. The emission is centrally concentrated within the
inner few kiloparsec and could come from warm (T ~ 1000-1500 K) molecular
material which is being deposited by the cooling flow. We speculate that the
H_2 emission could be related to the interaction between the jets and this
molecular gas.
","[{""version"":""v1"",""created"":""Thu, 18 Dec 1997 10:07:44 GMT""}]","2009-10-30"
"astro-ph/9712248","Matteo Guainazzi","M.Guainazzi (1), A.Comastri, G.Stirpe (2), W.N.Brandt (3), A.Parmar
  (4), E.M.Puchnarewicz (5) ((1) Beppo-SAX SDC, Roma, Italy, (2) Osservatorio
  Astronomico di Bologna, Italy, (3) Dep. of Astron. & Astophys., Penn State
  Un., U.S.A., (4) SSD/ESTEC. Noordwijk, The Netherlands, (5) Mullard Space
  Science Laboratory, Un. College London, Dorking, U.K.)","1H0419-577: a two-state Seyfert Galaxy?","4 pages, Latex, 4 Postscript figures, `espcrc2.sty included, to
  appear in the Proceedigns of the Workshop ""The active X-ray sky: results from
  Beppo-SAX and RXTE""",,"10.1016/S0920-5632(98)00278-3",,"astro-ph",,"  The preliminary results of the BeppoSAX observation of the radio-quiet AGN
1H0419-577 are presented. Despite its broad line optical spectrum, the
intermediate X-ray spectrum (i.e. 2--10 keV) is flatter than typically observed
in Seyfert 1s and no iron line is significantly detected. Even more
intriguingly, a 1992 ROSAT pointed observation suggests a dramatic (~ 1) change
in the spectral shape for E < 2 keV. Such behavior is briefly discussed in the
framework of our current understanding of Comptonization scenarios in the
nuclear regions of radio-quiet AGN.
","[{""version"":""v1"",""created"":""Thu, 18 Dec 1997 13:31:44 GMT""}]","2015-06-24"
"astro-ph/9712249","Lucio Chiappetti","L. Chiappetti, F. Haardt, A. Treves, D. Ricci, A. Santangelo, S.
  Mereghetti, T.Belloni","BeppoSAX observations of the exotic black hole candidate GX 339-4","4 pages, 2 figures imbedded, To appear in The Active X-ray Sky:
  Results from BeppoSAX and Rossi-XTE, Nuclear Physics B Proceedings
  Supplements, L. Scarsi, H. Bradt, P. Giommi and F. Fiore (eds.), Elsevier
  Science B.V","Nucl.Phys. B Proc.Suppl. 69 pag. 340","10.1016/S0920-5632(98)00236-9",,"astro-ph",,"  GX 339-4 has been observed by BeppoSAX twice in spring 1997 as part of a
longer monitoring program. The source was close to the highest levels (50
mCrab) of the extended low state (as measured by the XTE ASM during the last 2
years). Its spectrum was quite hard, similar to the Exosat 1984 off state, but
40 times stronger. The source is detected up to more than 120 keV, enabling the
possibility to study its high energy spectrum
","[{""version"":""v1"",""created"":""Thu, 18 Dec 1997 14:46:06 GMT""}]","2015-06-24"
"astro-ph/9712250","Cristian Vignali","C. Vignali(1), A. Comastri(2), G.M. Stirpe(2), M. Cappi(3,4), G.G.C.
  Palumbo(1,3), M. Matsuoka(4), G. Malaguti(3), L. Bassani(3) ((1)Dipartimento
  di Astronomia, Universita` di Bologna, (2)Osservatorio Astronomico di
  Bologna, (3)ITeSRE/CNR-Bologna, (4)RIKEN-Saitama)","ASCA detection of the FeK edge in the spectrum of the Seyfert 2 galaxy
  IRAS 04575-7537: a sign of a complex absorber","7 pages, 4 ps figures, accepted by Astronomy & Astrophysics main
  journal",,,"BAP 12-1997-052-DDA","astro-ph",,"  ASCA X-ray spectral analysis of the Seyfert 2 galaxy IRAS 04575-7537 is
presented. The main result is the presence of a significant iron edge at a rest
energy of 7.13^+0.21_-0.16 keV. The spectrum is flat (Gamma = 1.5) with a
substantial absorption Nh = 10^22 cm^-2 and does not require any reflection
component. There is also evidence of a narrow Fe Kalpha emission line, whose
rest energy (E = 6.35^+0.08_ -0.03 keV) and equivalent width (EW = 130+-50 eV)
suggest that the line originates from thick and cold matter. The intensity of
the line and, in particular, the depth of the iron edge are too strong to be
explained by simple transmission through the measured absorption column
density. This strongly suggests that a model more complex than a single
absorbed power law is needed. We propose an absorption model that we call
""leaky-total absorber"" which can explain the spectrum flatness, the iron
emission line and the edge absorption feature and has also the advantage of
having a straightforward physical interpretation in the framework of Unified
models. In this model a thick absorber (Nh = 10^23 cm^-2), possibly associated
with broad line region (BLR) clouds, partially (36 %) covers the source
continuum with Gamma fixed to 1.9 as observed in Sey 1 galaxies. The escaping
radiation is then absorbed by a column density Nh = 10^22 cm^-2, which can be
attributed to the torus, seen through its rim.
","[{""version"":""v1"",""created"":""Thu, 18 Dec 1997 14:54:35 GMT""}]","2007-05-23"
"astro-ph/9712251","Lucio Chiappetti","L. Chiappetti, G. Cusumano, S. Del Sordo, M. C. Maccarone, T. Mineo,
  S. Molendi","What can BeppoSAX do about the 2-10 keV cosmic background ? A progress
  report","8 pages, 9 figures imbedded, To appear in The Active X-ray Sky:
  Results from BeppoSAX and Rossi-XTE, Nuclear Physics B Proceedings
  Supplements, L. Scarsi, H. Bradt, P. Giommi and F. Fiore (eds.), Elsevier
  Science B.V","Nucl.Phys. B Proc. Suppl. 69 pag. 610","10.1016/S0920-5632(98)00305-3",,"astro-ph",,"  We report the current status of the analysis of the MECS background using the
entire dataset of the BeppoSAX Science performance Verification Phase. We have
collected 360 ks of dark Earth instrumental background, 470 ks of bright Earth
background and 1100 ks of blank field data. We are attempting to model the
instrumental background in terms of its various components (in particular the
spatial modulation of the residual contamination by the built-in Fe calibration
sources), and then use this model, and the information on the vignetting and
the PSF to derive the cosmic background in the 2-10 keV range
","[{""version"":""v1"",""created"":""Thu, 18 Dec 1997 15:06:58 GMT""}]","2015-06-24"
"astro-ph/9712252","Peter Meszaros","M.J. Rees (1) & P. Meszaros (2) ((1) Inst. of Astronomy, Cambridge
  University (2) Pennsylvania State University)","Refreshed Shocks and Afterglow Longevity in GRB","subm to Ap.J. Letters, 12/18/97; latex (aaspp4), 9 pages, one
  postscript figure","Astrophys.J. 496 (1998) L1","10.1086/311244",,"astro-ph",,"  We consider fireball models where the ejecta have a range of bulk Lorentz
factors, so that the inner (lower $\Gamma$) parts may carry most of the mass,
or even most of the energy. The outer shock and contact discontinuity
decelerate as the fireball sweeps up external matter. This deceleration allows
slower ejecta to catch up, replenishing and reenergizing the reverse shock and
boosting the momentum in the blast wave. In consequence, the energy available
to power the afterglow may substantially exceed that of the burst itself. Such
models allow a wide range of possibilities for the afterglow evolution, even in
the case of spherically symmetric expansion.
","[{""version"":""v1"",""created"":""Thu, 18 Dec 1997 15:52:43 GMT""}]","2009-10-30"
"chao-dyn/9712015","Andreas Wirzba","Andreas Wirzba (TU Darmstadt)","Quantum Mechanics and Semiclassics of Hyperbolic n-Disk Scattering
  Systems","131 pages (LaTeX), 47 figures (PostScript), uses elsart.sty,
  epsfig.sty, epsf.sty and epsf.tex; Habilitationsschrift (TU Darmstadt), see
  http://crunch.ikp.physik.tu-darmstadt.de/~wirzba/Habilitation.html","Phys.Rept. 309 (1999) 1-116","10.1016/S0370-1573(98)00036-2","HAB WIR 1997 - R13183 (IKP, TU Darmstadt)","chao-dyn cond-mat nlin.CD nucl-th quant-ph",,"  The scattering problems of a scalar point particle from a finite assembly of
n>1 non-overlapping and disconnected hard disks, fixed in the two-dimensional
plane, belong to the simplest realizations of classically hyperbolic scattering
systems. Here, we investigate the connection between the spectral properties of
the quantum-mechanical scattering matrix and its semiclassical equivalent based
on the semiclassical zeta-function of Gutzwiller and Voros. Our
quantum-mechanical calculation is well-defined at every step, as the on-shell
T-matrix and the multiscattering kernel M-1 are shown to be trace-class. The
multiscattering determinant can be organized in terms of the cumulant expansion
which is the defining prescription for the determinant over an infinite, but
trace-class matrix. The quantum cumulants are then expanded by traces which, in
turn, split into quantum itineraries or cycles. These can be organized by a
simple symbolic dynamics. The semiclassical reduction of the coherent
multiscattering part takes place on the level of the quantum cycles. We show
that the semiclassical analog of the m-th quantum cumulant is the m-th
curvature term of the semiclassical zeta function. In this way quantum
mechanics naturally imposes the curvature regularization structured by the
topological (not the geometrical) length of the pertinent periodic orbits onto
the semiclassical zeta function. However, since the cumulant limit m->infinity
and the semiclassical limit hbar->0 do not commute in general, the
semiclassical analog of the quantum multiscattering determinant is a curvature
expanded, truncated semiclassical zeta function. We relate the order of this
truncation to the topological entropy of the corresponding classical system.
","[{""version"":""v1"",""created"":""Wed, 17 Dec 1997 17:32:01 GMT""}]","2007-05-23"
"chao-dyn/9712016","Michael Blank","Michael Blank (Russian Academy of Sciences, Russia) and Gerhard Keller
  (Universitat Erlangen-Nurnberg, Germany)","Random perturbations of chaotic dynamical systems. Stability of the
  spectrum","14 pages, LaTeX",,"10.1088/0951-7715/11/5/010",,"chao-dyn nlin.CD",,"  For piecewise expanding one-dimensional maps without periodic turning points
we prove that isolated eigenvalues of small (random) perturbations of these
maps are close to isolated eigenvalues of the unperturbed system. (Here
``eigenvalue'' means eigenvalue of the corresponding Perron-Frobenius operator
acting on the space of functions of bounded variation.) This result applies
e.g. to the approximation of the system by a finite state Markov chain and
generalizes Ulam's conjecture about the approximation of the SBR invariant
measure of such a map. We provide several simple examples showing that for maps
with periodic turning points and for general multidimensional smooth hyperbolic
maps isolated eigenvalues are typically unstable under random perturbations.
Our main tool in the 1D case is a special technique for ``interchanging'' the
map and the perturbation, developed in our previous paper, combined with a
compactness argument.
","[{""version"":""v1"",""created"":""Thu, 18 Dec 1997 15:44:41 GMT""}]","2009-10-30"
"cond-mat/9712196","Kai Nagel","Kai Nagel, Dietrich E Wolf, Peter Wagner, Patrice Simon","Two-lane traffic rules for cellular automata: A systematic approach",,,"10.1103/PhysRevE.58.1425","LA-UR 97-4706","cond-mat.stat-mech adap-org nlin.AO",,"  Microscopic modeling of multi-lane traffic is usually done by applying
heuristic lane changing rules, and often with unsatisfying results. Recently, a
cellular automaton model for two-lane traffic was able to overcome some of
these problems and to produce a correct density inversion at densities somewhat
below the maximum flow density. In this paper, we summarize different
approaches to lane changing and their results, and propose a general scheme,
according to which realistic lane changing rules can be developed. We test this
scheme by applying it to several different lane changing rules, which, in spite
of their differences, generate similar and realistic results. We thus conclude
that, for producing realistic results, the logical structure of the lane
changing rules, as proposed here, is at least as important as the microscopic
details of the rules.
","[{""version"":""v1"",""created"":""Thu, 18 Dec 1997 01:44:31 GMT""}]","2009-10-30"
"cond-mat/9712201","Thorsten Poeschel","Volkhard Buchholtz and Thorsten Poeschel","Interaction of a granular stream with an obstacle","26 pages, 12 figures","Granular Matter, Vol. 1, 33 (1998)",,,"cond-mat.stat-mech cond-mat.mtrl-sci",,"  We investigate numerically the interaction of a stream of granular particles
with a resting obstacle in two dimensions. For the case of high stream velocity
we find that the force acting on the obstacle is proportional to the square of
the stream velocity, the density and the obstacle size. This behavior is
equivalent to that of non- interacting hard spheres. For low stream velocity
there appears a gap in between the obstacle and the incoming stream particles
which is filled with granular gas of high temperature and low density. As soon
as the gap appears the force does not depend on the square of velocity of the
stream but the dependency obeys another law.
","[{""version"":""v1"",""created"":""Thu, 18 Dec 1997 01:33:20 GMT""},{""version"":""v2"",""created"":""Thu, 18 Dec 1997 03:32:58 GMT""}]","2007-05-23"
"cond-mat/9712205","Gerhard Brunthaler","G. Brunthaler, T. Dietl, A. Prinz, M. Sawicki, J. Jaroszynski, P.
  Glod, F. Schaffler, G. Bauer, D.K. Maude and J.C. Portal","Interaction effects at the magnetic-field induced metal-insulator
  transition in Si/SiGe superlattices","5 pages, 3 figures, Solid State Communications, in print","Solid State Commun. 106, 157 (1998)","10.1016/S0038-1098(98)00013-1","HL-97-12","cond-mat.mes-hall",,"  A metal-insulator transition was induced by in-plane magnetic fields up to 27
T in homogeneously Sb-doped Si/SiGe superlattice structures. The localisation
is not observed for perpendicular magnetic fields. A comparison with
magnetoconductivity investigations in the weakly localised regime shows that
the delocalising effect originates from the interaction-induced spin-triplet
term in the particle-hole diffusion channel. It is expected that this term,
possibly together with the singlet particle-particle contribution, is of
general importance in disordered n-type Si bulk and heterostructures.
","[{""version"":""v1"",""created"":""Wed, 17 Dec 1997 21:28:59 GMT""}]","2014-01-10"
"cond-mat/9712213","Lamberto Rondoni","E.G.D. Cohen and L. Rondoni","Note on Phase Space Contraction and Entropy Production in Thermostatted
  Hamiltonian Systems","16 pages including 1 table and 3 figures. LaTeX format",,"10.1063/1.166317",,"cond-mat.stat-mech",,"  The phase space contraction and the entropy production rates of Hamiltonian
systems in an external field, thermostatted to obtain a stationary state are
considered. While for stationary states with a constant kinetic energy the two
rates are formally equal for all numbers of particles N, for stationary states
with constant total (kinetic and potential) energy this only obtains for large
N. However, in both cases a large number of particles is required to obtain
equality with the entropy production rate of Irreversible Thermodynamics.
Consequences of this for the positivity of the transport coefficients and for
the Onsager relations are discussed. Numerical results are presented for the
special case of the Lorentz gas.
","[{""version"":""v1"",""created"":""Wed, 17 Dec 1997 16:12:21 GMT""}]","2009-10-30"
"cond-mat/9712215","Martin Dube","M. Dube, P. C. E. Stamp","Dynamics of a Pair of Interacting Spins Coupled to an Environmental Sea","49 pages, To appear in Int J. Mod. Phys. B",,"10.1142/S0217979298000661","HIP-1997-70/TH","cond-mat",,"  We solve for the dynamics of a pair of spins, coupled to each other and also
to an environmental sea of oscillators. The environment mediates an indirect
interaction between the spins, causing both mutual coherence effects and
dissipation. This model describes a wide variety of physical systems, ranging
from 2 coupled microscopic systems (eg., magnetic impurities, bromophores,
etc), to 2 coupled macroscopic quantum systems. We obtain analytic results for
3 regimes, viz., (i) The locked regime, where the 2 spins lock together; (ii)
The correlated relaxation regime (mutually correlated incoherent relaxation);
and (iii) The mutual coherence regime, with correlated damped oscillations.
These results cover most of the parameter space of the system.
","[{""version"":""v1"",""created"":""Wed, 17 Dec 1997 19:39:15 GMT""}]","2015-06-25"
"cond-mat/9712216","Nicolas Dupuis","N. Dupuis and Victor M. Yakovenko (Univ. of Maryland)","Sign reversals of the quantum Hall effect and helicoidal
  magnetic-field-induced spin-density waves in quasi-one-dimensional organic
  conductors","4 pages, latex, 3 figures","Phys. Rev. Lett. 80, 3618 (1998)","10.1103/PhysRevLett.80.3618",,"cond-mat",,"  We study the effect of umklapp scattering on the magnetic-field-induced
spin-density-wave phases, which are experimentally observed in the
quasi-one-dimensional organic conductors of the Bechgaard salts family. Within
the framework of the quantized nesting model, we show that umklapp processes
may naturally explain sign reversals of the quantum Hall effect (QHE) observed
in these conductors. Moreover, umklapp scattering can change the polarization
of the spin-density wave (SDW) from linear (sinusoidal SDW) to circular
(helicoidal SDW). The QHE vanishes in the helicoidal phases, but a
magnetoelectric effect appears. These two characteristic properties may be
utilized to detect the magnetic-field-induced helicoidal SDW phases
experimentally.
","[{""version"":""v1"",""created"":""Wed, 17 Dec 1997 23:29:10 GMT""}]","2009-10-30"
"cond-mat/9712217","Sudip Chakravarty","Sudip Chakravarty, Lan Yin, Elihu Abrahams","Interactions and Scaling in a Disordered Two-Dimensional Metal","4 pages, RevTex","Phys. Rev. B 58, R559 (1998).","10.1103/PhysRevB.58.R559",,"cond-mat.dis-nn",,"  We show that a non-Fermi liquid state of interacting electrons in two
dimensions is stable in the presence of disorder and is a perfect conductor,
provided the interactions are sufficiently strong. Otherwise, the disorder
leads to localization as in the case of non-interacting electrons. This
conclusion is established by examining the replica field theory in the weak
disorder limit, but in the presence of arbitrary electron-electron interaction.
Thus, a disordered two-dimensional metal is a perfect metal, but not a Fermi
liquid.
","[{""version"":""v1"",""created"":""Thu, 18 Dec 1997 00:59:51 GMT""}]","2009-10-30"
"cond-mat/9712218","Mohammad H. S. Amin","M. H. S. Amin, Ian Affleck (UBC), M. Franz (Johns Hopkins)","Low Temperature Behavior of the Vortex Lattice in Unconventional
  Superconductors","3 figures and extensive discussion added, Version to appear in
  September 1 issue of PRB","Phys. Rev. B 58, 5848 (1998)","10.1103/PhysRevB.58.5848",,"cond-mat.supr-con",,"  We study the effect of the superconducting gap nodes on the vortex lattice
properties of high temperature superconductors at very low temperatures. The
nonlinear, nonlocal and nonanalytic nature of this effect is shown to have
measurable consequences for the vortex lattice geometry and the effective
penetration depth in the mixed state as measured by muon-spin-rotation
experiments.
","[{""version"":""v1"",""created"":""Thu, 18 Dec 1997 01:22:26 GMT""},{""version"":""v2"",""created"":""Fri, 19 Jun 1998 02:10:24 GMT""}]","2009-10-30"
"cond-mat/9712219","Hal Tasaki","Hal Tasaki","From Nagaoka's ferromagnetism to flat-band ferromagnetism and beyond: An
  introduction to ferromagnetism in the Hubbard model","LaTeX2e, 72 pages, 17 epsf figures. Many minor corrections made in
  March 1998. This is the final version, which will appear in Prog. Theor.
  Phys. 99 (invited paper)",,"10.1143/PTP.99.489",,"cond-mat.str-el",,"  This is a self-contained review about ferromagnetism in the Hubbard model,
which should be accessible to readers with various backgrounds who are new to
the field.
  We describe Nagaoka's ferromagnetism and flat-band ferromagnetism in detail,
giving all necessary backgrounds as well as complete (but elementary)
mathematical proofs. By studying an intermediate model called long-range
hopping model, we also demonstrate that there is indeed a deep relation between
these two seemingly different approaches to ferromagnetism.
  We further discuss some attempts to go beyond these approaches. We briefly
discuss recent rigorous example of ferromagnetism in the Hubbard model which
has neither infinitely large parameters nor completely flat bands. We give
preliminary discussions about possible experimental realizations of the
(nearly-)flat-band ferromagnetism. Finally we focus on some theoretical
attempts to understand metallic ferromagnetism. We discuss three artificial
one-dimensional models in which the existence of metallic ferromagnetism can be
easily proved.
","[{""version"":""v1"",""created"":""Thu, 18 Dec 1997 03:06:37 GMT""},{""version"":""v2"",""created"":""Thu, 5 Mar 1998 07:34:56 GMT""},{""version"":""v3"",""created"":""Mon, 9 Mar 1998 06:41:21 GMT""}]","2009-10-30"
"cond-mat/9712220","S. H.","S. Curnoe (Weizmann Institute), P.C.E. Stamp (University of British
  Columbia)","Quantum Oscillations of Electrons and of Composite Fermions in Two
  Dimensions: Beyond the Luttinger Expansion","4 pages, 3 figures, LaTex","Phys. Rev. Lett. 80 (1998) 3312","10.1103/PhysRevLett.80.3312",,"cond-mat.mes-hall cond-mat.str-el",,"  Quantum oscillation phenomena, in conventional 2-dimensional electron systems
and in the fractional quantum Hall effect, are usually treated in the
Lifshitz-Kosevich formalism. This is justified in three dimensions by
Luttinger's expansion, in the parameter $omega_c/\mu$. We show that in two
dimensions this expansion breaks down, and derive a new expression, exact in
the limit where rainbow graphs dominate the self-energy. Application of our
results to the fractional quantum Hall effect near half-filling shows very
strong deviations from Lifshitz-Kosevich behaviour. We expect that such
deviations will be important in any strongly-interacting 2-dimensional
electronic system.
","[{""version"":""v1"",""created"":""Thu, 18 Dec 1997 08:56:26 GMT""}]","2009-10-30"
"cond-mat/9712221","Luca Peliti","Luca Peliti and Mauro Sellitto","Aging in a simple model of a structural glass","LaTeX, 8 pages, 4 figures. Contribution to the Conference ""Disorder
  and Chaos"", Rome, September 1997. A few misprints corrected, and references
  updated",,,"NAG39705","cond-mat.stat-mech cond-mat.dis-nn",,"  We consider a simple model of a structural glass, represented by a lattice
gas with kinetic constraints in contact with a particle reservoir. Quench below
the glass transition is represented by the jump of the chemical potential above
a threshold. After a quench, the density approaches the critical density-where
the diffusion coefficient of the particles vanishes-following a power law in
time. In this regime, the two-time self-correlation functions exhibit aging.
The behavior of the model can be understood in terms of simple mean-field
arguments.
","[{""version"":""v1"",""created"":""Thu, 18 Dec 1997 13:23:23 GMT""},{""version"":""v2"",""created"":""Fri, 6 Feb 1998 15:50:22 GMT""}]","2007-05-23"
"cond-mat/9712222","Jeppe Dyre","Jeppe C. Dyre (Roskilde University, Denmark)","A Statistical Mechanical Approximation for the Calculation of Time
  Auto-Correlation Functions","Plain RevTex file, no figures",,,,"cond-mat",,"  This paper considers the problem of estimating the time auto-correlation
function for a quantity that is defined in configuration space, given a
knowledge of the mean-square displacement as function of time in configuration
space. The problem is particularly relevant for viscous liquids, where the
interesting time-scales are often beyond those reachable by computer
simulation. An approximate formula is derived which reduces the calculation of
the time auto- correlation function to a ""double canonical"" average. In this
approximation, in the case of Langevin dynamics the mean-square displacement
itself may be evaluated from the ""double partition function"" . The scheme
developed is illustrated by computer simulations of a simple one-dimensional
system at different temperatures, showing good agreement between the exact time
auto-correlation functions and those found by the approximation.
","[{""version"":""v1"",""created"":""Thu, 18 Dec 1997 14:22:35 GMT""}]","2007-05-23"
"cond-mat/9712224","Allan I. Solomon","Allan I. Solomon and Joseph L. Birman","Dynamical Group for the Quantum Hall Effect","9 pages, LaTex","Physics of Atomic Nuclei Vol 61(10): 1702--1704 (1998)",,"OU-97-00102","cond-mat.mes-hall",,"  A dynamical group for the single-particle (non-interacting) Quantum Hall
Effect is found, and used to describe the Landau levels and determine the
transverse (Hall) current.
","[{""version"":""v1"",""created"":""Thu, 18 Dec 1997 15:53:52 GMT""}]","2007-05-23"
