"hep-ph/9712436","Dr Tsou Sheung Tsun","HM Chan (Rutherford Appleton Laboratory) and ST Tsou (Oxford)","Standard Model with Duality: Physical Consequences","17 pages, Latex, no figures","Acta Phys.Polon.B28:3041-3056,1997",,"RAL-TR-97-070","hep-ph hep-th",,"  The Dualized Standard Model offers a natural place both to Higgs fields and
to fermion generations with Higgs fields appearing as frame vectors in internal
symmetry space and generation appearing as dual colour. If they are assigned
those niches, it follows that there are exactly 3 generations of fermions, and
that at the tree-level, only one generation has a mass (fermion mass hierarchy)
while the CKM matrix is the identity. However, loop corrections lift this
degeneracy giving nonzero CKM mixing and masses to fermions of the two lower
generations. A recent calculation to 1-loop level, with just a few parameters,
yields a very good fit to the empirical CKM matrix and sensible values also to
the lower generation masses. In addition, predictions are obtained, in areas
ranging from low energy flavour-changing neutral current decays to extremely
high energy cosmic rays, which are testable in experiments now being planned.
","[{""version"":""v1"",""created"":""Thu, 18 Dec 1997 10:48:30 GMT""}]","2011-04-15"
"hep-ph/9712437","Yuly Shabelsky","M.G.Ryskin and Yu.M.Shabelski (Petersburg Nuclear Physics Institute)","Elastic \rho' and \phi Meson Photo- and Electroproduction with
  Non-Resonant Background","11 pages, LaTeX, 5 figures in 9 additional eps files","Phys.Atom.Nucl. 62 (1999) 980-986; Yad.Fiz. 62 (1999) 1047-1053",,,"hep-ph",,"  The backgrounds due to the direct diffractive dissociation of the photon into
the $\pi^+\pi^-$ as well as $K^+K^-$ pairs to the ""elastic"" diffractive $\rho
'$ and $\phi $ mesons production in electron-proton collisions are calculated.
It is shown that the role of background and background-resonant interference
contributions is very important in experimental distribution of $M_{\pi^+
\pi^-}$ in the $\rho '$ mass region. The amplitude for the background process
is proportional to the $\pi$-meson - proton or K-meson - proton cross sections.
Therefore, describing the HERA data, one can estimate $\sigma (\pi p)$ and
$\sigma (Kp)$ at energies higher than the region of direct measurements.
","[{""version"":""v1"",""created"":""Thu, 18 Dec 1997 12:06:09 GMT""}]","2007-05-23"
"hep-ph/9712438","Jan Stern","Jan Stern (IPN-Orsay)","Light quarks masses and condensates in QCD","23 pages, 12 Postscript figures, LaTeX, uses svcon2e.sty, to be
  published in the Proceedings of the Workshop on Chiral Dynamics 1997, Mainz,
  Germany, Sept. 1-5, 1997",,"10.1007/BFb0104896","IPNO/TH 97-30","hep-ph",,"  We review some theoretical and phenomenological aspects of the scenario in
which the spontaneous breaking of chiral symmetry is not triggered by a
formation of a large condensate <\bar{q} q>. Emphasis is put on the resulting
pattern of light quark masses, on the constraints arising from QCD sum rules
and on forthcoming experimental tests.
","[{""version"":""v1"",""created"":""Thu, 18 Dec 1997 12:09:40 GMT""}]","2009-10-30"
"hep-ph/9712439","Manoj K. Samal","M. K. Samal","On the determination of CP violating Majorana phases","revtex, 5 pages, no figures",,,"IP/BBSR/97-30","hep-ph",,"  The determination of CP violating phases in the Majorana neutrino mixing
matrix using phenomenological constraints from neutrino oscillations,
neutrinoless double beta decay, ($\mu^-, e^+$) conversion and few other
processes is discussed. We give the expressions for the phases in terms of the
mixing angles and masses consistent with the recent data from Kamiokande.
","[{""version"":""v1"",""created"":""Thu, 18 Dec 1997 12:24:16 GMT""}]","2007-05-23"
"hep-ph/9712440","Piotr Urban","M. Jezabek, P. Urban","Polarization of tau leptons in semileptonic B decays","one footnote and one reference have been added; the paper is going to
  be published in Nucl. Phys. B","Nucl.Phys. B525 (1998) 350-368","10.1016/S0550-3213(98)00189-8","TP-USl/97/2","hep-ph",,"  Analytic formulae for the one-loop order QCD corrections to the differential
width of the semileptonic b decay are given with the tau polarization taken
into account. Thence the polarization of tau is expressed by its energy and the
invariant mass of the tau + antineutrino system. The non-perturbative
corrections by Falk et al. are incorporated in the calculation.
","[{""version"":""v1"",""created"":""Thu, 18 Dec 1997 14:10:46 GMT""},{""version"":""v2"",""created"":""Tue, 3 Mar 1998 09:02:29 GMT""}]","2009-10-30"
"hep-ph/9712441","Carlo Giunti","W.M. Alberico, M.B. Barbaro, S.M. Bilenky, J.A. Caballero, C. Giunti,
  C. Maieron, E. Moya de Guerra, J.M. Udias","The ratio of p and n yields in NC neutrino(antineutrino)-nucleus
  scattering and strange form factors of the nucleon","8 pages, including 2 figures. Final version to be published in Phys.
  Lett. B","Phys.Lett. B438 (1998) 9-13","10.1016/S0370-2693(98)01043-0","DFTT 70/97","hep-ph nucl-th",,"  We calculate the ratio of proton and neutron yields in NC induced
neutrino(antineutrino)-nucleus inelastic scattering at neutrino energies of
about 1 GeV. We show that this ratio depends very weakly on the nuclear models
employed and that in the neutrino and antineutrino cases the ratios have
different sensitivity to the axial and vector strange form factors; moreover,
the ratio of antineutrino--nucleus cross sections turns out to be rather
sensitive to the electric strange form factor. We demonstrate that measurements
of these ratios will allow to get information on the strange form factors of
the nucleon in the region Q > 0.4 GeV^2.
","[{""version"":""v1"",""created"":""Thu, 18 Dec 1997 14:15:10 GMT""},{""version"":""v2"",""created"":""Thu, 6 Aug 1998 13:06:44 GMT""}]","2009-10-30"
"hep-ph/9712442",,"Stefano Catani (CERN)","QCD at high energies","32 pages, LaTex, uses lprocl.sty, 15 ps figures",,,"CERN-TH/97-371","hep-ph",,"  The following topics in perturbative QCD are reviewed: recent theoretical
progress in higher-order calculations; soft-gluon resummation for
hard-scattering processes at large $E_T$ and high $x$; low-$x$ behaviour of
structure functions and recent theoretical results on BFKL dynamics; infrared
renormalons and power corrections to perturbative predictions; updated summary
of $\as$ measurements.
","[{""version"":""v1"",""created"":""Thu, 18 Dec 1997 14:33:58 GMT""}]","2007-05-23"
"hep-th/9712172","Seiji Terashima","Seiji Terashima","Supersymmetric Gauge Theories with Classical Groups via M Theory
  Fivebrane","45 pages, Latex. Includes corrections to sections on Higgs branch.
  Minor corrections to text. Final version to appear in Nucl. Phys. B","Nucl.Phys. B526 (1998) 163-198","10.1016/S0550-3213(98)00279-X","UTHEP-377","hep-th",,"  We study the moduli space of vacua of four dimensional N=1 and N=2
supersymmetric gauge theories with the gauge groups $Sp(2 N_c)$, $SO(2 N_c)$
and $SO(2 N_c +1)$ using the M theory fivebrane. Higgs branches of the N=2
supersymmetric gauge theories are interpreted in terms of the M theory
fivebrane and the type IIA $s$-rule is realized in it. In particular we
construct the fivebrane configuration which corresponds to a special Higgs
branch root. This root is analogous to the baryonic branch root in the
$SU(N_c)$ theory which remains as a vacuum after the adjoint mass perturbation
to break N=2 to N=1. Furthermore we obtain the monopole condensations and the
meson vacuum expectation values in the confining phase of N=1 supersymmetric
gauge theories using the fivebrane technique. These are in complete agreement
with the field theory results for the vacua in the phase with a single confined
photon.
","[{""version"":""v1"",""created"":""Thu, 18 Dec 1997 00:46:15 GMT""},{""version"":""v2"",""created"":""Mon, 29 Dec 1997 11:21:04 GMT""},{""version"":""v3"",""created"":""Thu, 30 Apr 1998 14:29:38 GMT""}]","2009-10-30"
"hep-th/9712173","Sebastian Jaimungal","C. R. Gattringer, S. Jaimungal and G. W. Semenoff","Topology and Duality in Abelian Lattice Theories","11 pages, LateX, 1 epsf figure; minor typos corrected and references
  updated","Phys.Lett.B425:282-290,1998","10.1016/S0370-2693(98)00254-8",,"hep-th hep-lat",,"  We show how to obtain the dual of any lattice model with inhomogeneous local
interactions based on an arbitrary Abelian group in any dimension and on
lattices with arbitrary topology. It is shown that in general the dual theory
contains disorder loops on the generators of the cohomology group of a
particular dimension. An explicit construction for altering the statistical sum
to obtain a self-dual theory, when these obstructions exist, is also given. We
discuss some applications of these results, particularly the existence of
non-trivial self-dual 2-dimensional Z_N theories on the torus. In addition we
explicitly construct the n-point functions of plaquette variables for the U(1)
gauge theory on the 2-dimensional g-tori.
","[{""version"":""v1"",""created"":""Thu, 18 Dec 1997 01:10:55 GMT""},{""version"":""v2"",""created"":""Thu, 26 Feb 1998 07:23:35 GMT""}]","2008-11-26"
"hep-th/9712175","Adel Khoudeir Maurched","Pio Jose Arias and Adel Khoudeir","Gauge invariance for the massive axion","one reference added, 6 pages, latex. Talk presented at the First
  Venezuelan Congress of Physics (Merida, December 1997)","Ciencia 9:46-49,2001",,,"hep-th",,"  A massive gauge invariant formulation for scalar ($\phi$) and antisymmetric
($C_{mnp}$) fields with a topological coupling, which provides a mass for the
axion field, is considered. The dual and local equivalence with the non-gauge
invariant proposal is established, but on manifolds with non-trivial
topological structure both formulations are not globally equivalent.
","[{""version"":""v1"",""created"":""Wed, 17 Dec 1997 17:00:11 GMT""},{""version"":""v2"",""created"":""Sun, 15 Feb 1998 20:34:32 GMT""}]","2014-11-18"
"hep-th/9712176",,"Fabio Riccioni (Universita' di Roma ""Tor Vergata"")","Tensor Multiplets in Six-Dimensional (2,0) Supergravity","13 pages, LATEX","Phys.Lett. B422 (1998) 126-134","10.1016/S0370-2693(98)00070-7","ROM2F-97/54","hep-th",,"  We construct the complete coupling of $(2,0)$ supergravity in six dimensions
to $n$ tensor multiplets, extending previous results to all orders in the fermi
fields. The truncation to $(1,0)$ supergravity coupled to tensor multiplets
exactly reproduces the complete couplings recently obtained.
","[{""version"":""v1"",""created"":""Wed, 17 Dec 1997 17:27:45 GMT""}]","2009-10-30"
"hep-th/9712177","Andrei Mironov","A.Mironov and A.Morozov","Covariance of WDVV equations","LaTeX, 7 pages, no figures (misprints corrected)","Phys.Lett. B424 (1998) 48-52","10.1016/S0370-2693(98)00150-6","ITEP/TH-71/97, FIAN/TD-25/97","hep-th",,"  The (generalized) WDVV equations for the prepotentials in $2d$ topological
and $4,5d$ Seiberg-Witten models are covariant with respect to non-linear
transformations, described in terms of solutions of associated linear problem.
Both time-variables and the prepotential change non-trivially, but period
matrix (prepotential's second derivatives) remains intact.
","[{""version"":""v1"",""created"":""Wed, 17 Dec 1997 21:37:35 GMT""},{""version"":""v2"",""created"":""Tue, 23 Dec 1997 17:56:05 GMT""}]","2009-10-30"
"hep-th/9712178","Ivan Maksymyk","I. Maksymyk, C.P. Burgess, A. de la Macorra, F. Quevedo","Supersymmetric Models with Product Groups and Field Dependent Gauge
  Couplings","withdrawn in favor of new version hep-th/9808087",,,"TRI-PP-97-33, McGill-97/35, IFUNAM FT97-17","hep-th",,"  The structure of the models of section 3.2 has been found to be richer than
previously thought; a revised version has appeared as hep-th/9808087.
","[{""version"":""v1"",""created"":""Wed, 17 Dec 1997 21:38:29 GMT""},{""version"":""v2"",""created"":""Tue, 17 Feb 1998 22:13:31 GMT""},{""version"":""v3"",""created"":""Thu, 27 Aug 1998 17:40:01 GMT""}]","2007-05-23"
"hep-th/9712179","N. D. Hari Dass","N.D. Hari Dass and B. Sathiapalan","Interaction of F- and D-strings in the Matrix Model","22 pages, 2 figs (Latex), one ref added","Mod.Phys.Lett. A13 (1998) 921-936","10.1142/S0217732398001005","IMSC/97/12/42","hep-th",,"  We study a configuration of a parallel F- (fundamental) and D- string in IIB
string theory by considering its T-dual configuration in the matrix model
description of M-theory. We show that certain non-perturbative features of
string theory such as $O(e^{-\frac{1}{g_{s}}})$ effects due to soliton loops,
the existence of bound state (1,1) strings and manifest S-duality, can be seen
in matrix models. We discuss certain subtleties that arise in the large-N limit
when membranes are wrapped around compact dimensions.
","[{""version"":""v1"",""created"":""Thu, 18 Dec 1997 05:59:14 GMT""},{""version"":""v2"",""created"":""Mon, 22 Dec 1997 07:18:56 GMT""},{""version"":""v3"",""created"":""Mon, 2 Feb 1998 10:34:37 GMT""},{""version"":""v4"",""created"":""Fri, 13 Feb 1998 11:49:23 GMT""}]","2009-10-30"
"hep-th/9712180","Naoki Sasakura","Isao Kishimoto and Naoki Sasakura (Kyoto Univ.)","M-theory description of BPS string in 7-brane background","8 pages, two references added","Phys.Lett. B432 (1998) 305-309","10.1016/S0370-2693(98)00686-8","KUNS-1484, HE(TH) 97/20","hep-th",,"  We discuss the BPS configurations of IIB strings in the 7-brane background
from M-theory viewpoint. We first obtain the hyperkahler geometry background of
M-theory expected from the 7-brane solutions of the type IIB supergravity. We
choose the appropriate complex structures of the background geometries and
embed a membrane of M-theory holomorphically to obtain a BPS string
configuration. The recently discussed BPS string configurations such as
3-string junctions and string networks in the flat background are generalized
to the cases with the 7-brane backgrounds. The property of the BPS string
configurations in the 7-brane backgrounds is in agreement with the previously
known results from the IIB string viewpoint.
","[{""version"":""v1"",""created"":""Thu, 18 Dec 1997 08:59:54 GMT""},{""version"":""v2"",""created"":""Wed, 24 Dec 1997 01:14:34 GMT""}]","2009-10-30"
"hep-th/9712181","Markus Quandt","M. Quandt, H. Reinhardt (Tubingen U.)","Ward Identities for Yang-Mills Theory in Abelian Gauges: Abelian
  Dominance at High Energies","11 pages, LaTeX","Phys.Lett. B424 (1998) 115-124","10.1016/S0370-2693(98)00137-3","UNITU-THEP-20/1997","hep-th",,"  We consider Yang-Mills theory in a general class of Abelian gauges.
Exploiting the residual Abelian symmetry on a quantum level, we derive a set of
Ward identities in functional form, valid to all orders in perturbation theory.
As a consequence, the coupling constant is only renormalised through the
Abelian two-point function. This implies that asymptotic freedom in all Abelian
gauges can be understood from an effective Abelian theory alone, which can be
interpreted as Abelian dominance in the high energy regime.
","[{""version"":""v1"",""created"":""Thu, 18 Dec 1997 09:43:43 GMT""}]","2009-10-30"
"hep-th/9712182","Olaf Lechtenfeld","Klaus Junemann, Olaf Lechtenfeld (Univ. of Hannover, Germany)","Chiral BRST Cohomology of N=2 Strings at Arbitrary Ghost and Picture
  Number","19 pages, LaTeX (uses amssymb, amsmath, amscd)","Commun.Math.Phys. 203 (1999) 53-69","10.1007/s002200050605","ITP-UH-33/97","hep-th",,"  We compute the BRST cohomology of the holomorphic part of the N=2 string at
arbitrary ghost and picture number. We confirm the expectation that the
relative cohomology at non-zero momentum consists of a single massless state in
each picture. The absolute cohomology is obtained by an independent method
based on homological algebra. For vanishing momentum, the relative and absolute
cohomologies both display a picture dependence -- a phenomenon discovered
recently also in the relative Ramond sector of N=1 strings by Berkovits and
Zwiebach.
","[{""version"":""v1"",""created"":""Thu, 18 Dec 1997 14:23:55 GMT""}]","2009-10-30"
"hep-th/9712183","Raimar Wulkenhaar","Raimar Wulkenhaar","Gyros as geometry of the standard model","20 pages, LaTeX 2e, 1 eps-figure",,,,"hep-th",,"  We investigate the (noncommutative) geometry defined by the standard model,
which turns out to be of Kaluza-Klein type. We find that spacetime points are
replaced by extended two-dimensional objects which resemble the surface of a
gyro. Their size is of the order of the inverse top quark mass.
","[{""version"":""v1"",""created"":""Thu, 18 Dec 1997 14:25:07 GMT""}]","2007-05-23"
"hep-th/9712184","Zheng Yin","Zheng Yin","Mirrors and Phases of N=4 in D=3","Talk presented at NATO/ASI on Strings, Branes and Dualities, Cargese,
  1997. 15 pages, 10 figures, latex 2.09, epsfig, crckapb.sty",,,"UCB-PTH-97/64, LBNL-41163","hep-th",,"  We review brane engineering of mirror pairs of 3d N=4 theories. It reveals
aspects of 3d physics not known from previous field theoretic studies: novel
QFT's without Lagrangian description and transitions to them from conventional
QFT's.
","[{""version"":""v1"",""created"":""Thu, 18 Dec 1997 15:02:51 GMT""}]","2007-05-23"
"math/9712257","Jesus A. De Loera","C. A. Athanasiadis (U. Pennsylvania), J. A. De Loera (U. Minnesota),
  V. Reiner (U. Minnesota), and F. Santos (U. Cantabria)","Fiber polytopes for the projections between cyclic polytopes","28 pages with 1 postscript figure","European J. Combin. 21:1 (2000), 19-47","10.1006/eujc.1999.0319",,"math.CO",,"  The cyclic polytope $C(n,d)$ is the convex hull of any $n$ points on the
moment curve ${(t,t^2,...,t^d):t \in \reals}$ in $\reals^d$. For $d' >d$, we
consider the fiber polytope (in the sense of Billera and Sturmfels) associated
to the natural projection of cyclic polytopes $\pi: C(n,d') \to C(n,d)$ which
""forgets"" the last $d'-d$ coordinates. It is known that this fiber polytope has
face lattice indexed by the coherent polytopal subdivisions of $C(n,d)$ which
are induced by the map $\pi$. Our main result characterizes the triples
$(n,d,d')$ for which the fiber polytope is canonical in either of the following
two senses:
  - all polytopal subdivisions induced by $\pi$ are coherent,
  - the structure of the fiber polytope does not depend upon the choice of
points on the moment curve.
  We also discuss a new instance with a positive answer to the Generalized
Baues Problem, namely that of a projection $\pi:P\to Q$ where $Q$ has only
regular subdivisions and $P$ has two more vertices than its dimension.
","[{""version"":""v1"",""created"":""Wed, 17 Dec 1997 16:09:52 GMT""}]","2013-04-30"
"math/9712258","Frank Sottile","Nantel Bergeron (York University) and Frank Sottile (University of
  Toronto)","A Monoid for the Universal K-Bruhat Order","LaTeX-2e, 21 pages, 3 figures, uses epsf.sty","European Journal of Combinatorics, 20, (1999), pp. 197-211","10.1006/eujc.1999.0283","MSRI 1997-073","math.CO",,"  Structure constants for the multiplication of Schubert polynomials by Schur
symmetric polynomials are known to be related to the enumeration of chains in a
new partial order on S_\infty, which we call the universal k-Bruhat order. Here
we present a monoid M for this order and show that $M$ is analogous to the
nil-Coxeter monoid for the weak order on S_\infty. For this, we develop a
theory of reduced sequences for M. We use these sequences to give a
combinatorial description of the structure constants above. We also give
combinatorial proofs of some of the symmetry relations satisfied by these
structure constants.
","[{""version"":""v1"",""created"":""Wed, 17 Dec 1997 16:46:11 GMT""}]","2016-11-08"
"math/9712296","Antoine Chambert-Loir","Antoine Chambert-Loir","Th\'eorie de Dieudonn\'e cristalline et p\'eriodes p-adiques",,,,"ANT-0090","math.NT math.AG",,"  Nous proposons dans ce texte une th\'eorie des p\'eriodes $p$-adiques pour
des sch\'emas en groupes finis et plats. Nous utilisons pour ce faire la
th\'eorie de Dieudonn\'e cristalline de Berthelot, Breen et Messing, ainsi que
l'interpr\'etation cristalline des anneaux de Fontaine.
  -----
  We propose in this paper a theory of $p$-adic periods for finite flat group
schemes. To this aim, we use the crystalline Dieudonn\'e theory of Berthelot,
Breen and Messing, together with the crystalline interpretation of Fontaine's
rings.
","[{""version"":""v1"",""created"":""Thu, 18 Dec 1997 00:00:00 GMT""}]","2007-05-23"
"math/9712297","Antoine Chambert-Loir","Antoine Chambert-Loir","Formes modulaires p-adiques",,,,"ANT-0091","math.NT",,"  This is the text of a talk to the study week on \emph{Modular forms and
Galois representations} held in Luminy, 1997. We give a survey of $p$-adic
modular forms, as developped by Serre, Katz, Hida, Wiles, Coleman and others...
","[{""version"":""v1"",""created"":""Thu, 18 Dec 1997 00:00:00 GMT""}]","2007-05-23"
"nucl-ex/9712007","Karsten Riisager","K. Riisager (IFA)","Comment on ""Halo Properties of the First 1/2+ State in 17F from the
  16O(p,gamma)17F Reaction''","2 pages, submitted to Phys.Rev.Lett",,,,"nucl-ex",,"  The increase at low energy of the S-factor for the 16O(p,gamma)17F* reaction
claimed by Morlock et al. to be a new observation is well documented and
explained in the literature.
","[{""version"":""v1"",""created"":""Thu, 18 Dec 1997 10:37:15 GMT""}]","2007-05-23"
"nucl-th/9712061","Volker Koch","V. Koch, J. Randrup, X.N. Wang and Y. Kluger","Dilepton from Disoriented Chiral Condensates","15 pages, 9 figs, uses epsf and sprocl style files Contribution to
  Proceedings, International Workshop on Astro Hadron Physics `Hadrons in Dense
  Matter', APCTP, Seoul, Korea, October 1997",,"10.1016/S0375-9474(98)00362-5","LBNL-41174","nucl-th",,"  Disoriented chiral condensates are manifested as long wavelength pionic
oscillations and their interaction with the thermal environment can be a
significant source of dileptons. We calculate the yield of such dilepton
production within the linear sigma model and illustrate the basic features of
the dilepton spectrum in a schematic model. We find that the dilepton yield
with invariant mass near and below $2m_{\pi}$ due to the soft pion modes can be
up to two orders of magnitude larger than the corresponding equilibrium yield.
We conclude with a discussion on how this enhancement can be detected by
present dilepton experiments.
","[{""version"":""v1"",""created"":""Wed, 17 Dec 1997 18:02:34 GMT""}]","2016-09-08"
"nucl-th/9712062","Georgios Lalazissis","G. A. Lalazissis and K. Hara","Analysis of the superdefomed rotational bands","6 pages, RevTex, 7 p.s. figures, submitted to P.R.L","Phys.Rev.C58:243-246,1998","10.1103/PhysRevC.58.243",,"nucl-th",,"  All available experimental data for the $\Delta I=2$ transition energies in
superdeformed bands are analyzed by using a new one-point formula. The
existence of deviations from the smooth behavior is confirmed in many bands.
However, we stress that one cannot necessarily speak about staggering patterns
as they are mostly irregular. Simulations of the experimental data suggest that
the irregularities may stem from the presence of irregular kinks in the
rotational spectra. This could be a clue but, at the moment, where such kinks
come from is an open question.
","[{""version"":""v1"",""created"":""Wed, 17 Dec 1997 19:20:13 GMT""}]","2008-11-26"
"nucl-th/9712063","H. Mado.","Hideki Madokoro and Masayuki Matsuzaki","Relativistic Mean Field Description of Nuclear Collective Rotation -The
  Superdeformed Rotational Bands in the A$\sim$60 Mass Region-","3 pages, LaTeX with World Scientific style file sprocl.sty and
  psfig.sty, 4 figures, talk given at The XVIIth RCNP International Symposium
  on Innovative Computational Methods in Nuclear Many-Body Problems, Osaka,
  Japan, November 10-15, 1997, to be published by World Scientific",,,,"nucl-th",,"  Relativistic Mean Field Theory is applied to the description of rotating
nuclei. Since the previous formulation of Munich group was based on a special
relativistic transformation property of the spinor fields, we reformulate in a
fully covariant manner using tetrad formalism. The numerical calculations are
performed for 3 zinc isotopes, including the newly discovered superdeformed
band in $^{62}$Zn which is the first experimental observation in this mass
region.
","[{""version"":""v1"",""created"":""Thu, 18 Dec 1997 10:31:33 GMT""}]","2007-05-23"
"nucl-th/9712064","Sergo Gerasimov","S.B.Gerasimov","Radiative processes of nucleon interactions and possible existence of
  exotic dibaryons","7 pages, Latex, no figures, Talk given at the 13th International
  Seminar ""Relativistic Nuclear Physics and Quantum Chromodynamics"", Dubna, 2-7
  Sept. 1996, and at International Workshop ""Symmetry and Spin"", Prague, 24-30
  August 1997",,,,"nucl-th",,"  The cross section of the reaction $pp \to pp \gamma \gamma$ is estimated and
the exploration possibilities of this reaction to probe for a possible
excitation of subnuclear degrees of freedom in two-nucleon systems, in
particular, the production and decay of the NN-decoupled dibaryon resonances,
are briefly discussed.Some arguments for and implications of the intermediate
dibaryon resonance excitation are inferred from preliminary data on the
two-photon yield and energy distribution observed by the DIBAR2$\gamma$ -
Collaboration at the kinetic energy of the initial proton $T_{lab} \simeq 200
MeV$.
","[{""version"":""v1"",""created"":""Thu, 18 Dec 1997 10:11:06 GMT""}]","2007-05-23"
