"gr-qc/9712077","Frank Wilczek","Maulik K. Parikh and Frank Wilczek","An Action for Black Hole Membranes","LaTeX, 30 Pages, minor editorial changes","Phys.Rev. D58 (1998) 064011","10.1103/PhysRevD.58.064011","PUPT-1753 and IASSNS-HEP-97-117","gr-qc hep-th",,"  The membrane paradigm is the remarkable view that, to an external observer, a
black hole appears to behave exactly like a dynamical fluid membrane, obeying
such pre-relativistic equations as Ohm's law and the Navier-Stokes equation. It
has traditionally been derived by manipulating the equations of motion. Here we
provide an action formulation of this picture, clarifying what underlies the
paradigm, and simplifying the derivations. Within this framework, we derive
previous membrane results, and extend them to dyonic black hole solutions. We
discuss how it is that an action can produce dissipative equations. Using a
Euclidean path integral, we show that familiar semi-classical thermodynamic
properties of black holes also emerge from the membrane action. Finally, in a
Hamiltonian description, we establish the validity of a minimum entropy
production principle for black holes.
","[{""version"":""v1"",""created"":""Wed, 17 Dec 1997 22:15:25 GMT""},{""version"":""v2"",""created"":""Mon, 9 Mar 1998 20:54:20 GMT""}]","2009-10-30"
"gr-qc/9712078","Michael Mensky","Michael B. Mensky (P.N.Lebedev Physical Institute, Moscow, Russia)","Relativistic Quantum Measurements, Unruh effect and Black Holes","24 pages (Latex), 8 EPS figures The text was edited for the new
  version","Theor.Math.Phys.115:542-553,1998; Teor.Mat.Fiz.115:215-232,1998","10.1007/BF02575454",,"gr-qc quant-ph",,"  It is shown how the technique of restricted path integrals (RPI) or quantum
corridors (QC) may be applied for the analysis of relativistic measurements.
Then this technique is used to clarify the physical nature of thermal effects
as seen by an accelerated observer in Minkowski space-time (Unruh effect) and
by a far observer in the field of a black hole (Hawking effect). The physical
nature of the ""thermal atmosphere"" around the observer is analysed in three
cases: a) the Unruh effect, b) an eternal (Kruskal) black hole and c) a black
hole forming in the process of collapse. It is shown that thermal particles are
real only in the case (c). In the case (b) they cannot be distinguished from
real particles but they do not carry away mass of the black hole until some of
these particles are absorbed by the far observer. In the case (a) thermal
particles are virtual.
","[{""version"":""v1"",""created"":""Thu, 18 Dec 1997 11:06:20 GMT""},{""version"":""v2"",""created"":""Thu, 22 Jan 1998 15:49:27 GMT""}]","2008-11-26"
"gr-qc/9712079","Stephen M. Merkowitz","Stephen M. Merkowitz","Solution to the inverse problem for a noisy spherical gravitational wave
  antenna","12 pages, 3 figures, to appear in Phys. Rev. D","Phys.Rev.D58:062002,1998","10.1103/PhysRevD.58.062002",,"gr-qc",,"  A spherical gravitational wave antenna is distinct from other types of
gravitational wave antennas in that only a single detector is necessary to
determine the direction and polarization of a gravitational wave. Zhou and
Michelson showed that the inverse problem can be solved using the maximum
likelihood method if the detector outputs are independent and have normally
distributed noise with the same variance. This paper presents an analytic
solution using only linear algebra that is found to produce identical results
as the maximum likelihood method but with less computational burden.
Applications of this solution to gravitational waves in alternative symmetric
metric theories of gravity and impulsive excitations also are discussed.
","[{""version"":""v1"",""created"":""Thu, 18 Dec 1997 12:49:02 GMT""},{""version"":""v2"",""created"":""Thu, 9 Jul 1998 15:50:59 GMT""}]","2009-12-30"
"hep-ex/9712022","Steve Mrenna","M. Carena (1), R.L. Culbertson (2), S. Eno (3), H.J. Frisch (2), and
  S. Mrenna (4) ((1) FNAL, (2) Univ. of Chicago, (3) Univ. of Maryland, (4)
  Argonne)","The Search for Supersymmetry at the Tevatron Collider","84 pages with 31 figures imbedded using psfig.tex. Uses sprocl.sty","Rev.Mod.Phys.71:937-981,1999","10.1103/RevModPhys.71.937","ANL-HEP-PR-97-98","hep-ex hep-ph",,"  We review the status of searches for Supersymmetry at the Tevatron Collider.
After discussing the theoretical aspects relevant to the production and decay
of supersymmetric particles at the Tevatron, we present the current results for
Runs Ia and Ib as of the summer of 1997. To appear in the book ""Perspectives in
Supersymmetry"", edited by G.L. Kane, World Scientific.
","[{""version"":""v1"",""created"":""Wed, 17 Dec 1997 22:01:18 GMT""}]","2008-11-26"
"hep-ex/9712023","Preprints Libr/pam","CLEO Collaboration, M. Artuso et al","Measurement of $Br(D^{0}\to K^{-}\pi^{+})$ using Partila Reconstruction
  of $\bar{B}\to D^{*+}X\ell^{-}\bar{\nu}$","10 page postscript file, postscript file also available through
  http://w4.lns.cornell.edu/public/CLNS","Phys.Rev.Lett.80:3193-3197,1998","10.1103/PhysRevLett.80.3193","CLNS 97/1517, CLEO 97-24","hep-ex",,"  We present a measurement of the absolute branching fraction for $D^0 -> K^-
pi^+$ using the reconstruction of the decay chain $Bbar -> D^{*+} X l^- nubar
$, $D^{*+} -> D^0 pi^+$ where only the lepton and the low-momentum pion from
the $D^{*+}$ are detected. With data collected by the CLEO II detector at the
Cornell Electron Storage Ring, we have determined $Br(D^0 -> K^- pi^+)= [3.81
+- 0.15(stat.) +- 0.16(syst.)]%$.
","[{""version"":""v1"",""created"":""Wed, 17 Dec 1997 20:08:48 GMT""}]","2010-04-08"
"hep-ex/9712024","Emil Frlez","E. Frlez, D. Pocanic, K. A. Assamagan, J. P. Chen, K. J. Keeter, R. M.
  Marshall, R. C. Minehart, L. C. Smith, G. E. Dodge, S. S. Hanna, B. H. King,
  and J. N. Knudson","Differential cross sections for pion charge exchange on the proton at
  27.5 MeV","ReVTeX v3.0 with aps.sty, 23 pages in e-print format, 7 PostScript
  Figures and 4 Tables, also available via anonymous ftp at
  ftp://helena.phys.virginia.edu/pub/preprints/scx.ps","Phys.Rev.C57:3144-3152,1998","10.1103/PhysRevC.57.3144","UVA-INPP-97-06","hep-ex hep-ph nucl-ex",,"  We have measured pion single charge exchange differential cross sections on
the proton at 27.5 MeV incident $\pi^-$ kinetic energy in the center of
momentum angular range between $0^\circ$ and $55^\circ$. The extracted cross
sections are compared with predictions of the standard pion-nucleon partial
wave analysis and found to be in excellent agreement.
","[{""version"":""v1"",""created"":""Thu, 18 Dec 1997 04:16:05 GMT""}]","2008-11-26"
"hep-ex/9712025","Suleimanov Mais Kazim ogly","M. K. Suleimanov, O. B. Abdinov, A.I.Anoshin, A. M.Bagirov, J.
  Bogdanowicz, A. A. Kuznetsov","Single - particle correlations in events with the total disintegration
  of nuclei","17 pages, submitted to Phys. Rew. C","Phys.Rev.C58:351-355,1998","10.1103/PhysRevC.58.351","Communication of the Joint Institute for Nuclear Research E1-97-342","hep-ex",,"  New experimental data on the behaviour of the single-particle two-dimensional
correlation functions R versus Q (Q is the number of nucleons emitted from nuc-
lei) and Ap (Ap is the mass of projectile nuclei) are presented in this paper.
The interactions of protons, d, 4He and 12C nuclei with carbon nuclei (at a
momentum of 4.2 A GeV/c) are considered.The values of R are obtained separately
for pi minus mesons and protons.In so doing,the values of R are normalized so
that -1=<R=<1.The value of R=0 corresponds to the case of the absence of corre-
lations.It has been found that the Q- and Ap-dependence of R takes place only
for weak correlations (R< 0.3).In the main (90 %),these correlations are con-
nected with the variable pt and have a nonlinear character, that is the regi-
ons with different characters of the Q-dependence of R are separated: there is
a change of regimes in the Q-dependences of R.The correlations weaken with
increasing Ap, and the variable R gets the least values of all the considered
ones in 12CC interactions.Simultaneously with weakening the correlations in the
region of large Q, the character of the Q-dependence of R changes.
","[{""version"":""v1"",""created"":""Thu, 18 Dec 1997 12:07:36 GMT""}]","2009-09-25"
"hep-lat/9712019","Thomas Lippert","Thomas Lippert (Department of Physics, University of Wuppertal,
  Germany)","The Hybrid Monte Carlo Algorithm for Quantum Chromodynamics","11 pages, Latex with lamuphys.sty and postscript figures, to appear
  in Proc. of the Workshop of the Graduiertenkolleg at the university of
  Wuppertal on ""Field Theoretical Tools for Polymer and Particle Physics""",,"10.1007/BFb0106881","HLRZ1997_72","hep-lat",,"  The Hybrid Monte Carlo (HMC) algorithm currently is the favorite scheme to
simulate quantum chromodynamics including dynamical fermions. In this
talk-which is intended for a non-expert audience--I want to bring together
methodical and practical aspects of the HMC for full QCD simulations. I will
comment on its merits and shortcomings, touch recent improvements and try to
forecast its efficiency and r\^ole in future full QCD simulations.
","[{""version"":""v1"",""created"":""Thu, 18 Dec 1997 10:33:41 GMT""}]","2009-10-30"
"hep-lat/9712020","Thomas Lippert","SESAM and TXL collaboration: Th. Lippert, G. Bali, N. Eicker, L.
  Giusti, U. Glaessner, S. Guesken, H. Hoeber, G. Martinelli, F. Rapuano, G.
  Ritzenhoefer, K. Schilling, A. Spitz, and J. Viehoff","Critical Dynamics of the Hybrid Monte Carlo Algorithm","3 pages, Latex with espcrc2.sty and postscript figures, Talk given at
  Lattice 97","Nucl.Phys.Proc.Suppl. 63 (1998) 946-948","10.1016/S0920-5632(97)00950-X","HLRZ1997_73","hep-lat",,"  We investigate the critical dynamics of the Hybrid Monte Carlo algorithm
approaching the chiral limit of standard Wilson fermions. Our observations are
based on time series of lengths O(5000) for a variety of observables. The
lattice sizes are 16^3 x 32 and 24^3 x 40. We work at beta=5.6, and
kappa=0.156, 0.157, 0.1575, 0.158, with 0.83 > m_pi/m_rho > 0.55. We find
surprisingly small integrated autocorrelation times for local and extended
observables. The dynamical critical exponent $z$ of the exponential
autocorrelation time is compatible with 2. We estimate the total computational
effort to scale between V^2 and V^2.25 towards the chiral limit.
","[{""version"":""v1"",""created"":""Thu, 18 Dec 1997 11:02:32 GMT""}]","2012-08-27"
"hep-lat/9712021","Niels R. Walet","N.E. Ligterink, N.R. Walet, and R.F. Bishop","A Coupled-Cluster Formulation of Hamiltonian Lattice Field Theory: The
  Non-Linear Sigma Model","44 Pages, 14 figures. Uses Latex2e, graphicx, amstex and geometry
  packages","Annals Phys. 267 (1998) 97-133","10.1006/aphy.1998.5812","UMIST/Phys/TP/97-11","hep-lat cond-mat hep-ph",,"  We apply the coupled cluster method (CCM) to the Hamiltonian version of the
latticised O(4) non-linear sigma model. The method, which was initially
developed for the accurate description of quantum many-body systems, gives rise
to two distinct approximation schemes. These approaches are compared with each
other as well as with some other Hamiltonian approaches. Our study of both the
ground state and collective excitations leads to indications of a possible
chiral phase transition as the lattice spacing is varied.
","[{""version"":""v1"",""created"":""Thu, 18 Dec 1997 11:44:35 GMT""}]","2009-10-30"
"hep-ph/9712419","Georgy Jikia","V. Borodulin (Institute for High Energy Physics, Protvino) and G.
  Jikia (Albert-Ludwigs-Universit""at Freiburg)","Two-loop large Higgs mass corrections to electroweak gauge boson quartic
  couplings","18 pages, 5 Postscript figures, uses epsfig.sty","Nucl.Phys. B520 (1998) 31-50","10.1016/S0550-3213(98)00200-4","Freiburg-THEP 97/28","hep-ph",,"  The two-loop corrections to the electroweak gauge bosons quartic couplings
growing quadratically with the Higgs boson mass are calculated in the Standard
Model in the limit of large Higgs mass. The corrections to WWWW, WWZZ and ZZZZ
four-vertices are found to be an order of magnitude larger than the two-loop
m_H^2 corrections to light fermion and triple gauge boson vertices. For a heavy
Higgs boson with a mass around 1 TeV the corrections are at the several percent
level and in principle could be observed experimentally.
","[{""version"":""v1"",""created"":""Wed, 17 Dec 1997 19:45:23 GMT""},{""version"":""v2"",""created"":""Wed, 7 Jan 1998 18:44:07 GMT""}]","2009-10-30"
"hep-ph/9712420","Lucas Taylor","John Swain and Lucas Taylor","First determination of the quark mixing matrix element Vtb independent
  of assumptions of unitarity","4 pages, 2 figures","Phys.Rev. D58 (1998) 093006","10.1103/PhysRevD.58.093006",,"hep-ph",,"  We present a new method for the determination of the
Cabibbo-Kobayashi-Maskawa quark mixing matrix element $|V_{tb}|$ from
electroweak loop corrections, in particular those affecting the process $Z\to
b\bar{b}$. From a combined analysis of results from the LEP, SLC, Tevatron, and
neutrino scattering experiments we determine $|V_{tb}| = 0.77^{+0.18}_{-0.24}$.
This is the first determination of $|V_{tb}|$ which is independent of unitarity
assumptions.
","[{""version"":""v1"",""created"":""Wed, 17 Dec 1997 16:13:07 GMT""}]","2009-10-30"
"hep-ph/9712421","Lucas Taylor","John Swain and Lucas Taylor","First unitarity-independent determination of the CKM matrix elements
  $V_{td}$, $V_{ts}$, and ${V_{tb}$ and the implications for unitarity","4 pages, no figures",,,,"hep-ph",,"  The magnitudes of the CKM matrix elements $V_{td}$, $V_{ts}$, and $V_{tb}$
are determined for the first time without any assumptions of unitarity. The
implications for the unitarity of the CKM matrix as a whole are discussed.
","[{""version"":""v1"",""created"":""Wed, 17 Dec 1997 16:23:48 GMT""}]","2007-05-23"
"hep-ph/9712422","Gilda Reyes","R. D. Peccei (UCLA)","The Mystery of Flavor","23 pages, 2 figures, latex document","AIP Conf.Proc.424:354-364,1997","10.1063/1.55128","UCLA/97/TEP/31","hep-ph",,"  After outlining some of the issues surrounding the flavor problem, I present
three speculative ideas on the origin of families. In turn, families are
conjectured to arise from an underlying preon dynamics; from random dynamics at
very short distances; or as a result of compactification in higher-dimensional
theories. Examples and limitations of each of these speculative scenarios are
discussed. The twin roles that family symmetries and GUT's can have on the
spectrum of quarks and leptons is emphasized, along with the dominant role that
the top mass is likely to play in the dynamics of mass generation.
","[{""version"":""v1"",""created"":""Thu, 18 Dec 1997 00:42:28 GMT""}]","2010-12-13"
"hep-ph/9712423","Lubov Vassilevskaya","N.V. Mikheev, O.S. Ovchinnikov and L.A. Vassilevskaya","Field-induced axion decay $a \to e^+ e^-$ in KSVZ-model","4 pages, latex. Talk given at the International Workshop on Particle
  Physics and the Early Universe ``COSMO'97'', Ambleside, Lake District,
  England, 15-19 September 1997",,"10.1142/9789814447263_0029","YARU-HE-97/09","hep-ph",,"  The axion decay into electron-positron pair $a \to e^+ e^-$ is studied in an
external magnetic field in KSVZ-model where axions have only induced coupling
to leptons. The axion lifetime in the field decreases with energy and field
strength to seconds.
","[{""version"":""v1"",""created"":""Wed, 17 Dec 1997 17:15:48 GMT""}]","2016-10-26"
"hep-ph/9712424","Parida Mina K.","M.K.Parida, B.Purkayastha and S.Dey(Phys.Dept.,NEHU, Shillong, India)","Supersymmetric SO(10) with SU(2)_L X SU(2)_R X SU(4)_C Intermediate
  Gauge Symmetry","19 pages,Latex",,,"NEHU-DEC-97","hep-ph",,"  In recent analyses the existence of
$SU(2)_L\times\SU(2)_R\times\SU(4)_C(g_{2L}\ne g_{2R})$ intermediate gauge
symmetry has been ruled out in SUSY SO(10) model at one-loop level, although
the left-right symmetric intermediate gauge group has been shown to exist with
certain light scalar superfields near 1 TeV.We show,how the asymmetric gauge
group is allowed with an intermediate scale $M_I=10^10- 10^13$ GeV by including
two-loop and threshold effects.
","[{""version"":""v1"",""created"":""Wed, 17 Dec 1997 18:13:52 GMT""}]","2019-08-17"
"hep-ph/9712425","M. D. Scadron","M. D. Scadron","Comments on compositeness in the SU(2) linear sigma model","Latex, 10 pages. To appear in PRD","Phys.Rev.D57:5307-5310,1998","10.1103/PhysRevD.57.5307",,"hep-ph",,"  First we summarize the quark-level linear $\sigma$ model compositeness
conditions and verify that indeed $m_\sigma = 2 m_q$ when $m_\pi = 0$ and
$N_c=3$, rather than in the $N_c\to\infty$ limit, as is sometimes suggested.
Later we show that this compositeness picture also predicts a chiral symmetry
restoration temperature $T_c = 2f_\pi$, where $f_\pi$ is the pion decay
constant. We contrast this self-consistent Z=0 compositeness analysis with
prior studies of the compositeness problem.
","[{""version"":""v1"",""created"":""Wed, 17 Dec 1997 20:09:44 GMT""},{""version"":""v2"",""created"":""Thu, 18 Dec 1997 22:20:10 GMT""}]","2011-07-19"
"hep-ph/9712426","Laura Reina","Laura Reina","Flavor Changing Neutral Currents at mu^+mu^- Colliders","10 pages, 1 EPS figure, requires LaTeX, epsf.sty","Proceedings of the ""Workshop on Physics at the First Muon Collider
  and at the Front End of a Muon Collider"", Fermilab, November 6-9, 1997","10.1063/1.56225","MADPH-97-1030","hep-ph",,"  We illustrate the possibility of observing signals from Flavor Changing
Neutral Currents, originating from the scalar sector of a Two Higgs Doublet
Model. In particular, we focus on the tree level process mu^+ mu^- --> tbar c +
cbar t, via scalar exchange in the s-channel, as a distinctive process for mu^+
mu^- colliders.
","[{""version"":""v1"",""created"":""Wed, 17 Dec 1997 20:15:53 GMT""}]","2009-10-30"
"hep-ph/9712427","Hsin-Chia Cheng","Hsin-Chia Cheng (Fermilab)","Flavor and CP violations from sleptons at the muon collider","10 pages, 4 figures, LaTeX, Talk presented at the Workshop on Physics
  at the First Muon Collider and at the Front End of a Muon Collider, Nov. 6-9,
  1997, Fermilab","AIPConf.Proc.435:561-566,1998","10.1063/1.56220","Fermilab-CONF-97/418-T","hep-ph",,"  Supersymmetric theories generally have new flavor and CP violation sources in
the squark and slepton mass matrices. They will contribute to the lepton flavor
violation processes, such as $\mu \to e \gamma$, which can be probed far below
the current bound with an intense muon source at the front end of the muon
collider. In addition, if sleptons can be produced at the muon collider, the
flavor violation can occur at their production and decay, allowing us to probe
the flavor mixing structure directly. Asymmetry between numbers of $\mu^+ e^-$
and $e^+ \mu^-$ events will be a sign for CP violation in supersymmetric flavor
mixing.
","[{""version"":""v1"",""created"":""Wed, 17 Dec 1997 20:55:14 GMT""}]","2009-10-30"
"hep-ph/9712428","Nir Polonsky","F. M. Borzumati, G. R. Farrar, N. Polonsky and S. Thomas","Precision Measurements at The Higgs Resonance: A Probe of Radiative
  Fermion Masses","7 pages, 1 figure, aipproc.sty (included). Talk presented by N.
  Polonsky at the Workshop on Physics at the First Muon Collider and the Front
  End of a Muon Collider, Fermilab, November 6-9, 1997",,"10.1063/1.56250","ZU-TH 35/97, RU-97-96, SU-ITP 97-52","hep-ph",,"  The possibility of radiative generation of fermion masses from soft
supersymmetry breaking chiral flavor violation is explored. Consistent models
are identified and classified. Phenomenological implications for electric
dipole moments and magnetic moments, as well as collider probes -- in
particular those relevant at the Higgs resonance -- are discussed. It is shown
that partial widths $\Gamma_{h^{0} \to ff}$ are enhanced compared with the
minimal supersymmetric standard model.
","[{""version"":""v1"",""created"":""Wed, 17 Dec 1997 21:32:13 GMT""}]","2009-10-30"
"hep-ph/9712429","Luis M. Bettencourt","Luis M.A. Bettencourt and Christof Wetterich","Time evolution of correlation functions in Non-equilibrium Field
  Theories","7 pages, 1 figure, RevTeX","Phys.Lett. B430 (1998) 140-150","10.1016/S0370-2693(98)00509-7","HD-THEP-97-59, LAUR - 974974","hep-ph cond-mat hep-th",,"  We investigate the non-equilibrium properties of an N-component scalar field
theory. The time evolution of the correlation functions for an arbitrary
ensemble of initial conditions is described by an exact functional differential
equation. In leading order in the 1/N expansion the system can be understood in
terms of infinitely many conserved quantities. They forbid the approach to the
canonical thermal distribution. Beyond leading order only energy conservation
is apparent generically. Nevertheless, we find a large manifold of stationary
distributions both for classical and quantum fields. They are the fixed points
of the evolution equation. For small deviations of the correlation functions
from a large range of fixed points we observe stable oscillations. These
results raise the question of if and in what sense the particular fixed point
corresponding to thermal equilibrium dominates the large time behavior of the
system.
","[{""version"":""v1"",""created"":""Thu, 18 Dec 1997 00:36:30 GMT""}]","2016-09-06"
"hep-ph/9712430",,"L.M. Kurdadze, Z.K. Silagadze","On Some rare weak decays of vector mesons","14 pages, LaTeX. Some typos corrected","Phys.Atom.Nucl. 63 (2000) 882-890; Yad.Fiz. 63N5 (2000) 953-961","10.1134/1.855719","BUDKERINP 97-101 (Novosibirsk)","hep-ph",,"  Some semileptonic weak decays of vector mesons are considered in the
framework of the most popular quark models. The predicted branching ratios are
unfortunately too small to make a study of these decays realistic at meson
factories under construction.
","[{""version"":""v1"",""created"":""Thu, 18 Dec 1997 06:22:18 GMT""},{""version"":""v2"",""created"":""Tue, 21 Apr 1998 07:23:32 GMT""}]","2009-10-30"
"hep-ph/9712431","Gg160","G.Holzwarth (Siegen University)","Chiral Phase Transition and Baryon Number Conservation","17 pages (RevTeX), 8 PS-figures; accepted for publication in
  Phys.Rev.D","Phys.Rev. D57 (1998) 3749-3758","10.1103/PhysRevD.57.3749","SI-TH-97-6","hep-ph",,"  In the standard $R^4$ embedding of the chiral O(4) model in 3+1 dimensions
the winding number is not conserved near the chiral phase transition and thus
no longer can be identified with baryon number. In order to reestablish
conserved baryon number in effective low-energy models near and above the
critical temperature $T_c$ it is argued that insisting in O(N) models on the
angular nature of the chiral fields with fixed boundary conditions restores
conservation of winding number. For N=2 in 1+1 dimensions it is illustrated
that as a consequence of the angular boundary conditions nontrivial solutions
exist which would be unstable in $R^2$; moving trajectories avoid crossing the
origin; and time evolution of random configurations after a quench leads to
quasistable soliton-antisoliton ensembles with net winding number fixed.
","[{""version"":""v1"",""created"":""Thu, 18 Dec 1997 07:38:49 GMT""}]","2009-10-30"
"hep-ph/9712432","Zhi-zhong Xing","T. Kobayashi and Z.Z. Xing","Quark Mass Matrices in Superstring Models","Latex 17 pages, accepted for publication in Int. J. Mod. Phys. A","Int.J.Mod.Phys. A13 (1998) 2201-2215","10.1142/S0217751X98000998","KEK Preprint 97-22, DPNU-97-26 (May 1997)","hep-ph hep-th",,"  Four simple but realistic patterns of quark mass matrices are derived from
orbifold models of superstring theory in the absence of gauge symmetries. Two
of them correspond to the Ramond-Roberts-Ross types, which have five texture
zeros in up and down quark sectors. The other two, with four texture zeros,
preserve the structural parallelism between up and down sectors. The
phenomenological consequences of these mass matrices on flavor mixings and CP
violation are analyzed at the weak scale. With the same input values of quark
mass ratios, we find that only one or two of the four patterns can be in good
agreement with current experimental data.
","[{""version"":""v1"",""created"":""Thu, 18 Dec 1997 07:49:36 GMT""}]","2009-10-30"
"hep-ph/9712435","Tord Riemann","Tord Riemann","Study of the Z Boson at LEP","10 pages, Latex, 1 figure, 2 tables, Invited talk held on occasion of
  the 25th anniversary of the Bishop Konstantin Preslavsky University of
  Shoumen, Bulgaria (Scientific Conference of the Theoretical Section of the
  Faculty of Physics, 31 Oct. 1996). Extended version: DESY 97-218",,,,"hep-ph",,"  The Z line shape is measured at LEP with an accuracy at the per mille level.
Usually it is described in the Standard Model of electroweak interactions with
account of quantum corrections. Alternatively, one may attempt different
model-independent approaches in order to extract quantities like mass and width
of the Z boson. If a fit deviates from that in the standard approach, this may
give hints for New Physics contributions. I describe two model-independent
approaches and compare their applications to LEP data with the Standard Model
approach.
","[{""version"":""v1"",""created"":""Thu, 18 Dec 1997 10:45:17 GMT""}]","2007-05-23"
