"cond-mat/9712264","Kiet Anh Nguyen","A. K. Nguyen and A. Sudb{\o}","Phase-coherence and the boson-analogy of vortex liquids","14 pages, 13 figures, to be published in Phys. Rev. B",,"10.1103/PhysRevB.58.2802",,"cond-mat.supr-con",,"  The statistical mechanics of the flux-line lattice in extreme type-II super-
conductors is studied within the framework of the uniformly frustrated
anisotropic 3D XY-model. A finite-field counterpart of an Onsager vortex-loop
transition in extreme type-II superconductors renders the vortex liquid phase-
incoherent when the Abrikosov vortex lattice undergoes a first order melting
transition. For the filling fractions considered in this paper $f$ given by
$1/f=12,14,16,20,25,32,48,64,72,84,96,112$, and 128, the vortex liquid phase is
not describable as a liquid of well-defined field induced vortex lines. This is
due to the proliferation of thermally induced closed vortex-loops with dia-
meters of order the magnetic length in the problem, resulting in a ""percolation
transition"" driven by non-field induced vortices also transverse to the direc-
tion of the applied magnetic field. This immediately triggers flux-line lattice
melting and loss of phase-coherence in all direction. In a non-relativistic 2D
boson-analogy picture, this latter feature would correspond to a vanishing mass
of the bosons. Scaling functions for the specific heat are calculated in zero
and finite magnetic field. From this we conclude that the critical region is of
order 10% of $T_c$ for a mass anisotropy $\sqrt{M_z/M}=3$, and increases with
increasing mass anisotropy. The entropy jump at the melting transition is cal-
culated as a function of magnetic field for a mass-ansitropy slightly lower
than that in $YBCO$, and found to be $\Delta S=0.1k_B$ per vortex panncake,
independent of the magnetic field for the filling fractions considered here.
This is slightly lower than experimental values of $\Delta S \approx 0.4k_B$
found experimentally for $YBCO$. We attribute this to the slightly lower mass
anisotropy used in our simulations.
","[{""version"":""v1"",""created"":""Mon, 22 Dec 1997 12:04:35 GMT""},{""version"":""v2"",""created"":""Sun, 26 Apr 1998 17:09:24 GMT""}]","2009-10-30"
"cond-mat/9712265","Elena E. Tareyeva","Elena Tareyeva and Valentin Ryzhov (Institute for High Pressure
  Physics, Russian Academy of Sciences)","Freezing transition in three and two dimensions by the generalized
  density functional theory","Lecture given on the International School on Strongly correlated
  systems and critical phenomena, held in JINR, Dubna (Russia) from August 26
  to September 5, 1997. 38 Latex pages, no figures",,,,"cond-mat.stat-mech",,"  A brief introduction to conventional DFT of 3D freezing is given and some
recent results are reviewed. The conventional DFT, however, can not be used in
the 2D case, particularly, because it can not describe the hexatic phase --
intermediate phase of 2D melting. We generalize DFT to describe 2D systems and
two-stage melting scenario including intermediate hexatic phase. Hexatic phase
is characterized by the appearance of bond orientational ordering. Our approach
describes this fact in terms of the appearance of nonisotropic part of the
two-particle distribution function while one-particle density remains constant.
Now we are dealing with the bifurcation of the solution of the equation for the
binary distribution function. Microscopic expressions for elastic moduli and
the Frank constant of hexatic phase are derived on the base of comparison of
distribution functions asymptotic behavior with the results of phenomenological
theories. We use our approach for the calculation of the phase boundary between
usual isotropic liquid and hexatic phase and slightly modified traditional DFT
for the phase boundary between hexatic phase and crystalline solid for a number
of 2D systems (hard disks, classical electron crystal, thin superconducting
films, Yukawa system etc.)
","[{""version"":""v1"",""created"":""Mon, 22 Dec 1997 12:04:08 GMT""}]","2007-05-23"
"cond-mat/9712266","Andrzej Fleszar","M. Nagelstra{\ss}er, H. Dr\""oge, H.-P. Steinr\""uck F. Fischer, T.
  Litz, A. Waag, G. Landwehr A. Fleszar and W. Hanke","The band structure of BeTe - a combined experimental and theoretical
  study","21 pages plus 4 figures",,"10.1103/PhysRevB.58.10394",,"cond-mat.soft",,"  Using angle-resolved synchrotron-radiation photoemission spectroscopy we have
determined the dispersion of the valence bands of BeTe(100) along $\Gamma X$,
i.e. the [100] direction. The measurements are analyzed with the aid of a
first-principles calculation of the BeTe bulk band structure as well as of the
photoemission peaks as given by the momentum conserving bulk transitions.
Taking the calculated unoccupied bands as final states of the photoemission
process, we obtain an excellent agreement between experimental and calculated
spectra and a clear interpretation of almost all measured bands. In contrast,
the free electron approximation for the final states fails to describe the BeTe
bulk band structure along $\Gamma X$ properly.
","[{""version"":""v1"",""created"":""Mon, 22 Dec 1997 13:25:06 GMT""}]","2016-08-17"
"dg-ga/9712012","Kirill C. H. Mackenzie","Kirill C. H. Mackenzie and Ping Xu","Integration of Lie bialgebroids","26 pages, LaTeX",,,,"dg-ga math.DG",,"  We prove that under certain mild assumptions a Lie bialgebroid integrates to
a Poisson groupoid. This includes, in particular, a new proof of the existence
of local symplectic groupoids for any Poisson manifold, a theorem of Karasev
and of Weinstein.
","[{""version"":""v1"",""created"":""Mon, 22 Dec 1997 15:22:05 GMT""}]","2007-05-23"
"funct-an/9712009","Hideki Nakamura","Hideki Nakamura (Hokkaido University)","A Rohlin Type Theorem for Automorphisms of Certain Purely Infinite
  $C^{\ast}$-Algebras","14 pages, no figure, LaTex",,,,"funct-an math.OA",,"  We show a noncommutative Rohlin type theorem for automorphisms of a certain
class of purely infinite simple $C^{\ast}$-algebras. This class consists of the
purely infinite unital simple $C^{\ast}$-algebras which are in the bootstrap
category ${\cal N}$ and have trivial $K_{1}$-groups.
","[{""version"":""v1"",""created"":""Mon, 22 Dec 1997 08:55:51 GMT""}]","2007-05-23"
"gr-qc/9712084","Carsten Gundlach","Carsten Gundlach (Albert Einstein Institut, Potsdam)","Critical phenomena in gravitational collapse (review paper)","46 p. Latex. Many minor corrections and extensions. To appear in Adv.
  Theor. Math. Phys","Adv.Theor.Math.Phys.2:1-49,1998",,,"gr-qc",,"  As first discovered by Choptuik, the black hole threshold in the space of
initial data for general relativity shows both surprising structure and
surprising simplicity. Universality, power-law scaling of the black hole mass,
and scale echoing have given rise to the term ""critical phenomena"". They are
explained by the existence of exact solutions which are attractors within the
black hole threshold, that is, attractors of codimension one in phase space,
and which are typically self-similar. This review gives an introduction to the
phenomena, tries to summarize the essential features of what is happening, and
then presents extensions and applications of this basic scenario. Critical
phenomena are of interest particularly for creating surprising structure from
simple equations, and for the light they throw on cosmic censorship. They may
have applications in quantum black holes and astrophysics.
","[{""version"":""v1"",""created"":""Sun, 21 Dec 1997 16:52:53 GMT""},{""version"":""v2"",""created"":""Fri, 9 Jan 1998 15:16:57 GMT""},{""version"":""v3"",""created"":""Tue, 27 Jan 1998 15:10:58 GMT""}]","2008-11-26"
"gr-qc/9712085","Frans Pretorius","F. Pretorius, D. Vollick and W. Israel","An Operational Approach To Black Hole Entropy","15 pages, LaTeX, submitted to Phys. Rev. D","Phys.Rev. D57 (1998) 6311-6316","10.1103/PhysRevD.57.6311",,"gr-qc",,"  In this paper we calculate the entropy of a thin spherical shell that
contracts reversibly from infinity down to its event horizon. We find that, for
a broad class of equations of state, the entropy of a non-extremal shell is
one-quarter of its area in the black hole limit. The considerations in this
paper suggest the following operational definition for the entropy of a black
hole: $S_{BH}$ is the equilibrium thermodynamic entropy that would be stored in
the material which gathers to form the black hole, if all of this material were
compressed into a thin layer near its gravitational radius. Since the entropy
for a given mass and area is maximized for thermal equilibrium we expect that
this is the maximum entropy that could be stored in the material before it
crosses the horizon. In the case of an extremal black hole the shell model does
not assign an unambiguous value to the entropy.
","[{""version"":""v1"",""created"":""Mon, 22 Dec 1997 09:03:17 GMT""}]","2009-10-30"
"hep-ex/9712027","Nick Brook HEP Glasgow","A. T. Doyle(University of Glasgow)","Diffraction: QCD Effects in Colour Singlet Exchange","38 pages. 39 postscript figures + 1 postscript preprint logo + 1
  LaTeX file + 3 style file. Talk presented at the 25th SLAC Summer Institute
  Also available at http://ppewww.ph.gla.ac.uk/preprints/97/13/",,,"GLAS-PPE-97-13","hep-ex",,"  Measurements of diffractive phenomena observed at HERA and the Tevatron are
reviewed. A short introduction to the theoretical background is presented where
colour singlet exchange reactions are discussed and the diffractive
contribution and its interpretation via pomeron exchange outlined. The review
focuses on the current experimental directions at HERA and discusses exclusive
production of vector mesons, the dissociation of real photons and the deep
inelastic structure of diffraction. Complementary information obtained from
hadronic final states and jet structures is also discussed. The experimental
signatures for diffractive jet and $W^\pm$ production observed at the Tevatron
are described and the rates compared with those from the HERA experiments.
","[{""version"":""v1"",""created"":""Mon, 22 Dec 1997 09:26:50 GMT""}]","2007-05-23"
"hep-ph/9712472","Christian Weiss","C. Weiss","Nucleon parton distributions in the large $N_c$ limit","13 pages, LaTeX, 2 figures included using epsf. Talk given at the
  Workshop ``Deep Inelastic Scattering off Polarized Targets: Theory Meets
  Experiment'', DESY-Zeuthen, Sep. 1-5, 1997",,,"RUB-TPII-13/97","hep-ph",,"  We review recent progress in calculating the twist--2 parton distribution
functions at a low normalization point in the large--$N_c$ limit, where the
nucleon can be described as a soliton of the effective chiral lagrangian. This
field-theoretic approach preserves all general requirements on the distribution
functions (positivity, normalization etc.). In particular, it allows to
calculate the polarized and unpolarized antiquark distributions at the low
normalization point.
","[{""version"":""v1"",""created"":""Sun, 21 Dec 1997 19:10:01 GMT""}]","2007-05-23"
"hep-ph/9712473","Hai-Yang Cheng","Hai-Yang Cheng","Remarks on Next-to-Leading Order Analysis of Polarized Deep Inelastic
  Scattering Data","10 pages, 1 figure. A new reference is added and a new paragraph
  after Eq.(10) is presented. To be published in Phys. Lett. B","Phys.Lett. B427 (1998) 371-376","10.1016/S0370-2693(98)00366-9",,"hep-ph hep-ex",,"  Since the x dependence of the axial-anomaly effect in inclusive polarized
deep inelastic scattering is fixed, the transformation from the $\bar{MS}$
scheme to different factorization schemes are not arbitrary. If the quark spin
distribution is demanded to be anomaly-free so that it does not evolve with
$Q^2$ and hard gluons contribute to the first moment of $g_1(x)$, then all the
moments of coefficient and splitting functions are fixed by perturbative QCD
for a given $\gamma_5$ prescription, contrary to the commonly used
Adler-Bardeen (AB) or AB-like scheme. It is urged that, in order to correctly
demonstrate the effect of factorization scheme dependence, the QCD analysis of
polarized structure functions in next-to-leading order should be performed,
besides the $\bar{MS}$ scheme, in the chiral-invariant factorization scheme in
which the axial anomaly resides in the gluon coefficient function, instead of
the less consistent and ambiguous AB scheme.
","[{""version"":""v1"",""created"":""Sun, 21 Dec 1997 23:24:32 GMT""},{""version"":""v2"",""created"":""Thu, 25 Dec 1997 23:23:14 GMT""},{""version"":""v3"",""created"":""Fri, 27 Mar 1998 23:25:21 GMT""}]","2009-10-30"
"hep-ph/9712474","Mike Berger","M. S. Berger (Indiana U.)","Precision W-Boson and Higgs Boson Mass Determinations at Muon Colliders","6 pages, 4 figures",,"10.1063/1.56256","IUHET-378","hep-ph",,"  Precise determinations of the masses of the $W$ boson and of the top quark
could stringently test the radiative structure of the Standard Model (SM) or
provide evidence for new physics. We analyze the excellent prospects at a muon
collider for measuring $M_W$ and $m_t$ in the $W^+W^-$ and $ZH$ threshold
regions. With an integrated luminosity of 10 (100) fb$^{-1}$, the W-boson mass
could be measured to a precision of 20 (6) MeV, provided that theoretical and
experimental systematics are understood. A measurement of $\Delta M_W=6$ MeV
would constrain the mass of a $\sim 100$ GeV Higgs to about $\pm 10$ GeV. We
demonstrate that a measurement at future colliders of the Bjorken process. With
an integrated luminosity of $100\fbi$ it is possible to measure the Standard
Model Higgs mass to within 45\mev at a $\mu^+\mu^-$ collider for $\mh=100\gev$.
","[{""version"":""v1"",""created"":""Mon, 22 Dec 1997 03:50:38 GMT""}]","2009-10-30"
"hep-ph/9712475",,"I. Bigi","CP Violation -- An Essential Mystery in Nature's Grand Design","LATEX, 73 pages, no figures; lectures given at the XXV ITEP
  Winterschool of Physics, at `Frontiers in Contemporary Physics' and at the
  International School of Physics ""Enrico Fermi"", Course `Heavy Flavour
  Physics: A Probe of Nature's Grand Design'","Surveys High Energ.Phys.12:269-336,1998","10.1080/01422419808228861",,"hep-ph",,"  CP violation has so far been observed in one system only, namely in the
decays of neutral kaons, and it can still be described by a single real
quantity corresponding to a superweak scenario. In these lectures I describe
why limitations on CP invariance are a particularly fundamental phenomenon and
what experimental information is available. The KM ansatz constitutes the
minimal implementation of CP violation: without requiring unknown degrees of
freedom it can reproduce the known CP phenomenology. It unequivocally predicts
large or even huge CP asymmetries of various kinds in the decays of beauty
hadrons. New theoretical technologies will enable us in the foreseeable future
to express at least some of these predictions in a quantitatively reliable
fashion. There is tremendous potential for discovering New Physics in beauty
transitions. Continuing efforts in strange decays and further dedicated
searches for electric dipole moments and for CP asymmetries in charm decays are
likewise essential for discovering crucial elements that still are missing in
the puzzle that is Nature's Grand Design.
","[{""version"":""v1"",""created"":""Mon, 22 Dec 1997 06:04:52 GMT""}]","2015-06-25"
"hep-ph/9712476","Hideaki Hiro-Oka","Hideaki Hiro-Oka (Kitasato Univ.) and Hisakazu Minakata (Tokyo
  Metropolitan Univ.)","Two Pion Correlations as a Possible Experimental Probe for Disoriented
  Chiral Condensates","RevTeX 13 pages, 2 Postscript figures included","Phys.Lett. B425 (1998) 129-134; Erratum-ibid. B434 (1998) 461","10.1016/S0370-2693(98)00201-9","TMUP-HEL-9714","hep-ph",,"  We discuss two-pion correlations as a possible experimental probe into
disoriented chiral condensates. In particular, we point out that the
iso-singlet squeezed states of the BCS type have peculiar two-particle
correlations in the back-to-back and the identical momentum configurations
which should be detectable experimentally. We motivate the examination of the
squeezed state by showing that such state naturally appears in a final stage of
nonequilibrium phase transitions via the parametric resonance mechanism
proposed by Mr\'owczy\'nski and M\""uller.
","[{""version"":""v1"",""created"":""Mon, 22 Dec 1997 07:07:04 GMT""},{""version"":""v2"",""created"":""Thu, 25 Dec 1997 05:42:35 GMT""},{""version"":""v3"",""created"":""Mon, 9 Feb 1998 02:27:00 GMT""}]","2009-10-30"
"hep-ph/9712477",,"A.V. Konychev (Institute for High Energy Physics, Protvino, Russia)","On the renormalization-scheme dependence in quantum field theory","9 pages, 1 Postscript figure",,,"IHEP 97-72","hep-ph",,"  Using quantum electrodynamics as an example, a dependence of physical
predictions of quantum field theory in a finite perturbation theory order on
the choice of renormalization scheme is studied. It is shown that On-Mass-Shell
renormalization scheme is distinguished in quantum electrodynamics not only due
to the agreement of the theory predictions with experimental results but also
due to a set of specific theoretical properties. Thus performing
renormalization procedure in other theories, it seems reasonable to use some of
On-Mass-Shell renormalization scheme prescriptions.
","[{""version"":""v1"",""created"":""Mon, 22 Dec 1997 08:06:07 GMT""}]","2007-05-23"
"hep-ph/9712478","W. S. Hou","Xiao-Gang He, Wei-Shu Hou and C.-S. Huang","Implications for $B \to \eta K$ and $B \to Glueball + K$ Modes from
  Observed Large $B\to \eta' K+X$","11 pages, revtex, no figs","Phys.Lett. B429 (1998) 99-105","10.1016/S0370-2693(98)00483-3",,"hep-ph",,"  The unexpectedly large branching ratios for $B\to \eta' K (\eta' X_s)$ decays
could be of gluonic origin. We study the implications for $B\to \eta K (\eta
X_s)$ and $P K (PX_s)$, where $P$ is the pseudoscalar glueball. In the
mechanism proposed by Fritzsch, large branching ratios are predicted for these
modes. The $B\to \eta K$ rate is barely within the experimental limit, and
$B\to P K$, $PX_s$ could be at the 0.1% and 1% level, respectively. Smaller but
less definite results are found for the mechanism of $g^* \to \eta' g$ via the
gluon anomaly.
","[{""version"":""v1"",""created"":""Mon, 22 Dec 1997 10:43:19 GMT""}]","2009-10-30"
"hep-ph/9712479","Nils A. Tornqvist","Nils A. Tornqvist (University of Helsinki)","Spontaneous Generation of Pseudoscalar Mass in the U(3)xU(3) Linear
  Sigma Model","8 pages revtex, 6 figures. Revritten paper to appear in Phys.Lett.B","Phys.Lett. B426 (1998) 105-113","10.1016/S0370-2693(98)00240-8",,"hep-ph",,"  A novel, nonperturbative, way to generate chiral symmetry breaking within the
linear sigma model for 3 flavours is discussed. After spontaneous chiral
symmetry breaking in the vacuum at the tree level the scalar nonet obtains
mass, while the pseudoscalars are massless. Then, including quantum loops in a
nonperturbative, self-consistent way chiral symmetry is broken by nonplanar
graphs in a second step, and also the pseudoscalars become massive. By
interpreting the basic symmetry to be a discrete permutation symmetry, in
accord with superselection rules, no additional Goldstone bosons are expected.
","[{""version"":""v1"",""created"":""Mon, 22 Dec 1997 11:05:51 GMT""},{""version"":""v2"",""created"":""Fri, 20 Mar 1998 07:47:35 GMT""}]","2009-10-30"
"hep-ph/9712480",,"D. Cocolicchio and M. Viggiano","The Quantum Field Theory of the Kaon Oscillations","19 pages, Plain TeX + eps latex file with 2 figures","Nuovo Cim. A112 (1999) 681-696","10.1007/BF03035877","IFUM 600-FT/97","hep-ph",,"  We consider the covariant formulation of the kaon mixing in the context of
the propagator method. It results important to check the possibility of a
sizable effect in the vacuum regeneration of kaons. We discuss all those terms
which may give relevant contributions to modify the exponential decay law of
the Wigner-Weisskopf narrow width approximation. Moreover, we examine the
characteristic structure of the complex singularities of the matrix propagator
and we provide a generalized form of the Bell-Steinberger unitarity sum rule.
","[{""version"":""v1"",""created"":""Mon, 22 Dec 1997 14:01:34 GMT""}]","2009-10-30"
"hep-ph/9712481","Michael Beyer","M. Beyer","Determination of V_cb from exclusive decays in a relativistic quark
  model","7 pages, 4 figures, RevTeX","Phys.Rev.D58:053001,1998","10.1103/PhysRevD.58.053001",,"hep-ph",,"  In the framework of a relativistic covariant Bethe-Salpeter model for the
quark-antiquark system we present a renewed determination of the
Cabbibo-Kobayashi-Maskawa matrix element $|V_{cb}|$. Complementing an earlier
analysis applied to the whole decay spectrum for $B\to D^* e\nu$ we now also
employ the ``zero-recoil method'' that uses the end point of the decay spectrum
($\omega=1$) and is suited for heavy-to-heavy transitions. The averaged
experimental value extracted from the data at zero recoil, $|V_{cb}|{\cal
F}(\omega=1)=0.0343\pm0.0015$, then leads to $|V_{cb}|=0.0360\pm 0.0016$. This
value is somewhat larger than the one that uses the whole decay spectrum for
the model analysis. We also contrast this result to a nonrelativistic model and
to recent experiments on the $B\to D e\nu$ semileptonic decay.
","[{""version"":""v1"",""created"":""Mon, 22 Dec 1997 14:32:20 GMT""}]","2014-11-17"
"hep-ph/9712482","Bernd Kniehl","J. Binnewies (Hamburg University), B.A. Kniehl (MPI Munich), G. Kramer
  (Hamburg University)","Predictions for D^*+- Photoproduction at HERA with New Fragmentation
  Functions from LEP1","23 pages (Latex), 7 figures (Postscript)","Phys.Rev.D58:014014,1998","10.1103/PhysRevD.58.014014","DESY 97-241, MPI/PhT/97-88","hep-ph hep-ex",,"  We present new sets of nonperturbative fragmentation functions for D^*+-
mesons, both at leading and next-to-leading order in the MS-bar factorization
scheme with five massless quark flavors. They are determined by fitting the
latest OPAL and ALEPH data on inclusive D^*+- production in e^+e^-
annihilation. We take the charm-quark fragmentation function to be of the form
proposed by Peterson et al. and thus obtain new values of the epsilon_c
parameter, which are specific for our choice of factorization scheme. With
these fragmentation functions, recent data on inclusive D^*+- photoproduction
in ep collisions at HERA are reasonably well reproduced.
","[{""version"":""v1"",""created"":""Mon, 22 Dec 1997 14:33:30 GMT""}]","2011-01-25"
"hep-ph/9712483","Shao-Jing Dong","S.J. Dong, K.F. Liu and A.G. Williams (Dept. of Physics and Astronomy,
  Univ. of Kentucky, KY; Special Research Center for the Subatomic Structure of
  Matter and Department of Physics and Mathematical Physics, University of
  Adelaide, Australia)","Lattice Calculation of the Strangeness Magnetic Moment of the Nucleon","10 pages, 5 figures, LaTex, UK/97-23, ADP-97-55/T281","Phys.Rev.D58:074504,1998","10.1103/PhysRevD.58.074504",,"hep-ph hep-lat",,"  We report on a lattice QCD calculation of the strangeness magnetic moment of
the nucleon. Our result is $G_M^s(0) = - 0.36 \pm 0.20 $. The sea contributions
from the u and d quarks are about 80% larger. However, they cancel to a large
extent due to their electric charges, resulting in a smaller net sea
contribution of $ - 0.097 \pm 0.037 \mu_N$ to the nucleon magnetic moment. As
far as the neutron to proton magnetic moment ratio is concerned, this sea
contribution tends to cancel out the cloud-quark effect from the Z-graphs and
result in a ratio of $ -0.68 \pm 0.04$ which is close to the SU(6) relation and
the experiment. The strangeness Sachs electric mean-square radius $< r_s^2>_E$
is found to be small and negative and the total sea contributes substantially
to the neutron electric form factor.
","[{""version"":""v1"",""created"":""Mon, 22 Dec 1997 14:59:39 GMT""}]","2010-03-04"
"hep-ph/9712484","W. Porod","A. Bartl, F. de Campos, M. A. Garcia-Jareno, M. B. Magro, W.
  Majerotto, W. Porod, J. W. F. Valle","Gluino Cascade Decays With Broken R--Parity","5 pages LaTeX including 2 figures, uses sprocl.sty. Talk presented by
  W. Porod at the ""International Workshop on Physics Beyond The Standard Model:
  from Theory to Experiment"", October 13 - 17, 1997, Valencia, Spain",,,"UWThPh-1997-50, HEPHY-PUB 683/97","hep-ph",,"  We study the pattern of gluino cascade decays in a class of supersymmetric
models where R-parity is spontaneously broken. The multi-lepton and same-sign
dilepton rates in these models are compared with those of the Minimal
Supersymmetric Standard Model. We show that these rates can be substantially
enhanced in models with broken R-parity.
","[{""version"":""v1"",""created"":""Mon, 22 Dec 1997 15:21:19 GMT""}]","2007-05-23"
"hep-th/9712200","Kechkin O. V.","Oleg Kechkin and Maria Yurova","BPS Solutions in D=5 Dilaton-Axion Gravity","presented at GR15","Mod.Phys.Lett. A13 (1998) 219-226","10.1142/S0217732398000279",,"hep-th",,"  We show that the D=5 dilaton-axion gravity compactified on a 2-torus
possesses the SL(4,R)/SO(4) matrix formulation. It is used for construction of
the SO(2,2)-invariant BPS solution depended on the one harmonic function.
","[{""version"":""v1"",""created"":""Sun, 21 Dec 1997 19:16:43 GMT""}]","2009-10-30"
"hep-th/9712202","Djordje Minic","D. Minic (Penn State)","Infinite Statistics and Black Holes in Matrix Theory","15 pages, plain TeX, no figures",,,,"hep-th",,"  The concept of infinite statistics is applied to the analysis of black hole
thermodynamics in Matrix Theory. It is argued that Matrix Theory partons,
D0-branes, satisfy quantum infinite statistics, and that this observation
justifies the recently proposed Boltzmann gas model of Schwarzschild black
holes in Matrix Theory.
","[{""version"":""v1"",""created"":""Sun, 21 Dec 1997 23:45:08 GMT""}]","2007-05-23"
