"hep-th/9712203","Hans J. Pirner","A. B. Bylev, H. J. Pirner","Hamiltonian Flow Equations for a Dirac Particle in an External Potential","6 pages","Phys.Lett. B428 (1998) 329-333","10.1016/S0370-2693(98)00417-1",,"hep-th",,"  We derive and solve the Hamiltonian flow equations for a Dirac particle in an
external static potential. The method shows a general procedure for the set up
of continuous unitary transformations to reduce the Hamiltonian to a
quasidiagonal form.
","[{""version"":""v1"",""created"":""Mon, 22 Dec 1997 09:57:24 GMT""}]","2009-10-30"
"hep-th/9712204","Bodo Geyer","S. Falkenberg, B. Geyer, and P. Moshin","Quantum properties of general gauge theories with composite and external
  fields","24 pages, LATEX, slightly changed to clarify the essential new aspect
  concerning composite fields depending on external ones; added formulas
  showing lack of (generalized) nilpotence of operators appearing in the Ward
  identities","Int.J.Mod.Phys. A14 (1999) 3847-3870","10.1142/S0217751X99001792","NTZ 49/1997","hep-th",,"  The generating functionals of Green's functions with composite and external
fields are considered in the framework of BV and BLT quantization methods for
general gauge theories. The corresponding Ward identities are derived and the
gauge dependence is investigated
","[{""version"":""v1"",""created"":""Mon, 22 Dec 1997 10:18:12 GMT""},{""version"":""v2"",""created"":""Fri, 23 Jan 1998 17:04:37 GMT""},{""version"":""v3"",""created"":""Thu, 14 May 1998 14:50:34 GMT""}]","2009-10-30"
"hep-th/9712205","Loriano Bonora","L.Bonora, C.S.Chu and M.Rinaldi","Anomalies and Locality in Field Theories and M theory","16 pages, LaTeX",,,"SISSA 161/97/EP/FM","hep-th",,"  We review some basic notions on anomalies in field theories and superstring
theories, with particular emphasis on the concept of locality. The aim is to
prepare the ground for a discussion on anomalies in theories with branes. In
this light we review the problem of chiral anomaly cancellation in M-theory
with a 5-brane.
","[{""version"":""v1"",""created"":""Mon, 22 Dec 1997 12:20:38 GMT""}]","2007-05-23"
"hep-th/9712206","Dr R. Szabo","Fedele Lizzi and Richard J. Szabo","Noncommutative Geometry and Spacetime Gauge Symmetries of String Theory","17 pages LaTeX; Invited paper to appear in the special issue of the
  Journal of Chaos, Solitons and Fractals on ""Superstrings, M, F, S, ...
  Theory"" (M.S. El Naschie and C. Castro, editors)","Chaos Solitons Fractals 10:445-458,1999","10.1016/S0960-0779(98)00085-X","DSF/51-97, OUTP-97-75P","hep-th gr-qc math.QA q-alg",,"  We illustrate the various ways in which the algebraic framework of
noncommutative geometry naturally captures the short-distance spacetime
properties of string theory. We describe the noncommutative spacetime
constructed from a vertex operator algebra and show that its algebraic
properties bear a striking resemblence to some structures appearing in M
Theory, such as the noncommutative torus. We classify the inner automorphisms
of the space and show how they naturally imply the conventional duality
symmetries of the quantum geometry of spacetime. We examine the problem of
constructing a universal gauge group which overlies all of the dynamical
symmetries of the string spacetime. We also describe some aspects of toroidal
compactifications with a light-like coordinate and show how certain generalized
Kac-Moody symmetries, such as the Monster sporadic group, arise as gauge
symmetries of the resulting spacetime and of superstring theories.
","[{""version"":""v1"",""created"":""Mon, 22 Dec 1997 14:40:46 GMT""}]","2010-11-19"
"math/9712261","Theresia Eisenkoelbl","Theresia Eisenk\""olbl (Universit\""at Wien)","Rhombus Tilings of a Hexagon with Three Fixed Border Tiles","7 pages, AmS-LaTeX, uses TeXDraw; revised version which is to appear
  in J. Combin. Theory Ser. A","J. Combin. Theory Ser. A 88 (1999), 368-378",,,"math.CO",,"  We compute the number of rhombus tilings of a hexagon with sides
$a+2,b+2,c+2,a+2,b+2,c+2$ with three fixed tiles touching the border. The
particular case $a=b=c$ solves a problem posed by Propp. Our result can also be
viewed as the enumeration of plane partitions having $a+2$ rows and $b+2$
columns, with largest entry $\le c+2$, with a given number of entries $c+2$ in
the first row, a given number of entries 0 in the last column and a given
bottom-left entry.
","[{""version"":""v1"",""created"":""Mon, 22 Dec 1997 12:05:22 GMT""},{""version"":""v2"",""created"":""Tue, 8 Sep 1998 12:12:23 GMT""}]","2007-05-23"
"math/9712280","Brian Osserman","Robert Osserman","A sharp Schwarz inequality on the boundary",,,,"MSRI 1997-110","math.CV",,"  A number of classical results reflect the fact that if a holomorphic function
maps the unit disk into itself taking the origin into the origin, and if some
boundary point $b$ maps to the boundary, then the map is a magnification at
$b$. We prove a sharp quantitative version of this result which also sharpens a
classical result of Loewner, and which implies that the map is a strict
magnification at $b$ unless it is a rotation.
","[{""version"":""v1"",""created"":""Mon, 22 Dec 1997 00:00:00 GMT""}]","2016-09-07"
"nucl-th/9712070","Yongseok Oh","Alexander I. Titov and Yongseok Oh","Asymmetry in omega meson photoproduction and the phase of omega-pi-gamma
  coupling","9 pages, LaTeX with elsart.sty, uses epsfig.sty, amsbsy.sty and
  amssymb.sty, 3 figures (5 eps files)","Phys.Lett. B422 (1998) 33-38","10.1016/S0370-2693(98)00049-5",,"nucl-th hep-ph",,"  We analyze the double polarization asymmetry of the omega-meson
photoproduction in the vector-meson-dominance model of diffractive production
and the one-pion exchange model. We find that the longitudinal beam-target
asymmetry is very sensitive to the real part of the diffractive photoproduction
amplitude and to the sign of the omega-pi-gamma coupling because of the
different spin structures of the amplitudes associated with the different
mechanisms.
","[{""version"":""v1"",""created"":""Mon, 22 Dec 1997 02:17:34 GMT""}]","2009-10-30"
"nucl-th/9712071","Dan-Olof Riska","A. Acus, E. Norvaisas, D.O. Riska","Stability and Representation Dependence of the Quantum Skyrmion","19 pages, LateX","Phys.Rev.C57:2597-2604,1998","10.1103/PhysRevC.57.2597",,"nucl-th",,"  A constructive realization of Skyrme's conjecture that an effective pion mass
``may arise as a self consistent quantal effect'' based on an ab initio quantum
treatment of the Skyrme model is presented. In this quantum mechanical Skyrme
model the spectrum of states with $I=J$, which appears in the collective
quantization, terminates without any infinite tower of unphysical states. The
termination point depends on the model parameters and the dimension of the
SU(2) representation. Representations, in which the nucleon and $\Delta_{33}$
resonance are the only stable states, exist. The model is developed for both
irreducible and reducible representations of general dimension. States with
spin larger than 1/2 are shown to be deformed. The representation dependence of
the baryon observables is illustrated numerically.
","[{""version"":""v1"",""created"":""Mon, 22 Dec 1997 09:12:58 GMT""}]","2008-11-26"
"nucl-th/9712072","Mariana Kirchbach","M. Kirchbach","Lorentz Multiplet Structure of Baryon Spectra and Relativistic
  Description","12 pages, LaTex, submitted to Mod. Phys. Lett. A","Mod.Phys.Lett. A12 (1997) 3177-3188","10.1142/S0217732397003307","MKPH-T-97-35","nucl-th hep-ph",,"  The pole positions of the various baryon resonances are known to reveal
well-pronounced clustering, so-called Hoehler clusters. For nonstrange baryons
the Hoehler clusters are shown to be identical to Lorentz multiplets of the
type (j,j)*[(1/2,0)+(0,1/2)] with j being a half-integer. For the Lambda
hyperons below 1800 MeV these clusters are shown to be of the type [(1,0)+
(0,1)]*[(1/2,0)+(0,1/2)] while above 1800 MeV they are parity duplicated
(J,0)+(0,J) (Weinberg-Ahluwalia) states. Therefore, for Lambda hyperons the
restoration of chiral symmetry takes place above 1800 MeV. Finally, it is
demonstrated that the description of spin-3/2 particles in terms of a 2nd rank
antisymmetric Lorentz tensor with Dirac spinor components does not contain any
off-shell parameters and avoids the main difficulties of the Rarita-Schwinger
description based upon a 4-vector with Dirac spinor components.
","[{""version"":""v1"",""created"":""Mon, 22 Dec 1997 12:52:54 GMT""}]","2009-10-30"
"q-alg/9712050",,"Alexander Molev and Grigori Olshanski","Centralizer construction for twisted Yangians","AMSTeX, 46 pages","Selecta Mathematica 6 (2000), no. 3, 269--317.",,"Australian National University, Preprint CMA 065-97","q-alg math.QA nlin.SI solv-int",,"  For each of the classical Lie algebras $g(n)=o(2n+1), sp(2n), o(2n)$ of type
B, C, D we consider the centralizer of the subalgebra $g(n-m)$ in the universal
enveloping algebra $U(g(n))$. We show that the $n$th centralizer algebra can be
naturally projected onto the $(n-1)$th one, so that one can form the projective
limit of the centralizer algebras as $n\to\infty$ with $m$ fixed. The main
result of the paper is a precise description of this limit (or stable)
centralizer algebra, denoted by $A_m$. We explicitly construct an algebra
isomorphism $A_m=Z\otimes Y_m$, where $Z$ is a commutative algebra and $Y_m$ is
the so-called twisted Yangian associated to the rank $m$ classical Lie algebra
of type B, C, or D. The algebra $Z$ may be viewed as the algebra of virtual
Laplace operators; it is isomorphic to the algebra of polynomials with
countably many indeterminates. The twisted Yangian $Y_m$ (and hence the algebra
$A_m$) can be described in terms of a system of generators with quadratic and
linear defining relations which are conveniently presented in R-matrix form
involving the so-called reflection equation. This extends the earlier work on
the type A case by the second author.
","[{""version"":""v1"",""created"":""Mon, 22 Dec 1997 06:27:55 GMT""}]","2008-03-02"
"quant-ph/9712050","Trevor Marshall","Trevor W. Marshall (Mathematics Dept., Manchester Univ., U. K.)","The zeropoint field - no longer a ghost","See also http://www.keyinnov.demon.co.uk",,,"MUM-97-16","quant-ph",,"  We develop a local realist analysis of parametric down conversion, based on
the recognition that the pump field, instead of down converting spontaneously,
does so through its nonlinear coupling with a real zeropoint, or ""vacuum""
electromagnetic field. The theory leads tothe prediction of a new phenomenon -
that, in addition to the main down-conversion rainbow, there is a satellite
rainbow, whose intensity is about 3 per cent of the main one. Confirmation of
this prediction will call seriously into question the current description of
the light field in terms of photons.
  The present article extends the analysis of its predecessors (this archive,
numbers 9711029 and 9712001) to take account of the pump's polarization>
","[{""version"":""v1"",""created"":""Sun, 21 Dec 1997 18:01:14 GMT""}]","2007-05-23"
"quant-ph/9712051","Yuri I. Ozhigov","Yuri Ozhigov","Quantum Computer Can Not Speed Up Iterated Applications of a Black Box","8 pages, Latex",,,,"quant-ph",,"  Let a classical algorithm be determined by sequential applications of a black
box performing one step of this algorithm. If we consider this black box as an
oracle which gives a value F(a) for any query a, we can compute T sequential
applications of F on a classical computer relative to this oracle in time T.
  It is proved that if T=O(2^{n/7}), where n is the length of input, then the
result of T sequential applications of F can not be computed on quantum
computer with oracle for F for all possible F faster than in time \Omega (T).
This means that there is no general method of quantum speeding up of classical
algorithms provided in such a general method a classical algorithm is regarded
as iterated applications of a given black box.
  For an arbitrary time complexity T a lower bound for the time of quantum
simulation was found to be \Omega (T^{1/2}).
","[{""version"":""v1"",""created"":""Mon, 22 Dec 1997 14:49:48 GMT""}]","2007-05-23"
