"astro-ph/9702041","Magueijo","Charlotte Cheung and Joao Magueijo","Painless causality in defect calculations",,"Phys.Rev. D56 (1997) 1982-1988","10.1103/PhysRevD.56.1982","IC-96-97/22","astro-ph",,"  Topological defects must respect causality, a statement leading to
restrictive constraints on the power spectrum of the total cosmological
perturbations they induce. Causality constraints have for long been known to
require the presence of an under-density in the surrounding matter compensating
the defect network on large scales. This so-called compensation can never be
neglected and significantly complicates calculations in defect scenarios, eg.
computing cosmic microwave background fluctuations. A quick and dirty way to
implement the compensation are the so-called compensation fudge factors. Here
we derive the complete photon-baryon-CDM backreaction effects in defect
scenarios. The fudge factor comes out as an algebraic identity and so we drop
the negative qualifier ``fudge''. The compensation scale is computed and
physically interpreted. Secondary backreaction effects exist, and neglecting
them constitutes the well-defined approximation scheme within which one should
consider compensation factor calculations. We quantitatively assess the
accuracy of this approximation, and conclude that the considerable pains
associated with improving on it are often a waste of effort.
","[{""version"":""v1"",""created"":""Tue, 4 Feb 1997 15:18:07 GMT""}]","2009-10-30"
"cmp-lg/9702002","John Carroll","Ted Briscoe (Cambridge University), John Carroll (University of
  Sussex)","Automatic Extraction of Subcategorization from Corpora","8 pages; requires aclap.sty. To appear in ANLP-97",,,,"cmp-lg cs.CL",,"  We describe a novel technique and implemented system for constructing a
subcategorization dictionary from textual corpora. Each dictionary entry
encodes the relative frequency of occurrence of a comprehensive set of
subcategorization classes for English. An initial experiment, on a sample of 14
verbs which exhibit multiple complementation patterns, demonstrates that the
technique achieves accuracy comparable to previous approaches, which are all
limited to a highly restricted set of subcategorization classes. We also
demonstrate that a subcategorization dictionary built with the system improves
the accuracy of a parser by an appreciable amount.
","[{""version"":""v1"",""created"":""Tue, 4 Feb 1997 11:21:00 GMT""}]","2016-08-31"
"cond-mat/9702024",,"S.Picozzi, A.Continenza and A. J. Freeman","Electric fields and valence band offsets at strained [111]
  heterojunctions","18 pages, Latex-file, to appear in Phys.Rev.B",,"10.1103/PhysRevB.55.13080",,"cond-mat.mtrl-sci",,"  [111] ordered common atom strained layer superlattices (in particular the
common anion GaSb/InSb system and the common cation InAs/InSb system) are
investigated using the ab initio full potential linearized augmented plane wave
(FLAPW) method. We have focused our attention on the potential line-up at the
two sides of the homopolar isovalent heterojunctions considered, and in
particular on its dependence on the strain conditions and on the strain induced
electric fields. We propose a procedure to locate the interface plane where the
band alignment could be evaluated; furthermore, we suggest that the
polarization charges, due to piezoelectric effects, are approximately confined
to a narrow region close to the interface and do not affect the potential
discontinuity. We find that the interface contribution to the valence band
offset is substantially unaffected by strain conditions, whereas the total band
line-up is highly tunable, as a function of the strain conditions. Finally, we
compare our results with those obtained for [001] heterojunctions.
","[{""version"":""v1"",""created"":""Mon, 3 Feb 1997 16:06:41 GMT""}]","2009-10-30"
"cond-mat/9702025","Max Petersen","C. Ratsch, A. P. Seitsonen, and M. Scheffler","Strain-Dependence of Surface Diffusion: Ag on Ag(111) and Pt(111)","4 pages, 3 figures, Phys. Rev. B 55 (1997), in press",,"10.1103/PhysRevB.55.6750",,"cond-mat.mtrl-sci",,"  Using density-functional theory with the local-density approximation and the
generalized gradient approximation we compute the energy barriers for surface
diffusion for Ag on Pt(111), Ag on one monolayer of Ag on Pt(111), and Ag on
Ag(111). The diffusion barrier for Ag on Ag(111) is found to increase linearly
with increasing lattice constant. We also discuss the reconstruction that has
been found experimentally when two Ag layers are deposited on Pt(111). Our
calculations explain why this strain driven reconstruction occurs only after
two Ag layers have been deposited.
","[{""version"":""v1"",""created"":""Mon, 3 Feb 1997 16:36:52 GMT""}]","2009-10-30"
"cond-mat/9702026","Helmut Kroger","J.F. Audet, A. Fledderjohann, C. Gerhardt, M. Karbach, H. Kr\""oger,
  K.H. M\""utter and M. Schmidt","Critical properties of 1-D spin 1/2 antiferromagnetic Heisenberg model","talk given by H. Kr{\""o}ger at Heraeus Seminar Theory of Spin
  Lattices and Lattice Gauge Models, Bad Honnef (1996), 20 pages, LaTeX + 18
  figures, PS","Lecture Notes in Physics 494(1997)41","10.1007/BFb0104302","LAVAL-PHY-10-96","cond-mat",,"  We discuss numerical results for the 1-D spin 1/2 antiferromagnetic
Heisenberg model with next-to-nearest neighbour coupling and in the presence of
an uniform magnetic field. The model develops zero frequency excitations at
field dependent soft mode momenta. We compute critical quantities from finite
size dependence of static structure factors.
","[{""version"":""v1"",""created"":""Mon, 3 Feb 1997 20:09:49 GMT""}]","2016-08-15"
"cond-mat/9702027","Remi Monasson","R. Monasson, O. Pouliquen","Entropy of particle packings : an illustration on a toy model","20 pages, 7 figures; to appear in Physica A",,"10.1016/S0378-4371(96)00369-X",,"cond-mat.stat-mech",,"  A toy model of particles packings is presented, which consists in arranging
hexagons on a triangular lattice according to local stability rules. The number
of stable packings is analytically computed and found to grow exponentially
with the size of the lattice, which illustrates the concept of packing entropy
first proposed by Edwards and collaborators. The analysis is carried out for
both the monodispersed case and the more interesting, i.e. more disordered,
bidispersed case.
","[{""version"":""v1"",""created"":""Mon, 3 Feb 1997 17:07:50 GMT""}]","2015-06-25"
"cond-mat/9702028","Magnus Hurd","Magnus Hurd","Current-voltage relation for superconducting d-wave junctions","4 pages, 2 figures",,"10.1103/PhysRevB.55.R11993",,"cond-mat.supr-con",,"  We calculate the current-voltage (I-V) relation for planar superconducting
d-wave junctions for both arbitrary transmission of the junction and arbitrary
orientation of the d-wave superconductors. The midgap states (MGS) present at
interfaces/surfaces of a d-wave superconductor influence the I-V relation. In
some arrangements we find considerable negative differential conductance and
lower threshold voltage for non-zero current due to resonant conduction through
MGS.
","[{""version"":""v1"",""created"":""Mon, 3 Feb 1997 17:21:26 GMT""}]","2009-10-30"
"cond-mat/9702029","Ricardo Brito","J. A. G. Orza, R. Brito (Universidad Complutense de Madrid, Spain), T.
  P. C. Van Noije and M. H. Ernst (Universiteit Utrecht, The Netherlands)","Patterns and Long Range Correlations in Idealized Granular Flows","13 pages with 7 postscript figures, LaTeX (uses psfig). Submitted to
  International Journal of Modern Physics C","Int. J. Mod. Phys. C 8, 953 1997","10.1142/S0129183197000825",,"cond-mat.stat-mech nlin.PS patt-sol physics.flu-dyn",,"  An initially homogeneous freely evolving fluid of inelastic hard spheres
develops inhomogeneities in the flow field (vortices) and in the density field
(clusters), driven by unstable fluctuations. Their spatial correlations, as
measured in molecular dynamics simulations, exhibit long range correlations;
the mean vortex diameter grows as the square root of time; there occur
transitions to macroscopic shearing states, etc.
  The Cahn--Hilliard theory of spinodal decomposition offers a qualitative
understanding and quantitative estimates of the observed phenomena. When
intrinsic length scales are of the order of the system size, effects of
physical boundaries and periodic boundaries (finite size effects in
simulations) are important.
","[{""version"":""v1"",""created"":""Mon, 3 Feb 1997 16:40:24 GMT""}]","2009-10-30"
"cond-mat/9702030","Federico Ricci-Tersenghi","Giorgio Parisi, Paola Ranieri, Federico Ricci-Tersenghi and Juan J.
  Ruiz-Lorenzo","Mean Field Dynamical Exponents in Finite-Dimensional Ising Spin Glass","20 pages, 12 figures, uses epsfig.sty. One reference added. Also
  available at http://chimera.roma1.infn.it/index_papers_complex.html","Journal of Physics A: Math. Gen. 30, 7115 (1997).","10.1088/0305-4470/30/20/015",,"cond-mat.dis-nn cond-mat.stat-mech",,"  We report the value of the dynamical critical exponent z for the six
dimensional Ising spin glass, measured in three different ways: from the
behavior of the energy and the susceptibility with the Monte Carlo time and by
studying the overlap-overlap correlation function as a function of the space
and time. All three results are in a very good agreement with the Mean Field
prediction z=4. Finally we have studied numerically the remanent magnetization
in 6 and 8 dimensions and we have compared it with the behavior observed in the
SK model, that we have computed analytically.
","[{""version"":""v1"",""created"":""Mon, 3 Feb 1997 19:32:06 GMT""},{""version"":""v2"",""created"":""Wed, 5 Feb 1997 10:39:58 GMT""}]","2009-10-30"
"cond-mat/9702031","James P. Sethna","James P. Sethna and Christopher R. Myers","Martensitic Tweed and the Two-Way Shape-Memory Effect","Originally presented at Los Alamos in April, 1995",,,,"cond-mat.dis-nn cond-mat.mtrl-sci cond-mat.stat-mech",,"  We briefly introduce tweed, which is found above the martensitic transition
in a variety of shape-memory, high-T_c, and other materials. Based on our
previous mapping of the problem onto a spin-glass model, we conjecture that the
two-way shape-memory effect is due to tweed.
","[{""version"":""v1"",""created"":""Mon, 3 Feb 1997 22:53:57 GMT""}]","2008-02-03"
"cond-mat/9702032","Sanjay Kodiyalam","S. Kodiyalam (Univ. of Maryland), H.A. Fertig (Univ. of Kentucky), S.
  Das Sarma (Univ. of Maryland)","Harmonic Solid Theory of Photoluminescence in the High Field
  Two-Dimensional Wigner Crystal","22 pages, RevTex, 8 figures. Submitted to the Physical Review B",,"10.1103/PhysRevB.56.12344",,"cond-mat.str-el",,"  Motivated by recent experiments on radiative recombination of two-dimensional
electrons in acceptor doped GaAs-AlGaAs heterojunctions as well as the success
of a harmonic solid model in describing tunneling between two-dimensional
electron systems, we calculate within the harmonic approximation and the time
dependent perturbation theory the line shape of the photoluminescence spectrum
corresponding to the recombination of an electron with a hole bound to an
acceptor atom. The recombination process is modeled as a sudden perturbation of
the Hamiltonian for the in-plane degrees of freedom of the electron. We include
in the perturbation, in addition to changes in the equilibrium positions of
electrons, changes in the curvatures of the harmonically approximated
potential. The computed spectra have line shapes similar to that seen in a
recent experiment. The spectral width, however, is roughly a factor of 3
smaller than that seen in experiment if one assumes a perfect Wigner crystal
for the initial state state of the system, whereas a simple random disorder
model yields a width a factor of 3 too large. We speculate on the possible
mechanisms that may lead to better quantitative agreement with experiment.
","[{""version"":""v1"",""created"":""Mon, 3 Feb 1997 23:04:12 GMT""}]","2016-08-31"
"cond-mat/9702033","Gilberto Hollauer","Mauro M. Doria, Gilberto Hollauer, F. Parage, and O. Buisson","Plasma Waves in Anisotropic Superconducting Films Below and Above the
  Plasma Frequency","26 pages,4 figures.Submitted",,"10.1016/S0921-4534(97)00941-6",,"cond-mat.supr-con",,"  We consider wave propagation inside an anisotropic superconducting film
sandwiched between two semi-infinite non-conducting bounding dieletric media
such that along the c-axis, perpendicular to the surfaces, there is a plasma
frequency $\omega_p$ below the superconducting gap. Propagation is assumed to
be parallel to the surfaces in the dielectric medium, where amplitudes decay
exponentially.Below $\omega_p$, the amplitude also evanesces inside the film,
and we retrieve the experimentally measured lower dispersion relation branch,
$\omega \propto \sqrt{\beta}$, and the recently proposed higher frequency
branch, $\omega \propto 1/\sqrt{\beta}$.Above $\omega_p$, propagation is of the
guided wave type, i.e., a dispersive plane wave confined inside the film that
reflects into the dielectric interfaces,and the modes are approximately
described by $\omega \approx \omega_p \sqrt{ 1+ (\beta/\beta_0)^2}$, where
$\beta_0$ is discussed here.
","[{""version"":""v1"",""created"":""Tue, 4 Feb 1997 01:51:01 GMT""}]","2009-10-30"
"cond-mat/9702034",,"Hideo Hasegawa (Tokyo Gakugei Univ.)","Slave-Boson Mean-Field Theory of the Antiferromagnetic State in the
  Doubly Degenerate Hubbard Model - the Half-Filled Case -","Latex 18 pages, 12 figures available on request to
  hasegawa@u-gakugei.ac.jp Note: published in Phys. Rev. B with some minor
  modifications","Phys. Rev. B 56 (1997) 1196-1203","10.1103/PhysRevB.56.1196",,"cond-mat.str-el",,"  The antiferromagnetic ground state of the half-filled Hubbard model with the
doubly degenerate orbital has been studied by using the slave-boson mean-field
theory which was previously proposed by the present author. Numerical
calculations for the simple cubic model have shown that the metal-insulator
transition does not take place except at the vanishing interaction point, in
strong contrast with its paramagnetic solution. The energy gap in the density
of states of the antiferromagnetic insulator is much reduced by the effect of
electron correlation. The exchange interaction $J$ plays an important role in
the antiferromagnetism: although for $J = 0$ the sublattice magnetic moment $m$
in our theory is fairly smaller than $m_{HFA}$ obtained in the Hartree-Fock
approximation, $m$ for $J/U > 0.2$ ($U$: the Coulomb interaction) is increased
to become comparable to $m_{HFA}$. Surprisingly, the antiferromagnetic state is
easily destroyed if a small, negative exchange interaction ($J/U < -0.05$) is
introduced.
","[{""version"":""v1"",""created"":""Tue, 4 Feb 1997 04:03:05 GMT""},{""version"":""v2"",""created"":""Tue, 22 Jul 1997 06:17:16 GMT""},{""version"":""v3"",""created"":""Tue, 22 Jul 1997 07:02:40 GMT""}]","2009-10-30"
"cond-mat/9702035","Lauren W. Wong","L. W. Wong, H. W. Jiang, E. Palm, W. J. Schaff","Termination of the spin-resolved integer quantum Hall effect","8 pages (Revtex), 5 ps figures, to appear in Phys. Rev. B15 Rapid
  Communication, 1997",,"10.1103/PhysRevB.55.R7343",,"cond-mat.mes-hall",,"  We report a magnetotransport study of the termination of the spin-resolved
integer quantum Hall effect by controlled disorder in a gated GaAs/AlGaAs
heterostructure. We have found that, for a given N^{th} Landau level, the
difference in filling factors of a pair of spin-split resistivity peaks
\delta\nu_{N}changes rapidly from one to zero near a critical density n_{c}.
Scaling analysis shows that \delta\nu_{N} collapses onto a single curve
independent of N when plotted against the parameter (n-n_{c})/n_{c} for five
Landau levels. The effect of increasing the Zeeman energy is also examined by
tilting the direction of magnetic field relative to the plane of the
two-dimensional electron gas. Our experiment suggests that the termination of
the spin-resolved quantum Hall effect is a phase transition.
","[{""version"":""v1"",""created"":""Tue, 4 Feb 1997 09:22:51 GMT""}]","2009-10-30"
"cond-mat/9702036","Colin Marsh","C. Marsh, G. Backx and M. H. Ernst","Static and Dynamic Properties of Dissipative Particle Dynamics","22 pages, LaTeX, 3 Postscript figures",,"10.1103/PhysRevE.56.1676",,"cond-mat.stat-mech",,"  The algorithm for the DPD fluid, the dynamics of which is conceptually a
combination of molecular dynamics, Brownian dynamics and lattice gas automata,
is designed for simulating rheological properties of complex fluids on
hydrodynamic time scales. This paper calculates the equilibrium and transport
properties (viscosity, self-diffusion) of the thermostated DPD fluid explicitly
in terms of the system parameters. It is demonstrated that temperature
gradients cannot exist, and that there is therefore no heat conductivity.
  Starting from the N-particle Fokker-Planck, or Kramers' equation, we prove an
H-theorem for the free energy, obtain hydrodynamic equations, and derive a
non-linear kinetic equation (the Fokker-Planck-Boltzmann equation) for the
single particle distribution function. This kinetic equation is solved by the
Chapman-Enskog method. The analytic results are compared with numerical
simulations.
","[{""version"":""v1"",""created"":""Tue, 4 Feb 1997 12:15:27 GMT""}]","2009-10-30"
"cond-mat/9702037","Max Petersen","Axel Gross and Matthias Scheffler","Steering and ro-vibrational effects in the dissociative adsorption and
  associative desorption of H_2/Pd(100)","8 pages, 5 figures, subm. to the Proceedings of ISSP-18, June 1996,
  Poland, to appear in Prog. Surf. Sci",,,,"cond-mat",,"  The interaction of hydrogen with many transition metal surfaces is
characterized by a coexistence of activated with non-activated paths to
adsorption with a broad distribution of barrier heights. By performing
six-dimensional quantum dynamical calculations using a potential energy surface
derived from ab initio calculations for the system H_2/Pd(100) we show that
these features of the potential energy surface lead to strong steering effects
in the dissociative adsorption and associative desorption dynamics. In
particular, we focus on the coupling of the translational, rotational and
vibrational degrees of freedom of the hydrogen molecule in the reaction
dynamics.
","[{""version"":""v1"",""created"":""Tue, 4 Feb 1997 13:02:54 GMT""}]","2007-05-23"
"dg-ga/9702001","John M. Sullivan","Robert B. Kusner, John M. Sullivan","On Distortion and Thickness of Knots","13 pages, LaTeX2e","in ""Topology and Geometry in Polymer Science"" (IMA 103), Springer,
  1998, pp 67-78",,,"dg-ga math.DG",,"  What length of rope (of given diameter) is required to tie a particular knot?
To answer this question, we define some new notions of thickness for a space
curve, one based on Gromov's distortion, and another generalizing the thickness
of Litherland, Simon et al. We prove a basic inequality between these thickness
measures, and show that the distortion thickness is upper semi-continuous in
the C^0 topology, suggesting that shortest curves of thickness 1 should exist
in each knot class.
","[{""version"":""v1"",""created"":""Tue, 4 Feb 1997 03:08:16 GMT""}]","2008-02-03"
"gr-qc/9702007","Beverly K. Berger","Beverly K. Berger, James Isenberg, Piotr T. Chru\'sciel, Vincent
  Moncrief","Global Foliations of Vacuum Spacetimes with $T^2$ Isometry","38 pages, 0 figures, LaTeX","Annals Phys. 260 (1997) 117-148","10.1006/aphy.1997.5707",,"gr-qc",,"  We prove a global existence theorem (with respect to a geometrically- defined
time) for globally hyperbolic solutions of the vacuum Einstein equations which
admit a $T^2$ isometry group with two-dimensional spacelike orbits, acting on
$T^3$ spacelike surfaces.
","[{""version"":""v1"",""created"":""Mon, 3 Feb 1997 23:31:44 GMT""}]","2009-10-30"
"hep-ex/9702003","Ralph Eichler","C. Adloff, et al. (H1 Collaboration)","Diffraction Dissociation in Photoproduction at HERA","29 pages, latex, 6 Figures","Z.Phys.C74:221-236,1997","10.1007/s002880050385","DESY 97-009","hep-ex",,"  A study is presented of the process gamma p -->XY, where there is a large
rapidity gap between the systems X and Y. Measurements are made of the
differential cross section as a function of the invariant mass mx of the system
produced at the photon vertex. Results are presented at centre of mass energies
of W_gp = 187 GeV and W_gp = 231 GeV, both where the proton dominantly remains
intact and, for the first time, where it dissociates. Both the centre of mass
energy and the mx^2 dependence of HERA data and those from a fixed target
experiment may simultaneously be described in a triple-Regge model. The low
mass photon dissociation process is found to be dominated by diffraction,
though a sizable subleading contribution is present at larger masses. The
pomeron intercept is extracted and found to be alpha_pom(0) = 1.068 \pm 0.016
(stat.) \pm 0.022 (syst.) \pm 0.041 (model), in good agreement with values
obtained from total and elastic hadronic and photoproduction cross sections.
The diffractive contribution to the process gamma p --> Xp with mx^2 / W_gp^2 <
0.05 is measured to be 22.2 \pm 0.6 (stat.) \pm 2.6 (syst.) \pm 1.7 (model) %
of the total gamma p cross section at W_gp = 187 GeV.
","[{""version"":""v1"",""created"":""Tue, 4 Feb 1997 10:47:08 GMT""}]","2008-11-26"
"hep-lat/9702002","Timur D. Bakeyev","T. D. Bakeyev, M. I. Polikarpov, A. A. Slavnov and A. I. Veselov","A toy model test of a new algorithm for bozonization of fermion
  determinants","7 pages, latex, 5 postscript figures","Theor.Math.Phys. 113 (1997) 58-67",,"SMI-1/97, KANAZAVA 97-01","hep-lat",,"  Different aspects of bozonization algorithm proposed by Slavnov are tested by
numerical simulations of a one dimensional toy model.
","[{""version"":""v1"",""created"":""Tue, 4 Feb 1997 12:09:58 GMT""}]","2007-05-23"
"hep-ph/9702227","Gordon Ramsey","Gordon P. Ramsey (Loyola Univ. and Argonne National Lab)","Probing Nucleon Spin Structure","65 pages, 3 Postscript figures, LaTeX. To be published in ""Progress
  in Particle and Nuclear Physics""","Prog.Part.Nucl.Phys.39:599-653,1997","10.1016/S0146-6410(97)00051-3","ANL-HEP-PR-96-103","hep-ph",,"  One of the important questions in high energy physics is the relation of
quark and gluon spin to that of the nucleons which they comprise. Polarization
experiments provide a mechanism to probe the spin properties of elementary
particles and provide crucial tests of Quantum Chromodynamics (QCD). The
theoretical and experimental status of this fundamental question will be
reviewed in this paper.
","[{""version"":""v1"",""created"":""Mon, 3 Feb 1997 16:17:35 GMT""}]","2014-11-17"
"hep-ph/9702229",,"R. N. Mohapatra","Neutrino Mass Textures and the Nature of New Physics Implied by Present
  Neutrino Data","Invited talk presented at the Neutrino'96 conference in Helsinki,
  Finland, June, 1996; 13 pages; To appear in the proceedings to be published
  by the World Scientific",,,,"hep-ph",,"  If all indications for neutrino oscillations observed in the solar,
atmospheric neutrino data as well as in the LSND experiments are borne out by
the ongoing and future experiments, then they severely constrain the neutrino
mass texture. In particular, the need for an ultralight sterile neutrino is
hard to avoid. Such ultralight neutrinos have profound implications not only
for physics beyond the standard model but also perhaps for physics beyond the
conventional grand unification. We discuss a scenario involving a parallel
universe that interacts with the familiar universe only via gravitational
interactions, where the ultralightness of the sterile neutrino follows from the
same physics that explains the near masslessness of the familiar neutrinos.
","[{""version"":""v1"",""created"":""Mon, 3 Feb 1997 20:43:52 GMT""}]","2007-05-23"
"hep-ph/9702230","Gerhard Schuler","Gerhard A. Schuler (CERN)","Quarkonium production: velocity-scaling rules and long-distance matrix
  elements","17 pages, Latex, uses 12pt.sty and epsfig.sty, 2 figures","Int.J.Mod.Phys.A12:3951-3964,1997","10.1142/S0217751X97002103","CERN-TH/97-12","hep-ph",,"  The hierarchy of long-distance matrix elements (MEs) for quarkonium
production depends on their scaling with the velocity $v$ of the heavy quark in
the bound state. Ranges for the velocities in various bound states and
uncertainties of colour-singlet MEs are estimated in a quark-potential model.
Different possibilities for the scaling with $v$ of the MEs are discussed; they
depend on the actual values of $v$ and the QCD scale. As an application, J/psi
polarization in e^+e^- annihilation is discussed. The first non-perturbative
estimates of colour-octet MEs are presented and compared with phenomenological
determinations. Finally, various predictions of prompt quarkonium production at
LEP are compared.
","[{""version"":""v1"",""created"":""Mon, 3 Feb 1997 18:52:46 GMT""}]","2011-04-15"
"hep-ph/9702231","J. W. F. Valle","J. W. F. Valle (U. Valencia-IFIC/CIC)","Neutrinos and Physics Beyond the Standard Model","Invited talk at KEK 4th Topical Conference on Flavor Physics, October
  1996, to be published by Nuclear Physics Proceedings Supplements, latex file,
  14 pages, including 9 figures, uses psfig.sty and espcrc2.sty","Nucl.Phys.Proc.Suppl.59:249-261,1997","10.1016/S0920-5632(97)00449-0","FTUV/97-5; IFIC/97-5","hep-ph astro-ph",,"  A brief sketch is made of the present observational status of neutrino
physics, with emphasis on the hints that follow from solar and atmospheric
neutrino observations, as well as cosmological data on the amplitude of
primordial density fluctuations. I also briefly review the ways to account for
the observed anomalies and some of their implications.
","[{""version"":""v1"",""created"":""Mon, 3 Feb 1997 18:12:54 GMT""}]","2009-09-17"
