"hep-ph/9702232",,"W-Y. P. Hwang","Nonlocal Condensates in QCD","13 pages, plain TeX, MIT-CTP-2606",,,,"hep-ph",,"  In the presence of the nontrivial QCD ground state or vacuum, nonlocal
condensates are used to characterize the quark or gluon propagator, or other
Green functions of higher order. In this paper, we wish to show that, by taking
the large $N_c$ limit (with $N_c$ the number of color) in treating higher-order
condensates, a closed set of coupled differential equations may be derived for
nonlocal condensates. As a specific example, the leading-order equations for
the nonlocal condensates appearing in the quark propagator are derived and
explicit solutions are obtained. Some applications of our analytical results
are briefly discussed.
","[{""version"":""v1"",""created"":""Mon, 3 Feb 1997 19:24:47 GMT""}]","2007-05-23"
"hep-ph/9702233","Jose Alejandro Ayala","Alejandro Ayala (University of Illinois at Urbana-Champaign) and
  Augusto Smerzi (SISSA, Trieste Italy)","Density and Boundary Effects on Pion Distributions in Relativistic
  Heavy--Ion Collisions","Latex, 4 pages, 4 figures. Submitted to Phys. Lett. B","Phys.Lett. B405 (1997) 20-24","10.1016/S0370-2693(97)00627-8",,"hep-ph nucl-th",,"  We compute the pion inclusive momentum distribution in a heavy-ion collision,
assuming thermal equilibrium and accounting for boundary effects at the time of
decoupling. We calculate the chemical potential corresponding to an average
pion multiplicity in central collisions and explore the consequences of having
the pion system produced close to the critical temperature for Bose-Einstein
condensation.
","[{""version"":""v1"",""created"":""Mon, 3 Feb 1997 19:58:54 GMT""}]","2009-10-30"
"hep-ph/9702234","Emilio Torrente","Emilio Torrente-Lujan","Baryon asymmetry at the weak phase transition in presence of arbitrary
  CP violation","23 pages, 7 eps figures (epsfig macro neccesary) also avalaible at
  http://www-itp.unibe.ch/~torrente","Phys.Atom.Nucl. 68 (2005) 1-12","10.1134/1.1858551","butp-9702","hep-ph",,"  We consider interactions of fermions with the domain wall bubbles produced
during a first order phase transition. A new exact solution of the Dirac
equations is obtained for a wall profile incorporating a position dependent CP
violating phase. The reflection coefficients are computed, a resonance effect
is uncovered for rapidly varying phases. This resonance effect happens when the
energy and mass of the incident particles are $E/m=\Delta\theta/2$. Where
$\Delta\theta$ is the phase variation across the wall width. We calculate the
chiral charge flux through the wall surface and the corresponding baryon
asymmetry of the Universe. It agrees in sign and magnitude with the observed
baryonic excess $\rho_B/s\approx 10^{-10}$ for a large range of parameters and
CP violation. As a function of $\Delta\theta$, the ratio $\rho_b/s$ reach a
maximum for $\Delta\theta\approx 2-4\pi$ and $m\approx m_{top}$. PACS:
11.27.+d, 03.65.-w, 02.30.Hq, 02.30.Gp, 11.30.Fs, 98.80.Cq
","[{""version"":""v1"",""created"":""Mon, 3 Feb 1997 20:11:25 GMT""}]","2015-06-25"
"hep-ph/9702235","Peter Lipa","H. C. Eggers, P. Lipa, B. Buschbeck","A sensitive test for models of Bose-Einstein correlations","5 pages, 2 figures, revtex","Phys.Rev.Lett. 79 (1997) 197-200","10.1103/PhysRevLett.79.197","HEPHY-PUB 662/96, STPHY 22/96","hep-ph",,"  Accurate and sensitive measurements of higher order cumulants open up new
approaches to pion interferometry. It is now possible to test whether a given
theoretical prediction can consistently match cumulants of both second and
third order. Our consistency test utilizes a new technique combining
theoretically predicted functions with experimentally determined weights in a
quasi-Monte Carlo approach. Testing a general quantum statistics-based
framework of Bose-Einstein correlations with this technique, we find that
predictions for third order cumulants differ significantly from UA1 data. This
discrepancy may point the way to more detailed dynamical information.
","[{""version"":""v1"",""created"":""Mon, 3 Feb 1997 19:57:53 GMT""}]","2009-10-30"
"hep-ph/9702236","Werner Koepf","L. Frankfurt, W. Koepf and M. Strikman","Soft-hard interplay and factorization for baryon production in the
  target fragmentation region in ep collisions","13 pages, LaTeX, 2 Postscript figures; Final version to appear in
  Phys. Lett. B","Phys.Lett.B405:367-372,1997","10.1016/S0370-2693(97)00633-3","DESY-97-027, OSU-97-0202","hep-ph",,"  We discuss baryon production in the nucleon fragmentation region in deep
inelastic scattering. The dependence of the nucleon spectra on Bjorken-$x$ is
evaluated within the parton model and in QCD, and ways to look for the
break-down of the DGLAP approximation via baryon production are suggested. We
argue also that the leading neutron production in these small $x$ processes is
rather insensitive to the pion parton densities of the nucleon.
","[{""version"":""v1"",""created"":""Mon, 3 Feb 1997 22:13:47 GMT""},{""version"":""v2"",""created"":""Tue, 4 Feb 1997 03:48:23 GMT""},{""version"":""v3"",""created"":""Wed, 19 Feb 1997 14:31:43 GMT""},{""version"":""v4"",""created"":""Mon, 2 Jun 1997 13:05:20 GMT""}]","2014-11-17"
"hep-ph/9702237","Jorge L. Lopez","T. Li, J. Lopez, and D. Nanopoulos","M-theory Inspired No-scale Supergravity","8 pages, LaTeX, 3 figures (included)","Mod.Phys.Lett. A12 (1997) 2647-2654","10.1142/S0217732397002788","CTP-TAMU-07/97, DOE/ER/40717-39","hep-ph hep-th",,"  We propose a supergravity model that contains elements recently shown to
arise in the strongly-coupled limit of the $E_8\times E_8$ heterotic string
(M-theory), including a no-scale--like K\""ahler potential, the identification
of the string scale with the gauge coupling unification scale, and the onset of
supersymmetry breaking at an intermediate scale determined by the size of the
eleventh dimension of M-theory. We also study the phenomenological consequences
of such scenario, which include a rather constrained sparticle spectrum within
the reach of present-generation particle accelerators.
","[{""version"":""v1"",""created"":""Mon, 3 Feb 1997 21:22:40 GMT""}]","2009-10-30"
"hep-ph/9702238","Jose Herman","G. Lopez Castro and J. H. Munoz","Non-leptonic B decays involving tensor mesons","11 pages, Latex, to appear in Phys. Rev. D","Phys.Rev. D55 (1997) 5581-5584","10.1103/PhysRevD.55.5581","CINVESTAV-FIS-13/96","hep-ph",,"  Two-body non-leptonic decays of B mesons into PT and VT modes are calculated
using the non-relativistic quark model of Isgur et al.. The predictions
obtained for $B \to \pi D^*_2, \rho D_2^*$ are a factor of $3\sim 5$ below
present experimental upper limits. Interesting patterns are obtained for ratios
of B decays involving mesons with different spin excitations and their
relevance for additional tests of forms factor models are briefly discussed.
","[{""version"":""v1"",""created"":""Tue, 4 Feb 1997 00:08:43 GMT""}]","2016-09-06"
"hep-ph/9702239","Tommaso Calarco","V. Barone (Universita` di Torino - INFN, Italy), T. Calarco
  (Universita` di Ferrara - INFN, Italy), A. Drago (Universita` di Ferrara -
  INFN, Italy)","Double-Spin Transverse Asymmetries in Drell-Yan Processes","8 pages, REVTeX, 6 figures included as file figures.tar.gz","Phys.Rev. D56 (1997) 527-530","10.1103/PhysRevD.56.527",,"hep-ph",,"  We calculate the double-spin transverse asymmetries for the Drell-Yan lepton
pair production in p-p and p-anti p collisions. We assume the transverse and
the longitudinal polarization densities to be equal at a very small scale, as
it is suggested by confinement model results. Using a global fit for the
longitudinal distributions, we find transverse asymmetries of order of 10^-2 at
most, in the accessible kinematic regions.
","[{""version"":""v1"",""created"":""Tue, 4 Feb 1997 08:04:51 GMT""}]","2009-10-30"
"hep-ph/9702240","Frank Klingl","F. Klingl and W. Weise","QCD Sum Rules and Vector Mesons in Nuclear Matter","10 pages of LaTeX-2E using axodraw.sty, epsfig.sty; 2 postscript
  figures included; Proc. of the Int. Workshop XXV, Hirschegg '97, on 'QCD
  Phase Transitions'",,,,"hep-ph",,"  Based on an effective Lagrangian which combines chiral SU(3) dynamics with
vector meson dominance, we have developed a model for the s-wave vector
meson-nucleon scattering amplitudes. We use this as an input for the low energy
part of the current-current correlation function in nuclear matter. Its
spectrum enters directly in the ``left hand side'' of QCD sum rules. For the
isovector channel we find a significant enhancement of the in-medium spectral
density below the $\rho$ resonance while the mass of $\rho$ meson itself
decreases only slightly. The situation is different in the isoscalar channel.
Here the mass and therefore the peak position of the $\omega$ meson decreases
strongly while the width increases less drastically than in the $\rho$ meson
case. For the $\phi$ meson we find almost no mass shift, the width of the peak
broadens due to the imaginary part of the scattering length. We find a
remarkable degree of consistency with the operator product expansion of QCD sum
rules in all three channels.
","[{""version"":""v1"",""created"":""Tue, 4 Feb 1997 09:41:09 GMT""}]","2007-05-23"
"hep-ph/9702241","Dieter Pertermann","A.Capella, A.Kaidalov, C.Merino, D.Pertermann, and J.Tran Thanh Van","Structure Functions of Nuclei at Small x and Diffraction at HERA","TeX, 10 pages, 7 figures in 6 ps-files",,,"LPTHE Orsay 97-04","hep-ph",,"  Gribov theory is applied to investigate the shadowing effects in the
structure functions of nuclei. In this approach these effects are related to
the process of diffractive dissociation of a virtual photon. A model for this
diffractive process, which describes well the HERA data, is used to calculate
the shadowing in nuclear structure functions. A reasonable description of the
x, Q^2 and A-dependence of nuclear shadowing is achieved.
","[{""version"":""v1"",""created"":""Tue, 4 Feb 1997 10:27:11 GMT""}]","2007-05-23"
"hep-ph/9702242","Willy van Neerven","M.Buza, W.L.van Neerven","Order \alpha_s^2 Contributions to charm production in charged-current
  deep-inelastic lepton-hadron scattering","45 pages LaTeX, 17 Postscript Figures","Nucl.Phys. B500 (1997) 301-324","10.1016/S0550-3213(97)00327-1",,"hep-ph",,"  The most important part of the order $\alpha_s^2$ corrections to the charm
component of the charged-current structure functions $F_2(x,Q^2)$ and
$F_3(x,Q^2)$ have been calculated. This calculation is based on the asymptotic
form of the heavy-quark coefficient functions corresponding to the higher order
corrections to the W-boson-gluon fusion process. These coefficient functions
which are in principle only valid for $Q^2 \gg m^2$ can be also used to
estimate the order $\alpha_s^2$ contributions at lower $Q^2$ values provided $x
< 0.1$. It turns out that the above corrections are appreciable in the large
$Q^2$-region and they explain the discrepancy found for the structure functions
between the fixed-flavour scheme (FFS) and the variable-flavour-number scheme
(VFNS). These corrections also hamper the extraction of the strange-quark
density from the data obtained for the charged-current and the
electromagnetic-current processes.
","[{""version"":""v1"",""created"":""Tue, 4 Feb 1997 10:49:23 GMT""}]","2009-10-30"
"hep-ph/9702243","Bill Scott","P.F. Harrison, D.H. Perkins, W.G. Scott","Further Evidence for Threefold Maximal Lepton Mixing and a Hierarchical
  Spectrum of Neutrino Mass-Squared Differences","15 Pages, LaTex, 2 tables + 6 figures as postscript files","Phys.Lett. B396 (1997) 186-196","10.1016/S0370-2693(97)00105-6","RAL-TR-97-009","hep-ph",,"  The phenomenological case for threefold maximal lepton mixing is strengthened
by more detailed comparison with existing data. The atmospheric neutrino data
are self-consistent and in good agreement with the threefold maximal mixing
prediction R = 2/3 (chi-squared/dof = 4.3/5, CL = 51%). Including partially
con- tained event data, the zenith angle dependence also points to threefold
maximal mixing, ruling-out a range of mixing schemes, including that of
Fritzsch and Xing. Accounting for `de facto' uncertainties in solar neutrino
fluxes, the solar neutrino data (including HOMESTAKE) are shown to be
consistent with threefold maximal mixing (chi-squared/dof = 5.1/3, CL = 16%),
as is the upper limit from the LSND appearance experiment. Detailed pred-
ictions for forthcoming long-base-line reactor and accelerator experiments are
presented.
","[{""version"":""v1"",""created"":""Tue, 4 Feb 1997 12:50:55 GMT""}]","2009-10-30"
"hep-ph/9702244",,"David I. Kaiser","Preheating in an Expanding Universe: Analytic Results for the Massless
  Case","15pp, revtex. No figures. Very minor revisions; forthcoming in Phys
  Rev D","Phys.Rev. D56 (1997) 706-716","10.1103/PhysRevD.56.706","HUTP-97/A005","hep-ph astro-ph gr-qc",,"  Analytic results are presented for preheating in both flat and open models of
chaotic inflation, for the case of massless inflaton decay into further
inflaton quanta. It is demonstrated that preheating in both these cases closely
resembles that in Minkowski spacetime. Furthermore, quantitative differences
between preheating in spatially-flat and open models of inflation remain of
order $10^{-2}$ for the chaotic inflation initial conditions considered here.
","[{""version"":""v1"",""created"":""Tue, 4 Feb 1997 13:21:53 GMT""},{""version"":""v2"",""created"":""Mon, 21 Apr 1997 02:34:50 GMT""}]","2009-10-30"
"hep-ph/9702245",,"Markus Peter","The static potential in QCD - a full Two-Loop Calculation","LaTeX, 25 pages, 12 figures included","Nucl.Phys. B501 (1997) 471-494","10.1016/S0550-3213(97)00373-8","TTP97-03","hep-ph",,"  A full analytic calculation of the two-loop diagrams contributing to the
static potential in QCD is presented in detail. Using a renormalization group
improvement, the ``three-loop'' potential in momentum space is thus derived and
the third coefficient of the $\beta$-function for the V-scheme is given. The
Fourier transformation to position space is then performed, and the result is
briefly discussed.
","[{""version"":""v1"",""created"":""Tue, 4 Feb 1997 14:28:12 GMT""},{""version"":""v2"",""created"":""Fri, 17 Oct 1997 08:01:22 GMT""}]","2009-10-30"
"hep-ph/9702246","Feng Zhonghan","Zhonghan Feng (1), Denes Molnar(1) and Laszlo Pal Csernai(1 and 2)
  ((1) Univ. of Bergen, (2) Univ. of Minnesota)","Chiral Dynamics with Quark Degrees of Freedom","8 pages, 4 Postscript figure,Latex, Submitted to Heavy Ion Physics",,"10.1007/BF03053710",,"hep-ph",,"  Possibility to detect DCC fluctuations is discussed. It is shown that
interactions with quark background and dissipative effects due to interactions
in the chiral field may result in damping of fluctuations. Since the magnitude
of fluctuations depends strongly on the initial state and speed of chiral phase
transition accurate evaluation of all modifying processes is required to
predict observability of DCCs.
","[{""version"":""v1"",""created"":""Tue, 4 Feb 1997 15:40:27 GMT""}]","2022-02-23"
"hep-ph/9702253","Takeshi Fukuyama","T. Fukuyama (Ritsumeikan Univ.) and H. Nishiura (Junior College of
  Osaka Institute of Technology)","Mass Matrix of Majorana Neutrinos","8pp, Latex, 1 PostScript Figure",,,"Ritsumei-pp-9711","hep-ph",,"  We present a massive Majorana neutrino model and see how it is constrained
from the solar and atmospheric neutrino deficit experiments. This model
incorporates the seesaw mechanism and Peccei-Quinn symmetry. Its consequence to
the neutrinoless double beta decay is also discussed.
","[{""version"":""v1"",""created"":""Tue, 4 Feb 1997 03:16:15 GMT""}]","2007-05-23"
"hep-th/9702022","Stanislaw Mrowczynski","Stanislaw Mrowczynski","Transport Theory of Massless Fields","32 pages, no macros","Phys.Rev.D56:2265-2280,1997","10.1103/PhysRevD.56.2265",,"hep-th",,"  Using the Schwinger-Keldysh technique we discuss how to derive the transport
equations for the system of massless quantum fields. We analyse the scalar
field models with quartic and cubic interaction terms. In the $\phi^4$ model
the massive quasiparticles appear due to the self-interaction of massless bare
fields. Therefore, the derivation of the transport equations strongly resembles
that one of the massive fields, but the subset of diagrams which provide the
quasiparticle mass has to be resummed. The kinetic equation for the finite
width quasiparticles is found, where, except the mean-field and collision
terms, there are terms which are absent in the standard Boltzmann equation. The
structure of these terms is discussed. In the massless $\phi^3$ model the
massive quasiparticles do not emerge and presumably there is no transport
theory corresponding to this model. It is not surprising since the $\phi^3$
model is anyhow ill defined.
","[{""version"":""v1"",""created"":""Mon, 3 Feb 1997 17:31:16 GMT""}]","2014-11-18"
"hep-th/9702023","Frans Klinkhamer","F. R. Klinkhamer and C. Rupp","A global anomaly from the Z-string","In Section 6 error corrected for SU(2) theories with general isospin;
  conclusions changed significantly","Nucl.Phys. B495 (1997) 172-194","10.1016/S0550-3213(97)00206-X","KA-TP-01-1997","hep-th hep-ph",,"  The response of isodoublet fermions to classical backgrounds of essentially
2-dimensional boson fields in SU(2) Yang-Mills-Higgs theory is investigated. In
particular, the spectral flow of Dirac eigenvalues is calculated for a
non-contractible sphere of configurations passing through the vacuum and the
Z-string (the embedded vortex solution). Also, a non-vanishing Berry phase is
established for adiabatic transport ""around"" the Z-string. These results imply
the existence of a new type of global (non-perturbative) gauge anomaly in SU(2)
Yang-Mills-Higgs quantum field theory with a single doublet of left-handed
fermions. Possible extensions to other chiral gauge field theories are also
discussed.
","[{""version"":""v1"",""created"":""Mon, 3 Feb 1997 18:01:16 GMT""},{""version"":""v2"",""created"":""Tue, 4 Feb 1997 13:15:04 GMT""},{""version"":""v3"",""created"":""Sat, 8 Feb 1997 14:08:39 GMT""},{""version"":""v4"",""created"":""Fri, 21 Feb 1997 11:25:11 GMT""},{""version"":""v5"",""created"":""Sat, 22 Mar 1997 13:33:08 GMT""},{""version"":""v6"",""created"":""Tue, 8 Apr 1997 13:09:55 GMT""},{""version"":""v7"",""created"":""Wed, 16 Apr 1997 12:23:39 GMT""}]","2009-10-30"
"hep-th/9702024","Ioannis Giannakis","Ioannis Giannakis and V. P. Nair","Symplectic Structures and Self -dual Fields in (4k+2) Dimensions","10 pages, plain Tex, new references added","Phys.Lett. B409 (1997) 145-152","10.1016/S0370-2693(97)00859-9","RU-97-01-B, CCNY-HEP-97-1","hep-th",,"  We discuss symplectic structures for the chiral boson in (1+1) dimensions and
the self-dual field in (4k+2) dimensions. Dimensional reduction of the
six-dimensional field on a torus is also considered.
","[{""version"":""v1"",""created"":""Mon, 3 Feb 1997 19:36:55 GMT""},{""version"":""v2"",""created"":""Wed, 12 Feb 1997 23:11:38 GMT""}]","2009-10-30"
"hep-th/9702025",,"Osvaldo Chandia and Jorge Zanelli","Topological Invariants, Instantons and Chiral Anomaly on Spaces with
  Torsion","6 pages, RevTeX, no figures, two columns","Phys. Rev. D 55, 7580 (1997)","10.1103/PhysRevD.55.7580",,"hep-th gr-qc",,"  In a spacetime with nonvanishing torsion there can occur topologically stable
configurations associated with the frame bundle which are independent of the
curvature. The relevant topological invariants are integrals of local scalar
densities first discussed by Nieh and Yan (N-Y). In four dimensions, the N-Y
form $N= (T^a \wedge T_a - R_{ab} \wedge e^a \wedge e^b)$ is the only closed
4-form invariant under local Lorentz rotations associated with the torsion of
the manifold. The integral of $N$ over a compact D-dimensional (Euclidean)
manifold is shown to be a topological invariant related to the Pontryagin
classes of SO(D+1) and SO(D). An explicit example of a topologically nontrivial
configuration carrying nonvanishing instanton number proportional to $\int N$
is costructed. The chiral anomaly in a four-dimensional spacetime with torsion
is also shown to contain a contribution proportional to $N$, besides the usual
Pontryagin density related to the spacetime curvature. The violation of chiral
symmetry can thus depend on the instanton number of the tangent frame bundle of
the manifold. Similar invariants can be constructed in D>4 dimensions and the
existence of the corresponding nontrivial excitations is also discussed.
","[{""version"":""v1"",""created"":""Mon, 3 Feb 1997 18:44:05 GMT""}]","2016-08-24"
"hep-th/9702026","Barry McCoy","A. Berkovich, B.M. McCoy, A. Schilling and S.O. Warnaar","Bailey flows and Bose-Fermi identities for the conformal coset models
  $(A^{(1)}_1)_N\times (A^{(1)}_1)_{N'}/(A^{(1)}_1)_{N+N'}$","28 pages, AMS-Latex, two references added","Nucl.Phys. B499 (1997) 621-649","10.1016/S0550-3213(97)82955-0","ITP-SB-97-02, University of Melbourne preprint 04-97","hep-th",,"  We use the recently established higher-level Bailey lemma and Bose-Fermi
polynomial identities for the minimal models $M(p,p')$ to demonstrate the
existence of a Bailey flow from $M(p,p')$ to the coset models
$(A^{(1)}_1)_N\times (A^{(1)}_1)_{N'}/(A^{(1)}_1)_{N+N'}$ where $N$ is a
positive integer and $N'$ is fractional, and to obtain Bose-Fermi identities
for these models. The fermionic side of these identities is expressed in terms
of the fractional-level Cartan matrix introduced in the study of $M(p,p')$.
Relations between Bailey and renormalization group flow are discussed.
","[{""version"":""v1"",""created"":""Mon, 3 Feb 1997 20:37:46 GMT""},{""version"":""v2"",""created"":""Fri, 14 Feb 1997 16:18:43 GMT""}]","2009-10-30"
"hep-th/9702027","Steven Weinberg","Steven Weinberg","What is Quantum Field Theory, and What Did We Think It Is?","17 pages, LaTeX, no macros needed, no figures",,,"UTTG-05-97","hep-th cond-mat gr-qc hep-ph",,"  This is a talk presented at the conference ``Historical and Philosophical
Reflections on the Foundations of Quantum Field Theory,'' at Boston University,
March 1996. It will be published in the proceedings of this conference.
","[{""version"":""v1"",""created"":""Tue, 4 Feb 1997 02:06:55 GMT""}]","2007-05-23"
"hep-th/9702029","Hyuk Jae Lee","Seungjoon Hyun, Junsoo Shin, Jae Hyung Yee and Hyuk-jae Lee","Vortex solutions of a Maxwell-Chern-Simons field coupled to four-fermion
  theory","7 pages, harvmac, To be published in Phys. Rev. D55","Phys.Rev.D55:3900-3902,1997; Erratum-ibid.D57:6561,1998","10.1103/PhysRevD.55.3900 10.1103/PhysRevD.57.6561","YUMS 96-12, SNUTP 96-065","hep-th",,"  We find the static vortex solutions of the model of Maxwell-Chern-Simons
gauge field coupled to a (2+1)-dimensional four-fermion theory. Especially, we
introduce two matter currents coupled to the gauge field minimally: the
electromagnetic current and a topological current associated with the
electromagnetic current. Unlike other Chern-Simons solitons the N-soliton
solution of this theory has binding energy and the stability of the solutions
is maintained by the charge conservation laws.
","[{""version"":""v1"",""created"":""Tue, 4 Feb 1997 05:01:41 GMT""}]","2014-11-18"
"hep-th/9702032","Sviatoslav Solganik","A.N. Sissakian, O.Yu. Shevchenko and S.B. Solganik","Discussion on ""Dynamical Chern-Simons term generation at finite density""
  and ""Chern-Simons term at finite density""",,,,,"hep-th",,"  We discuss the comment by V.Zeitlin on our recent papers concerning
Chern-Simons term generation at finite density.
","[{""version"":""v1"",""created"":""Tue, 4 Feb 1997 10:17:24 GMT""},{""version"":""v2"",""created"":""Fri, 16 May 1997 07:37:59 GMT""}]","2008-02-03"
"hep-th/9702033","Yakov Shnir","V.G. Kiselev and Ya.M. Shnir","Interaction of Non-Abelian Monopole with External Field","5 pages, laTeX, no figures. Talk given at the XXI International
  Colloquium on Group Theoretical Methods in Physics. July 1996, Goslar,
  Germany. To appear in the Proceedings",,,,"hep-th",,"  The interaction of a nontrivial topological field configuration with the
external fields is considered. The approach is based on the calculation of the
zero modes excitation probability. We consider the interaction of the
t'Hooft-Polyakov monopole with an external weak uniform magnetic field and the
field of another monopole.
","[{""version"":""v1"",""created"":""Tue, 4 Feb 1997 11:01:09 GMT""}]","2007-05-23"
"hep-th/9702034","Paul Saffin","P. M. Saffin and E. J. Copeland","Bubble collisions in SU(2)xU(1) gauge theory and the production of
  non-topological strings","9 pages, RevTeX, 4 eps figures","Phys.Rev. D56 (1997) 1215-1219","10.1103/PhysRevD.56.1215","SUSX-TH/97-003","hep-th hep-ph",,"  We extend work done previously concerning the formation of vortices in a
U(1)->1 gauge theory at a first order phase transition to the symmetry breaking
SU(2)xU(1)->U(1). It is shown that the collision of bubbles, appearing at the
phase transition, allow the possibility for forming non-topological strings
associated with the gauge group. The method used also shows clearly how these
vortices are related to the Nielsen-Olesen vortices.
","[{""version"":""v1"",""created"":""Tue, 4 Feb 1997 11:52:00 GMT""}]","2009-10-30"
