"alg-geom/9702004","Alice Silverberg","A. Silverberg and Yu. G. Zarhin","Semistable reduction of abelian varieties over extensions of small
  degree","LaTeX2e",,,,"alg-geom math.AG",,"  We obtain necessary and sufficient conditions for abelian varieties to
acquire semistable reduction over fields of low degree. Our criteria are
expressed in terms of torsion points of small order defined over unramified
extensions.
","[{""version"":""v1"",""created"":""Mon, 3 Feb 1997 20:20:45 GMT""},{""version"":""v2"",""created"":""Thu, 20 Feb 1997 16:14:15 GMT""}]","2016-08-30"
"alg-geom/9702005","Marco Andreatta","Marco Andreatta","Moishezon Manifolds","Plain-Tex, 10 pages",,,,"alg-geom math.AG",,"  Let X be a compact Moishezon manifold which becomes projective after blowing
up a smooth subvariety $Y \subset X$. We assume also that there exists a proper
map $\rho :X \to X'$ onto a projective variety X' with $\rho(Y)$ a point, such
that $Pic(X/X') = \Z$ and $K_X$ is $\rho$-big. We prove some inequalities
between the dimensions of Y and X and we construct examples which shows the
optimality of the inequalities. Then we discuss some differential geometry
properties of these examples which lead to a conjecture.
","[{""version"":""v1"",""created"":""Tue, 4 Feb 1997 13:07:33 GMT""}]","2008-02-03"
"astro-ph/9702023","Vladimir Reshetnikov","Vladimir Reshetnikov (AI SPbSU, Russia), Francoise Combes
  (Observatoire de Paris, France)","Tidally-triggered disk thickening. II. Results and interpretations","8 pages, 7 figures, latex. Accepted for publication in the Astronomy
  and Astrophysics",,,,"astro-ph",,"  We have reported in a previous paper (AAS 116, 417, 1996) B, V and I band
photometric data for a sample of 24 edge-on interacting spiral galaxies,
together with a control sample of 7 edge-on isolated galaxies. We discuss here
the main result found in this study: the ratio h/z of the radial exponential
scalelength h to the constant scaleheight z is about twice smaller for
interacting galaxies. This is found to be due both to a thickening of the
plane, and to a radial stripping or shrinking of the stellar disk. If we
believe that any galaxy experienced a tidal interaction in the past, we must
conclude that continuous gas accretion and subsequent star formation can bring
back the ratio h/z to higher values, in a time scale of 1 Gyr.
","[{""version"":""v1"",""created"":""Mon, 3 Feb 1997 17:18:48 GMT""}]","2007-05-23"
"astro-ph/9702025","Andrew Connolly","A.J. Connolly, A.S. Szalay (JHU), A.K. Romer, R.C. Nichol (CMU), B.
  Holden (UofC), D. Koo (UCSC), T. Miyaji (MPE)","A Search For Large-Scale Structure at High Redshift","3 pages, Latex file, includes 3 postscript figures (uses sprocl.sty
  and psfig). To appear in: Proceedings of the 18th Texas Symposium in
  Relativistic Astrophysics, Chicago, 15-20th December 1996. See also
  http://tarkus.pha.jhu.edu/~ajc/papers/supercluster/sc.html",,,,"astro-ph",,"  We present new and exciting results on our search for large-scale structure
at high redshift. Specifically, we have just completed a detailed analysis of
the area surrounding the cluster CL0016+16 (z=0.546) and have the most
compelling evidence yet that this cluster resides in the middle of a
supercluster. From the distribution of galaxies and clusters we find that the
supercluster appears to be a sheet of galaxies, viewed almost edge-on, with a
radial extent of 31 Mpc, transverse dimension of 12 Mpc, and a thickness of ~4
Mpc. The surface density and velocity dispersion of this coherent structure are
consistent with the properties of the ``Great Wall'' in the CfA redshift
survey.
","[{""version"":""v1"",""created"":""Mon, 3 Feb 1997 16:30:40 GMT""}]","2007-05-23"
"astro-ph/9702026","Juan I. Collar","J.I. Collar (PPE/CERN)","Reply to astro-ph/9612003 (""Comments on 'Biological Effects of Stellar
  Collapse Neutrinos'"") and astro-ph/9612214 (""Volcanogenic Dark Matter and
  Mass Extinctions"")","Postscript, 4 pages, no figures","Phys.Rev.Lett. 78 (1997) 1395","10.1103/PhysRevLett.78.1395",,"astro-ph hep-ph physics.bio-ph physics.geo-ph",,"  A Reply to the criticisms contained in astro-ph/9612003 is provided and a
logical inconsistency in astro-ph/9612214 is pointed out.
","[{""version"":""v1"",""created"":""Mon, 3 Feb 1997 16:43:55 GMT""}]","2009-10-30"
"astro-ph/9702027","Andrew Heckler","Andrew F. Heckler (Ohio State Univ.)","Calculation of the emergent spectrum and observation of primordial black
  holes","10 pages, Latex, submitted to PRL","Phys.Rev.Lett.78:3430-3433,1997","10.1103/PhysRevLett.78.3430","OSU-TA-97-3","astro-ph hep-ph",,"  We calculate the emergent spectrum of microscopic black holes, which emit
copious amounts of thermal ``Hawking'' radiation, taking into account the
proposition that (contrary to previous models) emitted quarks and gluons do not
directly fragment into hadrons, but rather interact and form a photosphere and
decrease in energy before fragmenting. The resulting spectrum emits copious
amount of photons at energies around 100MeV. We find that the limit on the
average universal density of black holes is not significantly affected by the
photosphere. However we also find that gamma ray satellites such as EGRET and
GLAST are well suited to look for nearby black holes out to a distance on the
order of 0.3 parsecs, and conclude that if black holes are clustered locally as
much as luminous matter, they may be directly detectable.
","[{""version"":""v1"",""created"":""Mon, 3 Feb 1997 17:10:01 GMT""}]","2011-07-19"
"astro-ph/9702028","Sakellariadou Mairi","Ruth Durrer and Mairi Sakellariadou (University of Geneva)","Microwave Background Anisotropies from Scaling Seed Perturbations","LaTeX file (18 pages) and 12 figures; minor corrections; to appear as
  an article in Physical Review D","Phys.Rev. D56 (1997) 4480-4493","10.1103/PhysRevD.56.4480",,"astro-ph gr-qc",,"  We study microwave background anisotropies induced by scaling seed
perturbations in a universe dominated by cold dark matter. Using a gauge
invariant linear perturbation analysis, we solve the perturbation equations on
super-horizon scales, for CMB anisotropies triggered by generic gravitational
seeds. We find that perturbations induced by seeds --- under very mild
restrictions --- are nearly isocurvature. Thus, compensation, which is mainly
the consequence of physically sensible initial conditions, is very generic.
  We then restrict our study to the case of scaling sources, motivated by
global scalar fields. We parameterize the energy momentum tensor of the source
by ``seed functions'' and calculate the Sachs-Wolfe and acoustic contributions
to the CMB anisotropies. We discuss the dependence of the anisotropy spectrum
on the parameters of the model considered. Even within the restricted class of
models investigated in this work, we find a surprising variety of results for
the position and height of the first acoustic peak as well as for the overall
amplitude. In particular, for certain choices of parameters, the spectrum
resembles very much the well known adiabatic inflationary spectrum, whereas for
others, the position of the first acoustic peak is significantly shifted
towards smaller angular scales.
","[{""version"":""v1"",""created"":""Mon, 3 Feb 1997 17:54:06 GMT""},{""version"":""v2"",""created"":""Tue, 4 Feb 1997 09:01:01 GMT""},{""version"":""v3"",""created"":""Thu, 27 Mar 1997 17:48:43 GMT""},{""version"":""v4"",""created"":""Mon, 28 Jul 1997 11:40:54 GMT""}]","2009-10-30"
"astro-ph/9702029",,"S. Cassisi (Universita' de L'Aquila) and M. Salaris
  (Max-Planck-Institut fur Astrophysik)","A critical investigation on the discrepancy between the observational
  and theoretical Red Giant luminosity function ""Bump""","10 pages, 5 figures, Tex file, mnrass.sty style included. To appear
  in MNRAS",,"10.1093/mnras/285.3.593",,"astro-ph",,"  New theoretical evaluations of the RGB luminosity function 'bump' and the
ZAHB luminosity covering the range of metallicities typical of galactic
globular cluster are presented. The variation of the theoretical RGB bump and
ZAHB levels due to the metallicity, original helium content, mixing length
value, age, mass loss, bolometric corrections, opacities and equation of state
adopted in the evolutionary models is also discussed. These new prescriptions
have been taken into account for casting light on a longstanding astrophysical
problem connected with the Red Giant Branch evolutionary phase, namely the
discrepancy between the observational and the theoretical luminosity of RGB
bump. A sample of globular clusters with accurate evaluations of the bump
luminosity and spectroscopical metallicity determinations has been selected.
The Zero Age Horizontal Branch luminosity at the RR-Lyrae instability strip has
been evaluated as accurately as possible, and the observational luminosity
difference between the RGB bump and the ZAHB has been compared with the
theoretical values. It is shown that there is no significant disagreement
between observations and canonical stellar models. The possible applications of
this result are also briefly discussed.
","[{""version"":""v1"",""created"":""Mon, 3 Feb 1997 17:02:28 GMT""}]","2015-06-24"
"astro-ph/9702030","Wesley Colley","Wesley N. Colley, Oleg Y. Gnedin, Jeremiah P. Ostriker, James E.
  Rhoads (Princeton University Observatory)","Dynamics of ``Small Galaxies'' in the Hubble Deep Field","AASTeX 4.0 (preprint), 4 PostScript figures",,"10.1086/304730","POPe-708, accepted by ApJ","astro-ph",,"  We have previously found in the Hubble Deep Field a significant angular
correlation of faint, high color-redshift objects on scales below one
arcsecond, or several kiloparsecs in metric size. We examine the correlation
and nearest neighbor statistics to conclude that 38% of these objects in the
HDF have a companion within one arcsecond, three times the number expected in a
random distribution with the same number of objects. We examine three dynamical
scenarios for these object multiplets: 1) the objects are star-forming regions
within normal galaxies, whose disks have been relatively dimmed by K-correction
and surface brightness dimming; 2) they are fragments merging into large
galaxies; 3) they are satellites accreting onto normal L_* galaxies. We find
that hypothesis 1 is most tenable. First, large galaxies in the process of a
merger formation would have accumulated too much mass in their centers (5e12
M_sun inside 2 kpc) to correspond to present day objects. Second, accretion by
dynamical friction occurs with a predictable density vs. radius slope, not seen
among the faint HDF objects. Since the dynamical friction time is roughly (1
Gyr), a steady-state should have been reached by redshift z < 5. Star-forming
regions within galaxies clearly present no dynamical problems. Since large
spirals would still appear as such in the HDF, we favor a scenario in which the
faint compact sources in the HDF are giant starforming regions within small
normal galaxies, such as Magellanic irregulars. Finally we checked that
reduction in mass-to-light from induced star-formation cannot alone explain the
luminosity overdensity.
","[{""version"":""v1"",""created"":""Mon, 3 Feb 1997 18:14:06 GMT""},{""version"":""v2"",""created"":""Tue, 4 Feb 1997 01:50:14 GMT""},{""version"":""v3"",""created"":""Thu, 1 May 1997 22:53:35 GMT""}]","2009-10-30"
"astro-ph/9702031","Min Yun","M. S. Yun, N. Z. Scoville, J. J. Carrasco, and R. D. Blandford
  (California Institute of Technology)","Resolution and Kinematics of Molecular Gas Surrounding the Cloverleaf
  Quasar at z=2.6 Using the Gravitational Lens","To appear in Astrophysical Journal. 10 pages, 2 postscript figures,
  uses aaspp4.sty","Astrophys.J.479:L9,1997","10.1086/310580",,"astro-ph",,"  Gravitational lenses have long been advertised as primitive telescopes,
capable of magnifying cosmologically distant sources (Zwicky 1937). In this
Letter, we present new 0''.9 resolution CO (7-6) observations of the z=2.56
Cloverleaf quasar (H 1413+117) and spatially resolved images. By modeling the
gravitational lens, we infer a size scale of 0''.3 (~1 kpc) for the molecular
gas structure surrounding the quasar, and the gas has a kinematic structure
roughly consistent with a rotating disk. The observed properties of the CO
emitting gas are similar to the nuclear starburst complexes found in the
infrared luminous galaxies in the local universe, and metal enrichment by
vigorous star formation within this massive nuclear gas complex can explain the
abundance of carbon and oxygen in the interstellar medium of this system
observed when the universe was only a few billion years old. Obtaining
corresponding details in an unlensed object at similar distances would be well
beyond the reach of current instruments, and this study highlights the less
exploited yet powerful use of a gravitational lens as a natural telescope.
","[{""version"":""v1"",""created"":""Mon, 3 Feb 1997 19:24:59 GMT""}]","2014-10-10"
"astro-ph/9702032","Gregory Mendell","Gregory Mendell (University of Florida)","Magnetohydrodynamics in Superconducting-Superfluid Neutron Stars","11 pages, requires MN plain TeX macros, to appear in MNRAS. Sec. 6
  was revised on 02/20/97 to state that stratification will greatly increase
  the magnetic spin-up time; 09/09/97 version corrects minor typos only",,"10.1046/j.1365-8711.1998.01451.x",,"astro-ph",,"  MHD equations are presented for the mixture of superfluid neutrons,
superconducting protons, and normal electrons believed to exist in the outer
cores of neutron stars. The dissipative effects of electron viscosity and
mutual friction due to electron-vortex scattering are also included. It is
shown that Alfven waves are replaced by cyclotron- vortex waves that have not
been previously derived from MHD theory. The cyclotron- vortex waves are
analogous to Alfven waves with the tension due to the magnetic energy density
replaced by the vortex energy density. The equations are then put into a
simplified form useful for studying the effects of the interior magnetic field
on the dynamics. Of particular interest is the crust-core coupling time which
can be inferred from pulsar glitch observations. The hypothesis that
cyclotron-vortex waves play a significant role in the core spin-up during a
glitch is used to place limits on the interior magnetic field. The results are
compared with those of other studies.
","[{""version"":""v1"",""created"":""Mon, 3 Feb 1997 19:38:33 GMT""},{""version"":""v2"",""created"":""Thu, 20 Feb 1997 17:48:53 GMT""},{""version"":""v3"",""created"":""Tue, 9 Sep 1997 18:57:12 GMT""}]","2009-10-30"
"astro-ph/9702033","Andrew de Laix","Andrew A. de Laix, Lawrence M. Krauss, and Tanmay Vachaspati","Gravitational Lensing Signature of Long Cosmic Strings","4 pages, revtex with 3 postscript figures included","Phys.Rev.Lett. 79 (1997) 1968-1971","10.1103/PhysRevLett.79.1968","CWRU-P1-97","astro-ph hep-ph",,"  The gravitational lensing by long, wiggly cosmic strings is shown to produce
a large number of lensed images of a background source. In addition to pairs of
images on either side of the string, a number of small images outline the
string due to small-scale structure on the string. This image pattern could
provide a highly distinctive signature of cosmic strings. Since the optical
depth for multiple imaging of distant quasar sources by long strings may be
comparable to that by galaxies, these image patterns should be clearly
observable in the next generation of redshift surveys such as the Sloan Digital
Sky Survey.
","[{""version"":""v1"",""created"":""Mon, 3 Feb 1997 20:04:40 GMT""}]","2009-10-30"
"astro-ph/9702034","Robert McClure","Robert D. McClure","The Binary Nature of the Subgiant CH Stars","10 Latex pages, including 2 figures. Accepted by PASP. Also available
  at http://www.hia.nrc.ca/eprints.html",,"10.1086/133910","DAO-9704","astro-ph",,"  Repeated radial velocities have been measured for a sample of 10 subgiant CH
(sgCH) stars over a period of about 15 years. Long-term velocity variations are
exhibited by all but one star, and spectroscopic orbits have been calculated
for six of them. The periods are long, ranging from 876 to 4144 days. The
distribution of eccentricities and mass functions for sgCH star orbits are
similar to those for giant barium and CH stars, exhibiting significant orbital
dissipation relative to normal late-type binaries. It is concluded that all
sgCH stars are binaries, and like the barium and CH stars, they have had mass
transferred from a former asymptotic giant-branch star.
","[{""version"":""v1"",""created"":""Mon, 3 Feb 1997 23:07:46 GMT""}]","2009-10-30"
"astro-ph/9702035","Q. Daniel Wang","Q. Daniel Wang, Melville Ulmer, and Russell J. Lavery","Butcher & Oemler Cluster A2111: A Head-on Merger at z = 0.23","To be published in MNRAS, 16 pages, plus 13 figures in the GIF or
  jpeg format (uuencoded). Black & white postscript files of the figures are
  available at http://www.astro.nwu.edu/astro/wqd/paper/a2111/",,"10.1093/mnras/288.3.702",,"astro-ph",,"  We present ROSAT PSPC and HRI observations of A2111, the richest galaxy
cluster photometrically surveyed by Butcher & Oemler (1984). The cluster
contains a distinct comet-shaped X-ray subcomponent, which appears hotter than
the rest of the cluster. The galaxy and X-ray surface brightness distributions
of the cluster show a similarly elongated morphology. These results suggest
that the cluster is undergoing a head-on subcluster merger. This merger may
also be responsible for the high fraction of gas-rich blue galaxies observed in
the cluster. We have further detected a poor cluster along the merging axis and
at a projected distance of about 5 Mpc from A2111.
","[{""version"":""v1"",""created"":""Tue, 4 Feb 1997 00:25:43 GMT""}]","2015-06-24"
"astro-ph/9702036","Yuhri Ishimaru","Yuhri Ishimaru, Nobuo Arimoto (University of Tokyo)","Roles of SNIa and SNII in ICM Enrichment","8 pages, 2 figures, requires PASJ LaTeX macros. To appear in PASJ",,"10.1093/pasj/49.1.1",,"astro-ph",,"  Based on ASCA observations Mushotzky et al. (1996, ApJ 466, 686) have
recently derived the relative-abundance ratios of $\alpha$-elements to iron,
[\alpha/Fe] \simeq 0.2-0.3$, for four rich clusters, and have suggested that
the origin of metals in an intra-cluster medium (ICM) is not a type-Ia
supernovae (SNIa), but a type-II supernovae (SNII). However, these authors used
the solar photospheric iron abundance for ASCA data reduction, while the
meteoritic iron abundance is usually adopted in chemical-evolution studies. It
is true that although the photospheric and meteoritic solar abundances are
consistent for most of the elements, a serious discrepancy is known to exist
for iron; indeed, the photospheric abundance of iron is $N_{Fe}/N_H = 4.68
10^{-5}$ by number, while the meteoritic value is $3.24 10^{-5}$. The argument
concerning the relative roles of SNIa and SNII in ICM enrichment is quite
sensitive to the precise values of [\alpha/Fe], and one should use an identical
solar iron abundance in data reduction as well as in theoretical arguments. We
therefore adopt the meteoritic iron abundance, which is consistent with
chemical-evolution studies, and shift Mushotzky et al.'s ASCA data by
$\Delta[\alpha/Fe] \simeq -0.16$ dex. By comparing the corrected [\alpha/Fe]
values with theoretical nucleosynthesis prescriptions of SNIa and SNII, we
reach a conclusion that an SNIa iron contribution of 50% or higher in the ICM
enrichment could not be ruled out, and might indeed be favoured based on the
ASCA spectra.
","[{""version"":""v1"",""created"":""Tue, 4 Feb 1997 11:17:57 GMT""}]","2015-06-24"
"astro-ph/9702037","Joakim Edsjo","L. Bergstrom (Stockholm University), J. Edsjo (Uppsala University) and
  M. Kamionkowski (Columbia University)","Astrophysical-Neutrino Detection with Angular and Energy Resolution","21 pages, 7 eps-figures (included), LaTeX, uses RevTeX and psfig,
  replaced version with added reference","Astropart.Phys. 7 (1997) 147-160","10.1016/S0927-6505(97)00013-3","USITP-10/96, UUITP-1/97, CU-TP-810, CAL-627","astro-ph hep-ph",,"  We investigate the improvement in sensitivity to astrophysical point sources
of energetic ($\gtrsim1$ GeV) neutrinos which can be achieved with angular
and/or energy resolution of the neutrino-induced muon. As a specific example we
consider WIMP annihilation in the Sun and in the Earth as a neutrino source.
The sensitivity is improved by using the angular and energy distribution to
reduce the atmospheric-neutrino background. Although the specific improvements
depend on the backgrounds and assumed sources, the sensitivity to a WIMP signal
may be improved, with equal exposure, by up to roughly a factor of two with
good angular resolution, and by up to roughly a factor of three with good
energy resolution. In case of a positive detection, energy resolution would
also improve the measurement of the neutrino energy spectrum and therefore
provide information on the WIMP mass and composition.
","[{""version"":""v1"",""created"":""Tue, 4 Feb 1997 12:26:22 GMT""},{""version"":""v2"",""created"":""Wed, 5 Feb 1997 18:19:35 GMT""}]","2009-10-30"
"astro-ph/9702038","Andrew Tyler Sornborger","Andrew T. Sornborger","High-Resolution Analysis of Cold and Hot Dark Matter in Cosmic String
  Wakes","17 pages, LaTeX, more figures and mpeg simulations available at
  http://www.damtp.cam.ac.uk/user/ats25/string.html","Phys. Rev. D 56, 6139 (1997)","10.1103/PhysRevD.56.6139","DAMTP-R/9707","astro-ph gr-qc",,"  We study the accretion of cold and hot dark matter onto a cosmic string wake
using a high-resolution numerical simulation. We verify previous analytical
calculations predicting the radius of bound matter around wakes and inflow
velocities of the dark matter, as well as assumptions about the self-similarity
of the solution. In cold wakes, we show that self-similarity is approached
quickly after a `binding' transition. Hot wakes approach self-similarity
rapidly once the free streaming `pressure' falls below a critical value and
accretion begins. We also analytically calculate the size of the overdensity in
wakes with cold dark matter and compare the results to simulations. We remark
that the results derived may be used in testing gravitational numerical codes
in the non-linear regime.
","[{""version"":""v1"",""created"":""Tue, 4 Feb 1997 14:18:20 GMT""}]","2016-08-25"
"astro-ph/9702039","Martin Dominik","M. Dominik","Galactic microlensing with rotating binaries","22 pages LaTeX2e format including 18 PostScript figures, uses
  ""aa.cls""","Astron.Astrophys. 329 (1998) 361",,"DO-TH 97/05","astro-ph",,"  The influence of rotating binary systems on the light curves of galactic
microlensing events is studied. Three different rotating binary systems are
discussed: a rotating binary lens, a rotating binary source, and the motion of
the earth around the sun (parallax effect). The most dramatic effects arise
from the motion of a binary lens because of the changes of the caustic
structure with time. I discuss when the treatment of a microlensing event with
a static binary model is appropriate. It is shown that additional constraints
on the unknown physical quantities of the lens system arise from a fit with a
rotating binary lens as well as from the earth-around-sun motion. For the DUO#2
event, a fit with a rotating binary lens is presented.
","[{""version"":""v1"",""created"":""Tue, 4 Feb 1997 14:35:37 GMT""},{""version"":""v2"",""created"":""Tue, 9 Sep 1997 14:06:58 GMT""}]","2014-10-10"
"astro-ph/9702040","Charley Lineweaver","C.H. Lineweaver (Observatoire de Strasbourg)","Constraining Cosmological Parameters with CMB Measurements","3 pages, 2 Figures, Texas in Chicago Proceedings",,,,"astro-ph",,"  The current enthusiam to measure fluctuations in the CMB power spectrum at
angular scales between 0.1 and 1 degree is largely motivated by the expectation
that CMB determinations of cosmological parameters will be of unprecedented
precision. In such circumstances it is important to estimate what we can
already say about the cosmological parameters. In two recent papers (Lineweaver
etal 1997a & 1997b) we have compiled the most recent CMB measurements, used a
fast Boltzmann code to calculate model power spectra (Seljak & Zaldarriaga
1996) and, with a chi-squared analysis, we have compared the data to the power
spectra from several large regions of parameter space. In the context of the
flat models tested we obtain the following constraints on cosmological
parameters: $Ho = 30^{+13}_{-9}$, $n=0.93^{+0.17}_{-0.16}$ and
$Q=17.5^{+3.5}_{-2.5}$ uK. The n and Q values are consistent with previous
estimates while the Ho result is surprisingly low.
","[{""version"":""v1"",""created"":""Tue, 4 Feb 1997 15:06:26 GMT""}]","2007-05-23"
