"hep-th/9702035",,"Maurizio Martellini and Mauro Zeni","Feynman rules and beta-function for the BF Yang-Mills Theory","14 pages and 6 figures, Latex and epsf","Phys.Lett. B401 (1997) 62-68","10.1016/S0370-2693(97)00379-1","IFUM 547/FT","hep-th",,"  Yang-Mills theory in the first order formalism appears as the deformation of
a topological field theory, the pure BF theory. We discuss this formulation at
the quantum level, giving the Feynman rules of the BF-YM theory, the structure
of the renormalization and checking its uv-behaviour in the computation of the
beta-function which agrees with the expected result.
","[{""version"":""v1"",""created"":""Tue, 4 Feb 1997 12:15:22 GMT""}]","2009-10-30"
"hep-th/9702036","Saulo Carneiro de Souza Silva S.","Saulo Carneiro","Probability Amplitudes for Charge-Monopole Scattering","To appear in The Journal of High Energy Physics (JHEP), Latex, 11
  pages, new results added","JHEP 07 (1998) 022","10.1088/1126-6708/1998/07/022",,"hep-th",,"  In this letter we quantize a previously proposed non-local lagrangean for the
classical dual electrodynamics (Phys.Lett.B 384(1996)197), showing how it can
be used to construct probability amplitudes. Our results are shown to agree
with those obtained in the context of Schwinger and Zwanzinger formulations,
but without necessity of introducing strings.
","[{""version"":""v1"",""created"":""Tue, 4 Feb 1997 14:16:18 GMT""},{""version"":""v2"",""created"":""Fri, 31 Jul 1998 20:36:17 GMT""}]","2011-08-26"
"hep-th/9702037",".","M. Frau, I. Pesando, S. Sciuto, A. Lerda, R. Russo","Scattering of closed strings from many D-branes","15 pages, plain Latex","Phys.Lett. B400 (1997) 52-62","10.1016/S0370-2693(97)00331-6","DFTT 8/97","hep-th",,"  We develop an operator formalism to compute scattering amplitudes of
arbitrary bosonic string states in the background of many D-branes.
Specifically, we construct a suitable boundary state which we use to saturate
the multi-Reggeon vertex in order to obtain the generator of multi-membrane
scattering amplitudes. We explicitly show that the amplitudes with $h$ parallel
D-branes are similar to amplitudes with $h-1$ open string loops.
","[{""version"":""v1"",""created"":""Tue, 4 Feb 1997 14:42:35 GMT""}]","2009-10-30"
"math/9702220","Akihiko Yukie","Akihiko Yukie","Prehomogeneous vector spaces and ergodic theory III",,,,"OSU Math 1997-4","math.RT",,"  Let H_1=SL(5), H_2=SL(3), H=H_1 \times H_2. It is known that (G,V) is a
prehomogeneous vector space (see [22], [26], [25], for the definition of
prehomogeneous vector spaces). A non-constant polynomial \delta(x) on V is
called a relative invariant polynomial if there exists a character \chi such
that \delta(gx)=\chi(g)\delta(x). Such \delta(x) exists for our case and is
essentially unique. So we define V^{ss}={x in V such that \delta(x) is not
equal to 0}. For x in V_R^{ss}, let H_{x R+}^0 be the connected component of 1
in classical topology of the stabilizer H_{x R}. We will prove that if x in
V_R^ss is ""sufficiently irrational"", H_{x R+}^0 H_Z is dense in H_R.
","[{""version"":""v1"",""created"":""Tue, 4 Feb 1997 00:00:00 GMT""}]","2009-09-25"
"math/9702226","Dave Witte","Edward Dobson, Heather Gavlas, Joy Morris, Dave Witte","Automorphism groups with cyclic commutator subgroup and Hamilton cycles",,,,"OSU Math 1997-2","math.CO",,"  It has been shown that there is a Hamilton cycle in every connected Cayley
graph on each group G whose commutator subgroup is cyclic of prime-power order.
This paper considers connected, vertex-transitive graphs X of order at least 3
where the automorphism group of X contains a transitive subgroup G whose
commutator subgroup is cyclic of prime-power order. We show that of these
graphs, only the Petersen graph is not hamiltonian.
","[{""version"":""v1"",""created"":""Tue, 4 Feb 1997 00:00:00 GMT""}]","2016-09-07"
"math/9702227","Dave Witte","Stephen C. Locke, Dave Witte Morris","On non-Hamiltonian circulant digraphs of outdegree three",,,,"OSU Math 1997-3","math.CO",,"  We construct infinitely many connected, circulant digraphs of outdegree three
that have no hamiltonian circuit. All of our examples have an even number of
vertices, and our examples are of two types: either every vertex in the digraph
is adjacent to two diametrically opposite vertices, or every vertex is adjacent
to the vertex diametrically opposite to itself.
","[{""version"":""v1"",""created"":""Tue, 4 Feb 1997 00:00:00 GMT""}]","2013-06-25"
"nucl-th/9702008","Joachim Reinhardt","A. Mishra (1), P.K. Panda (1), S. Schramm (2), J. Reinhardt(1), W.
  Greiner(1) ((1) Institut f\""ur Theoretische Physik, J.W. Goethe
  Universit\""at, Frankfurt am Main, Germany; (2) Gesellschaft f\""ur
  Schwerionenforschung, Darmstadt, Germany)","Structure of the Vacuum in Nuclear Matter - A Nonperturbative Approach","26 pages including 5 eps files, uses revtex style; PACS number:
  21.65.+f,21.30.+y","Phys.Rev.C56:1380-1388,1997","10.1103/PhysRevC.56.1380",,"nucl-th hep-ph",,"  We compute the vacuum polarisation correction to the binding energy of
nuclear matter in the Walecka model using a nonperturbative approach. We first
study such a contribution as arising from a ground state structure with
baryon-antibaryon condensates. This yields the same results as obtained through
the relativistic Hartree approximation of summing tadpole diagrams for the
baryon propagator. Such a vacuum is then generalized to include quantum effects
from meson fields through scalar-meson condensates. The method is applied to
study properties of nuclear matter and leads to a softer equation of state
giving a lower value of the incompressibility than would be reached without
quantum effects. The density dependent effective sigma mass is also calculated
including such vacuum polarisation effects.
","[{""version"":""v1"",""created"":""Tue, 4 Feb 1997 10:28:30 GMT""}]","2008-11-26"
"physics/9702004","Roelof Bijker","R. Lemus, F. Perez-Bernal, A. Frank, R. Bijker and J.M. Arias,
  (ICN/UNAM, Mexico and Sevilla, Spain)","Comment on ``Boson-realization model for the vibrational spectra of
  tetrahedral molecules''","9 pages Revtex, submitted February 1997","Phys. Rev. A 56 (1997) 4337-4340","10.1103/PhysRevA.56.4337",,"physics.chem-ph",,"  An algebraic model in terms of a local harmonic boson realization was
recently proposed to study molecular vibrational spectra [Zhong-Qi Ma et al.,
Phys. Rev. A 53, 2173 (1996)]. Because of the local nature of the bosons the
model has to deal with spurious degrees of freedom. An approach to eliminate
the latter from both the Hamiltonian and the basis was suggested. We show that
this procedure does not remove all spurious components from the Hamiltonian and
leads to a restricted set of interactions. We then propose a scheme in which
the physical Hamiltonian can be systematically constructed up to any order
without the need of imposing conditions on its matrix elements. In addition, we
show that this scheme corresponds to the harmonic limit of a symmetry adapted
algebraic approach based on U(2) algebras.
","[{""version"":""v1"",""created"":""Mon, 3 Feb 1997 19:50:28 GMT""}]","2009-10-30"
"q-alg/9702008","Alexander Berkovich","G. E. Andrews, A. Berkovich","A Trinomial Analogue of Bailey's Lemma and N=2 Superconformal Invariance","Reference and note added",,"10.1007/s002200050298",,"q-alg hep-th math.QA",,"  We propose and prove a trinomial version of the celebrated Bailey's lemma. As
an application we obtain new fermionic representations for characters of some
unitary as well as nonunitary models of N = 2 superconformal field theory
(SCFT). We also establish interesting relations between N = 1 and N = 2 models
of SCFT with central charges $(3/2)( 1 -{2(2 - 4\nu)^2}/{2(4\nu)})$ and $3(1 -
2/{4\nu})$. A number of new mock theta function identities are derived.
","[{""version"":""v1"",""created"":""Mon, 3 Feb 1997 23:52:50 GMT""},{""version"":""v2"",""created"":""Sun, 16 Feb 1997 02:10:53 GMT""},{""version"":""v3"",""created"":""Wed, 5 Mar 1997 23:03:48 GMT""}]","2009-10-30"
"quant-ph/9702011","Joy Christian","Jeeva Anandan, Joy Christian, and Kazimir Wanelik (Oxford)","Resource Letter GPP-1: Geometric Phases in Physics","13 pages (TeX); some new references added","Am.J.Phys. 65 (1997) 180","10.1119/1.18570",,"quant-ph hep-th",,"  This Resource Letter provides a guide to the literature on the geometric
angles and phases in classical and quantum physics. Journal articles and books
are cited for the following topics: anticipations of the geometric phase,
foundational derivations and formulations, books and review articles on the
subject, and theoretical and experimental elaborations and applications.
","[{""version"":""v1"",""created"":""Tue, 4 Feb 1997 12:02:31 GMT""},{""version"":""v2"",""created"":""Mon, 24 Mar 1997 20:12:32 GMT""}]","2009-10-30"
"quant-ph/9702012","Joy Christian","Joy Christian (Oxford)","The Plight of `I Am'","4 pages (tex); uses mtexsis.tex (included)","Metaphysical Review, vol. 3, no. 1, July 1996",,,"quant-ph",,"  This is a short metaphysical fable accentuating the conceptual difficulties
involved, and succinctly criticizing the approaches pursued since the inception
of quantum theory, in dealing with what is known collectively as `the
measurement problem.' It includes some landmark references, and has appeared in
the special issue of Metaphysical Review dedicated to Descartes on his 400th
birthday: Metaphysical Review, vol. 3, no. 1, July 1996.
","[{""version"":""v1"",""created"":""Tue, 4 Feb 1997 12:03:41 GMT""}]","2007-05-23"
