"hep-th/9702091","Stephen Pinsky","Stephen Pinsky (Ohio State University)","Wilson Loop on a Light-Cone Cylinder","7 pages, RevTex",,,,"hep-th",,"  QCD without matter and quantized on a light-cone spatial cylinder is
considered. For the gauge group SU(N) the theory has N-1 quantum mechanical
degrees of freedom, which describe the color fux that circulates around the the
spatial cylinder. In 1+1 dimensions this problem can be solved analytically. I
use the solution for SU(2) to compute the Wilson loop phase on the surface of
the cylinder and find that it is equal to g^2 area/4. This result is different
from the well known result for flat space. I argue that for SU(N) the Wilson
loop phase for a contour on a light-cone spatial cylinder is g^2(area) (N-1)/4.
The underlying reason for this result is that only the N-1 dimensional Cartan
subgroup of SU(N) is dynamical in this problem.
","[{""version"":""v1"",""created"":""Tue, 11 Feb 1997 17:16:40 GMT""}]","2007-05-23"
"hep-th/9702092","Denny Fliegner","D. Fliegner (Heidelberg U., ITP), P. Haberl (RWTH Aachen, ITP), M.G.
  Schmidt (Heidelberg U., ITP), C. Schubert (Humboldt U., Berlin)","Application of the Worldline Path Integral Method to the Calculation of
  Inverse Mass Expansions","6 pages, LaTeX. Talk given at 5th International Workshop on Software
  Engineering and Artificial Intelligence for High Energy and Nuclear Physics
  (AIHENP96), Lausanne (Switzerland), 2-6 September 1996","Nucl.Instrum.Meth. A389 (1997) 374-377","10.1016/S0168-9002(97)00136-8","HD-THEP-96/54, HUB-EP-96/57","hep-th",,"  Higher order coefficients of the inverse mass expansion of one-loop effective
actions are obtained from a one-dimensional path integral representation. For
the case of a massive scalar loop in the background of both a scalar potential
and a (non Abelian) gauge field explicit results to $O(T^5)$ in the proper time
parameter are presented.
","[{""version"":""v1"",""created"":""Tue, 11 Feb 1997 16:51:45 GMT""}]","2009-10-30"
"hep-th/9702093","A. Sagnotti","Augusto Sagnotti (Universita' di Roma ""Tor Vergata"")","Surprises in Open-String Perturbation Theory","13pages, LATEX with espcrc2, 3 eps figures Contribution to the
  Proceedings of the XXX Ahrenshoop Symposium, Buckow (Berlin), August 1996
  references added","Nucl.Phys.Proc.Suppl.56B:332-343,1997","10.1016/S0920-5632(97)00344-7","ROM2F-97/4","hep-th",,"  The perturbative analysis of models of open and closed superstrings presents
a number of surprises. For instance, variable numbers of antisymmetric tensors
ensure their consistency via generalized Green-Schwarz cancellations and a
novel type of singularity occurs in their moduli spaces. All these features are
related, in one way or another, to the presence of boundaries on the world
sheet or, equivalently, of extended objects (branes) interacting with the bulk
theory in space time. String dualities have largely widened the interest in
these models, that exhibit a wealth of generic non-perturbative features of
String Theory.
","[{""version"":""v1"",""created"":""Tue, 11 Feb 1997 20:33:10 GMT""},{""version"":""v2"",""created"":""Wed, 12 Feb 1997 18:09:21 GMT""}]","2009-10-30"
"hep-th/9702094","Michael E. Peskin","Michael E. Peskin","Duality in Supersymmetric Yang-Mills Theory","80 pages, latex + 12 figures, TASI96",,,"SLAC-PUB-7393","hep-th hep-ph",,"  These lectures provide an introduction to the behavior of strongly-coupled
supersymmetric gauge theories. After a discussion of the effective Lagrangian
in nonsupersymmetric and supersymmetric field theories, I analyze the
qualitative behavior of the simplest illustrative models. These include
supersymmetric QCD for $N_f < N_c$, in which the superpotential is generated
nonperturbatively, N=2 SU(2) Yang-Mills theory (the Seiberg-Witten model), in
which the nonperturbative behavior of the effective coupling is described
geometrically, and supersymmetric QCD for N_f large, in which the theory
illustrates a non-Abelian generalization of electric-magnetic duality.
[Lectures presented at the 1996 TASI Summer School, to appear in the
proceedings.]
","[{""version"":""v1"",""created"":""Tue, 11 Feb 1997 20:24:47 GMT""}]","2007-05-23"
"hep-th/9702095","Gerhard Weigt","Uwe M\""uller and Gerhard Weigt","Analytical Solution of the SL(2,R)/U(1) WZNW Black Hole Model","10 pages, LaTeX, amsfonts; one reference added","Phys.Lett. B400 (1997) 21-26","10.1016/S0370-2693(97)00339-0","DESY 96-221","hep-th",,"  The gauged SL(2,R)/U(1) Wess-Zumino-Novikov-Witten (WZNW) model is
classically an integrable conformal field theory. We have found a Lax pair
representation for the non-linear equations of motion, and a B""acklund
transformation. A second-order differential equation of the Gelfand-Dikii type
defines the Poisson bracket structure of the theory, and its fundamental
solutions describe the general solution of the WZNW model as well. The physical
and free fields are related by non-local transformations. The (anti-)chiral
component of the energy-momentum tensor which factorizes into conserved
quantities satisfying a non-linear algebra characteristic for parafermions
assumes the expected canonical free field form. So the black hole model seems
to be prepared for an exact canonical quantization.
","[{""version"":""v1"",""created"":""Tue, 11 Feb 1997 21:30:46 GMT""},{""version"":""v2"",""created"":""Thu, 13 Feb 1997 23:08:07 GMT""}]","2009-10-30"
"hep-th/9702096",,"Michael Danos","Ward - Takahashi identities and Noether's theorem in quantum field
  theory","14 pages, latex","Found.Phys. 27 (1997) 995-1009","10.1007/BF02551149",,"hep-th",,"  A gap in the mathematical logic in derivations in quantum field theory arises
as consequence of variation before quantization. To close this gap the present
paper introduces a mathematically rigorous variational calculus for operator
fields. Using quantization before variation it is demonstrated that the
so-called naive results are correct; in particular both Noether's theorem and
the Ward-Takahashi identities retain full validity in quantum field theory.
","[{""version"":""v1"",""created"":""Wed, 12 Feb 1997 01:44:31 GMT""}]","2016-09-06"
"hep-th/9702097","Tomohiro Inagaki","I. L. Buchbinder, T. Inagaki, S. D. Odintsov","Supersymmetric Nambu-Jona-Lasinio Model in an External Gravitational
  Field","8 pages, Latex, epic.sty and eepic.sty are used","Mod.Phys.Lett.A12:2271-2278,1997","10.1142/S021773239700234X",,"hep-th",,"  We investigate the effect of an external gravitational fields to the chiral
symmetry breaking in the SUSY (supersymmetric) NJL (Nambu-Jona-Lasinio) model
non-minimally interacting with external supergravity. Evaluating the effective
potential in the leading order of the $1/N_{c}$-expansion and in the linear
curvature approximation it is found the possibility of the chiral symmetry
breaking in the SUSY NJL model in an external gravitational fields. In the
broken phase the dynamically generated mass is analytically and numerically
calculated.
","[{""version"":""v1"",""created"":""Wed, 12 Feb 1997 02:23:41 GMT""}]","2009-09-17"
"hep-th/9702098",,"Massimo Bianchi (Universita' di Roma ``Tor Vergata'')","Type I Superstrings without D-branes","11 pages, latex, no figures; contribution to the Proceedings of the
  XII Italian Conference on General Relativity and Gravitational Physics, Rome,
  September 1996",,,"ROM2F-97-6","hep-th",,"  Notwithstanding the central role of D-branes in many recently proposed string
dualities, several interesting type I vacua have been found without resorting
directly to D-brane technology. In this talk, we analyze a three-generation
SO(8)xU(12) chiral type I model with N=1 supersymmetry in D=4. It descends from
the type IIB compactification on the Z orbifold and requires only Neumann
boundary conditions, i.e. only the ubiquitous D9-branes (pan-branes). We also
discuss a large class of 6D type I vacua that display rich patterns of
Chan-Paton symmetry breaking/enhancement and various numbers of tensor
multiplets. Finally, we briefly address issues raised by the conjectured
heterotic - type I duality and by the relation between type I vacua and
compactifications of the putative F-theory.
","[{""version"":""v1"",""created"":""Wed, 12 Feb 1997 13:25:25 GMT""}]","2007-05-23"
"hep-th/9702099","Sanjaye Kumar Ramgoolam","Z. Guralnik and S. Ramgoolam","Torons and D-Brane Bound States","13 pages, harvmac big","Nucl.Phys. B499 (1997) 241-252","10.1016/S0550-3213(97)00286-1","PUPT-1683","hep-th",,"  We interpret instantons on a torus with twisted boundary conditions, in terms
of bound states of branes. The interplay between the SU(N) and U(1) parts of
the U(N) theory of N 4-branes allows the construction of a variety of bound
states. The SU(N) and U(1) parts can contribute fractional amounts to the total
instanton number which is integral. The geometry of non-self intersecting
two-cycles in $T^4$ sheds some light on a number of properties of these
solutions.
","[{""version"":""v1"",""created"":""Wed, 12 Feb 1997 00:58:18 GMT""},{""version"":""v2"",""created"":""Thu, 13 Feb 1997 01:18:54 GMT""}]","2016-09-06"
"nucl-ex/9702001",,"J.A. Templon, B.A. Raue, L.C. Bland, K. Murphy, D.S. Carman, G.M.
  Huber, B.C. Markham, D.W. Miller, P. Schwandt, - (IUCF) - D.J. Millener (BNL)","Study of continuum nuclear structure of 12C via (p,p'X) at intermediate
  energies","12 pages, 4 figures, elsart style files, submitted to Physics Letters
  B","Phys.Lett.B413:253-259,1997","10.1016/S0370-2693(97)01149-0",,"nucl-ex nucl-th",,"  The inclusive 12C(p,p') and exclusive 12C(p,p'X) reactions have been studied
with a beam energy of 156 MeV and for X = p and alpha. The study focuses on the
(p,p'X) reaction mechanism and on the structure of 12C just above the
particle-emission threshold, 14 < E_x < 28 MeV. Cross sections were
simultaneously measured for all three reactions. The exclusive data were
analyzed by making multiple-peak fits of the spectra and by Legendre-polynomial
fits of the angular correlations. Multiple-peak fits were also made of the
inclusive spectra. The resultant cross sections were compared to theoretical
calculations. An analysis of the results shows that this region of E_x consists
predominantly of resonant excitations, in contradiction to the findings of
previous analyses.
","[{""version"":""v1"",""created"":""Tue, 11 Feb 1997 17:58:28 GMT""}]","2014-11-18"
"nucl-th/9702027","Wojciech Broniowski","Thomas D. Cohen and Wojciech Broniowski","Fixed-Velocity Chiral Sum Rules for Nuclear Matter","RevTeX, 15 pages, 2 figures",,,"U.MD PP 97-077 and INP 1753/PH","nucl-th hep-ph",,"  Infinite sets of sum rules involving the excitations of infinite nuclear
matter are derived using only completeness, the current algebra implicit in
QCD, and relativistic covariance. The sum rules can be used for
isospin-asymmetric nuclear matter, including neutron matter. They relate the
chiral condensate and the isospin density to weighted sums over states with
fixed velocity relative to the nuclear matter ground state.
","[{""version"":""v1"",""created"":""Tue, 11 Feb 1997 18:30:21 GMT""}]","2007-05-23"
"nucl-th/9702028","Christian Fuchs","C. Fuchs, L. Sehn, Amand Faessler, D.S. Kosov, V.S. Uma Maheswari and
  Z. Wang","Treatment of baryonic resonances in the RQMD approach including
  scalar-vector mean fields","8 pages Latex, 4 PS-figures; To appear in the proceedings of the 25th
  International Hirschegg Workshop on Properties of Nuclei and Nuclear
  Excitations, Jan 13-18, 1997 ""QCD Phase Transitions""",,,,"nucl-th",,"  In the relativistic Quantum Molecular Dynamics (RQMD) approach baryons are
described within the framework of covariant hamilton constraint dynamics. The
inclusion of a relativistic mean field results in a quasiparticle picture for
the baryons. This requires to distinguish between canonical and kinetic
variables of the particles. As resonances we include the $\Delta$(1232) and the
$N^*$(1440) resonance. The resonance masses are distributed according
Breit-Wigner functions. However, the scalar self energy leads to a shift in the
masses and introduces an additional medium dependence. Consequences of this
description on resonance and pion dynamics are discussed.
","[{""version"":""v1"",""created"":""Wed, 12 Feb 1997 08:50:02 GMT""}]","2007-05-23"
"nucl-th/9702029","Helmut Hofmann","H.Hofmann and D. Kiderlen","A self-consistent treatment of the dynamics of stable and unstable
  collective modes","26 pages, Latex, 7 Postscript figures; submitted to PRE; e-mail:
  hhofmann@physik.tu-muenchen.de www home page:
  http://www.physik.tu-muenchen.de/tumphy/e/T36/hofmann.html",,,,"nucl-th",,"  We address the dynamics of damped collective modes in terms of first and
second moments. The modes are introduced in a self-consistent fashion with the
help of a suitable application of linear response theory. Quantum effects in
the fluctuations are governed by diffusion coefficients D_{\mu\nu}. The latter
are obtained through a fluctuation dissipation theorem generalized to allow for
a treatment of unstable modes. Numerical evaluations of the D_{\mu\nu} are
presented. We discuss briefly how this picture may be used to describe global
motion within a locally harmonic approximation.
","[{""version"":""v1"",""created"":""Wed, 12 Feb 1997 13:17:12 GMT""}]","2007-05-23"
"nucl-th/9702030",,"S.S. Kamalov, J.A. Oller, E. Oset and M.J. Vicente-Vacas","Meson Exchange Currents in Kaon Scattering on the Lightest Nuclei","revtex, 16 pages, 6 figures","Phys.Rev.C55:2985-2990,1997","10.1103/PhysRevC.55.2985",,"nucl-th",,"  The K^+ scattering on the lightest nuclei, d, 3He and 4He is studied in the
framework of multiple scattering theory. Effects from MEC tied to the
K^+N-->KNpi reaction are evaluated. We found that at momentum transfers Q^2<0.5
(GeV/c)^2 contributions from MEC are much smaller than kaon rescattering
corrections. This makes the conventional multiple scattering picture a reliable
tool to study these reactions in this kinematical domain and to extract the
K^+n scattering amplitude from the K^+d data. At larger transferred momentum
MEC can become more relevant.
","[{""version"":""v1"",""created"":""Wed, 12 Feb 1997 14:58:43 GMT""}]","2008-11-26"
"patt-sol/9702002","Jorge Vinals","Peilong Chen and Jorge Vinals","Amplitude equations and pattern selection in Faraday waves","12 pages, 1 figure, Revtex","Phys. Rev. Lett. 79, 2670 (1997).","10.1103/PhysRevLett.79.2670",,"patt-sol nlin.PS",,"  We present a systematic nonlinear theory of pattern selection for parametric
surface waves (Faraday waves), not restricted to fluids of low viscosity. A
standing wave amplitude equation is derived from the Navier-Stokes equations
that is of gradient form. The associated Lyapunov function is calculated for
different regular patterns to determine the selected pattern near threshold.
For fluids of large viscosity, the selected wave pattern consists of parallel
stripes. At lower viscosity, patterns of square symmetry are obtained in the
capillary regime (large frequencies). At lower frequencies (the mixed
gravity-capillary regime), a sequence of six-fold (hexagonal), eight-fold, ...
patterns are predicted. The regions of stability of the various patterns are in
quantitative agreement with recent experiments conducted in large aspect ratio
systems.
","[{""version"":""v1"",""created"":""Tue, 11 Feb 1997 18:07:37 GMT""}]","2009-10-30"
"physics/9702010","Marian Fecko","Marian Fecko (Bratislava)","""Falling cat"" connections and the momentum map","10 pages, no figures, AmsTeX","J.Math.Phys. 36 (12) 6709-6719 (1995)","10.1063/1.531183",,"math-ph dg-ga math.DG math.MP",,"  We consider a standard symplectic dynamics on TM generated by a natural
Lagrangian L. The Lagrangian is assumed to be invariant with respect to the
action TR_g of a Lie group G lifted from the free and proper action R_g of G on
M. It is shown that under these conditions a connection on principal bundle pi:
M \rightarrow M/G can be constructed based on the momentum map corresponding to
the action TR_g. The horizontal motion is shown to be in physical terms the one
with all the momenta corresponding to the symmetry vanishing. A simple explicit
formula for the connection form is given. For the special case of the standard
action of G = SO(3) on M = R^3 x ... x R^3 corresponding to a rigid rotation of
a N-particle system the formula obtained earlier by Guichardet and
Shapere/Wilczek is reproduced.
","[{""version"":""v1"",""created"":""Wed, 12 Feb 1997 10:39:28 GMT""}]","2009-10-30"
"quant-ph/9702028","Peter Hoyer","Peter Hoyer (Odense University)","Efficient Quantum Transforms","30 pages, LaTeX2e, 7 figures included",,,,"quant-ph",,"  Quantum mechanics requires the operation of quantum computers to be unitary,
and thus makes it important to have general techniques for developing fast
quantum algorithms for computing unitary transforms. A quantum routine for
computing a generalized Kronecker product is given. Applications include
re-development of the networks for computing the Walsh-Hadamard and the quantum
Fourier transform. New networks for two wavelet transforms are given. Quantum
computation of Fourier transforms for non-Abelian groups is defined. A slightly
relaxed definition is shown to simplify the analysis and the networks that
computes the transforms. Efficient networks for computing such transforms for a
class of metacyclic groups are introduced. A novel network for computing a
Fourier transform for a group used in quantum error-correction is also given.
","[{""version"":""v1"",""created"":""Wed, 12 Feb 1997 00:52:17 GMT""}]","2007-05-23"
"quant-ph/9702029","Daniel Gottesman","Daniel Gottesman","A Theory of Fault-Tolerant Quantum Computation","30 pages, REVTeX, universal swapping operation added to allow
  universal computation on any stabilizer code","Phys.Rev.A57:127,1998","10.1103/PhysRevA.57.127","CALT-68-2100, QUIC-97-004","quant-ph",,"  In order to use quantum error-correcting codes to actually improve the
performance of a quantum computer, it is necessary to be able to perform
operations fault-tolerantly on encoded states. I present a general theory of
fault-tolerant operations based on symmetries of the code stabilizer. This
allows a straightforward determination of which operations can be performed
fault-tolerantly on a given code. I demonstrate that fault-tolerant universal
computation is possible for any stabilizer code. I discuss a number of examples
in more detail, including the five-qubit code.
","[{""version"":""v1"",""created"":""Wed, 12 Feb 1997 00:48:43 GMT""},{""version"":""v2"",""created"":""Tue, 18 Feb 1997 01:39:22 GMT""}]","2011-07-19"
