"cond-mat/9702102","Michel Gingras- Phys364","G. Ayton, M.J.P. Gingras, and G. N. Patey","Ferroelectric and Dipolar Glass Phases of Non-Crystalline Systems","25 pages (LATEX, no macros). 11 POSTSCRIPT figures enclosed.
  Submitted to Phisical Review E. Contact: gingras@astro.uwaterloo.ca","Phys.Rev. E, {56}, 562 (1997).","10.1103/PhysRevE.56.562",,"cond-mat.dis-nn cond-mat.stat-mech",,"  In a recent letter [Phys. Rev. Lett. {\bf 75}, 2360 (1996)] we briefly
discussed the existence and nature of ferroelectric order in positionally
disordered dipolar materials. Here we report further results and give a
complete description of our work. Simulations of randomly frozen and
dynamically disordered dipolar soft spheres are used to study ferroelectric
ordering in non-crystalline systems. We also give a physical interpretation of
the simulation results in terms of short- and long-range interactions. Cases
where the dipole moment has 1, 2, and 3 components (Ising, XY and XYZ models,
respectively) are considered. It is found that the Ising model displays
ferroelectric phases in frozen amorphous systems, while the XY and XYZ models
form dipolar glass phases at low temperatures. In the dynamically disordered
model the equations of motion are decoupled such that particle translation is
completely independent of the dipolar forces. These systems spontaneously
develop long-range ferroelectric order at nonzero temperature despite the
absence of any fined-tuned short-range spatial correlations favoring dipolar
order. Furthermore, since this is a nonequilibrium model we find that the
paraelectric to ferroelectric transition depends on the particle mass. For the
XY and XYZ models, the critical temperatures extrapolate to zero as the mass of
the particle becomes infinite, whereas, for the Ising model the critical
temperature is almost independent of mass and coincides with the ferroelectric
transition found for the randomly frozen system at the same density. Thus in
the infinite mass limit the results of the frozen amorphous systems are
recovered.
","[{""version"":""v1"",""created"":""Tue, 11 Feb 1997 22:27:13 GMT""}]","2009-10-30"
"cond-mat/9702103","Naoto Nagaosa","Naoto Nagaosa and Patrick A. Lee","Kondo Effect in High-T_c Cuprates","REVTEX",,"10.1103/PhysRevLett.79.3755",,"cond-mat",,"  We study the Kondo effect due to the nonmagnetic impurity, e.g., Zn, in
high-T_c cuprates based on the spin-change separated state. In the optimal or
overdoped case with the Kondo screening, the residual resistivity is dominated
by the spinons while the T-dependent part determined by the holons. This gives
$\rho(T) = { {4 \hbar} /{e^2}} { { n_{imp.}} /{(1-x)}} + {{\alpha T} / x}$ (x:
hole concentration,$n_{imp.}$: impurity concentration, $\alpha$: constant ),
which is in agreement with experiments. In the underdoped region with the
pseudo spin gap, an SU(2) formulation predicts that the holon phase shift is
related to the formation of the local spin moment, and hence the residual
resistivity is given by $\rho_{res.} = { {4 \hbar} /{ e^2}} { { n_{imp.}}/{x}}
$, which is also consistent with the experiments. The magnetic impurity case,
e.g., Ni, is also discussed.
","[{""version"":""v1"",""created"":""Wed, 12 Feb 1997 05:36:53 GMT""},{""version"":""v2"",""created"":""Tue, 25 Feb 1997 04:11:13 GMT""}]","2016-08-31"
"cond-mat/9702104","T. K. Ng","T. K. Ng and C. M. Varma","Tilting instability and other anomalies in the flux-lattice in some
  magnetic superconductors","12 pages, Latex file, no figure",,"10.1103/PhysRevLett.78.3745",,"cond-mat.supr-con",,"  The flux-line lattice in the compound $ErNi_2B_2C$, which has a tendency to
ferromagnetic order in the a-b plane is studied with external magnetic field
direction close to the c-axis. We show the existence of an instability where
the direction of flux-lines spontaneously tilts away from that of the applied
field near the onset of ferromagnetic order. The enhanced fluctuations in the
flux lattice and the square flux lattice recently observed are explained and
further experiments suggested.
","[{""version"":""v1"",""created"":""Wed, 12 Feb 1997 05:54:09 GMT""}]","2009-10-30"
"cond-mat/9702105","Oleg Sushkov","W. McRae and O. Sushkov","Thermodynamic Properties of 1d Heisenberg Model. Magnetic Moment of
  Spinon","LaTeX 6 pages",,,,"cond-mat",,"  The one dimensional spin 1/2 Heisenberg antiferromagnet is considered using a
simple quasiparticle picture - an interacting Fermi gas of kinks. Using this
picture the low temperature heat capacity, and the magnetic susceptibility with
logarithmic field and temperature corrections are derived. The results obtained
are in agreement with previous computations and conformal field theory
calculations. It is hypothesised that the magnetic moment of the kink
$g_{kink}=\sqrt{2}g_{electron}$.
","[{""version"":""v1"",""created"":""Wed, 12 Feb 1997 06:35:19 GMT""}]","2007-05-23"
"cond-mat/9702106","Sarkis Dallakian","A.E. Alahverdian, N.S. Ananikian and S.K. Dallakian","Singularites at a Dense Set of Temperature in Husimi Tree","ps file, 10 pages",,"10.1103/PhysRevE.57.2452",,"cond-mat",,"  We investigate complex temperature singularities of the three-site
interacting Ising model on the Husimi tree in the presentce of magnetic field.
We show that at certain magnetic field these singularities lie at a dense set
and as a consequence the phase transition condensation take place.
","[{""version"":""v1"",""created"":""Wed, 12 Feb 1997 10:13:55 GMT""}]","2009-10-30"
"cond-mat/9702107","Rokni Michal","Michal Rokni and Y. Levinson","Level broadening effects in quantum kinetic equations: Hot luminescence
  from a quantum wire near the optical phonon emission threshold","35 pages, REVTeX, with 6 figures",,"10.1103/PhysRevB.56.3952",,"cond-mat",,"  A recipe for the generalization of the Boltzmann equation to a quantum
kinetic equation is given for cases in which only level shift and broadening
are considered, while coherence phenomena can be neglected. We also consider a
specific problem: Hot luminescence from a quantum wire near the threshold for
optical phonon emission. The problem is first discussed within the framework of
the Boltzmann equation. After pointing out the failure of this description, the
Boltzmann equations are generalized to a set of quantum kinetic equations,
which in turn are solved in order to describe the luminescence spectra.
","[{""version"":""v1"",""created"":""Wed, 12 Feb 1997 11:37:20 GMT""}]","2009-10-30"
"cond-mat/9702108","Serge Galam","Serge Galam and Alain Mauger (LMDH, Universite Paris 6)","Reply to the comment ""Universal Formulae for Percolation Thresholds""","4 pages, latex","Phys. Rev. E 55, 1230 (1997)","10.1103/PhysRevE.55.1230",,"cond-mat.dis-nn cond-mat.stat-mech",,"  In a recent paper, we have reported a universal power law for both site and
bond percolation thresholds for any lattice of cubic symmetry. Extension to
anisotropic lattices is discussed.
","[{""version"":""v1"",""created"":""Wed, 12 Feb 1997 13:30:44 GMT""}]","2009-10-30"
"cond-mat/9702109","Maria Markosova","M. Markosova (Academay of Sciences, Slovakia), M. H. Jensen and K. B.
  Lauritsen (Niels Bohr Inst, Denmark), and K. Sneppen (NORDITA, Denmark)","Onset of criticality and transport in a driven diffusive system","4 latex/revtex pages; 4 figures","Phys. Rev. E 55, R2085-R2088 (1997).","10.1103/PhysRevE.55.R2085",,"cond-mat.stat-mech",,"  We study transport properties in a slowly driven diffusive system where the
transport is externally controlled by a parameter $p$. Three types of behavior
are found: For $p<p'$ the system is not conducting at all. For intermediate $p$
a finite fraction of the external excitations propagate through the system.
Third, in the regime $p>p_c$ the system becomes completely conducting. For all
$p>p'$ the system exhibits self-organized critical behavior. In the middle of
this regime, at $p_c$, the system undergoes a continuous phase transition
described by critical exponents.
","[{""version"":""v1"",""created"":""Wed, 12 Feb 1997 13:57:47 GMT""}]","2009-10-30"
"cond-mat/9702111","Gilles Poirot","Gilles Poirot (Ecole Polytechnique, France)","Mean Green's function of the Anderson model at weak disorder with an
  infra-red cut-off","31 pages, 7 eps figures, LaTeX document using AMS symbols
  (amssym.def, amssym.tex)",,,,"cond-mat.dis-nn",,"  We develop a polymer expansion with large/small field conditions for the mean
resolvent of a weakly disordered system. Then we show that we can apply our
result to a two-dimensional model, for energies outside the unperturbed
spectrum or in the free spectrum provided the potential has an infra-red
cut-off. This leads to an asymptotic expansion for the density of states. We
believe this is an important first step towards a rigourous analysis of the
density of states in the free spectrum of a random Schr\""odinger operator at
weak disorder.
","[{""version"":""v1"",""created"":""Wed, 12 Feb 1997 14:43:39 GMT""}]","2008-02-03"
"funct-an/9702006","ChiKeung Ng","Chi-Keung Ng","Morphisms of Multiplicative Unitaries","21 pages, Latex; to appear in the Journal of Operator Theory",,,,"funct-an math.OA math.QA q-alg",,"  In this paper, we will give a natural definition for morphisms between
multiplicative unitaries. We will then discuss some equivalences of this
definition and some interesting properties of them. Moreover, we will define
normal sub-multiplicative unitaries for multiplicative unitaries of discrete
type and prove an imprimitivity type theorem for discrete multiplicative
unitaries.
","[{""version"":""v1"",""created"":""Tue, 11 Feb 1997 21:07:33 GMT""}]","2008-02-03"
"funct-an/9702007","Michael Vinogradov","Rostyslav O. Hryniv (Moscow State University, Russia)","On the problem of semiinfinite beam oscillation with internal damping","9 pages, AMSTeX, to appear in Proceedings of the Seventh Crimean
  Autumn Mathematical School-Simposium on Spectral and Evolutionary Problems
  (September, 18--29, 1996, Sevastopol, Ukraine)",,,,"funct-an math.FA",,"  We study the Cauchy problem for the equation of the form $$ \ddot{u}(t) +
(\aa A + B)\dot{u}(t) + (A+G)u(t) = 0,\tag* $$ where $A$, $B$, and $G$ are \o s
in a Hilbert space $\Cal H$ with $A$ selfadjoint, $\sigma(A)=[0,\infty)$,
$B\ge0$ bounded, and $G$ symmetric and $A$-subordinate in a certain sense.
Spectral properties of the correspondent operator pencil
  $L(\lambda) := \lambda^2I + \lambda (\alpha A + B) + A + G$ are studied, and
existence and uniqueness of generalized and classical solutions of the Cauchy
problem are proved. Equations of the type (*) include, e.g., an abstract model
for the problem of semiinfinite beam oscillations with internal damping.
","[{""version"":""v1"",""created"":""Wed, 12 Feb 1997 11:22:09 GMT""}]","2016-08-31"
"funct-an/9702008","Michael Vinogradov","N. A. Kachanovsky (NTUU ""KPI"")","Dual $n_1$-Appell-like Systems in Infinite-Dimensional Analysis","5 pages, AMSTeX, to appear in Proceedings of the Seventh Crimean
  Autumn Mathematical School-Simposium on Spectral and Evolutionary Problems
  (September, 18--29, 1996, Sevastopol, Ukraine)",,,,"funct-an math.FA math.SP",,"  We introduce and study dual $n_1$-Appell-like systems which are the simple
generalization of generalized dual Appell systems in Infinite-Dimensional
Analysis (IDA). We study connected with these systems objects of IDA: the
analogues of Kondratiev spaces, $S$-transform, characterization theorems etc.
The results we obtained are useful to application in the theory of probability.
","[{""version"":""v1"",""created"":""Wed, 12 Feb 1997 11:23:02 GMT""}]","2008-02-03"
"funct-an/9702009","Michael Vinogradov","O. V. Solonoukha (Kiev, NTUU""KPI"")","On Variational Inequalities with Multivalued Operators with Semi-Bounded
  Variation","5 pages, AMSTeX, to appear in Proceedings of the Seventh Crimean
  Autumn Mathematical School-Simposium on Spectral and Evolutionary Problems
  (September, 18--29, 1996, Sevastopol, Ukraine)",,,,"funct-an math.FA math.SP",,"  In this paper we explore solvability of steady-state variational inequalities
with multivalued operators. Moreover, we are studying the connections between
the class of radially semi-continuous operators with semi-bounded variation and
classes of pseudo-monotone and monotone mappings, and some properties of this
operators.
","[{""version"":""v1"",""created"":""Wed, 12 Feb 1997 11:24:27 GMT""}]","2008-02-03"
"funct-an/9702010","Michael Vinogradov","I. Ya. Spectorsky","Stochastic equations and evolution families in the space of formal
  mappings","4 pages, AMSTeX, to appear in Proceedings of the Seventh Crimean
  Autumn Mathematical School-Simposium on Spectral and Evolutionary Problems
  (September, 18--29, 1996, Sevastopol, Ukraine)",,,,"funct-an math.FA math.PR",,"  We consider stochastic equations for the class of formal mappings. Existence
and uniqueness of solution, as well as evolution property are proved.
","[{""version"":""v1"",""created"":""Wed, 12 Feb 1997 11:24:57 GMT""}]","2008-02-03"
"funct-an/9702011","Michael Vinogradov","A. G. Us (Kiev, Institute of Mathematics)","Symmetrical Extensions of Dirichlet Operators","4 pages, AMSTeX, to appear in Proceedings of the Seventh Crimean
  Autumn Mathematical School-Simposium on Spectral and Evolutionary Problems
  (September, 18--29, 1996, Sevastopol, Ukraine)",,,,"funct-an math.FA math.SP",,"  There is constructed and considered the extension of classical Diriclet
operator corresponding to uniformly log-concave measure in the space of
symmetric differential forms. Sufficient conditions for its essential
self-adjointness in one-dimensional case as well as for the same of its
""sypersymmetric"" part in general situations are given.
","[{""version"":""v1"",""created"":""Wed, 12 Feb 1997 11:25:26 GMT""}]","2008-02-03"
"funct-an/9702012","Michael Vinogradov","A. S. Pechentsov, A. Yu. Popov","The asymptotical behavior of spectral function of one family of
  differential operators","5 pages, AMSTeX, to appear in Proceedings of the Seventh Crimean
  Autumn Mathematical School-Simposium on Spectral and Evolutionary Problems
  (September, 18-29, 1996, Sevastopol, Ukraine)",,,,"funct-an math.FA math.SP",,"  Is considered the asymptotical behavior of spectral function $\rho(\lambda,
\epsilon),\epsilon > 0$, of one family of self adjoint differential operators
of second order, defined in space $L_2[0,+\infty)$ with potentials, depending
on $\epsilon$. Are given evaluations for the derivative of spectral function
for negative $\lambda$ and is proved the weak convergence of $\rho'(\lambda,
\epsilon)$ to $\rho'(\lambda, 0)$ with $\epsilon \to +0$.
","[{""version"":""v1"",""created"":""Wed, 12 Feb 1997 11:23:59 GMT""}]","2008-02-03"
"gr-qc/9702022","Robert Manuel Wald","Robert M. Wald","Black Holes and Thermodynamics","26 pages, plain LaTeX; to appear in the proceedings of the Symposium
  on Black Holes and Relativistic Stars (in honor of S. Chandrasekhar),
  December 14-15, 1996",,,,"gr-qc hep-th",,"  We review the remarkable relationship between the laws of black hole
mechanics and the ordinary laws of thermodynamics. It is emphasized that - in
analogy with the laws of thermodynamics - the validity the laws of black hole
mechanics does not appear to depend upon the details of the underlying
dynamical theory (i.e., upon the particular field equations of general
relativity). It also is emphasized that a number of unresolved issues arise in
``ordinary thermodynamics'' in the context of general relativity. Thus, a
deeper understanding of the relationship between black holes and thermodynamics
may provide us with an opportunity not only to gain a better understanding of
the nature of black holes in quantum gravity, but also to better understand
some aspects of the fundamental nature of thermodynamics itself.
","[{""version"":""v1"",""created"":""Tue, 11 Feb 1997 23:02:27 GMT""}]","2007-05-23"
"gr-qc/9702023","T. P. Singh","T. P. Singh","Some comments on the nature of initial data in spherical collapse","Latex file, 6 pages",,,,"gr-qc",,"  Various authors have shown the occurence of naked singularities and black
holes in the spherical gravitational collapse of inhomogeneous dust. In a
recent preprint, Antia has criticised a statement in a paper by Jhingan, Joshi
and Singh on dust collapse. We show that his criticism is invalid. Antia shows
that in Eulerian coordinates a series expansion for the density of a collapsing
Newtonian fluid can have only even powers. However, he has overlooked the fact
that Jhingan et al. have actually used Lagrangian (comoving) coordinates, and
not Eulerian coordinates. As we show, in Lagrangian coordinates there is no
restriction that the density have only even powers and hence his criticism is
invalid. We also point out that an earlier claim by Antia on the instability of
strong naked singularities in dust collapse is not supported by any concrete
analysis, and is hence incorrect.
","[{""version"":""v1"",""created"":""Wed, 12 Feb 1997 10:57:14 GMT""}]","2007-05-23"
"hep-ph/9702304","D. R. T. Jones","P.M. Ferreira, I. Jack, and D.R.T. Jones","Large-N supersymmetric beta-functions","9 pages, tex, five figures. Uses harvmac and epsf. Revised to include
  a discussion of higher loop DRED ambiguities. Some references added, and
  notation clarified","Phys.Lett. B399 (1997) 258-262","10.1016/S0370-2693(97)00291-8","LTH 390","hep-ph hep-th",,"  We present calculations of the leading and O(1/N) terms in a large-N
expansion of the \beta-functions for various supersymmetric theories: a
Wess-Zumino model, supersymmetric QED and a non-abelian supersymmetric gauge
theory. In all cases N is the number of a class of the chiral superfields in
the theory.
","[{""version"":""v1"",""created"":""Tue, 11 Feb 1997 16:54:15 GMT""},{""version"":""v2"",""created"":""Thu, 6 Mar 1997 16:44:30 GMT""}]","2009-10-30"
"hep-ph/9702305",,"K.Whisnant, Jin Min Yang, Bing-Lin Young, and X.Zhang","Dimension-six CP-conserving operators of the third-family quarks and
  their effects on collider observables","25 pages","Phys.Rev.D56:467-478,1997","10.1103/PhysRevD.56.467","AMES-HET-97-1","hep-ph",,"  We list all possible dimension-six CP-conserving $SU_c(3)\times SU_L(2)
\times U_Y(1)$ invariant operators involving the third-family quarks which
could be generated by new physics at a higher scale. Expressions for these
operators after electroweak gauge symmetry breaking and the induced effective
couplings $Wt\bar b$, $Xb\bar b$ and $Xt\bar t$ $( X=Z,\gamma,g,H)$ are
presented. Analytic expressions for the tree level contributions of all these
operators to the observables $R_b$ and $A^b_{FB}$ at LEP I,
$\sigma(e^+e^-\rightarrow b\bar b)$ and $A^b_{FB}$ at LEP II,
$\sigma(e^+e^-\rightarrow t\bar t)$ and $A_{FB}^t$ at the NLC, as well as
$\sigma(p\bar p\rightarrow t\bar b+X)$ at the Tevatron upgrade, are provided.
The effects of these operators on different electroweak observables are
discussed and numerical examples presented. Numerical analyses show that in the
coupling region allowed by $R_b$ and $A^b_{FB}$ at LEP I, some of the new
physics operators can still have significant contributions at LEP II, the
Tevatron and the NLC.
","[{""version"":""v1"",""created"":""Tue, 11 Feb 1997 18:51:35 GMT""}]","2009-07-09"
"hep-ph/9702306","Raman Sundrum","Raman Sundrum (Boston University)","Hadronic String from Confinement","16 pages, LateX",,,"BUHEP-97-4","hep-ph hep-th",,"  The existence of hadronic string is derived as a consequence of confinement
in QCD. A state of ``stretched glue'', created by a Polyakov loop operator, is
shown to have translational zero-modes which are stringy degrees of freedom.
These modes are described by an effective string theory, valid for world-
sheets which are locally flat on length scales of order $\Lambda_{QCD}^{-1}$,
the dominant behavior being given by the Nambu-Goto action. In a subsequent
paper, these effective strings will be shown to emerge in mesons stretched by
their orbital angular momentum, thereby deriving some aspects of Regge
phenomenology directly from QCD and confinement.
","[{""version"":""v1"",""created"":""Tue, 11 Feb 1997 22:47:58 GMT""}]","2007-05-23"
"hep-ph/9702307","Borzumati Francesca","Francesca M. Borzumati","On the Minimal Messenger Model","29 pages, LaTeX file, fbsty.sty, 8 figures",,,"WIS-96/50/Dec.-PH","hep-ph",,"  We study the Minimal Messenger Model, a minimal version of Gauge Mediated
Supersymmetry Breaking models. Boundary conditions equal to zero for trilinear
and bilinear soft parameters at the messenger scale make this model free from
the supersymmetric CP problem and extremely predictive. These boundary
conditions and the vicinity of the messenger scale to the electroweak one,
require a careful implementation of the mechanism of radiative breaking of
$SU(2)\times U(1)$. We assess the importance of considering the complete
one-loop effective potential and of including a set of logarithmic two-loop
corrections to the B parameter for the correct determination of the electroweak
minimum. We analyze the resulting low-energy spectrum and give predictions of
interest for future experimental searches.
","[{""version"":""v1"",""created"":""Tue, 11 Feb 1997 21:58:01 GMT""}]","2009-09-25"
"hep-ph/9702309","Ellwanger","Ulrich Ellwanger","The Running Gauge Coupling in the Exact Renormalization Group Approach","17 pages (latex2e), 6 figs","Z.Phys. C76 (1997) 721-727",,"LPTHE ORSAY 97-02","hep-ph",,"  We discuss the perturbative running Yang-Mills coupling constant in the
Wilsonian exact renormalization group approach, and compare it to the running
coupling in the more conventional MS-bar scheme. The exact renormalization
group approach corresponds to a particular renormalization scheme, and we
relate explicitly the corresponding Lambda-parameters. The unambiguous
definition of an exact renormalization group scheme requires, however, the use
of a one-loop improved high energy effective action.
","[{""version"":""v1"",""created"":""Wed, 12 Feb 1997 10:18:55 GMT""}]","2007-05-23"
"hep-ph/9702310","Matthias Neubert","Matthias Neubert (CERN)","Theory of Inclusive B Decays","13 pages, 3 figures; to appear in the Proceedings of the 4th KEK
  Topical Conference on Flavour Physics, KEK, Japan, October 1996","Nucl.Phys.Proc.Suppl.59:101-113,1997","10.1016/S0920-5632(97)00432-5","CERN-TH/97-19","hep-ph",,"  We present the theory of inclusive decays of hadrons containing a heavy quark
and discuss its most important applications to the decays of B mesons. We also
review the theoretical understanding of the hadronic parameters lambda_1 and
lambda_2 (or mu_pi^2 and mu_G^2) entering the heavy-quark expansion.
","[{""version"":""v1"",""created"":""Wed, 12 Feb 1997 12:00:06 GMT""}]","2014-11-17"
"hep-ph/9702311","Nico Schoonderwoerd","N. C. J. Schoonderwoerd and B. L. G. Bakker (Department of Physics and
  Astronomy, Vrije Universiteit, Amsterdam, The Netherlands)","Equivalence of renormalized covariant and light-front perturbation
  theory: I. Longitudinal divergences in the Yukawa model","11 pages, epsf, revtex, contains more elaborate explanation of Forced
  Instantaneous Loops (FILs)",,"10.1103/PhysRevD.57.4965","VUTH 97-4","hep-ph hep-th",,"  Light-front perturbation theory has been proposed as an alternative to
covariant perturbation theory. Light-front perturbation theory is only
acceptable if it produces invariant S-matrix elements. Doubts have been raised
concerning the equivalence of light-front and covariant perturbation theory.
One of the obstacles to a rigorous proof of equivalence is the occurrence of
longitudinal divergences not present in covariant perturbation theory. We show
in the case of the Yukawa model of fermions interacting with scalar bosons at
the one-loop level how to deal with the longitudinal divergences. Invariant
S-matrix elements are obtained using our method.
","[{""version"":""v1"",""created"":""Wed, 12 Feb 1997 13:56:52 GMT""},{""version"":""v2"",""created"":""Tue, 17 Jun 1997 09:45:30 GMT""},{""version"":""v3"",""created"":""Wed, 28 Jan 1998 18:22:17 GMT""},{""version"":""v4"",""created"":""Thu, 29 Jan 1998 09:54:51 GMT""}]","2009-10-30"
"hep-ph/9702312","Ahmed Ali","A. Ali (DESY, Hamburg)","Flavour Changing Neutral Current Processes in B Decays","Latex2e, 16 pages, 4 figures (requires epsf.sty, espcrc2.sty) To be
  published in the Proceedings of the Fourth KEK Topical Conference on Flavour
  Physics, KEK, Tsukuba, Japan, October 29-31, 1996","Nucl.Phys.Proc.Suppl.59:86-100,1997","10.1016/S0920-5632(97)00431-3","DESY 97-019","hep-ph",,"  We review the theory and experimental measurements in the flavour changing
neutral current (FCNC) processes involving B decays in the context of the
standard model (SM). The role of these processes in determining the weak mixing
matrix elements is stressed.
","[{""version"":""v1"",""created"":""Wed, 12 Feb 1997 15:55:41 GMT""}]","2014-11-17"
"hep-ph/9702313","Charles Picciotto","C. E. Picciotto","K+ to pi-mu+mu+ and doubly-charged Higgs","8 pages, RevTex, Figure1 is PS","Phys.Rev. D56 (1997) 1612-1614","10.1103/PhysRevD.56.1612",,"hep-ph",,"  The rate for the lepton-number-violating decay K+ to pi- mu+mu+ is calculated
in a model which incorporates doubly-charged Higgs bosons. We find that for
reasonable values of the parameters the decay branching ratio may be as large
as 2E-16. Although this is a discouragingly small number, it is of the same
order of magnitude as the rate mediated by massive Majorana neutrinos.
","[{""version"":""v1"",""created"":""Wed, 12 Feb 1997 09:17:28 GMT""}]","2009-10-30"
