"hep-th/9702115","Herve Partouche","H. Partouche and B. Pioline","Partial Spontaneous Breaking of Global Supersymmetry","Contribution to the proceedings of the International Symposium
  Ahrenshoop on the Theory of Elementary Particles, Buckow, Germany, August
  27-31, 1996. LaTex2e, uses espcrc2.sty","Nucl.Phys.Proc.Suppl. 56B (1997) 322-327","10.1016/S0920-5632(97)00342-3","CPTH-PC496.0297","hep-th",,"  We review in detail the recently discovered phenomenon of partial spontaneous
breaking of supersymmetry in the case of a N=2 pure gauge U(1) theory, and
recall how the standard lore no-go theorem is evaded. We discuss the extension
of this mechanism to theories with charged matter, and surprisingly find that
the gauging forbids the existence of a magnetic Fayet-Iliopoulos term.
","[{""version"":""v1"",""created"":""Fri, 14 Feb 1997 11:09:10 GMT""}]","2009-10-30"
"nucl-th/9702032","Mike Boyce","M. Boyce, J. Treurniet, and P.J.S. Watson","Flux-Bubble Models and Mesonic Molecules","Accepted by Nuc. Phys. A, substantial revisions, Latex (24pgs/10eps
  fgs), also available at
  http://www.physics.carleton.ca/~boyce/papers/flxb96.ps",,,"OCIP/C-97-01","nucl-th hep-ph",,"  It has been shown that the string-flip potential model reproduces most of the
bulk properties of nuclear matter, with the exception of nuclear binding.
Furthermore, it was postulated that this model with the inclusion of the
colour-hyperfine interaction should produce binding. In some recent work a
modified version of the string-flip potential model was developed, called the
flux-bubble model, which would allow for the addition of perturbative QCD
interactions. In attempts to construct a simple $q\bar q$ nucleon system using
the flux-bubble model (which only included colour-Coulomb interactions)
difficulties arise with trying to construct a many-body variational wave
function that would take into account the locality of the flux-bubble
interactions. In this paper we look at a toy system, a mesonic molecule, in
order to understand these difficulties. {\it En route}, a new variational wave
function is proposed that may have a sufficient impact on the old string-flip
potential model results that the inclusion of perturbative effects may not be
needed.
","[{""version"":""v1"",""created"":""Thu, 13 Feb 1997 22:34:00 GMT""},{""version"":""v2"",""created"":""Wed, 2 Jun 1999 21:32:23 GMT""}]","2008-02-03"
"nucl-th/9702033","T. P. Vrana","S.A. Dytman, T.P. Vrana, T. S. H. Lee","Baryon Resonance Extraction from Pi Nucleon Data using a Multichannel
  Unitary Model","10 pages, Seattle 1996 Partial Wave Analysis Conference",,,,"nucl-th",,"  We present organization and solutions for a new analysis of all $\pi N$
elastic and the major inelastic channels to extract detailed characteristics of
the contributing baryon resonances. This work is based on the work of R.
Cutkosky and collaborators at CMU about 20 years ago. The model features
analyticity at the amplitude level and unitarity. Results are similar to
previous analyses for strongly excited states, but can vary considerably from
previous analyses when the states are weak, the data is poor, or there is a
strong model dependence. We emphasize the S_{11}(1535) resonance which has
particularly strong model dependence.
","[{""version"":""v1"",""created"":""Thu, 13 Feb 1997 23:19:07 GMT""},{""version"":""v2"",""created"":""Tue, 18 Feb 1997 14:59:49 GMT""}]","2008-02-03"
"nucl-th/9702034",,"K. Varga and Y. Suzuki","Solution of few-body problems with the stochastic variational method: I.
  Central forces","Description of a computer program. 19 pages, latex","Comput.Phys.Commun. 106 (1997) 157-168","10.1016/S0010-4655(97)00059-3","1997N3","nucl-th cond-mat hep-ph",,"  This paper presents a fortran program to solve diverse few-body problems with
the stochastic variational method. Depending on the available computational
resources the program is applicable for $N=2-3-4-5-6-...$-body systems with
$L=0$ total orbital momentum. The solution with the stochastic variational
method is ``automatic'' and universal. One defines the system (number of
particles, masses, symmetry, interaction, etc. ) and the program finds the
ground state energy and wave function. The examples include nuclear (alpha
particle: four-body, $^6$He: six-body), atomic (td$\mu^-$ and $e^+e^-e^+e^-$)
and subnuclear (the nucleon and the delta in a nonrelativistic quark model)
systems. The solutions are accurate for excited states as well, and even the
Efimov-states can be studied. The program is available from the author
(e-mail:varga@rikaxp.riken.go.jp).
","[{""version"":""v1"",""created"":""Fri, 14 Feb 1997 02:29:33 GMT""}]","2009-10-30"
"physics/9702012","David Goodson","David Z. Goodson, Dustin W. Roelse and Wan-Ting Chiang (Dept. of
  Chemistry, Southern Methodist University, Dallas, TX) Steven M. Valone
  (Materials Science and Technology Division, MST-7, Los Alamos National
  Laboratory, Los Alamos, NM), and J. D. Doll (Department of Chemistry, Brown
  University, Providence, RI)","A Simple Method for Calculating Quantum Effects on the Temperature
  Dependence of Bimolecular Reaction Rates: An Application to $CH_4 + H \to
  CH_3 + H_2$","Submitted to Journal of the American Chemical Society, 13 pages,
  REVTeX, 5 figures",,,,"physics.chem-ph",,"  The temperature dependence of the rate of the reaction CH_4+H \to CH_3+H_2 is
studied using classical collision theory with a temperature-dependent effective
potential derived from a path integral analysis. Analytical expressions are
obtained for the effective potential and for the rate constant. The rate
constant expressions use a temperature-dependent activation energy. They give
better agreement with the available experimental results than do previous
empirical fits. Since all but one of the parameters in the present expressions
are obtained from theory, rather than by fitting to experimental reaction
rates, the expressions can be expected to be more dependable than purely
empirical expressions at temperatures above 2000 K or below 350 K, where
experimental results are not available.
","[{""version"":""v1"",""created"":""Thu, 13 Feb 1997 21:09:06 GMT""}]","2016-09-08"
"q-alg/9702018",,"Malgorzata Rowicka-Kudlicka","An example of a braided category of C*- algebras","18 pages, LaTeX, replaced with revised version","Rep. Math. Phys. 2, 41(1998)","10.1016/S0034-4877(98)80174-2","UW-KMMF-97-01","q-alg math.QA",,"  A braided category of C*-algebras is constructed. Its objects are C*-algebras
endowed with an action of the group R, its morphisms are C*-algebras morphisms
intertwining the action of R, the crossed product of its two objects
essentially depends on the action of R on considered C*-algebras. Crossed
products of any object with the algebra of all continuous vanishing at infinity
functions on R and algebras of all continuous functions on one- and
twodimensional tori are discussed.
","[{""version"":""v1"",""created"":""Thu, 13 Feb 1997 18:56:20 GMT""},{""version"":""v2"",""created"":""Fri, 2 Mar 2001 14:11:37 GMT""}]","2009-10-30"
"q-alg/9702019","Yasuhiko Yamada","Yasuhiko Yamada","On $q$-Clebsch Gordan Rules and the Spinon Character Formulas for Affine
  $C_2^{(1)}$ Algebra","16 pages, amslatex",,,,"q-alg math.QA",,"  A $q$-analog of the Clebsch Gordan rules for the tensor products of the
fundamental representations of Yangian is introduced. Its relation to the
crystal base theory and application to the spinon character formulas are
discussed in case of $C_2^{(1)}$ explicitly.
","[{""version"":""v1"",""created"":""Fri, 14 Feb 1997 05:41:30 GMT""}]","2008-02-03"
"q-alg/9702020","Alexei Vladimirov","O.V.Radko and A.A.Vladimirov (JINR)","On the algebraic structure of differential calculus on quantum groups","14 pages, LaTeX 2.09, no figures, JINR preprint",,"10.1063/1.531952","E2-97-45","q-alg math.QA",,"  Intrinsic Hopf algebra structure of the Woronowicz differential complex is
shown to generate quite naturally a bicovariant algebra of four basic objects
within a differential calculus on quantum groups -- coordinate functions,
differential 1-forms, Lie derivatives, and inner derivations -- as the
cross-product algebra of two mutually dual graded Hopf algebras. This
construction, properly taking into account Hopf-algebraic properties of
Woronowicz's bicovariant calculus, provides a direct proof of the Cartan
identity and of many other useful relations. A detailed comparison with other
approaches is also given.
","[{""version"":""v1"",""created"":""Fri, 14 Feb 1997 07:58:47 GMT""}]","2009-10-30"
"quant-ph/9702031","Nicolas Cerf","Nicolas J. Cerf (Caltech), Richard Cleve (Univ. of Calgary)","Information-theoretic interpretation of quantum error-correcting codes","14 pages RevTeX, 8 Postscript figures. Added appendix. To appear in
  Phys. Rev. A","Phys.Rev.A56:1721,1997","10.1103/PhysRevA.56.1721","KRL MAP-209","quant-ph",,"  Quantum error-correcting codes are analyzed from an information-theoretic
perspective centered on quantum conditional and mutual entropies. This approach
parallels the description of classical error correction in Shannon theory,
while clarifying the differences between classical and quantum codes. More
specifically, it is shown how quantum information theory accounts for the fact
that ""redundant"" information can be distributed over quantum bits even though
this does not violate the quantum ""no-cloning"" theorem. Such a remarkable
feature, which has no counterpart for classical codes, is related to the
property that the ternary mutual entropy vanishes for a tripartite system in a
pure state. This information-theoretic description of quantum coding is used to
derive the quantum analogue of the Singleton bound on the number of logical
bits that can be preserved by a code of fixed length which can recover a given
number of errors.
","[{""version"":""v1"",""created"":""Thu, 13 Feb 1997 22:50:21 GMT""},{""version"":""v2"",""created"":""Sun, 22 Jun 1997 01:11:10 GMT""}]","2008-12-18"
"quant-ph/9702032","Paul Tapster","J G Rarity, P R Tapster, R Loudon","Non-classical interference between independent sources","6 pages, RevTeX, 4 figures",,,,"quant-ph",,"  When a one-photon state is mixed with a (separate) weak coherent state at a
beamsplitter the probability for detecting one photon in each beamsplitter
output approaches zero due to destructive interference. We demonstrate this
non-classical interference effect using pulse-gated single photons and weak
mode-locked laser pulses.
","[{""version"":""v1"",""created"":""Fri, 14 Feb 1997 11:03:57 GMT""},{""version"":""v2"",""created"":""Tue, 18 Feb 1997 11:24:02 GMT""}]","2008-02-03"
