"gr-qc/9702024","Franciso Turrubiates","Jerzy F. Plebanski (Cinvestav-phys), G.R. Moreno (Cinvestav-math) and
  F.J. Turrubiates (Cinvestav-phys)","Differential Forms, Hopf Algebra and General Relativity I","36 pages, LaTeX file, no figures","Acta Phys.Polon. B28 (1997) 1515-1552",,"CINVESTAV-FIS-05/97","gr-qc",,"  We review the language of differential forms and their applications to
Riemannian Geometry with an orientation to General Relativity. Working with the
principal algebraic and differential operations on forms, we obtain the
structure equations and their symmetries in terms of a new product (the
co-multiplication). It is showen how the Cartan - Grassmann algebra can be
endowed with the structure of a Hopf algebra.
","[{""version"":""v1"",""created"":""Thu, 13 Feb 1997 18:51:23 GMT""}]","2007-05-23"
"gr-qc/9702025","Lee Smolin","Fotini Markopoulou and Lee Smolin","Causal evolution of spin networks","latex, 32 pages, 17 figures","Nucl.Phys.B508:409-430,1997","10.1016/S0550-3213(97)00488-4","CGPG 97/2-1","gr-qc hep-th",,"  A new approach to quantum gravity is described which joins the loop
representation formulation of the canonical theory to the causal set
formulation of the path integral. The theory assigns quantum amplitudes to
special classes of causal sets, which consist of spin networks representing
quantum states of the gravitational field joined together by labeled null
edges. The theory exists in 3+1, 2+1 and 1+1 dimensional versions, and may also
be interepreted as a theory of labeled timelike surfaces. The dynamics is
specified by a choice of functions of the labelings of d+1 dimensional
simplices,which represent elementary future light cones of events in these
discrete spacetimes. The quantum dynamics thus respects the discrete causal
structure of the causal sets. In the 1+1 dimensional case the theory is closely
related to directed percolation models. In this case, at least, the theory may
have critical behavior associated with percolation, leading to the existence of
a classical limit.
","[{""version"":""v1"",""created"":""Thu, 13 Feb 1997 22:52:48 GMT""}]","2010-04-06"
"gr-qc/9702026","Michael Pfenning","Michael J. Pfenning, L.H. Ford","The unphysical nature of ""Warp Drive""","11 pages, 3 figures, latex. This revision corrects a typographical
  sign error in Eq. (3)","Class.Quant.Grav. 14 (1997) 1743-1751","10.1088/0264-9381/14/7/011",,"gr-qc",,"  We will apply the quantum inequality type restrictions to Alcubierre's warp
drive metric on a scale in which a local region of spacetime can be considered
``flat''. These are inequalities that restrict the magnitude and extent of the
negative energy which is needed to form the warp drive metric. From this we are
able to place limits on the parameters of the ``Warp Bubble''. It will be shown
that the bubble wall thickness is on the order of only a few hundred Planck
lengths. Then we will show that the total integrated energy density needed to
maintain the warp metric with such thin walls is physically unattainable.
","[{""version"":""v1"",""created"":""Thu, 13 Feb 1997 23:24:10 GMT""},{""version"":""v2"",""created"":""Thu, 20 Mar 1997 22:18:15 GMT""},{""version"":""v3"",""created"":""Thu, 15 Mar 2001 16:47:53 GMT""}]","2009-10-30"
"gr-qc/9702027","Maria Guimaraes","M. E. X. Guimaraes (Univ. of Wales, Cardiff)","Semiclassical Effects Induced by Aharonov-Bohm Interaction Between a
  Cosmic String and a Scalar Field","13 pages, no figures, accepted for publication in Phys. Letters B","Phys.Lett. B398 (1997) 281-284","10.1016/S0370-2693(97)00240-2",,"gr-qc hep-th",,"  In the context of the vacuum polarization effect, we consider the
backreaction of the energy-momentum tensor of a charged scalar field on the
background metric of a cosmic string carrying a magnetic flux $\Phi$. Working
within the semiclassical approach to the Einstein eqs. we find the first-order
(in $\hbar$) metric associated to the magnetic flux cosmic string. We show that
the contribution to the vacuum polarization effect coming from the
Aharonov-Bohm interaction is larger than the one coming from the non-trivial
gravitational interaction.
","[{""version"":""v1"",""created"":""Fri, 14 Feb 1997 13:46:35 GMT""}]","2009-10-30"
"hep-ex/9702007","Preprints Libr/pam","CLEO Collaboration, M. Artuso, et al","Study of the B^0 Semileptonic Decay Spectrum at the Upsilon(4S)
  Resonance","14 page, postscript file also available at
  http://w4.lns.cornell.edu/public/CLNS","Phys.Lett.B399:321-328,1997","10.1016/S0370-2693(97)00336-5","CLNS 97/1461, CLEO 97-2","hep-ex",,"  We have made a first measurement of the lepton momentum spectrum in a sample
of events enriched in neutral B's through a partial reconstruction of B0 -->
D*- l+ nu. This spectrum, measured with 2.38 fb**-1 of data collected at the
Upsilon(4S) resonance by the CLEO II detector, is compared directly to the
inclusive lepton spectrum from all Upsilon(4S) events in the same data set.
These two spectra are consistent with having the same shape above 1.5 GeV/c.
From the two spectra and two other CLEO measurements, we obtain the B0 and B+
semileptonic branching fractions, b0 and b+, their ratio, and the production
ratio f+-/f00 of B+ and B0 pairs at the Upsilon(4S). We report b+/b0=0.950
(+0.117-0.080) +- 0.091, b0 = (10.78 +- 0.60 +- 0.69)%, and b+ = (10.25 +- 0.57
+- 0.65)%. b+/b0 is equivalent to the ratio of charged to neutral B lifetimes,
tau+/tau0.
","[{""version"":""v1"",""created"":""Thu, 13 Feb 1997 20:19:53 GMT""}]","2010-04-08"
"hep-ex/9702008",,"Jonathan L. Rosner (University of Chicago) and John F. Wilkerson
  (University of Washington)","Detection of the RF Pulse Associated With Cosmic Ray Air Showers","7 pages, latex, 1 figure",,,"EFI-97-10","hep-ex astro-ph",,"  Initial results of a project to detect the radio-frequency pulse associated
with extensive air showers of cosmic rays are described briefly. This work is
being performed at the CASA/MIA array in Utah, with the intention of designing
equipment that can be used in conjunction with the Auger Giant Array proposal.
","[{""version"":""v1"",""created"":""Fri, 14 Feb 1997 15:07:05 GMT""}]","2007-05-23"
"hep-lat/9702014","Kieran Holland","K. Holland and U.-J. Wiese (MIT)","Quark Confinement in C-periodic Cylinders at Temperatures above T_c","8 pages, Latex, no figures","Phys.Lett. B415 (1997) 179-185","10.1016/S0370-2693(97)01237-9","MIT Preprint, CTP 2608","hep-lat hep-ph hep-th",,"  Due to the Gauss law, a single quark cannot exist in a periodic volume, while
it can exist with C-periodic boundary conditions. In a C-periodic cylinder of
cross section A = L_x L_y and length L_z >> L_x, L_y containing deconfined
gluons, regions of different high temperature Z(3) phases are aligned along the
z-direction, separated by deconfined- deconfined interfaces. In this geometry,
the free energy of a single static quark diverges in proportion to L_z. Hence,
paradoxically, the quark is confined, although the temperature T is larger than
T_c. At T around T_c, the confined phase coexists with the three deconfined
phases. The deconfined-deconfined interfaces can be completely or incompletely
wet by the confined phase. The free energy of a quark behaves differently in
these two cases. In contrast to claims in the literature, our results imply
that deconfined-deconfined interfaces are not Euclidean artifacts, but have
observable consequences in a system of hot gluons.
","[{""version"":""v1"",""created"":""Thu, 13 Feb 1997 20:01:15 GMT""}]","2009-10-30"
"hep-lat/9702015","Ka Chun Leung","Maarten Golterman, Ka Chun Leung","Chiral perturbation theory for K+ to pi+ pi0 decay in the continuum and
  on the lattice","50 pages, TeX, two eps figures included, minor changes, no changes in
  results or conclusions, version to appear in Phys.Rev.D","Phys. Rev. D 56, 2950 (1997)","10.1103/PhysRevD.56.2950","Wash. U. HEP/97-60","hep-lat hep-ph",,"  In this paper we use one-loop chiral perturbation theory in order to compare
lattice computations of the K+ to pi+ pi0 decay amplitude with the experimental
value. This makes it possible to investigate three systematic effects that
plague lattice computations: quenching, finite-volume effects, and the fact
that lattice computations have been done at unphysical values of the quark
masses and pion external momenta (only this latter effect shows up at tree
level). We apply our results to the most recent lattice computation, and find
that all three effects are substantial. We conclude that one-loop corrections
in chiral perturbation theory help in explaining the discrepancy between
lattice results and the real-world value. We also revisit B_K, which is closely
related to the K+ to pi+ pi0 decay amplitude by chiral symmetry.
","[{""version"":""v1"",""created"":""Fri, 14 Feb 1997 00:20:41 GMT""},{""version"":""v2"",""created"":""Fri, 16 May 1997 15:19:01 GMT""}]","2016-08-24"
"hep-ph/9702328","Wolfgang Schweiger","G. Folberth, R. Rossmann and W. Schweiger (Graz U.)","Exclusive photo- and electroproduction of mesons in the GeV region","10 pages, LaTeX document, uses sprocl.sty style file, 5 embedded eps
  figures. Contribution presented by W. Schweiger at the DIQUARKS III Workshop,
  Turin, Italy, 28-30 Oct 1996",,,"UNIGRAZ-UTP 12-02-97","hep-ph",,"  We consider the reactions gamma p --> M B, with M B being either K+ Lambda,
K+ Sigma0, or Pi n, within a diquark model which is based on perturbative QCD.
The model parameters and the quark-diquark distribution amplitudes of the
baryons are taken from previous investigations of electromagnetic baryon form
factors and Compton-scattering off protons. Reasonable agreement with the few
existing photoproduction data at large momentum transfer is found for meson
distribution amplitudes compatible with the asymptotic one (proportional to x
(1-x)). We present also first results for hard electroproduction of the K+
Lambda final state. Our predictions exhibit some characteristic features which
could easily be tested in forthcoming electroproduction experiments.
","[{""version"":""v1"",""created"":""Thu, 13 Feb 1997 16:39:03 GMT""}]","2007-05-23"
"hep-ph/9702329","Baurov Alexey Yu","Yu.A.Baurov (Central Scientific Research Institute of Machinery,
  Moscow)","Does Neutrino Really Exist ?","12 pages, latex, 1 PS figure",,,,"hep-ph",,"  An analysis of known experiments on direct and indirect detection of the
electron-type neutrino and antineutrino has been made. The analysis based on a
new hypothesis that the observed physical space is formed from a finite set of
byuons, ""one-dimensional vectorial objects"". It is shown in the article that
the hypothesis for existence of neutrinos advanced by Pauli on the basis of an
analysis of the conservation laws, is not unquestionable since the fulfillment
of these laws may be secured by the physical space itself (physical vacuum)
being the lowest energy state of a discrete oscillating system originating in
the course of byuon interaction. This effect is analogous to that of
M\""ossbauer. The direct experiments on detecting neutrinos are explained from
the existence of a new information channel due to the uncertainty interval for
coordinate of the four-contact byuon interaction forming the interior geometry
of elementary particles and their properties. Given are also the results of an
experiment on observation of cyclic variations of the $\beta$-decay rate, which
confirm the existence of said new information channel.
","[{""version"":""v1"",""created"":""Thu, 13 Feb 1997 19:42:47 GMT""}]","2007-05-23"
"hep-ph/9702330","Scott Willenbrock","S. Willenbrock (U. of Illinois)","Higgs Physics: An Historical Perspective","One reference added. 13 pages, LateX, 5 ps figures included.
  Presented at the Symposium on Future High Energy Colliders, Institute for
  Theoretical Physics, University of California at Santa Barbara, October
  21-25, 1996",,"10.1063/1.52992",,"hep-ph",,"  ``Weakly-coupled'' and ``strongly-coupled'' models of electroweak symmetry
breaking are introduced by analogy with the Fermi theory of the weak
interaction and the low-energy interaction of pions, respectively. The
implications of these two classes of models for colliders beyond the LHC and
NLC are discussed.
","[{""version"":""v1"",""created"":""Thu, 13 Feb 1997 18:45:03 GMT""},{""version"":""v2"",""created"":""Wed, 19 Mar 1997 22:02:27 GMT""}]","2009-10-30"
"hep-ph/9702331","Hoang","A.H. Hoang (University of California, San Diego)","The Vacuum Polarization Function to O(alpha^2) Accuracy Near Threshold
  and Darwin Corrections","26 pages, latex, five ps figures included","Phys. Rev. D 57, 1615 (1998)","10.1103/PhysRevD.57.1615","UCSD/PTH 97-04","hep-ph",,"  The QED vacuum polarization function is calculated to O(alpha^2)
(next-to-leading order) accuracy in the threshold regime by using the concept
of effective field theories to resum diagrams with the instantaneous Coulomb
exchange of longitudinally polarized photons. It is shown that the O(alpha^2)
contributions are of order alpha^2 in size rather than alpha^2/Pi^2. The vacuum
polarization contributions to the O(alpha^6) hyperfine splitting of the
positronium ground state are recalculated and differences with an older
calculation are pointed out. The results are used to determine O(C_F^2
alpha_s^2) (next-to-next-to-leading order) Darwin corrections to heavy
quark-antiquark bound state l=0 wave functions at the origin and to the heavy
quark-antiquark production cross section in e^+e^- collisions in the threshold
region. The absolute value of the corrections amounts to 10%-20% and 17%-34% in
the modulus squared of the ground state wave functions at the origin for the
$b\bar b$ and $c\bar c$ systems, respectively. In the case of the $t\bar t$
production cross section in the threshold region the absolute value of the
corrections is between 2% and 6% around the 1S peak and between 1% and 2% for
higher energies. A critical comment on recent QCD sum rule calculations for the
$\Upsilon$ system is made.
","[{""version"":""v1"",""created"":""Thu, 13 Feb 1997 21:08:35 GMT""}]","2016-08-25"
"hep-ph/9702332","Masayasu Harada","Masayasu Harada (Syracuse Univ.)","Existence of sigma meson in pi-pi scattering","7 pages (LaTeX), 2 PostScript figures (need epsf.tex). Talk given at
  1996 International Workshop on ``Perspectives of Strong Coupling Gauge
  Theories'' (Nov. 13--16, 1996, Nagoya)",,,"SU-4240-655","hep-ph",,"  In this talk I summarize a recently proposed mechanism to understand pi pi
scattering to 1 GeV. The model is motivated by the 1/Nc expansion to QCD, and
includes a current algebra contact term and resonant pole exchanges. Chiral
symmetry plays an important role in restricting the form of the interactions.
The existence of a broad low energy scalar (sigma) is indicated.
","[{""version"":""v1"",""created"":""Thu, 13 Feb 1997 21:11:04 GMT""}]","2007-05-23"
"hep-ph/9702333","Ren-Jie Zhang","Ren-Jie Zhang","A Model with Anomalous U(1) Induced Supersymmetry Breaking","8 pages, latex, no figures","Phys.Lett. B402 (1997) 101-105","10.1016/S0370-2693(97)00446-2","JHU-TIPAC-97004","hep-ph",,"  A model based on an anomalous Abelian symmetry $U(1)_1\times U(1)_2$ is
presented. This symmetry is responsible for both supersymmetry breaking and
fermion mass generation. Quark and squark mass matrices are aligned to prevent
large flavor-changing neutral current and CP-violation.
","[{""version"":""v1"",""created"":""Thu, 13 Feb 1997 23:23:49 GMT""}]","2009-10-30"
"hep-ph/9702334","Tao Han","V. Barger, M.S. Berger, J.F. Gunion and T. Han","Precision W-boson and top-quark mass determinations at a muon collider","27 pages, 11 figures, postscript file available via anonymous
  ftp://ucdhep.ucdavis.edu/han/mumu/mwmt.ps","Phys.Rev.D56:1714-1722,1997","10.1103/PhysRevD.56.1714","MADPH-96-963, IUHET-346, UCD-97-01","hep-ph hep-ex",,"  Precise determinations of the masses of the $W$ boson and of the top quark
could stringently test the radiative structure of the Standard Model (SM) or
provide evidence for new physics. We analyze the excellent prospects at a muon
collider for measuring $M_W$ and $m_t$ in the $W^+W^-$ and $t\bar t$ threshold
regions. With an integrated luminosity of 10 (100) fb$^{-1}$, the $W$-boson
mass could be measured to a precision of 20 (6) MeV, and the top-quark mass to
a precision of 200 (70) MeV, provided that theoretical and experimental
systematics are understood. A measurement of $\Delta m_t=200$ MeV for fixed
$M_W$ would constrain a 100 GeV SM Higgs mass within about $\pm 2$ GeV, while
$\Delta M_W=6$ MeV for fixed $m_t$ would constrain $m_h$ to about $\pm 10$ GeV.
","[{""version"":""v1"",""created"":""Fri, 14 Feb 1997 05:31:39 GMT""}]","2009-09-15"
"hep-ph/9702335",,"O.G. Tchikilev (IHEP, Protvino, Russia)","Multiplicity distributions in e+e- annihilation into hadrons and the
  extended modified negative binomial","9 pages, Latex, 2 postscript figures, epsfig is used",,,,"hep-ph",,"  It is shown that simple extension of the modified negative binomial
distribution describes negatively charged particle multiplicity distributions
in e+e- annihilation, measured in the whole phase space, as well as the
modified negative binomial.
","[{""version"":""v1"",""created"":""Fri, 14 Feb 1997 12:34:40 GMT""}]","2007-05-23"
"hep-ph/9702336",,"Eizou Umezawa","Fine-Tuning Problem in a Left-Right Symmetric Model and Sogami's
  Generalized Covariant Derivative Method","26pages, Latex file","Prog.Theor.Phys. 98 (1997) 187-210","10.1143/PTP.98.187","NUP-A-97-4","hep-ph",,"  We study Sogami's generalized covariant derivative method for a $SU(2)_{L}
\times SU(2)_{R} \times U(1)_{B-L} \times SU(3)_{c}$ model that contains
bi-doublet and triplet Higgs bosons. In particular, a detailed study is made on
the minimization conditions of the Higgs potential. It is known that a
minimization condition and certain phenomenology for a extra gauge boson mass
derive a restriction on potential parameters, which requires fine-tuning. We
show that the restriction can be reduced to a condition of Yukawa coupling
constants giving a heavy mass of the right-handed tau neutrino in our model. We
also discuss the consistency among parameter restrictions of our model by
taking phenomenology of the Higgs boson masses into account.
","[{""version"":""v1"",""created"":""Fri, 14 Feb 1997 11:13:44 GMT""},{""version"":""v2"",""created"":""Mon, 20 Oct 1997 10:35:33 GMT""}]","2009-10-30"
"hep-ph/9702337","Martti Raidal","G. Barenboim, J. Bernabeu and M. Raidal","Spontaneous CP violation and the B system","19 pages, LATEX, 4 postscript figures included","Nucl.Phys. B511 (1998) 577-593","10.1016/S0550-3213(97)00668-8","FTUV/96-70","hep-ph",,"  We investigate effects of spontaneous breakdown of CP in
$B^0_{d,s}-\overline{B^0}_{d,s}$ systems in left-right symmetric models.
Assuming that the left-right contribution to the $B^0-\overline{B^0}$ matrix
element $M_{12}$ can be at most equal to the standard model one we obtain a new
lower bound, $M_H\gsim 12$ TeV, on the flavour changing Higgs boson mass. Most
importantly, the convention independent parameter $Re(\overline{\epsilon}_B),$
which measures the amount of $\Delta B=2$ CP violation, can be enhanced by a
factor of four or more for $B^0_d$ and almost by two orders of magnitude for
$B^0_s$ systems when compared with the Standard Model predictions. Therefore,
interesting possibilities to observe indirect CP violation in the $B$ system
are open in the planned facilities.
","[{""version"":""v1"",""created"":""Fri, 14 Feb 1997 15:10:06 GMT""}]","2009-10-30"
"hep-th/9702108","Richard A. Corrado","David Berenstein and Richard Corrado","M(atrix)-Theory in Various Dimensions","12 pages LaTeX2e, using utarticle.cls (included), amsmath.sty,
  amsfonts.sty. Bibtex style: utphys.bst (.bbl file included)","Phys.Lett.B406:37-43,1997","10.1016/S0370-2693(97)00671-0","UTTG-04-97","hep-th",,"  We demonstrate the precise numerical correspondence between long range
scattering of supergravitons and membranes in supergravity in the infinite
momentum frame and in M(atrix)-Theory, both in 11 dimensions and for toroidal
compactifications. We also identify wrapped membranes in terms of topological
invariants of the vector bundles associated to the field theory description of
compactified M(atrix)-Theory. We use these results to check the realization of
T-duality in M(atrix)-Theory.
","[{""version"":""v1"",""created"":""Fri, 14 Feb 1997 00:47:16 GMT""}]","2010-11-19"
"hep-th/9702109","David Kastor","Fay Dowker, David Kastor and Jennie Traschen","U-Duality, D-Branes and Black Hole Emission Rates: Agreements and
  Disagreements","30 pages, harvmac; Clarification is added on the size of disagreement
  claimed; Remarks are added on treating the limit in which two charges are
  small","Phys. Rev. D 58, 124025 (1998)","10.1103/PhysRevD.58.124025","UMHEP-437, Imperial/TP/96-97/24","hep-th",,"  An expression for the spacetime absorption coefficient of a scalar field in a
five dimensional, near extremal black hole background is derived, which has the
same form as that presented by Maldacena and Strominger, but is valid over a
larger, U-duality invariant region of parameter space and in general disagrees
with the corresponding D-brane result. We develop an argument, based on D-brane
thermodynamics, which specifies the range of parameters over which agreement
should be expected. For neutral emission, the spacetime and D-brane results
agree over this range. However, for charged emission, we find disagreement in
the `Fat Black Hole' regime, in which charge is quantized in smaller units on
the brane, than in the bulk of spacetime. We indicate a possible problem with
the D-brane model in this regime. We also use the Born approximation to study
the high frequency limit of the absorption coefficient and find that it
approaches unity, for large black hole backgrounds, at frequencies still below
the string scale, again in disagreement with D-brane results.
","[{""version"":""v1"",""created"":""Thu, 13 Feb 1997 21:42:16 GMT""},{""version"":""v2"",""created"":""Mon, 17 Mar 1997 02:53:26 GMT""}]","2016-08-25"
"hep-th/9702110","Stieberger Stephan","H.P. Nilles and S. Stieberger","String-Unification, Universal One-Loop Corrections and Strongly Coupled
  Heterotic String Theory","28 LaTex pages with 2 figs","Nucl.Phys. B499 (1997) 3-28","10.1016/S0550-3213(97)00315-5","CERN-TH/97-18 and NEIP-009/96","hep-th hep-ph",,"  We derive the universal threshold corrections in heterotic string theory
including a continuous Wilson line. Unification of gauge and gravitational
couplings is shown to be possible even within perturbative string theory. The
relative importance of gauge group dependent and independent thresholds on
unification is clarified. Equipped with these results we can then attempt an
extrapolation to the strongly coupled heterotic string -- M-theory. We argue
that such an extrapolation might be meaningful because of the holomorphic
structure of the gauge coupling function and the close connection of the
threshold corrections to the anomaly cancelation mechanism.
","[{""version"":""v1"",""created"":""Thu, 13 Feb 1997 22:42:45 GMT""},{""version"":""v2"",""created"":""Fri, 14 Feb 1997 03:50:35 GMT""}]","2009-10-30"
"hep-th/9702111","Ergin Sezgin","P.S. Howe, E. Sezgin and P.C. West","The Six Dimensional Self-Dual Tensor","8 pages, latex","Phys.Lett. B400 (1997) 255-259","10.1016/S0370-2693(97)00365-1",,"hep-th",,"  The equations of motion for a self-interacting self-dual tensor in six
dimensions are extracted from the equations describing the M-theory five-brane.
These equations are presented in a self-contained, six-dimensional
Lorentz-covariant form. In particular, it is shown that the field-strength
tensor satisfies a non-linear generalised self-duality constraint. The
self-duality equation is rewritten in five-dimensional notation and shown to be
identical to the corresponding equation in the non-covariant formalism.
","[{""version"":""v1"",""created"":""Fri, 14 Feb 1997 01:13:07 GMT""}]","2009-10-30"
"hep-th/9702113","Dallas Kennedy","Angus F. Nicholson (1), Dallas C. Kennedy (2) ((1) The Australian
  National University, (2) University of Florida)","Gauge Boson and Fermion Masses Without a Higgs Field","32 pages, LaTex, no special macros, no figures; minor revisions",,,"UF-IFT-HEP-96-29","hep-th hep-ph",,"  A simple, anomaly-free chiral gauge theory can be perturbatively quantised
and renormalised in such a way as to generate fermion and gauge boson masses.
This development exploits certain freedoms inherent in choosing the unperturbed
Lagrangian and in the renormalisation procedure. Apart from its intrinsic
interest, such a mechanism might be employed in electroweak gauge theory to
generate fermion and gauge boson masses without a Higgs sector.
","[{""version"":""v1"",""created"":""Fri, 14 Feb 1997 03:10:50 GMT""},{""version"":""v2"",""created"":""Mon, 24 Mar 1997 23:11:45 GMT""},{""version"":""v3"",""created"":""Wed, 29 Jul 1998 19:50:54 GMT""},{""version"":""v4"",""created"":""Mon, 8 Mar 1999 20:45:15 GMT""},{""version"":""v5"",""created"":""Wed, 23 Jun 1999 04:00:55 GMT""},{""version"":""v6"",""created"":""Fri, 8 Dec 2000 04:10:05 GMT""}]","2008-02-03"
"hep-th/9702114","Luca Lusanna","Luca Lusanna (INFN Florence)","Solving Gauss' Laws and Searching Dirac Observables for the Four
  Interactions","9 pages, LaTeX (using espcrc2.sty). Talk given at the Second Conf. on
  Constrained Dynamics and Quantum Gravity, S.Margherita Ligure, 17-21
  September 1996","Nucl.Phys.Proc.Suppl. 57 (1997) 13-20","10.1016/S0920-5632(97)00349-6",,"hep-th",,"  A review is given of the status of the program of classical reduction to
Dirac's observables of the four interactions (standard SU(3)xSU(2)xU(1)
particle model and tetrad gravity) with the matter described either by
Grassmann-valued fermion fields or by particles with Grassmann charges.
","[{""version"":""v1"",""created"":""Fri, 14 Feb 1997 10:39:52 GMT""}]","2009-10-30"
