"quant-ph/9702055","Balachandran","A.P. Balachandran","Bringing Up a Quantum Baby","23 pages, 2 figures ( ref. updated, no other changes )",,,"SU-4240-657","quant-ph gr-qc hep-th math.QA q-alg",,"  Any two infinite-dimensional (separable) Hilbert spaces are unitarily
isomorphic. The sets of all their self-adjoint operators are also therefore
unitarily equivalent. Thus if all self-adjoint operators can be observed, and
if there is no further major axiom in quantum physics than those formulated for
example in Dirac's `Quantum Mechanics', then a quantum physicist would not be
able to tell a torus from a hole in the ground. We argue that there are indeed
such axioms involving vectors in the domain of the Hamiltonian: The
``probability densities'' (hermitean forms) \psi^\dagger \chi for \psi,\chi in
this domain generate an algebra from which the classical configuration space
with its topology (and with further refinements of the axiom, its C^K and
C^infinity structures) can be reconstructed using Gel'fand - Naimark theory.
Classical topology is an attribute of only certain quantum states for these
axioms, the configuration space emergent from quantum physics getting
progressively less differentiable with increasingly higher excitations of
energy and eventually altogether ceasing to exist. After formulating these
axioms, we apply them to show the possibility of topology change and to discuss
quantized fuzzy topologies. Fundamental issues concerning the role of time in
quantum physics are also addressed.
","[{""version"":""v1"",""created"":""Wed, 26 Feb 1997 20:37:34 GMT""},{""version"":""v2"",""created"":""Mon, 10 Mar 1997 22:27:50 GMT""}]","2008-02-03"
"quant-ph/9702056","Haiqing Wei","Xin Xue, Haiqing Wei","More on Static Quantum Computation","2 pages",,,,"quant-ph",,"  The construction of a universal static quantum computer actually provides
another proof of the NP-hardness of spin-glass problems.
","[{""version"":""v1"",""created"":""Wed, 26 Feb 1997 21:02:35 GMT""},{""version"":""v2"",""created"":""Mon, 2 Mar 1998 01:23:50 GMT""}]","2008-02-03"
"quant-ph/9702057","Philip Maymin","Philip Maymin (Harvard University)","The lambda-q calculus can efficiently simulate quantum computers","4 pages, LaTeX2e",,,,"quant-ph",,"  We show that the lambda-q calculus can efficiently simulate quantum Turing
machines by showing how the lambda-q calculus can efficiently simulate a class
of quantum cellular automaton that are equivalent to quantum Turing machines.
We conclude by noting that the lambda-q calculus may be strictly stronger than
quantum computers because NP-complete problems such as satisfiability are
efficiently solvable in the lambda-q calculus but there is a widespread doubt
that they are efficiently solvable by quantum computers.
","[{""version"":""v1"",""created"":""Wed, 26 Feb 1997 22:13:11 GMT""}]","2009-09-25"
"quant-ph/9702058","Raymond Laflamme","Emanuel Knill, Raymond Laflamme and Wojciech H. Zurek","Resilient Quantum Computation: Error Models and Thresholds","19 pages in RevTex, many figures, the paper is also avalaible at
  http://qso.lanl.gov/qc/",,"10.1098/rspa.1998.0166",,"quant-ph",,"  Recent research has demonstrated that quantum computers can solve certain
types of problems substantially faster than the known classical algorithms.
These problems include factoring integers and certain physics simulations.
Practical quantum computation requires overcoming the problems of environmental
noise and operational errors, problems which appear to be much more severe than
in classical computation due to the inherent fragility of quantum
superpositions involving many degrees of freedom. Here we show that arbitrarily
accurate quantum computations are possible provided that the error per
operation is below a threshold value. The result is obtained by combining
quantum error-correction, fault tolerant state recovery, fault tolerant
encoding of operations and concatenation. It holds under physically realistic
assumptions on the errors.
","[{""version"":""v1"",""created"":""Wed, 26 Feb 1997 21:40:50 GMT""}]","2009-10-30"
"quant-ph/9702059","Kalle-Antti Suominen","Stig Stenholm and Asta Paloviita (Research Institute for Theoretical
  Physics, University of Helsinki, Finland)","States prepared by decay","22 pages, Latex2.09, 6 Postscript figures embedded using psfig, see
  also http://www.physics.helsinki.fi/~kasuomin/ To appear in a Special Issue
  of Journal of Modern Optics (1997)","J. Mod. Opt. 44, 2533-2550 (1997)","10.1080/09500349708231899","HU-TFT-96-43","quant-ph",,"  We consider the time evolution of a discrete state embedded in a continuum.
Results from scattering theory can be utilized to solve the initial value
problem and discuss the system as a model of wave packet preparation. Extensive
use is made of the analytic properties of the propagators, and simple model
systems are evaluated to illustrate the argument. We verify the exponential
appearence of the continuum state and its propagation as a localized wave
packet.
","[{""version"":""v1"",""created"":""Thu, 27 Feb 1997 09:22:40 GMT""}]","2015-06-26"
"quant-ph/9702060","Marco Toller","M. Toller (Dipartimento di Fisica dell'Universita', Trento, Italia)","On the Quantum Space-Time Coordinates of an Event","21 pages, LATEX, no figures. This revised version contains several
  more important references and a short section on non-normalized positive
  operator valued measures",,,,"quant-ph",,"  This paper gives a representation of the most general positive operator
valued measure in Minkowski space-time, covariant with respect to the Poincare'
group. It provides the correct mathematical description of the space-time
coordinates of a quantum event, described by a quantum object with suitable
properties. It is known that these coordinates cannot be represented by
self-adjoint operators or by the corresponding projection valued measure.
","[{""version"":""v1"",""created"":""Thu, 27 Feb 1997 10:59:42 GMT""},{""version"":""v2"",""created"":""Thu, 13 Mar 1997 11:01:00 GMT""}]","2008-02-03"
"solv-int/9702007","Harold Widom","Harold Widom (University of California, Santa Cruz)","An Integral Operator Solution to the Matrix Toda Equations","8 pages, LaTeX file. An argument improved","J. Int. Eqs. Appl. 10 (1998) 363",,,"solv-int funct-an hep-th math.FA nlin.SI",,"  In previous work the author found solutions to the Toda equations that were
expressed in terms of determinants of integral operators. Here it is observed
that a simple variant yields solutions to the matrix Toda equations. As an
application another derivation is given of a differential equation of Sato,
Miwa and Jimbo for a particular Fredholm determinant.
","[{""version"":""v1"",""created"":""Wed, 26 Feb 1997 17:45:49 GMT""},{""version"":""v2"",""created"":""Tue, 6 May 1997 19:01:29 GMT""}]","2008-02-03"
