"cond-mat/9703238","Ove Jepsen","O.K. Andersen, S.Y. Savrasov, O. Jepsen, and A.I.Liechtenstein (Max
  Planck Institut, Stuttgart, Germany)","Out-of-plane instability and electron-phonon contribution to s- and
  d-wave pairing in high-temperature superconductors; LDA linear-response
  calculation for doped CaCuO2 and a generic tight-binding model","19 pages, 9 Postscript figures, Latex","Journal of Low Temp. Physics, Vol. 105, 285, 1996","10.1007/BF00768402",,"cond-mat.supr-con",,"  The equilibrium structure, energy bands, phonon dispersions, and s- and
d-channel electron-phonon interactions (EPIs) are calculated for the
infinite-layer superconductor CaCuO2 doped with 0.24 holes per CuO2. The LDA
and the linear-response full-potential LMTO method were used. In the
equilibrium structure, oxygen is found to buckle slightly out of the plane and,
as a result, the characters of the energy bands near EF are found to be similar
to those of other optimally doped HTSCs. For the EPI we find lambda(s)=0.4, in
accord with previous LDA calculations for YBa2Cu3O7. This supports the common
belief that the EPI mechanism alone is insufficient to explain HTSC.
Lambda(x^2-y^2) is found to be positive and nearly as large as lambda(s). This
is surprising and indicates that the EPI could enhance some other d-wave
pairing mechanism. Like in YBa2Cu3O7, the buckling modes contribute
significantly to the EPI, although these contributions are proportional to the
static buckling and would vanish for flat planes. These numerical results can
be understood from a generic tight-binding model originally derived from the
LDA bands of YBa2Cu3O7. In the future, the role of anharmonicity of the
buckling-modes and the influence of the spin-fluctuations should be
investigated.
","[{""version"":""v1"",""created"":""Thu, 27 Mar 1997 15:09:26 GMT""}]","2009-10-30"
"dg-ga/9703020","Piotr G. Grinevich","P.G.Grinevich (1 and 2) and M.U.Schmidt (2) ((1) L.D.Landau Institute
  for Theoretical Physics, Moscow, (2) Freie Universitat, Berlin)","Closed curves in R^3: a characterization in terms of curvature and
  torsion, the Hasimoto map and periodic solutions of the Filament Equation","LaTeX, 27 pages, macros ""amssym.def"" used",,,,"dg-ga math.DG nlin.SI solv-int",,"  If a curve in R^3 is closed, then the curvature and the torsion are periodic
functions satisfying some additional constraints. We show that these
constraints can be naturally formulated in terms of the spectral problem for a
2x2 matrix differential operator. This operator arose in the theory of the
self-focusing Nonlinear Schrodinger Equation.
  A simple spectral characterization of Bloch varieties generating periodic
solutions of the Filament Equation is obtained. We show that the method of
isoperiodic deformations suggested earlier by the authors for constructing
periodic solutions of soliton equations can be naturally applied to the
Filament Equation.
","[{""version"":""v1"",""created"":""Wed, 26 Mar 1997 20:19:48 GMT""}]","2008-02-03"
"gr-qc/9703074","Carey Carpenter Briggs","C. C. Briggs (Penn State U.)","A General Expression for the Quartic Lovelock Tensor","PostScript file, 2 pages",,,,"gr-qc",,"  A general expression is given for the quartic Lovelock tensor in terms of the
Riemann-Christoffel and Ricci curvature tensors and the Riemann curvature
scalar for n-dimensional differentiable manifolds having a general linear
connection. In addition, expressions are given (in the appendix) for the
coefficient of the quartic Lovelock Lagrangian as well as for lower-order
Lovelock tensors and Lovelock Lagrangian coefficients.
","[{""version"":""v1"",""created"":""Thu, 27 Mar 1997 00:18:00 GMT""}]","2007-05-23"
"gr-qc/9703076","Benni Reznik","B. Reznik","Origin of the Thermal Radiation in a Solid-State Analog of a Black-Hole","13 Pages, 3 figures, Revtex with epsf macros","Phys.Rev. D62 (2000) 044044","10.1103/PhysRevD.62.044044","LAUR-97-1055","gr-qc hep-th quant-ph",,"  An effective black-hole-like horizon occurs, for electromagnetic waves in
matter, at a surface of singular electric and magnetic permeabilities. In a
physical dispersive medium this horizon disappears for wave numbers with
$k>k_c$. Nevertheless, it is shown that Hawking radiation is still emitted if
free field modes with $k>k_c$ are in their ground state.
","[{""version"":""v1"",""created"":""Wed, 26 Mar 1997 20:39:30 GMT""}]","2009-10-30"
"gr-qc/9703078","J. D. E. Grant","James D. E. Grant and Ian G. Moss","Hamiltonians for Reduced Gravity","18 pages, revtex, 3 postscript figures included","Phys.Rev. D56 (1997) 6284-6292","10.1103/PhysRevD.56.6284",,"gr-qc hep-th",,"  A generalised canonical formulation of gravity is devised for foliations of
spacetime with codimension $n\ge1$. The new formalism retains n-dimensional
covariance and is especially suited to 2+2 decompositions of spacetime. It is
also possible to use the generalised formalism to obtain boundary contributions
to the 3+1 Hamiltonian.
","[{""version"":""v1"",""created"":""Wed, 26 Mar 1997 17:28:23 GMT""}]","2009-10-30"
"gr-qc/9703080","Maartens R. Staf","Roy Maartens, William Lesame, George Ellis","Consistency of dust solutions with div H=0","3 pages Revtex","Phys.Rev. D55 (1997) 5219-5221","10.1103/PhysRevD.55.5219","Portsmouth RCG 96/17","gr-qc",,"  One of the necessary covariant conditions for gravitational radiation is the
vanishing of the divergence of the magnetic Weyl tensor H_{ab}, while H_{ab}
itself is nonzero. We complete a recent analysis by showing that in
irrotational dust spacetimes, the condition div H=0 evolves consistently in the
exact nonlinear theory.
","[{""version"":""v1"",""created"":""Thu, 27 Mar 1997 10:43:30 GMT""}]","2009-10-30"
"gr-qc/9703081","Soumya Mohanty","Soumya D. Mohanty (IUCAA, Pune, India)","Hierarchical search strategy for the detection of gravitational waves
  from coalescing binaries: Extension to post-Newtonian wave forms","30 page RevTeX file and 17 figures (postscript). Submitted to PRD Feb
  21, 1997","Phys.Rev.D57:630-658,1998","10.1103/PhysRevD.57.630","IUCAA preprint # 15/97","gr-qc",,"  The detection of gravitational waves from coalescing compact binaries would
be a computationally intensive process if a single bank of template wave forms
(i.e., a one step search) is used. In an earlier paper we had presented a
detection strategy, called a two step search}, that utilizes a hierarchy of
template banks. It was shown that in the simple case of a family of Newtonian
signals, an on-line two step search was about 8 times faster than an on-line
one step search (for initial LIGO). In this paper we extend the two step search
to the more realistic case of zero spin 1.5 post-Newtonian wave forms. We also
present formulas for detection and false alarm probabilities which take
statistical correlations into account. We find that for the case of a 1.5
post-Newtonian family of templates and signals, an on-line two step search
requires about 1/21 the computing power that would be required for the
corresponding on-line one step search. This reduction is achieved when signals
having strength S = 10.34 are required to be detected with a probability of
0.95, at an average of one false event per year, and the noise power spectral
density used is that of advanced LIGO. For initial LIGO, the reduction achieved
in computing power is about 1/27 for S = 9.98 and the same probabilities for
detection and false alarm as above.
","[{""version"":""v1"",""created"":""Thu, 27 Mar 1997 11:11:39 GMT""}]","2009-12-30"
"gr-qc/9703082","Edgardo S. Cheb-Terrab","E.S. Cheb-Terrab (1 and 2), L.G.S. Duarte (1), L.A.C.P. da Mota (1)
  ((1) SCG/Theor.Phys, UERJ-Brazil, (2) SCG/Fac.Math, U.Waterloo-Canada)","Computer Algebra Solving of Second Order ODEs Using Symmetry Methods","24 pages, LaTeX, Soft-package (On-Line help) and sample MapleV
  sessions available at: http://dft.if.uerj.br/odetools.htm or
  http://lie.uwaterloo.ca/odetools.htm","Computer Physics Communications 108 (1998) 90","10.1016/S0010-4655(97)00132-X",,"gr-qc",,"  An update of the ODEtools Maple package, for the analytical solving of 1st
and 2nd order ODEs using Lie group symmetry methods, is presented. The set of
routines includes an ODE-solver and user-level commands realizing most of the
relevant steps of the symmetry scheme. The package also includes commands for
testing the returned results, and for classifying 1st and 2nd order ODEs.
","[{""version"":""v1"",""created"":""Thu, 27 Mar 1997 12:20:16 GMT""},{""version"":""v2"",""created"":""Fri, 29 May 1998 00:27:54 GMT""}]","2009-10-30"
"gr-qc/9703083",,"Jacek Jezierski","Bondi mass in classical field theory","51 pages, LaTeX","Acta Physica Polonica B 29 (1998) 667-743",,,"gr-qc",,"  We analyze three classical field theories based on the wave equation: scalar
field, electrodynamics and linearized gravity. We derive certain generating
formula on a hyperboloid and on a null surface for them. The linearized
Einstein equations are analyzed around null infinity. It is shown how the
dynamics can be reduced to gauge invariant quanitities in a quasi-local way.
The quasi-local gauge-invariant ``density'' of the hamiltonian is derived on
the hyperboloid and on the future null infinity. The result gives a new
interpretation of the Bondi mass loss formula. We show also how to define
angular momentum. Starting from affine approach for Einstein equations we
obtain variational formulae for Bondi-Sachs type metrics related with energy
and angular momentum generators. The original van der Burg asymptotic hierarchy
is revisited and the relations between linearized and asymptotic nonlinear
situations are established. We discuss also supertranslations, Newman-Penrose
charges and Janis solutions.
","[{""version"":""v1"",""created"":""Thu, 27 Mar 1997 12:17:22 GMT""}]","2013-11-12"
"hep-lat/9703018",,"P. Butera and M. Comi(Phys. Dept. of Milano Univ.)","N-vector spin models on the sc and the bcc lattices: a study of the
  critical behavior of the susceptibility and of the correlation length by high
  temperature series extended to order beta^{21}","Revised version to appear in Phys. Rev. B Sept. 1997. Revisions
  include an improved series analysis biased with perturbative values of the
  scaling correction exponents computed by A. I. Sokolov. Added a reference to
  estimates of exponents for the Ising Model. Abridged text of 19 pages, latex,
  no figures, no tables of series coefficients","Phys.Rev. B56 (1997) 8212","10.1103/PhysRevB.56.8212","IFUM 548/FT","hep-lat cond-mat.stat-mech",,"  High temperature expansions for the free energy, the susceptibility and the
second correlation moment of the classical N-vector model [also known as the
O(N) symmetric classical spin Heisenberg model or as the lattice O(N) nonlinear
sigma model] on the sc and the bcc lattices are extended to order beta^{21} for
arbitrary N. The series for the second field derivative of the susceptibility
is extended to order beta^{17}. An analysis of the newly computed series for
the susceptibility and the (second moment) correlation length yields updated
estimates of the critical parameters for various values of the spin
dimensionality N, including N=0 [the self-avoiding walk model], N=1 [the Ising
spin 1/2 model], N=2 [the XY model], N=3 [the Heisenberg model]. For all values
of N, we confirm a good agreement with the present renormalization group
estimates. A study of the series for the other observables will appear in a
forthcoming paper.
","[{""version"":""v1"",""created"":""Wed, 26 Mar 1997 18:07:41 GMT""},{""version"":""v2"",""created"":""Tue, 15 Jul 1997 16:08:47 GMT""},{""version"":""v3"",""created"":""Wed, 16 Jul 1997 16:47:48 GMT""}]","2009-10-30"
"hep-lat/9703019","Gunnar Bali","Gunnar S. Bali (U Southampton), Klaus Schilling (HLRZ Juelich & U
  Wuppertal), Armin Wachter (HLRZ Juelich)","Complete O(v^2) corrections to the static interquark potential from
  SU(3) gauge theory","54 pages REVTeX with 24 encapsuled ps figures","Phys.Rev.D56:2566-2589,1997","10.1103/PhysRevD.56.2566","SHEP 96/28, HLRZ 03/97, WUB 97-11","hep-lat hep-ph",,"  For the first time, we determine the complete spin- and momentum-dependent
order v^2 corrections to the static interquark potential from simulations of
QCD in the valence quark approximation at inverse lattice spacings of 2-3 GeV.
A new flavor dependent correction to the central potential is found. We report
a 1/r^2 contribution to the long range spin-orbit potential V_1'. The other
spin-dependent potentials turn out to be short ranged and can be well
understood by means of perturbation theory. The momentum-dependent potentials
qualitatively agree with minimal area law expectations. In view of spectrum
calculations, we discuss the matching of the effective nonrelativistic theory
to QCD as well as renormalization of lattice results. In a first survey of the
resulting bottomonia and charmonia spectra we reproduce the experimental levels
within average errors of 12.5 MeV and 22 MeV, respectively.
","[{""version"":""v1"",""created"":""Wed, 26 Mar 1997 19:25:53 GMT""},{""version"":""v2"",""created"":""Thu, 27 Mar 1997 13:51:45 GMT""}]","2014-11-17"
"hep-ph/9703425",,"Bo-Qiang Ma (IHEP, Academia Sinica, Beijing)","The Proton Spin Structure in a Light-Cone Qaurk-Spectator-Diquark Model","10 pages, latex, no figure, Invited talk presented at the Diquarks
  3rd Workshop, October 28-30, 1996, Villa Gualino, Torino, Italy. To appear in
  the proceedings (World Scientific) edited by M. Anselmino and E. Predazzi",,,,"hep-ph nucl-th",,"  It is shown that the proton spin problem raised by the Ellis-Jaffe sum rule
violation does not in conflict with the SU(6) quark model, provided that the
relativistic effect from the quark transversal motions, the flavor asymmetry
between the $u$ and $d$ valence quarks, and the intrinsic quark-antiquark pairs
generated by the non-perturbative meson-baryon fluctuations of the nucleon sea
are taken into account. The meson-baryon fluctuations of the nucleon sea
provide a consistent picture for connecting the proton spin structure with a
number of other anomalies observed in the proton's structure, such as the
flavor asymmetry of the nucleon sea implied by the violation of the Gottfried
sum rule and the discrepancy between two different measurements of the strange
quark distributions in the nucleon sea.
","[{""version"":""v1"",""created"":""Thu, 27 Mar 1997 00:00:24 GMT""},{""version"":""v2"",""created"":""Thu, 27 Mar 1997 21:42:13 GMT""}]","2008-02-03"
"hep-ph/9703427","Zoltan Kunszt","Z. Kunszt (ETH Zuerich), W. J. Stirling (Durham U.)","QCD Corrections and the Leptoquark Interpretation of the HERA High Q^2
  Events","25 pages, LaTeX, incl. 3 postscript figures, uses epsf.sty","Z.Phys.C75:453-463,1997","10.1007/s002880050487","DPT/97/16, ETH-TH/97-10","hep-ph",,"  The excess of high-$Q^2$ events found by H1 and ZEUS at HERA in $e^+p$
deep-inelastic scattering above the Standard Model prediction motivates us to
calculate the NLO QCD corrections to the HERA scalar leptoquark (or squark)
production cross sections. We find that the corrections are significant, of
order 50% in the mass range of interest. We also calculate the leptoquark
average transverse momentum squared and find it to be rather small. Various
leptoquark production cross sections at the Tevatron $p \bar p$ collider are
also considered. We investigate in detail the leptoquark interpretation of the
HERA data. First we assume a minimal leptoquark model with a single diagonal
Yukawa coupling to first family lepton and quark mass eigenstates only. In this
case constraints from atomic parity violating experiments allow only isodoublet
scalar leptoquark production at HERA. This interpretation can be confirmed or
ruled out in the near future by high luminosity data at the Tevatron. The
Tevatron data already appear to rule out the vector leptoquark interpretation
of the HERA data. We also consider a more general model which allows for all
possible left-handed, right-handed, flavour and lepton number changing
couplings. The allowed values of the Yukawa couplings of this general model
offer several different interpretations of the data which are radically
different from the minimal model solutions. However these somewhat ad hoc tuned
solutions can easily be tested by future HERA experiments.
","[{""version"":""v1"",""created"":""Wed, 26 Mar 1997 17:54:45 GMT""}]","2016-09-06"
"hep-ph/9703428","Paul Langacker","Paul Langacker and Jens Erler","Unification or Compositeness?","17 pages,7 figures, Presented at the Ringberg Workshop on the Higgs
  Puzzle, 12/96",,,"UPR-0743T","hep-ph",,"  The status of precision electroweak data, tests of the standard model,
determination of its parameters, and constraints on new physics, are surveyed.
","[{""version"":""v1"",""created"":""Wed, 26 Mar 1997 19:35:41 GMT""}]","2007-05-23"
"hep-ph/9703429","Martin Beneke","M. Beneke (CERN)","Non-relativistic effective theory for Quarkonium Production in Hadron
  Collisions","48 pages, 9 figures, LaTeX, myssi.sty (provided)",,,"CERN-TH/97-55","hep-ph",,"  I review recent progress in understanding inclusive quarkonium production in
hadron collisions. The first part focuses on non-relativistic QCD as an
effective theory. I discuss its differences from and similarities with
effective theories describing bound states of a single heavy quark, as far as
matching calculations beyond tree-level and power counting are concerned. The
second part summarizes predictions for charmonium and bottomonium production at
collider and fixed target experiments and their comparison with data. The
emphasis here is on novel signatures due to color octet production,
polarization of quarkonia and the $\chi_1/\chi_2$ ratio in fixed target
collisions.
","[{""version"":""v1"",""created"":""Wed, 26 Mar 1997 19:35:43 GMT""}]","2007-05-23"
"hep-ph/9703430","Concha Gonzalez-Garcia","E.M. Gregores, M.C. Gonzalez-Garcia, and S.F. Novaes","Discriminating New Physics Scenarios at NLC: The Role of Polarization","26 pages, LaTeX file using ReVTeX. 10 Figures","Phys.Rev. D56 (1997) 2920-2927","10.1103/PhysRevD.56.2920","IFT--P.028/97, FTUV/97-14, IFIC/97-14","hep-ph",,"  We explore the potential of the Next Linear Collider (NLC), operating in the
$e\gamma$ mode, to disentangle new physics scenarios on single $W$ production.
We study the effects related with the exchange of composite fermion in the
reaction $e\gamma \to W \nu_e$, and compare with those arising from trilinear
gauge boson anomalous couplings. We stress the role played by the initial state
polarization to increase the reach of this machine and to discriminate the
possible origin of the new phenomena.
","[{""version"":""v1"",""created"":""Wed, 26 Mar 1997 21:43:33 GMT""}]","2009-10-30"
"hep-ph/9703431","Jan Kalinowski","Jan Kalinowski","Supersymmetric $W$ Boson Decays as a Means to Search for Charginos and
  Neutralinos","LaTeX, 10 pages, 2 figures included, uses epsfig","Acta Phys.Polon.B28:1437-1444,1997",,"DESY 97-050","hep-ph",,"  If the sneutrino mass is below the chargino mass, the dominant decay mode of
the lightest chargino is via a two-body decay channel $\chi^{\pm}_1 \ra
\tilde{\nu} + l^{\pm}$. Sneutrinos are invisible in $R$-parity conserving
supersymmetric models and, if the mass gap $m(\chi^{\pm}_1)-m(\tilde{\nu})$ is
sufficiently small, the soft decay lepton may escape detection leading to
invisible chargino decays. This ``blind spot'' of the supersymmetry parameter
space would jeopardize the chargino search at LEP2. We point out that such a
scenario can be tested by searching for single $W$ events in $e^+e^- \ra
W^+W^-$, with one $W$ boson decaying to visible leptons or quark jets, and the
second $W$ boson decaying to invisible charginos and neutralinos.
","[{""version"":""v1"",""created"":""Wed, 26 Mar 1997 20:06:58 GMT""}]","2011-04-15"
"hep-ph/9703433","Hubert Spiesberger","T. Plehn, H. Spiesberger, M. Spira, and P.M. Zerwas","Formation and Decay of Scalar Leptoquarks/Squarks in ep collisions","10 pages, LaTex file with 3 figures, uses axodraw.sty (included)","Z.Phys. C74 (1997) 611-614",,"DESY 97-043","hep-ph",,"  The cross sections for the formation of scalar resonances, leptoquarks or
squarks, in electron/positron-proton collisions at HERA are presented including
next-to-leading order QCD corrections. Depending mildly on the mass of the
resonances, the K-factors increase the production cross sections by up to 30%
if the target quarks are valence quarks. The QCD corrections to the partial
decay widths of leptoquarks/squarks to leptons and quarks are small. The
electron spectrum in the decays is softened nevertheless by perturbative gluon
radiation at a level of 3.4 GeV for a leptoquark/squark mass of 200 GeV.
","[{""version"":""v1"",""created"":""Wed, 26 Mar 1997 20:17:27 GMT""}]","2007-05-23"
"hep-ph/9703434","Goran Senjanovic","C.S. Aulakh, K. Benakli, and G. Senjanovic","Reconciling Supersymmetry and Left-Right Symmetry","4 pages, revtex, no figures","Phys.Rev.Lett.79:2188-2191,1997","10.1103/PhysRevLett.79.2188","TAMU-19","hep-ph",,"  We construct the minimal supersymmetric left-right theory and show that at
the renormalizable level it requires the existence of an intermediate $B-L$
breaking scale. The subsequent symmetry breaking down to MSSM automatically
preserves R-symmetry. Furthermore, unlike in the nonsupersymmetric version of
the theory, the see-saw mechanism takes its canonical form. The theory predicts
the existence of a triplet of Higgs scalars much lighter than the $B-L$
breaking scale.
","[{""version"":""v1"",""created"":""Wed, 26 Mar 1997 21:08:22 GMT""}]","2011-02-09"
"hep-ph/9703435","David Bowser-Chao","David Bowser-Chao, Darwin Chang, Wai-Yee Keung","Electron Electric Dipole Moment from CP Violation in the Charged Higgs
  Sector","resubmission now matches published version in PRL, plus adds
  reference to AGS proposal to measure the muon edm to 10^-24 e-cm; complete
  uncompressed postscript at
  http://hepster.phy.uic.edu/~davechao/work/default.html","Phys.Rev.Lett.79:1988-1991,1997","10.1103/PhysRevLett.79.1988","NHCU-HEP-97-5, UICHEP-TH/97-3","hep-ph",,"  The leading contributions to the electron (or muon) electric dipole moment
due to CP violation in the charged Higgs sector are at the two-loop level. A
careful analysis of the model-independent contribution is provided. We also
consider specific scenarios to demonstrate how charged Higgs sector CP
violation can naturally give rise to large electric dipole moments. Numerical
results show that the electron electric dipole moment in such models can lie at
the experimentally accessible level.
","[{""version"":""v1"",""created"":""Wed, 26 Mar 1997 22:34:12 GMT""},{""version"":""v2"",""created"":""Tue, 2 Dec 1997 23:15:08 GMT""}]","2009-09-01"
"hep-ph/9703436","Hubert Spiesberger","J. Kalinowski, R. Rueckl, H. Spiesberger and P.M. Zerwas","Supersymmetry with R-Parity Breaking: Contact Interactions and Resonance
  Formation in Leptonic Processes at LEP2","13 pages, LaTex file with 3 figures, uses axodraw.sty (included).
  References updated / limits from rare B decays on Yukawa couplings updated,
  favoring tau-sneutrinos over mu-sneutrinos/ numerical results unchanged","Phys.Lett.B406:314-320,1997","10.1016/S0370-2693(97)00706-5","DESY 97-044","hep-ph",,"  In supersymmetric theories with R-parity breaking, trilinear couplings of two
leptons to scalar sleptons are possible. In electron-positron collisions such
interactions would manifest themselves through contact terms in Bhabha
scattering and in annihilation to mu or tau pair Interpreting the high x, high
Q2 DIS HERA events as charm squark production with squark masses of order 200
GeV, the formation of tau sneutrinos with a mass in the range close to the LEP2
energy or even in reach, is an exciting speculation which can be investigated
in the coming LEP2 runs with energies close to 200 GeV.
","[{""version"":""v1"",""created"":""Wed, 26 Mar 1997 22:52:54 GMT""},{""version"":""v2"",""created"":""Tue, 8 Apr 1997 18:53:23 GMT""}]","2011-05-05"
"hep-ph/9703438","Qiao Cong Feng","Feng Yuan, Cong-Feng Qiao, and Kuang-Ta Chao(Peking University)","Prompt J/psi production at e^+e^- colliders","15 page, LaTex, 9 figures in postscript. Submitted to Phys. Rev. D","Phys.Rev. D56 (1997) 321-328","10.1103/PhysRevD.56.321","PUTP-96-30","hep-ph",,"  In this paper, we discuss the prompt j/psi production at e^+e^- colliders via
color-singlet and color-octet production mechanisms. The color-singlet
production processes include 1) e^+e^- to J/\psi gg; 2) e^+e^- to J/\psi
c\bar{c}; 3) e^+e^- to q \bar q ggJ/\psi and e^+e^- to q \bar q g\chi_c
followed by \chi_c to J/\psi \gamma. The color-octet production processes
include 1) e^+e^- to J/\psi g; 2) e^+e^- to j/psi q\bar q. Of all these
production channels, we find that the color-octet contributions dominate over
the color-singlet contributions at any energy scales. At low energies
(\sqrt{s}< 20 GeV), the dominant channel is e^+e^- to J/\psi g whereas at high
energies e+e^- to j/psi q\bar q will take the leading part. We also find that
the energy spectrum for the color-octet j/psi production in process e^+e^- to
j/psi q\bar q is very soft, and the mean energy of the produced j/psi is only
about 10 GeV~ 20 GeV even at very high energies (e.g. at 1000 GeV). The
extraction of color-octet matrix elements from j/psi production in e^+e^-
collisions is also discussed.
","[{""version"":""v1"",""created"":""Thu, 27 Mar 1997 07:21:54 GMT""}]","2009-10-30"
