"astro-ph/9703172","Mordecai-Mark Mac Low","Mordecai-Mark Mac Low (MPI Astronomy, Heidelberg) and Michael D. Smith
  (Astron. Inst., Uni. Wuerzburg)","Nonlinear Development and Observational Consequences of Wardle C-Shock
  Instabilities","24 pages, 18 figures, uses aaspp4.sty, submitted to ApJ, 26 March
  1997 Larger figures are jpegs; original postscript is available from
  http://www.mpia-hd.mpg.de/MPIA/Projects/THEORY/maclow/papers/cshk/p2.html",,"10.1086/304981",,"astro-ph",,"  We compute the nonlinear development of the instabilities in C-shocks first
described by Wardle, using a version of the ZEUS code modified to include a
semi-implicit treatment of ambipolar diffusion. We find that, in three
dimensions, thin sheets parallel to the shock velocity and perpendicular to the
magnetic field lines form. High resolution, two-dimensional models show that
the sheets are confined by the Brandenburg & Zweibel ambipolar diffusion
singularity, forcing them to numerically unresolvable thinness. Hot and cold
regions form around these filaments, disrupting the uniform temperature
structure characteristic of a steady-state C-shock. This filamentary region
steadily grows as the shock progresses. We compare steady-state to unstable
C-shocks, showing excitation diagrams, line ratios, and line profiles for
molecular hydrogen lines visible in the K-band, with the Infrared Space
Observatory, and with NICMOS on the Hubble Space Telescope.
","[{""version"":""v1"",""created"":""Wed, 26 Mar 1997 16:06:27 GMT""}]","2009-10-30"
"astro-ph/9703174","Mike Turner","Michael S. Turner (U. Chicago/Fermilab)","Cosmology: From Hubble to HST","15 pages LaTeX with 6 eps figures. To be published in The
  Extragalactic Distance Scale, edited by M. Livio, M. Donahue, and N. Panagia
  (Cambridge University Press, 1997)",,,,"astro-ph hep-ph",,"  The Hubble constant sets the size and age of the Universe, and, together with
independent determinations of the age, provides a consistency check of the
standard cosmology. The Hubble constant also provides an important test of our
most attractive paradigm for extending the standard cosmology, inflation and
cold dark matter.
","[{""version"":""v1"",""created"":""Wed, 26 Mar 1997 17:18:47 GMT""}]","2007-05-23"
"astro-ph/9703175","Hale Bradt","Hale Bradt (M.I.T.)","Some Early Results from the Rossi X-ray Timing Explorer (RXTE)","13 pages Latex, 13 figs postscript. To be published in Proceedings of
  Vulcano 1996 Workshop on ""Frontier Objects in Astrophysics and Particle
  Physics"", May 1996, ed. F. Giovanelli, Societa Italiana di Fisica, and also
  in ""Proceedings of the 5th International Workshop on Data Analysis in
  Astronomy"",CCSEM Center, Erice, Italy (Oct. 1996), eds. L. Scarsi and C.
  Maccarone, World Scientific Publ. Co",,,,"astro-ph",,"  The Rossi X-ray Timing Explorer (RXTE) was successfully launched on 1995
December 30 and has been operational since that time. Its three instruments are
probing regions close to compact objects, degenerate dwarfs, neutron stars,
stellar black holes and the central engines of AGN. Temporal studies with the
ASM and PCA have already yielded rich results which pertain to the environs,
evolution, and nature of the compact objects in galactic systems. Here I review
some selected results from these instruments, as obtained by various RXTE
observers. The ASM is providing detailed light curves of about 60 detected
sources and has uncovered new temporal/spectral states of galactic binary
systems. The bizarre behavior of the possibly very young binary system, Cir
X-1, is being revealed in detail by both the ASM and the PCA. A rare high/soft
state of the black-hole candidate, Cyg X-1 provides new insight into the nature
of the low/high transitions in black-hole binaries. The PCA has made possible
the discovery of oscillations near 1 kHz in ten low-mass X-ray binary systems.
These are most probably direct indicators of the neutron-star spin in some
cases and probably indirect indicators in others. Studies of microquasars have
unveiled a host of new temporal phenomena which may provide links between
accretion processes and the radio jets in these systems.
","[{""version"":""v1"",""created"":""Wed, 26 Mar 1997 17:03:26 GMT""}]","2007-05-23"
"astro-ph/9703176","Benjamin Mathiesen","B. Mathiesen (1), A. E. Evrard (1,2) ((1) University of Michigan, (2)
  Institut d'Astrophysique, Paris)","Constraints on \Omega_0 and Cluster Evolution Using the ROSAT LogN-LogS","MNRAS LaTeX style format, submitted to MNRAS 3/26/97. Thirteen pages,
  eleven postscript figures. Uses epsf macros to include figures",,"10.1046/j.1365-8711.1998.01217.x",,"astro-ph",,"  We examine the likelihoods of different cosmological models and cluster
evolutionary histories by comparing semi-analytical predictions of X-ray
cluster number counts to observational data from the ROSAT satellite. We model
cluster abundance as a function of mass and redshift using a Press-Schechter
distribution, and assume the temperature T(M,z) and bolometric luminosity
L_X(M,z) scale as power laws in mass and epoch, in order to construct expected
counts as a function of X-ray flux. The L_X-M scaling is fixed using the local
luminosity function while the degree of evolution in the X-ray luminosity with
redshift L_X \propto (1+z)^s is left open, with s an interesting free parameter
which we investigate. We examine open and flat cosmologies with initial,
scale-free fluctuation spectra having indices n = 0, -1 and -2. An independent
constraint arising from the slope of the luminosity-temperature relation
strongly favors the n = -2 spectrum.
  The expected counts demonstrate a strong dependence on \Omega_0 and s, with
lesser dependence on \lambda_0 and n. Comparison with the observed counts
reveals a ""ridge"" of acceptable models in the \Omega_0 - s plane, roughly
following the relation s = 6 \Omega_0 and spanning low-density models with a
small degree of evolution to \Omega = 1 models with strong evolution. Models
with moderate evolution are revealed to have a strong lower limit of \Omega_0
\gtrsim 0.3, and low-evolution models imply that \Omega_0 < 1 at a very high
confidence level. We suggest observational tests for breaking the degeneracy
along this ridge, and discuss implications for evolutionary histories of the
intracluster medium.
","[{""version"":""v1"",""created"":""Thu, 27 Mar 1997 00:59:01 GMT""},{""version"":""v2"",""created"":""Thu, 27 Mar 1997 01:11:33 GMT""}]","2009-10-30"
"astro-ph/9703177","Patrick M. Ogle","M. H. Cohen, R. C. Vermeulen, P. M. Ogle, H. D. Tran, R. W. Goodrich","PKS 0116+082: An Optically Variable Compact Steep-Spectrum Source in an
  NLRG","24 pages, 6 figures, to appear in July 1997 ApJ",,"10.1086/304328",,"astro-ph",,"  Polarimetry of the narrow-line radio galaxy PKS 0116+082 at the W.M. Keck
telescope shows that it has high and variable optical polarization, presumably
due to synchrotron radiation. It is not a BL Lac object because it has strong
narrow lines, and it is not an OVV quasar because it has no broad lines and the
extended galaxy is prominent. VLA and VLBA images show that it is a compact
steep-spectrum radio source with most of the emission coming from a region less
than 100 milli-arcsec in size. Of the 25 compact steep-spectrum or gigahertz
peaked-spectrum sources measured polarimetrically, four have high optical
polarization. One of these has been observed only once but in the other three
the polarization is variable. This gives an intriguing hint that variability
may be a general property of these objects.
","[{""version"":""v1"",""created"":""Wed, 26 Mar 1997 23:55:45 GMT""}]","2009-10-30"
"astro-ph/9703178","Paul Francis","Paul J. Francis (Melbourne), Bruce E. Woodgate (GSFC) and Anthony C.
  Danks (Hughes STX)","A Group of Red, Ly-alpha Emitting, High Redshift Galaxies","12 pages, 2 figures, uses aaspp4 style file. Accepted for publication
  in Astrophysical Journal Letters",,"10.1086/310667",,"astro-ph",,"  We have discovered two new high redshift (z=2.38) galaxies, near the
previously known z=2.38 galaxy 2139-4434 B1 (Francis et al. 1996).
  All three galaxies are strong Ly-alpha emitters, and have much redder
continuum colors (I-K about 5) than other optically-selected high redshift
galaxies. We hypothesize that these three galaxies are QSO IIs; radio-quiet
counterparts of high redshift radio galaxies, containing concealed QSO nuclei.
The red colors are most easily modelled by an old (> 0.5 Gyr), massive (> 10E11
solar masses) stellar population. If true, this implies that at least one
galaxy cluster of mass much greater than 3E11 solar masses had collapsed before
redshift five.
","[{""version"":""v1"",""created"":""Thu, 27 Mar 1997 03:50:40 GMT""}]","2009-10-30"
"astro-ph/9703179","S. C. Tripathy","S.C. Tripathy, H.M. Antia, F. Hill and A. Ambastha","Seismic investigation of the solar structure using GONG frequencies","Latex, 2 pages, 3 figures, To appear in the IAU Symp. # 181:
  ""Sounding solar and stellar interiors"", eds. F.X. Schmider & J. Provost",,,,"astro-ph",,"  Using the recently obtained GONG frequencies, we investigate the properties
of the solar interior by constructing solar models with various input physics
like opacities, equation of state, nuclear reaction rates etc. The differential
asymptotic inversion technique is then used to infer the relative difference in
sound speed between the Sun and solar models. Here we apply these results to
test equation of state and different formulation for calculating the convective
flux.
","[{""version"":""v1"",""created"":""Thu, 27 Mar 1997 11:03:00 GMT""}]","2007-05-23"
"astro-ph/9703181","Mike E. Prokhorov","V.M. Lipunov, K.A. Postnov, M.E. Prokhorov (Sternberg Astronomical
  Institute, Moscow, Russia)","An independent estimate of the cosmological distance to GRB970228 and
  GRB970508","LaTeX, A&A style, 3 pages, includes 2 postscript figures",,,,"astro-ph",,"  Assuming binary neutron star mergings as a standard-candle model for GRBs, an
independent estimate is obtained for the redshift of GRB970228 and GRB970508
with optical counterparts, using mean statistical properties of GRBs observed
by BATSE. We derive z=0.7\pm 0.1 and z=1.9\pm 0.1 for GRB970228 and GRB970508
respectively, depending on the power-law index of the GRB spectrum s=-1.1\pm
0.3 and the value of the redshift of the initial star formation z_*=3-10 in a
flat \Omega=1 Universe with a cosmological term \Lambda=0.7.
","[{""version"":""v1"",""created"":""Thu, 27 Mar 1997 11:09:21 GMT""},{""version"":""v2"",""created"":""Fri, 28 Mar 1997 10:15:00 GMT""},{""version"":""v3"",""created"":""Tue, 13 May 1997 14:37:18 GMT""}]","2008-02-03"
"astro-ph/9703182","Kampert","KASCADE Collaboration, K.-H. Kampert, et al","First Results from the KASCADE Air-Shower Experiment","6 pages PostScript file, including 6 figures",,,,"astro-ph",,"  A new extensive air shower (EAS) experiment has been installed at the
laboratory site of the Forschungszentrum Karlsruhe. The major goal of the
experiment is to determine the chemical composition in the energy range around
and above the knee of the primary cosmic ray spectrum. An important advantage
of the installation is the capability to simultaneously measure the
electromagnetic, muonic and hadronic components of EAS event-by-event, thereby
reducing systematic uncertainties to a large extend. Data taking with a large
part of the experiment has started at the end of 1995 with further
installations continuing during 1996. First preliminary results are presented.
","[{""version"":""v1"",""created"":""Thu, 27 Mar 1997 12:08:43 GMT""}]","2007-05-23"
"astro-ph/9703183","Frazer Pearce","F.R. Pearce, H.M.P. Couchman","Hydra: A Parallel Adaptive Grid Code","23 pages, LaTex plus encapsulated figures",,"10.1016/S1384-1076(97)00025-0","FRP_du1","astro-ph",,"  We describe the first parallel implementation of an adaptive
particle-particle, particle-mesh code with smoothed particle hydrodynamics.
Parallelisation of the serial code, ``Hydra'', is achieved by using CRAFT, a
Cray proprietary language which allows rapid implementation of a serial code on
a parallel machine by allowing global addressing of distributed memory.
  The collisionless variant of the code has already completed several 16.8
million particle cosmological simulations on a 128 processor Cray T3D whilst
the full hydrodynamic code has completed several 4.2 million particle combined
gas and dark matter runs. The efficiency of the code now allows parameter-space
explorations to be performed routinely using $64^3$ particles of each species.
A complete run including gas cooling, from high redshift to the present epoch
requires approximately 10 hours on 64 processors.
  In this paper we present implementation details and results of the
performance and scalability of the CRAFT version of Hydra under varying degrees
of particle clustering.
","[{""version"":""v1"",""created"":""Thu, 27 Mar 1997 15:38:41 GMT""}]","2009-10-30"
"cond-mat/9703226","Enrico Carlon","Enrico Carlon (KU Leuven, Belgium) and Andrzej Drzewinski (Inst. for
  Low Temp. and Structure Research, PAS, Wroclaw, Poland)","Effect of Gravity and Confinement on Phase Equilibria: A Density Matrix
  Renormalization Approach","4 pages, RevTeX and 4 PostScript figures included. Final version as
  published. To appear in Phys. Rev. Lett","Phys. Rev. Lett. 79, 1591 (1997)","10.1103/PhysRevLett.79.1591",,"cond-mat.stat-mech",,"  The phase diagram of the 2D Ising model confined between two infinite walls
and subject to opposing surface fields and to a bulk ""gravitational"" field is
calculated by means of density matrix renormalization methods. In absence of
gravity two phase coexistence is restricted to temperatures below the wetting
temperature. We find that gravity restores the two phase coexistence up to the
bulk critical temperature, in agreement with previous mean-field predictions.
We calculate the exponents governing the finite size scaling in the temperature
and in the gravitational field directions. The former is the exponent which
describes the shift of the critical temperature in capillary condensation. The
latter agrees, for large surface fields, with a scaling assumption of Van
Leeuwen and Sengers. Magnetization profiles in the two phase and in the single
phase region are calculated. The profiles in the single phase region, where an
interface is present, agree well with magnetization profiles calculated from a
simple solid-on-solid interface hamiltonian.
","[{""version"":""v1"",""created"":""Wed, 26 Mar 1997 16:07:49 GMT""},{""version"":""v2"",""created"":""Thu, 21 Aug 1997 10:47:36 GMT""}]","2009-10-30"
"cond-mat/9703227",,"O. Sommelius (Theoretical Physics, Lund U.)","On the Kinetic Behavior and Folding Properties of an Off-Lattice
  Heteropolymer Model","7 pages LaTeX",,,"LU TP 97-04","cond-mat.soft physics.chem-ph q-bio",,"  The kinetic behavior of a three-dimensional off-lattice heteropolymer model
is studied in terms of the time dependence of the average mean-square
displacement between configurations. It is found that at short time-scales
similar behavior is obtained even for sequences with very different
thermodynamic properties. Furthermore, the degree of cooperativity in the
folding process is examined by studying the residual number of degrees of
freedom, obtained from an eigenvalue analysis of the correlation matrix,
contributing to the structural fluctuations. In the compact state, a gradual
decrease in this effective number of degrees of freedom take place as the
temperature is lowered. This can be interpreted as an increasing asymmetry of
the energy landscape.
","[{""version"":""v1"",""created"":""Wed, 26 Mar 1997 16:47:57 GMT""}]","2008-02-03"
"cond-mat/9703228",,"G. E. Volovik and V. M. Yakovenko","Hopf Term for a Two-Dimensional Electron Gas","RevTeX, 1 page, no figures","Phys. Rev. Lett. 79, 3791 (1997)","10.1103/PhysRevLett.79.3791",,"cond-mat.str-el cond-mat.mes-hall hep-th",,"  In this Comment on the paper by W. Apel and Yu. A. Bychkov, cond-mat/9610040
and Phys. Rev. Lett. 78, 2188 (1997), we draw attention to our prior
microscopic derivations of the Hopf term for various systems and to
shortcomings of the Apel-Bychkov derivation. We explain how the value of the
Hopt term prefactor $\Theta$ is expressed in terms of a topological invariant
in the momentum space and the quantized Hall conductivity of the system. (See
also related paper cond-mat/9703195)
","[{""version"":""v1"",""created"":""Wed, 26 Mar 1997 18:03:14 GMT""}]","2009-10-30"
"cond-mat/9703229","Richard N. Silver","R. N. Silver, H. Roder (Los Alamos National Laboratory)","Calculation of Densities of States and Spectral Functions by Chebyshev
  Recursion and Maximum Entropy","8 pages RevTex, 3 postscript figures",,"10.1103/PhysRevE.56.4822","LAUR-97-1012","cond-mat",,"  We present an efficient algorithm for calculating spectral properties of
large sparse Hamiltonian matrices such as densities of states and spectral
functions. The combination of Chebyshev recursion and maximum entropy achieves
high energy resolution without significant roundoff error, machine precision or
numerical instability limitations. If controlled statistical or systematic
errors are acceptable, cpu and memory requirements scale linearly in the number
of states. The inference of spectral properties from moments is much better
conditioned for Chebyshev moments than for power moments. We adapt concepts
from the kernel polynomial approximation, a linear Chebyshev approximation with
optimized Gibbs damping, to control the accuracy of Fourier integrals of
positive non-analytic functions. We compare the performance of kernel
polynomial and maximum entropy algorithms for an electronic structure example.
","[{""version"":""v1"",""created"":""Wed, 26 Mar 1997 19:46:48 GMT""}]","2009-10-30"
"cond-mat/9703230","Eugene Shakhnovich","A.Gutin, V.Abkevich and E.Shakhnovich","Reply to the comment by C.Camacho on PRL, v.77, p.5433",,,,,"cond-mat",,"  In this brief reply we point out to some misconceptions in C.Camacho's
comment (cond-mat/9701210).
","[{""version"":""v1"",""created"":""Wed, 26 Mar 1997 20:27:30 GMT""}]","2007-05-23"
"cond-mat/9703231","YuKui. Zhou","Y.-K. Zhou (ANU)","Fateev-Zamolodchikov and Kashiwara-Miwa models: boundary star-triangle
  relations and surface critical properties","17 pages, no ps figures, latex file","Nucl Phys B 487(1997)779","10.1016/S0550-3213(96)00674-8","MRR 008-97","cond-mat.stat-mech",,"  The boundary Boltzmann weights are found by solving the boundary
star-triangle relations for the Fateev-Zamolodchikov and Kashiwara-Miwa models.
We calculate the surface free energies of the models. The critical surface
exponent \alpha_s of the Kashiwara-Miwa model is given and satisfies the
scaling relation \alpha_b=2\alpha_s-2, where \alpha_b is the bulk exponent.
","[{""version"":""v1"",""created"":""Thu, 27 Mar 1997 01:31:09 GMT""}]","2009-10-30"
"cond-mat/9703232","Stoyan Vlaev Jelev","S. Vlaev (Inst. Gen. Inorg. Chemistry, Bulgaria and EFUAZ, Mexico), D.
  A. Contreras-Solorio (EFUAZ, Mexico)","Electronic States in Diffused Quantum Wells","ReVTeX file, 7pp., no macros, 4 figures available on the request",,"10.1063/1.365750","EFUAZ FT-97-42","cond-mat",,"  In the present study we calculate the energy values and the spatial
distributions of the bound electronic states in some diffused quantum wells.
The calculations are performed within the virtual crystal approximation, $sp^3
s^*$ spin dependent empirical tight-binding model and the surface Green
function matching method. A good agreement is found between our results and
experimental data obtained for AlGaAs/GaAs quantum wells with thermally induced
changes in the profile at the interfaces. Our calculations show that for
diffusion lengths $L_{D}=20\div100$ {\AA} the transition (C3-HH3) is not
sensitive to the diffusion length, but the transitions (C1-HH1), (C1-LH1),
(C2-HH2) and (C2-LH2) display large ""blue shifts"" as L_{D} increases. For
diffusion lengths $L_{D}=0\div20$ {\AA} the transitions (C1-HH1) and (C1-LH1)
are less sensitive to the L_{D} changes than the (C3-HH3) transition. The
observed dependence is explained in terms of the bound states spatial
distributions.
","[{""version"":""v1"",""created"":""Thu, 27 Mar 1997 04:48:57 GMT""}]","2009-10-30"
"cond-mat/9703233","Dr. Markus Johannes Thill","M.J. Thill","A new old algorithm, entropy sampling, and/or getting in and out of
  energy minima","Uses aps, prl, multicol, epsf, and revtex; 2 figures",,,,"cond-mat",,"  I propose a new algorithm, a free energy Monte Carlo algorithm, for
calculations where conventional Monte Carlo simulations struggle with
ergodicity problems. The simplest version of the proposed algorithm allows for
the determination of the entropy function of statistical systems and/or
performs entropy sampling at sufficiently large times. I also mention how this
algorithm can be used to explore the system's energy space, in particular for
minima.
","[{""version"":""v1"",""created"":""Thu, 27 Mar 1997 06:18:23 GMT""}]","2007-05-23"
"cond-mat/9703234","Dr. Markus Johannes Thill","M.J. Thill","On the Free Energy Monte Carlo algorithm","Uses aps, epsf, and revtex; 7 figures",,,,"cond-mat",,"  In this paper, I investigate more closely the recently proposed Free Energy
Monte Carlo algorithm that is devised in particular for calculations where
conventional Monte Carlo simulations struggle with ergodicity problems. The
simplest version of the proposed algorithm allows for the determination of the
entropy function of statistical systems and/or performs entropy sampling at
sufficiently large times. I also show how this algorithm can be used to explore
the system's energy space, in particular for minima.
","[{""version"":""v1"",""created"":""Thu, 27 Mar 1997 07:04:54 GMT""}]","2007-05-23"
"cond-mat/9703235","Heiko Rieger","U. Geppert, H. Rieger, M. Schreckenberg","A hierarchical model for aging","10 pages LaTeX, 4 postscript-figures included","J. Phys. A 30 (1997) L393","10.1088/0305-4470/30/12/001","HLRZ-11/97","cond-mat.dis-nn",,"  We present a one dimensional model for diffusion on a hierarchical tree
structure. It is shown that this model exhibits aging phenomena although no
disorder is present. The origin of aging in this model is therefore the
hierarchical structure of phase space.
","[{""version"":""v1"",""created"":""Thu, 27 Mar 1997 09:32:41 GMT""}]","2009-10-30"
"cond-mat/9703236","Giuseppe Iannaccone","G. Iannaccone, M. Macucci, B. Pellegrini","Theory of conductance and noise additivity in parallel mesoscopic
  conductors","4 pages, 2 figures","Phys. Rev. B vol. 36, 12104 (1997).","10.1103/PhysRevB.56.12104",,"cond-mat.mes-hall",,"  We present a theory of conductance and noise in generic mesoscopic conductors
connected in parallel, and we demonstrate that the additivity of conductance
and of shot noise arises as a sole property of the junctions connecting the two
(or more) conductors in parallel. Consequences on the functionality of devices
based on the Aharonov-Bohm effect are also drawn.
","[{""version"":""v1"",""created"":""Thu, 27 Mar 1997 12:32:31 GMT""}]","2009-10-30"
"cond-mat/9703237","Walter Kob","Jurgen Horbach, Walter Kob, and Kurt Binder (Institute of Physics,
  Mainz, Germany)","Molecular Dynamics Computer Simulation of the Dynamics of Supercooled
  Silica","5 pages, Latex, 6 postscript figures","Phil. Mag. B 77, 297 (1998)","10.1080/13642819808204955","KOMA-97-06","cond-mat.dis-nn",,"  We present the results of a large scale computer simulation of supercooled
silica. We find that at high temperatures the diffusion constants show a
non-Arrhenius temperature dependence whereas at low temperature this dependence
is also compatible with an Arrhenius law. We demonstrate that at low
temperatures the intermediate scattering function shows a two-step relaxation
behavior and that it obeys the time temperature superposition principle. We
also discuss the wave-vector dependence of the nonergodicity parameter and the
time and temperature dependence of the non-Gaussian parameter.
","[{""version"":""v1"",""created"":""Thu, 27 Mar 1997 13:37:19 GMT""}]","2015-06-25"
