"hep-ph/9703439","Cai-Dian Lue","Cai-Dian Lu (Hamburg) and Da-Xin Zhang (Technion)","Calculations of penguin diagrams in B decays","Latex, 14 pages, including 3 figures (Postscript)","Phys.Lett. B400 (1997) 188-193","10.1016/S0370-2693(97)00343-2","TECHNION-PH-96-21, DESY 97-051","hep-ph",,"  We analyze the effects of the space-like penguin diagrams in two body B
decays $B^-\to K^-{\bar K}^0$ and $B^-\to \pi^-{\bar K}^0$. Special attention
is paid to the operator $Q_6$, whose contribution is large in the BSW model,
but vanishes in the PQCD method in the approximation of neglecting the masses
in the final states. Suppressions of the space-like penguin diagrams are found
in the PQCD method, which implies that the contributions of the space-like
penguins are small compared to those of the time-like penguins.
","[{""version"":""v1"",""created"":""Thu, 27 Mar 1997 10:28:48 GMT""},{""version"":""v2"",""created"":""Mon, 7 Apr 1997 10:58:56 GMT""}]","2009-10-30"
"hep-ph/9703440","Kampert","K.H. Kampert, T.C. Awes, P. Stankus, H.H. Gutbrod, V. Manko, T.
  Peitzmann, and R. Santo","Comment on: ``Search for direct photons from S-Au Collisions at 200
  GeV/nucleon'' by the CERES Collaboration","11 pages, 1 figure, Accepted for publication in Z. Phys. C","Z.Phys. C74 (1997) 587-591",,,"hep-ph",,"  In this note we comment on a recent publication in this journal by the CERES
(NA45) Collaboration. The authors report to have determined an upper limit on
the direct photon yield relative to the decay photon yield in S+Au collisions
of 14 % and 7 % by two different methods, respectively. We argue that these
limits are unsupported by the results and analysis of the CERES data. The
systematic error estimates quoted in the CERES analysis are consistently overly
optimistic. Using more realistic estimates of the various error contributions
and propagating them appropriately we arrive at a direct photon upper limit
which at best is 20% of the inclusive photon yield, and most probably is much
higher.
","[{""version"":""v1"",""created"":""Thu, 27 Mar 1997 12:49:52 GMT""}]","2007-05-23"
"hep-ph/9703441","Yara do Amaral Coutinho","F. M. L. Almeida Jr, Y. A. Coutinho, J. A. Martins Sim\~oes, P. P.
  Queiroz Filho and C. M. Porto","Same-sign dileptons as a signature for heavy Majorana neutrinos in
  hadron-hadron collisions","07 pages, LaTeX; to be published in Physics Letters B","Phys.Lett.B400:331-334,1997","10.1016/S0370-2693(97)00143-3",,"hep-ph",,"  We discuss the possibility of same-sign dileptons as a signature for Majorana
neutrinos. The production mechanism is given by a single heavy neutrino
production and decay proton-proton -> l^{\pm} N X -> l^{\pm} l^{\pm} X'. Cross
section and distributions are presented for the LHC energies.
","[{""version"":""v1"",""created"":""Thu, 27 Mar 1997 09:54:57 GMT""}]","2008-11-26"
"hep-ph/9703442","Mikolaj Misiak","Mikolaj Misiak, Stefan Pokorski and Janusz Rosiek","Supersymmetry and FCNC effects","45 pages, 19 figures, uses epsfig.sty, (axodraw.sty included) To
  appear in the Review Volume ``Heavy Flavours II'', eds. A.J. Buras and M.
  Lindner, Advanced Series on Directions in High Energy Physics, World
  Scientific Publishing Co., Singapore. Revision made on November 19, 1997
  amounts to including ""note added"" concerning bounds on delta_LR from
  charginos, and a few correlated minor changes. Misprint in eq. (A.5)
  corrected",,"10.1142/9789812812667_0012","IFT 3/97","hep-ph",,"  We consider Flavour Changing Neutral Current processes in the framework of
the supersymmetric extension of the Standard Model. FCNC constraints on the
structure of sfermion mass matrices are reviewed. Furthermore, we analyze
supersymmetric contributions to FCNC transitions which remain in the limit of
flavour-conserving sfermion mass matrices. Implications of the FCNC constraints
on the structure of sfermion mass matrices for SUSY breaking and sfermion mass
generation are discussed. We conclude that the supersymmetric flavour problem
is intriguing but perhaps not as severe as it is commonly believed.
","[{""version"":""v1"",""created"":""Thu, 27 Mar 1997 15:22:35 GMT""},{""version"":""v2"",""created"":""Wed, 19 Nov 1997 20:16:25 GMT""}]","2016-11-03"
"hep-ph/9703447","Oleg Teryaev","J. Soffer and O. V. Teryaev","Comment on the Burkhardt - Cottingham and Generalized
  Gerasimov-Drell-Hearn Sum Rules for the neutron","LATEX, 4 pages, 1 figure in the separate postscript file","Phys.Rev. D56 (1997) 7458-7460","10.1103/PhysRevD.56.7458","CPT-97/P.3466","hep-ph",,"  A description of the generalized Gerasimov-Drell-Hearn sum rule for neutron
is suggested, using its relation to the Burkhardt-Cottingham sum rule.
","[{""version"":""v1"",""created"":""Thu, 27 Mar 1997 13:56:24 GMT""}]","2009-10-30"
"hep-th/9703190","Sergei Lukyanov","S. Lukyanov","Form-factors of exponential fields in the sine-Gordon model","8 pages, harvmac.tex, added the formula (25) for two soliton
  form-factors at the reflectionless points","Mod.Phys.Lett. A12 (1997) 2543-2550","10.1142/S0217732397002673","CLNS 96/1471","hep-th cond-mat math.QA q-alg",,"  An integral representation for form-factors of exponential fields in the
sine-Gordon model is proposed.
","[{""version"":""v1"",""created"":""Wed, 26 Mar 1997 17:58:36 GMT""},{""version"":""v2"",""created"":""Thu, 3 Apr 1997 16:40:50 GMT""}]","2009-10-30"
"hep-th/9703191","Jeong-Hyuck Park","Jeong-Hyuck Park","N=1 Superconformal Symmetry in Four Dimensions","32 pages, no figure, LaTeX. New references added, A result corrected","Int.J.Mod.Phys. A13 (1998) 1743-1772","10.1142/S0217751X98000755","DAMTP 97-27","hep-th",,"  N=1, d=4 superconformal group is studied and its representations are
discussed. Under superconformal transformations, left invariant derivatives and
some class of superfields, including supercurrents, are shown to follow these
representations. In other words, these superfields are quasi-primary by analogy
with two dimensional conformal field theory. Based on these results, we find
the general forms of the two-point and the three-point correlation functions of
the quasi-primary superfields in a group theoretical way. In particular, we
show that the two-point function of the supercurrent is unique up to a constant
and the general form of the three-point function of the supercurrent has two
free parameters.
","[{""version"":""v1"",""created"":""Wed, 26 Mar 1997 18:12:45 GMT""},{""version"":""v2"",""created"":""Tue, 6 Jan 1998 18:59:42 GMT""},{""version"":""v3"",""created"":""Fri, 24 Jul 1998 11:18:57 GMT""},{""version"":""v4"",""created"":""Thu, 11 Feb 1999 10:50:46 GMT""}]","2016-09-06"
"hep-th/9703192","Nikolaos Mavromatos","P. Kanti, N.E. Mavromatos, J. Rizos, K. Tamvakis, E. Winstanley","Dilatonic Black Holes in Higher-Curvature String Gravity II: Linear
  Stability","25 pages LaTeX file, 5 LaTeX figures (included)","Phys.Rev. D57 (1998) 6255-6264","10.1103/PhysRevD.57.6255","Oxford OUTP-12-P","hep-th gr-qc",,"  We demonstrate linear stability of the dilatonic Black Holes appearing in a
string-inspired higher-derivative gravity theory with a Gauss- Bonnet
curvature-squared term. The proof is accomplished by mapping the system to a
one-dimensional Schrodinger problem which admits no bound states. This result
is important in that it constitutes a linearly stable example of a black hole
that bypasses the `no-hair conjecture'. However, the dilaton hair is
`secondary'in the sense that it is not accompanied by any new quantum number
for the black hole solution.
","[{""version"":""v1"",""created"":""Wed, 26 Mar 1997 20:59:13 GMT""}]","2009-10-30"
"hep-th/9703193","Yoonbai Kim","Yoonbai Kim, Phillial Oh and Chaiho Rim","Self-dual Chern-Simons Solitons in the Planar Ferromagnet","11 pages of LaTeX, Three figures of pslatex files are included","Mod.Phys.Lett.A12:3169-3176,1997","10.1142/S0217732397003290","SNUTP-97-020","hep-th",,"  We consider a uniaxial planar ferromagnet coupled minimally to an Abelian
Chern-Simons gauge field and study self-dual solitons which saturate the
Bogomol'nyi bound. We find a rich structure of rotationally symmetric static
soliton solutions for various uniform background charge densities. For a given
ferromagnet material, the properties of these solitons are controlled only by
the external magnetic field and the background charge.
","[{""version"":""v1"",""created"":""Thu, 27 Mar 1997 00:33:38 GMT""}]","2014-11-18"
"hep-th/9703194","Vladimir Sadov","Michael Bershadsky and Vladimir Sadov","F Theory on K3xK3 and Instantons on 7-branes","20 pages, harvmac","Nucl.Phys. B510 (1998) 232-246","10.1016/S0550-3213(97)00636-6",,"hep-th",,"  We discuss N=2 supersymmetric compactifications to four dimensions from the
point of view of F-theory and heterotic theory. In a relatively simple setup,
we illustrate the spectral theory for vector bundles on K3xT^2 and discuss the
heterotic -- F-theory map. The moduli space of instantons on the 7-brane
wrapped around K3 is discussed from the point of view of Higgs mechanism in the
effective four-dimensional N=2 theory. This allows us to elaborate on the
transitions between various branches of the moduli space of the
heterotic/F-theory. We also describe the F-theory compactification on smooth
K3xK3 without the 3-branes in which the anomaly is cancelled by the gauge
fields.
","[{""version"":""v1"",""created"":""Thu, 27 Mar 1997 02:39:20 GMT""}]","2009-10-30"
"hep-th/9703196","Hugh Osborn","J.I. Latorre, H. Osborn","Modified Weak Energy Condition for the Energy Momentum Tensor in Quantum
  Field Theory","27 pages, 1 figure, uses harvmac, epsf and boldmath (included).
  Change of title and some text changes, form to be published","Nucl.Phys. B511 (1998) 737-759","10.1016/S0550-3213(97)00667-6","DAMTP 97/1","hep-th gr-qc",,"  The weak energy condition is known to fail in general when applied to
expectation values of the the energy momentum tensor in flat space quantum
field theory. It is shown how the usual counter arguments against its validity
are no longer applicable if the states $|\psi \r$ for which the expectation
value is considered are restricted to a suitably defined subspace. A possible
natural restriction on $|\psi \r$ is suggested and illustrated by two quantum
mechanical examples based on a simple perturbed harmonic oscillator
Hamiltonian. The proposed alternative quantum weak energy condition is applied
to states formed by the action of scalar, vector and the energy momentum tensor
operators on the vacuum. We assume conformal invariance in order to determine
almost uniquely three-point functions involving the energy momentum tensor in
terms of a few parameters. The positivity conditions lead to non trivial
inequalities for these parameters. They are satisfied in free field theories,
except in one case for dimensions close to two. Further restrictions on $|\psi
\r$ are suggested which remove this problem. The inequalities which follow from
considering the state formed by applying the energy momentum tensor to the
vacuum are shown to imply that the coefficient of the topological term in the
expectation value of the trace of the energy momentum tensor in an arbitrary
curved space background is positive, in accord with calculations in free field
theories.
","[{""version"":""v1"",""created"":""Thu, 27 Mar 1997 10:01:10 GMT""},{""version"":""v2"",""created"":""Wed, 8 Oct 1997 09:29:12 GMT""}]","2009-10-30"
"hep-th/9703197","Nick Evans","Nick Evans (Boston U.), Stephen Hsu (Yale) and Myckola Schwetz (Yale)","Controlled Soft Breaking of N=1 SQCD","10 pages, Latex, one eps figure","Phys.Lett. B404 (1997) 77-82","10.1016/S0370-2693(97)00541-8","BUHEP-97-10, YCTP-P2-97","hep-th hep-ph",,"  We discuss the introduction of soft breaking terms into the exact solutions
of N=1 SQCD using a spurion analysis. The spurion symmetries are not sufficient
to determine the behavior of models in which squark or gaugino masses alone are
introduced. However, a controlled approximation is obtained in some cases if a
supersymmetric mass is first introduced for the matter fields. We present
low-energy solutions for two models with perturbing soft breaking terms, one
with a gaugino mass and one with squark mixing. These models have non-trivial
theta angle dependence and exhibit phase transitions at non-zero theta angle
analogous to those found in the chiral Lagrangian description of QCD.
","[{""version"":""v1"",""created"":""Thu, 27 Mar 1997 15:46:22 GMT""}]","2009-10-30"
"hep-th/9703198","Costas Kounnas","Costas Kounnas","BPS States in Superstrings with Spontaneously Broken SUSY","30 pages, Latex, uses epsf.sty","Nucl.Phys.Proc.Suppl. 58 (1997) 57-78","10.1016/S0920-5632(97)00413-1","CERN-TH/97-57, LPTENS/97/16","hep-th",,"  We show the existence of a supersymmetry-breaking mechanism in string theory,
where N=4 supersymmetry is broken spontaneously to N=2 and N=1 with
moduli-dependent gravitino masses. The BPS spectrum of the theory with lower
supersymmetry is in one-to-one correspondence with the spectrum of the
heterotic N=4 string. The mass splitting of the N=4 spectrum depends on the
moduli as well as the three R-symmetry charges. In the case of N=4 \to N=2, the
perturbative N=2 prepotential is determined by the perturbative N=4 BPS states.
This observation led us to suggest a method that determines the exact
non-perturbative prepotential of the effective N=2 supergravity using the
shifted spectrum of the non-perturbative BPS states of the underlying N=4
theory.
","[{""version"":""v1"",""created"":""Thu, 27 Mar 1997 15:37:52 GMT""}]","2009-10-30"
"hep-th/9703199","Poul Henrik Damgaard","I.A. Batalin, K. Bering and P.H. Damgaard","Second Class Constraints in a Higher-Order Lagrangian Formalism","LaTeX, 8 pages","Phys.Lett. B408 (1997) 235-240","10.1016/S0370-2693(97)00837-X","NBI-HE-96-60, UUITP-09/97","hep-th",,"  We consider the description of second-class constraints in a Lagrangian path
integral associated with a higher-order $\Delta$-operator. Based on two
conjugate higher-order $\Delta$-operators, we also propose a Lagrangian path
integral with $Sp(2)$ symmetry, and describe the corresponding system in the
presence of second-class constraints.
","[{""version"":""v1"",""created"":""Thu, 27 Mar 1997 15:58:41 GMT""},{""version"":""v2"",""created"":""Sun, 30 Mar 1997 14:54:26 GMT""},{""version"":""v3"",""created"":""Sun, 13 Apr 1997 14:14:43 GMT""}]","2009-10-30"
"math/9703212",,"J\""org Rambau","A Suspension Lemma for Bounded Posets",,,,"MSRI 1997-029","math.CO",,"  Let $P$ and $Q$ be bounded posets. In this note, a lemma is introduced that
provides a set of sufficient conditions for the proper part of $P$ being
homotopy equivalent to the suspension of the proper part of~$Q$. An application
of this lemma is a unified proof of the sphericity of the higher Bruhat orders
under both inclusion order (a known proved earlier by Ziegler) and single step
inclusion order (which was not previously known).
","[{""version"":""v1"",""created"":""Thu, 27 Mar 1997 00:00:00 GMT""}]","2016-09-07"
"math/9703217","Wolfram Koepf","Wolfram Koepf, Dieter Schmersau","Representations of orthogonal polynomials",,,,"OP-SF 27 Mar 1997","math.CA",,"  Zeilberger's algorithm provides a method to compute recurrence and
differential equations from given hypergeometric series representations, and an
adaption of Almquist and Zeilberger computes recurrence and differential
equations for hyperexponential integrals. Further versions of this algorithm
allow the computation of recurrence and differential equations from Rodrigues
type formulas and from generating functions. In particular, these algorithms
can be used to compute the differential/difference and recurrence equations for
the classical continuous and discrete orthogonal polynomials from their
hypergeometric representations, and from their Rodrigues rperesentations and
generating functions.
  In recent work, we used an explicit formula for the recurrence equation of
families of classical continuous and discrete orthogonal polynomials, in terms
of the coefficients of their differential/difference equations, to give an
algorithm to identify the polynomial system from a given recurrence equation.
  In this article we extend these results by presenting a collection of
algorithms with which any of the conversions between the
differential/difference equation, the hupergeometric representation, and the
recurrence equation is possible.
  The main technique is again to use texplicit formulas for structural
identities of the given polynomial systems.
","[{""version"":""v1"",""created"":""Thu, 27 Mar 1997 00:00:00 GMT""}]","2016-09-07"
"nucl-th/9703058","Kazuyuki Ochi","Kazuyuki Ochi, Michihiro Hirata, Takashi Takaki","Photoabsorption on a Nucleon in the D_{13} Resonance Energy Region","Revtex file, 25 pages, 8 figures, uses here.sty, psfig.sty","Phys.Rev.C56:1472-1482,1997","10.1103/PhysRevC.56.1472",,"nucl-th hep-ph",,"  We present a simple model for the $\gamma N \to \pi \pi N$ reaction which
reproduces the cross sections of the $\pi^+ \pi^- p, \pi^+ \pi^- n, \pi^+ \pi^0
n$ and $\pi^- \pi^0 p$ channels over the range of the energies 0.41-0.85 GeV.
We use the dynamical model for the resonances, \Delta(1232), N^*(1520) and
\rho-meson. The total photoabsorption off a nucleon is also discussed.
","[{""version"":""v1"",""created"":""Thu, 27 Mar 1997 04:03:08 GMT""},{""version"":""v2"",""created"":""Fri, 11 Apr 1997 15:10:07 GMT""}]","2008-11-26"
"nucl-th/9703059","Thomas Waindzoch","S.Nishizaki (Iwate University), J.Wambach (TH-Darmstadt)","Double Giant Dipole Resonance in ^{208}Pb","7 pages, Latex, 5 postscript figures","Phys.Rev.C57:1515-1517,1998","10.1103/PhysRevC.57.1515",,"nucl-th",,"  Double-dipole excitations in ^{208}Pb are analyzed within a microscopic model
explicitly treating 2p2h-excitations. Collective states built from such
2p2h-excitations are shown to appear at about twice the energy of the isovector
giant dipole resonance, in agreement with the experimental findings. The
calculated cross section for Coulomb excitation at relativistic energies cannot
explain simultaneously the measured single-dipole and double-dipole cross
sections, however.
","[{""version"":""v1"",""created"":""Thu, 27 Mar 1997 10:36:11 GMT""}]","2008-11-26"
"patt-sol/9703008","Shinya Watanabe","M. Barahona, E. Trias, T.P. Orlando, A.E. Duwel, H.S.J. van der Zant,
  S. Watanabe, S.H. Strogatz","Resonances of dynamical checkerboard states in Josephson arrays with
  self-inductance","5 pages, 3 figures included by psfig, to appear in Phys.Rev.B, Fig.1
  corrected",,"10.1103/PhysRevB.55.R11989",,"patt-sol cond-mat.supr-con nlin.PS",,"  We study the dynamics of fully frustrated, underdamped Josephson arrays.
Experiments reveal remarkable similarities among the dc current-voltage
characteristics of several kinds of square and triangular arrays, where two
resonant voltages are observed. Simulations indicate that a dynamical
checkerboard solution underlies these similarities. By assuming such a
solution, we reduce the governing equations to three coupled pendulum
equations, and thereby calculate the voltages of the intrinsic resonances
analytically.
","[{""version"":""v1"",""created"":""Wed, 26 Mar 1997 21:10:16 GMT""},{""version"":""v2"",""created"":""Fri, 28 Mar 1997 10:15:50 GMT""}]","2009-10-30"
"patt-sol/9703009","Aronson Igor","Lev Tsimring and Igor Aranson","Localized and Cellular Patterns in a Vibrated Granular Layer","4 pages, 4 figures, submitted to Phys. Rev. Lett",,"10.1103/PhysRevLett.79.213",,"patt-sol nlin.PS",,"  We propose a phenomenological model for pattern formation in a vertically
vibrated layer of granular material. This model exhibits a variety of stable
cellular patterns including standing rolls and squares as well as localized
objects (oscillons and worms), similar to recent experimental
observations(Umbanhowar et al., 1996). The model is an amplitude equation for
the parametrical instability coupled to the mass conservation law. The
structure and dynamics of the solutions resemble closely the properties of
localized and cellular patterns observed in the experiments.
","[{""version"":""v1"",""created"":""Wed, 26 Mar 1997 16:07:15 GMT""},{""version"":""v2"",""created"":""Fri, 28 Mar 1997 20:50:10 GMT""}]","2016-09-08"
"physics/9703028","Valeri Dvoeglazov","Valeri V. Dvoeglazov (EFUAZ, Mexico) and Myron W. Evans (York U.,
  Canada)","On the way to understanding the electromagnetic phenomena","ReVTeX file, 6pp","Apeiron 4 (1997) 45",,"EFUAZ FT-97-41","physics.gen-ph math-ph math.MP physics.class-ph",,"  On the basis of the ordinary mathematical methods we discuss new classes of
solutions of the Maxwell's equations discovered in the papers by D. Ahluwalia,
M. Evans and H. M'unera et al.
","[{""version"":""v1"",""created"":""Thu, 27 Mar 1997 04:59:08 GMT""}]","2008-02-03"
"physics/9703031","Andrew Chubykalo","Andrew E. Chubykalo (EFUAZ, Mexico) and Stoyan J. Vlaev (Inst. Gen.
  Inorg. Chemistry, Bulgaria and EFUAZ, Mexico)","Theorem on the proportionality of inertial and gravitational masses in
  classical mechanics","ReVTeX file, 10pp","Eur.J.Phys. 19 (1998) 1-6","10.1088/0143-0807/19/1/002","EFUAZ FT-97-43","physics.class-ph",,"  We considered the problem of the proportionality of inertial and
gravitational masses in classical mechanics. We found that the kinetic energy
of a material mass point m in a circular motion with a constant angular
velocity around another material point M depends only on its gravitational
mass. This fact, together with the known result that the straight line is a
circumference with an infinite radius, allowed us to prove the proportionality
between the inertial and gravitational masses.
","[{""version"":""v1"",""created"":""Thu, 27 Mar 1997 04:48:23 GMT""}]","2009-10-30"
"q-alg/9703043","Stanislav Pakuliak","S. Khoroshkin, D. Lebedev, S. Pakuliak, A. Stolin, V. Tolstoy","Classical Limit of the Scaled Elliptic Algebra $A_{\hbar,\eta}(sl_2)$","LaTeX 2.09, 2 figs under bezier.sty, macros use AMS fonts, 18 pages
  One incorrect statement is corrected, note and 3 ref. are added",,,"Preprint ITEP-TH-1/97, RIMS-1139","q-alg math.QA",,"  The classical limit of the scaled elliptic algebra $A_{\hbar,\eta}(sl_2)$ is
investigated. The limiting Lie algebra is described in two equivalent ways: as
a central extension of the algebra of generalized automorphic $sl_2$ valued
functions on a strip and as an extended algebra of decreasing automorphic
$sl_2$ valued functions on the real line. A bialgebra structure and an
infinite-dimensional representation in the Fock space are studied. The
classical limit of elliptic algebra $A_{q,p}(sl_2)$ is also briefly presented.
","[{""version"":""v1"",""created"":""Thu, 27 Mar 1997 03:03:56 GMT""},{""version"":""v2"",""created"":""Tue, 12 May 1998 06:10:48 GMT""}]","2008-02-03"
"q-alg/9703044","Vitaly Tarasov","Vitaly Tarasov and Alexander Varchenko","Geometry of q-Hypergeometric Functions, Quantum Affine Algebras and
  Elliptic Quantum Groups","72 pages, amstex.tex (ver. 2.1) and amssym.tex are required","Asterisque 246 (1997) 1--135",,,"q-alg math.QA",,"  The trigonometric quantized Knizhnik-Zamolodchikov equation (qKZ equation)
associated with the quantum group $U_q(sl_2)$ is a system of linear difference
equations with values in a tensor product of $U_q(sl_2)$ Verma modules. We
solve the equation in terms of multidimensional $q$-hypergeometric functions
and define a natural isomorphism between the space of solutions and the tensor
product of the corresponding evaluation Verma modules over the elliptic quantum
group $E_{\rho,\gamma}(sl_2)$, where parameters $\rho$ and $\gamma$ are related
to the parameter $q$ of the quantum group $U_q(sl_2)$ and the step $p$ of the
qKZ equation via $p=e^{2\pii\rho}$ and $q=e^{-2\pii\gamma}$.
  We construct asymptotic solutions associated with suitable asymptotic zones
and compute the transition functions between the asymptotic solutions in terms
of the dynamical elliptic R-matrices. This description of the transition
functions gives a connection between representation theories of the quantum
loop algebra $U_q(\widetilde{gl}_2$ and the elliptic quantum group
$E_{\rho,\gamma}(sl_2)$ and is analogous to the Kohno-Drinfeld theorem on the
monodromy group of the differential Knizhnik-Zamolodchikov equation.
  In order to establish these results we construct a discrete Gauss-Manin
connection, in particular, a suitable discrete local system, discrete homology
and cohomology groups with coefficients in this local system, and identify an
associated difference equation with the qKZ equation.
","[{""version"":""v1"",""created"":""Thu, 27 Mar 1997 10:25:23 GMT""},{""version"":""v2"",""created"":""Fri, 26 Sep 1997 10:01:32 GMT""},{""version"":""v3"",""created"":""Wed, 3 Feb 1999 11:20:28 GMT""}]","2008-02-03"
