"quant-ph/9703049","Mensky Michael B.","J\""urgen Audretsch, Michael Mensky","Continuous Fuzzy Measurement of Energy for a Two-Level System","29 pages in LATEX, 1 figure in EPS, to be published in Physical
  Review A","Phys.Rev. A56 (1997) 44","10.1103/PhysRevA.56.44",,"quant-ph",,"  A continuous measurement of energy which is sharp (perfect) leads to the
quantum Zeno effect (freezing of the state). Only if the quantum measurement is
fuzzy, continuous monitoring gives a readout E(t) from which information about
the dynamical development of the state vector of the system may be obtained in
certain cases. This is studied in detail. Fuzziness is thereby introduced with
the help of restricted path integrals equivalent to non-Hermitian Hamiltonians.
For an otherwise undisturbed multilevel system it is shown that this
measurement represents a model of decoherence. If it lasts long enough, the
measurement readout discriminates between the energy levels and the von Neumann
state reduction is obtained. For a two-level system under resonance influence
(which undergoes in absence of measurement Rabi oscillations between the
levels) different regimes of measurement are specified depending on its
duration and fuzziness: 1) the Zeno regime where the measurement results in a
freezing of the transitions between the levels and 2) the Rabi regime when the
transitions maintain. It is shown that in the Rabi regime at the border to the
Zeno regime a correlation exists between the time dependent measurement readout
and the modified Rabi oscillations of the state of the measured system.
Possible realizations of continuous fuzzy measurements of energy are sketched.
","[{""version"":""v1"",""created"":""Wed, 26 Mar 1997 19:46:37 GMT""}]","2009-10-30"
"quant-ph/9703050","Nicolas Cerf","N. J. Cerf, S. E. Koonin (California Institute of Technology)","Monte Carlo Simulation of Quantum Computation","12 pages Latex, 2 Postscript figures, to appear in Proceedings of the
  IMACS (International Association for Mathematics and Computers in Simulation)
  Conference on Monte Carlo Methods, Brussels, April 97","Math. and Comp. in Simulation 47 (1998), 143-152",,"KRL MAP-212","quant-ph",,"  The many-body dynamics of a quantum computer can be reduced to the time
evolution of non-interacting quantum bits in auxiliary fields by use of the
Hubbard-Stratonovich representation of two-bit quantum gates in terms of
one-bit gates. This makes it possible to perform the stochastic simulation of a
quantum algorithm, based on the Monte Carlo evaluation of an integral of
dimension polynomial in the number of quantum bits. As an example, the
simulation of the quantum circuit for the Fast Fourier Transform is discussed.
","[{""version"":""v1"",""created"":""Wed, 26 Mar 1997 19:55:56 GMT""}]","2007-05-23"
"quant-ph/9703051","Scutaru Horia","Gh.- S. Paraoanu, Horia Scutaru","Bures distance between two displaced thermal states","3 pages, RevTeX, no figures","Phys.Rev. A, 58, 869 (1998)","10.1103/PhysRevA.58.869",,"quant-ph",,"  The Bures distance between two displaced thermal states and the corresponding
geometric quantities (statistical metric, volume element, scalar curvature) are
computed. Under nonunitary (dissipative) dynamics, the statistical distance
shows the same general features previously reported in the literature by
Braunstein and Milburn for two--state systems. The scalar curvature turns out
to have new interesting properties when compared to the curvature associated
with squeezed thermal states.
","[{""version"":""v1"",""created"":""Thu, 27 Mar 1997 09:22:39 GMT""},{""version"":""v2"",""created"":""Mon, 9 Feb 1998 10:10:35 GMT""},{""version"":""v3"",""created"":""Wed, 11 Feb 1998 06:56:03 GMT""},{""version"":""v4"",""created"":""Thu, 12 Aug 1999 06:04:02 GMT""}]","2009-10-30"
"quant-ph/9703052",,"Lorenza Viola, Roberto Onofrio and Tommaso Calarco","Macroscopic quantum damping in SQUID rings","7 Pages; Plain REVTeX; 3 Figures available upon request; to be
  published in Phys. Lett. A 229, 23 (1997)","Phys.Lett. A229 (1997) 23","10.1016/S0375-9601(97)00154-0",,"quant-ph",,"  The measurement process is introduced in the dynamics of Josephson devices
exhibiting quantum behaviour in a macroscopic degree of freedom. The
measurement is shown to give rise to a dynamical damping mechanism whose
experimental observability could be relevant to understand decoherence in
macroscopic quantum systems.
","[{""version"":""v1"",""created"":""Thu, 27 Mar 1997 11:16:30 GMT""}]","2009-10-30"
"quant-ph/9707050","Yury A. Cuperin","L.A.Dmitrieva, Yu.A.Kuperin, Yu.B.Melnikov","One-Dimensional Discrete Stark Hamiltonian and Resonance Scattering by
  Impurities","20 pages, Latex, no figures",,"10.1088/0305-4470/30/9/019",,"quant-ph",,"  A one-dimensional discrete Stark Hamiltonian with a continuous electric field
is constructed by extension theory methods. In absence of the impurities the
model is proved to be exactly solvable, the spectrum is shown to be simple,
continuous, filling the real axis; the eigenfunctions, the resolvent and the
spectral measure are constructed explicitly. For this (unperturbed) system the
resonance spectrum is shown to be empty. The model considering impurity in a
single node is also constructed using the operator extension theory methods.
The spectral analysis is performed and the dispersion equation for the
resolvent singularities is obtained. The resonance spectrum is shown to contain
infinite discrete set of resonances. One-to-one correspondence of the
constructed Hamiltonian to some Lee-Friedrichs model is established.
","[{""version"":""v1"",""created"":""Thu, 27 Mar 1997 03:03:31 GMT""}]","2009-10-30"
