"quant-ph/9703054","Daniel S. Abrams","Daniel S. Abrams (1), Seth Lloyd (2) ((1) Department of Physics,
  Massachusetts Institute of Technology (2) Department of Mechanical
  Engineering, Massachusetts Institute of Technology)","Simulation of Many-Body Fermi Systems on a Universal Quantum Computer","Submitted 11/7/96 to Phys. Rev. Lett. 10 pages, 0 figures","Phys.Rev.Lett. 79 (1997) 2586-2589","10.1103/PhysRevLett.79.2586",,"quant-ph",,"  We provide fast algorithms for simulating many body Fermi systems on a
universal quantum computer. Both first and second quantized descriptions are
considered, and the relative computational complexities are determined in each
case. In order to accommodate fermions using a first quantized Hamiltonian, an
efficient quantum algorithm for anti-symmetrization is given. Finally, a
simulation of the Hubbard model is discussed in detail.
","[{""version"":""v1"",""created"":""Fri, 28 Mar 1997 20:03:47 GMT""}]","2009-10-30"
