"alg-geom/9703037","Jim Alexander","J. Alexander, A. Hirschowitz","An Assympotic Vanishing Theorem for Generic Unions of Multiple Points","26 pages, Latex 2e, using diagrams.tex. Revised edition",,,,"alg-geom math.AG",,"  In this revised form, the proof of the principal lemma has been simplified
and the main theorem has been extended to all characteristics for those
varieties which are smooth in codimension one.
  This principal theorem essentially says the following : given an ample line
bundle O(1) on a projective variety X and a fixed upper bound M on the
multiplicities, there exists a lower bound D such that any generic union of
multiple points of multiplicity at most M imposes independent conditions on the
sections of O(d) for d>D. Here a multiple point is the closed subscheme defined
by a power m of the ideal of a smooth point in X and m is its multiplicity.
","[{""version"":""v1"",""created"":""Fri, 28 Mar 1997 16:19:40 GMT""},{""version"":""v2"",""created"":""Fri, 2 May 1997 16:15:18 GMT""},{""version"":""v3"",""created"":""Tue, 15 Feb 2000 16:21:36 GMT""}]","2009-09-25"
"alg-geom/9703038","Vladimir Baranovsky","Vladimir Baranovsky","On Punctual Quot Schemes for Algebraic Surfaces","Latex2e, amssymb, amsmath packages; 4 pages. Proofs simplified",,,,"alg-geom math.AG",,"  The punctual Quot scheme parametrizes all length d quotients of a (locally)
trivial rank r sheaf which are supported at a fixed point. The author shows
that this scheme is irreducible and (rd-1)-dimensional. The same result was
proved independently by Ellingsrud and Lehn.
","[{""version"":""v1"",""created"":""Fri, 28 Mar 1997 21:20:10 GMT""},{""version"":""v2"",""created"":""Fri, 11 Apr 1997 23:41:28 GMT""},{""version"":""v3"",""created"":""Sat, 18 Jul 1998 15:12:00 GMT""}]","2008-02-03"
"astro-ph/9703190","Kouji Takahasi","Koji Takahashi (Osaka University)","Fokker-Planck Models of Star Clusters with Anisotropic Velocity
  Distributions. III. Multi-Mass Clusters","29 pages, including 12 figures, Latex, submitted to PASJ",,"10.1093/pasj/49.5.547","OU-TAP-59","astro-ph",,"  The evolution of globular clusters driven by two-body relaxation is
investigated by means of numerical integration of the two-dimensional
Fokker-Planck equation in energy--angular momentum space. The two- dimensional
Fokker-Planck equation allows the development of velocity anisotropy. We
include a spectrum of stellar masses in this paper. The radial anisotropy
develops, that is, the radial velocity dispersion exceeds the tangential one,
in the outer halo of multi-mass clusters as in single-mass clusters. However,
the evolution of the velocity anisotropy depends significantly on the stellar
mass in some cases. In fact the tangential velocity dispersion becomes dominant
around the half-mass radius for massive components in clusters with a steep
mass function. The development of this tangential anisotropy is closely related
to the initial cooling of the massive components toward energy equipartition.
Our simulation results indicate that multi-mass anisotropic King-Michie models
are not always appropriate for describing the velocity anisotropy in globular
clusters.
","[{""version"":""v1"",""created"":""Sat, 29 Mar 1997 05:30:23 GMT""}]","2015-06-24"
"astro-ph/9703192",,"HEAT Collaboration: S. W. Barwick, E. Schneider (University of
  California at Irvine), J. J. Beatty, G. A. de Nolfo (Pennsylvania State
  University), A. Bhattacharyya, C. R. Bower, J. A. Musser (Indiana
  University), C. J. Chaput, S. Coutu, S. McKee, G. Tarle, A. D. Tomasch
  (University of Michigan), J. Knapp (Universitat Karlsruhe), D. M. Lowder
  (University of California at Berkeley), D. Muller, S. P. Swordy, E. Torbet
  (University of Chicago), S. L. Nutter (Eastern New Mexico University,
  Portales)","Measurements of the Cosmic-Ray Positron Fraction From 1 to 50 GeV","7 pages, LaTeX, two eps figures, aas2pp4.sty and epsf.tex needed,
  accepted by Ap.J. Lett. (March 27, 1997)","Astrophys.J. 482 (1997) L191-L194","10.1086/310706","UM HE 97-04","astro-ph",,"  Two measurements of the cosmic-ray positron fraction as a function of energy
have been made using the High Energy Antimatter Telescope (HEAT) balloon-borne
instrument. The first flight took place from Ft. Sumner, New Mexico in 1994,
and yielded results above the geomagnetic cutoff energy of 4.5 GeV. The second
flight from Lynn Lake, Manitoba in 1995 permitted measurements over a larger
energy interval, from 1 GeV to 50 GeV. In this letter we present results on the
positron fraction based on data from the Lynn Lake flight, and compare these
with the previously published results from the Ft. Sumner flight. The results
confirm that the positron fraction does not increase with energy above ~10 GeV,
although a small excess above purely secondary production cannot be ruled out.
At low energies the positron fraction is slightly larger than that reported
from measurements made in the 1960's. This effect could possibly be a
consequence of charge dependence in the level of solar modulation.
","[{""version"":""v1"",""created"":""Fri, 28 Mar 1997 17:10:11 GMT""}]","2009-10-30"
"astro-ph/9703193","John C. Houck","John C. Houck (1 and 2), Joel N. Bregman (1), Roger A. Chevalier (3),
  Kohji Tomisaka (4) ((1) University of Michigan (2) MIT (3) University of
  Virginia (4) Niigata University)","Recent X-Ray Observations of SN1986J with ASCA and ROSAT","20 pages, 9 postscript figures, latex, uses aastex4.0, submitted to
  The Astrophysical Journal",,"10.1086/305098",,"astro-ph",,"  We present ASCA and ROSAT observations of SN 1986J covering the period 1991
August to 1996 January. From observations with the ROSAT HRI and PSPC, we find
that the 0.5-2.5 keV flux decreased proportional to $t^{-2}$ during this
period; the ASCA data are consistent with this result and extend it to the 2-10
keV band. ASCA spectra from 1994 January and 1996 January are consistent with
thermal emission from a solar metallicity plasma at an equilibrium temperature
kT = 5-7.5 keV, somewhat hotter than that observed from other X-ray supernovae.
These spectra also show a clear Fe K emission line at 6.7 keV with FWHM <
20,000 km/s (90% confidence). This limit on the line width is consistent with
the reverse shock model of Chevalier & Fransson (1994), but does not rule out
the clumpy wind model of Chugai (1993).
","[{""version"":""v1"",""created"":""Fri, 28 Mar 1997 17:53:17 GMT""}]","2009-10-30"
"astro-ph/9703194","Mike Turner","Michael S. Turner (U. Chicago/Fermilab)","Inflation: From Theory to Observation and Back","17 pages LaTeX with 2 eps figures","Annals N.Y.Acad.Sci.759:153,1995","10.1111/j.1749-6632.1995.tb17521.x",,"astro-ph hep-ph",,"  Alan Guth introduced cosmologists to inflation at the 1980 Texas Symposium.
Since, inflation has had almost as much impact on cosmology as the big-bang
model itself. However, unlike the big-bang model, it has little observational
support. Hopefully, that situation is about to change as a variety and
abundance of data begin to test inflation in a significant way. The
observations that are putting inflation to test involve the formation of
structure in the Universe, especially measurements of the anisotropy of the
cosmic background radiation. The cold dark matter models of structure formation
motivated by inflation are holding up well as the observational tests become
sharper. In the next decade inflation will be tested even more significantly,
with more precise measurements of CBR anisotropy, the mean density of the
Universe, the Hubble constant, and the distribution of matter, as well as
sensitive searches for the nonbaryonic dark matter predicted to exist by
inflation. As an optimist I believe that we may be well on our way to a
standard cosmology that includes inflation and extends back to around 10^{-32}
sec, providing an important window on the earliest moments and fundamental
physics.
","[{""version"":""v1"",""created"":""Fri, 28 Mar 1997 20:04:22 GMT""}]","2014-10-13"
"astro-ph/9703195","Mike Turner","Michael S. Turner (U. Chicago/Fermilab)","The Cosmology of Nothing","32 pages LaTeX (sprocl.sty) with 8 eps figures. Published in Vacuum
  and Vacua: The Physics of Nothing, edited A. Zichichi (World Scientific,
  1996), p. 50",,,,"astro-ph hep-ph",,"  For more seventy years physicists have appreciated that Nature's vacuum is
far from empty. The discovery of the Lamb shift in Hydrogen provided dramatic
verification of the reality of the quantum vacuum. The advent of gauge theories
has led us to believe that the physics of the vacuum is even richer, with the
possibility of instantons, vacuum phase transitions, vacuum defects (monopoles,
domain walls, cosmic strings and nontopological solitons), vacuum energy, and
degenerate vacua states (with different local realizations of the laws of
physics). Cosmology offers a unique laboratory for exploring the ``physics of
nothing.'' In this lecture I focus on the implications of vacuum energy for
cosmology -- in particular, inflation -- and discuss the flood of observations
that are testing the inflationary paradigm and in process probing the physics
of nothing. I also discuss the possibility that today vacuum energy plays a
dynamically important role (as a cosmological constant).
","[{""version"":""v1"",""created"":""Fri, 28 Mar 1997 20:20:51 GMT""}]","2007-05-23"
"cond-mat/9703249","Robert Shrock","Robert Shrock and Shan-Ho Tsai (Institute for Theoretical Physics,
  State University of New York at Stony Brook)","Families of Graphs With Chromatic Zeros Lying on Circles","8 pages, Latex","Phys. Rev. E56, 1342 (1997)","10.1103/PhysRevE.56.1342",,"cond-mat.stat-mech",,"  We define an infinite set of families of graphs, which we call $p$-wheels and
denote $(Wh)^{(p)}_n$, that generalize the wheel ($p=1$) and biwheel ($p=2$)
graphs. The chromatic polynomial for $(Wh)^{(p)}_n$ is calculated, and
remarkably simple properties of the chromatic zeros are found: (i) the real
zeros occur at $q=0,1,...p+1$ for $n-p$ even and $q=0,1,...p+2$ for $n-p$ odd;
and (ii) the complex zeros all lie, equally spaced, on the unit circle
$|q-(p+1)|=1$ in the complex $q$ plane. In the $n \to \infty$ limit, the zeros
on this circle merge to form a boundary curve separating two regions where the
limiting function $W(\{(Wh)^{(p)}\},q)$ is analytic, viz., the exterior and
interior of the above circle. Connections with statistical mechanics are noted.
","[{""version"":""v1"",""created"":""Fri, 28 Mar 1997 23:56:26 GMT""}]","2009-10-30"
"cond-mat/9703250","Sergio Caracciolo","Sergio Caracciolo, Maria Serena Causo and Andrea Pelissetto","High-precision determination of the critical exponent gamma for
  self-avoiding walks","8 pages","Phys.Rev. E57 (1998) 1215-1218","10.1103/PhysRevE.57.R1215",,"cond-mat.stat-mech hep-lat physics.chem-ph",,"  We compute the exponent gamma for self-avoiding walks in three dimensions. We
get gamma = 1.1575 +- 0.0006 in agreement with renormalization-group
predictions. Earlier Monte Carlo and exact-enumeration determinations are now
seen to be biased by corrections to scaling.
","[{""version"":""v1"",""created"":""Sat, 29 Mar 1997 10:46:16 GMT""}]","2009-10-30"
"gr-qc/9703086","3","Donald E. Neville","Total intrinsic spin for plane gravity waves","14 pages; LaTex","Phys.Rev.D56:3485-3489,1997","10.1103/PhysRevD.56.3485","TU-328-97","gr-qc",,"  A quantity which measures total intrinsic spin along the z axis is
constructed for planar gravity (fields dependent on z and t only), in both the
Ashtekar complex connection formalism and in geometrodynamics. The total spin
is conserved but (surprisingly) is not a surface term. This constant of the
motion coincides with one of four observables previously discovered by Husain
and Smolin. Two more of those observables can be interpreted physically as
raising and lowering operators for total spin.
","[{""version"":""v1"",""created"":""Fri, 28 Mar 1997 18:52:12 GMT""}]","2011-09-09"
"hep-ex/9703015","William David Dagenhart","Fermilab E769 Collaboration","Atomic mass dependence of \Xi^- and \overline{\Xi}^+ production in
  central 250 GeV \pi^- nucleon interactions","10 pages, revtex, 2 figures, submitted to Phys. Rev. D","Phys.Rev.D56:6003-6005,1997","10.1103/PhysRevD.56.6003","TUHEP-97-01","hep-ex",,"  We present the first measurement of the atomic mass dependence of central
\Xi^- and \overline{\Xi}^+ production. It is measured using a sample of 22,459
\Xi^-'s and \overline{\Xi}^+'s produced in collisions between a 250 GeV \pi^-
beam and targets of beryllium, aluminum, copper, and tungsten. The relative
cross sections are fit to the two parameter function \sigma_0 A^\alpha, where A
is the atomic mass. We measure \alpha = 0.924+-0.020+-0.025, for Feynman-x in
the range -0.09 < x_F < 0.15.
","[{""version"":""v1"",""created"":""Fri, 28 Mar 1997 21:47:38 GMT""}]","2012-08-27"
"hep-ex/9703016","Peter Bosted","P. L. Anthony, R. Becker-Szendy, P. E. Bosted, M. Cavalli-Sforza, L.
  P. Keller, L. A. Kelley, S. R. Klein, G. Niemi, M. L. Perl, L. S. Rochester,
  J. L. White: E146 Collaboration","Bremsstrahlung Suppression due to the LPM and Dielectric Effects in a
  Variety of Materials","52 pages, 13 figures (incorporated in the revtex LaTeX file)","Phys.Rev.D56:1373-1390,1997","10.1103/PhysRevD.56.1373","SLAC--PUB--7413, LBNL--40054","hep-ex",,"  The cross section for bremsstrahlung from highly relativistic particles is
suppressed due to interference caused by multiple scattering in dense media,
and due to photon interactions with the electrons in all materials. We present
here a detailed study of bremsstrahlung production of 200 keV to 500 MeV
photons from 8 and 25 GeV electrons traversing a variety of target materials.
For most targets, we observe the expected suppressions to a good accuracy. We
observe that finite thickness effects are important for thin targets.
","[{""version"":""v1"",""created"":""Fri, 28 Mar 1997 21:46:54 GMT""}]","2012-08-27"
"hep-ph/9703450","Matthias Hosch","M. Hosch, K. Whisnant, and B.-L. Young","Direct Top Quark Production at Hadron Colliders as a Probe of New
  Physics","14 pages, Latex, requires feynmf","Phys.Rev. D56 (1997) 5725-5730","10.1103/PhysRevD.56.5725","AMES-HET-97-02","hep-ph",,"  We examine the effect of an anomalous flavor changing chromomagnetic moment
which allows direct top quark production (two partons combining into an
unaccompanied single top quark in the s-channel) at hadron colliders. We
consider both t-c-g and t-u-g couplings. We find that the anomalous charm quark
coupling parameter $\kappa_c / \Lambda$ can be measured down to $.06
TeV^{-1}(.009 TeV^{-1}$) at the Tevatron with the Main Injector upgrade(LHC).
The anomalous up quark coupling parameter $\kappa_u / \Lambda$ can be measured
to $.02 TeV^{-1}(.003 TeV^{-1}$) at the Tevatron(LHC).
","[{""version"":""v1"",""created"":""Fri, 28 Mar 1997 20:18:35 GMT""}]","2016-09-06"
"hep-ph/9703451","John R. Hiller","J. R. Hiller","Nonperturbative Renormalization in Light-Cone Quantization","10 pages, LaTeX/RevTex, no figures, to appear in the proceedings of
  Orbis Scientiae 1997: Twenty-Five Coral Gables Conferences and their Impact
  on High Energy Physics and Cosmology, B.N. Kursunoglu, ed",,,"UMN-D-97-2","hep-ph",,"  Two approaches to nonperturbative renormalization are discussed for theories
quantized on the light cone. One is tailored specifically to a calculation of
the dressed-electron state in quantum electrodynamics, where an invariant-mass
cutoff is used as a regulator and a Tamm-Dancoff truncation is made to include
no more than two photons. The other approach is based on Pauli-Villars
regulators and is applied to Yukawa theory and a related soluble model. In both
cases discretized light-cone quantization is used to obtain a finite matrix
problem that can be solved nonperturbatively.
","[{""version"":""v1"",""created"":""Fri, 28 Mar 1997 20:20:18 GMT""}]","2007-05-23"
"hep-ph/9703452","Manuel Drees","Abdelhak Djouadi (LPM, Montpellier, France) and Manuel Drees (APCTP,
  Seoul, Korea)","Higgs Boson Decays into Light Gravitinos","11 pages, 4 embedded figures; LaTeX with equation.sty and epsf.sty","Phys.Lett. B407 (1997) 243-249","10.1016/S0370-2693(97)00670-9","APCTP 97-05, PM 97-05","hep-ph",,"  We study decays of the neutral and charged Higgs bosons of the minimal
supersymmetric standard model into a very light gravitino and a neutralino or
chargino. Present experimental constraints already imply that the lighter
scalar Higgs boson can only have a very small branching ratio into this mode.
However, if the gravitino mass is below $\sim 0.5$ eV, the heavier neutral and
charged Higgs boson decays into a gravitino can be important or even dominant.
We discuss the resulting signature for associate production of the heavy
CP-even and the CP-odd states at future $e^+ e^-$ colliders, and comment on
Higgs boson production at hadron colliders.
","[{""version"":""v1"",""created"":""Sat, 29 Mar 1997 05:58:35 GMT""}]","2009-10-30"
"hep-ph/9703453","Koretune","Susumu Koretune","Mean Charge of the Light Sea Quarks in the Proton","7pages, Latex, a discussion concerning the phenomenological
  saturation of the sum rule is added, published in
  Prog.Theor.Phys.V.98(1997)749 - 753","Prog.Theor.Phys. 98 (1997) 749-753","10.1143/PTP.98.749",,"hep-ph nucl-th",,"  The modified Gottfried sum rule multiplied by 3/2 can be interpreted as the
one to measure the mean $I_3$ of the [(quark) - (antiquark)] in the proton .
Based on this interpretation we find the sum rule which can be understood as
the one to measure the mean charge of the light sea quarks (u,d,s) in the
proton, and show that it takes the value 0.23 for the proton and 0.34 for the
neutron .
","[{""version"":""v1"",""created"":""Sat, 29 Mar 1997 06:06:31 GMT""},{""version"":""v2"",""created"":""Thu, 23 Oct 1997 00:26:55 GMT""}]","2009-10-30"
"hep-th/9703207","Zhao Liu","Liu Zhao, Changzheng Qu","Bosonic Super Liouville System: Lax Pair and Solution","LaTeX, no figures, 11 pages","Int.J.Theor.Phys. 36 (1997) 1537-1546","10.1007/BF02435754",,"hep-th",,"  We study the bosonic super Liouville system which is a statistical
transmutation of super Liouville system. Lax pair for the bosonic super
Liouville system is constructed using prolongation method, ensuring the Lax
integrability, and the solution to the equations of motion is also considered
via Leznov-Saveliev analysis.
","[{""version"":""v1"",""created"":""Fri, 28 Mar 1997 23:58:06 GMT""}]","2009-10-30"
"hep-th/9703209","Dr R. Szabo","Ian I. Kogan and Richard J. Szabo","Matrix Strings in Two-dimensional Yang-Mills Theory","15 pages LaTeX; 1 .ps file included, uses psfig.sty","Phys.Lett. B404 (1997) 276-284","10.1016/S0370-2693(97)00569-8","OUTP-97-15P","hep-th",,"  We describe the structure of string vacuum states in the supersymmetric
matrix model for M theory compactified on a circle in the large-N limit. We
show that the theory admits topological instanton field configurations which at
short-distance scales reduce to ordinary Yang-Mills instantons that interpolate
between degenerate vacua of the theory. We show that there exists further
classes of hadronic strings associated with the D-string super-fields. We
discuss the relationships between these non-perturbative string states and
rigid QCD strings, critical strings, and membrane states.
","[{""version"":""v1"",""created"":""Sat, 29 Mar 1997 12:15:16 GMT""}]","2009-10-30"
"hep-th/9703210","Clifford Johnson","Nick Evans, Clifford V. Johnson, Alfred D. Shapere","Orientifolds, Branes, and Duality of 4D Gauge Theories","24 pages, harvmac.tex (b), 6 figures, epsf.tex (Major improvements to
  figures; minor improvements to text.)","Nucl.Phys. B505 (1997) 251-271","10.1016/S0550-3213(97)00384-2",,"hep-th",,"  Recently, a D-brane construction in type IIA string theory was shown to yield
the electric/magnetic duality of four dimensional N=1 supersymmetric U(N_c)
gauge theories with N_f flavours of quark. We present here an extension of that
construction which yields the electric/magnetic duality for the SO(N_c) and
USp(N_c) gauge theories with N_f quarks, by adding an orientifold plane which
is consistent with the supersymmetry. Due to the intersection of the
orientifold plane with the NS-NS fivebranes already present, new features arise
which are crucial in determining the correct final structure of the dualities.
","[{""version"":""v1"",""created"":""Fri, 28 Mar 1997 20:12:31 GMT""},{""version"":""v2"",""created"":""Mon, 31 Mar 1997 05:45:26 GMT""},{""version"":""v3"",""created"":""Wed, 2 Apr 1997 22:44:41 GMT""},{""version"":""v4"",""created"":""Mon, 7 Apr 1997 01:49:20 GMT""}]","2009-10-30"
"hep-th/9703211","Emil Martinec","Miao Li and Emil Martinec","Matrix Black Holes","26 pages, harvmac; a few more references and additional comments","Class.Quant.Grav. 14 (1997) 3187-3204","10.1088/0264-9381/14/12/006","EFI-97-3","hep-th",,"  Four and five dimensional extremal black holes with nonzero entropy have
simple presentations in M-theory as gravitational waves bound to configurations
of intersecting M-branes. We discuss realizations of these objects in matrix
models of M-theory, investigate the properties of zero-brane probes, and
propose a measure of their internal density. A scenario for black hole dynamics
is presented.
","[{""version"":""v1"",""created"":""Fri, 28 Mar 1997 20:33:28 GMT""},{""version"":""v2"",""created"":""Thu, 17 Apr 1997 21:10:59 GMT""}]","2016-08-16"
"hep-th/9703212","Zorawar Bassi","Z. S. Bassi and A. LeClair","A 1D Model for N-level Atoms Coupled to an EM Field","8 pages, Plain TeX","J.Math.Phys. 40 (1999) 3723-3731","10.1063/1.532922","CLNS 97/1472","hep-th physics.optics",,"  We construct a model for n-level atoms coupled to quantized electromagnetic
fields in a fibrillar geometry. In the slowly varying envelope and rotating
wave approximations, the equations of motion are shown to satisfy a zero
curvature representation, implying integrability of the quantum system.
","[{""version"":""v1"",""created"":""Fri, 28 Mar 1997 22:32:33 GMT""}]","2009-10-30"
"hep-th/9703213","Okumura Yoshitaka","Yoshitaka Okumura","Left-right symmetric gauge model in a noncommutative geometry on
  $M_4\times Z_4$","22 pages, LaTex file","Nuovo Cim. A110 (1997) 267-294",,"CHUBU97032","hep-th",,"  The left-right symmetric gauge model with the symmetry of $SU(3)_c\times
SU(2)_L\times SU(2)_R\times U(1)$ is reconstructed in a new scheme of the
noncommutative differential geometry (NCG) on the discrete space $M_4\times
Z_4$ which is a product space of Minkowski space and four points space. The
characteristic point of this new scheme is to take the fermion field to be a
vector in a 24-dimensional space which contains all leptons and quarks.
Corresponding to this specification, all gauge and Higgs boson fields are
represented in $24\times 24$ matrix forms. We incorporate two Higgs doublet
bosons $h$ and $SU(2)_R$ adjoint Higgs $\xi_R$ which are as usual transformed
as $(2,2^\ast,0)$ and $(1,3,-2)$ under $SU(2)_L\times SU(2)_R\times U(1)$,
respectively. Owing to the revise of the algebraic rules in a new NCG, we can
obtain the necessary potential and interacting terms between these Higgs bosons
which are responsible for giving masses to the particles included. Among the
Higgs doublet bosons, one CP-even scalar boson survives in the weak energy
scale and other four scalar bosons acquire the mass of the $SU(2)_R\times U(1)$
breaking scale, which is similar to the situation in the standard model.
$\xi_R$ is responsible to spontaneously break $SU(2)\ma{R} \times U(1)$ down to
$U(1)\ma{Y}$ and so well explains the seesaw mechanism. Up and down quarks have
the different masses through the vacuum expectation value of $h$.
","[{""version"":""v1"",""created"":""Sat, 29 Mar 1997 07:39:59 GMT""}]","2007-05-23"
"hep-th/9703214",,"Hitoshi Nishino","Supergravity in 10 + 2 Dimensions as Consistent Background for
  Superstring","An amendment in eq.(3.3a), a paragraph added in pages 6 - 7 with new
  eq.(3.12), other minor changes like wording and updated references, 14 pages,
  latex, no figures","Phys.Lett.B428:85-94,1998","10.1016/S0370-2693(98)00374-8","UMDEPP 97-101","hep-th",,"  We present a consistent theory of N=1 supergravity in twelve-dimensions with
the signature (10,2). Even though the formulation uses two null vectors
violating the manifest Lorentz covariance, all the superspace Bianchi
identities are satisfied. After a simple dimensional reduction to
ten-dimensions, this theory reproduces the N=1 supergravity in ten-dimensions,
supporting the consistency of the system. We also show that our supergravity
can be the consistent backgrounds for heterotic or type-I superstring in
Green-Schwarz formulation, by confirming the kappa-invariance of the total
action. This theory is supposed to be the purely N=1 supergravity sector for
the field theory limit of the recently predicted F-theory in twelve-dimensions.
","[{""version"":""v1"",""created"":""Sat, 29 Mar 1997 08:25:07 GMT""},{""version"":""v2"",""created"":""Sat, 12 Apr 1997 00:49:23 GMT""}]","2014-11-18"
