"alg-geom/9709015",,"Lawrence Ein","Multiplier Ideals, Vanishing Theorem and Applications","21 pages, AMSTEX",,,,"alg-geom math.AG",,"  The purpose of this note is to give a survey of the algebraic properties of
multiplier ideals, and illustrate some of their applications to classical
projective geometry.
","[{""version"":""v1"",""created"":""Thu, 11 Sep 1997 22:31:06 GMT""}]","2008-02-03"
"astro-ph/9709107","Alice Quillen","A. C. Quillen & Gary Bower","M84 - Can the AGN Affect The Orientation of The Disk?","AAS Latex + gif Figure, submitted to ApJ",,,,"astro-ph",,"  In M84 dust features are not aligned with the galaxy isophotes but are
perpendicular to the radio jets. We estimate the timescale that the gas disk
should precess in the galaxy. Since this timescale is short ($\sim 2\times
10^7$ years at 100 pc) we consider mechanisms that could cause the gas disk to
be misaligned with the galaxy. One possibility is that a cooling flow
replenishes the disk on this timescale and at angles that vary with radius.
Another possibility is that there is a pressure on the disk that is large
enough to overcome the torque from the galaxy. We estimate this pressure and
find that it can be provided by ram pressure from an energetic interstellar
medium that is consistent with velocity dispersions observed in ionized gas and
densities estimated from the X-ray emission. We therefore propose that an AGN
associated energetic interstellar medium is responsible for causing the gas
disk in M84 to be misaligned with the galaxy isophotal major axis for $r \lta
600$ pc. We propose that AGN associated outflows or kinetic motion in low
density media could be responsible for jet/disk alignments observed on 100 pc
scales in nearby radio galaxies.
","[{""version"":""v1"",""created"":""Thu, 11 Sep 1997 19:03:22 GMT""}]","2007-05-23"
"astro-ph/9709108","Renyue Cen","Renyue Cen, Steven Phelps, Jordi Miralda-Escud\'e and Jeremiah P.
  Ostriker (Princeton University Observatory)","On the Clustering of Lyman Alpha Clouds","submitted to ApJ on 7/17/97, 26 latex pages and 8 figures",,,,"astro-ph",,"  We examine the correlational property of $\lya$ clouds in detail and compare
it to that of mass and galaxies. We show that the correlation strength of
$\lya$ clouds is somewhat weaker than that of the underlying matter, which in
turn is weaker than that of galaxies (biased galaxy formation). On the scales
probed, $10-300$km/s, for $\lya$ clouds, we find that higher density, higher
optical depth, higher column density regions are more strongly clustered than
lower density, lower optical depth, lower column density regions. Thus, a
consistent picture seems to emerge: the correlation strength for a given set of
objects is positively correlated with their characteristic global density and
the differences among the correlations of galaxies, $\lya$ clouds and mass
reflect the differences in density that each trace. Significant positive
correlations with a strength of $0.1-1.0$ are found for $\lya$ clouds in the
velocity range $50-300$km/s. Among the correlational measures examined, an
optical depth correlation function (Equation 5) proposed here may serve as the
best correlational measure. It reasonably faithfully represents the true
correlation of the underlying matter, enabling a better indication of both
matter correlation and the relationship between galaxies and $\lya$ clouds.
Furthermore, it appears to be an alternative to the conventional line-line
correlation function with the virtue that it does not require ambiguous
post-observation fitting procedures such as those commonly employed in the
conventional line-finding methods. Neither does it depend sensitively on the
observational resolution (e.g., FWHM), insofaras the clouds are resolved
Conveniently, it can be easily measured with the current observational
sensitivity without being contaminated significantly by the presence of noise.
","[{""version"":""v1"",""created"":""Thu, 11 Sep 1997 20:10:11 GMT""}]","2007-05-23"
"astro-ph/9709109","Mike Shull","J. Michael Shull (Univ. of Colorado)","The Nature of the Low-redshift Ly-alpha Clouds","8 pages LATEX, with 5 PostScript figures, conf_iap.sty To appear in
  Proceedings of 13th IAP (Paris) Colloquium, (July 1-5, 1997) Structure and
  Evolution of the IGM from QSO Absorption Lines, ed. P. Petitjean, S. Charlot",,,,"astro-ph",,"  I discuss recent HST observations and interpretation of low-z Ly-alpha clouds
toward nearby Seyferts and QSOs, including their frequency, space density,
estimated mass, association with galaxies, and contribution to Omega_b. Our
HST/GHRS detections of 73 Lya absorbers with N_HI > 10^12.6 cm^(-2) along 11
sightlines covering pathlength Delta(cz) = 86,000 km/s show f(>N_HI)
proportional to N_HI^(-0.6 +/- 0.2). A group of strong absorbers toward
PKS~2155-304 may be associated with gas (400-800)/h_75 kpc from 4 large
galaxies with low metallicity (<0.004 solar) and D/H < 2 x 10^-4. At low-z, we
derive a metagalactic ionizing radiation field and Lya-forest baryon density
J_0 = (1.1 +/- 0.4) x 10^(-23) ergs/cm^2/s/Hz/sr and Omega_b = (0.008 +/-
0.004) h_75^(-1) [J_-23 N_14 b_100]^0.5 for clouds of characteristic size b =
(100 kpc)b_100.
","[{""version"":""v1"",""created"":""Thu, 11 Sep 1997 21:13:49 GMT""}]","2007-05-23"
"astro-ph/9709110","Mike Shull","J. Michael Shull (University of Colorado)","Structure and Evolution of The Intergalactic Medium: Conference Summary","8 pages LATEX, with 1 PostScript figure, conf_iap.sty To appear in
  Proceedings of 13th IAP (Paris) Colloquium (July 1-5, 1997) Structure and
  Evolution of the IGM from QSO Absorption Lines, ed. P. Petitjean, S. Charlot",,,,"astro-ph",,"  Wasn't this a fun meeting? Yes, except for the rain. This summary highlights
scientific themes of the 13th IAP conference: (1) The History of Baryons; (2)
The History of Metals; (3) Reionization of the IGM; (4) The Assembly of
Galaxies, plus a ""wish list"" of future projects for observers and theorists.
","[{""version"":""v1"",""created"":""Thu, 11 Sep 1997 21:42:26 GMT""}]","2007-05-23"
"astro-ph/9709111","Rector Travis Arthu","John T. Stocke and Travis A. Rector (Center for Astrophysics and Space
  Astronomy, University of Colorado, Boulder)","An Excess of Mg II Absorbers in BL Lac Objects","LaTeX, AASTeX, 3 figures: jy0138.eps, jy0454.eps, jy2029.eps ApJL,
  Accepted September 2nd, 1997",,"10.1086/310962",,"astro-ph",,"  Two new Mg II absorbers are presented (z=1.340 in S5 0454+844 and z=1.117 in
PKS 2029+121), bringing the total number of Mg II systems in the 1 Jy
radio-selected BL Lac sample to 10. Five of the ten absorption systems are at W
> 1A; this is a factor of four to five greater than the number expected based
upon quasar sightlines, and is 2.5 to 3 sigma greater than the expectation
value. Interpretations of this possible excess include either that some of the
Mg II absorbers might be intrinsic to the BL Lac or that there is a correlation
between the presence of absorbing gas in the foreground and the nearly
featureless spectra of these BL Lac Objects compared to quasars. Such a
correlation can be created by gravitational microlensing as suggested by
Ostriker & Vietri. The similarity between the optical spectra of BL Lacs with
Mg II absorption and the spectrum of the Gamma-ray burst source GRB 970508
suggests that models of Gamma-ray bursts as microlensed AGN should be
investigated.
","[{""version"":""v1"",""created"":""Thu, 11 Sep 1997 23:09:07 GMT""}]","2009-10-30"
"astro-ph/9709112","Wayne Hu","Daniel J. Eisenstein and Wayne Hu (IAS, Princeton)","Baryonic Features in the Matter Transfer Function","20 pages, LaTeX, 7 Postscript figures included. Submitted to ApJ.
  Electronic versions of formulae are available at
  http://www.sns.ias.edu/~whu/transfer/transfer.html","Astrophys.J.496:605,1998","10.1086/305424",,"astro-ph",,"  We provide scaling relations and fitting formulae for adiabatic cold dark
matter cosmologies that account for all baryon effects in the matter transfer
function to better than 10% in the large-scale structure regime. They are based
upon a physically well-motivated separation of the effects of acoustic
oscillations, Compton drag, velocity overshoot, baryon infall, adiabatic
damping, Silk damping, and cold-dark-matter growth suppression. We also find a
simpler, more accurate, and better motivated form for the zero baryon transfer
function than previous works. These descriptions are employed to quantify the
amplitude and location of baryonic features in linear theory. While baryonic
oscillations are prominent if the baryon fraction exceeds $\Omega_0 h^2 + 0.2$,
the main effect in more conventional cosmologies is a sharp suppression in the
transfer function below the sound horizon. We provide a simple but accurate
description of this effect and stress that it is not well approximated by a
change in the shape parameter $\Gamma$.
","[{""version"":""v1"",""created"":""Fri, 12 Sep 1997 00:10:17 GMT""}]","2011-06-15"
"astro-ph/9709113","Juri Poutanen","Boris Stern, Juri Poutanen, and Roland Svensson","A Complexity-Brightness Correlation in Gamma Ray Bursts","13 pages; 11 figures; replaced with the published version","Astrophys.J. 510: 312:324, 1999","10.1086/306548",,"astro-ph astro-ph.CO astro-ph.HE","http://arxiv.org/licenses/nonexclusive-distrib/1.0/","  We observe strong correlations between the temporal properties of gamma ray
bursts (GRBs) and their apparent peak brightness. The strongest effect (with a
significance level of 10^{-6}) is the difference between the brightness
distributions of simple bursts (dominated by a single smooth pulse) and complex
bursts (consisting of overlapping pulses). The latter has a break at a peak
flux of 1.5 ph/cm^2/s, while the distribution of simple bursts is smooth down
to the BATSE threshold. We also observe brightness dependent variations in the
shape of the average peak aligned time profile (ATP) of GRBs. The decaying
slope of the ATP shows time dilation when comparing bright and dim bursts while
the rising slope hardly changes. Both slopes of the ATP are deformed for weak
bursts as compared to strong bursts. The interpretation of these effects is
simple: a complex burst where a number of independent pulses overlap in time
appears intrinsically stronger than a simple burst. Then the BATSE sample of
complex bursts covers larger redshifts where some cosmological factor causes
the break in the peak brightness distribution. This break could correspond to
the peak in the star formation rate that was recently shown to occur at a
redshift of z~1.5.
","[{""version"":""v1"",""created"":""Fri, 12 Sep 1997 13:29:42 GMT""},{""version"":""v2"",""created"":""Mon, 4 Jul 2011 14:08:45 GMT""}]","2011-07-13"
"astro-ph/9709114","Izumi Murakami","Izumi Murakami (National Institute for Fusion Science) and Kazuyuki
  Yamashita (Information Processing Center, Chiba University)","Metal Enrichment of Ly alpha Clouds and Intergalactic Medium","4 pages LaTeX, 3 PostScript figures, conf_iap.sty. To appear in the
  Proceedings of the 13th IAP Colloquium (July 1-5, 1997): Structure and
  Evolution of the IGM from QSO Absorption Line Systems",,,,"astro-ph",,"  We have examined the metal enrichment of the intergalactic medium (IGM) based
on a galactic wind model. A galactic wind driven by supernovae brings metallic
gas to the IGM but not so far beyond the gravitational potential. The expanding
velocity of the outflow depends on the star formation timescale. Examining 3D
calculation for the IGM in CDM model, we find that only 10 % region has
metallicity larger than $10^{-2}Z_{\odot}$ at $z=3$. Wide range of the IGM
metallicity produces variety of CIV column densities for a fixed HI column
density.
","[{""version"":""v1"",""created"":""Fri, 12 Sep 1997 10:46:44 GMT""}]","2007-05-23"
"astro-ph/9709115","Yoshiaki Sofue","Yoshiaki Sofue, Yoshinori Tutui, Mareki Honma and Akihiko Tomita","Nuclear Rotation Curves of Galaxies in the CO Line Emission","To appear in AJ, Plain TeX, Figures on request",,"10.1086/118657","U.Tokyo Astro.Preprint No.97-19","astro-ph",,"  We have obtained high-resolution position-velocity (PV) diagrams along the
major axes of the central regions of nearby galaxies in the CO-line emission
using the Nobeyama 45-m telescope and the Millimeter Array. Nuclear rotation
curves for 14 galaxies have been derived based on the PV diagrams using the
envelope-tracing method. The nuclear rotation curves for most of the galaxies
show a steep rise within a few hundred pc, which indicates a high-density
concentration of mass.
  Keywords: Galaxies: general - Galaxies: structure - ISM: molecular line
","[{""version"":""v1"",""created"":""Fri, 12 Sep 1997 10:37:52 GMT""}]","2009-10-30"
"astro-ph/9709116","Jochen Heidt","J. Heidt, S.J. Wagner","Intraday variability in x-ray selected BL Lacertae objects","10 pages, 6 figures, A&A Latex (relevant style files included),
  accepted for publication in A&A main journal",,,,"astro-ph",,"  We present a study of the intraday variability behaviour of two samples of
x-ray selected BL Lac objects, the EMSS and EXOSAT samples consisting of 22 and
11 sources, respectively. In both samples we were able to detect intraday
variability in less than 40% of the sources only. The duty cycle (the fraction
of time, when a BL Lac object is variable) in x-ray selected BL Lac objects is
0.4 or less. The typical peak-to-peak amplitudes of the variability are 10%.
Typical time-scales and an activity parameter for our variable BL Lac objects
were inferred from structure function and autocorrelation function analyses. In
only 4 BL Lac objects we were able to measure a characteristic time-scale,
which was in the range between 1.3 and 2.7 days. Comparison with our previous
study of a complete sample of radio-selected BL Lac objects from the 1 Jy
catalogue shows that x-ray and radio-selected BL Lac objects differ in their
duty cycle by a factor of 2 and the typical peak-to-peak amplitudes by a factor
of 3. The observed time-scales are similar. We also found that the same
mechanism may be responsible for the observed variability in the x-ray selected
and radio-selected BL Lac objects. The expectations of the various schemes
linking x-ray selected and radio-selected BL Lac objects have been compared to
our observations. Consistency is found for a scenario, where x-ray selected BL
Lac objects have on average stronger magnetic fields and are seen under
relatively larger viewing angles than the radio-selected BL Lac objects.
However, the suggestion that x-ray selected BL Lac objects have decelerating
jets and radio-selected BL Lac objects accelerating jets can also not be ruled
out.
","[{""version"":""v1"",""created"":""Fri, 12 Sep 1997 12:20:29 GMT""}]","2007-05-23"
"astro-ph/9709117","Jacco Vink","Jacco Vink, Jelle Kaastra, Johan Bleeker","X-ray spectroscopy of the supernova remnant RCW 86","7 pages, 5 figures",,,,"astro-ph",,"  We present an analysis of ASCA X-ray data of SNR RCW 86. There appears to be
a remarkable spectral variation over the remnant, indicating temperatures
varying from 0.8 keV to > 3 keV. We have fitted these spectra with
non-equilibrium ionization models and found that all regions are best fitted by
emission from a hot plasma underabundant in metals (<0.25 solar), but in some
cases fluorescent emission indicates overabundances of Ar and Fe. The
ionization stage of the metals appears to be far from equilibrium, at some
spots as low as log(n_e t) 15.3 (SI units). We discuss the physical reality of
the abundances and suggest an electron distribution with a supra-thermal tail
to alleviate the strong depletion factors observed. We argue that RCW 86 is the
result of a cavity explosion.
","[{""version"":""v1"",""created"":""Fri, 12 Sep 1997 13:43:58 GMT""}]","2007-05-23"
"astro-ph/9709118","Christopher L. Taylor","C.L. Taylor and C.D. Wilson","12CO J=1-0 Observations of Individual Giant Molecular Clouds in M81","14 pages, 5 figures, 1 table; has been accepted for publication in
  ApJ",,"10.1086/305247",,"astro-ph",,"  We present 12CO J=1-0 observations from the Caltech Millimeter Array of a
field in the nearby spiral galaxy M81. We detect emission from three features
that are the size of large giant molecular clouds (GMCs) in the Milky Way
Galaxy and M31, but are larger than any known in M33 or the SMC. The M81 clouds
have diameters approximately 100 pc and molecular masses 3 * 10^5 solar masses.
These are the first GMCs to be detected in such an early type galaxy (Sab) or
in a normal galaxy outside the Local Group. The clouds we have detected do not
obey the size-linewidth relation obeyed by GMCs in our Galaxy and in M33, and
some of them may be GMC complexes that contain several small GMCs. One of these
does show signs of sub-structure, and is shaped like a ring section with three
separate peaks. At the center of this ring section lies a giant HII region,
which may be associated with the molecular clouds.
","[{""version"":""v1"",""created"":""Fri, 12 Sep 1997 14:04:57 GMT""}]","2016-08-30"
"astro-ph/9709119",,"Jacco Th. van Loon (ESO, Amsterdam), Albert A. Zijlstra (ESO),
  Patricia A. Whitelock (SAAO), Peter te Lintel Hekkert (ATNF), Jessica M.
  Chapman (AAO, ATNF), Cecile Loup (ESO, IAP), M.A.T. Groenewegen (MPA),
  L.B.F.M. Waters (Amsterdam, SRON), and Norman. R. Trams (ESA)","Obscured Asymptotic Giant Branch stars in the Magellanic Clouds IV.
  Carbon stars and OH/IR stars","17 pages, with 8 figures. Accepted by Astronomy and Astrophysics,
  Main Journal","Astron.Astrophys.329:169,1998",,,"astro-ph",,"  We present N-band photometry for a sample of 21 dust- enshrouded AGB stars in
the Large Magellanic Cloud, and three additional sources in the Small
Magellanic Cloud. Together with near-IR photometry, this is used to give a
tentative classification into carbon and oxygen-rich atmospheres. Bolometric
luminosities are also estimated for these stars. In addition, we present the
results of a survey for OH masers in the LMC, which resulted in the discovery
of OH maser emission from IRAS04407-7000. Spectra between 600 and 1000 nm have
been obtained for two heavily obscured AGB stars in the LMC, confirming them to
be highly reddened very late M-type giants. Because the dust-enshrouded stars
are clearly undergoing heavy mass loss they are assumed to be very near the
termination of their respective Asymptotic Giant Branch phases. The fraction of
mass-losing carbon stars decreases with increasing luminosity, as expected from
Hot Bottom Burning. The best candidate carbon star, with M_bol = -6.8 mag, is
the most luminous mass-losing carbon star in the Magellanic Clouds, and amongst
the most luminous AGB stars. At lower luminosities (M_bol = -5 mag) both oxygen
and carbon stars are found. This may be explained by a range in metallicity of
the individual mass-losing AGB stars.
","[{""version"":""v1"",""created"":""Fri, 12 Sep 1997 15:33:07 GMT""}]","2008-11-26"
"chao-dyn/9709015","Cristian Giardina'","C. Giardina' and R. Livi","Ergodic Properties of Microcanonical Observables","19 pages, 6 figures",,,,"chao-dyn nlin.CD",,"  The problem of the existence of a Strong Stochasticity Threshold in the
FPU-beta model is reconsidered, using suitable microcanonical observables of
thermodynamic nature, like the temperature and the specific heat. Explicit
expressions for these observables are obtained by exploiting rigorous methods
of differential geometry. Measurements of the corresponding temporal
autocorrelation functions locate the threshold at a finite value of the energy
density, that results to be indipendent of the number of degrees of freedom.
","[{""version"":""v1"",""created"":""Fri, 12 Sep 1997 11:04:45 GMT""}]","2008-02-03"
"chao-dyn/9709016","Antonio Politi","F.Cecconi, R.Livi, and A.Politi","Fuzzy phase transition in a 1D coupled stable-map lattice","15 pages, 10 PostScript files for 9 figures",,,,"chao-dyn nlin.CD",,"  A coupled-map lattice showing complex behavior in presence of a fully
negative Lyapunov spectrum is considered. A phase transition from ordered to
disordered evolution upon changing diffusive coupling is studied in detail.
Various indicators provide a coherent description of the scenario: the
existence of an intermediate transition region characterized by an irregular
alternancy of periodic and chaotic evolution.
","[{""version"":""v1"",""created"":""Fri, 12 Sep 1997 11:08:22 GMT""}]","2008-02-03"
"chao-dyn/9709018","Peter Schmelcher","P. Schmelcher and F. K. Diakonos","A turning point analysis of the ergodic dynamics of iterative maps","37 pages, 11 figures, LaTeX, tccite.sty, to be published in the Int.
  J. Bif. Chaos",,"10.1142/S0218127497001643",,"chao-dyn nlin.CD",,"  The dynamics of one dimensional iterative maps in the regime of fully
developed chaos is studied in detail. Motivated by the observation of dynamical
structures around the unstable fixed point we introduce the geometrical concept
of a turning point which represents a local minimum or maximum of the
trajectory. Following we investigate the highly organized and structured
distribution of turning points. The turning point dynamics is discussed and the
corresponding turning point map which possesses an appealing asymptotic scaling
property is investigated. Strong correlations are shown to exist for the
turning point trajectories which contain the information of the fixed points as
well as the stability coefficients of the dynamical system. For the more
specialized case of symmetric maps which possess a symmetric density we derive
universal statistical properties of the corresponding turning point dynamics.
Using the turning point concept we finally develop a method for the analysis of
(one dimensional) time series.
","[{""version"":""v1"",""created"":""Fri, 12 Sep 1997 15:27:29 GMT""}]","2015-06-24"
"cond-mat/9709137","Bob Markiewicz","R.S. Markiewicz and M.T. Vaughn (Northeastern U., Boston)","Stripes, pseudogaps, and SO(6) in the cuprate superconductors","5 pages, 8 figures included as ps files; presented at SNS97
  (Spectroscopies in Novel Superconductors), Sept. 14-18, Cape Cod; proceedings
  to appear in J. Phys. Chem. Sol",,"10.1016/S0022-3697(98)00093-6",,"cond-mat.supr-con",,"  We briefly summarize two related calculations. First, we demonstrate that the
instabilities (either nesting or pairing) associated with the high-T_c cuprates
can be described by an SO(6) transformation group. There are two independent
6-dimensional representations (`superspins'). One superspin combines Zhang's
5-component superspin with a flux phase instability; the other involves a
charge density wave, s-wave superconductivity, and an exotic spin current.
  The second calculation is a self-consistent slave boson calculation, which
provides a good description of the doping dependence of the photoemission
dispersion in terms of dynamic striped phases. The stripes are stabilized by
strong electron-phonon coupling, and provide evidence for a doping-dependent
crossover between the two superspin groundstates.
","[{""version"":""v1"",""created"":""Thu, 11 Sep 1997 19:33:39 GMT""}]","2009-10-30"
"cond-mat/9709138","Igor Mazin","I.I. Mazin and D.J. Singh","Nonlocal density functionals and the linear response of the homogeneous
  electron gas","4 pages, two eps figures embedded","Phys. Rev. B., 1998, 57, 6879","10.1103/PhysRevB.57.6879",,"cond-mat.mtrl-sci",,"  The known and usable truly nonlocal functionals for exchange-correlation
energy of the inhomogeneous electron gas are the ADA (average density
approximation) and the WDA (weighted density approximation). ADA, by design,
yields the correct linear response function of the uniform electron gas. WDA is
constructed so that it is exact in the limit of one-electron systems. We derive
an expression for the linear response of the uniform gas in the WDA, and
calculate it for several flavors of WDA. We then compare the results with the
Monte-Carlo data on the exchange-correlation local field correction, and
identify the weak points of conventional WDA in the homogeneous limit. We
suggest how the WDA can be modified to improve the response function. The
resulting approximation is a good one in both opposite limits, and should be
useful for practical nonlocal density functional calculations.
","[{""version"":""v1"",""created"":""Thu, 11 Sep 1997 19:23:49 GMT""}]","2009-10-30"
"cond-mat/9709139","Reinhold Egger","Reinhold Egger, Andrei Komnik","Scaling and criticality of the Kondo effect in a Luttinger liquid","11 pages REVTeX, incl. 9 PS figures, subm. to PRB","Phys. Rev. B 57, 10620 (1998).","10.1103/PhysRevB.57.10620",,"cond-mat.str-el",,"  A quantum Monte Carlo simulation method has been developed and applied to
study the critical behavior of a single Kondo impurity in a Luttinger liquid.
This numerically exact method has no finite-size limitations and allows to
simulate the whole temperature range. Focusing on the impurity magnetic
susceptibility, we determine the scaling functions, in particular for
temperatures well below the Kondo temperature. In the absence of elastic
potential scattering, we find Fermi-liquid behavior for strong
electron-electron interactions, g_c < 1/2, and anomalous power laws for 1/2<g_c
< 1, where g_c is the correlation parameter of the Luttinger liquid. These
findings resolve a recent controversy. If elastic potential scattering is
present, we find a logarithmically divergent impurity susceptibility at g_c<1/2
which can be rationalized in terms of the two-channel Kondo model.
","[{""version"":""v1"",""created"":""Thu, 11 Sep 1997 20:04:59 GMT""}]","2009-10-30"
