"cond-mat/9709140","Ilpo Vattulainen","I. Vattulainen, J. Merikoski, T. Ala-Nissila, and S. C. Ying","Non-Arrhenius Behavior of Surface Diffusion Near a Phase Transition
  Boundary","4 pages, Latex with RevTeX macros","Phys. Rev. Lett. 79 (1997) 257","10.1103/PhysRevLett.79.257",,"cond-mat.soft",,"  We study the non-Arrhenius behavior of surface diffusion near the
second-order phase transition boundary of an adsorbate layer. In contrast to
expectations based on macroscopic thermodynamic effects, we show that this
behavior can be related to the average microscopic jump rate which in turn is
determined by the waiting-time distribution W(t) of single-particle jumps at
short times. At long times, W(t) yields a barrier that corresponds to the
rate-limiting step in diffusion. The microscopic information in W(t) should be
accessible by STM measurements.
","[{""version"":""v1"",""created"":""Thu, 11 Sep 1997 20:20:05 GMT""}]","2009-10-30"
"cond-mat/9709141","Bob Holdom","B. Holdom","From turbulence to financial time series","10 pages, 1 figure, LaTeX, version to appear in Physica A",,"10.1016/S0378-4371(98)00078-8","UTPT-97-20","cond-mat.stat-mech q-fin.ST",,"  We develop a framework especially suited to the autocorrelation properties
observed in financial times series, by borrowing from the physical picture of
turbulence. The success of our approach as applied to high frequency foreign
exchange data is demonstrated by the overlap of the curves in Figure (1), since
we are able to provide an analytical derivation of the relative sizes of the
quantities depicted. These quantities include departures from Gaussian
probability density functions and various two and three-point autocorrelation
functions.
","[{""version"":""v1"",""created"":""Thu, 11 Sep 1997 20:28:41 GMT""},{""version"":""v2"",""created"":""Thu, 26 Feb 1998 03:31:49 GMT""}]","2015-06-25"
"cond-mat/9709142","Frederick Green","F. Green (CSIRO Telecommunications and Industrial Physics) and M. P.
  Das (Australian National University)","Nonequilibrium Noise in Metals at Mesoscopic Scales","RevTeX, 3 pp, no figs",,,"TIPP42","cond-mat",,"  We review a semiclassical theory of high-field noise in degenerate
conductors, based on propagator solutions to the Boltzmann equation for the
fluctuation distribution function. The theory provides a microscopic
description of correlation-induced suppression of noise in quantum-confined
systems, such as heterojunction devices. It is also capable of describing
diffusive conductors in the mesoscopic regime. We discuss nonequilibrium
thermal noise in a simple model of a mesoscopic wire.
","[{""version"":""v1"",""created"":""Fri, 12 Sep 1997 01:53:05 GMT""}]","2007-05-23"
"cond-mat/9709143","Krastan B. Blagoev","K.B. Blagoev, J.R. Engelbrecht and K.S. Bedell (Physics Department,
  Boston College, MA)","S-wave Superconductivity in Weak Ferromagnetic Metals","4 pages, 1 eps figure",,,,"cond-mat.str-el cond-mat.supr-con",,"  We investigate the behavior of weak ferromagnetic metals close to the
ferromagnetic critical point. We show that in the limit of small magnetic
moment the low temperature metallic phase is rigorously described by a local
ferromagnetic Fermi liquid that has a momentum-independent self-energy.
Whereas, non-Fermi liquid features develop at higher temperatures. Furthermore,
we find that an instability towards s-wave superconductivity is possible when
the exchange splitting is comparable to the superconducting gap.
","[{""version"":""v1"",""created"":""Fri, 12 Sep 1997 03:36:44 GMT""}]","2008-02-03"
"cond-mat/9709144","Nuno Miguel Peres","N. M. R. Peres, P. D. Sacramento, and J. C. Carmelo","Charge and Spin Currents of the 1D Hubbard Model at Finite Energy","LaTex file, 39 pages, 28 figures",,,,"cond-mat.str-el",,"  The transport of charge and spin at finite energies is studied for the
Hubbard chain in a magnetic field by means of the pseudoparticle perturbation
theory. In the general case, this involves the solution of an infinite set of
Bethe-ansatz equations with a flux. Our results refer to all densities and
magnetizations. We express the charge and the spin-diffusion currents in terms
of elementary currents associated with the charge and spin carriers. We show
that these are the \alpha,\gamma pseudoparticles (with \alpha =c,s and \gamma
=0,1,2,3,...) and we find their couplings to charge and spin. We also study the
ratios of the pseudoparticle charge and spin transport masses over the
corresponding static mass. These ratios provide valuable information on the
effects of electronic correlations in the transport properties of the quantum
system. We show that the transport of charge and spin in the Hubbard chain can,
alternatively, be described by means of pseudoparticle kinetic equations. This
follows from the occurrence of only forward-scattering pseudoparticle
interactions at all energies.
","[{""version"":""v1"",""created"":""Fri, 12 Sep 1997 10:27:47 GMT""}]","2008-02-03"
"cond-mat/9709145","Daniel Duque","D Duque and P Tarazona (Universidad Autonoma de Madrid, Spain)","Exact results and mean field approximation for a model of molecular
  aggregation","7 pages, 5 figures, some minor corrections","Journal of Chemical Physics, 107, 10207 (1997)","10.1063/1.474157",,"cond-mat.soft cond-mat.stat-mech",,"  We present a simple one-dimensional model with molecular interactions
favouring the formation of clusters with a defined optimal size. Increasing the
density, at low temperature, the system goes from a nearly-ideal gas of
independent molecules to a system with most of the molecules in optimal
clusters, in a way that resembles the formation of micelles in a dilution of
amphiphilic molecules, at the critical micellar concentration. Our model is
simple enough to have an exact solution, but it contains some basic features of
more realistic descriptions of amphiphilic systems: molecular excluded volume
and molecular attractions which are saturated at the optimal cluster. The
comparison between the exact results and the mean field density functional
approximation suggests new approaches to study the more complex and realistic
models of micelle formation; in particular it addresses the long-standing
controversy surrounding separation of internal degrees of freedom in the
formulation of cluster association phenomena.
","[{""version"":""v1"",""created"":""Fri, 12 Sep 1997 11:24:42 GMT""},{""version"":""v2"",""created"":""Tue, 9 Dec 1997 13:31:25 GMT""}]","2009-10-30"
"cond-mat/9709146","Sandro Sorella","S. Sorella and A. Parola","Theory of hole propagation in one dimensional insulators and
  superconductors","38 pages, RevTeX + 13 figures in a single Postscript file submitted
  to Phys. Rev. B",,"10.1103/PhysRevB.57.6444",,"cond-mat",,"  The dynamical properties of hole motion in an antiferromagnetic background
are determined in one dimensional models in zero magnetic field, where spin
isotropy holds, as well as in an external magnetic field. The latter case is
also relevant, via particle-hole transformation, to the problem of hole
propagation in one dimensional ""superconductors"". The singularities in the
spectral function are investigated by means of bosonization techniques and
perturbation theories. Results are then compared with Bethe ansatz solutions
and Lanczos diagonalizations. The formalism also leads to interesting
connections to the single impurity problem in Luttinger liquids. A rich
structure is found in the spectral function whenever spin isotropy is broken,
suggesting the presence of exotic momentum dependence in photoemission spectra
of (quasi) one dimensional materials.
","[{""version"":""v1"",""created"":""Fri, 12 Sep 1997 14:56:30 GMT""}]","2009-10-30"
"cond-mat/9709147","Thomas Devereaux","T. P. Devereaux and A. P. Kampf","Electronic Raman Scattering in Nearly Antiferromagnetic Fermi Liquids","3 pages + 4 figures, SNS97 Conference Proceedings","J. Phys. Chem. Solids Vol. 59, 1972 (1998)","10.1016/S0022-3697(98)00158-9",,"cond-mat.str-el",,"  A theory of electronic Raman scattering in nearly antiferromagnetic Fermi
liquids is constructed using the phenomenological electron-electron interaction
introduced by Millis, Monien, and Pines. The role of ""hot spots"" and their
resulting signatures in the channel dependent Raman spectra is highlighted, and
different scaling regimes are addressed. The theory is compared to Raman
spectra taken in the normal state of overdoped
Bi$_{2}$Sr$_{2}$CaCu$_{2}$O$_{8+\delta}$, and it is shown that many features of
the symmetry dependent spectra can be explained by the theory.
","[{""version"":""v1"",""created"":""Fri, 12 Sep 1997 15:17:58 GMT""}]","2009-10-30"
"gr-qc/9709025","Chris Chambers","Chris M. Chambers (Montana State)","The Cauchy Horizon In Black Hole-de Sitter Spacetimes","35 pages (including 15 eps figures), RevTex. Uses header.sty
  (included). To be published in the proceedings of the workshop on ``The
  Internal Structure of Black Holes and Spacetime Singularities"", held at the
  Technion -- Israel Institute of Technology, Haifa, Israel. June 29 - July 3,
  1997",,,"MSUPHY9716","gr-qc",,"  The last seven years has produced a growing body of evidence which concludes
that the Cauchy horizon in black hole-de Sitter spacetimes is classically
stable when the surface gravity at the cosmological event horizon is greater
than that at the Cauchy horizon. That stability persists for a finite, but
non-zero, region of the black hole's parameter space, $(M,Q,J,\Lambda)$,
suggests that black holes immersed in de Sitter space are counter-examples to
the strong cosmic censorship hypothesis.
  In this review we chronicle that body of evidence and describe the first
steps of a program of numerical work aimed at better understanding the interior
of black hole-de Sitter spacetimes. The review ends with a speculative account
of the role that future work will take.
","[{""version"":""v1"",""created"":""Thu, 11 Sep 1997 20:09:57 GMT""}]","2007-05-23"
"gr-qc/9709026","Thomas Baumgarte","T. W. Baumgarte, G. B. Cook, M. A. Scheel, S. L. Shapiro and S. A.
  Teukolsky","General Relativistic Models of Binary Neutron Stars in Quasiequilibrium","14 pages, 8 figures, RevTeX","Phys. Rev. D 57, 7299 (1998)","10.1103/PhysRevD.57.7299",,"gr-qc astro-ph",,"  We perform fully relativistic calculations of binary neutron stars in
corotating, circular orbit. While Newtonian gravity allows for a strict
equilibrium, a relativistic binary system emits gravitational radiation,
causing the system to lose energy and slowly spiral inwards. However, since
inspiral occurs on a time scale much longer than the orbital period, we can
treat the binary to be in quasiequilibrium. In this approximation, we integrate
a subset of the Einstein equations coupled to the relativistic equation of
hydrostatic equilibrium to solve the initial value problem for binaries of
arbitrary separation. We adopt a polytropic equation of state to determine the
structure and maximum mass of neutron stars in close binaries for polytropic
indices n=1, 1.5 and 2. We construct sequences of constant rest-mass and locate
turning points along energy equilibrium curves to identify the onset of orbital
instability. In particular, we locate the innermost stable circular orbit
(ISCO) and its angular velocity. We construct the first contact binary systems
in full general relativity. These arise whenever the equation of state is
sufficiently soft >= 1.5. A radial stability analysis reveals no tendency for
neutron stars in close binaries to collapse to black holes prior to merger.
","[{""version"":""v1"",""created"":""Thu, 11 Sep 1997 22:22:30 GMT""}]","2016-08-25"
"gr-qc/9709027","Dominik Schwarz","Dominik J. Schwarz (Univ. Frankfurt)","Evolution of gravitational waves through the cosmological QCD transition","10 pages, LaTeX2e, 1 figure; analytic estimate for the modification
  of the spectral slope near f_* added, minor changes to improve the
  presentation; accepted for publication in Mod. Phys. Lett. A","Mod.Phys.Lett. A13 (1998) 2771-2778","10.1142/S0217732398002941",,"gr-qc astro-ph hep-ph",,"  The spectrum of gravitational waves that have been produced in inflation is
modified during cosmological transitions. Large drops in the number of
relativistic particles, like during the QCD transition or at $e^+e^-$
annihilation, lead to steps in the spectrum of gravitational waves. We
calculate the transfer function for the differential energy density of
gravitational waves for a first-order and for a crossover QCD transition.
","[{""version"":""v1"",""created"":""Fri, 12 Sep 1997 08:51:28 GMT""},{""version"":""v2"",""created"":""Fri, 6 Nov 1998 15:19:10 GMT""}]","2009-10-30"
"gr-qc/9709028","Dr John W. Barrett","John W. Barrett, Louis Crane","Relativistic spin networks and quantum gravity","10 pages, amstex, some errors corrected, more references","J.Math.Phys. 39 (1998) 3296-3302","10.1063/1.532254",,"gr-qc hep-th",,"  Relativistic spin networks are defined by considering the spin covering of
the group SO(4), SU(2) times SU(2). Relativistic quantum spins are related to
the geometry of the 2-dimensional faces of a 4-simplex. This extends the idea
of Ponzano and Regge that SU(2) spins are related to the geometry of the edges
of a 3-simplex.
  This leads us to suggest that there may be a 4-dimensional state sum model
for quantum gravity based on relativistic spin networks which parallels the
construction of 3-dimensional quantum gravity from ordinary spin networks.
","[{""version"":""v1"",""created"":""Fri, 12 Sep 1997 13:51:05 GMT""},{""version"":""v2"",""created"":""Fri, 23 Jan 1998 17:11:26 GMT""}]","2009-10-30"
"gr-qc/9709029","Ruth A. W. Gregory","Owen Dando and Ruth Gregory","Global monopoles in dilaton gravity","15 pages, 3 figures, version to appear in Class Quant Grav","Class.Quant.Grav. 15 (1998) 985-995","10.1088/0264-9381/15/4/019","DTP/97/43","gr-qc hep-th",,"  We analyse the gravitational field of a global monopole within the context of
low energy string gravity, allowing for an arbitrary coupling of the monopole
fields to the dilaton. Both massive and massless dilatons are considered. We
find that, for a massless dilaton, the spacetime is generically singular,
whereas when the dilaton is massive, the monopole generically induces a long
range dilaton cloud. We compare and contrast these results with the literature.
","[{""version"":""v1"",""created"":""Fri, 12 Sep 1997 13:55:15 GMT""},{""version"":""v2"",""created"":""Mon, 19 Jan 1998 09:45:03 GMT""},{""version"":""v3"",""created"":""Wed, 11 Feb 1998 17:00:31 GMT""}]","2009-10-30"
"gr-qc/9709030","Zloshchastiev Konstantin","Konstantin G. Zloshchastiev (Dnepropetrovsk University, Ukraine)","Theory of thin shells in general relativity: Equivalence of direct and
  Wheeler-DeWitt quantizations","5 pages, LaTeX",,,,"gr-qc",,"  We justify the way of the direct quantization which means immediate
quantization of a conservation law. It is shown that this approach is
equivalent to introducing the super Hamiltonian on a minisuperspace in spirit
of the Wheeler-DeWitt's approach. Then we will have: (i) all values are
observable and have an obvious physical meaning and well-defined application
domain; (ii) wave function is well-defined without time slicing and often can
be exactly obtained; (iii) we can take off major mathematical troubles, and
therefore, more complicate models can be considered exactly without the
perturbation theory.
","[{""version"":""v1"",""created"":""Fri, 12 Sep 1997 10:06:41 GMT""},{""version"":""v2"",""created"":""Sun, 20 Sep 1998 03:10:20 GMT""},{""version"":""v3"",""created"":""Tue, 22 Sep 1998 03:54:47 GMT""}]","2008-02-03"
"hep-lat/9709032","Jeff Greensite","L. Del Debbio, M. Faber, J. Greensite, S. Olejnik","Center Vortices and the Asymptotic String Tension","Talk presented at Lattice 97. 3 pages, 2 figures, Latex. Uses
  espcrc2.sty and psfig.sty","Nucl.Phys.Proc.Suppl.63:552-554,1998","10.1016/S0920-5632(97)00831-1",,"hep-lat",,"  We present a method for locating center vortices (``fluxons'') in thermalized
lattice gauge field configurations. We find evidence, in lattice Monte Carlo
simulations, that the asymptotic string tension of fundamental-representation
Wilson loops is due to fluctuations in the number of center vortices linking
those loops.
","[{""version"":""v1"",""created"":""Thu, 11 Sep 1997 19:40:34 GMT""}]","2008-11-26"
"hep-lat/9709033","Karl Jansen","Roberto Frezzotti and Karl Jansen","Experiences with the Polynomial Hybrid Monte Carlo Algorithm","Latex file, 1 figure, 5 pages, talk given by R.F. at the
  International Symposium on Lattice Field Theory, 22-26 July 1997, Edinburgh,
  Scotland","Nucl.Phys.Proc.Suppl. 63 (1998) 943-945","10.1016/S0920-5632(97)00948-1","CERN-TH/97-243","hep-lat",,"  We discuss a simulation algorithm for dynamical fermions, which combines the
multiboson technique with the Hybrid Monte Carlo algorithm. The algorithm turns
out to give a substantial gain over standard methods in practical simulations
and to be suitable for dealing with fermion zero modes in a clean and
controllable way.
","[{""version"":""v1"",""created"":""Fri, 12 Sep 1997 07:22:18 GMT""}]","2009-10-30"
"hep-lat/9709034","L. Del Debbio","L. Del Debbio (for the UKQCD Collaboration)","Chiral symmetry breaking in the 3-d Thirring model for small $N_f$","3 pages, 3 figures. Talk presented at Lattice '97",,,"CPT-97/P.3527","hep-lat",,"  We study the dynamical breaking of chiral symmetry in the 3-d Thirring model
for a small number of fermion species. The critical point is identified by
fitting lattice data to an equation of state. The spectrum of the theory is
studied to confirm the phase structure of the model.
","[{""version"":""v1"",""created"":""Fri, 12 Sep 1997 12:29:51 GMT""}]","2007-05-23"
"hep-ph/9709317","Tanmay Vachaspati","Levon Pogosian and Tanmay Vachaspati (CWRU)","Relaxing the Geodesic Rule in Defect Formation Algorithms","3 pages, 3 figures, RevTeX","Phys.Lett. B423 (1998) 45-48","10.1016/S0370-2693(98)00109-9","CWRU-P14-1997","hep-ph",,"  In studying the formation of topological defects, it is conventional to
assume the ``geodesic rule'' which is equivalent to minimizing gradients of the
order parameter. This assumption has been called into question in
field-theoretic studies of first order phase transitions and in the case of
local defects. We present a scheme for numerically investigating the formation
of strings without assuming the geodesic rule. Our results show that the
fraction of string in infinite strings grows as we deviate from the geodesic
rule.
","[{""version"":""v1"",""created"":""Thu, 11 Sep 1997 17:14:41 GMT""}]","2009-10-30"
"hep-ph/9709318","Kathleen Logan","Gordon L. Kane","Sphenomenology --- An Overview, with a Focus on a Higgsino LSP World,
  and on Eventual Tests of String Theory","Uses espcrc2.sty","Nucl.Phys.Proc.Suppl. 62 (1998) 144-151","10.1016/S0920-5632(97)00651-8",,"hep-ph",,"  In this talk, as requested, I begin with a overview and with some basic
reminders about how evidence for supersymmetry in nature might appear -- in
particular, how SUSY signatures are never clear so it is difficult to search
for them without major theoretical input. Models can be usefully categorized
phenomenologically by naming their LSP -- that is, once the LSP is
approximately fixed so is the behavior of the observables, and the resulting
behavior is generally very different for different LSPs. Next I compare the
three main LSP-models (gravitino, bino, higgsino). Hints from data suggest
taking the higgsino-LSP world very seriously, so I focus on it, and describe
its successful prediction of reported events from the 1996 LEP runs. SUSY
signatures in the $\tilde h$ LSP world are very different from those that are
usually studied. Then I briefly discuss how to measure the parameters of the
effective Lagrangian from collider and decay data. Finally I turn to how data
will test and help extract the implications of string theories.
","[{""version"":""v1"",""created"":""Thu, 11 Sep 1997 18:51:32 GMT""}]","2009-10-30"
"hep-ph/9709319","Oscar J. P. Eboli","O. J. P. Eboli, R. Z. Funchal, and T. L. Lungov","Signal and Backgrounds for Leptoquarks at the LHC","37 pages, revtex, uses epsfig.sty (included), 15 figures (included)","Phys.Rev.D57:1715-1729,1998","10.1103/PhysRevD.57.1715","IFUSP-P 1271 and FERMILAB Pub-97/305-T","hep-ph",,"  We study the potentiality of the CERN Large Hadron Collider (LHC) to unravel
the existence of first generation scalar leptoquarks.
  Working with the most general $SU(2)_L \otimes U(1)_Y$ invariant leptoquark
interactions, we analyze in detail the signals and backgrounds that lead to a
final state containing a pair $e^+e^-$ and jets. Our results indicate that a
machine like the LHC will be able to discover leptoquarks with masses up to
2--3 TeV depending on their couplings.
","[{""version"":""v1"",""created"":""Thu, 11 Sep 1997 19:54:19 GMT""}]","2008-11-26"
"hep-ph/9709320","Michael Joyce","Michael Joyce (Dublin) and Tomislav Prokopec (NBI)","Turning Around the Sphaleron Bound: Electroweak Baryogenesis in an
  Alternative Post-inflationary Cosmology","44 pages, ReVTeX, with 9 postscipt figures (included); minor
  modifications to figures","Phys. Rev. D 57, 6022 (1998)","10.1103/PhysRevD.57.6022","NBI-HE-97-48, CLNS 97/1512","hep-ph astro-ph",,"  The usual sphaleron bound and the statement of the impossibility of baryon
production at a second order phase transition or analytic cross-over are
reformulated in the first part of the paper as requirements of the expansion
rate of the Universe at the electroweak scale. With an (exact or effective)
additional contribution to the energy density scaling as 1/a^6, which dominates
until just before nucleosynthesis, the observed baryon asymmetry may be
produced at the electroweak scale in simple extensions of the Minimal Standard
Model, even in the case that the phase transition is not first order. We focus
our attention on one such cosmology, in which the Universe goes through a
period termed `kination' in which its energy is dominated by the kinetic energy
of a scalar field. The required kinetic energy dominated modes can occur either
as a field rolls down an exponential (or steeper) potential, or in the
oscillation of a field about the minimum of a steep power-law potential. We
implement in detail the former case with a single exponential field first
driving inflation, and then rolling into a kinetic energy dominated mode.
Reheating is achieved using an alternative to the usual mechanism due to
Spokoiny, in which the Universe is `reheated' by particle creation in the
expanding background. Density perturbations of the magnitude required for
structure formation may also be generated. We show that the analogous model for
the power-law potential cannot be consistently implemented. In models with
inflation driven by a second field and the usual mechanism of reheating (by
decay of the inflaton) the required kinetic energy dominated cosmology is
viable in both types of potential.
","[{""version"":""v1"",""created"":""Thu, 11 Sep 1997 23:35:24 GMT""},{""version"":""v2"",""created"":""Sat, 13 Sep 1997 21:23:02 GMT""}]","2016-08-25"
"hep-ph/9709321","Michael Joyce","Michael Joyce","Electroweak Baryogenesis without the Phase Transition","5 pages, Latex with sprocl.sty, no figures; talk given at the Eotvos
  Conference in Science ,``Strong and Electroweak Matter '97'', Eger, Hungary,
  May 1997",,,,"hep-ph astro-ph",,"  Radiation domination at the electroweak epoch is a simplifying assumption,
but one for which there is no observational basis. Treating the expansion rate
as a variable, I re-examine electroweak baryogenesis in various scenarios. At a
first order phase transition the main effect is on the sphaleron bound, which
becomes a lower bound on the expansion rate in any given theory. At a
second-order or cross-over phase transition, the created baryon asymmetry is
directly proportional to the expansion rate. I sketch an alternative
post-inflationary cosmology, in which the kinetic energy of a scalar field
dominates the Universe until shortly before nucleosynthesis, and argue that the
observed baryon asymmetry could be produced in this case even at an analytic
cross-over.
","[{""version"":""v1"",""created"":""Thu, 11 Sep 1997 21:56:14 GMT""}]","2007-05-23"
"hep-ph/9709322","Xuemin Jin","R. L. Jaffe, Xuemin Jin, and Jian Tang","Interference Fragmentation Functions and the Nucleon's Transversity","Final version to be published in Phys. Rev. Lett","Phys.Rev.Lett.80:1166-1169,1998","10.1103/PhysRevLett.80.1166","MIT-CTP-2672","hep-ph hep-ex nucl-th",,"  We introduce twist-two quark interference fragmentation functions in helicity
density matrix formalism and study their physical implications. We show how the
nucleon's transversity distribution can be probed through the final state
interaction between two mesons ($\pi^+\pi^-$, $K\bar K$, or $\pi K$) produced
in the current fragmentation region in deep inelastic scattering on a
transversely polarized nucleon.
","[{""version"":""v1"",""created"":""Fri, 12 Sep 1997 15:06:47 GMT""},{""version"":""v2"",""created"":""Mon, 12 Jan 1998 22:33:22 GMT""}]","2008-11-26"
