"hep-ph/9709323","Hiroshi Yokota","Hisao Nakkagawa and Hiroshi Yokota (Nara University, Japan)","Effective Potential at Finite Temperature: RG improvement vs. High
  temperature expansion","3 pages, latex, 3 figures (not include, but send by request). Talk
  given at YITP International Workshop on Physics of Relativistic Heavy Ion
  Collisions, Kyoto, Japan, 9-11 June 1997, to be published in Prog. Theor.
  Phys. Supplement (Proceeding volume)","Prog.Theor.Phys.Suppl.129:209-214,1997","10.1143/PTPS.129.209","NUTP-9701","hep-ph",,"  We have applied the recently proposed renormalization group improvement
procedure of the finite temperature effective potential, and have investigated
extensively the phase structure of the massive scalar $\phi^4$ model, showing
that the $\phi^4$ model has a rich 3-phase structure at $T \neq 0$, two of them
are not seen in the ordinary perturbative analysis. Temperature dependent phase
transition in this model is shown to be strongly the first order.
","[{""version"":""v1"",""created"":""Fri, 12 Sep 1997 02:36:55 GMT""}]","2011-04-15"
"hep-ph/9709324",,"Zhenjun Xiao","Technicolor leptoquarks and the excess of NC and CC events with
  high-$Q^2$ at HERA","26 pages, Latex, no macros, two PS figures and 1 embedded latex
  figure",,,"RAL-TR-97-043","hep-ph",,"  In this paper we pursue a consistent leptoquark interpretation for HERA
anomalies in the framework of Technicolor. We find that: (a) one F=0 scalar
Technicolor leptoquark $P_3^{'}$ with a mass of 200 GeV can provide the
required contributions to account for the excess of both neutral and charged
current events with high-$Q^2$ at HERA; (b) the current data still allow the
coexistence of $ P_3^{'}$ with m(P_3^{'})= 200 GeV$ and $P_3^0$ with
$m(P_3^0)=225 GeV$, they could contribute effectively to $e^+p$ collision
process and may be responsible for the apparent splitting of average mass of H1
and ZEUS NC events with high-$Q^2$.
","[{""version"":""v1"",""created"":""Fri, 12 Sep 1997 08:20:40 GMT""}]","2007-05-23"
"hep-ph/9709325","Valery Lyubovitskij","M. A. Ivanov (JINR, Dubna), J. G. Korner (Mainz U., Inst. Phys.), V.
  E. Lyubovitskij (JINR, Dubna and Tomsk U.), A. G. Rusetsky (JINR, Dubna and
  Tbilisi U.)","Exclusive nonleptonic bottom to charm baryon decays including
  nonfactorizable contributions","14 pages, LaTeX-file","Mod.Phys.Lett. A13 (1998) 181-192","10.1142/S0217732398000231","Preprint Mainz Univ. MZ-TH/97-21","hep-ph",,"  Exclusive nonleptonic decays of bottom baryons to charm baryons and
pseudoscalar light mesons are analyzed within a relativistic three-quark model.
We include factorizing as well as nonfactorizing contributions to the decay
amplitudes. The total contribution of the nonfactorizing diagrams amount up to
30% of the factorizing contributions in amplitude. We present detailed
predictions for rates and asymmetry parameters.
","[{""version"":""v1"",""created"":""Fri, 12 Sep 1997 09:25:02 GMT""},{""version"":""v2"",""created"":""Sat, 31 Jan 1998 15:24:02 GMT""}]","2009-10-30"
"hep-ph/9709326","Hegyi Sandor","S. Hegyi (KFKI Rmki)","Asymptotic multiplicity scaling: a renormalization group perspective","13 pages REVTeX",,,,"hep-ph",,"  A generalization of the Polyakov-Koba-Nielsen-Olesen scaling law of the
multiplicity distributions P(n,s) is developed. It states that a suitable
change in the normalization point of P(n,s) compensated by a rescaling can
restore data collapsing onto a universal curve if the original scaling rule is
violated. We show that the iteratively executed transformation of P(n,s) can be
viewed as varying the collision energy. The e+e- and p-pbar multiplicity data
at top energies are found to exhibit a fixed point property of the iteration.
","[{""version"":""v1"",""created"":""Fri, 12 Sep 1997 12:00:27 GMT""}]","2007-05-23"
"hep-ph/9709327","Matthias Neubert","Matthias Neubert (CERN)","Theoretical Analysis of B -> D^{**} pi Decays","11 pages; 1 reference added and some typos corrected; version to
  appear in Physics Letters B","Phys.Lett. B418 (1998) 173-180","10.1016/S0370-2693(97)01384-1","CERN-TH/97-240","hep-ph",,"  The decays B -> D^{**} pi, where D^{**} is a narrow p-wave charm resonance,
are investigated in the context of a generalized factorization hypothesis,
including the leading nonfactorizable corrections. The decay rates for these
processes are related to the corresponding semileptonic rates at maximum
recoil. It is pointed out that the current data on the branching ratio for the
decay B^- -> D_2^{*0} pi^- may pose a problem for theory. We predict that
future, more accurate measurements of this branching ratio will find a value
B(B^- -> D_2^{*0} pi^-) = 4 * 10^{-4}, a factor 5 lower than the current
central value.
","[{""version"":""v1"",""created"":""Fri, 12 Sep 1997 13:13:04 GMT""},{""version"":""v2"",""created"":""Thu, 30 Oct 1997 16:14:59 GMT""}]","2009-10-30"
"hep-ph/9709328","Claude Bernard","C. Bernard, T. Blum, T. DeGrand, C. DeTar, Steven Gottlieb, U. M.
  Heller, J. Hetrick, C. McNeile, K. Rummukainen, R. Sugar, D. Toussaint, and
  M. Wingate","B Mixing on the Lattice: $f_B$, $f_{B_s}$ and Related Quantities","9 pages, 3 included postscript figures, uses aipproc.sty and epsfig.
  Invited talk presented by C. Bernard at ""b20: Twenty Beautiful Years of
  Bottom Physics,"" Illinois Institute of Technology, June 29-July 2, 1997",,"10.1063/1.55130",,"hep-ph hep-lat",,"  The MILC collaboration computation of heavy-light decay constants is
described. Results for $f_B$, $f_{B_s}$, $f_D$, $f_{D_s}$ and their ratios are
presented. These results are still preliminary, but the analysis is close to
being completed. Sources of systematic error, both within the quenched
approximation and from quenching itself, are estimated, although the latter
estimate is rather crude. A sample of our results is: $f_B=153 \pm 10
{}^{+36}_{-13} {}^{+13}_{-0} MeV$, $f_{B_s}/f_B = 1.10 \pm 0.02
{}^{+0.05}_{-0.03} {}^{+0.03}_{-0.02}$, and $f_{B}/f_{D_s} = 0.76 \pm 0.03
{}^{+0.07}_{-0.04} {}^{+0.02}_{-0.01}$, where the errors are statistical,
systematic (within the quenched approximation), and systematic (of quenching),
respectively. The largest source of error comes from the extrapolation to the
continuum. The second largest source is the chiral extrapolation. At present,
the central values are based on linear chiral extrapolations; a shift to
quadratic extrapolations would for example raise $f_B$ by $\approx 20$ MeV and
thereby make the error within the quenched approximation more symmetric.
","[{""version"":""v1"",""created"":""Fri, 12 Sep 1997 14:45:57 GMT""}]","2009-10-30"
"hep-ph/9709329","Carlos Munoz","Carlos Munoz","Charge and Color Breaking in Supersymmetry and Superstrings","Based on talks given at ""Beyond the desert: accelerator and
  non-accelerator approaches"", Castle Ringberg, Tegernsee (Germany), June 1997;
  ""8th Miniworshop on Particle and Astroparticle Physics"", Pusan (South Korea),
  May 1997. Uuencoded LaTex file. 11 pages + macro iopconf1.sty + 1 Postscript
  figure, including the macro psfig.tex",,,"KAIST-TH 97/16, FTUAM 97/20","hep-ph hep-th",,"  Charge and color breaking minima in SUSY theories might make the standard
vacuum unstable. In this talk a brief review of this issue is performed. When a
complete analysis of all the potentially dangerous directions in the field
space of the theory is carried out, imposing that the standard vacuum should be
the global minimum, the corresponding constraints turn out to be very strong
and, in fact, there are extensive regions in the parameter space of soft
SUSY--breaking terms that become forbidden. For instance, in the context of the
MSSM with universal soft terms, this produces important bounds, not only on the
value of A, but also on the values of B, M and m. In specific SUSY scenarios,
as fixed point models, no-scale supergravity, gauge-mediated SUSY breaking and
superstrings, the charge and color breaking constraints are also very
important. For example, if the dilaton is the source of SUSY breaking in
four-dimensional superstrings, the whole parameter space (m_{3/2},B) is
excluded on these grounds. Cosmological analyses are also briefly reviewed.
","[{""version"":""v1"",""created"":""Fri, 12 Sep 1997 14:58:09 GMT""}]","2007-05-23"
"hep-ph/9709330","Stefano Bertolini","S. Bertolini and J. Matias","The $b\to s\gamma\gamma$ transition in softly broken supersymmetry","Latex2e, RevTex, 22 pages, 8 eps figures, comments and references
  added","Phys.Rev. D57 (1998) 4197-4204","10.1103/PhysRevD.57.4197","SISSA 107/97/EP and DFPD 97/TH/39","hep-ph",,"  We study the effect of supersymmetric contributions to the effective quark
transition $b\to s\gamma\gamma$, including leading order QCD effects. We apply
the discussion to the decay $B_s\to\gamma\gamma$. Even though one-particle
irreducible contributions could play a role, numerical cancelations make the
amplitude for the two-photon emission strongly correlated to the $b\to s\gamma$
amplitude which is sharply constrained by experiment. A quite general statement
follows: as long as non-standard physics effects appear only in the matching of
the Wilson coefficients of the standard effective operator basis, the
deviations from the standard model expectations of the decay rates induced by
$b\to s\gamma\gamma$ are bound to follow closely the corresponding deviations
on $b\to s\gamma$. Effects of new physics are therefore bound to be small.
","[{""version"":""v1"",""created"":""Fri, 12 Sep 1997 15:33:03 GMT""},{""version"":""v2"",""created"":""Sat, 13 Sep 1997 08:57:53 GMT""},{""version"":""v3"",""created"":""Tue, 23 Dec 1997 09:39:12 GMT""}]","2009-10-30"
"hep-th/9709082","Gordon Chalmers","Gordon Chalmers","The Implicit Metric on a Deformation of the Atiyah-Hitchin Manifold","15 pages, latex, appendix corr","Phys.Rev. D58 (1998) 125011","10.1103/PhysRevD.58.125011","ITP-SB-97-53","hep-th",,"  Using twistor methods we derive a generating function which leads to the
hyperk\"" ahler metric on a deformation of the Atiyah-Hitchin monopole moduli
space. This deformation was first considered by Dancer through the quotient
construction and is related to a charge two monopole configuration in a
completely broken SU(3) gauge theory. The manifold and metric are the first
members of a family of hyperk\"" ahler manifolds which are deformations of the
$D_k$ rational singularities of $C^2$.
","[{""version"":""v1"",""created"":""Thu, 11 Sep 1997 16:01:27 GMT""},{""version"":""v2"",""created"":""Thu, 4 Dec 1997 04:44:29 GMT""},{""version"":""v3"",""created"":""Sat, 13 Dec 1997 00:34:23 GMT""}]","2009-10-30"
"hep-th/9709085","Carlos Naon","Carlos M. Naon","Field theory approach to one-dimensional electronic systems","25 pages, latex, no figures. Talk delivered at Trends in Theoretical
  Physics - CERN - Santiago de Compostela - La Plata Meeting, La Plata,
  April-May 1997, to be published. Abstract modified",,"10.1063/1.54697",,"hep-th",,"  In this talk I describe a recently introduced field-theoretical approach that
can be used as an alternative framework to study one-dimensional systems of
highly correlated particles.
","[{""version"":""v1"",""created"":""Thu, 11 Sep 1997 16:44:51 GMT""},{""version"":""v2"",""created"":""Mon, 15 Sep 1997 17:22:27 GMT""}]","2009-10-30"
"hep-th/9709087",,"I. Chepelev and A.A. Tseytlin","Long-distance interactions of branes: correspondence between
  supergravity and super Yang-Mills descriptions","43 pages, latex. Few misprints corrected, to appear in Nuclear
  Physics","Nucl.Phys.B515:73-113,1998","10.1016/S0550-3213(97)00725-6","ITEP-TH-40/97, ITP-SB-97-54, Imperial/TP/96-97/60","hep-th",,"  We address the issue of correspondence between classical supergravity and
quantum super Yang-Mills (or Matrix theory) expressions for the long-distance,
low-velocity interaction potentials between 0-branes and various bound states
of branes. The leading-order potentials are known to be reproduced by the F^4
terms in the 1-loop SYM effective action. Using self-consistency
considerations, we determine a universal combination of F^6 terms in the 2-loop
SYM effective action that corresponds to the subleading terms in the
supergravity potentials in many cases, including 0-brane scattering off 1/8
supersymmetric 410 and 4440 bound states representing extremal D=5 and D=4
extremal black holes. We give explicit descriptions of the these configurations
in terms of 1/4 supersymmetric SYM backgrounds on dual tori. Under a proper
choice of the gauge field backgrounds, the 2-loop F^6 SYM action reproduces the
full expression for the subleading term in the supergravity potentials,
including its subtle v^2 part.
","[{""version"":""v1"",""created"":""Thu, 11 Sep 1997 21:59:12 GMT""},{""version"":""v2"",""created"":""Tue, 16 Sep 1997 22:19:11 GMT""},{""version"":""v3"",""created"":""Mon, 13 Oct 1997 20:57:48 GMT""},{""version"":""v4"",""created"":""Sun, 18 Jan 1998 13:53:45 GMT""}]","2009-09-17"
"hep-th/9709088",,"Norbert Dragon and Sergei M. Kuzenko (Institut fuer Theoretische
  Physik, Universitaet Hannover)","Self-interacting vector-tensor multiplet","8 pages, LaTeX, typos corrected, new references added","Phys.Lett. B420 (1998) 64-68","10.1016/S0370-2693(97)01564-5","ITP-UH-24/97","hep-th",,"  We construct a consistent self-coupling for the vector-tensor multiplet in N
= 2 harmonic central charge superspace.
","[{""version"":""v1"",""created"":""Fri, 12 Sep 1997 12:32:34 GMT""},{""version"":""v2"",""created"":""Thu, 9 Oct 1997 16:05:56 GMT""}]","2009-10-30"
"hep-th/9709094","Eugenio Mello","A. C. V. V. de Siqueira, I. A. Pedrosa and E. R. Bezerra de Mello","Schr\""odinger Wave Function for a Free Falling Particle in the
  Schwarzschild Black Hole","13 pages, Latex format, no figures",,,,"hep-th",,"  We use the time-dependent invariant method in a geometric approach (Jacobi
fields) to quantize the motion of a free falling point particle in the
Schwarzschild black hole. Assuming that the particle comes from infinity, we
obtain the relativistic Schr\""{o}dinger wave function for this system.
","[{""version"":""v1"",""created"":""Fri, 12 Sep 1997 15:21:09 GMT""}]","2007-05-23"
"math/9709205","Mirna Dzamonja","Mirna D\v{z}amonja and Saharon Shelah","A note on some versions of club",,,,"Logic E-prints September 12, 1997; Shelah [DjSh:F227]","math.LO",,"  This note gives two results on guessing unbounded subsets of lambda^+. The
first is a positive result and applies to the situation of lambda regular,
while the second is a negative consistency result which applies to the
situation of lambda singular. Both results are connected to an earlier result
of the same authors in which they showed that a certain version of clubsuit
holds at a successor of singular just in ZFC. The first result here shows that
that fact can to a certain extent be extended to the successor of singular. The
negative result here gives limitations to the extent to which one can hope to
extend the afore mentioned fact.
  This note is presently only available as an electronic publication. It can be
obtained as a ps file either from the e-prints archive, or from the authors'
home pages.
","[{""version"":""v1"",""created"":""Fri, 12 Sep 1997 00:00:00 GMT""}]","2009-09-25"
"nucl-ex/9709003","Maurik Holtrop","M. Holtrop, D. Jordan, T. McIlvain, R. Alarcon, R. Beck, W. Bertozzi,
  V. Bhushan, W. Boeglin, J.P. Chen, D. Dale, G. Dodson, S. Dolfini, K. Dow, J.
  Dzengeleski, M.B. Epstein, M. Farkhondeh, S. Gilad, J. Gorgen, K. Joo, J.
  Kelsey, W. Kim, R. Laszewski, R. Lourie, J. Mandeville, D. Margaziotis, D.
  Martinez, R. Miskimen, C. Papanicolas, S. Penn, W. Sapp, A.J. Sarty, D.
  Tieger, C. Tschalaer, W. Turchinetz, G. Warren, L. Weinstein, S. Williamson","A Measurement of the Interference Structure Function, R_LT, for the
  12C(e,e'p) reaction in the Quasielastic Region","8 Pages LaTex, 5 postscript figures. Submitted to Phys. Rev. C","Phys.Rev.C58:3205-3211,1998","10.1103/PhysRevC.58.3205",,"nucl-ex",,"  The coincidence cross-section and the interference structure function, R_LT,
were measured for the 12C(e,e'p) 11B reaction at quasielastic kinematics and
central momentum transfer of q=400 MeV/c. The measurement was at an opening
angle of theta_pq=11 degrees, covering a range in missing energy of E_m = 0 to
65 MeV. The R_LT structure function is found to be consistent with zero for E_m
> 50 MeV, confirming an earlier study which indicated that R_L vanishes in this
region. The integrated strengths of the p- and s-shell are compared with a
Distorted Wave Impulse Approximation calculation. The s-shell strength and
shape are compared with a Hartree Fock-Random Phase Approximation calculation.
The DWIA calculation overestimates the cross sections for p- and s-shell proton
knockout as expected, but surprisingly agrees with the extracted R_LT value for
both shells. The HF-RPA calculation describes the data more consistently, which
may be due to the inclusion of 2-body currents in this calculation.
","[{""version"":""v1"",""created"":""Thu, 11 Sep 1997 23:35:51 GMT""},{""version"":""v2"",""created"":""Wed, 25 Mar 1998 00:25:42 GMT""}]","2008-11-26"
"q-alg/9709016","Oziewicz Kwass Zbigniew","Zbigniew Oziewicz (Wroclaw - Poland and UNAM - Mexico)","Clifford Hopf-gebra and Bi-universal Hopf-gebra","Run LaTeX2e three times, 8 pages. Submitted to Czechoslovak Journal
  of Physics, August 1997","Czechoslovak Journal of Physics Vol. 47 (12) (1997) 1267-1274","10.1023/A:1022833801475",,"q-alg math.QA",,"  We consider a pair of independent scalar products, one scalar product on
vectors, and another independent scalar product on dual space of co-vectors.
The Clifford co-product of multivectors is calculated from the dual Clifford
algebra. With respect to this co-product unit is not group-like and vectors are
not primitive. The Clifford product and the Clifford co-product fits to the
bi-gebra with respect to the family of the (pre)-braids. The Clifford bi-gebra
is in a braided category iff at least one of these scalar products vanish.
","[{""version"":""v1"",""created"":""Thu, 11 Sep 1997 21:36:51 GMT""}]","2010-11-23"
"q-alg/9709018","Reinhard Haering-Oldenburg","Reinhard H""aring-Oldenburg","The Cylinder braiding of the quantum Weyl group of $sl_2$",,,,,"q-alg math.QA",,"  Is is shown that the quantum Weyl group of $sl_2$ contains an element that is
a cylinder twist, i.e. it gives rise to representations of the braid group of
Coxeter type B.
","[{""version"":""v1"",""created"":""Fri, 12 Sep 1997 15:31:32 GMT""}]","2008-02-03"
"quant-ph/9709025","Raymond Laflamme","R. Laflamme, E. Knill, W.H. Zurek, P. Catasti, S.V.S. Mariappan","NMR GHZ","4 pages in RevTex, 3 figures, the paper is also avalaible at
  http://qso.lanl.gov/qc/","Phil.Trans.Roy.Soc.Lond. A356 (1998) 1941-1948","10.1098/rsta.1998.0257",,"quant-ph",,"  We describe the creation of a Greenberger-Horne-Zeilinger (GHZ) state of the
form |000>+|111> (three maximally entangled quantum bits) using Nuclear
Magnetic Resonance (NMR). We have successfully carried out the experiment using
the proton and carbon spins of trichloroethylene, and confirmed the result
using state tomography. We have thus extended the space of entangled quantum
states explored systematically to three quantum bits, an essential step for
quantum computation.
","[{""version"":""v1"",""created"":""Thu, 11 Sep 1997 16:57:46 GMT""}]","2009-10-30"
"quant-ph/9709026","Daniel Rohrlich","Sandu Popescu and Daniel Rohrlich","Causality and Nonlocality as Axioms for Quantum Mechanics","9 pages, RevTeX; for the proceedings of the symposium on Causality
  and Locality in Modern Physics and Astronomy: Open Questions and Possible
  Solutions (York University, Toronto, August 25-29, 1997). This version
  contains an additional affiliation and address for one author",,,"TAUP 2452-97","quant-ph",,"  Quantum mechanics permits nonlocality - both nonlocal correlations and
nonlocal equations of motion - while respecting relativistic causality. Is
quantum mechanics the unique theory that reconciles nonlocality and causality?
We consider two models, going beyond quantum mechanics, of nonlocality:
""superquantum"" correlations, and nonlocal ""jamming"" of correlations. These
models are consistent with some definitions of nonlocality and causality.
","[{""version"":""v1"",""created"":""Thu, 11 Sep 1997 20:34:14 GMT""},{""version"":""v2"",""created"":""Sun, 5 Oct 1997 21:58:17 GMT""}]","2008-02-03"
"quant-ph/9709027","Francisco Javier Delgado Cepeda","Francisco Delgado C. (1 and 2) and Bogdan Mielnik (1 and 3) ((1)
  Physics Department, Centro de Investigacion y Estudios Avanzados, Mexico, (2)
  Mathematics Department, Instituto Tecnologico y de Estudios Superiores de
  Monterrey-Campus Estado de Mexico, Mexico, (3) Physics Department, Warsaw
  University, Poland)","Are there Floquet Quanta?","10 pages, Latex, 2 gzip-compressed figures in figf.tar.gz","Phys.Lett. A249 (1998) 369-375","10.1016/S0375-9601(98)00777-4","CIEA-FIS/97-06","quant-ph",,"  The Zeldovich hypothesis is revised and the meaning of quasi energy spectra
is discussed. The observation of Floquet resonance for microobjects in quickly
oscillating external fields might bring a new information about the time scale
of hypothetical quantum jumps.
","[{""version"":""v1"",""created"":""Thu, 11 Sep 1997 21:33:57 GMT""}]","2009-10-30"
"quant-ph/9709028","Francisco Javier Delgado Cepeda","Francisco Delgado C. (1 and 2), Bogdan Mielnik (1 and 3) and Marco A.
  Reyes (1 and 4) ((1) Physics Department, Centro de Investigacion y Estudios
  Avanzados, Mexico, (2) Mathematics Department, Instituto Tecnologico y de
  Estudios Superiores de Monterrey-Campus Estado de Mexico, Mexico, (3) Physics
  Department, Warsaw University, Poland, (4) Physics Department, Universidad de
  Guanajuato, Mexico)","Squeezed States and Helmholtz Spectra","10 pages, Latex, 3 gzip-compressed figures in figh.tar.gz",,"10.1016/S0375-9601(97)00882-7","CIEA-FIS/97-07","quant-ph",,"  The 'classical interpretation' of the wave function psi(x) reveals an
interesting operational aspect of the Helmholtz spectra. It is shown that the
traditional Sturm-Liouville problem contains the simplest key to predict the
squeezing effect for charged particle states.
","[{""version"":""v1"",""created"":""Fri, 12 Sep 1997 02:55:01 GMT""}]","2009-10-30"
