"alg-geom/9709016","James A. Carlson","Daniel Allcock, James A. Carlson, Domingo Toledo","A Complex Hyperbolic Structure for Moduli of Cubic Surfaces","Six pages, plain tex, available at http://www.math.utah.edu/~allcock",,"10.1016/S0764-4442(97)82711-5",,"alg-geom math.AG",,"  We show that the moduli space M of marked cubic surfaces is biholomorphic to
the quotient by a discrete group generated by complex reflections of the
complex four-ball minus the reflection hyperplanes of the group. Thus M carries
a complex hyperbolic structure: an (incomplete) metric of constant holomorphic
sectional curvature.
","[{""version"":""v1"",""created"":""Fri, 12 Sep 1997 21:10:31 GMT""}]","2009-10-30"
"astro-ph/9709120","Alan Watson","Alan M. Watson and Margaret M. Hanson","Near Infrared Spectroscopy of G29.96-0.02: The First Spectral
  Classification of the Ionizing Star of an Ultracompact HII Region","To appear in ApJ Letters. 7 pages and 4 figures","Astrophys.J. 490 (1997) 165","10.1086/311034",,"astro-ph",,"  We have obtained the first classification spectrum and present the first
direct spectral classification of the ionizing star of an ultracompact HII
region. The ultracompact HII region is G29.96-0.02, a well-studied object with
roughly twice solar metallicity. The near infrared K-band spectrum of the
ionizing star exhibits CIV and NIII emission and HeII absorption, but lines of
HI and HeI are obliterated by nebular emission. We determine that the star has
a spectral type of O5 to O7 or possibly O8. We critically evaluate limits on
the properties of the star and find that it is compatible with zero-age
main-sequence properties only if it is binary and if a significant fraction of
the bolometric luminosity can escape from the region. G29.96-0.02 will now be
an excellent test case for nebular models, as the properties of the ionizing
star are independently constrained.
","[{""version"":""v1"",""created"":""Fri, 12 Sep 1997 18:13:23 GMT""}]","2009-10-30"
"astro-ph/9709121","Stephane Leon du Demirm","S. Leon, F. Combes and T.K. Menon","Molecular gas in galaxies of Hickson compact groups","20 pages, including 17 figures. A&A latex, accepted for publication
  in A&A main journal. Also available via
  ftp://ftp.obspm.fr/transit/sleon/paper/hickson_gas.ps.gz",,,,"astro-ph",,"  We have observed 70 galaxies belonging to 45 Hickson compact groups in the
CO(1-0) and CO(2-1) lines, in order to determine their molecular content. We
detected 57 galaxies, corresponding to a detection rate of 81%. We compare the
gas content relative to blue and FIR luminosities of galaxies in compact groups
with respect to other samples in the literature, including various environments
and morphological types. We find that there is some hint of enhanced M(H2)/Lb
and M(dust)/Lb ratios in the galaxies from compact group with respect to our
control sample, especially for the most compact groups, suggesting that tidal
interactions can drive the gas component inwards, by removing its angular
momentum, and concentrating it in the dense central regions, where it is easily
detected. The molecular gas content in compact group galaxies is similar to
that in pairs and starburst samples. However, the total L(FIR) luminosity of
HCGs is quite similar to that of the control sample, and therefore the star
formation efficiency appears lower than in the control galaxies. However this
assumes that the FIR spatial distributions are similar in both samples which is
not the case at radio frequencies. Higher spatial resolution FIR data are
needed to make a valid comparison. Given their short dynamical friction
time-scale, it is possible that some of these systems are in the final stage
before merging, leading to ultra-luminous starburst phases. We also find for
all galaxy samples that the \htwo content (derived from CO luminosity and
normalised to blue luminosity) is strongly correlated to the L(FIR)luminosity,
while the total gas content H2+HI is not.
","[{""version"":""v1"",""created"":""Fri, 12 Sep 1997 17:22:57 GMT""}]","2007-05-23"
"astro-ph/9709122","Barbara J. Anthony-Twarog","Bruce A. Twarog (1), Keith M. Ashman (1) and Barbara J. Anthony-Twarog
  (1) ((1) University of Kansas)","Some Revised Observational Constraints on the Formation and Evolution of
  the Galactic Disk","41 pages, 9 figure files, LaTex. Appendix section and tables (tex or
  postscript) available at http://kubarb.phsx.ukans.edu/ ~twarog/ Submitted to
  Astronomical Journal July 1997",,"10.1086/118667",,"astro-ph",,"  A set of 76 open clusters with abundances based upon DDO photometry and/or
moderate dispersion spectroscopy has been transformed to a common [Fe/H] scale
and used to study the local structure and evolution of the galactic disk. The
metallicity distribution of clusters with R_GC is best described by two
distinct zones. Between R_GC = 6.5 and 10 kpc, the distribution has a mean
[Fe/H] = 0.0 and a dispersion of 0.1 dex; there is only weak evidence for a
shallow abundance gradient over this distance range. Beyond R_GC = 10 kpc, the
metallicity distribution has a dispersion between 0.10 and 0.15 dex, but with a
mean [Fe/H] = -0.3, implying a sharp discontinuity at R_GC = 10 kpc. After
correcting for the discontinuity, no evidence is found for a gradient
perpendicular to the plane. Adopting the clusters interior to 10 kpc as a
representative sample of the galactic disk over the last 7 Gyr, the cluster
metallicity range is found to be about half that of the field stars. When
coupled with the discontinuity in the galactocentric gradient, the discrepancy
in the metallicity distribution is interpreted as an indication of significant
diffusion of field stars into the solar neighborhood from beyond 10 kpc. These
results imply that the sun is NOT atypical of the stars formed in the solar
circle 4.6 Gyr ago. It is suggested that the discontinuity reflects the edge of
the initial galactic disk as defined by the disk globular cluster system and
the so-called thick disk; the initial offset in [Fe/H] created by the
differences in the chemical history on either side of the discontinuity has
carried through to the current stage of galactic evolution. If correct,
diffusion coupled with the absence of an abundance gradient could make the
separation of field stars on the basis of galactocentric origin difficult.
","[{""version"":""v1"",""created"":""Fri, 12 Sep 1997 18:23:37 GMT""}]","2009-10-30"
"astro-ph/9709123","Patrick Nolan","J. M. Fierro, P. F. Michelson, P. L. Nolan, D. J. Thompson","Phase-Resolved Studies of the High-Energy Gamma-Ray Emission from the
  Crab, Geminga, and Vela Pulsars","20 pages, 11 figures, 7 tables. Accepted for publication in the
  Astrophysical Journal","Astrophys.J.494:734-746,1998","10.1086/305219",,"astro-ph",,"  Using the first three and a half years of observations from the Energetic
Gamma Ray Telescope (EGRET) on board the Compton Gamma Ray Observatory (CGRO),
phase-resolved analyses are performed on the emission from the three brightest
high-energy gamma-ray pulsars, Crab, Geminga, and Vela. For each pulsar, it is
found that there is detectable high-energy gamma-ray emission above the
galactic diffuse background throughout much of the pulsar rotation cycle. A
hardness ratio is introduced to characterize the evolution of the spectral
index as a function of pulsar phase. While the hardest emission from the Crab
and Vela pulsars comes from the bridge region between the two gamma-ray peaks,
the hardest emission from Geminga corresponds to the second gamma-ray peak. For
all three pulsars, phase-resolved spectra of the pulse profile components
reveal that although there is a large variation in the spectral index over the
pulsar phase interval, the high-energy spectral turnover, if any, occurs at
roughly the same energy in each component. The high-energy gamma-ray emission
from the Crab complex appears to include an unpulsed ultra-soft component of
spectral index ~ -4.3 which dominates the total emission below 100 MeV. This
component is consistent with the expected emission from the tail end of the
Crab nebula synchrotron emission.
","[{""version"":""v1"",""created"":""Fri, 12 Sep 1997 18:50:16 GMT""}]","2008-11-26"
"astro-ph/9709124","Rob Ivison","Rob Ivison, James Dunlop, David Hughes, Elese Archibald (IfA,
  Edinburgh), Jason Stevens, Wayne Holland, Ian Robson (JAC, Hawaii), Steve
  Eales (Cardiff), Steve Rawlings (Oxford), Arjun Dey (NOAO), Walter Gear (ROE)","Dust, gas and the evolutionary status of the radio galaxy, 8C1435+635,
  at z = 4.25","7 pages, 3 figures, LaTeX, uses emulateapj.sty (included), accepted
  for ApJ",,"10.1086/305208",,"astro-ph",,"  We present the results of new rest-frame far-IR observations of the z = 4.25
radio galaxy, 8C1435+635, which not only confirm that it contains an enormous
quantity of dust (as first inferred from its mm-wave detection by Ivison 1995)
but also allow the first meaningful constraints to be placed on the mass of
this dust and associated gas. The new measurements consist of: (i) clear
detections of sub-mm continuum emission at 450 and 850um obtained with the new
sub-mm bolometer array, SCUBA, on the JCMT, (ii) continuum upper limits at 350,
750 and 175um obtained with SCUBA and the PHT far-IR camera aboard ISO, and
(iii) a sensitive upper limit on the CO(4-3) line flux obtained with the IRAM
30-m MRT. The resulting rest-frame 33- to 238-um continuum coverage allows us
to deduce that 2E8 Msun of dust at a temperature of 40 +/- 5 K is responsible
for the observed mm/sub-mm emission. Using our CO upper limit, which constrains
M(H2)/M(dust) to <950, we go on to calculate robust limits on the total gas
reserves (H2 + HI) which are thereby constrained to between 4E10 and 1.2E12
Msun. The sub-mm properties of 8C1435+635 are thus strikingly similar to those
of the z = 3.80 radio galaxy, 4C41.17, the only other high-redshift galaxy
detected to date at sub-mm wavelengths whose properties appear not to be
exaggerated by gravitational lensing (Dunlop et al. 1994; Hughes, Dunlop &
Rawlings 1997). The inferred gas masses of both objects are sufficiently large
to suggest that the formative starbursts of massive elliptical galaxies are
still in progress at around z = 4. Observations of complete samples of radio
galaxies spanning a range of redshifts and radio luminosities will be required
to determine if the spectacular far-IR properties of 8C1435+635 and 4C41.17 are
primarily due to their extreme redshifts or their extreme radio luminosities.
","[{""version"":""v1"",""created"":""Fri, 12 Sep 1997 21:52:13 GMT""}]","2009-10-30"
"astro-ph/9709125","Henry Kandrup","Henry E. Kandrup (University of Florida)","Invariant distributions and collisionless equilibria","14 pages, LaTeX, no macros",,"10.1046/j.1365-8711.1998.01865.x",,"astro-ph",,"  This paper discusses the possibility of constructing time-independent
solutions to the collisionless Boltzmann equation which depend on quantities
other than global isolating integrals such as energy and angular momentum. The
key point is that, at least in principle, a self-consistent equilibrium can be
constructed from any set of time-independent phase space building blocks which,
when combined, generate the mass distribution associated with an assumed
time-independent potential. This approach provides a way to justify
Schwarzschild's (1979) method for the numerical construction of self-consistent
equilibria with arbitrary time-independent potentials, generalising thereby an
approach developed by Vandervoort (1984) for integrable potentials. As a simple
illustration, Schwarzschild's method is reformulated to allow for a
straightforward computation of equilibria which depend only on one or two
global integrals and no other quantities, as is reasonable, e.g., for modeling
axisymmetric configurations characterised by a nonintegrable potential.
","[{""version"":""v1"",""created"":""Sat, 13 Sep 1997 15:28:53 GMT""}]","2009-10-30"
"chao-dyn/9709017","Raul Oscar Vallejos","R. O. Vallejos, A. M. Ozorio de Almeida, and C. H. Lewenkopf","Quantum time-delay in chaotic scattering: a semiclassical approach","13 latex pages, 3 ps figures. Submitted to Journal of Physics A",,"10.1088/0305-4470/31/21/007",,"chao-dyn nlin.CD",,"  We study the universal fluctuations of the Wigner-Smith time delay for
systems which exhibit chaotic dynamics in their classical limit. We present a
new derivation of the semiclassical relation of the quantum time delay to
properties of the set of trapped periodic orbits in the repeller. As an
application, we calculate the energy correlator in the crossover regime between
preserved and fully broken time reversal symmetry. We discuss the range of
validity of our results and compare them with the predictions of random matrix
theories.
","[{""version"":""v1"",""created"":""Fri, 12 Sep 1997 16:01:06 GMT""}]","2009-10-30"
"cmp-lg/9709002","Eric Siegel","Eric V. Siegel","Learning Methods for Combining Linguistic Indicators to Classify Verbs","7 pages, Latex, in the Proceedings of the Second Conference on
  Empirical Methods in Natural Language Processing, Providence, Rhode Island,
  1997",,,,"cmp-lg cs.CL",,"  Fourteen linguistically-motivated numerical indicators are evaluated for
their ability to categorize verbs as either states or events. The values for
each indicator are computed automatically across a corpus of text. To improve
classification performance, machine learning techniques are employed to combine
multiple indicators. Three machine learning methods are compared for this task:
decision tree induction, a genetic algorithm, and log-linear regression.
","[{""version"":""v1"",""created"":""Fri, 12 Sep 1997 22:21:04 GMT""},{""version"":""v2"",""created"":""Sat, 13 Sep 1997 17:29:57 GMT""}]","2008-02-03"
"comp-gas/9709001","Emanuel Katz","E. Katz, U.-J. Wiese","Lattice Fluid Dynamics from Perfect Discretizations of Continuum Flows","25 pages, tex., using epsfig, minor changes, refernces added",,"10.1103/PhysRevE.58.5796",,"comp-gas hep-lat nlin.CG",,"  We use renormalization group methods to derive equations of motion for large
scale variables in fluid dynamics. The large scale variables are averages of
the underlying continuum variables over cubic volumes, and naturally live on a
lattice. The resulting lattice dynamics represents a perfect discretization of
continuum physics, i.e. grid artifacts are completely eliminated. Perfect
equations of motion are derived for static, slow flows of incompressible,
viscous fluids. For Hagen-Poiseuille flow in a channel with square cross
section the equations reduce to a perfect discretization of the Poisson
equation for the velocity field with Dirichlet boundary conditions. The perfect
large scale Poisson equation is used in a numerical simulation, and is shown to
represent the continuum flow exactly. For non-square cross sections we use a
numerical iterative procedure to derive flow equations that are approximately
perfect.
","[{""version"":""v1"",""created"":""Fri, 12 Sep 1997 19:36:06 GMT""},{""version"":""v2"",""created"":""Wed, 22 Jul 1998 18:30:33 GMT""}]","2009-10-30"
"cond-mat/9709148","Seong-Gon Kim","Seong-Gon Kim, I.I. Mazin, and D.J. Singh","First Principles Study of Zn-Sb Thermoelectrics","5 pages, 6 figures",,"10.1103/PhysRevB.57.6199",,"cond-mat.mtrl-sci",,"  We report first principles LDA calculations of the electronic structure and
thermoelectric properties of $\beta $-Zn$_{4}$Sb$_{3}$. The material is found
to be a low carrier density metal with a complex Fermi surface topology and
non-trivial dependence of Hall concentration on band filling. The band
structure is rather covalent, consistent with experimental observations of good
carrier mobility. Calculations of the variation with band filling are used to
extract the doping level (band filling) from the experimental Hall number. At
this band filling, which actually corresponds to 0.1 electrons per 22 atom unit
cell, the calculated thermopower and its temperature dependence are in good
agreement with experiment. The high Seebeck coefficient in a metallic material
is remarkable, and arises in part from the strong energy dependence of the
Fermiology near the experimental band filling. Improved thermoelectric
performance is predicted for lower doping levels which corresponds to higher Zn
concentrations.
","[{""version"":""v1"",""created"":""Fri, 12 Sep 1997 17:17:20 GMT""},{""version"":""v2"",""created"":""Mon, 22 Sep 1997 20:48:28 GMT""}]","2009-10-30"
"cond-mat/9709149",,"Hsuan-Yi Chen and David Jasnow","Surface dynamics of a freely standing smectic-A film","11 pages; 3 ps figures; latex, revtex",,"10.1103/PhysRevE.57.5639","PITT-DMJ973","cond-mat.soft",,"  A theoretical analysis of surface fluctuations of a freely standing
thermotropic smectic-A liquid crystal film is provided, including the effects
of viscous hydrodynamics. We find two surface dynamic modes (undulation and
peristaltic). For long wavelengths and small frequencies in a thin film, the
undulation mode is the dominant mode. Permeation enters the theory only through
the boundary conditions. The resulting power spectrum is compared with existing
experiments. It is also shown that feasible light scattering experiments on a
freely standing smectic-A film can reveal viscosity and elastic coefficients
through the structure of the power spectrum of both the undulation and
peristaltic modes.
","[{""version"":""v1"",""created"":""Fri, 12 Sep 1997 18:58:58 GMT""}]","2009-10-30"
"cond-mat/9709150","Igor A. Zaliznyak","I. A. Zaliznyak (1,2,3) D. C. Dender (1,2), C. Broholm (1,2), and
  Daniel H. Reich (1) ((1) Department of Physics and Astronomy, The Johns
  Hopkins University, Baltimore (2) National Institute of Standards and
  Technology, Gaithersburg, Maryland (3) P. Kapitza Institute for Physical
  Problems, ul. Kosygina 2, Moscow)","Tuning the spin Hamiltonian of NENP by external pressure: a neutron
  scattering study","LaTeX file nenp_p.tex, 10 pages, 1 table, 5 figures. Submitted to
  Phys. Rev. B",,"10.1103/PhysRevB.57.5200",,"cond-mat",,"  We report an inelastic neutron scattering study of antiferromagnetic spin
dynamics in the Haldane chain compound Ni(C2H8N2)2NO2ClO4 (NENP) under external
hydrostatic pressure P = 2.5 GPa. At ambient pressure, the magnetic excitations
in NENP are dominated by a long-lived triplet mode with a gap which is split by
orthorhombic crystalline anisotropy into a lower doublet centered at
$\Delta_\perp\approx$ 1.2meV and a singlet at $\Delta_\parallel\approx$ 2.5meV.
With pressure we observe appreciable shifts in these levels, which move to
$\Delta_\perp{(2.5GPa)}\approx$ 1.45 meV and $\Delta_\parallel(2.5GPa)\approx$
2.2meV. The dispersion of these modes in the crystalline c-direction
perpendicular to the chain was measured here for the first time, and can be
accounted for by an interchain exchange J'_c approximately 3e-4*J which changes
only slightly with pressure. Since the average gap value $\Delta_H\approx$ 1.64
meV remains almost unchanged with P, we conclude that in NENP the application
of external pressure does not affect the intrachain coupling J appreciably, but
does produce a significant decrease of the single-ion anisotropy constant from
D/J = 0.16(2) at ambient pressure to D/J = 0.09(7) at P = 2.5 GPa.
","[{""version"":""v1"",""created"":""Fri, 12 Sep 1997 23:25:56 GMT""},{""version"":""v2"",""created"":""Mon, 15 Sep 1997 19:30:59 GMT""}]","2016-08-31"
"cond-mat/9709151","Konstantin Kladko","A. M. Dyugaev, Yu. N. Ovchinnikov, P. Fulde and K. Kladko","Nuclear magnetic susceptibility of metals with magnetic impurities","9 pages, 4 figures, REVTEX","EUROPHYSICS LETTERS,43(#3)326,1998","10.1209/epl/i1998-00360-9",,"cond-mat.str-el",,"  We consider the contribution of magnetic impurities to the nuclear magnetic
susceptibility $\chi$ and to the specific heat $C$ of a metal. The impurity
contribution to the magnetic susceptibility has a $1/T^2$ behaviour, and the
impurity contribution to the specific heat has a $1/T$ behaviour, both in an
extended region of temperatures $T$. In the case of a dirty metal the RKKY
interaction of nuclear spins and impurity spins is suppressed for low
temperatures and the main contribution to $C$ and $\chi$ is given by their
dipole-dipole interaction.
","[{""version"":""v1"",""created"":""Fri, 12 Sep 1997 19:52:16 GMT""}]","2009-10-30"
"cond-mat/9709153","Jose Rodriguez","J.P. Rodriguez, P.D. Sacramento, V.R. Vieira","Spin-density Wave in Ising-coupled Antiferromagnetic Chains","11 pgs. of plain TeX, one postscript fig., to appear in Phys. Rev. B",,"10.1103/PhysRevB.56.13685",,"cond-mat",,"  The effect of anisotropy in the nearest-neighbor spin interactions that
couple $N\geq 2$ consecutive spin-1/2 antiferromagnetic chains is studied
theoretically by considering the limit where the coupling is purely of the
Ising type. An analysis based on the equivalent Luttinger model reveals that
the groundstate is an Ising antiferromagnet in general.
","[{""version"":""v1"",""created"":""Sat, 13 Sep 1997 03:00:13 GMT""}]","2009-10-30"
"cond-mat/9709161","David Clarke","David Clarke (Princeton) and Steven Strong (IAS)","Confined Coherence in Strongly Correlated Anisotropic Metals","93 pages, RevTeX. To appear in Advances in Physics, vol 46, number 6,
  (Nov-Dec 1997). Figures unavailable in electronic form",,"10.1080/00018739700101538",,"cond-mat.str-el",,"  We present a detailed discussion of both theoretical and experimental
evidence in favour of the existence of states of ``confined coherence'' in
metals of sufficiently high anisotropy and with sufficiently strong
correlations. The defining property of such a state is that single electron
coherence is confined to lower dimensional subspaces (planes or chains) so that
it is impossible to observe interference effects between histories which
involve electrons moving between these subspaces. The most dramatic
experimental manifestation of such a state is the coexistence of incoherent,
non-metallic transport in one or two directions with coherent transport in at
least one other direction. The magnitude of the Fermi surface warping due to
transverse (inter-subspace) momentum plays the role of an order parameter (in a
state of confined coherence, this order parameter vanishes) and the effect can
occur in a pure system at zero temperature..... ..anomalous transport data in
the (normal state of the) cuprate superconductors and in the low temperature,
metallic state of the highly anisotropic organic conductor (TMTSF)$_2$PF$_6$
cannot be understood within a Fermi liquid framework, and, we argue, the only
plausible way to understand that transport is in terms of a state of confined
coherence.
","[{""version"":""v1"",""created"":""Fri, 12 Sep 1997 19:00:31 GMT""},{""version"":""v2"",""created"":""Fri, 19 Sep 1997 18:00:14 GMT""}]","2009-10-30"
"gr-qc/9709031","Ewa E. Czuchry","Ewa Czuchry and Wojciech Kopczynski","Multipole moments in Kaluza-Klein theories","11 pages, AMS-TeX, few misprints corrected, to appear in Classical
  and Quantum Gravity","Class.Quant.Grav.15:509-518,1998","10.1088/0264-9381/15/3/005",,"gr-qc",,"  This paper contains discussion of the problem of motion of extended i.e. non
point test bodies in multidimensional space. Extended bodies are described in
terms of so called multipole moments. Using approximated form of equations of
motion for extended bodies deviation from geodesic motion is derived. Results
are applied to special form of space-time.
","[{""version"":""v1"",""created"":""Fri, 12 Sep 1997 20:54:59 GMT""},{""version"":""v2"",""created"":""Sun, 14 Dec 1997 00:15:52 GMT""}]","2011-07-19"
"gr-qc/9709032","Eric Poisson","Eric Poisson","Gravitational waves from inspiraling compact binaries: The
  quadrupole-moment term","5 pages, ReVTeX","Phys. Rev. D 57, 5287 (1998)","10.1103/PhysRevD.57.5287",,"gr-qc",,"  A rotating star's oblateness creates a deformation in the gravitational field
outside the star, which is measured by the quadrupole-moment tensor. We
consider the effect of the quadrupole moment on the orbital motion and rate of
inspiral of a compact binary system, composed of neutron stars and/or black
holes. We find that in the case of circular orbits, the quadrupole-monopole
interaction affects the relation between orbital radius and angular velocity,
and also the rate of inspiral, by a quantity of order (v/c)^4, where v is the
orbital velocity and c the speed of light.
","[{""version"":""v1"",""created"":""Fri, 12 Sep 1997 20:33:28 GMT""}]","2016-08-25"
"gr-qc/9709033","Eric Poisson","William G. Laarakkers and Eric Poisson","Quadrupole moments of rotating neutron stars","ReVTeX, 7 pages, 5 figures, additional material, and references added",,"10.1086/306732",,"gr-qc",,"  Numerical models of rotating neutron stars are constructed for four equations
of state using the computer code RNS written by Stergioulas. For five selected
values of the star's gravitational mass (in the interval between 1.0 and 1.8
solar masses) and for each equation of state, the star's angular momentum is
varied from J=0 to the Keplerian limit J=J_{max}. For each neutron-star
configuration we compute Q, the quadrupole moment of the mass distribution. We
show that for given values of M and J, |Q| increases with the stiffness of the
equation of state. For fixed mass and equation of state, the dependence on J is
well reproduced with a simple quadratic fit, Q \simeq - aJ^2/M c^2, where c is
the speed of light, and a is a parameter of order unity depending on the mass
and the equation of state.
","[{""version"":""v1"",""created"":""Fri, 12 Sep 1997 20:33:10 GMT""},{""version"":""v2"",""created"":""Fri, 6 Mar 1998 00:28:00 GMT""}]","2015-06-25"
