"alg-geom/9709018","Lakshmibai","V. Lakshmibai and Peter Magyar","Degeneracy Schemes and Schubert Varieties","16 pp, Northeastern University, Latex",,,,"alg-geom math.AG",,"  A result of Zelevinsky states that an orbit closure in the space of
representations of the equioriented quiver of type $A_h$ is in bijection with
the opposite cell in a Schubert variety of a partial flag variety $SL(n)/Q$. We
prove that Zelevinsky's bijection is a scheme-theoretic isomorphism, which
shows that the universal degeneracy schemes of Fulton are reduced and
Cohen-Macaulay in arbitrary characteristic.
","[{""version"":""v1"",""created"":""Tue, 16 Sep 1997 19:16:12 GMT""}]","2008-02-03"
"alg-geom/9709019","Vladimir Masek","Vladimir Masek (Washington Univ. in St. Louis)","Kawachi's invariant for normal surface singularities","16 pages, AMS-LaTeX 1.2",,,,"alg-geom math.AG",,"  We study a useful numerical invariant of normal surface singularities,
introduced recently by T. Kawachi. Using this invariant, we give a quick proof
of the (well-known) fact that all log-canonical surface singularities are
either elliptic Gorenstein or rational (without assuming a priori that they are
Q-Gorenstein).
  The main result is a criterion (stated in terms of Kawachi's invariant)
regarding global generation of adjoint linear systems on normal surfaces with
boundary. Such results can be used in proving effective estimates for global
generation on singular threefolds. The theorem of Ein-Lazarsfeld and Kawamata,
which says that the minimal center of log-canonical singularities is always
normal, explains why the results proved here are relevant in that situation.
","[{""version"":""v1"",""created"":""Wed, 17 Sep 1997 15:51:59 GMT""}]","2008-02-03"
"astro-ph/9709154","Sandra Savaglio","S. Savaglio (ESO)","Heavy element enrichment in the IGM at high redshift","4 pages, 3 ps figures. To appear in the Proceedings of the 13th IAP
  Colloquium on ""Structure and Evolution of the IGM from QSO Absorption Lines"",
  ed. P. Petitjean, S. Charlot, Paris July 1-5",,,,"astro-ph",,"  We present a detailed analysis of the ionisation state and heavy element
abundances in the Intergalactic Medium (IGM). The CIV doublet is shown by 30 %
of the 182 selected optically thin \lya clouds in 10 QSO lines of sight. Direct
metallicity calculations have been performed on individual systems with
detected CIV and SiIV (10% of the sample) varying the UV photoionising source,
cloud density and size and silicon relative abundance. The best solutions for
carbon content in this subsample (redshift coverage $z=2.6 - 3.8$) span between
1/6 and 1/300 of the solar value with no evidence of redshift evolution in both
the metallicity and the ionising source. Global properties of the whole sample
indicate that the metallicity in \lya clouds with CIV and SiIV is not typical
of the IGM. The redshift evolution of the UVB is one of the possible sources of
the observed SiIV/CIV trend presented by Cowie and collaborators during this
meeting. Future detection of heavy elements in lower HI column density ($\log
N_{HI} < 14.5$) \lya clouds relies on the presence of OVI and NV at $z=1-2.5$.
","[{""version"":""v1"",""created"":""Tue, 16 Sep 1997 16:34:49 GMT""}]","2007-05-23"
"astro-ph/9709155","Sandra Savaglio","L. Amendola (OAR) & S. Savaglio (ESO)","The power spectrum of the Lyman--$\alpha$ clouds","2 pages, 1 ps figure. To appear in the Proceedings of the 13th IAP
  Colloquium on ""Structure and Evolution of the IGM from QSO Absorption Lines"",
  ed. P. Petitjean, S. Charlot, Paris July 1-5",,,,"astro-ph",,"  We estimate the 1--D power spectrum and the integral density of neighbors in
14 QSO lines of sight. We discuss their variation with respect to redshift and
column density and compare the results with standard CDM models.
","[{""version"":""v1"",""created"":""Tue, 16 Sep 1997 16:36:23 GMT""}]","2007-05-23"
"astro-ph/9709156","Igor V. Igumenshchev","I. V. Igumenshchev, M. A. Abramowicz, I. D. Novikov","Slim accretion discs: a model for ADAF-SLE transitions","12 pages, 7 figures, MNRAS accepted",,"10.1046/j.1365-8711.1998.01774.x",,"astro-ph",,"  We numerically construct slim, global, vertically integrated models of
optically thin, transonic accretion discs around black holes, assuming a
regularity condition at the sonic radius and boundary conditions at the outer
radius of the disc and near the black hole. In agreement with several previous
studies, we find two branches of shock-free solutions, in which the cooling is
dominated either by advection, or by local radiation. We also confirm that the
part of the accretion flow where advection dominates is in some circumstances
limited in size: it does not extend beyond a certain outer limiting radius. New
results found in our paper concern the location of the limiting radius and
properties of the flow near to it. In particular, we find that beyond the
limiting radius, the advective dominated solutions match on to Shapiro,
Lightman & Eardley (SLE) discs through a smooth transition region. Therefore,
the full global solutions are shock-free and unlimited in size. There is no
need for postulating an extra physical effect (e.g. evaporation) for triggering
the ADAF-SLE transition. It occurs due to standard accretion processes
described by the classic slim disc equations.
","[{""version"":""v1"",""created"":""Tue, 16 Sep 1997 19:06:18 GMT""}]","2009-10-30"
"astro-ph/9709157","Eric Gotthelf","E. V. Gotthelf (NASA/GSFC), S. R. Kulkarni (Caltech)","An Unusual X-ray Burst from the Globular Cluster M28","13 pages with 3 eps figures, LATEX, aastex, psfig. To appear in the
  Astrophysical Journal Letters","ApJ 490, L161 (1997)","10.1086/311038",,"astro-ph",,"  We report the discovery of an unusual X-ray burst from the direction of the
Globular Cluster M28 using data acquired with the ASCA Observatory. The burst
was recorded by all four ASCA telescopes and displays a fast (~ 70 ms) rise
followed by an exponential decay (t = 7.5 s) and a steady afterglow which lasts
between 800 - 3250 s. The image of the burst is consistent with an ASCA point
source and is centered on quiescent X-ray emission from the core of M28. The
burst temporal profile is similar to Type-I bursts emitted by accreting neutron
stars of low mass X-ray binaries (LMXB). We argue that the burst arises from an
LMXB that is located in the core of M28. The burst is unique in two ways: it is
intrinsically sub-luminous, ~ 0.02 L_Edd and more importantly, originates from
a source whose quiescent luminosity is fainter than that of the known cluster
bursters by three orders of magnitude. We suggest that this burst is from a
highly magnetized neutron star accreting at a low rate. These accreting systems
may account for the mysterious low luminosity X-ray sources in globular
clusters.
","[{""version"":""v1"",""created"":""Tue, 16 Sep 1997 19:52:51 GMT""}]","2015-06-24"
"astro-ph/9709158","Pedro N. Safier","Pedro N. Safier","A Critique of Current Magnetic-Accretion Models for Classical T-Tauri
  Stars","2 figures",,"10.1086/305212",,"astro-ph",,"  Current magnetic-accretion models for classical T-Tauri stars rely on a
strong, dipolar magnetic field of stellar origin to funnel the disk material
onto the star, and assume a steady-state. In this paper, I critically examine
the physical basis of these models in light of the observational evidence and
our knowledge of magnetic fields in low-mass stars, and find it lacking.
  I also argue that magnetic accretion onto these stars is inherently a
time-dependent problem, and that a steady-state is not warranted.
  Finally, directions for future work towards fully-consistent models are
pointed out.
","[{""version"":""v1"",""created"":""Tue, 16 Sep 1997 21:34:10 GMT""}]","2009-10-30"
"astro-ph/9709159","Bhuvnesh Jain","R. Moessner (MPA) and Bhuvnesh Jain (MPA, JHU)","Angular Cross-Correlation of Galaxies: A Probe of Gravitational Lensing
  by Large-Scale Structure","7 pages, 4 figures included, revised with additions to formalism and
  discussion, matches published version","MNRAS, 294, L18 (1998)","10.1111/j.1365-8711.1998.01378.x",,"astro-ph",,"  The angular cross-correlation between two galaxy samples separated in
redshift is shown to be a useful measure of weak lensing by large-scale
structure. Angular correlations in faint galaxies arise due to spatial
clustering of the galaxies as well as gravitational lensing by dark matter
along the line-of-sight. The lensing contribution to the 2-point
auto-correlation function is typically small compared to the gravitational
clustering. However the cross-correlation between two galaxy samples is nearly
unaffected by gravitational clustering provided their redshift distributions do
not overlap. The cross-correlation is then induced by magnification bias due to
lensing by large-scale structure. We compute the expected amplitude of the
cross-correlation for popular theoretical models of structure formation. For
two populations with mean redshifts of $\simeq 0.3$ and 1, we find a
cross-correlation signal of $\simeq 1%$ on arcminute scales and $\simeq 3%$ on
a few arcseconds. The dependence on the cosmological parameters $\Omega$ and
$\Lambda$, on the dark matter power spectrum and on the bias factor of the
foreground galaxy population is explored.
","[{""version"":""v1"",""created"":""Tue, 16 Sep 1997 22:49:20 GMT""},{""version"":""v2"",""created"":""Thu, 27 Aug 1998 18:42:29 GMT""}]","2020-11-25"
"astro-ph/9709160","Palle M{\o}ller","Palle Moller, Stephen J. Warren, Johan U. Fynbo","On the nature of z(abs) ~ z(em) damped absorbers in quasar spectra","Accepted for publication in A&A, 6 pages, 3 figures","Astron.Astrophys.330:19-24,1998",,,"astro-ph",,"  We present spectroscopic observations of the damped Ly-alpha absorber at
redshift z=1.9342 seen in the spectrum of the quasar Q0151+048A. The redshift
of the absorber is greater than the redshift of the quasar, so the system
resembles the z(abs) ~ z(em) damped absorber at z=2.81 towards the quasar
PKS0528-250. We have previously reported the detection of Ly-alpha emission
from the latter absorber, one of only two damped absorbers for which Ly-alpha
emission has unambiguously been detected. The resemblance between the
PKS0528-250 and Q0151+048A systems is made closer by the detection of a weak
emission feature in the trough of the Q0151+048A absorber. This leads us to
consider whether these z(abs) ~ z(em) DLA absorbers are different objects to
the intervening DLA absorbers. Two possibilities are examined and rejected.
Firstly the Q0151+048A and PKS0528-250 z(abs) ~ z(em) absorbers appear to be
unrelated to the intrinsic absorbers (i.e. gas close to the quasar nucleus,
ejected by the quasar), as intrinsic absorbers are of higher metallicity, have
higher ionisation parameter, and show complex absorption profiles. Secondly
these two DLA absorbers cannot be equated with the gaseous disks of the quasar
host galaxies, as the absorber redshifts differ significantly from the quasar
systemic redshifts. It is likely, then, that intrinsically the z(abs) ~ z(em)
DLA absorbers are the same as the intervening DLA absorbers, so that
peculiarities in some of the z(abs) ~ z(em) absorbers can be ascribed to their
different environment i.e. proximity to the quasar, or membership of the same
cluster as the quasar. We point out that the proximity effect may play some
role, by reducing the Ly-alpha forest line blanketing of any Ly-alpha emission
line from z(abs) ~ z(em) absorbers.
","[{""version"":""v1"",""created"":""Tue, 16 Sep 1997 23:32:07 GMT""}]","2011-05-23"
"astro-ph/9709161","Oleg Y. Gnedin","Oleg Y. Gnedin (Princeton), Lars Hernquist (UC Santa Cruz), Jeremiah
  P. Ostriker (Princeton)","Tidal Shocking by Extended Mass Distributions","22 pages; ApJ 514 (in press)","Astrophys.J. 514 (1999) 109-118","10.1086/344636","POP-728","astro-ph",,"  We derive expressions for the tidal field exerted by a spherically symmetric
galaxy having an extended mass distribution, and use our analysis to calculate
tidal perturbations and heating of stars in a globular cluster or a satellite
galaxy orbiting in the external potential. We consider a Hernquist model and
several power-law models for the primary. We integrate the tidal force over
accurate orbits in the given potential by using the impulse approximation and
by introducing adiabatic corrections that allow for the time variation of the
force. We compare these results with the conventional straight path
approximation. We also check the results with direct N-body simulations and
find very good agreement. Heating on highly eccentric orbits dominates as the
adiabatic corrections strongly damp the energy change on low eccentricity
orbits. The results are illustrated for the example of globular cluster NGC
6712. For the orbital eccentricities higher than 0.9 the future lifetime of NGC
6712 is less than 10^{10} yr. Our analysis can be used to study tidal
interactions of star clusters and galaxies in a semi-analytical manner.
","[{""version"":""v1"",""created"":""Wed, 17 Sep 1997 03:31:17 GMT""},{""version"":""v2"",""created"":""Tue, 23 Feb 1999 13:39:41 GMT""}]","2009-10-30"
"astro-ph/9709162","Valentina Klochkova","V. G. Klochkova, E. L. Chentsov, V. E. Panchuk","Optical spectrum of the IR-source IRC+10420 in 1992-1996","14 pages, Latex, 4 ps figures, uses supertab.sty. Accepted for
  publication in the MNRAS",,"10.1093/mnras/292.1.19",,"astro-ph",,"  To understand the evolutionary stage of the peculiar supergiant IRC+10420, we
have been taking spectra for several years at the 6m telescope. The optical
spectrum of IRC+10420 of the years from 1992 through 1996 points to the
increase in the temperature: spectral class A5 instead of the former F8, as was
pointed out by Humpreys et al., (1973). Now it resembles the spectra of
late-type B[e] stars. The spectrum contains absorptions (mainly of ions) formed
in the photosphere, apparently stationary with respect to the star center of
mass, and emissions too, which can be formed in the fossil expanding envelope
as well as partly in its compressing region. Using our spectra and spectral
data obtained by Oudmaijer (1995) we estimated the atmospheric parameters
Teff=8500 K, logg=1.0, Vt=12km/s and concluded that metallicity of IRC+10420 is
solar: the average value [(V,Cr,Fe)/H]=-0.03. Combination of results allows us
to consider IRC+10420 as a massive supergiant evolving to the WR-stage.
","[{""version"":""v1"",""created"":""Wed, 17 Sep 1997 05:10:41 GMT""}]","2015-06-24"
"astro-ph/9709163","Cedric Lacey","Cedric Lacey (TAC Copenhagen), Carlton Baugh (Durham), Shaun Cole
  (Durham) and Carlos Frenk (Durham)","Modelling Galaxy Formation at high z","6 pages, LaTeX, 3 postscript figures, uses conf_iap.sty. To appear in
  Proceedings of 13th IAP Colloquium: Structure and Evolution of the IGM from
  QSO Absorption Line Systems, eds. P. Petitjean, S. Charlot. Also available at
  http://www.tac.dk/~lacey/papers/iap97.ps.gz",,,,"astro-ph",,"  I describe a semi-analytical model for the formation and evolution of
galaxies in hierarchical clustering models, and its predictions for the
properties of the galaxy population at high z. The predictions are found to
agree well with the observed properties of the Lyman break galaxies found at z
sim 3 by Steidel et al. The models predict that the star formation rate per
comoving volume should have peaked at z sim 1-2, which also agrees well with
recent observational data.
","[{""version"":""v1"",""created"":""Wed, 17 Sep 1997 14:54:34 GMT""}]","2007-05-23"
"astro-ph/9709164","Gareth Leyshon","G. Leyshon (University of Wales, Cardiff)","On the reduction and presentation of data in astronomical two-channel
  photopolarimetry","19 pages, 2 figures (both small). Uses modified Kluwer style files
  (included). Accepted for publication in Experimental Astronomy. PostScript
  version also available at ftp://ftp.astro.cf.ac.uk/pub/gjl/PolDataRedn.ps","Exper.Astron. 8 (1998) 153-175",,,"astro-ph",,"  Many different methods exist for reducing data obtained when an astronomical
source is studied with a two-channel polarimeter, such as a Wollaston prism
system. This paper presents a rigorous method of reducing the data from raw
aperture photometry, and evaluates errors both by a statistical treatment, and
by propagating the measured sky noise from each frame. The reduction process
performs a hypothesis test for the presence of linear polarization. The
probability of there being a non-zero polarization is obtained, and the best
method of obtaining the normalized Stokes Parameters is discussed. Point and
interval estimates are obtained for the degree of linear polarization, which is
subject to positive bias; and the polarization axis is found.
","[{""version"":""v1"",""created"":""Wed, 17 Sep 1997 11:06:50 GMT""}]","2007-05-23"
"astro-ph/9709165","D. Worrall","D.M. Worrall (Department of Physics, University of Bristol &
  Harvard-Smithsonian Center for Astrophysics)","X-ray Emission from Jets in Centrally Obscured AGN","TeX, 6 pages, 8 PostScript figures included, using macros lecproc.cmm
  and epsf.sty, included. To appear in the Proceedings of the Conference
  ``Relativistic Jets in AGNs'', Cracow, May 1997",,,,"astro-ph",,"  There is good evidence for X-ray emission associated with AGN jets which are
relativistically boosted towards the observer. But to what jet radius does such
X-ray emission persist? To attempt to answer this question one can look at
radio galaxies; their cores are sufficiently X-ray faint that any unbeamed
X-ray emission in the vicinity of the central engine must be obscured. The jets
of such sources are at unfavourable angles for relativistic boosting, and so
their relatively weak X-ray emission must be carefully separated from the
plateau of resolved X-ray emission from a hot interstellar, intragroup, or
intracluster medium on which they are expected to sit. This paper presents
results arguing that jet X-ray emission is generally detected in radio
galaxies, even those of low intrinsic power without hot spots. The levels of
emission suggest an extrapolated radio to soft X-ray spectral index, alpha_rx,
of about 0.85 at parsec to perhaps kiloparsec distances from the cores.
","[{""version"":""v1"",""created"":""Wed, 17 Sep 1997 11:42:08 GMT""}]","2007-05-23"
"astro-ph/9709166","Ken Lanzetta","Kenneth M. Lanzetta (State University of New York at Stony Brook),
  Alberto Fernandez-Soto (State University of New York at Stony Brook), and
  Amos Yahil (State University of New York at Stony Brook)","Photometric Redshifts of Galaxies in the Hubble Deep Field","21 pages, LaTex, 9 figures, to be published in The Hubble Deep Field,
  proceedings of the Space Telescope Science Institute 1997 May Symposium, ed.
  M. Livio, S. M. Fall, and P. Madau",,,,"astro-ph",,"  We describe our application of broad-band photometric redshift techniques to
faint galaxies in the Hubble Deep Field. To magnitudes AB(8140) < 26, the
accuracy of the photometric redshifts is a few tenths and the reliability of
the photometric redshifts approaches 100%. At fainter magnitudes the effects of
photometric error on the photometric redshifts can be rigorously quantified and
accounted for. We argue that broad-band photometric redshift techniques can be
applied to accurately and reliably estimate redshifts of galaxies that are up
to many magnitudes fainter than the spectroscopic limit.
","[{""version"":""v1"",""created"":""Wed, 17 Sep 1997 14:14:51 GMT""}]","2007-05-23"
"astro-ph/9709167","Xavier Hernandez Doring","X. Hernandez and Gerard Gilmore","Inferring dark halo structure from observed scaling laws of late type
  galaxies and LSB's","13 pages, 18 figures, MNRAS accepted","MNRAS 294, 595","10.1111/j.1365-8711.1998.01158.x",,"astro-ph",,"  We re-examine the Fall & Efstathiou (1980) scenario for galaxy formation,
including the dark halo gravitational reaction to the formation of the baryon
disk, as well as continuous variations in the intrinsic halo density profile.
The recently published rotation curves of LSB and dwarf galaxies together with
previously known scaling relations provide sufficient information on the
present day structure of late type disk galaxies to invert the problem. By
requiring that the models reproduce all the observational restrictions we can
fully constrain the initial conditions of galaxy formation, with a minimum of
assumptions, in particular without the need to specify a CDM halo profile. This
allows one to solve for all the initial conditions, in terms of the halo
density profile, the baryon fraction and the total angular momentum. We find
that a unique initial halo shape is sufficient to accurately reproduce the
rotation curves of both LSB and normal late type spiral galaxies. This unique
halo profile differs substantially from that found in standard CDM models
(Navarro, Frenk & White 1996). A galactic baryon fraction of 0.065 is found.
The initial value of the dimensionless angular momentum is seen to be the
principal discriminator between the galaxy classes we examine. The present day
scalings between structural parameters are seen to originate in the initial
conditions.
","[{""version"":""v1"",""created"":""Wed, 17 Sep 1997 14:49:38 GMT""}]","2020-11-25"
"astro-ph/9709168","Ken Lanzetta","Kenneth M. Lanzetta (State University of New York at Stony Brook),
  John K. Webb (University of New South Wales), and Xavier Barcons (Universidad
  de Cantabria)","The Galaxy-Absorber Cross-Correlation Function","6 pages, LaTex, 3 figures, to be published in proceedings of the 13th
  IAP Meeting, ed. P. Petitjean and S. Charlot",,,,"astro-ph",,"  We describe an analysis of the galaxy-absorber cross-correlation function as
a function of velocity separation, impact parameter separation, and absorber
Lyman alpha equivalent width on impact parameter scales that extend up to 1
Mpc.
","[{""version"":""v1"",""created"":""Wed, 17 Sep 1997 15:18:54 GMT""}]","2007-05-23"
"chao-dyn/9709020","Enrico Segre","Enrico Segre and Shigeo Kida","Late states of incompressible 2D decaying vorticity fields","requires elsart.sty, chicago.sty, chicago.bst Figures submitted as
  low resolution gif; avaliable upon request as postscript. to appear in Fluid
  Dynamics Research",,"10.1016/S0169-5983(97)00050-6",,"chao-dyn nlin.CD",,"  Two-dimensional decaying turbulent flow is known to approach apparently
stable states after a long time evolution. A few theories and models have been
so far proposed to account for this relaxation. In this paper, we compare
results of numerical experiments with the predictions of these theories to
assess their applicability. We study the long time decay of initially
multilevel vorticity fields on the periodic box, and characterize the outcoming
final states. Our final states do not match the predictions of the theories; a
broader variety of dipole profiles, as well as nonstationary final states are
found. The problem of the robustness of the relaxational state with respect to
variations of the Reynolds number and different numerical resolution is
addressed. The observed configurations also do not necessarily possess the
maximal energy, in contrast to what is anticipated by some of the theories. We
are led to conclude that the mixing of the vorticity is generally not ergodic,
and that some metastable configurations may inhibit the attainment of an
equilibrium state.
","[{""version"":""v1"",""created"":""Wed, 17 Sep 1997 12:24:58 GMT""}]","2015-06-24"
"cmp-lg/9709005","Antoni Tuells","Toni Tuells (Universitat Pompeu Fabra)","A generation algorithm for f-structure representations","6 pages","In the Proceedings of RANLP'97 (pages 270-275), Tzigov Chark,
  Bulgaria, 1997",,,"cmp-lg cs.CL",,"  This paper shows that previously reported generation algorithms run into
problems when dealing with f-structure representations. A generation algorithm
that is suitable for this type of representations is presented: the Semantic
Kernel Generation (SKG) algorithm. The SKG method has the same processing
strategy as the Semantic Head Driven generation (SHDG) algorithm and relies on
the assumption that it is possible to compute the Semantic Kernel (SK) and non
Semantic Kernel (Non-SK) information for each input structure.
","[{""version"":""v1"",""created"":""Wed, 17 Sep 1997 08:10:55 GMT""}]","2008-02-03"
"cmp-lg/9709006","Manuela Boros","Manuela Boros (FORWISS, Erlangen), Maria Aretoulaki, Florian Gallwitz,
  Elmar Noeth, Heinrich Niemann (Chair for Pattern Recognition, University of
  Erlangen)","Semantic Processing of Out-Of-Vocabulary Words in a Spoken Dialogue
  System","4 pages, 2 eps figures, requires LaTeX2e, uses eurospeech.sty and
  epsfig","Proceedings of EUROSPEECH'97, Vol.4, pp.1887-1890, Rhodes, Greece",,,"cmp-lg cs.CL",,"  One of the most important causes of failure in spoken dialogue systems is
usually neglected: the problem of words that are not covered by the system's
vocabulary (out-of-vocabulary or OOV words). In this paper a methodology is
described for the detection, classification and processing of OOV words in an
automatic train timetable information system. The various extensions that had
to be effected on the different modules of the system are reported, resulting
in the design of appropriate dialogue strategies, as are encouraging evaluation
results on the new versions of the word recogniser and the linguistic
processor.
","[{""version"":""v1"",""created"":""Wed, 17 Sep 1997 11:58:24 GMT""}]","2008-02-03"
