"cmp-lg/9709007",,"Manuel de Buenaga Rodriguez, Jose Maria Gomez Hidalgo, Belen Diaz
  Agudo","Using WordNet to Complement Training Information in Text Categorization","16 pages, 1 figure, 3 tables, previously with RANLP latext style","Second International Conference on Recent Advances in Natural
  Language Processing, 1997",,,"cmp-lg cs.CL",,"  Automatic Text Categorization (TC) is a complex and useful task for many
natural language applications, and is usually performed through the use of a
set of manually classified documents, a training collection. We suggest the
utilization of additional resources like lexical databases to increase the
amount of information that TC systems make use of, and thus, to improve their
performance. Our approach integrates WordNet information with two training
approaches through the Vector Space Model. The training approaches we test are
the Rocchio (relevance feedback) and the Widrow-Hoff (machine learning)
algorithms. Results obtained from evaluation show that the integration of
WordNet clearly outperforms training approaches, and that an integrated
technique can effectively address the classification of low frequency
categories.
","[{""version"":""v1"",""created"":""Wed, 17 Sep 1997 15:34:10 GMT""}]","2008-02-03"
"cond-mat/9709168","Philip Phillips","Philip Phillips, Yi Wan, Ivar Martin, Sergey Knysh, and Denis
  Dalidovich (University of Illinois at Urbana-Champaign)","Superconductivity in a two-dimensional Electron Gas","5 pages, 2 ps figures","Nature vol. 395, p. 253, 1998","10.1038/26179",,"cond-mat.str-el cond-mat.dis-nn cond-mat.supr-con",,"  In a series of recent experiments, Kravchenko and colleagues observed
unexpectedly that a two-dimensional electron gas in zero magnetic field can be
a conductor. The two-dimensionality was imposed by confining the electron gas
to move laterally at the interface between two semiconductors. The observation
of a conductor in two dimensions (2D) is surprising as the conventional theory
of metals precludes the presence of a metallic state at zero temperature in 2D.
Nonetheless, there are now several experiments confirming the existence of the
new conducting phase in a dilute two-dimensional electron gas in zero magnetic
field. Here we argue based on an analysis of the experiments and general
theoretical grounds that this phase is a zero-temperature superconductor with
an inhomogeneous charge density.
","[{""version"":""v1"",""created"":""Tue, 16 Sep 1997 18:01:22 GMT""},{""version"":""v2"",""created"":""Wed, 11 Feb 1998 21:17:25 GMT""},{""version"":""v3"",""created"":""Mon, 21 Sep 1998 18:51:16 GMT""}]","2009-10-30"
"cond-mat/9709182","Simone Fratini","P. Quemerais and S. Fratini","Polaron Dissociation at the Insulator-to-Metal Transition","5 pages, 3 figures, to be published Mod. Phys. Lett. B; added 1
  figure, references and minor changes",,"10.1142/S0217984997001559",,"cond-mat",,"  Considering the long range Coulomb interactions between large polarons in
dielectrics, we propose a model for their crystallization when no bipolarons
are formed. As the density increases, the melting is examined at $T=OK$. One
possibility is the delocalization towards a liquid state of polarons. However,
we show that this cannot happen if the electron-phonon coupling is larger than
some critical value. The other competing mechanism is the dissociation of the
polarons themselves, favored owing to their large mass at strong coupling.
Finally, we propose a phase diagram for the insulator-to metal transition as a
function of the density and electron-phonon coupling.
","[{""version"":""v1"",""created"":""Tue, 16 Sep 1997 17:20:02 GMT""},{""version"":""v2"",""created"":""Fri, 12 Dec 1997 10:08:44 GMT""}]","2009-10-30"
"cond-mat/9709183","Bruce M. Boghosian","Peter V. Coveney (Schlumberger Cambridge Research), Andrew N. Emerton
  (Oxford), Bruce M. Boghosian (Boston University)","Simulation of Self-Reproducing Micelles using a Lattice-Gas Automaton","10 pages, LaTeX with epsf and REVTeX, EPS illustrations included","J. Amer. Chem. Soc. 118 (1996) 10719-10724",,"OU-THP-9613S, BU-CCS-960301","cond-mat.soft comp-gas nlin.CG",,"  We simulate self-reproducing micellar systems using a recently introduced
lattice-gas automaton. This dynamical model correctly describes the equilibrium
and non-equilibrium properties of mixtures of oil, water and surfactants. The
simulations reported here mimic the experiments of Luisi et al. in which
caprylate micelles are formed by alkaline hydrolysis of immiscible ethyl
caprylate ester. As in the laboratory experiments, we find an extended
induction period during which the concentration of micelles remains small;
thereafter the ester is consumed very rapidly with concomitant production of
micelles.
","[{""version"":""v1"",""created"":""Tue, 16 Sep 1997 17:23:01 GMT""}]","2008-02-03"
"cond-mat/9709184","Dan Shahar","Y. Hanein, U. Meirav, D. Shahar, C.C. Li, D.C. Tsui and Hadas
  Shtrikman","The Metallic-Like Conductivity of a Two-Dimensional Hole System","Latex, 3 pages, 4 ps figures",,"10.1103/PhysRevLett.80.1288",,"cond-mat.mes-hall",,"  We report on a zero magnetic field transport study of a two-dimensional,
variable-density, hole system in GaAs. As the density is varied we observe, for
the first time in GaAs-based materials, a crossover from an insulating behavior
at low-density, to a metallic-like behavior at high-density, where the metallic
behavior is characterized by a large drop in the resistivity as the temperature
is lowered. These results are in agreement with recent experiments on Si-based
two-dimensional systems by Kravchenko et al. and others. We show that, in the
metallic region, the resistivity is dominated by an exponential
temperature-dependence with a characteristic temperature which is proportional
to the hole density, and appear to reach a constant value at lower
temperatures.
","[{""version"":""v1"",""created"":""Tue, 16 Sep 1997 17:18:15 GMT""},{""version"":""v2"",""created"":""Wed, 17 Sep 1997 17:13:26 GMT""},{""version"":""v3"",""created"":""Thu, 18 Sep 1997 07:18:52 GMT""}]","2016-08-31"
"cond-mat/9709185","Walter R. L. Lambrecht","Sergey N. Rashkeev, Walter R. L. Lambrecht and Benjamin Segall","Efficient ab-initio method for the calculation of frequency dependent
  non-linear optical response in semiconductors: application to second harmonic
  generation","Latex 17 pages (REVTEX style) 8 postscript figures",,,,"cond-mat.mtrl-sci",,"  A LMTO implementation of Aversa and Sipe's length-gauge formalism for
calculating the full frequency dependent second-harmonic generation in the
independent particle approximation is presented. It is applied to GaAs, GaP,
3C-SiC, c-BN and wurtzite and zincblende GaN and AlN. The use of the scissor's
operator for correcting LDA errors is discussed and compared to an alternative
approach in which the Hamiltonian is corrected. The latter is found to be
superior. Decomposition in omega and 2 omega resonances and in intra- and
inter-band contributions and in specific band-to-band contributions are
presented.
","[{""version"":""v1"",""created"":""Tue, 16 Sep 1997 22:36:49 GMT""}]","2008-02-03"
"cond-mat/9709186","Dennis Clougherty","Dennis P. Clougherty and Frederick G. Anderson","Theory of Spontaneous Polarization of Endohedral Fullerenes","4 pages, REVTEX, 1 Postscript figure. [Phys. Rev. Lett. (in press)]","Phys. Rev. Lett. 80 (1998) 3735","10.1103/PhysRevLett.80.3735",,"cond-mat",,"  A pseudo-Jahn-Teller model describing central atom distortions is proposed
for endohedral fullerenes of the form A@C$_{60}$ where A is either a rare gas
or a metal atom. A critical (dimensionless) coupling $g_c$ is found, below
which the symmetric configuration is stable and above which inversion symmetry
is broken. Vibronic parameters are given for selected endohedral fullerenes.
","[{""version"":""v1"",""created"":""Tue, 16 Sep 1997 22:49:57 GMT""},{""version"":""v2"",""created"":""Tue, 31 Mar 1998 23:07:22 GMT""}]","2009-10-30"
"cond-mat/9709187","Eric Jeckelmann","Chunli Zhang, Eric Jeckelmann and Steven R. White (University of
  California, Irvine)","Density Matrix Approach to Local Hilbert Space Reduction","4 pages, 4 figures","Physical Review Letters 80, 2661 (1998)","10.1103/PhysRevLett.80.2661",,"cond-mat.supr-con cond-mat.str-el",,"  We present a density matrix approach for treating systems with a large or
infinite number of degrees of freedom per site with exact diagonalization or
the density matrix renormalization group. The method is demonstrated on the 1D
Holstein model of electrons coupled to Einstein phonons. In this system, two or
three optimized phonon modes per site give results as accurate as with 10-100
bare phonon levels per site.
","[{""version"":""v1"",""created"":""Tue, 16 Sep 1997 22:21:31 GMT""}]","2009-10-30"
"cond-mat/9709188","Hiroaki Nakamura","Hiroaki Nakamura, Kazuaki Ikeda, and Satarou Yamaguchi","Transport Coefficients of InSb in a Strong Magnetic Field","6 pages, Latex, This article was presented in the XVI International
  Conference on Thermoelectrics, Dresden, Germany (1997)",,,,"cond-mat.mtrl-sci",,"  Improvement of a superconducting magnet system makes induction of a strong
magnetic field easier. This fact gives us a possibility of energy conversion by
the Nernst effect. As the first step to study the Nernst element, we measured
the conductivity, the Hall coefficient, the thermoelectric power and the Nernst
coefficient of the InSb, which is one of candidates of the Nernst elements.
  From this experiment, it is concluded that the Nernst coefficient is smaller
than the theoretical values. On the other hand, the conductivity, the Hall
coefficient ant the thermoelectric power has the values expected by the theory.
","[{""version"":""v1"",""created"":""Wed, 17 Sep 1997 05:40:29 GMT""}]","2008-02-03"
"cond-mat/9709189","Dr. Adolfo Avella","F. Mancini (1), D. Villani (1) and H. Matsumoto (2) ((1)University of
  Salerno, (2) Seikei University)","Thermodynamics of the 2D Hubbard model","28 pages, 27 embedded Postscript figures, RevTeX, submitted to
  Physica B","J. Phys. Studies 4, 474 (1999)",,"MVM97","cond-mat.str-el cond-mat.supr-con",,"  A theoretical analysis of the thermodynamic response functions of the 2D
single-band Hubbard model is realized by means of the composite operator
method. It is shown that all the features of these quantities can be explained
by looking at the dependence of the thermodynamic variables on their conjugate
ones. It is found that the numerical data from quantum Monte Carlo techniques
for the internal energy and electronic specific heat are well reproduced. The
anomalous normal state properties in hole-doped cuprate high Tc superconductors
are also well described. Actually, the results for the linear coefficient of
the electronic specific heat are in agreement with those obtained by using a
pure fermionic theoretical scheme. Finally, we obtain several characteristic
crossing points for the response functions when reported as functions of some
thermodynamic variables. These peculiar features indicate the existence of more
than one energy scale competing with thermal excitations in the 2D Hubbard
model.
","[{""version"":""v1"",""created"":""Wed, 17 Sep 1997 10:02:10 GMT""},{""version"":""v2"",""created"":""Tue, 23 Sep 1997 15:34:22 GMT""},{""version"":""v3"",""created"":""Fri, 31 Jul 1998 17:16:40 GMT""}]","2008-02-03"
"cond-mat/9709190","Michel Gingras","M.J.P. Gingras, M. Larkin, I. Mirebeau, W.D. Wu, K. Kojima, G.M. Luke,
  B. Nachumi, and Y.J. Uemura","Muon Spin Relaxation Study of Reentrant Spin Glasses:
  Amorphous-Fe_{1-x}Mn_x","Letter, 3 POSTSCRIPT figures included. Submitted to Physical Review
  Letters. Contact: gingras@astro.uwaterloo.ca",,,,"cond-mat.dis-nn cond-mat.stat-mech",,"  We have performed an extensive muon spin relaxation study of the well known
(Fe$_{1-x}$Mn$_{x}$)$_{75}$P$_{16}$B$_6$Al$_3$ reentrant spin glass. We find a
strong increase of the dynamic as well as static muon depolarization rate at
the paramagnetic to ferromagnetic transition temperature, $T_c$, and at $T_f$
($T_f<T_c$) that corresponds to the onset of strong bulk magnetic
irreversabilities. We find no critical dynamic signature of a freezing of the
transverse $XY$ spin components at an intermediate temperature $T_{xy}$ ($T_f <
T_{xy} < T_c$) where extra static order not contributing to the magnetization
starts developping.
","[{""version"":""v1"",""created"":""Wed, 17 Sep 1997 12:39:32 GMT""}]","2009-09-25"
"cond-mat/9709191","Walter R. L. Lambrecht","Sukit Limpijumnong and Walter R. L. Lambrecht","Total energy differences between SiC polytypes revisited","8 pages, 3 figures, Latex, uses epsfig and revtex",,"10.1103/PhysRevB.57.12017",,"cond-mat.mtrl-sci",,"  The total energy differences between various SiC polytypes (3C, 6H, 4H, 2H,
15R and 9R) were calculated using the full-potential linear muffin-tin orbital
method using the Perdew-Wang-(91) generalized gradient approximation to the
exchange-correlation functional in the density functional method. Numerical
convergence versus k-point sampling and basis set completeness are demonstrated
to be better than 1 meV/atom. The parameters of several generalized anisotropic
next-nearest-neighbor Ising models are extracted and their significance and
consequences for epitaxial growth are discussed.
","[{""version"":""v1"",""created"":""Wed, 17 Sep 1997 13:33:24 GMT""}]","2009-10-30"
"cond-mat/9709192","Stefano Zapperi","Alessandro Vespignani and Stefano Zapperi","How self-organized criticality works: A unified mean-field picture","21 RevTex pages, 3 figures, submitted to Phys. Rev. E",,"10.1103/PhysRevE.57.6345",,"cond-mat.stat-mech",,"  We present a unified mean-field theory, based on the single site
approximation to the master-equation, for stochastic self-organized critical
models. In particular, we analyze in detail the properties of sandpile and
forest-fire (FF) models. In analogy with other non-equilibrium critical
phenomena, we identify the order parameter with the density of ``active'' sites
and the control parameters with the driving rates. Depending on the values of
the control parameters, the system is shown to reach a subcritical (absorbing)
or super-critical (active) stationary state. Criticality is analyzed in terms
of the singularities of the zero-field susceptibility. In the limit of
vanishing control parameters, the stationary state displays scaling
characteristic of self-organized criticality (SOC). We show that this limit
corresponds to the breakdown of space-time locality in the dynamical rules of
the models. We define a complete set of critical exponents, describing the
scaling of order parameter, response functions, susceptibility and correlation
length in the subcritical and supercritical states. In the subcritical state,
the response of the system to small perturbations takes place in avalanches. We
analyze their scaling behavior in relation with branching processes. In
sandpile models because of conservation laws, a critical exponents subset
displays mean-field values ($\nu=1/2$ and $\gamma = 1$) in any dimensions. We
treat bulk and boundary dissipation and introduce a new critical exponent
relating dissipation and finite size effects. We present numerical simulations
that confirm our results. In the case of the forest-fire model, our approach
can distinguish between different regimes (SOC-FF and deterministic FF) studied
in the literature and determine the full spectrum of critical exponents.
","[{""version"":""v1"",""created"":""Wed, 17 Sep 1997 14:19:58 GMT""}]","2009-10-30"
"cond-mat/9709193","Garnett Bryant","W. Jaskolski and Garnett W. Bryant (NIST)","Multiband theory of quantum-dot quantum wells: Dark excitons, bright
  excitons, and charge separation in heteronanostructures","10 pages of ReVTex, 6 ps figures, submitted to Phys. Rev. B",,"10.1103/PhysRevB.57.R4237",,"cond-mat.mes-hall",,"  Electron, hole, and exciton states of multishell CdS/HgS/CdS quantum-dot
quantum well nanocrystals are determined by use of a multiband theory that
includes valence-band mixing, modeled with a 6-band Luttinger-Kohn Hamiltonian,
and nonparabolicity of the conduction band. The multiband theory correctly
describes the recently observed dark-exciton ground state and the lowest,
optically active, bright-exciton states. Charge separation in pair states is
identified. Previous single-band theories could not describe these states or
account for charge separation.
","[{""version"":""v1"",""created"":""Wed, 17 Sep 1997 14:41:04 GMT""}]","2009-10-30"
"cond-mat/9709195","Robert B. Laughlin","R. B. Laughlin (Stanford University)","A Critique of Two Metals","9 pages of RevTeX, 4 eps figures",,,,"cond-mat.supr-con",,"  I argue that the conflict between the fermi-liquid and non-fermi-liquid
metallic states viewed by Anderson as the central intellectual issue of cuprate
superconductivity, and which motivates the recent criticism by Baskaran and
Anderson [cond-mat/9706076] of the work of Zhang [cond-mat/9610140], is a
fundamentally wrong concept. All experimental evidence points to adiabatic
continuability of the strange metal into a conventional one, and thus to one
metallic phase rather than two, and all attempts to account theoretically for
the existence of a luttinger-liquid at zero temperature in spatial dimension
greater than 1 have failed. I discuss the underlying reasons for this failure
and then argue that the true higher-dimensional generalization of the
luttinger-liquid behavior is a propensity of the system to order. I speculate
about how the conflict between antiferromagnetism and superconductivity, the
two principal kinds of order in this problem, might result in both the observed
zero-temperature phase diagram of the cuprates and the luttinger-liquid
phenomenology, i.e. the breakup of the electron into spinons and holons in
certain regimes of doping and energy. The key idea is a quantum critical point
regulating a first-order transition between these phases and toward which one
is first attracted under renormalization before bifurcating between the two
phases.
","[{""version"":""v1"",""created"":""Wed, 17 Sep 1997 15:47:08 GMT""},{""version"":""v2"",""created"":""Sun, 8 Feb 1998 20:43:21 GMT""}]","2008-02-03"
"gr-qc/9709043","G. Kunstatter","G. Kunstatter, R. Petryk and S. Shelemy (U. of Winnipeg)","Hamiltonian Thermodynamics of Black Holes in Generic 2-D Dilaton Gravity","25 pages Revtex including 7 (eps) figures","Phys.Rev.D57:3537-3547,1998","10.1103/PhysRevD.57.3537",,"gr-qc hep-th",,"  We consider the Hamiltonian mechanics and thermodynamics of an eternal black
hole in a box of fixed radius and temperature in generic 2-D dilaton gravity.
Imposing boundary conditions analoguous to those used by Louko and Whiting for
spherically symmetric gravity, we find that the reduced Hamiltonian generically
takes the form: $$ H(M,\phi_+) = \sigma_0 E(M,\phi_+) -{N_0\over 2\pi} S(M) $$
where $E(M,\phi_+)$ is the quasilocal energy of a black hole of mass $M$ inside
a static box (surface of fixed dilaton field $\phi_+$) and $S(M)$ is the
associated classical thermodynamical entropy. $\sigma_0$ and $N_0$ determine
time evolution along the world line of the box and boosts at the bifurcation
point, respectively. An ansatz for the quantum partition function is obtained
by fixing $\sigma_0$ and $N_0$ and then tracing the operator $e^{-\beta H}$
over mass eigenstates. We analyze this partition function in some detail both
generically and for the class of dilaton gravity theories that is obtained by
dimensional reduction of Einstein gravity in n+2 dimensions with $S^n$
spherical symmetry.
","[{""version"":""v1"",""created"":""Tue, 16 Sep 1997 21:01:17 GMT""}]","2014-11-17"
"hep-ex/9709017","John Dainton","C. Adloff, et al. (H1 Collaboration)","Low Q^2 Jet Production at HERA and Virtual Photon Structure","20 pages, 5 Figures","Phys.Lett.B415:418-434,1997","10.1016/S0370-2693(97)01264-1","DESY 97-179","hep-ex",,"  The transition between photoproduction and deep-inelastic scattering is
investigated in jet production at the HERA ep collider, using data collected by
the H1 experiment. Measurements of the differential inclusive jet
cross-sections dsigep/dEt* and dsigmep/deta*, where Et* and eta* are the
transverse energy and the pseudorapidity of the jets in the virtual
photon-proton centre of mass frame, are presented for 0 < Q2 < 49 GeV2 and 0.3
< y < 0.6. The interpretation of the results in terms of the structure of the
virtual photon is discussed. The data are best described by QCD calculations
which include a partonic structure of the virtual photon that evolves with Q2.
","[{""version"":""v1"",""created"":""Tue, 16 Sep 1997 16:20:21 GMT""}]","2008-11-26"
"hep-lat/9709052","Thomas A. DeGrand","T. DeGrand","Scaling Tests of Some Lattice Fermion Actions","3 pages, LaTeX, 2 figures, uses espcrc2.sty, Talk given at LATTICE97","Nucl.Phys.Proc.Suppl. 63 (1998) 913-915","10.1016/S0920-5632(97)00939-0","COLO-HEP-387","hep-lat",,"  I describe studies of quenched spectroscopy, using crude approximations to
fixed point actions for fermions interacting with SU(3) gauge fields. These
actions have a hypercubic kinetic term and a complicated lattice anomalous
magnetic moment term. They show improved scaling compared to the conventional
Wilson action.
","[{""version"":""v1"",""created"":""Tue, 16 Sep 1997 16:35:28 GMT""}]","2009-10-30"
"hep-lat/9709053","Guy Moore","Guy D. Moore","O(a) errors in 3-D SU(N) Higgs theories","23 pages with two figures. Added references, a few typos corrected","Nucl.Phys. B523 (1998) 569-593","10.1016/S0550-3213(98)00158-8","MCGILL-97/23","hep-lat hep-ph",,"  We compute the matching conditions between lattice and continuum 3-D SU(N)
Higgs theories, with both adjoint and fundamental scalars, at O(a), except for
additive corrections to masses and Higgs field operator insertions.
","[{""version"":""v1"",""created"":""Tue, 16 Sep 1997 18:14:04 GMT""},{""version"":""v2"",""created"":""Tue, 3 Feb 1998 20:26:03 GMT""}]","2009-10-30"
"hep-lat/9709054","Juergen Cox","J. Cox, W. Franzki, J. Jersak, C. B. Lang, T. Neuhaus, A. Seyfried and
  P. W. Stephenson","Scaling of gauge balls and static potential in the confinement phase of
  the pure U(1) lattice gauge theory","Contribution to the Lattice 97 proceedings, LaTeX, 3 pages, 3 figures","Nucl.Phys.Proc.Suppl. 63 (1998) 691-693","10.1016/S0920-5632(97)00874-8","HLRZ1997_40","hep-lat",,"  We investigate the scaling behaviour of gauge-ball masses and static
potential in the pure U(1) lattice gauge theory on toroidal lattices. An
extended gauge field action $-\sum_P(\beta \cos\Theta_P + \gamma
\cos2\Theta_P)$ is used with $\gamma= -0.2$ and -0.5. Gauge-ball correlation
functions with all possible lattice quantum numbers are calculated. Most
gauge-ball masses scale with the non-Gaussian exponent $\nu_{ng}\approx 0.36$.
The $A_1^{++}$ gauge-ball mass scales with the Gaussian value $\nu_{g} \approx
0.5$ in the investigated range of correlation lengths. The static potential is
examined with Sommer's method. The long range part scales consistently with
$\nu_{ng}$ but the short range part tends to yield smaller values of $\nu$. The
$\beta$-function, having a UV stable zero, is obtained from the running
coupling. These results hold for both $\gamma$ values, supporting universality.
Consequences for the continuum limit of the theory are discussed.
","[{""version"":""v1"",""created"":""Tue, 16 Sep 1997 23:04:56 GMT""}]","2009-10-30"
"hep-lat/9709055","Yoichi Iwasaki","Y. Iwasaki","The CP-PACS Project","9 pages, 8 figures, Talk at International Workshop on Lattice QCD on
  Parallel Computers, 10-15 March, 1997, Tsukuba, to appear in Nucl. Phys.
  B(Proc. Suppl.)","Nucl.Phys.Proc.Suppl. 60A (1998) 246-254","10.1016/S0920-5632(97)00487-8","UTHEP-370, UTCCP-P-25","hep-lat",,"  The CP-PACS project is a five year plan, which formally started in April 1992
and has been completed in March 1997, to develop a massively parallel computer
for carrying out research in computational physics with primary emphasis on
lattice QCD. The initial version of the CP-PACS computer with a theoretical
peak speed of 307 GFLOPS with 1024 processors was completed in March 1996. The
final version with a peak speed of 614 GFLOPS with 2048 processors was
completed in September 1996, and has been in full operation since October 1996.
We describe the architecture, the final specification, the hardware
implementation, and the software of the CP-PACS computer. The CP-PACS has been
used for hadron spectroscopy production runs since July 1996. The performance
for lattice QCD applications and the LINPACK benchmark are given.
","[{""version"":""v1"",""created"":""Wed, 17 Sep 1997 02:10:40 GMT""}]","2009-10-30"
"hep-lat/9709056","Desmond Johnston","P. Bialas, Z. Burda and D. A. Johnston","Balls in Boxes and Quantum Gravity","3 pages, LaTeX, 2 figures, uses espcrc2.sty, talk given at LATTICE97","Nucl.Phys.Proc.Suppl. 63 (1998) 763-765","10.1016/S0920-5632(97)00897-9","HWM97-30","hep-lat gr-qc",,"  Four dimensional simplicial gravity has been studied by means of Monte Carlo
simulations for some time, the main outcome of the studies being that the model
undergoes a discontinuous phase transition between an elongated and a crumpled
phase when one changes the curvature (Newton) coupling. In the crumpled phase
there are singular vertices growing extensively with the volume of the system
whereas the elongated phase resembles a branched-polymer.
  We have postulated that this behaviour is a manifestation of the
constrained-mean-field scenario as realised in the Branched Polymer or
Balls-in-Boxes model. These models share all the features of 4D simplicial
gravity except that they exhibit a continuous phase transition. We note here
that this defect can be remedied by a suitable choice of ensemble.
","[{""version"":""v1"",""created"":""Wed, 17 Sep 1997 09:40:36 GMT""}]","2009-10-30"
