"astro-ph/9709273","Peter Meszaros","P. Meszaros (1), M.J. Rees (2) & R.A.M.J. Wijers (2) ((1) Pennsylvania
  State University; (2) Inst. of Astronomy, Cambridge University)","Viewing Angle and Environment Effects in GRB: Sources of Afterglow
  Diversity","Revised version, original subm to Ap.J. 9/26/97, latex file (uses
  aaspp4), 17 pages. The qualitative behavior remains the same, Eqs. 8, 14, 15
  have corrected exponents, Tables 1 and 2 are partially rewritten, discussion
  partially updated","Astrophys.J. 499 (1998) 301","10.1086/305635",,"astro-ph",,"  We discuss the afterglows from the evolution of both spherical and
anisotropic fireballs decelerating in an inhomogeneous external medium. We
consider both the radiative and adiabatic evolution regimes, and analyze the
physical conditions under which these regimes can be used. Afterglows may be
expected to differ widely among themselves, depending on the angular anisotropy
of the fireball and the properties of the environment. They may be entirely
absent, or may be detected without a corresponding $\gamma$-ray event. A
tabulation of different representative light curves is presented, covering a
wide range of behaviors that resemble what is currently observed in GRB 970228,
GRB 970508 and other objects.
","[{""version"":""v1"",""created"":""Fri, 26 Sep 1997 15:39:18 GMT""},{""version"":""v2"",""created"":""Fri, 5 Dec 1997 17:20:00 GMT""}]","2009-10-30"
"chao-dyn/9709028","Michael Chertkov","M. Chertkov and V. Yakhot (Princeton)","Propagation of a Huygens front through turbulent medium","4 pages, RevTeX 3.0, Submitted to Phys.Rev.Lett",,"10.1103/PhysRevLett.80.2837",,"chao-dyn cond-mat nlin.CD",,"  The dynamics of a thin Huygens front propagating through turbulent medium is
considered. A rigorous asymptotic expression for the effective velocity $v_{F}$
proportional to the front area is derived. The small-scale fluctuations of the
front position are shown to be strongly intermittent. This intermittency plays
a crucial role in establishing a steady state magnitude of the front velocity.
The results are compared with experimental data.
","[{""version"":""v1"",""created"":""Thu, 25 Sep 1997 20:16:25 GMT""}]","2009-10-30"
"cmp-lg/9709015","Yaari Yaakov","Yaakov Yaari (Bar Ilan University)","Segmentation of Expository Texts by Hierarchical Agglomerative
  Clustering","7 pages, Latex2e, 4 postscript figures","RANLP'97, Bulgaria",,,"cmp-lg cs.CL",,"  We propose a method for segmentation of expository texts based on
hierarchical agglomerative clustering. The method uses paragraphs as the basic
segments for identifying hierarchical discourse structure in the text, applying
lexical similarity between them as the proximity test. Linear segmentation can
be induced from the identified structure through application of two simple
rules. However the hierarchy can be used also for intelligent exploration of
the text. The proposed segmentation algorithm is evaluated against an accepted
linear segmentation method and shows comparable results.
","[{""version"":""v1"",""created"":""Fri, 26 Sep 1997 11:08:06 GMT""}]","2016-08-31"
"cond-mat/9709279",,"Matteo Campellone, Giorgio Parisi and Paola Ranieri","Dynamical fluctuations in an exactly solvable model of spin glasses","Latex, 8 pages",,"10.1088/0305-4470/31/8/003",,"cond-mat",,"  In this work we calculate the dynamical fluctuations at O(1/N) in the low
temperature phase of the $p=2$ spherical spin glass model. We study the
large-times asymptotic regimes and we find, in a short time-differences regime,
a fluctuation dissipation relation for the four-point correlation functions.
This relation can be extended to the out of equilibrium regimes introducing a
function $X_{t}$ which, for large time $t$, we find scales as $t^{-1/2}$ as in
the case of the two-point functions.
","[{""version"":""v1"",""created"":""Thu, 25 Sep 1997 23:44:55 GMT""}]","2009-10-30"
"cond-mat/9709282","Michael Zhitomirsky","M. E. Zhitomirsky and M. B. Walker","Thermal conductivity across a twin boundary in d-wave superconductor","7 pages, ReVTEX, 2 PS-figures","Phys. Rev. B 57, 8560 (1998)","10.1103/PhysRevB.57.8560",,"cond-mat.supr-con",,"  We consider excitation spectrum near a twin boundary in an orthorhombic $d+s$
superconductor. The low-energy spectrum is highly sensitive to the presence of
the small amount of s-wave component. Robustness of the bound states at the
Fermi level with respect to impurities and an extra boundary potential is
investigated. The role of Andreev transmission process for the low-temperature
thermal conductivity across twin boundaries is studied for an impure
superconductors. At very low temperatures the bulk part and the twin boundaries
part of the thermal conductivity have similar linear-$T$ dependences, whereas
at intermediate temperatures the two contributions behave like $T^3$ and $T^2$,
respectively.
","[{""version"":""v1"",""created"":""Thu, 25 Sep 1997 16:11:28 GMT""}]","2009-10-30"
"cond-mat/9709283",,"A. M. Sengupta, P. P. Mitra","Distributions of Singular Values for Some Random Matrices","8 pages, Latex, uses psfig",,,,"cond-mat.stat-mech physics.data-an",,"  The Singular Value Decomposition is a matrix decomposition technique widely
used in the analysis of multivariate data, such as complex space-time images
obtained in both physical and biological systems. In this paper, we examine the
distribution of Singular Values of low rank matrices corrupted by additive
noise. Past studies have been limited to uniform uncorrelated noise. Using
diagrammatic and saddle point integration techniques, we extend these results
to heterogeneous and correlated noise sources. We also provide perturbative
estimates of error bars on the reconstructed low rank matrix obtained by
truncating a Singular Value Decomposition.
","[{""version"":""v1"",""created"":""Thu, 25 Sep 1997 16:36:25 GMT""}]","2009-09-25"
"cond-mat/9709284","Arnold J. Dahm","N. A. Rubin and A. J. Dahm","Comment on ""Observations of 2D Polarons and Magneto-Polarons on
  Superfluid Helium Films""","1 page, 2 figures, TeX",,,,"cond-mat.str-el",,"  A recent experimental Physical Review Letter which claims to prove the
existence of the single-electron ripplonic polaron associated with electrons on
a helium film is examined. A correct evaluation of the holding field and a
restriction of the polaron radius to the Wigner-Seitz radius lead to a gross
discrepancy between experiment and theory. The polaron is not bound under the
experimental conditions.
","[{""version"":""v1"",""created"":""Thu, 25 Sep 1997 18:06:17 GMT""}]","2008-02-03"
"cond-mat/9709285","Christian D. Lorenz","P. Kleban (1), R. M. Ziff (2) ((1) Laboratory for Surface Science and
  Technology & Department of Physics and Astronomy, University of Maine, Orono,
  ME, (2) Department of Chemical Engineering, University of Michigan, Ann
  Arbor, MI)","Exact results at the 2-D percolation point","12 pages, 2 figures, LaTeX, submitted to Physical Review Letters",,"10.1103/PhysRevB.57.R8075","UM-97-3","cond-mat.dis-nn hep-lat hep-th",,"  We derive exact expressions for the excess number of clusters b and the
excess cumulants b_n of a related quantity at the 2-D percolation point.
High-accuracy computer simulations are in accord with our predictions. b is a
finite-size correction to the Temperley-Lieb or Baxter-Temperley-Ashley formula
for the number of clusters per site n_c in the infinite system limit; the bn
correct bulk cumulants. b and b_n are universal, and thus depend only on the
system's shape. Higher-order corrections show no apparent dependence on
fractional powers of the system size.
","[{""version"":""v1"",""created"":""Thu, 25 Sep 1997 18:41:15 GMT""}]","2009-10-30"
"cond-mat/9709286","Stephen Teitel","Pramod Gupta, S. Teitel, Michel J. P. Gingras","Glassiness Vs. Order in Densely Frustrated Josephson Arrays","4 pages, 4 eps figures","Phys. Rev. Lett. 80, 105 (1997)","10.1103/PhysRevLett.80.105",,"cond-mat.stat-mech cond-mat.supr-con",,"  We carry out extensive Monte Carlo simulations on the Coulomb gas dual to the
uniformly frustrated two dimensional XY model, for a sequence of frustrations f
converging to the irraltional (3-sqrt 5)/2. We find in these systems a sharp
first order equilibrium phase transition to an ordered vortex structure at a
T_c which varies only slightly with f. This ordered vortex structure remains in
general phase incoherent until a lower pinning transition T_p(f) that varies
with f. We argue that the glassy behaviors reported for this model in earlier
simulations are dynamic effects.
","[{""version"":""v1"",""created"":""Thu, 25 Sep 1997 20:00:39 GMT""}]","2009-10-30"
"cond-mat/9709287","Alexander V. Balatsky","A.V. Balatsky (LANL)","Spontaneous time reversal and parity breaking in a $d_{x^2-y^2}$-wave
  superconductor with magnetic impurities","Based on talk, given at Spectroscopies in Novel Superconductors 1997;
  4 pages latex file, Journ. Phys. and Chem. of Solids, to be published",,"10.1016/S0022-3697(98)00084-5",,"cond-mat.supr-con",,"  It is argued that the $d_{x^2-y^2}$ superconductor exhibits the transition
into $d_{x^2-y^2} + id_{xy}$ state in the presence of magnetic impurities in
certain conditions. Linear coupling between impurity magnetization and the
$d_{xy}$ component drives this transition. Violation of time-reversal symmetry
and parity occurs spontaneously via the second order transition. In the ordered
phase both impurity magnetization and $d_{xy}$ component of the order parameter
develop and are proportional to each other.
","[{""version"":""v1"",""created"":""Thu, 25 Sep 1997 20:14:26 GMT""}]","2009-10-30"
"cond-mat/9709288","Hari Manoharan","H. C. Manoharan, Y. W. Suen, T. S. Lay, M. B. Santos, and M. Shayegan
  (Princeton University)","Spontaneous Interlayer Charge Transfer near the Magnetic Quantum Limit","4 pages, 4 figures (1 color) included in text. Related papers at
  http://www.ee.princeton.edu/~hari/papers.html","Phys. Rev. Lett., vol. 79, p. 2722 (1997)","10.1103/PhysRevLett.79.2722",,"cond-mat.mes-hall cond-mat.str-el",,"  Experiments reveal that a confined electron system with two equally-populated
layers at zero magnetic field can spontaneously break this symmetry through an
interlayer charge transfer near the magnetic quantum limit. New fractional
quantum Hall states at unusual total filling factors such as \nu = 11/15 (= 1/3
+ 2/5) stabilize as signatures that the system deforms itself, at substantial
electrostatic energy cost, in order to gain crucial correlation energy by
""locking in"" separate incompressible liquid phases at unequal fillings in the
two layers (e.g., layered 1/3 and 2/5 states in the case of \nu = 11/15).
","[{""version"":""v1"",""created"":""Thu, 25 Sep 1997 21:53:02 GMT""}]","2009-10-30"
"cond-mat/9709289","Shou-Cheng Zhang","Shou-Cheng Zhang","Recent Developments in the SO(5) Theory of High $T_c$ Superconductivity","5 pages LaTex. Invited talk given at the International Conference on
  Spectroscopy of Novel Superconductors. To be published in Journal of Phys.
  and Chem. of Solids",,"10.1016/S0022-3697(98)00096-1",,"cond-mat.supr-con",,"  In this talk I outline the general strategy behind the SO(5) theory of high
$T_c$ superconductivity. Progress in the direction of exact SO(5) models,
numerical exact diagonalization and possible experimental tests are reviewed. I
also address the criticisms raised recently against the SO(5) theory and point
out directions for future exploration.
","[{""version"":""v1"",""created"":""Fri, 26 Sep 1997 03:43:55 GMT""}]","2009-10-30"
"cond-mat/9709290","Murray. Batchelor","H.W.J. Bl\""ote (Delft), M.T. Batchelor (Canberra) and B. Nienhuis
  (Amsterdam)","Collapse of a polymer in two dimensions","11 pages, Latex, 3 eps figs, Elsevier style files, to appear in the
  Hans van Leeuwen Festschrift (Physica A)","Physica A, 251 (1998) 95-103","10.1016/S0378-4371(97)00597-9",,"cond-mat.stat-mech",,"  We numerically investigate the influence of self-attraction on the critical
behaviour of a polymer in two dimensions, by means of an analysis of
finite-size results of transfer-matrix calculations. The transfer matrix is
constructed on the basis of the O($n$) loop model in the limit $n \to 0$. It
yields finite-size results for the magnetic correlation length of systems with
a cylindrical geometry. A comparison with the predictions of finite-size
scaling enables us to obtain information about the phase diagram as a function
of the chemical potential of the loop segments and the strength of the
attractive potential. Results for the magnetic scaling dimension can be
interpreted in terms of known universality classes. In particular, when the
attractive potential is increased, we observe the crossover between polymer
critical behaviour of the self-avoiding walk type to behaviour described
earlier for the theta point.
","[{""version"":""v1"",""created"":""Fri, 26 Sep 1997 05:34:05 GMT""}]","2015-06-25"
"cond-mat/9709291","Guido Goldoni","G. Goldoni, F. Rossi, E. Molinari (INFM and Dipartimento di Fisica,
  Univ. of Modena, Italy)","Excitonic Effects in Quantum Wires","Proc. OECS-5 Conference, G\""ottingen, 1997 (To appear in Phys. Stat.
  Sol. (b))","Physica Status Solidi (a) 64, 265 (1997).","10.1002/1521-396X(199711)164:1<265::AID-PSSA265>3.0.CO",,"cond-mat.mtrl-sci",,"  We review the effects of Coulomb correlation on the linear and non-linear
optical properties of semiconductor quantum wires, with emphasis on recent
results for the bound excitonic states. Our theoretical approach is based on
generalized semiconductor Bloch equations, and allows full three-dimensional
multisubband description of electron-hole correlation for arbitrary confinement
profiles. In particular, we consider V- and T-shaped structures for which
significant experimental advances were obtained recently. Above band gap, a
very general result obtained by this approach is that electron-hole Coulomb
correlation removes the inverse-square-root single-particle singularity in the
optical spectra at band edge, in agreement with previous reports from purely
one-dimensional models. Strong correlation effects on transitions in the
continuum are found to persist also at high densities of photoexcited carriers.
  Below bandgap, we find that the same potential- (Coulomb) to kinetic-energy
ratio holds for quite different wire cross sections and compositions. As a
consequence, we identify a shape- and barrier-independent parameter that
governs a universal scaling law for exciton binding energy with size. Previous
indications that the shape of the wire cross-section may have important effects
on exciton binding are discussed in the light of the present results.
","[{""version"":""v1"",""created"":""Fri, 26 Sep 1997 08:16:19 GMT""}]","2009-10-30"
"cond-mat/9709292","Paolo Provero","P. Provero","Interaction effects in the spectrum of the three-dimensional Ising model","10 pages, LaTeX file + 1 ps figure, uses axodraw.sty",,"10.1103/PhysRevE.57.3861","DFTT 58/97","cond-mat.stat-mech hep-lat",,"  The two-point correlation functions of statistical models show in general
both poles and cuts in momentum space. The former correspond to the spectrum of
massive excitations of the model, while the latter originate from interaction
effects, namely creation and annihilation of virtual pairs of excitations. We
discuss the effect of such interactions on the long distance behavior of
correlation functions in configuration space, focusing on certain time-slice
operators which are commonly used to extract the spectrum. For the 3D Ising
model in the scaling region of the broken-symmetry phase, a one-loop
calculation shows that the interaction effects on time-slice correlations is
non negligible for distances up to a few times the correlation length, and
should therefore be taken into account when analysing Monte Carlo data.
","[{""version"":""v1"",""created"":""Fri, 26 Sep 1997 08:30:25 GMT""}]","2009-10-30"
"cond-mat/9709293","Max Petersen","C. Ratsch, P. Ruggerone, and M. Scheffler","Study of Strain and Temperature Dependence of Metal Epitaxy","25 pages, 6 figures, In: ``Morphological Organisation during
  Epitaxial Growth and Removal'', Eds. Z. Zhang, M. Lagally. World Scientific,
  Singapore 1998. other related publications can be found at
  http://www.rz-berlin.mpg.de/th/paper.html",,"10.1142/9789812816245_0001",,"cond-mat.mtrl-sci",,"  Metallic films are important in catalysis, magneto-optic storage media, and
interconnects in microelectronics, and it is crucial to predict and control
their morphologies. The evolution of a growing crystal is determined by the
behavior of each individual atom, but technologically relevant structures have
to be described on a time scale of the order of (at least) tenths of a second
and on a length scale of nanometers. An adequate theory of growth should
describe the atomistic level on very short time scales (femtoseconds), the
formation of small islands (microseconds), as well as the evolution of
mesoscopic and macroscopic structures (tenths of seconds).
  The development of efficient algorithms combined with the availability of
cheaper and faster computers has turned density functional theory (DFT) into a
reliable and feasible tool to study the microscopic aspects of growth phenomena
(and many other complex processes in materials science, condensed matter
physics, and chemistry). In this paper some DFT results for diffusion
properties on metallic surfaces are presented. Particularly, we will discuss
the current understanding of the influences of strain on the diffusion (energy
barrier and prefactor) of a single adatom on a substrate.
  A DFT total energy calculation by its nature is primarily a static
calculation. An accurate way to describe the spatial and temporal development
of a growing crystal is given by kinetic Monte Carlo (KMC). We will describe
the method and its combination with microscopic parameters obtained from ab
initio calculations. It is shown that realistic ab initio kinetic Monte Carlo
simulations are able to predict an evolving mesoscopic structure on the basis
of microscopic details.
","[{""version"":""v1"",""created"":""Fri, 26 Sep 1997 10:02:37 GMT""}]","2016-11-03"
"cond-mat/9709294","Nobuo Furukawa","Nobuo Furukawa (ISSP, Univ. Tokyo), Kazuma Hirota (Tohoku Univ.)","Scaling relation of spin wave lifetime in double-exchange systems","To be published in Physica B",,"10.1016/S0921-4526(97)00716-3",,"cond-mat.str-el",,"  Spin excitation spectrum of CMR manganites are studied from both theoretical
and experimental sides. Scaling relations for the spin wave lifetime in the
electronic model with double-exchange interaction is observed, which is
consistent with results for neutron inelastic scattering experiments for
(La,Y)$_{0.8}$Sr$_{0.2}$MnO$_3$. Roles of other interactions and degrees of
freedom such as polaron effects are also discussed.
","[{""version"":""v1"",""created"":""Fri, 26 Sep 1997 10:04:03 GMT""}]","2016-03-23"
"cond-mat/9709295","Tota Nakamura","Tota Nakamura and Kiyomi Okamoto","Theoretical analysis of the experiments on the double-spin-chain
  compound -- KCuCl$_3$","4 pages, REVTeX, 5 figures in eps-files","Phys. Rev. B, 58 (1998) 2411","10.1103/PhysRevB.58.2411",,"cond-mat",,"  We have analyzed the experimental susceptibility data of KCuCl$_3$ and found
that the data are well-explained by the double-spin-chain models with strong
antiferromagnetic dimerization. Large quantum Monte Carlo calculations were
performed for the first time in the spin systems with frustration. This was
made possible by removing the negative-sign problem with the use of the dimer
basis that has the spin-reversal symmetry. The numerical data agree with the
experimental data within 1% relative errors in the whole temperature region. We
also present a theoretical estimate for the dispersion relation and compare it
with the recent neutron-scattering experiment. Finally, the magnitude of each
interaction bond is predicted.
","[{""version"":""v1"",""created"":""Fri, 26 Sep 1997 12:25:52 GMT""}]","2009-10-30"
"cond-mat/9709296","C. R. Werner","C. R. Werner and U. Eckern","Non-linear conductivity of charge-density-wave systems","16 pages, 6 figures","Ann. Physik 6 (1997) 595-610","10.1002/andp.19975090803",,"cond-mat.dis-nn",,"  We consider the problem of sliding motion of a charge-density-wave subject to
static disorder within an elastic medium model. Starting with a
field-theoretical formulation, which allows exact disorder averaging, we
propose a self-consistent approximation scheme to obtain results beyond the
standard large-velocity expansion. Explicit calculations are carried out in
three spatial dimensions. For the conductivity, we find a strong-coupling
regime at electrical fields just above the pinning threshold. Phase and
velocity correlation functions scale differently from the high-field regime,
and static phase correlations converge to the pinned-phase behaviour. The
sliding charge-density-wave is accompanied by narrow-band noise.
","[{""version"":""v1"",""created"":""Fri, 26 Sep 1997 12:57:32 GMT""},{""version"":""v2"",""created"":""Mon, 26 Jan 1998 15:09:20 GMT""}]","2009-10-30"
"cond-mat/9709297",,"E. Orignac and T. Giamarchi (Laboratoire de Physique des Solides,
  Universite de Paris-Sud)","Weakly disordered spin ladders","38 pages, RevTeX, 8 encapsulated PostScript figures submitted to
  Phys. Rev. B","Phys. Rev. B 57 p. 5812 (1998)","10.1103/PhysRevB.57.5812",,"cond-mat.str-el",,"  We analyze an anisotropic spin 1/2 two legs ladder in the presence of various
type of random perturbations. The generic phase diagram for the pure system, in
a way similar to spin one chains, consists of four phases: an Antiferromagnet,
a Haldane gap or a Singlet phase (depending on the sign of interchain coupling)
and two XY phases designated by XY1 and XY2. The effects of disorder depend
crucially on whether it preserves XY symmetry (random field along z and random
exchange) or not (random anisotropy or random XY fields). The singlet phases
and the massless XY1 phase are totally unaffected by disorder in stark contrast
with the single chain case. On the other hand the XY2 phase is very strongly
suppressed. Disorder breaking XY symmetry has much stronger effects and most of
the phases at the exception of the singlet one are destroyed. Interestingly,
the disordered XY1 phase has a much shorter correlation length than the
disordered XY2 phase contrarily with the case of perturbations preserving the
rotation symmetry around the z axis.
","[{""version"":""v1"",""created"":""Fri, 26 Sep 1997 13:48:05 GMT""}]","2009-10-30"
"funct-an/9709004","Neal J. Fowler","Neal Fowler and Marcelo Laca (University of Newcastle, Australia)","Endomorphisms of B(H), extensions of pure states, and a class of
  representations of O_n","22 pages, AMS-LaTeX",,,,"funct-an math.OA",,"  Let F_n be the fixed-point algebra of the gauge action of the circle on the
Cuntz algebra O_n. For every pure state \rho of F_n and every representation
\theta of C(T) we construct a representation of O_n, and we use the resulting
class of representations to parameterize the space of all states of O_n which
extend \rho. We show that the gauge group acts transitively on the pure
extensions of \rho and that the action is p-to-1 with p the period of \rho
under the usual shift. We then use the above representations of O_n to
construct endomorphisms of B(H) which we classify up to conjugacy in terms of
the parameters \rho and \theta. In particular our construction yields every
ergodic endomorphism \alpha whose tail algebra $\bigcap_k\alpha^k(B(H))$ has a
minimal projection, and our results classify these ergodic endomorphisms by an
equivalence relation on the pure states of F_n. As examples we analyze the
ergodic endomorphisms arising from periodic pure product states of F_n, for
which we are able to give a geometric complete conjugacy invariant,
generalizing results of Stacey, Laca, and Bratteli-Jorgensen-Price on the
shifts of Powers.
","[{""version"":""v1"",""created"":""Fri, 26 Sep 1997 05:28:43 GMT""}]","2008-02-03"
"gr-qc/9709068","Max Banados","Maximo Banados and Mauricio Contreras","Darboux coordinates for (first order) tetrad gravity","12 pages, Latex. Minor presentation changes and some references
  added. Version to appear in Classical and Quantum Gravity","Class.Quant.Grav. 15 (1998) 1527-1534","10.1088/0264-9381/15/6/009",,"gr-qc hep-th",,"  The Hamiltonian form of the Hilbert action in the first order tetrad
formalism is examined. We perform a non-linear field redefinition of the
canonical variables isolating the part of the spin connection which is
canonically conjugate to the tetrad. The geometrical meaning of the constraints
written in these new variables is examined.
","[{""version"":""v1"",""created"":""Thu, 25 Sep 1997 23:18:44 GMT""},{""version"":""v2"",""created"":""Mon, 29 Sep 1997 16:39:29 GMT""},{""version"":""v3"",""created"":""Sat, 28 Feb 1998 23:57:09 GMT""}]","2009-10-30"
"gr-qc/9709069","Anjan Ananda Sen.","A.A.Sen and N.Banerjee","Gravitational field of a stationary circular cosmic string loop","Revised version submitted to Astrophysics and Space Sciences","Astrophys.Space Sci. 259 (1998) 301-307","10.1023/A:1001717823007",,"gr-qc",,"  Gravitational field of a stationary circular cosmic string loop has been
studied in the context of full nonlinear Einstein's theory of gravity. It has
been assumed that the radial and tangential stresses of the loop are equal to
the energy density of the string loop. An exact solution for the system has
been presented which has a singularity at a finite distance from the axis,but
is regular for any other distances from the axis of the loop.
","[{""version"":""v1"",""created"":""Fri, 26 Sep 1997 11:23:30 GMT""},{""version"":""v2"",""created"":""Wed, 25 Feb 1998 09:42:53 GMT""},{""version"":""v3"",""created"":""Mon, 22 Jun 1998 11:01:45 GMT""}]","2019-08-16"
