"gr-qc/9709070","Hans-Juergen Schmidt","S. Mignemi and H.-J. Schmidt","Classification of multidimensional inflationary models","21 pages, LaTeX, no figures, J. Math. Phys. in print","J.Math.Phys. 39 (1998) 998-1010","10.1063/1.532366","Preprint Cagliari INFNCA-TH 9708","gr-qc",,"  We define under which circumstances two multi-warped product spacetimes can
be considered equivalent and then we classify the spaces of constant curvature
in the Euclidean and Lorentzian signature. For dimension D=2, we get
essentially twelve representations, for D=3 exactly eighteen. More general, for
every even D, 5D+2 cases exist, whereas for every odd D, 5D+3 cases exist. For
every D, exactly one half of them has the Euclidean signature. Our definition
is well suited for the discussion of multidimensional cosmological models, and
our results give a simple algorithm to decide whether a given metric represents
the inflationary de Sitter spacetime (in unusual coordinates) or not.
","[{""version"":""v1"",""created"":""Fri, 26 Sep 1997 15:06:59 GMT""}]","2009-10-30"
"gr-qc/9709071","Hans-Juergen Schmidt","H.-J. Schmidt","A new proof of Birkhoff's theorem","17 pages, LaTeX, no figures, Grav. and Cosm. in print","Grav.Cosmol. 3 (1997) 185-190",,"Preprint UNIPO-MATH-97-September-25","gr-qc",,"  Assuming SO(3)-spherical symmetry, the 4-dimensional Einstein equation
reduces to an equation conformally related to the field equation for
2-dimensional gravity following from the Lagrangian L = R^(1/3).
  Solutions for 2-dimensional gravity always possess a local isometry because
the traceless part of its Ricci tensor identically vanishes. Combining both
facts, we get a new proof of Birkhoff's theorem; contrary to other proofs, no
coordinates must be introduced.
  The SO(m)-spherically symmetric solutions of the (m+1)-dimensional Einstein
equation can be found by considering L = R^(1/m) in two dimensions. This yields
several generalizations of Birkhoff's theorem in an arbitrary number of
dimensions, and to an arbitrary signature of the metric.
","[{""version"":""v1"",""created"":""Fri, 26 Sep 1997 15:54:53 GMT""}]","2007-05-23"
"hep-ex/9709028","Sunil Somalwar","J. Adams, et al. (KTeV Collaboration)","Search for Light Gluinos via the Spontaneous Appearance of pi+pi- Pairs
  with an 800 GeV/c Proton Beam at Fermilab","Documentstyle aps,epsfig,prl (revtex), 6 pages, 7 figures","Phys.Rev.Lett.79:4083-4087,1997","10.1103/PhysRevLett.79.4083","RUTGERS-97-26, FERMILAB-PUB-97-320-E","hep-ex astro-ph hep-ph",,"  We searched for the appearance of pi+pi- pairs with invariant mass greater
than 648 MeV in a neutral beam. Such an observation could signify the decay of
a long-lived light neutral particle. We find no evidence for this decay. Our
null result severely constrains the existence of an R0 hadron, which is the
lightest bound state of a gluon and a light gluino, and thereby also the
possibility of a light gluino. Depending on the photino mass, we exclude the R0
in the mass and lifetime ranges of 1.2 -- 4.6 GeV and 2E-10 -- 7E-4 seconds,
respectively. (To Appear in Phys. Rev. Lett.)
","[{""version"":""v1"",""created"":""Thu, 25 Sep 1997 16:09:16 GMT""}]","2008-11-26"
"hep-ex/9709029","Claudia Glasman","Claudia Glasman (representing the H1 and ZEUS Collaborations)","Jet Cross Sections and Jet Shapes in Photoproduction at HERA","6 pages, latex, 4 figures",,"10.1142/9789814447256_0021",,"hep-ex",,"  Studies on the structure of the photon are presented by means of the
extraction of a leading order effective parton distribution in the photon and
measurements of inclusive jet differential cross sections in photoproduction.
Measurements of the internal structure of jets have been performed and are also
presented as a function of the transverse energy and pseudorapidity of the
jets.
","[{""version"":""v1"",""created"":""Fri, 26 Sep 1997 15:30:35 GMT""}]","2016-11-03"
"hep-lat/9709119","Pavlos Vranas","Pavlos M. Vranas (Columbia University)","Domain Wall Fermions and Chiral Symmetry Restoration Rate","3 pages, LaTex, 5 ps figures, contribution to LATTICE97 proceedings","Nucl.Phys.Proc.Suppl. 63 (1998) 605-607","10.1016/S0920-5632(97)00846-3",,"hep-lat",,"  Domain Wall Fermions utilize an extra space time dimension to provide a
method for restoring the regularization induced chiral symmetry breaking in
lattice vector gauge theories even at finite lattice spacing. The breaking is
restored at an exponential rate as the size of the extra dimension increases.
As a precursor to lattice QCD studies the dependence of the restoration rate to
the other parameters of the theory and, in particular, the lattice spacing is
investigated in the context of the two flavor lattice Schwinger model.
","[{""version"":""v1"",""created"":""Thu, 25 Sep 1997 18:07:34 GMT""}]","2009-10-30"
"hep-lat/9709120","Dong Chen","B. B. Beard, R. C. Brower, S. Chandrasekharan, D. Chen, A. Tsapalis
  and U.-J. Wiese","D-Theory: Field Theory via Dimensional Reduction of Discrete Variables","15 pages, LaTeX, including 9 encapsulated postscript figures.
  Contribution to Lattice 97 by 5 authors, to appear in Nuclear Physics B
  (Proceeding Supplements). Requires psfig.tex and espcrc2.sty","Nucl.Phys.Proc.Suppl. 63 (1998) 775-789","10.1016/S0920-5632(97)00900-6","MIT-CTP/2675","hep-lat",,"  A new non-perturbative approach to quantum field theory --- D-theory --- is
proposed, in which continuous classical fields are replaced by discrete
quantized variables which undergo dimensional reduction. The 2-d classical O(3)
model emerges from the (2+1)-d quantum Heisenberg model formulated in terms of
quantum spins. Dimensional reduction is demonstrated explicitly by simulating
correlation lengths up to 350,000 lattice spacings using a loop cluster
algorithm. In the framework of D-theory, gauge theories are formulated in terms
of quantum links --- the gauge analogs of quantum spins. Quantum links are
parallel transporter matrices whose elements are non-commuting operators. They
can be expressed as bilinears of anticommuting fermion constituents. In quantum
link models dimensional reduction to four dimensions occurs, due to the
presence of a 5-d Coulomb phase, whose existence is confirmed by detailed
simulations using standard lattice gauge theory. Using Shamir's variant of
Kaplan's fermion proposal, in quantum link QCD quarks appear as edge states of
a 5-d slab. This naturally protects their chiral symmetries without
fine-tuning. The first efficient cluster algorithm for a gauge theory with a
continuous gauge group is formulated for the U(1) quantum link model. Improved
estimators for Wilson loops are constructed, and dimensional reduction to
ordinary lattice QED is verified numerically.
","[{""version"":""v1"",""created"":""Thu, 25 Sep 1997 19:59:58 GMT""}]","2009-10-30"
"hep-lat/9709121",,"Stephan Elser and Burkhard Bunk (Humboldt-Universit\""at, Berlin)","Local bosonic versus HMC --- a CPU cost comparison","Talk presented at LATTICE97(algorithms), 3 pages, 3 Postscript
  figures, uses twoside, fleqn, espcrc2, epsf","Nucl.Phys.Proc.Suppl. 63 (1998) 940-942","10.1016/S0920-5632(97)00947-X",,"hep-lat",,"  We compare the CPU cost of HMC to various implementations of the Hermitean
variant of L\""uscher's local bosonic algorithm (LBA) for 2D massive QED with
two flavours of Wilson fermions. We carefully scan a 3-dimensional parameter
subspace and find flat behaviour around the optimum. The gain factor of the
LBA, as compared to HMC, is slightly smaller for the Re-weighting method than
for the Metropolis variants and estimated to about 3.3 for the plaquette and
1.9 for the the meson correlator.
","[{""version"":""v1"",""created"":""Thu, 25 Sep 1997 20:38:12 GMT""}]","2009-10-30"
"hep-lat/9709122","Roy Luo","Yubing Luo","Improved actions of the staggered fermion","3 pages, Latex, talk presented at LATTICE''97(Improvement)","Nucl.Phys.Proc.Suppl. 63 (1998) 889-891","10.1016/S0920-5632(97)00931-6",,"hep-lat",,"  We have studied $O(a^2)$ improved lattice QCD with the staggered fermion by
using Symanzik's program. We find that there are 5 dimension-6 fermion
bilinears and gauge operators. In addition, there are 10 four-fermion operators
which are absent at the tree-level and tadpole-improved tree-level.
","[{""version"":""v1"",""created"":""Thu, 25 Sep 1997 21:29:30 GMT""}]","2009-10-30"
"hep-lat/9709123","Yusuke Taniguchi","S. Aoki and Y. Taniguchi","One loop calculation of QCD with domain-wall quarks","3 pages, Latex with espcrc2.sty. Talk presented at Lattice97,
  Edinburgh, 22-26 July 1997","Nucl.Phys.Proc.Suppl. 63 (1998) 290-292","10.1016/S0920-5632(97)00749-4",,"hep-lat",,"  We calculate one loop corrections to the domain-wall quark propagator in QCD.
We show how the wave function is renormalized in this theory. Especially we are
interested in the behavior of the massless fermion mode, which exists near the
domain wall at the tree level. We show that this massless mode is stable
against the quantum correction.
","[{""version"":""v1"",""created"":""Fri, 26 Sep 1997 08:56:02 GMT""}]","2009-10-30"
"hep-lat/9709124","Petrus Pennanen","A. M. Green and P. Pennanen","A model for multi-quark systems","10 pages, one LaTeX figure","Phys.Lett. B426 (1998) 243-250","10.1016/S0370-2693(98)00300-1","HIP-1997-55/TH","hep-lat hep-ph nucl-th",,"  As a step towards understanding multi-quark systems abundant in nature we
construct a model that reproduces the binding energies of static four-quark
systems. These energies have been calculated using SU(2) lattice gauge theory
for a set of six different geometries representative of the general case. The
model is based on ground and excited state two-body potentials and multi-quark
interaction terms.
","[{""version"":""v1"",""created"":""Fri, 26 Sep 1997 11:24:39 GMT""},{""version"":""v2"",""created"":""Sun, 28 Sep 1997 15:37:55 GMT""}]","2009-10-30"
"hep-lat/9709125","Martin Luescher","S. Capitani, M. Guagnelli, M. Luescher, S. Sint, R. Sommer, P. Weisz
  and H. Wittig","Non-perturbative quark mass renormalization","Talk given at LATTICE '97, 6 pages, Latex source, 7 eps figures,
  needs epsfig","Nucl.Phys.Proc.Suppl. 63 (1998) 153-158","10.1016/S0920-5632(97)00707-X","DESY 97-188","hep-lat",,"  We show that the renormalization factor relating the renormalization group
invariant quark masses to the bare quark masses computed in lattice QCD can be
determined non-perturbatively. The calculation is based on an extension of a
finite-size technique previously employed to compute the running coupling in
quenched QCD. As a by-product we obtain the $\Lambda$--parameter in this theory
with completely controlled errors.
","[{""version"":""v1"",""created"":""Fri, 26 Sep 1997 14:54:35 GMT""}]","2009-10-30"
"hep-lat/9709126","Mark Alford","Mark Alford, Timothy R. Klassen, Peter Lepage","Mean-link tadpole improvement of SW and D234 actions","3 pages, LaTeX, uses espcrc2, Contribution to LATTICE 97","Nucl.Phys.Proc.Suppl.63:862-864,1998","10.1016/S0920-5632(97)00922-5","IASSNS-HEP-97/104","hep-lat",,"  We investigate a tadpole-improved tree-level-O(a^3)-accurate action, D234c,
on coarse lattices, using the mean link in Landau gauge to measure the tadpole
contribution. We find that D234c shows much better rotational invariance than
Sheikholeslami-Wohlert, and that mean-link tadpole improvement gives much
better hadron mass scaling than plaquette tadpole improvement, with finite-a
errors at 0.25 fm of only a few percent. We explore the effects of possible
O(alpha_s) changes to the improvement coefficients, and find that the two
leading coefficients can be independently tuned: hadron masses are only
sensitive to the clover coefficient, while hadron dispersion relations are only
sensitive to the third derivative coefficient. Preliminary non-perturbative
tuning of these coefficients yields values that are consistent with the
expected size of perturbative corrections.
","[{""version"":""v1"",""created"":""Fri, 26 Sep 1997 15:56:37 GMT""}]","2010-11-19"
"hep-ph/9709458",,"S. Moretti and K. Odagiri (Cavendish Laboratory, Cambridge, UK)","Charged Higgs scalar production in single-top mode (and other) at future
  $ep$ colliders in the Minimal Supersymmetric Standard Model","28 pages, latex, epsfig, 12 postscript figures bitmapped at 75dpi,
  complete paper including high resolution figures available at
  ftp://axpa.hep.phy.cam.ac.uk/moretti/cavendish_9713 and at
  http://www.hep.phy.cam.ac.uk/theory/papers/","Phys.Rev. D57 (1998) 5773-5779","10.1103/PhysRevD.57.5773","Cavendish-HEP-97/13","hep-ph",,"  We study charged Higgs boson production at future electron-proton colliders
in the framework of the Minimal Supersymmetric Standard Model. We focus our
attention to the case of single-top production and decay through the channel
$t\to bH^\pm$ and of vector-scalar fusion via $W^{\pm*} \Phi^*\to H^\pm$ (where
$\Phi=H,h$ and $A$). We consider the signature $H^\pm\to \tau\nu_\tau$ and
compare it to the irreducible background from Standard Model interactions. For
$M_{H^\pm}<m_t$, the $H^\pm$ signal is accessible through lepton universality
breaking if $M_A<100-120$ GeV at both low and large values of $\tan\beta$.
Furthermore, although the bulk of the production cross section comes from
single-top events, a sizable contribution due to vector-scalar-scalar
interactions should be observable at large $\tan\beta$, this possibly offering
some insights into the structure of the scalar sector of the theory. The
possibility of the CERN collider running in the LEPXLHC mode is considered in
detail
","[{""version"":""v1"",""created"":""Thu, 25 Sep 1997 16:32:12 GMT""}]","2009-10-30"
"hep-ph/9709459","Harold W. Fearing","Harold W. Fearing and Randy Lewis (TRIUMF), Nader Mobed (Regina),
  Stefan Scherer (Mainz)","Radiative and non radiative muon capture on the proton in heavy baryon
  chiral perturbation theory","Talk at the 15th Int. Conf. on Few-Body Problems in Physics, 22-26
  July, 1997, Groningen, The Netherlands, to be published in the proceedings; 5
  pages, LaTeX, using espcrc1.sty","Nucl.Phys. A631 (1998) 735c-739c","10.1016/S0375-9474(98)00101-8","TRIUMF report TRI-PP-97-30","hep-ph nucl-th",,"  We have evaluated the amplitude for muon capture by a proton, mu + p --> n +
nu, to O(p^3) within the context of heavy baryon chiral perturbation theory
(HBChPT) using the new O(p^3) Lagrangian of Ecker and Mojzis (E&M). We obtain
expressions for the standard muon capture form factors and determine three of
the coefficients of the E&M Lagrangian, namely, b_7, b_{19}, and b_{23}. We
describe progress on the next step, a calculation of the radiative muon capture
process, mu + p --> n + nu + gamma.
","[{""version"":""v1"",""created"":""Thu, 25 Sep 1997 19:06:33 GMT""}]","2009-10-30"
"hep-ph/9709460","Claude Bernard","C. Bernard","Lattice Calculations of Decay Constants","12 pages, 3 included postscript figures, uses sprocl.sty and epsfig.
  Review talk presented at the ""Seventh International Symposium on Heavy Flavor
  Physics,"" Santa Barbara, July 7-11, 1997",,,,"hep-ph hep-lat",,"  Lattice attempts to compute the leptonic decay constants of heavy-light
pseudoscalar mesons are described. I give a short historical overview of such
attempts and then discuss some current calculations. I focus on three of the
most important sources of systematic error: the extrapolation to the continuum,
the chiral extrapolation in light quark mass, and the effects of quenching. I
briefly discuss the ``bag parameters'' $B_B$ and $B_{B_s}$, and then conclude
with my expectations of the precision in decay constants and bag parameters
that will be possible in the next few years.
","[{""version"":""v1"",""created"":""Thu, 25 Sep 1997 19:28:13 GMT""}]","2007-05-23"
"hep-ph/9709461","Leonid Burakovsky","L. Burakovsky and T. Goldman","Schwinger's nonet mass formula revisited","11 pages, LaTeX",,,"LA-UR-97-3795","hep-ph",,"  We prove the validity of Schwinger's quartic nonet mass formula for a general
nonet structure with the isoscalar singlet mass being shifted from its
``ideal'' value. We apply this formula to the problem of the correct q\bar{q}
assignment for the scalar meson nonet. The results favor scalar isoscalar
singlet and isoscalar octet masses in the vicinity of 1 GeV and 1.45 GeV,
respectively. We explain the failure of Schwinger's formula for the
pseudoscalar meson nonet, and suggest a new version of this formula, modified
by the inclusion of the pseudoscalar decay constants, which holds with improved
accuracy for this nonet. We also rederive the new Gell-Mann-Okubo mass formula
3M^2(n\bar{n},I=1)+2M^2(s\bar{s})=4M^2(s\bar{n})+M^2(n\bar{n},I=0) (n=u,d),
suggested in our previous publications.
","[{""version"":""v1"",""created"":""Thu, 25 Sep 1997 21:11:29 GMT""}]","2007-05-23"
"hep-ph/9709462","Harald W. Griesshammer","Harald W. Griesshammer (U Erlangen, U of Washington)","Magnetic Defects Signal Failure of Abelian Projection Gauges in QCD","20 pages, LaTeX2e, uses package fontenc",,,"FAU-TP3-97/6, DOE/ER/41014-35-N97","hep-ph hep-th",,"  Magnetically charged Abelian defects are shown to arise on most compact base
manifolds and in most Abelian projection gauges. They obey the Dirac
quantisation condition and give rise to homogeneous magnetic background fields.
The reasons for their occurrence are global failures of the procedure with
which gauge covariant operators are diagonalised or their eigenphases
extracted. Defects related to the former case are string-like; for the latter
case they resemble domain walls. Either configuration forms the generic case
and indicates a failure of gauge fixing as continuity and periodicity
properties of the functional space are changed. These results are first
obtained in canonically quantised QCD_{3+1} and path integral QCD_{2+1} on the
torus for the modified axial gauge which keeps only the eigenphases as
dynamical variables of the Wilson line in the x_3-direction. In the end, they
are extended to other gauges, dimensions and standard manifolds.
","[{""version"":""v1"",""created"":""Thu, 25 Sep 1997 23:09:51 GMT""}]","2007-05-23"
"hep-ph/9709463","Billy D. Jones","Billy D. Jones (TRIUMF)","Light-Front Hamiltonian Approach to the Bound-State Problem in Quantum
  Electrodynamics","Ph.D. Dissertation at The Ohio State University, 149 pages (LaTeX2e)",,,,"hep-ph hep-th nucl-th",,"  This dissertation presents the first theoretical investigation of the Lamb
shift in a light-front hamiltonian approach: the dominant part of the splitting
between the 2S(1/2) and 2P(1/2) energy levels in hydrogen is calculated. Also
presented for the first time is an analytic calculation in a light-front
hamiltonian approach of the singlet-triplet spin splitting in the ground state
of positronium through fourth order in the fine-structure constant.
","[{""version"":""v1"",""created"":""Thu, 25 Sep 1997 23:40:51 GMT""},{""version"":""v2"",""created"":""Fri, 26 Sep 1997 00:48:24 GMT""}]","2009-09-25"
"hep-ph/9709464","N. D. Hari Dass","N.D. Hari Dass(IMSc,Madras) and V. Soni(NPL,New Delhi)","Quantum Chromodynamics and the Z-width","Latex(revtex) 4 pages Rep No:IMSc/97/07/31",,,,"hep-ph",,"  We show by explicit construction of an alternative theory for the strong
interactions that it cannot be distinguished from QCD by any of the usual
precision tests except on extending these theories to the full electroweak
theory, by the Z- particle width.
","[{""version"":""v1"",""created"":""Fri, 26 Sep 1997 07:27:47 GMT""}]","2007-05-23"
"hep-ph/9709465","Kazakov Dmitri","D.I. Kazakov","Finiteness of Soft Terms in Finite N=1 SUSY Gauge Theories","Latex, 8pp, no figures","Phys.Lett.B421:211-216,1998","10.1016/S0370-2693(97)01561-X",,"hep-ph",,"  Recently proposed relations between the renormalization group functions of
the soft supersymmetry breaking terms and those of a rigid theory allow one to
consider a possibility of constructing a totally all loop finite N=1 SUSY gauge
theory, including the soft SUSY breaking terms. The requirement of finiteness,
which can be satisfied in previously constructed finite SUSY GUTs, imposes some
constraints on the SUSY breaking parameters which, in the leading order,
coincide with those originating from the supergravity and superstring-inspired
models. Explicit relations between the soft terms, which lead to a completely
finite theory in any loop order, are given.
","[{""version"":""v1"",""created"":""Fri, 26 Sep 1997 09:06:44 GMT""}]","2008-11-26"
"hep-ph/9709466","Rainer Haeussling","R. H\""au{\ss}ling, M. Paschke, and F. Scheck","Leptonic Generation Mixing, Noncommutative Geometry and Solar Neutrino
  Fluxes","LaTeX, 12 pages","Phys.Lett. B417 (1998) 312-319","10.1016/S0370-2693(97)01407-X",,"hep-ph",,"  Triangular mass matrices for neutrinos and their charged partners contain
full information on neutrino mixing in a most concise form. Although the scheme
is general and model independent, triangular matrices are typical for reducible
but indecomposable representations of graded Lie algebras which, in turn, are
characteristic for the standard model in noncommutative geometry. The mixing
matrix responsible for neutrino oscillations is worked out analytically for two
and three lepton families. The example of two families fixes the mixing angle
to just about what is required by the Mikheyev-Smirnov-Wolfenstein resonance
oscillation of solar neutrinos. In the case of three families we classify all
physically plausible choices for the neutrino mass matrix and derive
interesting bounds on some of the moduli of the mixing matrix.
","[{""version"":""v1"",""created"":""Fri, 26 Sep 1997 11:41:04 GMT""}]","2016-08-15"
"hep-ph/9709467",,"N.V.Krasnikov","Influence of $SU(2) \otimes U(1)$ singlet scalars on Higgs boson signal
  at LHC","9 pages, latex, no figures","Mod.Phys.Lett. A13 (1998) 893-898","10.1142/S0217732398000978","Preprint INR-0940a/97","hep-ph",,"  We investigate a model of $SU(2) \otimes U(1)$ singlet scalars coupled to
Standard Model. We point out that for the case of maximal mixing between
singlet scalars and standard Higgs boson the Higgs boson production cross
section is smaller than the standard Higgs boson production by factor
$\frac{1}{N+1}$, where N is the number of singlet scalar scalars. For the case
of big mixing Higgs boson could be nonobservable at LHC. However, there is also
a possibility for the observation of scalar singlets at LHC. As a
quasirealistic example we discuss a supersymmetric $SU(2) \otimes U(1)$
electroweak model with an additional gauge singlet chiral superfield.
","[{""version"":""v1"",""created"":""Fri, 26 Sep 1997 12:38:09 GMT""}]","2009-10-30"
"hep-ph/9709468","Tommy Ohlsson","Johan Linde, Tommy Ohlsson, and Hakan Snellman","Decuplet Baryon Magnetic Moments in the Chiral Quark Model","4 pages, RevTeX","Phys.Rev. D57 (1998) 5916-5919","10.1103/PhysRevD.57.5916",,"hep-ph",,"  We present calculations of the decuplet baryon magnetic moments in the chiral
quark model. As input we use parameters obtained in qualitatively accurate fits
to the octet baryon magnetic moments studied previously. The values found for
the magnetic moments of $\Delta^{++}$ and $\Omega^{-}$ are in good agreement
with experiments. We finally calculate the total quark spin polarizations of
the decuplet baryons and find that they are considerably smaller than what is
expected from the non-relativistic quark model.
","[{""version"":""v1"",""created"":""Fri, 26 Sep 1997 13:24:56 GMT""},{""version"":""v2"",""created"":""Tue, 30 Dec 1997 17:34:38 GMT""},{""version"":""v3"",""created"":""Wed, 15 Apr 1998 16:53:27 GMT""}]","2009-10-30"
"hep-ph/9709469","Willy van Neerven","W.L. van Neerven","Heavy flavour contributions to the spin structure function g_1(x,Q^2)
  and the Bjorken sum rule","10 pages LaTex, 3 Postscript figures, To appear in Nucl. Phys. B
  (Suppl.)",,,,"hep-ph",,"  We discuss the order alpha_s^2 corrections to the longitudinal spin structure
function g_1(x,Q^2,m^2) which are due to heavy flavour contributions. Here Q
denotes the virtuality of the photon and m stands for the heavy flavour mass.
Since the exact heavy quark coefficient functions are not known yet we have
used the asymptotic forms which are strictly speaking only valid in the region
Q^2 >> m^2. However an analysis of the exact and asymptotic expressions for
F_2^{NLO}(x,Q^2,m^2) and g_1^{LO}(x,Q^2,m^2) reveals that the asymptotic forms
can be also used at smaller Q^2. It appears that for the region 0.01 < x < 0.1
the NLO charm quark component can become twice as large as in LO. However it is
still much smaller than g_1(x,Q^2) due to light parton contributions. This is
in contrast to the observations made for F_2(x,Q^2) at small x. Also the charm
quark contribution to the Bjorken sum rule turns out to be very small.
","[{""version"":""v1"",""created"":""Fri, 26 Sep 1997 13:52:50 GMT""}]","2007-05-23"
"hep-ph/9709470","Leonard S. Kisslinger","Leonard S. Kisslinger (Carnegie Mellon University),Zhenping Li (Peking
  University)","Sigma Signal for Hybrid Baryon Decay","Latex file","Phys.Lett. B445 (1999) 271-273","10.1016/S0370-2693(98)01503-2",,"hep-ph",,"  We develop an ansatze of the sigma enhancement of the I=0, L=0 $\pi$-$\pi$
scattering amplitude as arising from a low-energy glueball pole. Using this
picture we estimate the $\pi^0\pi^0$ to $\pi^0$ branching ratio for the decays
of the Roper resonance, which we previously found to be a hybrid in our QCD sum
rule calculation. We find that the sigma decay might be a good signal for
gluonic components of hadrons.
","[{""version"":""v1"",""created"":""Fri, 26 Sep 1997 13:53:36 GMT""}]","2009-10-30"
