"cond-mat/9705072","Okunishi","Tomotoshi Nishino (Kobe University), Kouichi Okunishi (Osaka
  University)","Corner Transfer Matrix Algorithm for Classical Renormalization Group","20 pages, 10 ps figures, JPSJ style files are included","J. Phys. Soc. Jpn. 66 (1997) 3040","10.1143/JPSJ.66.3040",,"cond-mat.stat-mech",,"  We report a real-space renormalization group (RSRG) algorithm, which is
formulated through Baxter's corner transfer matrix (CTM), for two-dimensional
(d = 2) classical lattice models. The new method performs the renormalization
group transformation according to White's density matrix algorithm, so that
variational free energies are minimized within a restricted degree of freedom
m. As a consequence of the renormalization, spin variables on each corner of
CTM are replaced by a m-state block spin variable. It is shown that the
thermodynamic functions and critical exponents of the q = 2, 3 Potts models can
be precisely evaluated by use of the renormalization group method.
","[{""version"":""v1"",""created"":""Thu, 8 May 1997 11:50:55 GMT""}]","2008-02-03"
"cond-mat/9705073","Yasha Yi","Lin Tian, Ya-Sha Yi, Chui-Lin Wang and Zhao-Bin Su (Institute of
  Theoretical Physics, Chinese Academy of Sciences)","$E\otimes e$ Jahn-Teller Effect in $C_{70}^{3-}$ Systems","14 pages, to appear in Mod. Phys. Lett. B (1997)",,"10.1142/S0217979297001039",,"cond-mat.mtrl-sci cond-mat.soft",,"  The electron-phonon interaction in $C_{70}$ anions is studied by making use
of a lattice relaxation approach. We find there exists a Jahn-Teller effect in
$C_{70}^{3-}$ system, due to an extra electron being doped to the double
degenerate $E_{1}^{''}$ state. As a result of this effect, the original
$D_{5h}$ symmetry of the ground state becomes unstable, which causes distortion
of the lattice configuration. The only symmetry maintained in the final state
of the relaxation is the $x-y$ plane reflection symmetry. We further find that
besides the Jahn-Teller active $A_{1}^{'}, A_{2}^{'}, E_{2}^{'}$ modes, the
non-Jahn-Teller active $E_{1}^{'}$ vibrations also contribute to the relaxation
process, which come from the nonlinear effect and are two or three orders
smaller than those of the Jahn-Teller active modes. We suggest that the
$C_{70}^{3-}$ molecule is a promising Berry Phase candidate in this effective
$E \otimes e$ Jahn-Teller system.
","[{""version"":""v1"",""created"":""Thu, 8 May 1997 14:40:46 GMT""}]","2016-08-31"
"cond-mat/9705077","Prashant Gade","Prashant M. Gade (JNCASR, Bangalore) and M. P. Joy(IISc, Bangalore)","Self Organized Criticality in Digging Myopic Ant Model","Submitted to Phys. Rev. Lett., 7 .eps files, Revtex document",,,,"cond-mat adap-org nlin.AO",,"  We demonstrate the phenomenon of self organized criticality (SOC) in a simple
random walk model described by a random walk of a myopic ant. The ant acts on
the underlying lattice aiming at uniform digging of the surface but is
unaffected by the underlying lattice. In 1-d, 2-d and 3-d we have explored this
model and have obtained power laws in the time intervals between consecutive
events of `digging'. Being a simple random walk, the power laws in space
translate to power laws in time. We also study the finite size scaling of
asymptotic scale invariant process as well as dynamic scaling in this system.
This model differs qualitatively from the cascade models of SOC.
","[{""version"":""v1"",""created"":""Thu, 8 May 1997 10:21:41 GMT""}]","2008-02-03"
"gr-qc/9705012","Jorma Louko","Dieter R. Brill, Jorma Louko, and Peter Peldan","Thermodynamics of (3+1)-dimensional black holes with toroidal or higher
  genus horizons","25 pages, REVTeX v3.1, contains 5 LaTeX figures. (Typos corrected,
  references and minor comments added. To be published in Phys. Rev. D.)","Phys.Rev. D56 (1997) 3600-3610","10.1103/PhysRevD.56.3600","PP97-111, USITP 97-6","gr-qc",,"  We examine counterparts of the Reissner-Nordstrom-anti-de Sitter black hole
spacetimes in which the two-sphere has been replaced by a surface Sigma of
constant negative or zero curvature. When horizons exist, the spacetimes are
black holes with an asymptotically locally anti-de Sitter infinity, but the
infinity topology differs from that in the asymptotically Minkowski case, and
the horizon topology is not S^2. Maximal analytic extensions of the solutions
are given. The local Hawking temperature is found. When Sigma is closed, we
derive the first law of thermodynamics using a Brown-York type quasilocal
energy at a finite boundary, and we identify the entropy as one quarter of the
horizon area, independent of the horizon topology. The heat capacities with
constant charge and constant electrostatic potential are shown to be positive
definite. With the boundary pushed to infinity, we consider thermodynamical
ensembles that fix the renormalized temperature and either the charge or the
electrostatic potential at infinity. Both ensembles turn out to be
thermodynamically stable, and dominated by a unique classical solution.
","[{""version"":""v1"",""created"":""Wed, 7 May 1997 19:50:07 GMT""},{""version"":""v2"",""created"":""Mon, 4 Aug 1997 14:27:24 GMT""}]","2009-10-30"
"hep-lat/9705012","Urs M. Heller","Urs M. Heller","The Schr\""odinger functional running coupling with staggered fermions","24 pages. LaTeX2e with 1 macro file and 2 postscript figures","Nucl.Phys. B504 (1997) 435-458","10.1016/S0550-3213(97)00504-X","FSU-SCRI-97-41","hep-lat",,"  We discuss the Schr\""odinger functional in lattice QCD with staggered
fermions including its order $O(a)$ boundary counterterms. We relate it, in the
classical continuum limit, to the Schr\""odinger functional as obtained in the
same limit with Wilson fermions. We compute the strong coupling constant
defined via the Schr\""odinger functional with staggered fermions at one loop
and show that it agrees with the continuum running coupling constant in the
Schr\""odinger functional formalism.
","[{""version"":""v1"",""created"":""Thu, 8 May 1997 15:30:44 GMT""}]","2009-10-30"
"hep-ph/9705251","Igor Halperin","Igor Halperin and Ariel Zhitnitsky","Why is the B -> eta' X decay width so large ?","Comments on a mixing model for intrinsic charm and pre-asymptotic
  effects and some references are added. Latex, 9 pages","Phys.Rev.Lett. 80 (1998) 438-441","10.1103/PhysRevLett.80.438",,"hep-ph hep-ex",,"  New mechanism for the observed inclusive B -> \eta'X decay is suggested. We
argue that the dominant contribution to this amplitude is due to the Cabbibo
favored b -> \bar{c}cs process followed by the transition \bar{c}c -> \eta'. A
large magnitude of the ""intrinsic charm"" component of \eta' is of critical
importance in our approach. Our results are consistent with an unexpectedly
large Br(B -> \eta'+X) \sim 10^{-3} recently announced by CLEO. We stress the
uniqueness of this channel for 0^{-+} gluonia search.
","[{""version"":""v1"",""created"":""Wed, 7 May 1997 20:16:17 GMT""},{""version"":""v2"",""created"":""Mon, 8 Sep 1997 22:38:13 GMT""}]","2009-10-30"
"hep-ph/9705258","A. D. Martin","A. D. Martin (Centre for Particle Theory, Durham), M. G. Ryskin (Nucl.
  Phys. Inst., Petersburg) and V. A. Khoze (CPT, Durham)","Dijet hadroproduction with rapidity gaps and QCD double logarithmic
  effects","16 pages, LaTeX, 3 Postscript figures","Phys.Rev. D56 (1997) 5867-5874","10.1103/PhysRevD.56.5867","DTP/97/34","hep-ph",,"  We show that the hadroproduction of a pair of jets with large transverse
energy in the central region bounded by rapidity gaps is an ideal process to
see important double logarithmic QCD suppression effects. We compute the cross
sections for both exclusive and inclusive double-diffractive dijet production
at Tevatron and LHC energies for a range of rapidity configurations.
","[{""version"":""v1"",""created"":""Wed, 7 May 1997 17:33:03 GMT""}]","2009-10-30"
"hep-ph/9705259","Carlos Alberto Salgado Lopez","E. G. Ferreiro and C. Pajares","Strangeness enhancement in the String Fusion Model Code","LaTeX, 19 pages, 4 Postscript figures","J.Phys.G23:1961-1968,1997","10.1088/0954-3899/23/12/021","US-FT/14-97","hep-ph",,"  String Fusion Model Code results for Pb--Pb central collisions at SPS
energies including the string fusion interaction mechanism are compared to the
last experimental data. Predictions for RHIC energies are also presented. On
the other hand, the evolution of the strangeness enhancement ratio
$E_s=\frac{<\Lambda>+4<K_s^0>}{3<\pi^->}$ with the energy and with the atomic
number of participant nuclei is discussed.
","[{""version"":""v1"",""created"":""Wed, 7 May 1997 17:12:23 GMT""}]","2008-11-26"
"hep-ph/9705260","Robert Thews","Jorgen Randrup, Robert L. Thews","Analysis of DCC Domain Structure","18 pages, Latex, 7 Figures included as .ps files","Phys.Rev.D56:4392-4399,1997","10.1103/PhysRevD.56.4392","LBNL-40184; AZPH-TH/97-06","hep-ph nucl-th",,"  Wavelet-type methods are employed for the analysis of pion field
configurations that have been obtained by dynamical simulations in idealized
scenarios relevant to the formation of disoriented chiral condensates. It is
illustrated how the measurement of the isospin domain structure depends on the
ability to zoom in on limited parts of the phase space, due to the interplay
between the pion correlation length and the effective source geometry. The need
for advanced analysis methods is underscored by the fact that the extracted
neutral-fraction distribution would differ significantly from the ideal form,
even under perfect experimental conditions, and, moreover, by the circumstance
that thermal sources with suitably adjusted temperatures can lead to
distributions that may be practically indistinguishable from those arising from
DCC-type non-equilibrium evolutions.
","[{""version"":""v1"",""created"":""Wed, 7 May 1997 22:36:13 GMT""}]","2014-11-17"
"hep-ph/9705262","Michael Gronau","Michael Gronau","CP Violation in the B Meson System","17 pages, Talk at FCNC97, Santa Monica, CA , Feb. 19-21, 1997",,,"TECHNION-PH-97-17","hep-ph",,"  CP violation in $B$ decays is reviewed in the Standard Model (SM) and beyond
the SM. The present explanation of CP violation in terms of a phase in the
Cabibbo-Kobayashi-Maskawa (CKM) matrix can be tested through a variety of CP
asymmetries in neutral and charged $B$ decays. Usually, new mechanisms of CP
nonconservation enter via $B-\bar{B}$ mixing and violate SM constraints on the
CKM parameters in a few characteristic ways. Different models can be partially
distinguished by penguin-dominated $B$ decay rate measurements. In radiative
decays, large mixing-induced asymmetries may occur due to new contributions to
the decay amplitude.
","[{""version"":""v1"",""created"":""Thu, 8 May 1997 07:01:16 GMT""}]","2016-09-06"
"hep-ph/9705263","Takasugi","Eiichi Takasugi","The rephasing freedom and the NNI form of quark mass matrices","12pages","Prog.Theor.Phys. 98 (1997) 177-186","10.1143/PTP.98.177",,"hep-ph",,"  For three generations of quarks, we show that one of quark mass matrices can
be transformed into either a Fritzsch form or a Branco-Silva-Marcos form, while
the other is kept in the NNI basis. In these bases, quark mass matrices are
determined unambiguously once quark masses and the CKM mixing are given.
","[{""version"":""v1"",""created"":""Thu, 8 May 1997 08:49:01 GMT""}]","2009-10-30"
"hep-ph/9705264","Johannes Bluemlein","J. Bl\""umlein, B. Geyer, and D. Robaschik","On the Evolution Kernels of Twist 2 Light-Ray Operators for Unpolarized
  and Polarized Deep Inelastic Scattering","10 pages latex, including 1 ps-figure, typos corrected","Phys.Lett.B406:161-170,1997","10.1016/S0370-2693(97)00680-1","DESY 97--074, NTZ 14/97, Phys. Lett. B in print","hep-ph",,"  The non-singlet and singlet evolution kernels of the twist--2 light-ray
operators for unpolarized and polarized deep inelastic scattering are
calculated in $O(\alpha_s)$ for the general case of virtualities $q^2, q'^2
\neq 0$. Special cases as the kernels for the general single-variable evolution
equation and the Altarelli-Parisi and Brodsky-Lepage limits are derived from
these results.
","[{""version"":""v1"",""created"":""Thu, 8 May 1997 12:28:40 GMT""},{""version"":""v2"",""created"":""Wed, 28 May 1997 14:34:22 GMT""}]","2010-03-25"
"hep-ph/9705265",,"S.M. Barr (Bartol Research Institute)","Flavor Alignment Solutions to the Strong CP Problem in Supersymmetry","13 pages, LaTeX","Phys.Rev.D56:5761-5765,1997","10.1103/PhysRevD.56.5761","BA-97-16","hep-ph",,"  An approach to solving the Strong CP Problem in supersymmetric theories is
discussed which uses abelian family symmetries to align the mass matrices of
the quarks and squarks. In this way both the Strong CP Problem and the
characteristic flavor and CP problems of supersymmetry can be solved in a
single way.
","[{""version"":""v1"",""created"":""Thu, 8 May 1997 15:30:58 GMT""}]","2011-05-12"
"hep-ph/9705266",,"S.M. Barr (Bartol Research Institute)","The Sliding-singlet Mechanism Revived","xx pages, LaTeX. Note added","Phys.Rev.D57:190-194,1998","10.1103/PhysRevD.57.190","BA-97-17","hep-ph",,"  It is shown, using a modification of an idea of Sen, that completely
realistic supersymmetric grand-unified theories based on SU(6) or larger
unitary groups can be constructed using the sliding-singlet mechanism. These
models have a simple structure, preserve the successful prediction of $\sin^2
\theta_W$, and can suppress Higgsino-mediated proton decay to an acceptable
level in a simple way.
","[{""version"":""v1"",""created"":""Thu, 8 May 1997 15:33:06 GMT""},{""version"":""v2"",""created"":""Thu, 5 Jun 1997 17:53:43 GMT""}]","2011-05-12"
"hep-ph/9705268","John Gracey","S. E. Derkachov, J. A. Gracey and A. N. Manashov","Four loop anomalous dimensions of gradient operators in phi^4 theory","22 latex pages, 10 figures (3 postscript files)","Eur.Phys.J.C2:569-579,1998","10.1007/s100520050162","SPbU-IP-97-07, LTH-391","hep-ph",,"  We compute the anomalous dimensions of a set of composite operators which
involve derivatives at four loops in MSbar in phi^4 theory as a function of the
operator moment n. These operators are similar to the twist-2 operators which
arise in QCD in the operator product expansion in deep inelastic scattering. By
regarding their inverse Mellin transform as being equivalent to the DGLAP
splitting functions we explore to what extent taking a restricted set of
operator moments can give a good approximation to the exact four loop result.
","[{""version"":""v1"",""created"":""Thu, 8 May 1997 15:49:30 GMT""}]","2008-11-26"
"hep-th/9705039","J\""urgen Fuchs","J. B""ockenhauer and J. Fuchs","CFT fusion rules, DHR gauge groups, and CAR algebras","22 pages, LaTeX2e","J.Phys.A31:3503-3522,1998","10.1088/0305-4470/31/15/015","DESY 97-077","hep-th",,"  It is demonstrated that several series of conformal field theories, while
satisfying braid group statistics, can still be described in the conventional
setting of the DHR theory, i.e. their superselection structure can be
understood in terms of a compact DHR gauge group. Besides theories with only
simple sectors, these include (the untwisted part of) c=1 orbifold theories and
level two so(N) WZW theories. We also analyze the relation between these models
and theories of complex free fermions.
","[{""version"":""v1"",""created"":""Wed, 7 May 1997 16:47:35 GMT""}]","2008-11-26"
"hep-th/9705044","Ken Intriligator","Julie D. Blum and Kenneth Intriligator","New Phases of String Theory and 6d RG Fixed Points via Branes at
  Orbifold Singularities","Harvmac, 28 pages, small typo corrected","Nucl.Phys.B506:199-222,1997","10.1016/S0550-3213(97)00449-5","IASSNS-HEP-97/40","hep-th",,"  We discuss type II and type I branes at general ADE type orbifold
singularities. We show that there are new phases of type I or heterotic string
theory in six dimensions, involving extra tensor multiplets, which arise when
small instantons sit on orbifold singularities. The theories with extra tensor
multiplets are explicitly constructed via orientifolds. The world-volume
theories in type IIB or type I five-branes at orbifold singularities lead to
the existence of several infinite classes of six dimensional, interacting,
renormalization group fixed point theories.
","[{""version"":""v1"",""created"":""Wed, 7 May 1997 22:11:10 GMT""},{""version"":""v2"",""created"":""Thu, 8 May 1997 16:43:58 GMT""}]","2009-08-18"
"hep-th/9705045","Francesco Antonuccio","F.Antonuccio","Light-Cone Quantization and Renormalization of Large-N Scalar Matrix
  Models","14 pages, LaTeX",,,"MPIH-V?-1997","hep-th",,"  We discuss the issue of renormalization and the derivation of effective
interactions for light-cone Hamiltonians in the context of large-N scalar
matrix models with $\Phi^3$ interactions. For various space-time dimensions $D
\geq 3$, we deduce appropriate mass, coupling constant, and wavefunction
renormalizations which are necessary for finiteness of the Hamiltonian at
leading order. We also outline how higher order corrections may be derived
within this framework, and discuss the relevance of this approach in the
light-cone quantization of gauge theories.
","[{""version"":""v1"",""created"":""Wed, 7 May 1997 22:18:12 GMT""}]","2007-05-23"
"hep-th/9705047","Alexios Polychronakos","Alexios P. Polychronakos","Multidimensional Calogero systems from matrix models","12 pages, no figures, plain tex, phyzzx macro","Phys.Lett. B408 (1997) 117-121","10.1016/S0370-2693(97)00788-0","UUTP-08/97, 10A 97-06","hep-th cond-mat",,"  We show that a particular many-matrix model gives rise, upon hamiltonian
reduction, to a multidimensional version of the Calogero-Sutherland model and
its spin generalizations. Some simple solutions of these models are
demonstrated by solving the corresponding matrix equations. A connection of
this model to the dimensional reduction of Yang-Mills theories to
(0+1)-dimensions is pointed out. In particular, it is shown that the low-energy
dynamics of D0-branes in sectors with nontrivial fermion content is that of
spin-Calogero particles.
","[{""version"":""v1"",""created"":""Thu, 8 May 1997 07:11:06 GMT""}]","2009-10-30"
"hep-th/9705048","Ruslan Metsaev","R.R. Metsaev (Lebedev Physical Institute)","Cubic interaction vertices for higher spin fields","6 pages, sprocl.sty","Talk given at 2nd International Sakharov Conference on Physics,
  Moscow, Russia, 20-24 May 1996. Published in Proceedings of the Second
  International A.D. Sakharov Conference on Physics, Ed. I.M. Dremin and A.M.
  Semikhatov, World Scientific, Singapore, 1997",,,"hep-th",,"  We present results of investigation into a problem of cubic interaction
vertices of massless higher spin fields which transform in arbitrary irreps of
the Poincare algebra
","[{""version"":""v1"",""created"":""Thu, 8 May 1997 08:24:15 GMT""}]","2007-05-23"
"hep-th/9705049","Manuel Calixto Molina","V. Aldaya, M. Calixto, J. M. Cervero","Vacuum Radiation and Symmetry Breaking in Conformally Invariant Quantum
  Field Theory","29 pages, Latex, 1 figure, to appear in Commun. Math. Phys","Commun.Math.Phys. 200 (1999) 325-354","10.1007/s002200050532",,"hep-th",,"  The underlying reasons for the difficulty of unitarily implementing the whole
conformal group $SO(4,2)$ in a massless Quantum Field Theory (QFT) are
investigated in this paper. Firstly, we demonstrate that the singular action of
the subgroup of special conformal transformations (SCT), on the standard
Minkowski space $M$, cannot be primarily associated with the vacuum radiation
problems, the reason being more profound and related to the dynamical breakdown
of part of the conformal symmetry (the SCT subgroup, to be more precise) when
representations of null mass are selected inside the representations of the
whole conformal group. Then we show how the vacuum of the massless QFT radiates
under the action of SCT (usually interpreted as transitions to a uniformly
accelerated frame) and we calculate exactly the spectrum of the outgoing
particles, which proves to be a generalization of the Planckian one, this
recovered as a given limit.
","[{""version"":""v1"",""created"":""Thu, 8 May 1997 09:30:51 GMT""},{""version"":""v2"",""created"":""Thu, 9 Jul 1998 11:47:40 GMT""}]","2009-10-30"
"hep-th/9705050","David Wands","E. J. Copeland, James E. Lidsey and David Wands","S-duality Invariant Perturbations in String Cosmology","15 pages, no figures, plain LaTeX","Nucl.Phys. B506 (1997) 407-420","10.1016/S0550-3213(97)00538-5","SUSX-TH-97-007, PU-RCG 97/5","hep-th gr-qc",,"  We investigate the generation of curvature and isocurvature (dilaton, moduli
and axion) perturbations in a general class of axion-dilaton-moduli
models,including the pre-big bang scenario. Allowing for an arbitrary coupling
constant between the dilaton field and the axion field, we exploit the SL(2,R)
symmetry of the theory to obtain the spectral indices of the field
perturbations in a pre-big bang type scenario. Axion field fluctuations about a
homogeneous background field can yield a scale-invariant (Harrison-Zel'dovich)
spectrum. As an example we present a string-motivated case with SL(2,R)xSL(2,R)
symmetry, where a second axion field arises from the compactification of the
ten-dimensional theory to four dimensions.
","[{""version"":""v1"",""created"":""Thu, 8 May 1997 10:57:29 GMT""}]","2009-10-30"
"hep-th/9705051","Hasan R. Karadayi","H.R.Karadayi and M.Gungormez","The Higher Cohomologies of E_8 Lie Algebra","13 pages, no figures, TeX file",,,"ITU-HEP/97-12","hep-th alg-geom math.AG math.QA q-alg",,"  It is well known that anomaly cancellations for D_16 Lie algebra are at the
root of the first string revolution. For E_8 Lie algebra, cancellation of
anomalies is the principal fact leading to the existence of heterotic string.
They are in fact nothing but the 6th order cohomologies of corresponding Lie
algebras. Beyond 6th order, the calculations seem to require special care and
it could be that their study will be worthwhile in the light of developments of
the second string revolution.
  As we have shown in a recent article, for A_N Lie algebras, there is a method
which are based on the calculations of Casimir eigenvalues. This is extended to
E_8 Lie algebra in the present article. In the generality of any irreducible
representation of E_8 Lie algebra, we consider 8th and 12th order cohomologies
while emphasizing the diversities between the two. It is seen that one can
respectively define 2 and 8 basic invariant polinomials in terms of which 8th
and 12th order Casimir eigenvalues are always expressed as linear
superpositions. All these can be easily investigated because each one of these
invariant polinimials gives us a linear equation to calculate E_8 weight
multiplicities. Our results beyond order 12 are not included here because they
get more complicated though share the same characteristic properties with 12th
order calculations.
","[{""version"":""v1"",""created"":""Thu, 8 May 1997 12:24:27 GMT""}]","2008-02-03"
"hep-th/9705052",,"S. Deser, L. Griguolo and D. Seminara","Gauge Invariance, Finite Temperature and Parity Anomaly in D=3","4 pages, RevTex","Phys.Rev.Lett.79:1976-1979,1997","10.1103/PhysRevLett.79.1976",,"hep-th cond-mat.supr-con",,"  The effective gauge field actions generated by charged fermions in $QED_3$
and $QCD_3$ can be made invariant under both small and large gauge
transformations at any temperature by suitable regularization of the Dirac
operator determinant, at the price of parity anomalies. We resolve the paradox
that the perturbative expansion is not invariant, as manifested by the
temperature dependence of the induced Chern-Simons term, by showing that large
(unlike small) transformations and hence their Ward identities, are not
perturbative order-preserving. Our results are illustrated through concrete
examples of field configurations.
","[{""version"":""v1"",""created"":""Thu, 8 May 1997 15:49:59 GMT""}]","2008-11-26"
"math/9705217",,"Dubravko Ivan\v{s}i\'c","Finite-volume hyperbolic 4-manifolds that share a fundamental polyhedron",,,,"MSRI 1997-052","math.GT",,"  It is known that the volume function for hyperbolic manifolds of dimension
$\geq 3$ is finite-to-one. We show that the number of nonhomeomorphic
hyperbolic 4-manifolds with the same volume can be made arbitrarily large. This
is done by constructing a sequence of finite-sided finite-volume polyhedra with
side-pairings that yield manifolds. In fact, we show that arbitrarily many
nonhomeomorphic hyperbolic 4-manifolds may share a fundamental polyhedron. As a
by-product of our examples, we also show in a constructive way that the set of
volumes of hyperbolic 4-manifolds contains the set of even integral multiples
of $4\pi^2/3$. This is ``half'' the set of possible values for volumes, which
is the integral multiples of $4\pi^2/3$ due to the Gauss-Bonnet formula.
","[{""version"":""v1"",""created"":""Thu, 8 May 1997 00:00:00 GMT""}]","2016-09-07"
