"nucl-th/9705016","SA Rakityanski","S. A. Sofianos, S. A. Rakityansky, G. P. Vermaak","Sub-threshold resonances in few-neutron systems","Latex, 22 pages, no PS-figures, submitted to J.Phys.G","J.Phys.G23:1619-1630,1997","10.1088/0954-3899/23/11/010",,"nucl-th",,"  Three- and four-neutron systems are studied within the framework of the
hyperspherical approach with a local S-wave nn-potential. Possible bound and
resonant states of these systems are sought as zeros of three- and four-body
Jost functions in the complex momentum plane. It is found that zeros closest to
the origin correspond to sub-threshold (nnn) (1/2-) and (nnnn) (0+) resonant
states. The positions of these zeros turned out to be sensitive to the choice
of the $nn$--potential. For the Malfliet- Tjon potential they are
E(nnn)=-4.9-i6.9 (MeV) and E(nnnn)=-2.6-i9.0 (MeV). Movement of the zeros with
an artificial increase of the potential strength also shows an extreme
sensitivity to the choice of potential. Thus, to generate ^3n and ^4n bound
states, the Yukawa potential needs to be multiplied by 2.67 and 2.32
respectively, while for the Malfliet-Tjon potential the required multiplicative
factors are 4.04 and 3.59.
","[{""version"":""v1"",""created"":""Thu, 8 May 1997 05:14:53 GMT""}]","2008-11-26"
"patt-sol/9705005","Royce H. Kam","Royce Kam and Herbert Levine","Unicellular algal growth: A biomechanical approach to cell wall dynamics","5 pages, 2 embedded figures",,"10.1103/PhysRevLett.79.4290",,"patt-sol nlin.PS q-bio",,"  We present a model for unicellular algal growth as motivated by several
experiments implicating the importance of calcium ions and ``loosening''
enzymes in morphogenesis. A growing cell at rest in a diffusive calcium
solution is viewed as an elastic shell on short timescales. For a given turgor
pressure, we calculate the stressed shapes of the wall elements whose elastic
properties are determined by Young's modulus and the thickness of the wall. The
local enzyme concentration then determines the rate at which the unstressed
shape of a wall element relaxes toward its stressed shape. The local wall
thickness is calculated from the calcium-mediated addition of material and
thinning due to elongation. We use this model to calculate growth rates for
small perturbations to a circular cell. We find an instability related to
modulations of the wall thickness, leading to growth rates which peak at a
finite wave number.
","[{""version"":""v1"",""created"":""Wed, 7 May 1997 19:04:41 GMT""}]","2009-10-30"
"q-alg/9705006","V. Kuznetsov","Vadim B. Kuznetsov, Evgueni K. Sklyanin","Separation of variables and integral relations for special functions","32 pages, LaTex, no figures","The Ramanujan J. 3 (1999) 5-35","10.1023/A:1009880307186",,"q-alg math.CA math.QA",,"  We show that the method of separation of variables gives a natural
generalisation of integral relations for classical special functions of one
variable. The approach is illustrated by giving a new proof of the
``quadratic'' integral relations for the continuous q-ultraspherical
polynomials. The separating integral operator M expressed in terms of the
Askey-Wilson operator is studied in detail: apart from writing down the
characteristic (``separation'') equations it satisfies, we find its spectrum,
eigenfunctions, inversion, invariants (invariant q-difference operators), and
give its interpretation as a fractional q-integration operator. We also give
expansions of the A1 Macdonald polynomials into the eigenfunctions of the
separating operator M and vice versa.
","[{""version"":""v1"",""created"":""Thu, 8 May 1997 11:22:30 GMT""}]","2015-11-13"
"quant-ph/9705010","Arno Bohm","A. Bohm, M. Loewe, P. Patuleanu and C. Puntmann (Department of
  Physics, University of Texas at Austin)","Jordan Blocks and Exponentially Decaying Higher Order Gamow States","Dedicated to L. P. Horwitz on the occasion of his 65th birthday; 11
  pages, no figures, uses subeqnarray.sty; to appear in Found. of Phys. May 97",,"10.1007/BF02550171","UTEXAS-HEP-96-26 Bohm-141","quant-ph",,"  In the framework of the rigged Hilbert space, unstable quantum systems
associated with first order poles of the analytically continued S-matrix can be
described by Gamow vectors which are generalized vectors with exponential decay
and a Breit-Wigner energy distribution. This mathematical formalism can be
generalized to quasistationary systems associated with higher order poles of
the S-matrix, which leads to a set of Gamow vectors of higher order with a
non-exponential time evolution. One can define a state operator from the set of
higher order Gamow vectors which obeys the exponential decay law. We shall
discuss to what extend the requirement of an exponential time evolution
determines the form of the state operator for a quasistationary microphysical
system associated with a higher order pole of the S-matrix.
","[{""version"":""v1"",""created"":""Wed, 7 May 1997 20:32:40 GMT""}]","2009-10-30"
"quant-ph/9705011","Arno Bohm","A. Bohm, M. Loewe, S. Maxson, P. Patuleanu, C. Puntmann (Department of
  Physics, University of Texas at Austin), and M. Gadella (Faculdad de
  Ciensias, Universidad de Valladolid)","Gamow-Jordan Vectors and Non-Reducible Density Operators from Higher
  Order S-Matrix Poles","39 pages, 3 PostScript figures; sub2.eps may stall some printers and
  should then be printed out separately; ghostview is o.k","J.Math.Phys. 38 (1997) 6072-6100","10.1063/1.532203","UTEXAS-HEP-96-24 Bohm-139","quant-ph",,"  In analogy to Gamow vectors that are obtained from first order resonance
poles of the S-matrix, one can also define higher order Gamow vectors which are
derived from higher order poles of the S-matrix. An S-matrix pole of r-th order
at z_R=E_R-i\Gamma/2 leads to r generalized eigenvectors of order k= 0, 1, ...
, r-1, which are also Jordan vectors of degree (k+1) with generalized
eigenvalue (E_R-i\Gamma/2). The Gamow-Jordan vectors are elements of a
generalized complex eigenvector expansion, whose form suggests the definition
of a state operator (density matrix) for the microphysical decaying state of
this higher order pole. This microphysical state is a mixture of non-reducible
components. In spite of the fact that the k-th order Gamow-Jordan vectors has
the polynomial time-dependence which one always associates with higher order
poles, the microphysical state obeys a purely exponential decay law.
","[{""version"":""v1"",""created"":""Wed, 7 May 1997 22:10:43 GMT""}]","2009-10-30"
"quant-ph/9705012","Christoph Puntmann","C. Puntmann and P. Patuleanu (Dept. of Physics, Univ. of Texas,
  Austin)","Resonances from Higher Order S-Matrix Poles with Exponential Decay","4 pages, no figures, uses group21.sty (included); to appear in
  GROUP21 proceedings vol. 1, H.-D. Doebner et al., eds., World Scientific,
  Singapore",,,"UTEXAS-HEP-97-8","quant-ph",,"  In analogy to Gamow vectors describing resonance states from first order
S-matrix poles, one can define Gamow vectors from higher order poles of the
S-matrix. With these vectors we are going to discuss a density operator that
describes exponentially decaying resonances from higher order poles.
","[{""version"":""v1"",""created"":""Thu, 8 May 1997 00:16:42 GMT""}]","2007-05-23"
"quant-ph/9705013","Christoph Puntmann","Christoph Puntmann","Higher Order Gamow States with Exponential Decay","19 pages, no figures; proceedings of Peyresq/France, Summer 96","Int.J.Theor.Phys. 36 (1997) 2295-2314","10.1007/BF02768926","UTEXAS-HEP-97-9","quant-ph",,"  We derive Gamow vectors from S-matrix poles of higher multiplicity in analogy
to the Gamow vectors describing resonances from first-order poles. With these
vectors we construct a density operator that describes resonances associated
with higher order poles that obey an exponential decay law. It turns out that
this operator formed by these higher order Gamow vectors has a unique
structure.
","[{""version"":""v1"",""created"":""Thu, 8 May 1997 01:12:45 GMT""}]","2015-06-26"
"quant-ph/9705014","Cassius D'Helon","C. D'Helon and G.J.Milburn","Quantum measurements with a quantum computer","9 pages, 3 figures; RevTex",,,,"quant-ph",,"  We present a scheme in which an ion trap quantum computer can be used to make
arbitrarily accurate measurements of the quadrature phase variables for the
collective vibrational motion of the ion. The electronic states of the ion
become the `apparatus', and the method is based on regarding the `apparatus' as
a quantum computer register which can be prepared in appropriate states by
running a Fourier transform algorithm on the data stored within it. The
resolution of the measurement rises exponentially with the number of ions used.
","[{""version"":""v1"",""created"":""Thu, 8 May 1997 03:05:21 GMT""}]","2007-05-23"
"solv-int/9705006","Dr. L. Bordag","L.A. Bordag (Leipzig) and V.S. Dryuma (Kishinev)","Investigation of dynamical systems using tools of the theory of
  invariants and projective geometry","18 pages, Latex, to appear in J. of Applied Mathematics (ZAMP)",,"10.1007/s000330050061","NTZ-Preprint 24/95, Leipzig, 1995","solv-int chao-dyn nlin.CD nlin.SI",,"  The investigation of nonlinear dynamical systems of the type
$\dot{x}=P(x,y,z),\dot{y}=Q(x,y,z),\dot{z}=R(x,y,z)$ by means of reduction to
some ordinary differential equations of the second order in the form
$y''+a_1(x,y)y'^3+3a_2(x,y)y'^2+3a_3(x,y)y'+a_4(x,y)=0$ is done. The main
backbone of this investigation was provided by the theory of invariants
developed by S. Lie, R. Liouville and A. Tresse at the end of the 19th century
and the projective geometry of E. Cartan. In our work two, in some sense
supplementary, systems are considered: the Lorenz system $\dot{x}=\sigma (y-x),
\dot{y}=rx-y-zx,\dot{z}=xy-bz $ and the R\""o\ss ler system
$\dot{x}=-y-z,\dot{y}=x+ay,\dot{z}=b+xz-cz.$. The invarinats for the ordinary
differential equations, which correspond to the systems mentioned abouve, are
evaluated. The connection of values of the invariants with characteristics of
dynamical systems is established.
","[{""version"":""v1"",""created"":""Wed, 7 May 1997 21:34:13 GMT""}]","2018-08-29"
