"alg-geom/9705010","Ron Y. Donagi","Ron Y. Donagi, (UPenn, on leave at IAS)","Seiberg-Witten integrable systems","41 pages, AMS-TeX. To appear in Proceedings of the Santa Cruz
  algebraic geometry conference; and to be reprinted in ""Surveys in
  Differential Geometry"", ed. S.T.Yau",,,,"alg-geom hep-th math.AG",,"  This is a survey of the work of Seiberg and Witten on 4-dimensional N=2
supersymmetric Yang-Mills theory and of some of its recent extensions, written
for mathematicians. The point of view is that of algebraic geometry and
integrable systems. An introductory chapter tries to describe some of the
relevant physics for a reader with no physics background. This is followed by a
review of the relevant properties of integrable systems. The remaining chapters
describe the specific integrable systems used, and include a detailed study of
the applications to quantum field theory.
","[{""version"":""v1"",""created"":""Wed, 7 May 1997 23:04:58 GMT""}]","2009-09-25"
"astro-ph/9705043","Karl D. Gordon","K. D. Gordon, D. Calzetti, A. N. Witt","Dust in Starburst Galaxies","17 pages (9 figures included), to be published in the ApJ","Astrophys.J.487:625-635,1997","10.1086/304654",,"astro-ph",,"  To investigate the nature of starbursts' dust, we constructed a model of the
stars and dust in starburst galaxies and applied it to 30 observed starburst
spectral energy distributions (SEDs). The starburst model was constructed by
combining two stellar evolutionary synthesis models with a model describing the
radiative transfer of stellar photons through dust. The stellar evolutionary
synthesis models were used to compute the dust-free SEDs for stellar
populations with ages between 1x10^6 and 15x10^9 years. Using a Monte Carlo
radiative transfer model, the effects of dust were computed for average Milky
Way (MW) and Small Magellanic Cloud (SMC) dust, two different star/dust
geometries, and locally homogeneous or clumpy dust. Using color-color plots,
the starburst model was used to interpret the behavior of 30 starbursts with
aperture-matched UV and optical SEDs (and IR for 19 of the 30) from previous
studies. From the color-color plots, it was evident that the dust in starbursts
has an extinction curve lacking a 2175 A bump, like the SMC curve, and a steep
far-UV rise, intermediate between the MW and SMC curves. The star/dust geometry
which is able to explain the distribution of the 30 starbursts in various
color-color plots has an inner dust-free sphere of stars surrounded by an outer
star-free shell of clumpy dust. When combined with other work from the
literature on the Orion region and the 30 Dor region of the Large Magellanic
Cloud, this work implies a trend in dust properties with star formation
intensity.
","[{""version"":""v1"",""created"":""Wed, 7 May 1997 19:56:01 GMT""}]","2008-11-26"
"astro-ph/9705048","Tom Barlow","Thomas A. Barlow (CASS/UCSD), F. Hamann (CASS/UCSD), and W. L. W.
  Sargent (Caltech)","Partial Coverage and Time Variability of Narrow-Line Intrinsic QSO
  Absorption Systems","6 pages with 4 figures, LaTex, to appear in ""Mass Ejection From AGN,""
  eds. R.Weymann, I.Shlosman, N.Arav",,,,"astro-ph",,"  It is possible to distinguish ``intrinsic'' absorption systems (gas clouds
within the quasar environment) from ``intervening'' systems (gas clouds
unrelated to the quasar phenomenon) by considering certain observational
properties. We find that the most direct determinations of the intrinsic nature
of a system are time variability and partial coverage of the background light
source by the absorption region. Both of these conditions are unlikely to occur
in intervening systems. We present Keck and HIRES data which demonstrate both
these phenomena. We also summarize a list of several other observational
properties which appear to be indicative of ``intrinsic'' systems.
","[{""version"":""v1"",""created"":""Wed, 7 May 1997 17:59:44 GMT""}]","2007-05-23"
"astro-ph/9705049","F. H. Briggs","F.H. Briggs","Where are the Nearby Gas-Rich LSB Galaxies?","10 pages, 1 figure, 1 table, latex. To appear in ApJL",,,,"astro-ph",,"  The Fisher-Tully `10 Mpc Catalog of Late-Type Galaxies' (FT, 1981) is
remarkably complete. Despite the considerable effort that has been spent
searching for and cataloging low surface brightness (LSB) galaxies, almost no
new HI-rich galaxies have been added to the volume to which the FT observations
were both sensitive (d < 10 (M_{HI}/10^{8.2} Msolar)^{5/12} Mpc) and intended
to be complete (d < 10 Mpc). It has not yet been demonstrated by the new
surveys that HI-rich LSB galaxies are not properly represented in this catalog
of nearby galaxies. Although new optical surveys are discovering heretofore
uncatalogued galaxies at greater distances than the depth of the FT Catalog,
they do not alter the completeness of the FT Catalog for HI-rich LSB objects.
Thus, unless the galaxy population of the local volume is atypical, there is at
present no evidence for a significant, new population of gas-rich galaxies that
has escaped recognition until now.
","[{""version"":""v1"",""created"":""Wed, 7 May 1997 18:43:26 GMT""}]","2007-05-23"
"astro-ph/9705050","Pablo Dmitruk","Pablo Dmitruk (1), Daniel O. Gomez (1 and 2) ((1) Departamento de
  Fisica, Facultad de Ciencias Exactas Y Naturales, Universidad de Buenos
  Aires, (2) IAFE, CONICET)","Turbulent coronal heating and the distribution of nanoflares","12 pages, Latex (AASTeX), 3 figures, ApJ Lett (in press)",,"10.1086/310760",,"astro-ph adap-org nlin.AO physics.plasm-ph",,"  We perform direct numerical simulations of an externally driven
two-dimensional magnetohydrodynamic system over extended periods of time to
simulate the dynamics of a transverse section of a solar coronal loop. A
stationary and large-scale magnetic forcing was imposed, to model the
photospheric motions at the magnetic loop footpoints. A turbulent stationary
regime is reached, which corresponds to energy dissipation rates consistent
with the heating requirements of coronal loops. The temporal behavior of
quantities such as the energy dissipation rate show clear indications of
intermittency, which are exclusively due to the strong nonlinearity of the
system. We tentatively associate these impulsive events of magnetic energy
dissipation to the so-called nanoflares. A statistical analysis of these events
yields a power law distribution as a function of their energies with a negative
slope of 1.5, which is consistent with those obtained for flare energy
distributions reported from X-ray observations.
","[{""version"":""v1"",""created"":""Wed, 7 May 1997 19:12:08 GMT""}]","2009-10-30"
"astro-ph/9705051","Andrew P. Gould","Andrew Gould and Osamu Uza","Upper Limit to the Distance to the Large Magellanic Cloud","Contains new evidence that the ring is elliptical, courtesy of A.P.S.
  Crotts. This raises the upper limit to \mu_lmc < 18.44 +/- 0.05",,"10.1086/305193","OSU-TA-12/97","astro-ph",,"  We remeasure the ``light echo'' times to the near and far side of the ring
around SN 1987A using the method of Gould (1995) and the new reductions of the
original UV spectra by Sonneborn et al. (1996). Under the assumption that the
ring is circular, we obtain an upper limit to the distance to the Large
Magellanic Cloud \mu_lmc < 18.37 +/- 0.04. This result is very close to Gould's
original value, and contradicts claims that the new spectra measurements lead
to a significant increase in the distance estimate and a substantial increase
in the statistical errors. We present new evidence (partly provided by A.P.S.
Crotts) that the ring is intrinsically elliptical, with axis ratio b/a ~ 0.95.
For an elliptical ring, \mu_lmc < 18.44 +/- 0.05. We elaborate on Gould's
original argument that the upper limit is robust, i.e., that it is only weakly
sensitive to unmodeled aspects of the ring such as its hydrodynamic properties
and ionization history.
","[{""version"":""v1"",""created"":""Wed, 7 May 1997 20:35:25 GMT""},{""version"":""v2"",""created"":""Mon, 19 May 1997 21:11:44 GMT""}]","2009-10-30"
"astro-ph/9705052","Ed Fenimore","E. E. Fenimore, M. C. Sumner (Los Alamos National Laboratory)","Relativistic Shells and Gamma-Ray Bursts","to appear in the Proc. All-Sky Observations in the Next Decade
  Workshop, RIKEN Institute, Tokyo Japan March 3-5, 1997",,,"LAUR 97-1675","astro-ph",,"  In many models of Gamma-Ray Bursts (GRBs) relativistic shells are responsible
for the overall envelope of emission. We use kinematics and symmetry to
calculate the time history and spectral evolution expected from a relativistic
shell including effects from intrinsic variations in the shell's intensity and
spectra. We find that the decay phase of an envelope is produced by photons
delayed by the shell's curvature. These delayed photons are produced by regions
that are off-axis such that the spectra evolve according to a universal
function (T^{-1}) regardless of intrinsic variations in the rest frame of the
shell. We compare our predictions to the overall envelope of emission of GRBs.
The observed spectra evolve faster. Intrinsic variations cannot make the
spectra evolve that fast, which adds strength to the ``shell symmetry''
problem: models, in particular, the external shock model, that involve
relativistic shells must either confine the material to narrow pencil beams, be
very inefficient, or break the local spherical symmetry so that the shell acts
like a parallel slab. In the case of the internal shock models involving winds
(i.e., central engines), it will probably be easier to break the local
spherical symmetry, but then one must postulate nearly continuous energy
generation at 10^{51} erg s^{-1} lasting up to hundreds of seconds at the
central site.
","[{""version"":""v1"",""created"":""Wed, 7 May 1997 20:53:51 GMT""}]","2007-05-23"
"astro-ph/9705053","M. S. Brotherton","M. S. Brotherton, Wil van Breugel, Arjun Dey, Robert Antonucci","Spectropolarimetry of FIRST 0840+3633","4 pages, 1 figure. LaTeX with encapsulated postscript. To appear in
  the proceedings of the workshop on ""Mass Ejection from AGN"", Pasadena, 1997
  Feb",,,,"astro-ph",,"  We present Keck spectropolarimetry of a rare ``Iron Lo-BALQSO,'' FIRST
0840+3633. The continuum is 4% polarized near 2000 angstroms rest-frame, but
falls to 2% at longer wavelengths, and maintains a relatively constant position
angle of 50 degrees. The emission lines are unpolarized. The polarization
increases up to 8% in the low-ionization absorption troughs of Mg II 2800 and
Al III 1860. The polarization and its position angle vary in a complicated
manner across the metastable Fe II absorption lines, suggesting that more than
one mechanism is at work or that the system geometry is complex.
","[{""version"":""v1"",""created"":""Thu, 8 May 1997 00:30:33 GMT""}]","2007-05-23"
"cond-mat/9705057","T. Saikawa","A. Ferraz, S. L. Garavelli and T. Saikawa (International Center of
  Condensed Matter Physics, UnB, Brasil)","Non-Fermi Liquid Behaviour in d = 2 Spatial Dimension","10 pages, LaTeX (with REVTeX), 3 Postscript figures, submitted to
  Phys. Rev. Lett",,,,"cond-mat.str-el",,"  We consider a local effective model for fermionic low lying excitations in a
metal. Introducing a boson auxiliary field and taking into account that the
most significant interactions between quasiparticles arise for those which are
near a given point on the Fermi surface, we find that the effective
boson-fermion interaction is singular for a spatial dimension d=2. We
regularize the theory and apply the renormalization group method. As we vary
the coupling constant as a function of an energy scale parameter we show that
the model undergoes a non-perturbative regime in which the Fermi liquid theory
is no longer valid.
","[{""version"":""v1"",""created"":""Wed, 7 May 1997 18:41:16 GMT""}]","2008-02-03"
"cond-mat/9705059","Marco Falcioni","Mark Bowick (Syracuse), Marco Falcioni (Syracuse) and Gudmar
  Thorleifsson (Bielefeld)","Numerical Observation of a Tubular Phase in Anisotropic Membranes","8 pages, LaTeX, REVTEX, final published version","Phys. Rev. Lett. 79 (1997) 885","10.1103/PhysRevLett.79.885","BI-TP-97/12 SU-4240-661","cond-mat.stat-mech",,"  We provide the first numerical evidence for the existence of a tubular phase,
predicted by Radzihovsky and Toner (RT), for anisotropic tethered membranes
without self-avoidance. Incorporating anisotropy into the bending rigidity of a
simple model of a tethered membrane with free boundary conditions, we show that
the model indeed has two phase transitions corresponding to the flat-to-tubular
and tubular-to-crumpled transitions. For the tubular phase we measure the Flory
exponent $\nu_F$ and the roughness exponent $\zeta$. We find $\nu_F=0.305(14)$
and $\zeta=0.895(60)$, which are in reasonable agreement with the theoretical
predictions of RT --- $\nu_F=1/4$ and $\zeta=1$.
","[{""version"":""v1"",""created"":""Wed, 7 May 1997 21:38:29 GMT""},{""version"":""v2"",""created"":""Fri, 13 Jun 1997 18:29:35 GMT""},{""version"":""v3"",""created"":""Tue, 12 Aug 1997 17:51:51 GMT""}]","2009-10-30"
"cond-mat/9705060","Igor Mazin","D.J. Singh and I.I. Mazin","Calculated thermoelectric properties of La-filled skutterudites","4 RevTeX pages (10pt), 3 embedded figures","Phys. Rev. B, v.56, R1650 (1997)","10.1103/PhysRevB.56.R1650",,"cond-mat.mtrl-sci",,"  The thermoelectric properties of La-filled skutterudites are discussed from
the point of view of their electronic structures. These are calculated from
first principles within the local density approximation. The electronic
structure is in turn used to determine transport related quantities. Virtual
crystal calculations for La(Fe,Co)_4Sb_{12} show that the system obeys near
rigid band behavior with varying Co concentration, and has a substantial band
gap at a position corresponding to the composition LaFe_3% CoSb_{12}. The
valence band maximum occurs at the $\Gamma$ point and is due to a singly
degenerate dispersive band, which by itself would not be favorable for high
thermopower. However, very flat transition metal derived bands occur in close
proximity and become active as the doping level is increased, giving a
non-trivial dependence of the properties on carrier concentration and
explaining the favorable thermoelectric properties.
","[{""version"":""v1"",""created"":""Wed, 7 May 1997 16:19:12 GMT""}]","2009-10-30"
"cond-mat/9705061","Alexander Dooglav","M. A. Teplov, Yu. A. Sakhratov, A. V. Dooglav, A. V. Egorov, E. V.
  Krjukov, O. P. Zaitsev","Stripe motion in CuO{2} planes of Y{1-x}Pr{x}Ba{2}Cu{3}O{7} as seen from
  the Cu(2) NQR","3 journal pages + 1 page of Figure captions, 3 Figures. To be
  published in JETP Letters",,,,"cond-mat.supr-con",,"  Pulsed NQR at the frequencies of 28-33 MHz has been used to study copper NQR
spectra in YBa{2}Cu{3}O{7}, TmBa{2}Cu{3}O{7} and Y{0.9}Pr{0.1}Ba{2}Cu{3}O{7}
compounds at temperatures of 4.2-200K. Quantitative analysis of the spectra has
shown that the ""plane"" Cu(2) spectra shape is well described by using a model
of 1D correlations of charge and spin distribution in CuO{2} planes (stripe
correlations). In the undoped superconductors the charge-spin stripe structure
moves fast in the CuO{2} planes, but doping the YBa{2}Cu{3}O{7} lattice with
praseodymium slows this motion down.
","[{""version"":""v1"",""created"":""Wed, 7 May 1997 16:30:49 GMT""}]","2008-02-03"
"cond-mat/9705062","Leonardo Angelini","L. Angelini, M. Pellicoro, I. Sardella, M. Villani","Variational method and duality in the 2D square Potts model","20 pages, 5 EPS figures","J. Phys. A: Math Gen. 30 (1997) 7677-7693","10.1088/0305-4470/30/22/008","BARI-TH 97-263","cond-mat.stat-mech cond-mat.dis-nn",,"  The ferromagnetic q-state Potts model on a square lattice is analyzed, for
q>4, through an elaborate version of the operatorial variational method. In the
variational approach proposed in the paper, the duality relations are exactly
satisfied, involving at a more fundamental level, a duality relationship
between variational parameters. Besides some exact predictions, the approach is
very effective in the numerical estimates over the whole range of temperature
and can be systematically improved.
","[{""version"":""v1"",""created"":""Wed, 7 May 1997 17:51:09 GMT""}]","2009-10-30"
"cond-mat/9705063","Stuart A. Trugman","Janez Bonca (1 and 2), S. A. Trugman (1) ((1) Los Alamos National Lab,
  (2) J. Stefan Institute and U. Ljubljana)","Inelastic Quantum Transport","revtex, 13 pages, 4 figures",,"10.1103/PhysRevLett.79.4874",,"cond-mat.str-el",,"  We solve a Schrodinger equation for inelastic quantum transport that retains
full quantum coherence, in contrast to previous rate or Boltzmann equation
approaches. The model Hamiltonian is the zero temperature 1d Holstein model for
an electron coupled to optical phonons (polaron), in a strong electric field.
The Hilbert space grows exponentially with electron position, forming a
non-standard Bethe lattice. We calculate nonperturbatively the transport
current, electron-phonon correlations, and quantum diffusion. This system is a
toy model for the constantly branching ``wavefunction of the universe''.
","[{""version"":""v1"",""created"":""Wed, 7 May 1997 19:04:25 GMT""}]","2009-10-30"
"cond-mat/9705064","Phillip Broussard","P. R. Broussard, S. B. Qadri and V. C. Cestone (Naval Research
  Laboratory, Washington, DC)","X-ray photoemission spectroscopy of La(0.67)Ca(0.33)MnO(3) films","7 pages, 6 jpg figures, to appear in Applied Surface Science","Appl. Surf. Sci. 115, 80 (1997)","10.1016/S0169-4332(96)00848-3",,"cond-mat.str-el",,"  We have performed x-ray photoemission spectroscopy (XPS) on thin films of
(001) and (200) oriented La(0.67)Ca(0.33)MnO(3) grown on (100) and (110)
SrTiO(3) substrates by off-axis sputtering. The films were examined by XPS
without exposing them to air. We have compared the core levels and the valence
spectra between the two different orientations, as well as after the effects of
air exposure and annealing in UHV. We find that the surfaces are very stable
against exposure to air. Comparing the measured intensity ratios to a model for
the uniform termination of the film shows the terminating layer to be MnO(2)
for both the (001) and (200) oriented La(0.67)Ca(0.33)MnO(3) films.
","[{""version"":""v1"",""created"":""Wed, 7 May 1997 20:59:55 GMT""}]","2009-10-30"
"cond-mat/9705065","Jungsoo Kim","Jungsoo Kim and D. Coffey (SUNY, Buffalo)","Single-Particle Properties of a Two-Dimensional Fermi Liquid at finite
  Frequencies and Temperatures","Revtex, 15 pages with 13 figures. minor corrections. Accepted for
  publication in Phy. Rev. B",,"10.1103/PhysRevB.57.542",,"cond-mat.str-el",,"  We review the leading momentum, frequency and temperature dependences of the
single particle self-energy and the corresponding term in the entropy of a two
dimensional Fermi liquid (FL) with a free particle spectrum. We calculate the
corrections to these leading dependences for the paramagnon model and the
electron gas and find that the leading dependences are limited to regions of
energy and temperature which decrease with decreasing number density of
fermions. This can make it difficult to identify the frequency and temperature
dependent characteristics of a FL ground state in experimental quantities in
low density systems even when complications of band structure and other degrees
of freedom are absent. This is an important consideration when the normal state
properties of the undoped cuprate superconductors are analyzed.
","[{""version"":""v1"",""created"":""Wed, 7 May 1997 21:16:29 GMT""},{""version"":""v2"",""created"":""Fri, 26 Sep 1997 18:59:56 GMT""}]","2009-10-30"
"cond-mat/9705066","Randall D. Kamien","J. David Moroz, Randall D. Kamien","Self-Avoiding Walks with Writhe","20 pages, LaTex. Requires epsf and psfig. One included eps file.
  Revision adds a reference","Nucl.Phys. B506 (1997) 695-710",,,"cond-mat.stat-mech cond-mat.soft hep-th",,"  We map self-avoiding random walks with a chemical potential for writhe to the
three-dimensional complex O(N) Chern-Simons theory as N -> 0. We argue that at
the Wilson-Fisher fixed point which characterizes normal self-avoiding walks
(with radius of gyration exponent nu = 0.588) a small chemical potential for
writhe is irrelevant and the Chern-Simons field does not modify the monomer-
monomer correlation function. For a large chemical potential the polymer
collapses.
","[{""version"":""v1"",""created"":""Thu, 8 May 1997 01:56:43 GMT""},{""version"":""v2"",""created"":""Sun, 11 May 1997 18:44:10 GMT""}]","2008-02-03"
"cond-mat/9705067","Yasuko Munehisa","Tomo Munehisa and Yasuko Munehisa","Quantum Monte Carlo Study of an Extended Hubbard Model on a Two-leg
  Ladder","12 pages, latex, 5 eps figures, to appear in J. Phys. Soc. Jpn. In
  order to make our discussions abundantly clear we added one figure and
  rewrote the section 4. A few references are also added",,"10.1143/JPSJ.66.3876",,"cond-mat.str-el",,"  An extended Hubbard model on a two-leg ladder is numerically studied by means
of the quantum Monte Carlo techniques. The model we study has the
nearest-neighbor interactions which are repulsive along chains and attractive
for rungs. The plots of the doping parameter versus the chemical potential show
two cliff-like regions and a large plateau region. Results on the charge
susceptibility suggest it diverges in these cliff-like regions. These
observations might imply a signal to the phase separation, which should be
related to the effective attractive interactions along chains.
","[{""version"":""v1"",""created"":""Thu, 8 May 1997 02:41:44 GMT""},{""version"":""v2"",""created"":""Tue, 16 Sep 1997 05:28:59 GMT""}]","2009-10-30"
"cond-mat/9705068","Mahito Kohmoto","D. Lidsky, J. Shiraishi, Y. Hatsugai and M. Kohmoto","Simple Exactly Solvable Models of non-Fermi Liquids","Revtex",,"10.1103/PhysRevB.57.1340",,"cond-mat.str-el",,"  We generalize the model of Hatsugai and Kohmoto [J. Phys. Soc. Jpn, 61, 2056
(1992)] and find ground states which do not show the properties of Fermi
liquids. We work in two space dimensions, but it is straightforward to
generalize to higher dimensions. The ground state is highly degenerate and
there is no discontinuity in the momentum distribution; i.e., there is no Fermi
surface. The Green's function generically has a branch cut.
","[{""version"":""v1"",""created"":""Thu, 8 May 1997 04:07:49 GMT""}]","2016-08-31"
"cond-mat/9705069","Y. Motome","Yukitoshi Motome and Masatoshi Imada (ISSP, Univ. Tokyo)","A Quantum Monte Carlo Method and Its Applications to Multi-Orbital
  Hubbard Models","10 pages LaTeX including 2 PS figures, to appear in J.Phys.Soc.Jpn",,"10.1143/JPSJ.66.1872",,"cond-mat.str-el",,"  We present a framework of an auxiliary field quantum Monte Carlo (QMC) method
for multi-orbital Hubbard models. Our formulation can be applied to a
Hamiltonian which includes terms for on-site Coulomb interaction for both
intra- and inter-orbitals, intra-site exchange interaction and energy
differences between orbitals. Based on our framework, we point out possible
ways to investigate various phase transitions such as metal-insulator, magnetic
and orbital order-disorder transitions without the minus sign problem. As an
application, a two-band model is investigated by the projection QMC method and
the ground state properties of this model are presented.
","[{""version"":""v1"",""created"":""Thu, 8 May 1997 07:00:13 GMT""},{""version"":""v2"",""created"":""Tue, 27 May 1997 07:17:38 GMT""}]","2009-10-30"
"cond-mat/9705070","Dalfovo Franco","Jan Harms, J.Peter Toennies and Franco Dalfovo","Density of Superfluid Helium Droplets","27 pages, REVTeX, 5 postscript figures","Phys. Rev. B, 58 (1998) 3341","10.1103/PhysRevB.58.3341",,"cond-mat",,"  The classical integral cross sections of large superfluid 4He_N droplets and
the number of atoms in the droplets (N=10^3-10^4) have been measured in
molecular beam scattering experiments. These measurements are found to be in
good agreement with the cross sections predicted from density functional
calculations of the radial density distributions with a 10-90 % surface
thickness of 5.7\AA. By using a simple model for the density profile of the
droplets a thickness of about 6-8\AA is extracted directly from the data.
","[{""version"":""v1"",""created"":""Thu, 8 May 1997 08:28:37 GMT""}]","2009-10-30"
"cond-mat/9705071","Varelogiannis Giorgos","Georgios Varelogiannis (FORTH-IESL Heraklion) and Martin Peter
  (University of Geneva)","Topological asymmetry in the damping-pairing contribution of
  electron-boson scattering","LATEX file and 3 Postscript figures",,"10.1209/epl/i1997-00373-4",,"cond-mat",,"  We make a harmonic analysis of the pairing and damping contribution of a
finite $k$ range isotropic electron-phonon (or other boson) scattering in an
anisotropic two-dimensional electronic system. We show that the pairing
contribution of the anisotropic part of the electronic system can be much
larger than its damping contribution enhancing significantly T_c. The higher is
the order of the harmonic of the electronic anisotropy, smaller is its damping
contribution and higher can be the asymmetry in its damping-pairing
contribution. This could explain the puzzle of a much broader quasiparticle
peak in the n-doped than in the p-doped cuprates, their smaller T_c's being
also attributed to larger damping effects.
","[{""version"":""v1"",""created"":""Thu, 8 May 1997 09:31:36 GMT""}]","2016-08-31"
