"astro-ph/9705203","Zeljko Ivezic","Z. Ivezic & D. M. Christodoulou","Infrared Search for Young Stars in HI High-velocity Clouds","9 pages, 4 JPEG figures. PostScript figures available from authors",,"10.1086/304549",,"astro-ph",,"  We have searched the IRAS Point Source Catalog and HIRES maps for young
stellar objects (YSOs) in the direction of five \HI high-velocity clouds
(HVCs). In agreement with optical searches in the halo, no evidence was found
for extensive star-forming activity inside the high-latitude HVCs.
Specifically, we have found no signs of star formation or YSOs in the direction
of the A IV cloud or in the very-high-velocity clouds HVC~110-7-465 and
HVC~114-10-440. We have identified only one young star in the direction of the
M~I.1 cloud, which shows almost perfect alignment with a knot of \HI emission.
Because of the small number of early-type stars observed in the halo, the
probability for such a positional coincidence is low; thus, this young star
appears to be physically associated with the M~I.1 cloud. We have also
identified a good YSO candidate in the \HI shell-like structure observed in the
core region of the low-latitude cloud complex H (HVC~131+1-200). This region
could be a supernova remnant with several other YSO candidates formed along the
shock front produced by the explosion. In agreement with recent theoretical
estimates, these results point to a low but significant star-formation rate in
intermediate and high Galactic latitude HVCs. For M~I.1 in particular, we
estimate that the efficiency of the star-formation process is $M(YSO)/M(\HI)\ga
10^{-4}-10^{-3}$ by mass. Such efficiency is sufficient to account for (a) the
existence of the few young blue stars whose ages imply that they were born in
the Galactic halo, and (b) the nonprimordial metallicities inferred for some
HVCs if their metal content proves to be low.
","[{""version"":""v1"",""created"":""Sun, 25 May 1997 19:08:43 GMT""}]","2009-10-30"
"astro-ph/9705204",,"John M. Dickey (Univ. of Minnesota and ATNF)","Absorption of the Linear Polarization of the Galactic Background
  Radiation by the $\lambda$21-cm Line of HI","13 pages, 3 figures, Latex, see
  http://ast1.spa.umn.edu/john/Galpol.html to be published in Astrophysical
  Journal, 1997 October 10",,"10.1086/304707",,"astro-ph",,"  Absorption lines at $\lambda$ 21-cm are detected in the Stokes Q and U
components of the Galactic synchrotron background. The lower limit distance
implied for the emission region is 2 kpc in the direction (l,b) =
(329.5$^{\circ}$,+1.15$^{\circ}$). The Australia Telescope Compact Array has
the capability of mapping this absorption over large areas of the Galactic
plane. Observations like these have the potential to reveal the three
dimensional structure of the Galactic synchrotron emission throughout the Milky
Way disk.
","[{""version"":""v1"",""created"":""Mon, 26 May 1997 04:31:00 GMT""}]","2009-10-30"
"astro-ph/9705205","Pascal de Theije","Pascal de Theije (Leiden Observatory), Eelco van Kampen (TAC), Remco
  Slijkhuis","Properties of galaxy clusters in N-body simulations: Intrinsic
  properties","21 pages, Latex (mn.sty), 16 figures",,"10.1046/j.1365-8711.1998.01457.x",,"astro-ph",,"  We study the influence of the various parameters of scenarios of large-scale
structure formation on properties of galaxy clusters, and investigate which
cluster properties are most sensitive to these parameters. We present a set of
large N-body simulations and derive the intrinsic properties of galaxy clusters
in these simulations, which represent a volume of $256^3 h^{-3}$ Mpc^3. The
cosmological scenarios studied differ in either the shape of the power spectrum
of initial fluctuations, its normalization, the density parameter $\Omega_{0}$,
or the Hubble parameter $H_{0}$. Between each of the simulations, only one
parameter is set differently, so that we can study the influence of that
parameter on the cluster properties. The cluster properties that are studied
are the mass, line-of-sight velocity dispersion, peculiar velocity, intrinsic
shape, and orientation with respect to its surroundings. $\sigma_{8}$ has a
large impact on the cluster properties. The latter, viz. the cluster number
density, mass, line-of-sight velocity dispersion and peculiar velocity, are
also determined by $\Omega_{0}$, though somewhat less. Other parameters, such
as $H_{0}$, the tilt of the initial fluctuation spectrum, and the exact shape
of this spectrum, are generally less important. Unlike the other cluster
properties studied, the peculiar velocity is found to depend on all parameters
of the formation scenario. Using scaling relations between the average
properties of the cluster sample and the parameters of the formation scenario,
one may try and interpolate between the scenarios studied here in order to find
the parameters of the scenario that is most consistent with the data.
","[{""version"":""v1"",""created"":""Mon, 26 May 1997 06:15:48 GMT""},{""version"":""v2"",""created"":""Thu, 5 Jun 1997 07:24:50 GMT""},{""version"":""v3"",""created"":""Mon, 30 Jun 1997 07:35:50 GMT""}]","2016-08-30"
"astro-ph/9705206",,"G. Cayrel de Strobel (1), C. Soubiran (2), E.D. Friel (NSF), N. Ralite
  (2), P. Francois (1) ((1) Paris-Meudon Obs., (2) Bordeaux Obs.)","A catalogue of [Fe/H] determinations : 1996 edition","7 pages (Latex, A&A style), 4 PostScript figures, to be published in
  A&A Supplement Series in july",,"10.1051/aas:1997194",,"astro-ph",,"  The Catalogue of [Fe/H] determinations has been updated and now includes 5946
determinations for 3247 stars (with 751 stars in 84 associations, clusters or
galaxies). The 700 bibliographical references are complete up to December 1995
and refer only to [Fe/H] determinations obtained from high-resolution
spectroscopic observations. The Catalogue also gives the spectral type, the
object type, the visual magnitude and colour, as well as determinations of the
effective temperature and gravity for each star, when available. In this paper,
we comment on the Catalogue, the parameters listed in it, its stellar
content,and the precautions that should be observed when using it. The full
Catalogue is only available in electronic form at the CDS or upon request
(soubiran@observ.u-bordeaux.fr).
","[{""version"":""v1"",""created"":""Mon, 26 May 1997 09:46:25 GMT""}]","2009-10-30"
"astro-ph/9705207","Paola Andreani","P. Andreani (Univ. of Padova, Italy) A. Franceschini (Univ. of Padova,
  Italy) G.L. Granato (Oss. of Padova, Italy)","Far-IR and MM Properties of Quasars","6 Latex pages, macros and 3 ps figures included, to appear in the
  Proc. of the IRAM/ESA Sympsosium 'The Far-IR and Sub-mm Universe' Grenoble,
  april 15-17 1997",,,,"astro-ph",,"  We use photometric data, from the optical to the mm for a large sample of
optically selected radio-quiet quasars, at low and high redshifts, to test
emission models from circum-nuclear dusty torii around them. Model parameters,
such as dust mass, temperature distributions and torus sizes are inferred,
under the assumption that the dust is heated only by the central nuclear
source. Dependences of best-fit parameters on luminosity and redshift are
studied and the contribution of dust in the host galaxy to the observed fluxes
is briefly mentioned. Only tentative conclusions can be drawn from this yet
large dataset and detailed modelling, because crucial spectral information is
missing at wavelengths where the QSO dust emission is more prominent, i.e. at
$\lambda \simeq 50$ to 600 $\mu m$. Poor information in this wavelength range
affects our understanding not only of the high-redshift objects, but also of
the low-redshift sample. We then expect fundamental contributions by the FIRST
mission in this field, which is obviously related to the more general one of
galaxy formation.
","[{""version"":""v1"",""created"":""Mon, 26 May 1997 09:47:11 GMT""}]","2007-05-23"
"astro-ph/9705208","Carsten van de Bruck","Carsten van de Bruck (Institut fuer Astrophysik, Bonn, Germany)","Cosmic String Network Evolution in arbitrary Friedmann-Lemaitre models","8 pages, 4 postscript figures included, submitted to Phys. Rev. D","Phys.Rev. D57 (1998) 1306-1308","10.1103/PhysRevD.57.1306",,"astro-ph",,"  We use the velocity-dependent one-scale model by Martins & Shellard to
investigate the evolution of a GUT long cosmic string network in arbitrary
Friedmann-Lemaitre models. Four representative models are used to show that in
general there is no scaling solution. The implications for structure formation
are briefly discussed.
","[{""version"":""v1"",""created"":""Mon, 26 May 1997 13:13:38 GMT""}]","2009-10-30"
"cond-mat/9705255","A. F. Barabanov","L.A. Maksimov (Kurchatov Institute, Moscow), A.F.Barabanov (Institute
  for High Pressure Physics, Troitsk), R.O. Kuzian (Institute for Materials
  Science, Kiev)","One Spin-Polaron Problem in the Two-Dimensional Kondo-Lattice","7 pages, revtex, 4 figures, to be published in Phys.Lett.A",,"10.1016/S0375-9601(97)00372-1",,"cond-mat.str-el",,"  Within the frameworks of spin-polaron concept and the spherically symmetric
state for the antiferromagnetic spin background, the one-particle motion is
studied for two-dimensional Kondo-lattice. The elemetary excitations are
represented as a Bloch superposition of four one-site electron states: two
local states- a bare electron state and a local spin-polaron of small radius,
and two states of delocalized polarons which correspond to the coupling of
local states to the antiferromagnetic spin wave with momentum Q=(pi,pi), so
called Q-polarons. As a remarkable result we show that the lowest band of
elementary excitations is essentially determined by Q-polaron states in
strongly coupled regime. The account of Q-polarons shifts the band bottom from
(pi,pi) to (0,0). The spectral weight of a bare particle in the lowest band
states can greatly differ from 1. This may lead to a large Fermi surface for
relatively small particle concentration.
","[{""version"":""v1"",""created"":""Mon, 26 May 1997 07:55:17 GMT""}]","2009-10-30"
"cond-mat/9705256","Max Petersen","Michel Bockstedte, Alexander Kley, Joerg Neugebauer, and Matthias
  Scheffler","Density-functional theory calculations for poly-atomic systems:
  Electronic structure, static and elastic properties and ab initio molecular
  dynamics","50 pages, 1 figure, subm. to Comp. Phys. Comm. Code available from
  http://www.rz-berlin.mpg.de/th/fhi96md.html or by downloading the source",,"10.1016/S0010-4655(97)00117-3",,"cond-mat",,"  The package ""fhi96md"" is an efficient code to perform density-functional
theory total-energy calculations for materials ranging from insulators to
transition metals. The package employs first-principles pseudopotentials, and a
plane-wave basis-set. For exchange and correlation both the local density and
generalized gradient approximations are implemented. The code has a low storage
demand and performs efficiently on low budget personal computers as well as
high performance computers.
","[{""version"":""v1"",""created"":""Mon, 26 May 1997 10:52:11 GMT""}]","2009-10-30"
"cond-mat/9705257","Robert Urbanczik","W. Kinzel and R. Urbanczik","On-line learning in a discrete state space","7 pages, 1 Figure, Latex, submitted to J.Phys.A",,,"WUE-ITP-97-013","cond-mat",,"  On-line learning of a rule given by an N-dimensional Ising perceptron, is
considered for the case when the student is constrained to take values in a
discrete state space of size $L^N$. For L=2 no on-line algorithm can achieve a
finite overlap with the teacher in the thermodynamic limit. However, if $L$ is
on the order of $\sqrt{N}$, Hebbian learning does achieve a finite overlap.
","[{""version"":""v1"",""created"":""Mon, 26 May 1997 10:04:29 GMT""}]","2007-05-23"
"cond-mat/9705258","Goetz S. Uhrig","Goetz S. Uhrig (Universitaet zu Koeln)","Symmetry and dimension of the magnon dispersion of inorganic
  spin-Peierls systems","4 pages, Revtex, to appear in PRL","Phys. Rev. Lett. 79, 163 (1997)","10.1103/PhysRevLett.79.163","THP-MH-9711","cond-mat.str-el",,"  The data on the dispersion of the magnetic excitations of CuGeO_3 in the
spin-Peierls dimerized phase are analyzed. On the basis of the lattice
structure it is shown that even along the chains the $d=2$ character cannot be
neglected. The symmetry of the dispersion differs from the one assumed so far.
The magnetic resonance data is reinterpreted. The possibility of interchain
rather than intrachain frustration is discussed.
","[{""version"":""v1"",""created"":""Mon, 26 May 1997 11:07:52 GMT""}]","2009-10-30"
"cond-mat/9705259","Heinz Horner","Heinz Horner and Anthea Bethge","Bounds on learning in polynomial time","12 pages Latex with 8 eps figures",,"10.1080/13642819808205041",,"cond-mat.dis-nn",,"  The performance of large neural networks can be judged not only by their
storage capacity but also by the time required for learning. A polynomial
learning algorithm with learning time $\sim N^2$ in a network with $N$ units
might be practical whereas a learning time $\sim e^N$ would allow rather small
networks only. The question of absolute storage capacity $\alpha_c$ and
capacity for polynomial learning rules $\alpha_p$ is discussed for several
feed-forward architectures, the perceptron, the binary perceptron, the
committee machine and a perceptron with fixed weights in the first layer and
adaptive weights in the second layer. The analysis is based partially on
dynamic mean field theory which is valid for $N\to\infty$. Especially for the
committee machine a value $\alpha_p$ considerably lower than the capacity
predicted by replica theory or simulations is found. This discrepancy is
resolved by new simulations investigating the learning time dependence and
revealing subtleties in the definition of the capacity.
","[{""version"":""v1"",""created"":""Mon, 26 May 1997 14:06:00 GMT""}]","2017-02-08"
"funct-an/9705004","William Arveson","William Arveson","Pure E_0-semigroups and absorbing states","27 pp. AMS-TeX 2.0",,"10.1007/s002200050128",,"funct-an math.OA",,"  An E_0-semigroup acting on B(H) is called pure if the intersection of the
ranges $\alpha_t(B(H))$, $t>0$, is the algebra of scalars. We determine all
pure E_0-semigroups which have a weakly continuous invariant state $\omega$ and
which are minimal in an appropriate sense. In such cases, for every normal
state $\rho$ there is convergence to equilibrium in the trace norm
$\lim_{t\to\infty}\| \rho\circ\alpha_t - \omega \| = 0.$ A normal state
$\omega$ with this property is called an absorbing state. Such E_0-semigroups
mest be cocycle perturbations of CAR/CCR flows, and we develop systematic
methods for constructing those perturbations which have absorbing states with
prescribed finite eigenvalue lists.
","[{""version"":""v1"",""created"":""Sun, 25 May 1997 18:36:11 GMT""}]","2009-10-30"
"funct-an/9705005","William Arveson","William Arveson","The index of a quantum dynamical semigroup","26 pp. AMS-TeX 2.0",,,,"funct-an math.OA",,"  A numerical index is introduced for semigroups of completely positive maps of
$\Cal B(H)$ which generalizes the index of E_0-semigroups. It is shown that the
index of a unital completely positive semigroup agrees with the index of its
dilation to an E_0-semigroup, provided that the dilation is minimal.
","[{""version"":""v1"",""created"":""Sun, 25 May 1997 19:19:50 GMT""}]","2008-02-03"
"funct-an/9705006","William Arveson","William Arveson","On the index and dilations of completely positive semigroups","31 pp. AMS-TeX 2.0",,,,"funct-an math.OA",,"  It is known that every semigroup of normal completely positive maps $P =
{P_t: t\geq 0}$ of $B(H)$, satisfying $P_t(1) = 1$ for every $t\geq 0$, has a
minimal dilation to an E_0-semigroup acting on $B(K)$ for some Hilbert space K
containing H. The minimal dilation of P is unique up to conjugacy. In a
previous paper a numerical index was introduced for semigroups of completely
positive maps and it was shown that the index of P agrees with the index of its
minimal dilation to an E_0-semigroup. However, no examples were discussed, and
no computations were made. In this paper we calculate the index of a unital
completely positive semigroup whose generator is a bounded operator $ L:
B(H)\to B(H) $ in terms of natrual structures associated with the generator.
This includes all unital CP semigroups acting on matrix algebras. We also show
that the minimal dilation of the semigroup $P={\exp{tL}: t\geq 0}$ to an \esg\
is is cocycle conjugate to a CAR/CCR flow.
","[{""version"":""v1"",""created"":""Sun, 25 May 1997 19:24:10 GMT""}]","2008-02-03"
"gr-qc/9705066","Hideo Kodama","Hideo Kodama(YITP, Kyoto University)","Canonical Structure of Locally Homogeneous Systems on Compact Closed
  3-Manifolds of Types $E^3$, Nil and Sol","62 pages, LaTeX","Prog.Theor.Phys. 99 (1998) 173-236","10.1143/PTP.99.173","YITP-97-25","gr-qc",,"  In this paper we investigate the canonical structure of diffeomorphism
invariant phase spaces for spatially locally homogeneous spacetimes with
3-dimensional compact closed spaces. After giving a general algorithm to
express the diffeomorphism-invariant phase space and the canonical structure of
a locally homogeneous system in terms of those of a homogeneous system on a
covering space and a moduli space, we completely determine the canonical
structures and the Hamiltonians of locally homogeneous pure gravity systems on
orientable compact closed 3-spaces of the Thurston-type $E^3$, $\Nil$ and
$\Sol$ for all possible space topologies and invariance groups. We point out
that in many cases the canonical structure becomes degenerate in the moduli
sectors, which implies that the locally homogeneous systems are not canonically
closed in general in the full diffeomorphism-invariant phase space of generic
spacetimes with compact closed spaces.
","[{""version"":""v1"",""created"":""Mon, 26 May 1997 06:43:54 GMT""}]","2009-10-30"
"gr-qc/9705067","Peter Peldan","Soren Holst and Peter Peldan","Black Holes and Causal Structure in Anti-de Sitter Isometric Spacetimes","LaTeX, 22 pages, 10 postscript figures, uses epsf.tex","Class.Quant.Grav. 14 (1997) 3433-3452","10.1088/0264-9381/14/12/025","USITP 97-7","gr-qc",,"  The observation that the 2+1 dimensional BTZ black hole can be obtained as a
quotient space of anti-de Sitter space leads one to ask what causal behaviour
other such quotient spaces can display. In this paper we answer this question
in 2+1 and 3+1 dimensions when the identification group has one generator.
Among other things we find that there does not exist any 3+1 generalization of
the rotating BTZ hole. However, the non-rotating generalization exists and
exhibits some unexpected properties. For example, it turns out to be non-static
and to possess a non-trivial apparent horizon.
","[{""version"":""v1"",""created"":""Mon, 26 May 1997 13:33:45 GMT""}]","2009-10-30"
"hep-lat/9705034","Hartmut Wittig","Hartmut Wittig","Leptonic Decays of Heavy Quarks on the Lattice","Invited review to be published in Int. J. Mod. Phys. A, 63 pages,
  LaTeX, ijmpa1.sty (included), 8 postscript figures","Int.J.Mod.Phys. A12 (1997) 4477-4538","10.1142/S0217751X97002449","OUTP 97-20P","hep-lat hep-ph",,"  The status of lattice calculations of heavy-light decay constants and of the
$B$ parameter $B_B$ is reviewed. After describing the lattice approach to heavy
quark systems, the main results are discussed, with special emphasis on the
systematic errors in present lattice calculations. A detailed analysis of the
continuum limit for decay constants is performed. The implications of lattice
results on studies of CP violation in the Standard Model are discussed.
","[{""version"":""v1"",""created"":""Mon, 26 May 1997 15:20:28 GMT""}]","2009-10-30"
"hep-lat/9705035","Yoshinobu Kuramashi","JLQCD Collaboration: S.Aoki, M.Fukugita, S.Hashimoto, N.Ishizuka,
  Y.Iwasaki, K.Kanaya, Y.Kuramashi, M.Okawa, A.Ukawa, T.Yoshi\'e","Lattice QCD Calculation of the Kaon B-parameter with the Wilson Quark
  Action","11 pages, latex source-file, 4 figures as ps-file","Phys.Rev.Lett. 81 (1998) 1778-1781","10.1103/PhysRevLett.81.1778","KEK-CP-54","hep-lat",,"  The kaon B parameter is calculated in quenched lattice QCD with the Wilson
quark action. The mixing problem of the \Delta s=2 four-quark operators is
solved non-perturbatively with full use of chiral Ward identities, and this
method enables us to construct the weak four-quark operators exhibiting good
chiral behavior. We find B_K(NDR, 2GeV)=0.562(64) in the continuum limit, which
agrees with the value obtained with the Kogut-Susskind quark action.
","[{""version"":""v1"",""created"":""Mon, 26 May 1997 15:22:42 GMT""}]","2019-08-17"
"hep-lat/9705036","Yoshinobu Kuramashi","Yoshinobu Kuramashi","Perturbative Renormalization Factors of Bilinear Operators for Massive
  Wilson Quarks on the Lattice","43 pages, latex source-file, 12 figures as ps-file. Our result is
  compared with the static and the NRQCD ones","Phys.Rev. D58 (1998) 034507","10.1103/PhysRevD.58.034507","KEK-CP-55","hep-lat",,"  Renormalization factors for local vector and axial vector currents for the
Wilson quark action are perturbatively calculated to one loop order including
finite quark masses from the ratio of the on-shell quark matrix elements in the
Feynman gauge defined on the lattice and in the continuum. For large quark
masses of order unity in lattice units, we find that finite quark mass effects
are quite large: one-loop coefficients of the renormalization factors differ by
100% compared to those in the massless limit.
","[{""version"":""v1"",""created"":""Mon, 26 May 1997 15:25:13 GMT""},{""version"":""v2"",""created"":""Wed, 15 Apr 1998 10:20:40 GMT""}]","2009-10-30"
"hep-ph/9705414","John March-Russell","K.S. Babu, Christopher Kolda, and John March-Russell (Institute for
  Advanced Study, Princeton)","Implications of a charged-current anomaly at HERA","10 pages Latex. Corrected 3-body decay widths","Phys.Lett. B408 (1997) 261-267","10.1016/S0370-2693(97)00766-1","IASSNS-HEP-97-64","hep-ph hep-ex",,"  We demonstrate that in the presence of mixing between different scalar
leptoquark multiplets it is possible to simultaneously account for the HERA
high-$Q^2$ neutral current anomaly, and produce a charged current anomaly of
comparable magnitude. The reduced branching ratio to electrons and jets of the
lightest leptoquark state results in a significant weakening of the CDF/D0
limits on scalar leptoquarks; masses consistent with the HERA neutral current
excess are comfortably within the allowed range. We show that the possibilities
for such a successful mixed leptoquark scenario are quite limited, and we
investigate some aspects of their phenomenology.
","[{""version"":""v1"",""created"":""Sun, 25 May 1997 21:06:15 GMT""},{""version"":""v2"",""created"":""Tue, 3 Jun 1997 16:22:29 GMT""},{""version"":""v3"",""created"":""Thu, 19 Jun 1997 02:09:57 GMT""}]","2009-10-30"
"hep-ph/9705417","Junji Hisano","J. Hisano and M. Shifman (Univ. of Minnesota)","Exact Results for Soft Supersymmetry Breaking Parameters in
  Supersymmetric Gauge Theories","One correction, one reference added; the final version to be
  published in Phys. Rev. D","Phys.Rev. D56 (1997) 5475-5482","10.1103/PhysRevD.56.5475","TPI-MINN-97/14-T, UMN-TH-1543-97","hep-ph hep-th",,"  We obtain exact relations (valid to all orders in the coupling constant) for
the running gaugino mass in supersymmetric gauge theories, treating the soft
supersymmetry breaking effects in the linear approximation. If a supersymmetry
breaking squark (selectron) mass term is introduced, our relation connects the
renormalization group equation for this term with that for the gaugino mass.
Exact relations for the threshold effects in the gaugino masses are derived.
The key ingredients of our analysis is the use of the Wilsonean action and
holomorphy of this action with respect to relevant parameters.
","[{""version"":""v1"",""created"":""Sun, 25 May 1997 23:25:05 GMT""},{""version"":""v2"",""created"":""Fri, 5 Sep 1997 00:32:21 GMT""}]","2009-10-30"
"hep-ph/9705418","Jacek Ziabicki","Merle Michael Robinson and Jacek Ziabicki","Spontaneous CP Violation in Models with Anomalous U(1)","14 pages, 1 figure included in text, plain LaTeX",,,"EFI-97-22","hep-ph",,"  We examine a class of Froggatt-Nielsen models with an anomalous U(1) as the
flavor dependent symmetry. Anomaly cancellation and unbroken supersymmetry
impose constraints on the U(1)_X charges of the fermions and the vacuum
expectation values of the symmetry-breaking scalars. We show by example that it
is possible to find models that reproduce the observed masses and mixings of
the standard model fermions, and exhibit a realistic amount of CP violation.
","[{""version"":""v1"",""created"":""Mon, 26 May 1997 02:23:10 GMT""}]","2007-05-23"
"hep-ph/9705419","Seungho Choe","Seungho Choe (Yonsei University)","Multiquark states and QCD sum rules","Latex, 6 pages, 2 ps figures. Talk given at YITP international
  Workshop on Recent Developments in QCD and Hadron Physics, Kyoto, Japan, Dec.
  16-18, 1996","Soryushiron Kenkyu 95:D87,1997",,,"hep-ph nucl-th",,"  There have been arguments about hadronic molecules, which are weakly-bound
states of two or more hadrons. We investigate the possibility of some
candidates (f0 (980), a0 (980), f0 (1500), f0 (1710), etc.) using QCD sum rule
approach and compare our results with multiquark states in the MIT bag model.
We find that f0 (1500), f0 (1710) can be good candidates for vector-vector
molecule-type multiquark states.
","[{""version"":""v1"",""created"":""Mon, 26 May 1997 04:28:13 GMT""}]","2011-04-15"
