"physics/9705034","Jon. D. Pelletier","Jon D. Pelletier (Geological Sciences, Cornell U.)","Statistical analysis and modeling of variations of the earth's magnetic
  field","latex file, 22 pages, 15 postscript figures",,,,"physics.geo-ph cond-mat",,"  Power spectral analyses of the dipole moment of the earth's magnetic field
inferred from ocean sediment cores and archeomagnetic data from time scales of
100 yr to 4 Myr have been carried out. The power spectrum is proportional to
1/f where f is the frequency. These analyses compliment previous work which has
established a 1/f^2 spectrum for variations at time scales less than 100 yr.
Power spectral analyses of inclination and declination inferred from lake
sediments from time scales of 10 yr to 30 kyr have also been performed. The
spectra are constant above time scales of 3 kyr, proportional to 1/f^2 from
time scales of 500 yr to 3 kyr, and constant again below time scales of 500 yr.
The 3 kyr time scale is associated with the decay time of the quadrupole
moment. We test the hypothesis that reversals are the result of variations in
dipole intensity with a 1/f spectrum which occasionally are large enough to
cross the zero intensity value. Synthetic binormal time series with a 1/f power
spectrum representing variations in the earth's dipole moment are constructed.
Synthetic reversals from these time series exhibit statistics in good agreement
with the reversal record. 1/f noise behavior is reproduced with a model of
magnetic diffusion in the earth's core driven by dynamo action modeled as a
random amplification or destruction of the local magnetic field.
","[{""version"":""v1"",""created"":""Mon, 26 May 1997 03:07:22 GMT""}]","2008-02-03"
"physics/9705035","Jon. D. Pelletier","Jon D. Pelletier (Geological Sciences, Cornell U.)","Scale-invariance of soil moisture variability and its implications for
  the frequency-size distribution of landslides","latex file, 20 pages, 10 postscript figures",,,,"physics.geo-ph cond-mat",,"  Power spectral analyses of soil moisture variability are carried out from
scales of 100 m to 10 km on the microwave remotely-sensed data from the Washita
experimental watershed during 1992. The power spectrum S(k) has an
approximately power-law dependence on wave number k with exponent -1.8. This
behavior is consistent with the behavior of a stochastic differential equation
for soil moisture at a point. This behavior has important consequences for the
frequency-size distribution of landslides. We present the cumulative
frequency-size distributions of landslides induced by precipitation in Japan
and Bolivia as well as landslides triggered by the 1994 Northridge, California
earthquake. Large landslides in these regions, despite being triggered by
different mechanisms, have a cumulative frequency-size distribution with a
power-law dependence on area with an exponent ranging from -1.5 to -2. We use a
soil moisture field with the above statistics in conjunction with a slope
stability analysis to model the frequency-size distribution of landslides. In
our model landslides occur when a threshold shear stress dependent on cohesion,
pore pressure, internal friction and slope angle is exceeded. This implies a
threshold dependence on soil moisture and slope angle since these factors are
primarily dependent on soil moisture. Abstract continued in paper.
","[{""version"":""v1"",""created"":""Mon, 26 May 1997 03:07:53 GMT""}]","2008-02-03"
"physics/9705038","Jon. D. Pelletier","Jon D. Pelletier and Donald L. Turcotte (Geological Sciences, Cornell
  U.)","Self-affine time series: applications and models","latex file, 64 pages, 56 figures",,,,"physics.geo-ph cond-mat",,"  A review paper considering space-time variability of climate, sedimentation,
and geomagnetism.
","[{""version"":""v1"",""created"":""Mon, 26 May 1997 03:14:41 GMT""}]","2009-09-25"
"physics/9705039","Vladimir M. Shabaev","V. M. Shabaev (St.Petersburg State University)","QED theory of the nuclear recoil effect in atoms","20 pages, 6 figures, Latex","Phys.Rev.A57:59-67,1998","10.1103/PhysRevA.57.59",,"physics.atom-ph",,"  The quantum electrodynamic theory of the nuclear recoil effect in atoms to
all orders in \alpha Z is formulated. The nuclear recoil corrections for atoms
with one and two electrons over closed shells are considered in detail. The
problem of the composite nuclear structure in the theory of the nuclear recoil
effect is discussed.
","[{""version"":""v1"",""created"":""Mon, 26 May 1997 13:43:41 GMT""}]","2008-11-26"
"q-alg/9705016","Ruibin Zhang","A. R. Gover and R. B. Zhang","Geometry of Quantum Homogeneous Vector Bundles and Representation Theory
  of Quantum Groups I","Plain Latex, 34 pages, no figures",,,,"q-alg math.QA",,"  Quantum homogeneous vector bundles are introduced by a direct description of
their sections in the context of Woronowicz type compact quantum groups. The
bundles carry natural topologies inherited from the quantum groups, and their
sections furnish projective modules over algebras of functions on quantum
homogeneous spaces. Further properties of the quantum homogeneous vector
bundles are investigated, and their applications to the representation theory
of quantum groups are explored. In particular, quantum Frobenius reciprocity
and a generalized Borel-Weil theorem are established.
","[{""version"":""v1"",""created"":""Mon, 26 May 1997 07:31:06 GMT""}]","2008-02-03"
"q-alg/9705017","Vitaly Tarasov","Giovanni Felder, Vitaly Tarasov and Alexander Varchenko","Monodromy of solutions of the elliptic quantum
  Knizhnik-Zamolodchikov-Bernard difference equations","20 pages",,,,"q-alg math.QA",,"  The elliptic quantum Knizhnik-Zamolodchikov-Bernard (qKZB) difference
equations associated to the elliptic quantum group $E_{\tau,\eta}(sl_2)$ is a
system of difference equations with values in a tensor product of
representations of the quantum group and defined in terms of the elliptic
R-matrices associated with pairs of representations of the quantum group. In
this paper we solve the qKZB equations in terms of elliptic hypergeometric
functions and decribe the monodromy properties of solutions. It turns out that
the monodromy transformations of solutions are described in terms of elliptic
R-matrices associated with pairs of representations of the ""dual"" elliptic
quantum group $E_{p,\eta}(sl_2)$, where $p$ is the step of the difference
equations. Our description of the monodromy is analogous to the Kohno-Drinfeld
description the monodromy group of solutions of the KZ differential equations
associated to a simple Lie algebra in terms of the corresponding quantum group.
","[{""version"":""v1"",""created"":""Mon, 26 May 1997 05:48:01 GMT""}]","2008-02-03"
"quant-ph/9705043","Masahide Sasaki","Masahide Sasaki (1), Kentaro Kato (2), Masayuki Izutsu (1), and Osamu
  Hirota (2) ((1)Communication Research Laboratory, Tokyo, (2) Tamagawa Univ.,
  Tokyo)","A simple quantum channel having superadditivity of channel capacity","5 pages, LaTeX, 3 eps figures","Phys.Lett. A236 (1997) 1","10.1016/S0375-9601(97)00740-8","qphys-97-1","quant-ph",,"  When classical information is sent through a quantum channel of nonorthogonal
states, there is a possibility that transmittable classical information exceeds
a channel capacity in a single use of the initial channel by extending it into
multi-product channel. In this paper, it is shown that this remarkable feature
of a quantum channel, so-called superadditivity, appears even in as low as the
third extended coding of the simplest binary input channel. A physical
implementation of this channel is indicated based on cavity QED techniques.
","[{""version"":""v1"",""created"":""Mon, 26 May 1997 09:33:05 GMT""}]","2009-10-30"
"quant-ph/9705044","Paolo Zanardi","P. Zanardi (1,3) and M. Rasetti (2,3) ((1) ISI Foundation, Torino (2)
  Dipartimento di fisica, Politecnico di Torino, (3) INFM Politecnico di
  Torino)","Noiseless Quantum Codes","Revised version (to make it accessible to a broader readership) to
  appear on PRL (4 pages, REVTEX)","Phys.Rev.Lett.79:3306-3309,1997","10.1103/PhysRevLett.79.3306",,"quant-ph",,"  In this paper we study a model quantum register $\cal R$ made of $N$ replicas
(cells) of a given finite-dimensional quantum system S. Assuming that all cells
are coupled with a common environment with equal strength we show that, for $N$
large enough, in the Hilbert space of $\cal R$ there exists a linear subspace
${\cal C}_N$ which is dynamically decoupled from the environment. The states in
${\cal C}_N$ evolve unitarily and are therefore decoherence-dissipation free.
The space ${\cal C}_N$ realizes a noiseless quantum code in which information
can be stored, in principle, for arbitrarily long time without being affected
by errors.
","[{""version"":""v1"",""created"":""Mon, 26 May 1997 10:11:06 GMT""},{""version"":""v2"",""created"":""Fri, 5 Sep 1997 08:17:28 GMT""}]","2009-01-23"
"quant-ph/9705045","Paolo Zanardi","Paolo Zanardi (1) ((1) Institute for Scientific Interchange
  Foundation, Torino, Italy and Unit\`a INFM, Politecnico di Torino, Torino,
  Italy)","Dissipation and Decoherence in a Quantum Register","minor corrections, references added, to appear in PRA (10 pages + 5
  figures LaTeX)","Phys.Rev.A57:3276,1998","10.1103/PhysRevA.57.3276",,"quant-ph",,"  A model for a quantum register $\cal R$ made of $N$ replicas of a
$d$-dimensional quantum system (cell) coupled with the environment, is studied
by means of a Born-Markov Master Equation (ME). Dissipation and decoherence are
discussed in various cases in which a sub-decoherent enconding can be
rigorously found. For the qubit case ($d=2$) we have solved, for small $N,$ the
ME by numerical direct integration and studied, as a function of the coherence
length $\xi_c$ of the bath, fidelity and decoherence rates of states of the
register. For large enough $\xi_c$ the singlet states of the global $su(2)$
pseudo-spin algebra of the register (noiseless at $\xi_c=\infty$) are shown to
have a much smaller decoherence rates than the rest of the Hilbert space.
","[{""version"":""v1"",""created"":""Mon, 26 May 1997 10:40:01 GMT""},{""version"":""v2"",""created"":""Fri, 6 Feb 1998 10:23:14 GMT""}]","2011-07-19"
