"dg-ga/9710020","Iskander Taimanov","Iskander A. Taimanov","The Weierstrass representation of closed surfaces in $R^3$","15 pages, LaTeX; Preprint no. 291, SFB 288, TU-Berlin","Functional Anal. Appl. 32:4 (1998), 49--62.",,,"dg-ga math.DG",,"  In the present paper which a sequel to dg-ga/9511005 and dg-ga//9610013 a
global Weierstrass representation of an arbitrary closed oriented surface of
genus $\geq 1$ in the the three-space is constructed. The Weierstrass spectrum
of a torus immersed into $R^3$ is introduced and finite-zone planes as well as
finite-zone solutions to the modified Novikov-Veselov equations are
constructed.
","[{""version"":""v1"",""created"":""Mon, 20 Oct 1997 15:52:19 GMT""},{""version"":""v2"",""created"":""Wed, 22 Oct 1997 08:38:05 GMT""},{""version"":""v3"",""created"":""Sat, 6 Dec 1997 13:48:51 GMT""}]","2007-05-23"
"gr-qc/9710089","Sean Hayward","Sean A. Hayward","Unified first law of black-hole dynamics and relativistic thermodynamics","18 pages, TeX, expanded somewhat, to appear in Class. Quantum Grav","Class.Quant.Grav.15:3147-3162,1998","10.1088/0264-9381/15/10/017",,"gr-qc",,"  A unified first law of black-hole dynamics and relativistic thermodynamics is
derived in spherically symmetric general relativity. This equation expresses
the gradient of the active gravitational energy E according to the Einstein
equation, divided into energy-supply and work terms. Projecting the equation
along the flow of thermodynamic matter and along the trapping horizon of a
blackhole yield, respectively, first laws of relativistic thermodynamics and
black-hole dynamics. In the black-hole case, this first law has the same form
as the first law of black-hole statics, with static perturbations replaced by
the derivative along the horizon. There is the expected term involving the area
and surface gravity, where the dynamic surface gravity is defined as in the
static case but using the Kodama vector and trapping horizon. This surface
gravity vanishes for degenerate trapping horizons and satisfies certain
expected inequalities involving the area and energy. In the thermodynamic case,
the quasi-local first law has the same form, apart from a relativistic factor,
as the classical first law of thermodynamics, involving heat supply and
hydrodynamic work, but with E replacing the internal energy. Expanding E in the
Newtonian limit shows that it incorporates the Newtonian mass, kinetic energy,
gravitational potential energy and thermal energy. There is also a weak type of
unified zeroth law: a Gibbs-like definition of thermal equilibrium requires
constancy of an effective temperature, generalising the Tolman condition and
the particular case of Hawking radiation, while gravithermal equilibrium
further requires constancy of surface gravity. Finally, it is suggested that
the energy operator of spherically symmetric quantum gravity is determined by
the Kodama vector, which encodes a dynamic time related to E.
","[{""version"":""v1"",""created"":""Mon, 20 Oct 1997 06:55:06 GMT""},{""version"":""v2"",""created"":""Thu, 27 Aug 1998 05:48:11 GMT""}]","2008-11-26"
"gr-qc/9710090","Paulo Rodrigues Lima Vargas Moniz","P.V. Moniz (DAMTP, University of Cambridge)","Can we obtain Conserved Currents in Supersymmetric Quantum Cosmology?","3 pages, LaTeX, requires mprocl.sty available at
  http://shemesh.fiz.huji.ac.il/MG8/submission.html, talk given in the Quantum
  Cosmology session at the MG8 conference",,,,"gr-qc",,"  In this paper we report whether conserved currents can be sensibly defined in
supersymmetric minisuperspaces. Our analysis deals with a k=1 FRW model.
Supermatter in the form of scalar supermultiplets is included. We show that
conserved currents cannot be adequately established except for some very simple
scenarios.
","[{""version"":""v1"",""created"":""Mon, 20 Oct 1997 10:36:19 GMT""}]","2007-05-23"
"gr-qc/9710091","Tekin Dereli","E. Atasoy, T. Dereli, M. Onder","Constrained Euler-Poincare Supergravity in Five Dimensions","13 pages LATEX file. No figures. (To appear in the Turkish Journal of
  Physics)",,,,"gr-qc",,"  The N=2 supergravity action in D=5 is generalized by the inclusion of
dimensionally continued Euler-Poincare form. The spacetime torsion implied by
the Einsteinean supergravity is imposed by a Lagrangian constraint and
resulting variational equations are solved for the Lagrange multipliers. The
corresponding terms in the Einstein and Rarita-Schwinger field equations are
determined. These indicate new types of interactions that could be included in
the action to achieve local supersymmetry.
","[{""version"":""v1"",""created"":""Mon, 20 Oct 1997 12:49:36 GMT""}]","2007-05-23"
"gr-qc/9710092","Kirill Bronnikov","K. A. Bronnikov, C. P. Constantinidis, R. L. Evangelista and J. C.
  Fabris","Cold black holes in scalar-tensor theories","9 pages, Latex, submitted to Int. J. Mod. Phys. D",,,"UFES-DF-001/97","gr-qc",,"  We study the possible existence of black holes in scalar-tensor theories of
gravity in four dimensions. Their existence is verified for anomalous versions
of these theories, with a negative kinetic term in the Lagrangian. The Hawking
temperature T_H of these holes is zero, while the horizon area is (in most
cases) infinite. It is shown that an infinite value of T_H can occur only at a
curvature singularity rather than a horizon. As a special case, the Brans-Dicke
theory is studied in more detail, and two kinds of infinite-area black holes
are revealed, with finite and infinite proper time needed for an infalling
particle to reach the horizon.
","[{""version"":""v1"",""created"":""Mon, 20 Oct 1997 13:21:35 GMT""}]","2007-05-23"
"gr-qc/9710093","Rudnei O. Ramos","H. P. de Oliveira, Rudnei O. Ramos","Dynamical System Analysis for Inflation with Dissipation","Plain LaTex, 21 pages, 8 eps figs (uses epsf), to be published in
  Phys. Rev. D","Phys.Rev. D57 (1998) 741-749","10.1103/PhysRevD.57.741","IF/UERJ-97/12","gr-qc astro-ph hep-ph",,"  We examine the solutions of the equations of motion for an expanding
Universe, taking into account the radiation of the inflaton field energy. We
then analyze the question of the generality of inflationary solutions in this
more general setting of a dissipative system. We find a surprisingly rich
behavior for the solutions of the dynamical system of equations in the presence
of dissipational effects. We also determine that a value of dissipation as
small as $\sim 10^{-7} H$ can lead to a smooth exit from inflation to
radiation.
","[{""version"":""v1"",""created"":""Mon, 20 Oct 1997 14:41:46 GMT""}]","2009-10-30"
"hep-lat/9710067","John Markham","J. F. Markham (University of Melbourne), T. D. Kieu (University of
  Melbourne)","Monte Carlo Simulations with Complex-Valued Measure","3 pages, 3 Postscript figures, submitted to Nucl.Phys.B.Proc.Supp","Nucl.Phys.Proc.Suppl. 63 (1998) 970-972","10.1016/S0920-5632(97)00958-4","UM-P-97/49, RCHEP-97/09","hep-lat",,"  A simulation method based on the RG blocking is shown to yield statistical
errors smaller than that of the crude MC using absolute values of the original
measures. The new method is particularly suitable to apply to the sign problem
of indefinite or complex-valued measures. We demonstrate the many advantages of
this method in the simulation of 2D Ising model with complex-valued
temperature.
","[{""version"":""v1"",""created"":""Mon, 20 Oct 1997 06:44:14 GMT""}]","2009-10-30"
"hep-lat/9710068","Kurt Langfeld","Kurt Langfeld, Hugo Reinhardt and Oliver Tennert","Confinement and scaling of the vortex vacuum of SU(2) lattice gauge
  theory","8 pages, LaTeX, 4 figures using epsf","Phys.Lett.B419:317-321,1998","10.1016/S0370-2693(97)01435-4","UNITU-THEP-19/97","hep-lat hep-ph hep-th",,"  The magnetic vortices which arise in SU(2) lattice gauge theory in center
projection are visualized for a given time slice. We establish that the number
of vortices piercing a given 2-dimensional sheet is a renormalization group
invariant and therefore physical quantity. We find that roughly 2 vortices
pierce an area of 1 fm^2.
","[{""version"":""v1"",""created"":""Mon, 20 Oct 1997 07:31:18 GMT""}]","2011-07-18"
"hep-lat/9710069","Hugh P. Shanahan","C.T.H. Davies, A.J. Lidsey and H.P.Shanahan","A study of the quenched bc mass spectrum at beta=6.2","4 pages LaTeX, 4 postscript figures. requires espcrc2.sty and
  epsf.sty. To be published in the proceedings of Lattice 97, Edinburgh,
  Scotland","Nucl.Phys.Proc.Suppl. 63 (1998) 323-325","10.1016/S0920-5632(97)00758-5","DAMTP-97-91","hep-lat",,"  We present an analysis of the mass spectrum of heavy quarkonia with
non-degenerate quark masses. The heavier (bottom) valence quark is treated in a
non-relativistic fashion and the other (charm) is a relativistic Wilson-like
quark using the improved SW action. Such states provide and interesting probe
between the relativistic B meson states and the non-relativistic bottomonium
states.
","[{""version"":""v1"",""created"":""Mon, 20 Oct 1997 10:07:15 GMT""}]","2009-10-30"
"hep-ph/9710400","Martin Maul","M. Maul (Regensburg Univ.), J. G. Contreras (Dortmund Univ.), H.
  Ihssen (NIKHEF), A. Schafer (Regensburg Univ.)","Semi-inclusive asymmetries with polarized proton beams at HERA","8 pages, LaTeX, 6 figures, uses psfig and a41 (included) styles;
  Invited talk presented at the workshop 'Deep Inelastic Scattering off
  Polarized Targets: Theory Meets Experiment', Zeuthen, Germany, Sept. 1-5,
  1997, one ambiguity in the notation of fragmentation functions removed",,,,"hep-ph",,"  The prospects of semi-inclusive measurements with polarized proton beams at
HERA are discussed. Detailed simulations show that one can disentangle the
valence-quark and sea-quark contribution to the polarized structure function
g_1(x) in the small x-domain, if the equivalent of 1000 pb-1 of data are
collected. It is also shown how semi-inclusive charged- current events can
provide information on the relative importance of the spin contribution of the
anti-s and anti-d sea quarks. Moreover, various methods to determine the
fragmentation functions in this kinematical domain are presented.
","[{""version"":""v1"",""created"":""Sun, 19 Oct 1997 18:45:18 GMT""},{""version"":""v2"",""created"":""Thu, 23 Oct 1997 19:50:16 GMT""},{""version"":""v3"",""created"":""Mon, 10 Nov 1997 20:56:26 GMT""}]","2007-05-23"
"hep-ph/9710401","Carlos Wagner","M. Carena, M. Quiros and C.E.M. Wagner","Electroweak Baryogenesis and Higgs and Stop Searches at LEP and the
  Tevatron","19 pages, 2 figures, LateX","Nucl.Phys.B524:3-22,1998","10.1016/S0550-3213(98)00187-4","CERN-TH/97-190","hep-ph hep-ex",,"  It has been recently shown that the observed baryon number may originate at
the electroweak phase transition, provided that the Higgs boson and the
lightest stop are sufficiently light. In this work, we perform a detailed
analysis, including all dominant two-loop finite temperature corrections to the
Higgs effective potential, as well as the non-trivial effects proceeding from
the mixing in the stop sector, to define the region of parameter space for
which electroweak baryogenesis can happen. The limits on the stop and Higgs
masses are obtained by taking into account the experimental bounds on these
quantities, as well as those coming from the requirement of avoiding dangerous
color breaking minima. We find for the Higgs mass $m_h \simlt 105$ GeV, while
the stop mass may be close to the present experimental bound and must be
smaller than, or of order of, the top quark mass. These results provide a very
strong motivation for further non-perturbative analysis of the electroweak
phase transition, as well as for the search for Higgs and stop particles at the
LEP and Tevatron colliders.
","[{""version"":""v1"",""created"":""Mon, 20 Oct 1997 01:57:30 GMT""}]","2008-11-26"
"hep-ph/9710402","Gregory Gabadadze","Gregory Gabadadze","Modeling The Glueball Spectrum By A Closed Bosonic Membrane","45 LaTex pages. Two references with comments added. Phys. Rev. D58
  (1998) 094015","Phys.Rev. D58 (1998) 094015","10.1103/PhysRevD.58.094015","RU-97-44","hep-ph hep-th",,"  We use an analogy between the Yang-Mills theory Hamiltonian and the matrix
model description of the closed bosonic membrane theory to calculate the
spectrum of glueballs in the large $N_c$ limit. Some features of the Yang-Mills
theory vacuum, such as the screening of the topological charge and vacuum
topological susceptibility are discussed. We show that the topological
susceptibility has different properties depending on whether it is calculated
in the weak coupling or strong coupling regimes of the theory. A mechanism of
the formation of the pseudoscalar glueball state within pure Yang-Mills theory
is proposed and studied.
","[{""version"":""v1"",""created"":""Mon, 20 Oct 1997 04:45:57 GMT""},{""version"":""v2"",""created"":""Sun, 25 Oct 1998 02:38:31 GMT""}]","2009-10-30"
"hep-ph/9710403","Robert Foot","R. Foot, R. R. Volkas and O. Yasuda","Up-down atmospheric neutrino flux asymmetry predictions for various
  neutrino oscillation scenarios","6 pages, 6 figures, Latex","Phys.Lett.B421:245-249,1998","10.1016/S0370-2693(98)00013-6","TMUP-HEL-9710, UM-P-97/57","hep-ph",,"  We compute up-down asymmetries for atmospheric neutrino induced electron and
muon events in the SuperKamiokande detector for the following neutrino
oscillation models: (A) maximally mixed $\nu_{\mu} - \nu_{\tau}$ or $\nu_{\mu}
- \nu_s$, (B) maximally mixed $\nu_{\mu} - \nu_e$, (C) threefold maximal mixing
between $\nu_e, \nu_{\mu}$ and $\nu_{\tau}$, and (D) neutrino oscillations via
Equivalence Principle or Lorentz invariance violation. We emphasise the role of
different momentum cuts.
","[{""version"":""v1"",""created"":""Mon, 20 Oct 1997 05:03:52 GMT""}]","2011-03-10"
"hep-ph/9710404","Sarira Sahu","Subhendra Mohanty and Sarira Sahu","Neutrino helicity flip by Cerenkov emission and absorption of plasmons
  in supernova","2 pages, latex, 2 figures",,,,"hep-ph",,"  We show that in a supernova core the longitudinal photon (plasmon) has a
space-like dispersion and Cerenkov absorption and emission of such photons is
kinematically allowed. If the neutrino has a non-zero magnetic moment, then
helicity flipping Cerenkov absorption of a plasmon $\nu_L+\gamma\to\nu_R$ is
the most efficient cooling mechanism of the supernova core, and this allows us
to put a restrictive bound on the neutrino magnetic moment
$\mu_{\nu}~<~0.7\times 10^{-13}\mu_B$.
","[{""version"":""v1"",""created"":""Mon, 20 Oct 1997 05:32:23 GMT""}]","2007-05-23"
"hep-ph/9710405","Piotr Zenczykowski","P. Zenczykowski (Institute of Nuclear Physics, Krakow, Poland)","Weak radiative hyperon decays, Hara's theorem and the diquark","10 pages, LaTeX","Phys. Rev. D 57, 3163 (1998)","10.1103/PhysRevD.57.3163","1767/PH","hep-ph",,"  Weak radiative hyperon decays are discussed in the diquark-level approach. It
is pointed out that in the general diquark formalism one may reproduce the
experimentally suggested pattern of asymmetries, while maintaining Hara's
theorem in the SU(3) limit. At present, however, no detailed quark-based model
of parity-violating diquark-photon coupling exists that would have the
necessary properties.
","[{""version"":""v1"",""created"":""Mon, 20 Oct 1997 10:36:53 GMT""}]","2016-08-25"
"hep-ph/9710406",,"Gouranga C Nayak and V. Ravishankar (Dept. of Physics, Indian
  Institute of Technology, Kanpur. INDIA)","Pre-equilibrium evolution of quark-gluon plasma","22 pages Latex, 14 postscript figures; Minor changes are made: To
  appear in Physical Reveiw C","Phys.Rev.C58:356-364,1998","10.1103/PhysRevC.58.356",,"hep-ph nucl-th",,"  We study the production and the evolution of quark-gluon plasma expected to
be formed in ultra relativistic heavy-ion collisions, within the color
flux-tube model. We introduce the gluonic component in the Boltzmann equation,
which we solve in the phase space which is extended to include the SU(3) color
degree of freedom. The color degree of freedom is shown to play a decisive role
in equilibration, and in fixing the temperature of the plasma. We further find
that the soft partons that we study here contribute substantially to the bulk
properties. Finally, the model is shown to provide a detailed picture of how
the quark-gluon plasma evolves and is driven towards a hydrodynamic flow, which
starts occuring around 1 $fm$.
","[{""version"":""v1"",""created"":""Mon, 20 Oct 1997 11:07:31 GMT""},{""version"":""v2"",""created"":""Wed, 15 Apr 1998 05:02:40 GMT""}]","2008-11-26"
"hep-ph/9710407","Colin Froggatt","D. L. Bennett, C. D. Froggatt and H. B. Nielsen","Standard Model Parameters from the Multiple Point Principle and Anti-GUT","32 page LaTeX file plus 5 postscript figures, FEYNMAN and mprocl
  style files, uses epsfig.sty; to appear in the Proceedings of the APCTP-ICTP
  Joint International Conference (AIJIC 97) on Recent Developments in
  Nonperturbative Quantum Field Theory, Seoul, Korea, 26-30 May 1997",,,"GUTPA/97/10/3","hep-ph",,"  We put forward a model, or rather a relatively broad class of models, beyond
the Standard Model based on the two main assumptions: MPP) The coupling
constants should be fixed such as to ensure that there be many ``vacuum
states'', i.e. Lorentz invariant states of the fields, with the same energy
density. Anti-GUT) At high energy, above an essential desert of only Standard
Model interactions, there is the bigger gauge group $SMG^3\times U(1)_f$ which
means that each family of quarks and leptons has its own set of gauge bosons
analogous to those in the Standard Model itself, and then there is one extra
abelian gauge boson called $U(1)_f$. In addition we make some further more
phenomenological assumptions. We succeed in fitting order of magnitudewise most
of the (effective) Yukawa couplings observed in the Standard Model as quark and
lepton masses and mixing angles. We have more accurate numbers for the three
fine-structure constants and the top and Higgs masses, as well as some
suggestive understanding of the fine-tuning wonders for the cosmological
constant and the $\Theta$-angles. CP-violation is predicted a bit low, but
order of magnitudewise in agreement with experiment. In summary, we obtain at
least an order of magnitudewise understanding of the Standard Model parameters
within our scheme, except for the mysteriously low weak scale compared to the
Planck scale, with only 4 continuous parameters being fitted, in addition to
our somewhat more discrete choices.
","[{""version"":""v1"",""created"":""Mon, 20 Oct 1997 11:39:12 GMT""}]","2007-05-23"
"hep-ph/9710408",,"Miguel A. Sanchis-Lozano","Heavy Quark Effective Fields as Operator-valued Distributions","9 pages, LaTex",,,"IFIC/97-73; FTUV/97-43","hep-ph",,"  We look at effective fields defined in the heavy-quark effective theory as
operator-valued generalized functions on Minkowski space-time to be averaged
with physically suitable smoothing functions (Gaussians of typical width the
hadronic size) leading to operator-valued distributions in Hilbert space.
One-heavy-quark states are thus represented by normalizable wave packets
displaying a particle-like behaviour at the characteristic hadronic time
${\Lambda}_{QCD}^{-1}$. We examine some consequences relative to the average
kinetic energy of heavy quarks in hadrons to avoid inconsistences within this
formalism.
","[{""version"":""v1"",""created"":""Mon, 20 Oct 1997 12:04:08 GMT""},{""version"":""v2"",""created"":""Tue, 21 Oct 1997 09:35:20 GMT""}]","2007-05-23"
"hep-ph/9710409","Bodenmueller","Harald Fritzsch","The Kinematics and Dynamics of Flavor Mixing","18 latex pages","Acta Phys.Polon.B28:2259-2277,1997",,"LMU 13/97","hep-ph",,"  In view of the observed strong hierarchy of the quark and lepton masses and
of the flavor mixing angles, it is argued that the description of flavor mixing
must take this into account. One particularly interesting way to describe the
flavor mixing, which, however, is not the one used today, emerges, which is
particularly suited for models of quark mass matrices based on flavor
symmetries. We conclude that the unitarity triangle important for B physics
should be close to or identical to a rectangular triangle. CP violation is
maximal in this sense.
","[{""version"":""v1"",""created"":""Mon, 20 Oct 1997 12:46:27 GMT""}]","2014-11-17"
"hep-ph/9710410","Marco Stratmann","D. de Florian (CERN), M. Stratmann (Durham), W. Vogelsang (CERN)","Polarized Lambda Production at HERA","13 pages, LaTeX, 6 figures, uses epsfig and a41 (included) styles;
  Contribution to the proceedings of the 1997 workshop on 'Physics with
  Polarized Protons at HERA', Hamburg and Zeuthen, Germany, March-September
  1997",,,"CERN-TH/97-287, DTP/97/94","hep-ph",,"  We study the prospects for HERA with polarized electron and/or proton beams
to determine the functions describing the fragmentation of a longitudinally
polarized parton into a polarized Lambda baryon. We examine both semi-inclusive
deep-inelastic scattering (SIDIS) and photoproduction of Lambda.
","[{""version"":""v1"",""created"":""Mon, 20 Oct 1997 13:53:48 GMT""}]","2007-05-23"
"hep-ph/9710411","Anatoli Efremov","A.V. Efremov (JINR, Dubna, Russia)","Nuclear Structure Functions and Cumulative Processes","Latex file 9 pages 5 eps figures, wrapfig.sty. An updated version of
  the talk at 13 International Seminar on Relativistic Nuclear Physics and QCD
  (Dubna, Sept. 2-7, 1996) which includes new experimental data and some ideas
  appeared since that time. Will appear in the Proceedings",,,,"hep-ph",,"  The authors's point of view, based on QCD, on the nuclear quark structure is
presented. Different models for explaining the EMC--effect are considered. It
is also shown that cumulative production data are very useful for a better
understanding of the EMC--effect and give some evidence in favor of its
multiquark nature.
","[{""version"":""v1"",""created"":""Mon, 20 Oct 1997 14:21:58 GMT""}]","2007-05-23"
"hep-ph/9710412","Ralph Kretschmer","J. Boguszynski, H. D. Dahmen, R. Kretschmer, L. Lukaszuk (Siegen
  University, Fachbereich Physik, Siegen, Germany, and Soltan Institute for
  Nuclear Studies, Warsaw, Poland)","Collinear Asymptotic Dynamics for Massive Particles. Multi-Channel Regge
  Behaviour","11 pages, LaTeX",,,"SI-97-15","hep-ph",,"  The high-energy behaviour in a multi-channel system is investigated in the
framework of collinear asymptotic dynamics for massive particles. We consider
the most general trilinear coupling of N different scalar fields. We find Regge
behaviour and obtain closed expressions for the Regge trajectories and
couplings. The results are corraborated in the multi-channel Bethe-Salpeter
approach. The scattering processes dominated by single Regge trajectories are
explicitly given.
","[{""version"":""v1"",""created"":""Mon, 20 Oct 1997 14:52:59 GMT""}]","2007-05-23"
"hep-ph/9710413","Robert Harlander","R. Harlander and M. Steinhauser","O(\alpha_s^2) Corrections to Top Quark Production at $e^+e^-$ Colliders","LaTeX, 13 pages, 10 figures included as ps-files. The complete paper,
  including figures, is also available via anonymous ftp at
  ftp://ttpux2.physik.uni-karlsruhe.de/ , or via www at
  http://www-ttp.physik.uni-karlsruhe.de/cgi-bin/preprints/","Eur.Phys.J.C2:151-158,1998","10.1007/s100520050129","MPI/PhT/97-66, TTP97-40","hep-ph",,"  In this article we evaluate mass corrections up to $O((m^2/q^2)^6)$ to the
three-loop polarization function induced by an axial-vector current. Special
emphasis is put on the evaluation of the singlet diagram which is absent in the
vector case. As a physical application $O(\alpha_s^2)$ corrections to the
production of top quarks at future $e^+e^-$ colliders is considered. It is
demonstrated that for center of mass energies $\sqrt{s} >~ 500$ GeV the
inclusion of the first seven terms into the cross section leads to a reliable
description.
","[{""version"":""v1"",""created"":""Mon, 20 Oct 1997 14:57:23 GMT""}]","2011-09-13"
"hep-ph/9710414","Oleg Teryaev","J. Soffer, O.V. Teryaev","A positivity bound for the longitudinal gluon distribution in a nucleon","LATEX, 5 pages, Preprint CPT-97-P.3550","Phys.Lett. B419 (1998) 400-402","10.1016/S0370-2693(97)01467-6",,"hep-ph",,"  The distribution of longitudinal gluons in a nucleon, introduced earlier by
Gorsky and Ioffe, is estimated from below by making use of the positivity of
density matrix and the analogue of the Wandzura-Wilczek relation for the
light-cone distributions of polarized gluons in a transversely polarized
nucleon.
","[{""version"":""v1"",""created"":""Mon, 20 Oct 1997 15:50:31 GMT""},{""version"":""v2"",""created"":""Tue, 21 Oct 1997 10:02:59 GMT""}]","2009-10-30"
