"hep-th/9710149","Yan Vtorov-Karevsky","Zurab Kakushadze, Gary Shiu, S.-H. Henry Tye and Yan Vtorov-Karevsky","A Review of Three-Family Grand Unified String Models","49 pages, Revtex 3.0; one ps figure included. To appear in the Review
  section of Int.J.Mod.Phys","Int.J.Mod.Phys. A13 (1998) 2551-2598","10.1142/S0217751X98001323",,"hep-th hep-ph",,"  We review the construction and classification of three-family grand unified
models within the framework of asymmetric orbifolds in perturbative heterotic
superstring. We give a detailed survey of all such models which is organized to
aid analysis of their phenomenological properties. We compute tree-level
superpotentials for these models. These superpotentials are used to analyze the
issues of proton stability (doublet-triplet splitting and R-parity violating
terms) and Yukawa mass matrices. To have agreement with phenomenological data
all these models seem to require certain degree of fine-tuning. We also analyze
the possible patterns of supersymmetry breaking in these models.
  We find that the supersymmetry breaking scale comes out either too high to
explain the electroweak hierarchy problem, or below the electroweak scale
unless some degree of fine-tuning is involved. Thus, none of the models at hand
seem to be phenomenologically flawless.
","[{""version"":""v1"",""created"":""Sun, 19 Oct 1997 19:46:21 GMT""}]","2009-10-30"
"hep-th/9710150","Indranil Dasgupta","Indranil Dasgupta","The imaginary time Path Integral and non-time-reversal-invariant- saddle
  points of the Euclidean Action","19 pages, LaTex, 5 epsf figures. A new example from quantum mechanics
  is included. The role of internal symmetries is discussed. To be published in
  Nucl. Phys. B","Nucl.Phys. B523 (1998) 403-419","10.1016/S0550-3213(98)00284-3","BUHEP-97-18, UCTP 107/97","hep-th hep-ph",,"  We discuss new bounce-like (but non-time-reversal-invariant-) solutions to
Euclidean equations of motion, which we dub boomerons. In the Euclidean path
integral approach to quantum theories, boomerons make an imaginary contribution
to the vacuum energy. The fake vacuum instabilty can be removed by cancelling
boomeron contributions against contributions from time reversed boomerons
(anti-boomerons). The cancellation rests on a sign choice whose significance is
not completely understood in the path integral method.
","[{""version"":""v1"",""created"":""Sun, 19 Oct 1997 23:49:39 GMT""},{""version"":""v2"",""created"":""Sun, 7 Dec 1997 22:28:48 GMT""},{""version"":""v3"",""created"":""Tue, 14 Apr 1998 01:12:30 GMT""}]","2009-10-30"
"hep-th/9710152",,"M.A.Zubkov","Effective abelian gauge theory for lattice gluodynamics and
  chromoelectric string","10pp., Latex",,,"ITEP-TH-53/97","hep-th",,"  The lattice SU(2) gluodynamics in the maximal abelian projection is reduced
to the abelian theory, in which the natural small parameter exists. We show
that in the zeroth order of the expansion in this parameter the theory is
equivalent to the compact abelian gauge theory coupled to ghosts of charge 2.
  The theory is a renormalizable and asymptotically free. This theory is
represented in the form of the theory of open string with the boundary
consisting of the worldline of the quark. The ghosts live on the worldsheet of
the string. The naive continuum limit of such string representation gives a
simple expression for the chromoelectric string action.
","[{""version"":""v1"",""created"":""Mon, 20 Oct 1997 11:21:20 GMT""},{""version"":""v2"",""created"":""Fri, 12 Sep 2003 08:52:07 GMT""}]","2007-05-23"
"hep-th/9710153","Ctirad Klimcik","C. Klimcik","Gauge theories on the noncommutative sphere","33 pages, LaTeX","Commun.Math.Phys. 199 (1998) 257-279","10.1007/s002200050501","IHES/P/97/77","hep-th",,"  Gauge theories are formulated on the noncommutative two-sphere. These
theories have only finite number of degrees of freedom, nevertheless they
exhibit both the gauge symmetry and the SU(2) ""Poincar\'e"" symmetry of the
sphere. In particular, the coupling of gauge fields to chiral fermions is
naturally achieved.
","[{""version"":""v1"",""created"":""Mon, 20 Oct 1997 13:39:40 GMT""}]","2009-10-30"
"hep-th/9710154","Jerzy Plebanski","Hugo Garcia-Compean, Jerzy F. Plebanski, Maciej Przanowski","The Geometry of Deformation Quantization and Self-Dual Gravity","LaTeX, mprocl.sty, 3 pages, no figures, version to appear in the
  Eighth Marcel Grossmann Meeting",,,"CINVESTAV-FIS 27/97","hep-th",,"  A geometric formulation of the Moyal deformation for the Self-dual Yang-Mills
theory and the Chiral Model approach to Self-dual gravity is given. We find in
Fedosov's geometrical construction of deformation quantization the natural
geometrical framework associated to the Moyal deformation of Self-dual gravity.
","[{""version"":""v1"",""created"":""Mon, 20 Oct 1997 15:46:04 GMT""}]","2007-05-23"
"math/9710208",,"Marc Bourdon, Herv\'e Pajot","Poincar\'e inequalities and quasiconformal structure on the boundary of
  some hyperbolic buildings",,,,"MSRI 1997-100","math.DG math.MG",,"  In this paper we shall show that the boundary $\partial I_{p,q}$ of the
hyperbolic building $I_{p,q}$ considered in M. Bourdon, \emph{Immeubles
hyperboliques, dimension conforme et rigidit\'e de Mostow} (Geometric And
Functional Analysis, Vol 7 (1997), p 245-268) admits Poincar\'e type
inequalities. Then by using Heinonen-Koskela's work, we shall prove Loewner
capacity estimates for some families of curves of $\partial I_{p,q}$ and the
fact that every quasiconformal homeomorphism $f : \partial I_{p,q}
\longrightarrow \partial I_{p,q}$ is quasisymetric. Therefore by these results,
the answers to certain questions of Heinonen and Semmes are NO.
","[{""version"":""v1"",""created"":""Mon, 20 Oct 1997 00:00:00 GMT""}]","2016-09-07"
"math/9710224","Jos\'e Felipe Voloch","Jos\'e Felipe Voloch","Torsion points on y^2=x^6+1",,,,"ANT-0082","math.NT",,"  Let C be the curve y^2=x^6+1 of genus 2 over a field of characteristic zero.
Consider C embedded in its Jacobian J by sending one of the points at infinity
on C to the origin of J. In this brief note we show that the points of C whose
image on J are torsion are precisely the two points at infinity and the six
points with y=0.
","[{""version"":""v1"",""created"":""Mon, 20 Oct 1997 00:00:00 GMT""}]","2007-05-23"
"nucl-th/9710043",,"E. L. Bratkovskaya, W. Cassing (Giessen Uni.), R. Rapp (SUNY, Stony
  Brook) and J. Wambach (Darmstadt, Tech. Hochsch.)","Dilepton production and $m_T$-scaling at BEVALAC/SIS energies","35 pages, ReVTeX, including 11 postscript figures, UGI-97-06, Nucl.
  Phys. A, in press","Nucl.Phys. A634 (1998) 168-189","10.1016/S0375-9474(98)00135-3",,"nucl-th",,"  We present a dynamical study of $e^+e^-$ production in C + C and Ca + Ca
collisions at BEVALAC/SIS energies on the basis of the covariant transport
approach HSD employing momentum-dependent $\rho$-meson spectral functions that
include the pion modifications in the nuclear medium as well as the
polarization of the $\rho$-meson due to resonant $\rho - N$ scattering. We find
that the experimental data from the DLS collaboration cannot be described
within the $\rho$-meson spectral function approach. A dropping $\eta$-mass
scenario leads to a good reproduction of the DLS dilepton data, however,
violates the $m_T$-scaling of $\pi^0$ and $\eta$ spectra as observed by the
TAPS collaboration as well as $\eta$ photoproduction on nuclei.
","[{""version"":""v1"",""created"":""Mon, 20 Oct 1997 09:05:35 GMT""},{""version"":""v2"",""created"":""Mon, 2 Feb 1998 17:00:10 GMT""}]","2009-10-30"
"nucl-th/9710044",,"A. Sibirtsev, W. Cassing (Giessen Uni.), G.I. Lykasov and M.V. Rzjanin
  (JINR, Dubna)","Reanalysis of antiproton production in proton-nucleus and
  nucleus-nucleus reactions at subthreshold energies","25 pages, latex, including 15 ps-figures, UGI-97-21, submitted to
  Nucl. Phys. A","Nucl.Phys. A632 (1998) 131-152","10.1016/S0375-9474(97)00809-9",,"nucl-th",,"  We reanalyse the production of $p\bar{p}$ pairs in proton-nucleus and
nucleus-nucleus collisions employing novel elementary cross sections for
baryon-baryon and pion-baryon production channels based on a boson-exchange
model. In contrast to previous transport studies performed in the literature
the secondary pion induced channel is found to be most important in both p+A
and A+A collisions at subthreshold energies. A detailed comparison with the
experimental data available indicates that sizeable attractive $\bar{p}$
potentials in the order of - 100 to - 150 MeV at normal nuclear matter density
are needed to reproduce the size and shape of the experimental spectra.
","[{""version"":""v1"",""created"":""Mon, 20 Oct 1997 10:54:31 GMT""}]","2009-10-30"
"physics/9710022","Thomas Larsson","T. A. Larsson","Fock representations of non-centrally extended super-diffeomorphism
  algebras","31 pages, LaTeX",,,,"math-ph hep-th math.MP math.QA",,"  A class of Fock representations of non-central extensions of the
super-diffeomorphism algebra in (N+1|M) dimensions is constructed, by
superization of the paper [physics/9705040]. The representations act on
trajectories in (N|M)-dimensional superspace, the extra dimension being the
parameter along the trajectory. The restrictions to various subalgebras are
considered. In particular, the centrally extended superconformal algebra is
obtained by restriction to the contact superalgebra K(1|1). This shows that one
of the basic assumptions in superstring theory (the distinguished nature of the
superconformal algebra) is incorrect.
","[{""version"":""v1"",""created"":""Mon, 20 Oct 1997 15:35:07 GMT""}]","2008-11-06"
"physics/9710023","Claus Wilke","C. Wilke, S. Altmeyer, T. Martinetz (Ruhr-Universitaet Bochum)","Aftershocks in Coherent-Noise Models","23 pages, 8 figures, Latex with elsart.cls, revised version accepted
  for publication in Physica D","Physica D 120:401-417 (1998)","10.1016/S0167-2789(98)00092-X",,"physics.data-an adap-org cond-mat.dis-nn cond-mat.stat-mech nlin.AO",,"  The decay pattern of aftershocks in the so-called 'coherent-noise' models [M.
E. J. Newman and K. Sneppen, Phys. Rev. E54, 6226 (1996)] is studied in detail.
Analytical and numerical results show that the probability to find a large
event at time $t$ after an initial major event decreases as $t^{-\tau}$ for
small $t$, with the exponent $\tau$ ranging from 0 to values well above 1. This
is in contrast to Sneppen und Newman, who stated that the exponent is about 1,
independent of the microscopic details of the simulation. Numerical simulations
of an extended model [C. Wilke, T. Martinetz, Phys. Rev. E56, 7128 (1997)] show
that the power-law is only a generic feature of the original dynamics and does
not necessarily appear in a more general context. Finally, the implications of
the results to the modeling of earthquakes are discussed.
","[{""version"":""v1"",""created"":""Mon, 20 Oct 1997 15:38:43 GMT""},{""version"":""v2"",""created"":""Thu, 12 Mar 1998 14:04:31 GMT""}]","2009-10-30"
"quant-ph/9710044","Sara Schneider","S. Schneider and G.J. Milburn","Decoherence in ion traps due to laser intensity and phase fluctuations","2 figures, submitted to PRA",,"10.1103/PhysRevA.57.3748",,"quant-ph",,"  We consider one source of decoherence for a single trapped ion due to
intensity and phase fluctuations in the exciting laser pulses. For simplicity
we assume that the stochastic processes involved are white noise processes,
which enables us to give a simple master equation description of this source of
decoherence. This master equation is averaged over the noise, and is sufficient
to describe the results of experiments that probe the oscillations in the
electronic populations as energy is exchanged between the internal and
electronic motion. Our results are in good qualitative agreement with recent
experiments and predict that the decoherence rate will depend on vibrational
quantum number in different ways depending on which vibrational excitation
sideband is used.
","[{""version"":""v1"",""created"":""Mon, 20 Oct 1997 02:43:49 GMT""}]","2009-10-30"
"quant-ph/9710045","Yeranuhy Hakobyan","Ye.M.Hakobyan, G.S.Pogosyan, A.N.Sissakian, S.I.Vinitsky","Isotropic oscillator in the space of constant positive curvature.
  Interbasis expansions","21 pages, LaTex","Phys. Atom. Nucl. 62 (1999) 623-637; Yad. Fiz . 62 (1999) 671-685",,,"quant-ph hep-th math-ph math.MP",,"  The Schr\""odinger equation is thoroughly analysed for the isotropic
oscillator in the three-dimensional space of constant positive curvature in the
spherical and cylindrical systems of coordinates. The expansion coefficients
between the spherical and cylindrical bases of the oscillator are calculated.
It is shown that the relevant coefficients are expressed through the
generalised hypergeometric functions $_4F_3$ of the unit argument or $6_j$
Racah symbols extended over their indices to the region of real values.
Limiting transitions to a free motion and flat space are considered in detail.
Elliptic bases of the oscillator are constructed in the form of expansion over
the spherical and cylindrical bases. The corresponding expansion coefficients
are shown to obey the three-term recurrence relations.
","[{""version"":""v1"",""created"":""Mon, 20 Oct 1997 14:36:59 GMT""},{""version"":""v2"",""created"":""Mon, 12 Jul 1999 20:26:05 GMT""}]","2007-05-23"
"solv-int/9710013","Manna Miguel","M. A. Manna and V. Merle","Asymptotic dynamics of short-waves in nonlinear dispersive models","to appears in Physical Review E. 4 pages, revtex files",,"10.1103/PhysRevE.57.6206",,"solv-int nlin.SI",,"  The multiple-scale perturbation theory, well known for long-waves, is
extended to the study of the far-field behaviour of short-waves, commonly
called ripples. It is proved that the Benjamin-Bona-Mahony- Peregrine equation
can propagates short-waves. This result contradict the Benjamin hypothesis that
short-waves tends not to propagate in this model and close a part of the old
controversy between Korteweg-de Vries and Benjamin-Bona-Mahony-Peregrine
equations. We shown that a nonlinear (quadratic) Klein-Gordon type equation
substitutes in a short-wave analysis the ubiquitous Korteweg-de Vries equation
of long-wave approach. Moreover the kink solutions of phi-4 and sine-Gordon
equations are understood as an all orders asymptotic behaviour of short-waves.
It is proved that the antikink solution of phi-4 model which was never obtained
perturbatively can be obtained by perturbation expansion in the wave-number k
in the short-wave limit.
","[{""version"":""v1"",""created"":""Mon, 20 Oct 1997 08:49:45 GMT""}]","2009-10-30"
