"alg-geom/9710023","Norbert A'Campo","Norbert A'Campo","Real deformations and complex topology of plane curve singularities","16 pages TeX with 11 fig-xx.eps","Ann. Fac. Sci. Toulouse Math. (6) 8 (1999), no. 1, 5-23",,,"alg-geom math.AG",,"  This is the paper as published. The topology of a complex plane curve
singularity with real branches is deduced from any real deformation having
delta crossings. An example of the computation of the global geometric
monodromy of a polynomial mapping is added.
","[{""version"":""v1"",""created"":""Mon, 20 Oct 1997 00:13:22 GMT""},{""version"":""v2"",""created"":""Mon, 3 Apr 2000 13:32:16 GMT""}]","2007-05-23"
"alg-geom/9710024","Sadok Kallel","S. Kallel and R.J. Milgram","The Geometry of the Space of Holomorphic Maps from a Riemann Surface
  into Complex Projective Space","47 pages, plain TeX. To appear in J. Diff. Geo",,,,"alg-geom math.AG",,"  In this paper we study the topology of the spaces Hol(M,P{n},k) of (basepoint
preserving) holomorphic maps of a given degree k from a Riemann surface M of
genus g>0 into the n-th complex projective space P{n}, n>0. Using symmetric
products of the surface as well as the geometry of the associated Abel-Jacobi
maps, we construct an explicit topological compactification of Hol(M,P{n},k)
which allow us to construct spectral sequences with known E_1-terms that can be
used to determine the homology groups of Hol(M,P{n},k). Complete calculations
are given for the elliptic case (g=1). Complete rational calculations are also
given for hyperelliptic curves.
","[{""version"":""v1"",""created"":""Mon, 20 Oct 1997 03:09:10 GMT""}]","2007-05-23"
"alg-geom/9710025","Stephan Endrass","Stephan Endrass","Minimal even sets of nodes","LaTeX 2e, 17 pages",,,,"alg-geom math.AG",,"  We extend some results on even sets of nodes which have been proved for
surfaces up to degree 6 to surfaces up to degree 10. In particular, we give a
formula for the minimal cardinality of a nonempty even set of nodes.
","[{""version"":""v1"",""created"":""Mon, 20 Oct 1997 10:49:54 GMT""}]","2007-05-23"
"astro-ph/9710201","Vladimir Avila Reese","V. Avila-Reese (1), C. Firmani (2,1) and X. Hern\'andez (1,3) ((1)
  Instituto de Astronomia-UNAM, (2) Centro de Instrumentos-UNAM, (3) Inst. of
  Astronomy, Cambridge University)","On Formation and Evolution of Disk Galaxies: Cosmological Initial
  Conditions and the Gravitational Collapse","31 pages, 7 ps figures. Accepted in ApJ. Minor corrections suggested
  by the referee","Astrophys.J.505:37,1998","10.1086/306136",,"astro-ph",,"  We use a semianalytical approach and a CDM cosmological model to study the
gravitational collapse and virialization, the structure, as well as the global
and statistical properties of isolated dark matter galactic halos which emerge
from primordial Gaussian fluctuations. From the statistical properties of the
density fluctuation field the possible mass aggregation histories (MAHs) are
generated, and these histories are used as the initial conditions of the
gravitational collapse. To calculate the structure of the virialized systems we
have generalized the secondary infall model. Although a range of halo
structures is obtained, the average density profiles agree with the profile
derived as a fitting formula to results of N-body cosmological simulations. The
comparison of the density profiles with the observational data is disscused,
and some possible solutions to the disagreement found in the inner regions are
discussed. The results of our approach, after considering the gravitational
dragging of the baryon matter that forms a central disk in centrifugal
equilibrium, show that the Tully-Fisher relation and its scatter can be
explained through the initial cosmological conditions. The sigma8=1 SCDM model
produces galaxies with high velocities when compared to observations, but when
the SCDM power spectrum is normalized to sigma8=0.57 an excellent agreement
with the observable TF relation is found, suggesting that this relation is the
natural extension to galactic scales of the observed galaxy distribution power
spectrum. The theoretical TF scatter is close to the measured one. The slope of
the TF relation is practically invariant with respect to the spin parameter
lambda.
","[{""version"":""v1"",""created"":""Sun, 19 Oct 1997 23:37:27 GMT""},{""version"":""v2"",""created"":""Wed, 22 Apr 1998 03:30:55 GMT""}]","2010-04-06"
"astro-ph/9710202","Brian Boyle","Boyle (AAO), R.J.Smith (IoA), T.Shanks (Durham), S.M.Croom (Durham),
  L.Miller (Oxford)","The AAO 2dF QSO Redshift Survey","Oral contribution to IAU Symposium 183 1 LaTeX file (+ style file), 7
  pages, 4 figures",,,,"astro-ph",,"  We describe the aims, strategy and status of the AAO 2dF QSO redshift survey.
This goal of the survey is to obtain redshifts for 30000 QSOs in a homogeneous
magnitude limited (B<21) survey. The survey began in early 1997 and should be
complete by the end of 1999.
","[{""version"":""v1"",""created"":""Mon, 20 Oct 1997 00:41:05 GMT""}]","2007-05-23"
"astro-ph/9710203","Tomonori Totani","T. Totani, K. Sato (U. Tokyo), H.E. Dalhed and J.R. Wilson (LLNL)","Future Detection of Supernova Neutrino Burst and Explosion Mechanism","28 pages including all figures. Accepted by Astrophys. J","Astrophys.J. 496 (1998) 216-225","10.1086/305364","UTAP-276/97, RESCEU-42/97","astro-ph hep-ex hep-ph",,"  Future detection of a supernova neutrino burst by large underground detectors
would give important information for the explosion mechanism of collapse-driven
supernovae. We studied the statistical analysis for the future detection of a
nearby supernova by using a numerical supernova model and realistic Monte-Carlo
simulations of detection by the Super-Kamiokande detector. We mainly discuss
the detectability of the signatures of the delayed explosion mechanism in the
time evolution of the $\anue$ luminosity and spectrum. For a supernova at 10
kpc away from the Earth, we find that not only the signature is clearly
discernible, but also the deviation of energy spectrum from the Fermi-Dirac
(FD) distribution can be observed. The deviation from the FD distribution
would, if observed, provide a test for the standard picture of neutrino
emission from collapse-driven supernovae. For the $D$ = 50 kpc case, the
signature of the delayed explosion is still observable, but statistical
fluctuation is too large to detect the deviation from the FD distribution. We
also propose a method for statistical reconstruction of the time evolution of
$\anue$ luminosity and spectrum from data, by which we can get a smoother time
evolution and smaller statistical errors than a simple, time-binning analysis.
This method is useful especially when the available number of events is
relatively small, e.g., a supernova in the LMC or SMC. Neutronization burst of
$\nu_e$'s produces about 5 scattering events when $D$ = 10 kpc and this signal
is difficult to distinguish from $\anue p$ events.
","[{""version"":""v1"",""created"":""Mon, 20 Oct 1997 10:05:59 GMT""}]","2009-10-30"
"astro-ph/9710204","Jesus Pando","J. Pando, P. Lipa, M. Greiner, and L.Z. Fang","Probing Hierarchical Clustering by Scale-Scale Correlations of Wavelet
  Coefficients","10 pages, 1 ps figure included. Uses AAS Latex macros. Accpeted in
  the Astrophysical Journal",,"10.1086/305386",,"astro-ph",,"  It is of fundamental importance to determine if and how hierarchical
clustering is involved in large-scale structure formation of the universe.
Hierarchical evolution is characterized by rules which specify how dark matter
halos are formed by the merging of halos at smaller scales. We show that
scale-scale correlations of the matter density field are direct and sensitive
measures to quantify this merging tree. Such correlations are most conveniently
determined from discrete wavelet transforms. Analyzing two samples of Ly-alpha
forests of QSO's absorption spectra, we find significant scale-scale
correlations whose dependence is typical for a branching process. Therefore,
models which predict a ""history"" independent evolution are ruled out and the
halos hosting the Ly-alpha clouds must have gone through a ""history"" dependent
merging process during their formation.
","[{""version"":""v1"",""created"":""Mon, 20 Oct 1997 10:48:59 GMT""}]","2009-10-30"
"astro-ph/9710205","Garrelt Mellema","Garrelt Mellema (1), Alejandro C. Raga (2), Jorge Canto(2), Peter
  Lundqvist (1), Bruce Balick (3), Wolfgang Steffen (4), Alberto Noriega-Crespo
  (5) ((1) Stockholm Observatory, Sweden, (2) Inst. de Astronomia, UNAM,
  Mexico, (3) Astronomy Dept., U. Washington, Seattle, USA, (4) Univ. of
  Manchester, UK, (5) IPAC, Pasadena, USA)","Photo-evaporation of clumps in Planetary Nebulae","12 pages, 8 figures. A&A LaTeX v4.01. To appear in A&A. Related mpeg
  movie can be found at http://www.astro.su.se/~garrelt/photoclump.html",,,"STOCK_SN_005","astro-ph",,"  We study the evolution of dense neutral clumps located in the outer parts of
planetary nebulae. These clumps will be photo-ionized by the ionizing radiation
from the central star and change their structure in the process. The main
effect of the ionization process is the setting up of a photo-evaporation flow
and a shock running through the clump. Once this shock has moved through the
entire clump it starts to accelerate because of the `rocket effect'. This
continues until the entire clump has been photo-ionized. We present an analytic
model for the shock and accelerating phases and also the results of numerical
simulations which include detailed microphysics. We find a good match between
the analytic description and the numerical results and use the numerical
results to produce some of the clump's observational characteristics at
different phases of its evolution. We compare the results with the properties
of the fast moving low ionization knots (ansae or FLIERs) seen in a number of
planetary nebulae. We find that the models match many of the kinematic and
emission properties of FLIERs.
","[{""version"":""v1"",""created"":""Mon, 20 Oct 1997 13:13:25 GMT""}]","2007-05-23"
"astro-ph/9710206","Harud-Or Rashid","Matts Roos and S. M. Harun-or-Rashid","The case for a cosmological constant","7 Pages, 2 Figures, Latex2e. To be published in Astronomy and
  Astrophysics","Astron.Astrophys.329:L17,1998",,,"astro-ph",,"  Taking the Hubble constant to be in the range 60 - 75 km/s Mpc we show that
three independent conditions strongly rule out the standard model of flat space
with vanishing cosmological constant.
","[{""version"":""v1"",""created"":""Mon, 20 Oct 1997 13:31:37 GMT""}]","2011-05-23"
"astro-ph/9710207","Martin Kerscher","Martin Kerscher","Regularity in the distribution of superclusters","4 pages, Latex, 4 eps-figures included, using epsf.sty, sprocl.sty;
  to appear in the proceedings of the Potsdam cosmology workshop 1997",,,,"astro-ph",,"  Using a measure of clustering derived from the nearest neighbour distribution
and the void probability function we are able to distinguish between regular
and clustered structures. With an example we show that regularity is a property
of a point set, which may be invisible in the two point correlation function.
Applying this measure to a supercluster catalogue we conclude that there is
some evidence for regular structures on large scales.
","[{""version"":""v1"",""created"":""Mon, 20 Oct 1997 13:55:47 GMT""}]","2007-05-23"
"astro-ph/9710208","Zoltan Haiman","Zoltan Haiman and Abraham Loeb (Harvard Univ.)","Observational Signatures of the First Quasars","28 pages, latex, 9 figures included, submitted to ApJ","Astrophys.J. 503 (1998) 505","10.1086/306017",,"astro-ph",,"  We study the observational signatures of a potential population of
low-luminosity quasars at high redshifts in a LambdaCDM cosmology. We derive
the evolution of the quasar luminosity function at fainter luminosities and
higher redshifts than currently detected, based on three assumptions: (1) the
formation of dark-matter halos follows the Press-Schechter theory, (2) the
ratio of central black hole mass to halo mass is the same for all halos, and
(3) the light-curve of quasars, in Eddington units, is universal. We show that
a universal light-curve provides an excellent fit to the observed quasar
luminosity function at redshifts 2.6 < z < 4.5. By extrapolating the evolution
of this luminosity function to higher redshifts (4.5 < z < 20), we find that
the associated early population of low-luminosity quasars reionizes the
universe around redshift z=12. The reprocessing of the UV light of these
quasars by dust from early type II supernovae, distorts the microwave
background spectrum by a Compton y-parameter, y = 1e-5, comparable to the upper
limit set by COBE. The Next Generation Space Telescope could detect tens of
quasars from redshifts z > 10 per square arcminute, with its proposed 1nJy
sensitivity at 1-3.5 microns. Absorption spectra of several such quasars would
reveal the reionization history of the universe.
","[{""version"":""v1"",""created"":""Mon, 20 Oct 1997 14:24:28 GMT""}]","2009-10-30"
"astro-ph/9710209",,"Simon F. Portegies Zwart (University of Amsterdam, The Netherlands),
  Christopher A. Tout (Monash University, Australia) and Hyung Mok Lee (Pusan
  National University, Korea)","Stellar Evolution and Dynamics in Star Clusters","6 pages including 3 figures, Latex; to appear in Highlights of
  Astronomy Vol. 11, Kluwer Academic Publishers, ed. Johannes Andersen",,,,"astro-ph",,"  Dynamical models of star clusters are maturing in the sense that effects
other than simple point particle dynamics are taken into account. We summarize
the relevance of and prospects for this new generation of N-body models.
","[{""version"":""v1"",""created"":""Mon, 20 Oct 1997 14:45:39 GMT""}]","2007-05-23"
"astro-ph/9710210","Hugo Martel","Paul R. Shapiro (University of Texas), Alejandro C. Raga (UNAM,
  Mexico), and Garrelt Mellema (Stockholm Observatory)","Reionization Feedback and the Photoevaporation of Intergalactic Clouds","1 latex file (shapiro.tex), 1 style file (conf_iap.sty) and 3 figures
  (shapiroa1.ps, shapiro1b.ps, shapiro2.ps), combined into one gzip-ed tar
  file. Structure and Evolution of the IGM from QSO Absorption Line Systems
  (13th IAP Colloquium), eds. P. Petitjean and S. Charlot (Paris: Editions
  Frontiere), in press",,,,"astro-ph",,"  Energy released by a small fraction of the baryons in the universe, which
condensed out of while the IGM was cold, dark, and neutral,reheated and
reionized it, exposing gas clouds within it to the glare of ionizing radiation.
The first gas dynamical simulations of the photoevaporation of an intergalactic
cloud by a quasar, including radiative transfer, are presented, along with a
few observational diagnostics.
","[{""version"":""v1"",""created"":""Mon, 20 Oct 1997 15:13:06 GMT""},{""version"":""v2"",""created"":""Tue, 21 Oct 1997 21:34:16 GMT""}]","2007-05-23"
"astro-ph/9710211","Roel van der Meulen","R. D. van der Meulen (2 and 5), H. Bloemen (2 and 5), K. Bennett (4),
  W. Hermsen (2), L. Kuiper (2), R. P. Much (4), J. Ryan (3), V. Sch""onfelder
  (1), A. Strong (1) ((1) MPE, Garching, Germany (2) SRON-Utrecht, The
  Netherlands (3) Univ. of New Hampshire, USA (4) ESTEC, The Netherlands (5)
  Leiden Observatory, The Netherlands)","COMPTEL gamma-ray study of the Crab nebula","6 pages, LaTex using A&A macros, including 3 PS figures. Accepted for
  publication in A&A",,,,"astro-ph",,"  We report on a study of the gamma-ray continuum emission from the Crab
supernova nebula and on a search for nuclear de-excitation gamma-ray lines.
Crab is the brightest continuum source in the 1-10 MeV gamma-ray sky, and its
continuum radiation is most likely of synchrotron origin. It is a likely source
of cosmic rays through shock acceleration and thus a potential candidate for
gamma-ray line emission from nuclear interactions. Five years of COMPTEL
observations enable a fine spectral binning to investigate the behaviour of the
0.75-30 MeV emission in detail and to search for nuclear de-excitation lines on
top of the continuum. The nebular spectrum shows a break at the edge of the
COMPTEL energy range and connects well to the EGRET spectrum, probably
reflecting electron energy losses in the synchrotron emission scenario. Such a
smooth continuum model alone may not be sufficient to explain the observations.
A weak bump in the spectrum at 1-2 MeV may be present. No significant evidence
for distinct line emission is seen, but the presence of a blend of line
features or another synchrotron component cannot be excluded.
","[{""version"":""v1"",""created"":""Mon, 20 Oct 1997 15:42:08 GMT""}]","2007-05-23"
"chao-dyn/9710015","Jayme Vicente De Luca","Jayme De Luca","Electrodynamics of helium with retardation and diffusion along the
  center manifold of Wannier orbits",,,,,"chao-dyn nlin.CD",,"  We show that an extra complex constant of motion with an analytic form can
exist in the neighborhood of some discrete Wannier orbits of helium, when one
includes retardation and self-interaction effects. The energies of these
discrete Wannier orbits are in the correct atomic magnitude. The highest
frequency in the stable manifold of one such orbit agrees with the highest
frequency sharp line (2P-1S) of parahelium to within two percent. The generic
term of the frequency in the stable manifold to higher orbits is also in
agreement with the asymptotic form of quantum mechanics for helium.
","[{""version"":""v1"",""created"":""Mon, 20 Oct 1997 08:20:48 GMT""},{""version"":""v2"",""created"":""Thu, 6 Nov 1997 18:45:59 GMT""}]","2007-05-23"
"chao-dyn/9710016","Zoltan Kovacs","Zoltan Kovacs","Hierarchy in chaotic scattering in Hill's problem","13 pages, LaTeX (REVTeX), 6 PostScript figures in 22 files",,,,"chao-dyn nlin.CD",,"  Hierarchic properties of chaotic scattering in a model of satellite
encounters, studied first by Petit and Henon, are examined by decomposing the
dwell time function and comparing scattering trajectories. The analysis reveals
an (approximate) ternary organization in the chaotic set of bounded orbits and
the presence of a stable island. The results can open the way for a calculation
of global quantities characterizing the scattering process by using tools of
the thermodynamic formalism.
","[{""version"":""v1"",""created"":""Mon, 20 Oct 1997 10:09:14 GMT""}]","2007-05-23"
"cond-mat/9710195","Igor Aleiner","I.L. Aleiner and L.I. Glazman","Mesoscopic charge quantization","34 two-column pages, latex, 9 .eps figures included",,"10.1103/PhysRevB.57.9608",,"cond-mat.mes-hall",,"  We study the Coulomb blockade in a chaotic quantum dot connected to a lead by
a single channel at nearly perfect transmission. We take into account quantum
fluctuations of the dot charge and a finite level spacing for electron states
within the dot. Mesoscopic fluctuations of thermodynamic and transport
properties in the Coulomb blockade regime exist at any transmission
coefficient. In contrast to the previous theories, we show that by virtue of
these mesoscopic fluctuations, the Coulomb blockade is not destroyed completely
even at perfect transmission. The oscillatory dependence of all the observable
characteristics on the gate voltage is preserved, its period is still defined
by the charge of a single electron. However, phases of those oscillations are
random; because of the randomness, the Coulomb blockade shows up not in the
averages but in the correlation functions of the fluctuating observables (e.g.,
capacitance or tunneling conductance). This phenomenon may be called
""mesoscopic charge quantization"".
","[{""version"":""v1"",""created"":""Sun, 19 Oct 1997 18:06:49 GMT""}]","2009-10-30"
"cond-mat/9710196","Zheng Wen-jun","Wenjun Zheng, Yue Yu and Zhaobin Su (ITP, Chinese Academy of Sciences,
  Beijing, P.R.China)","Comparative Study of the Insulator-Hall Liquid-Insulator Transitions:
  Composite Boson Picture vs Composite Fermion Picture","5 pages, RevTex, 2 figures, a discussion of the T=0 dissipative
  conductivity is added",,,,"cond-mat.mes-hall",,"  Based on a newly advanced phenomenological understanding of the high-field
insulator- Hall liquid transition in a composite fermion picture, we extend its
composite boson counterpart to the analysis of the low-field insulator-Hall
liquid transition. We thus achieve a comparative study of these two
transitions. In this way, the similar reflection symmetries in filling factors
in both transitions are understood consistently as due to the symmetry of the
gapful excitations which dominate $\sigma_{xx}$ across the transitions, and the
abrupt change in $\sigma_{xy}$ at the transitions. The substantially different
characteristic energy scales involved in these two transitions can be
attributed to the differences in critical filling factors $\nu_c$ and the
effective masses. The opposite temperature-dependences of the critical
longitudinal resistivities are also well-understood, which can be traced to the
opposite statistical natures of the composite fermion and the composite boson.
We also give a tentative discussion of the zero-temperature dissipative
conductivity. The above results are supported by a recent experiment
(cond-mat/9708239).
","[{""version"":""v1"",""created"":""Mon, 20 Oct 1997 03:16:58 GMT""},{""version"":""v2"",""created"":""Sat, 6 Dec 1997 06:05:47 GMT""}]","2007-05-23"
"cond-mat/9710197",,"Andrew Matacz (University of Sydney, Australia)","Financial Modeling and Option Theory with the Truncated Levy Process","21 pages in Latex, 6 eps figures",,,"97-28","cond-mat.stat-mech q-fin.PR",,"  In recent studies the truncated Levy process (TLP) has been shown to be very
promising for the modeling of financial dynamics. In contrast to the Levy
process, the TLP has finite moments and can account for both the previously
observed excess kurtosis at short timescales, along with the slow convergence
to Gaussian at longer timescales. I further test the truncated Levy paradigm
using high frequency data from the Australian All Ordinaries share market
index. I then consider, for the early Levy dominated regime, the issue of
option hedging for two different hedging strategies that are in some sense
optimal. These are compared with the usual delta hedging approach and found to
differ significantly. I also derive the natural generalization of the
Black-Scholes option pricing formula when the underlying security is modeled by
a geometric TLP. This generalization would not be possible without the
truncation.
","[{""version"":""v1"",""created"":""Mon, 20 Oct 1997 05:44:13 GMT""}]","2008-12-10"
"cond-mat/9710198","Andrei Manolescu","Andrei Manolescu, Vidar Gudmundsson","The FIR-absorption of short period quantum wires and the transition from
  one to two dimensions","15 pages, 9 figures, Revtex, to appear in Phys. Rev. B",,"10.1103/PhysRevB.57.1668","IC/97/103","cond-mat.mes-hall",,"  We investigate the FIR-absorption of short period parallel quantum wires in a
perpendicular quantizing magnetic field. The external time-dependent electric
field is linearly polarized along the wire modulation. The mutual Coulomb
interaction of the electrons is treated self-consistently in the ground state
and in the absorption calculation within the Hartree approximation. We consider
the effects of a metal gate grating coupler, with the same or with a different
period as the wire modulation, on the absorption. The evolution of the
magnetoplasmon in the nonlocal region where it is split into several Bernstein
modes is discussed in the transition from: narrow to broad wires, and isolated
to overlapping wires. We show that in the case of narrow and not strongly
modulated wires the absorption can be directly correlated with the underlying
electronic bandstructure.
","[{""version"":""v1"",""created"":""Mon, 20 Oct 1997 12:16:33 GMT""}]","2009-10-30"
"cond-mat/9710199","Ch. Floe Kristjansen","B. Eynard (Durham) and C. Kristjansen (NBI)","An Iterative Solution of the Three-colour Problem on a Random Lattice","14 pages, LaTeX, misprints corrected, approximation of (6.20) refined","Nucl.Phys. B516 (1998) 529-542","10.1016/S0550-3213(98)00042-X","DTP-97-55, SPhT-97/122, NBI-HE-97-51","cond-mat.stat-mech hep-lat hep-th",,"  We study the generalisation of Baxter's three-colour problem to a random
lattice. Rephrasing the problem as a matrix model problem we discuss the
analyticity structure and the critical behaviour of the resulting matrix model.
Based on a set of loop equations we develop an algorithm which enables us to
solve the three-colour problem recursively
","[{""version"":""v1"",""created"":""Mon, 20 Oct 1997 14:46:58 GMT""},{""version"":""v2"",""created"":""Mon, 15 Dec 1997 16:36:13 GMT""}]","2009-10-30"
"dg-ga/9710019","Li Weiping","Weiping Li (OSU)","Cap-prodcut structures on the Fintushel-Stern spectral sequence","14 pages, no figure, AmsLaTex",,,,"dg-ga math.DG",,"  We show that there is a well-defined cap-product structure on the
Fintushel-Stern spectral sequence. Hence we obtain the induced cap-product
structure on the ${\BZ}_8$-graded instanton Floer homology. The cap-product
structure provides an essentially new property of the instanton Floer homology,
from a topological point of view, which multiplies a finite dimensional
cohomology class by an infinite dimensional homology class (Floer cycles) to
get another infinite dimensional homology class.
","[{""version"":""v1"",""created"":""Mon, 20 Oct 1997 13:40:13 GMT""}]","2007-05-23"
