"gr-qc/9710109","Clement Gerard","Gerard Clement","From Schwarzschild to Kerr: Generating spinning Einstein-maxwell fields
  from static fields","8 pages, Latex","Phys.Rev. D57 (1998) 4885-4889","10.1103/PhysRevD.57.4885","DF-UFES 002/97","gr-qc hep-th",,"  The Kerr solution is generated from the Schwarzschild solution by a simple
combination of real global coordinate transformations and of invariance
transformations acting on the space of stationary solutions of the
Einstein-Maxwell equations. The same transformation can be used to generate a
spinning field configuration from any static axisymmetric configuration. We
illustrate this by generating from the continuous family of Voorhees--Zipoy
vacuum solutions a family of solutions endowed with mass, angular momentum,
dipole magnetic moment and quadrupole electric moment.
","[{""version"":""v1"",""created"":""Thu, 23 Oct 1997 18:52:54 GMT""}]","2009-10-30"
"gr-qc/9710111","Toni Arbona","A. Arbona, C. Bona, J. Carot, L. Mas, J. Masso, J. Stela","Stuffed Black Holes","12 pages, Latex, 4 postscript figures, corrected some typos, new
  section about physical interpretation","Phys.Rev. D57 (1998) 2397-2402","10.1103/PhysRevD.57.2397",,"gr-qc",,"  Initial data corresponding to spacetimes containing black holes are
considered in the time symmetric case. The solutions are obtained by matching
across the apparent horizon different, conformally flat, spatial metrics. The
exterior metric is the vacuum solution obtained by the well known conformal
imaging method. The interior metric for every black hole is regular everywhere
and corresponds to a positive energy density. The resulting matched solutions
cover then the whole initial (Cauchy) hypersurface, without any singularity,
and can be useful for numerical applications. The simpler cases of one black
hole (Schwarzschild data) or two identical black holes (Misner data) are
explicitly solved. A procedure for extending this construction to the multiple
black hole case is also given, and it is shown to work for all time symmetric
vacuum solutions obtained by the conformal imaging method. The numerical
evolution of one such 'stuffed' black hole is compared with that of a pure
vacuum or 'plain' black hole in the spherically symmetric case.
","[{""version"":""v1"",""created"":""Fri, 24 Oct 1997 11:13:01 GMT""},{""version"":""v2"",""created"":""Thu, 26 Feb 1998 10:47:00 GMT""}]","2009-10-30"
"hep-ex/9710025","Stefan Soldner-Rembold","Jochen Patt","Results from Gamma-Gamma Collisions in OPAL","4 pages, 4 figures, uses aipproc.sty, submitted to the proceedings of
  7th International Conference on Hadron Spectroscopy (HADRON 97), Brookhaven,
  25-30 August 1997",,"10.1063/1.56086","Freiburg EHEP-97-18","hep-ex",,"  The production of charged hadrons and jets is measured in collisions of
quasi-real photons. The data were taken with the OPAL detector at LEP at e+e-
centre-of-mass energies of 161 and 172 GeV. The measured cross-sections are
compared to perturbative next-to-leading order QCD calculations. The separation
of the direct and the resolved component of the photon is demonstrated.
","[{""version"":""v1"",""created"":""Thu, 23 Oct 1997 17:47:18 GMT""}]","2009-10-30"
"hep-ex/9710026","Steven Wasserbaech","The ALEPH Collaboration","Updated measurement of the tau lepton lifetime","17 pages, Latex; to be published in Physics Letters B","Phys.Lett.B414:362-372,1997","10.1016/S0370-2693(97)01116-7","CERN-PPE/97-090","hep-ex",,"  A new measurement of the mean lifetime of the tau lepton is presented. Three
different analysis methods are applied to a sample of 90000 tau pairs,
collected in 1993 and 1994 with the ALEPH detector at LEP. The average of this
measurement and those previously published by ALEPH is tau_tau = 290.1 +- 1.5
+- 1.1 fs.
","[{""version"":""v1"",""created"":""Thu, 23 Oct 1997 20:28:55 GMT""}]","2012-08-27"
"hep-ex/9710027","Jose Hernandez","ZEUS Collaboration","Event Shape Analysis of Deep Inelastic Scattering Events with a Large
  Rapidity Gap at HERA","23 pages including 4 figures","Phys.Lett.B421:368-384,1998","10.1016/S0370-2693(97)01539-6","DESY-97-202","hep-ex",,"  A global event shape analysis of the multihadronic final states observed in
neutral current deep inelastic scattering events with a large rapidity gap with
respect to the proton direction is presented. The analysis is performed in the
range $5 \leq Q^2 \leq 185\gev^2$ and $160 \leq W \leq 250\gev$, where $Q^2$ is
the virtuality of the photon and $W$ is the virtual-photon proton centre of
mass energy. Particular emphasis is placed on the dependence of the shape
variables, measured in the $\gamma^*-$pomeron rest frame, on the mass of the
hadronic final state, $M_X$. With increasing $M_X$ the multihadronic final
state becomes more collimated and planar. The experimental results are compared
with several models which attempt to describe diffractive events. The
broadening effects exhibited by the data require in these models a significant
gluon component of the pomeron.
","[{""version"":""v1"",""created"":""Thu, 23 Oct 1997 20:20:17 GMT""}]","2012-08-27"
"hep-lat/9710081","Hugo Fort","H. Fort (IFFC, Montevideo)","Numerical Computations in the Worldsheet Formulation","Talk presented at LATTICE 97, Edinburgh. 3 pages, 2 .eps figures,
  uses espcrc2.sty","Nucl.Phys.Proc.Suppl. 63 (1998) 793-795","10.1016/S0920-5632(97)00902-X",,"hep-lat",,"  The worldsheet formulation of lattice gauge theories has two appealing
features: the gauge non-redundancy and the geometrical transparency. Both
properties are profitable in order to perform numerical computations. In the
case of dynamical fermions this description offers additional advantages. For
instance, it does not suffer from the species doubling problem and it involves
fewer degrees of freedom.
","[{""version"":""v1"",""created"":""Thu, 23 Oct 1997 17:35:30 GMT""}]","2009-10-30"
"hep-lat/9710082","Hugo Fort","H. Fort (IFFC, Montevideo, Uruguay)","The Worldsheet Formulation as an Alternative Method for Simulating
  Dynamical Fermions","4 pages, 1 eps figure, revtex","Phys.Lett. B444 (1998) 174-178","10.1016/S0370-2693(98)01377-X",,"hep-lat hep-ph hep-th",,"  The recently proposed worldsheet formulation of lattice fermions is tested
for the first time carrying out a simulation for the simplest model: the
one-flavor, strictly massless lattice Schwinger model. A main advantage of this
alternative method for simulating dynamical fermions consists in its economy:
it involves many fewer degrees of freedom than the ordinary Kogut-Susskind
formulation. The known continuum limit is reproduced by the method for
relatively small lattices.
","[{""version"":""v1"",""created"":""Fri, 24 Oct 1997 13:11:45 GMT""}]","2009-10-30"
"hep-lat/9710083","Thomas Manke","UKQCD Collaboration: T. Manke, I. T. Drummond, R. R. Horgan, H. P.
  Shanahan","Heavy Hybrids from NRQCD","9 pages, LaTeX2e, 2 figures, uses styles [11pt, a4wide, epsf]","Phys.Rev.D57:3829-3832,1998","10.1103/PhysRevD.57.3829","DAMTP-97-110","hep-lat hep-ph",,"  We present a quenched lattice calculation for the lowest lying $b \bar b
g$-hybrid states in the framework of NRQCD using the leading order Hamiltonian
up to ${\cal O}(mv^2)$. We demonstrate the existence of a nearly degenerate
rotational band of states with an excitation energy approximately 1.6 GeV above
the $\Upsilon$ ground state. This lies around the $B \bar B_J^*$-threshold but
well above the $B \bar B$-threshold. Therefore a heavy hybrid signal may well
be detected if the centre-of-mass energy in B-factories is raised a few hundred
MeV to coincide with other resonances above the 4S state. Our prediction is
consistent with most phenomenological models and lattice calculations carried
out in the static limit.
","[{""version"":""v1"",""created"":""Fri, 24 Oct 1997 15:55:22 GMT""}]","2009-12-30"
"hep-ph/9710447","Jose Wudka","Ernest Ma, D.P Roy, and Jose Wudka","Enhanced Three-Body Decay of the Charged Higgs Boson","11 pages, 2 figures, revtex and epsf required","Phys.Rev.Lett. 80 (1998) 1162-1165","10.1103/PhysRevLett.80.1162","UCRHEP-T203","hep-ph",,"  If the charged Higgs boson H+ exists with mh < mt + mb, the conventional
expectation is that it will decay dominantly into c s-bar and tau+ nu-tau.
However, the three-body decay mode H+ --> W+ b b-bar is also present and we
show that it becomes very important in the low tan(beta) region for mh >~ 140
GeV. We explore its phenomenological implications for the charged-Higgs-boson
search in top-quark decay.
","[{""version"":""v1"",""created"":""Thu, 23 Oct 1997 20:31:18 GMT""},{""version"":""v2"",""created"":""Tue, 4 Nov 1997 18:01:18 GMT""},{""version"":""v3"",""created"":""Mon, 5 Jan 1998 17:45:21 GMT""}]","2009-10-30"
"hep-ph/9710451","Tilman Plehn","W. Beenakker, M. Kr\""amer, T. Plehn, M. Spira, P.M. Zerwas","Stop Production at Hadron Colliders","15 pages, LaTeX","Nucl.Phys. B515 (1998) 3-14","10.1016/S0550-3213(98)00014-5","DESY 97-43, CERN-TH/97-177, RAL-TR-97-056","hep-ph",,"  Stop particles are expected to be the lightest squarks in supersymmetric
theories and the search for these particles is an important experimental task.
We therefore present the cross sections for the production processes
$p\bar{p}/pp \to \ste\steb$ and $\stz\stzb$ at Tevatron and LHC energies in
next-to-leading order supersymmetric QCD. The corrections stabilize the
theoretical predictions for the cross sections, and they are positive, thus
raising the cross sections to values above the leading-order predictions. Mixed
$\ste\stzb/\steb\stz$ pairs can only be generated in higher orders at strongly
suppressed rates.
","[{""version"":""v1"",""created"":""Thu, 23 Oct 1997 16:52:19 GMT""}]","2009-10-30"
"hep-ph/9710452","Luis Bento","Luis Bento (Universidade de Lisboa)","Neutrino Oscillations: a source of Goldstone fields","12 pages, LATeX with RevTex, 1 figure, reference [4] corrected, to
  appear in Phys. Rev. D 1 (1998)","Phys.Rev. D57 (1998) 583-588","10.1103/PhysRevD.57.583","CFNUL/97-01","hep-ph hep-th",,"  It is proved that true Goldstone bosons develop coherent fields whenever the
associated charges of the matter particles are not conserved in a macroscopic
scale. The sources of the Goldstone fields are the time rates of quantum number
violation. The case of neutrino flavour oscillations is studied with
application to Supernovae. It is shown that if the Lepton numbers break at the
Fermi scale, the neutrino potentials and oscillation patterns change in the
periods of largest neutrino fluxes. In this way, electron anti-neutrino to muon
anti-neutrino oscillations may occur in the first instants of neutrino
emission.
","[{""version"":""v1"",""created"":""Thu, 23 Oct 1997 18:25:49 GMT""},{""version"":""v2"",""created"":""Sun, 30 Nov 1997 18:46:07 GMT""}]","2009-10-30"
"hep-ph/9710453","Jisuke Kubo","Yoshiharu Kawamura, Tatsuo Kobayashi Jisuke Kubo","Sum rules in the superpartner spectrum of the minimal supersymmetric
  standard model","10 pages, LaTex 4 figures","Phys.Lett. B432 (1998) 108-113","10.1016/S0370-2693(98)00605-4","Technical University of Munich Report TUM-HEP-297/97","hep-ph",,"  Assuming that the string inspired, universal sum rules for soft
supersymmetry-breaking terms, which have been recently found both in a wide
class of four-dimensional superstrings and in supersymmertic gauge-Yukawa
unified gauge models, are satisfied above and at the grand unification scale,
we investigate theirlow energy consequences and derive sum rules in the
superpartner spectrum of the minimal supersymmetric standard model.
","[{""version"":""v1"",""created"":""Fri, 24 Oct 1997 05:41:28 GMT""}]","2009-10-30"
"hep-ph/9710454","Tanaka Kazuhiro","Jiro Kodaira (Hiroshima Univ.), Takashi Nasuno (Hiroshima Univ.),
  Hiroshi Tochimura (Hiroshima Univ.), Kazuhiro Tanaka (Juntendo Univ.) and
  Yoshiaki Yasui (RIKEN-BNL)","Renormalization of the Twist-3 Flavor Singlet Operators in a Covariant
  Gauge","10 pages, 12 Postscript figures, LaTeX. Misprints corrected.
  Proceedings of the DESY workshop, ""Deep inelastic scattering off polarized
  targets: Theory meets experiment"" help at DESY-Zeuthen, September 1-5, 1997",,,,"hep-ph",,"  We investigate the nucleon's transverse spin-dependent structure function
g_2(x, Q^2) in the framework of the operator product expansion and the
renormalization group. We construct the complete set of the twist-3 operators
for the flavor singlet channel, and give the relations among them. We develop
an efficient, covariant approach to derive the anomalous dimension matrix of
the twist-3 singlet operators by computing the off-shell Green's functions. As
an application, we investigate the Q^2-evolution of g_2(x, Q^{2}) for the
lowest moment case, and discuss its experimental implication.
","[{""version"":""v1"",""created"":""Fri, 24 Oct 1997 10:02:55 GMT""},{""version"":""v2"",""created"":""Mon, 24 Nov 1997 10:22:03 GMT""}]","2007-05-23"
"hep-ph/9710455","Robert Fleischer","Robert Fleischer (CERN)","CP Violation and Strategies for Extracting CKM Phases","12 pages, LaTeX, no figures. Invited plenary talk given at the IVth
  International Workshop on Progress in Heavy Quark Physics, Rostock, Germany,
  20-22 September 1997. To appear in the Proceedings",,,"CERN-TH/97-295","hep-ph",,"  The phenomenon of CP violation and strategies for extracting the angles of
the unitarity triangle are reviewed. Special emphasis is given to the B-meson
system, as it plays an outstanding role to test the Standard Model description
of CP violation at future experimental B-physics facilities. Both general
aspects and recent developments are discussed. It is pointed out that combined
branching ratios for $B_{u,d}\to\pi K$ modes, which have been observed recently
by the CLEO collaboration, and untagged $B_s\to K\bar{K}$ decays may allow us
to derive interesting constraints on the CKM angle $\gamma$ and may eventually
lead to a solid determination of this angle.
","[{""version"":""v1"",""created"":""Fri, 24 Oct 1997 13:57:19 GMT""}]","2007-05-23"
"hep-ph/9710456","M. R. Pennington","M.R. Pennington (Centre for Particle Theory, University of Durham,
  Durham, U.K)","The production model of Ishida et al. and unitarity",,,,,"hep-ph",,"  The relation between scattering and production amplitudes imposed by
unitarity and analyticity, recently criticised by Ishida et al., is explained.
","[{""version"":""v1"",""created"":""Fri, 24 Oct 1997 14:16:03 GMT""}]","2007-05-23"
"hep-ph/9710457","M. R. Pennington","M. Boglione and M.R. Pennington (Centre for Particle Theory,
  University of Durham, Durham, U.K)","Dressing the Scalar Glueball","4pages, TEX, Fig. 1 is as Fig.1. in Ref 10. Contribution to the
  Seventh International Conference on Hadron Spectroscopy, Brookhaven, August
  1997",,"10.1063/1.55951",,"hep-ph",,"  The hadronic dressing of the ten lightest scalar mesons, the $q{\bar q}$
nonet and a glueball, is discussed.
","[{""version"":""v1"",""created"":""Fri, 24 Oct 1997 14:38:40 GMT""}]","2009-10-30"
"hep-ph/9710458","Phil Ratcliffe","Philip G. Ratcliffe (Univ. of Milano in Como and INFN - Milano)","A New Quark Model Approach to Hyperon Semi-Leptonic Decays","10 pages, Latex, uses FEYNMAN macros Presented at the Topical
  Workshop on Deep Inelastic Scattering off Polarized Targets: Theory Meets
  Experiment---Zeuthen, Sept. 1997",,,"UNICO-97-010","hep-ph",,"  A new analysis of hyperon semi-leptonic decay data is presented, based on
simple and general arguments for an SU(3)-breaking structure of the couplings
involved. The results obtained are compatible with those of earlier
investigations and highlight the uncertainties inherent in extraction of the
V_us Cabibbo-Kobayashi-Maskawa matrix element from such data, and the need for
complete analyses. For F and D, the results can be summarised by the ratio:
F/D=0.57+/-0.01; while as far as the value of V_us is concerned, the only
conclusion to be drawn is that, insofar as SU(3) breaking is still not totally
under control, the value obtained is compatible but not competitive with that
obtained from kaon semi-leptonic decays.
","[{""version"":""v1"",""created"":""Fri, 24 Oct 1997 15:13:59 GMT""}]","2007-05-23"
"hep-ph/9710460","Michael Pluemacher","W. Buchmuller and M. Plumacher","CP Asymmetry in Majorana Neutrino Decays","latex2e, 14 pages, 4 figures, extended version, conclusion changed","Phys.Lett. B431 (1998) 354-362","10.1016/S0370-2693(97)01548-7","DESY 97-190","hep-ph",,"  We study CP asymmetries in lepton-number violating two-body scattering
processes and show how they are related to CP asymmetries in the decays of
intermediate massive Majorana neutrinos. Self-energy corrections, which do not
contribute to CP asymmetries in two-body processes, induce CP violating
couplings of the intermediate Majorana neutrinos to lepton-Higgs states. We
briefly comment on the implications of these results for applications at finite
temperature.
","[{""version"":""v1"",""created"":""Fri, 24 Oct 1997 15:29:16 GMT""},{""version"":""v2"",""created"":""Mon, 4 May 1998 17:16:36 GMT""}]","2009-10-30"
"hep-th/9710178",,"Michael R. Douglas and Hirosi Ooguri","Why Matrix Theory is Hard","10 pages, harvmac; references added, minor corrections","Phys.Lett.B425:71-76,1998","10.1016/S0370-2693(98)00114-2",,"hep-th",,"  Recently Sen and Seiberg gave a prescription for constructing the matrix
theory in any superstring background. We use their prescription to test the
finite N matrix theory conjecture on an ALE space. Based on our earlier work
with Shenker, we find a sharper discrepancy between matrix theory computation
and supergravity prediction. We discuss subtleties in the light-front
quantization which may lead to a resolution to the discrepancy.
","[{""version"":""v1"",""created"":""Thu, 23 Oct 1997 23:53:06 GMT""},{""version"":""v2"",""created"":""Fri, 24 Oct 1997 00:55:22 GMT""},{""version"":""v3"",""created"":""Wed, 29 Oct 1997 09:05:00 GMT""}]","2009-09-17"
"hep-th/9710179","Dr R. Szabo","L. Cooper, I.I. Kogan and R.J. Szabo","Mirror Maps in Chern-Simons Gauge Theory","40 pages LaTeX, 4 postscript files, uses psfig.sty; minor textual
  changes, typos corrected, references added","Annals Phys. 268 (1998) 61-104","10.1006/aphy.1998.5832","OUTP-97-57P","hep-th cond-mat",,"  We describe mirror symmetry in N=2 superconformal field theories in terms of
a dynamical topology changing process of the principal fiber bundle associated
with a topological membrane. We show that the topological symmetries of
Calabi-Yau sigma-models can be obtained from discrete geometric transformations
of compact Chern-Simons gauge theory coupled to charged matter fields. We
demonstrate that the appearence of magnetic monopole-instantons, which
interpolate between topologically inequivalent vacua of the gauge theory,
implies that the discrete symmetry group of the worldsheet theory is realized
kinematically in three dimensions as the magnetic flux symmetry group. From
this we construct the mirror map and show that it corresponds to the
interchange of topologically non-trivial matter field and gauge degrees of
freedom. We also apply the mirror transformation to the mean field theory of
the quantum Hall effect. We show that it maps the Jain hierarchy into a new
hierarchy of states in which the lowest composite fermions have the same
filling fractions.
","[{""version"":""v1"",""created"":""Thu, 23 Oct 1997 19:17:25 GMT""},{""version"":""v2"",""created"":""Wed, 25 Mar 1998 18:00:59 GMT""}]","2009-10-30"
"hep-th/9710180",,"Ricardo Troncoso and Jorge Zanelli","New Gauge Supergravity in Seven and Eleven Dimensions","5pages, RevTeX, no figures, two columns, minor typos corrected","Phys.Rev.D58:101703,1998","10.1103/PhysRevD.58.101703",,"hep-th",,"  Locally supersymmetric systems in odd dimensions whose Lagrangians are
Chern-Simons forms for supersymmetric extensions of anti-de Sitter gravity are
discussed. The construction is illustrated for D=7 and 11. In seven dimensions
the theory is an N=2 supergravity whose fields are the vielbein
($e_{\mu}^{a}$), the spin connection ($\omega_{\mu}^{ab}$), two gravitini
($\psi_{\mu}^{i}$) and an $sp(2)$ gauge connection ($a_{\mu j}^{i}$). These
fields form a connection for $osp(2|8)$. In eleven dimensions the theory is an
N=1 supergravity containing, apart from $e_{\mu}^{a}$ and $\omega_{\mu}^{ab}$,
one gravitino $\psi_{\mu}$, and a totally antisymmetric fifth rank Lorentz
tensor one-form, $b_{\mu}^{abcde}$. These fields form a connection for
$osp(32|1)$. The actions are by construction invariant under local
supersymmetry and the algebra closes off shell without requiring auxiliary
fields. The $N=2^{[D/2]}$-theory can be shown to have nonnegative energy around
an AdS background, which is a classical solution that saturates the Bogomolnyi
bound obtained from the superalgebra.
","[{""version"":""v1"",""created"":""Thu, 23 Oct 1997 23:25:11 GMT""},{""version"":""v2"",""created"":""Sat, 24 Jan 1998 17:48:10 GMT""},{""version"":""v3"",""created"":""Thu, 28 May 1998 15:57:20 GMT""},{""version"":""v4"",""created"":""Sun, 29 Nov 1998 01:11:42 GMT""},{""version"":""v5"",""created"":""Sat, 30 Jan 1999 23:15:01 GMT""}]","2009-12-30"
"hep-th/9710181","Larus Thorlacius","Larus Thorlacius","Born-Infeld String as a Boundary Conformal Field Theory","8 pages, 1 figure, latex, references added","Phys.Rev.Lett. 80 (1998) 1588-1590","10.1103/PhysRevLett.80.1588","PUPT-1738","hep-th",,"  Solutions of Born-Infeld theory, representing strings extending from a
Dirichlet p-brane, are also solutions of the higher derivative generalization
of the Born-Infeld equations defining an exact open string vacuum
configuration.
","[{""version"":""v1"",""created"":""Fri, 24 Oct 1997 05:05:22 GMT""},{""version"":""v2"",""created"":""Sun, 9 Nov 1997 21:40:42 GMT""}]","2009-10-30"
"hep-th/9710182","Bernd Schroers","B.J. Schroers","Non-abelian Dyons","10 pages, latex, Talk given at Solitons Conference, Kingston,
  Ontario, July 1997",,,"ITFA-97-38","hep-th",,"  The dyonic quantum states of magnetic monopoles in Yang-Mills-Higgs theory
with a non-abelian unbroken gauge group display a subtle interplay between
magnetic and electric properties. This is described in detail in the theory
with the gauge group SU(3) broken to U(2), and shown to be captured by the
representation theory of the semi-direct product of U(2) with R^4. The
implications of this observation for the fusion rules and electric-magnetic
duality properties of dyonic states are pointed out.
","[{""version"":""v1"",""created"":""Fri, 24 Oct 1997 09:18:45 GMT""}]","2007-05-23"
"hep-th/9710183","Yu. A. Sitenko","Yu.A. Sitenko and A.Yu. Babansky","The Casimir-Aharonov-Bohm effect?","10 pages, LaTeX","Mod.Phys.Lett. A13 (1998) 379-386","10.1142/S0217732398000437",,"hep-th",,"  The combined effect of the magnetic field background in the form of a
singular vortex and the Dirichlet boundary condition at the location of the
vortex on the vacuum of quantized scalar field is studied. We find the induced
vacuum energy density and current to be periodic functions of the vortex flux
and holomorphic functions of the space dimension.
","[{""version"":""v1"",""created"":""Fri, 24 Oct 1997 09:22:49 GMT""}]","2009-10-30"
"hep-th/9710184","H. T. Ozer","H. T. Ozer","Vertex Operator Extension of Casimir W A(N) Algebras","7 pages,no figures,TeX file,(to appear in Mod.Phys.Lett.A)","Mod.Phys.Lett. A13 (1998) 2645-2652","10.1142/S0217732398002813",,"hep-th math-ph math.MP",,"  We give an extension of Casimir of Casimir $\cal{WA_N}$ algebras including a
vertex operator which depends on non-simple roots of $A_{N-1}$.
","[{""version"":""v1"",""created"":""Fri, 24 Oct 1997 11:47:41 GMT""},{""version"":""v2"",""created"":""Fri, 2 Oct 1998 09:20:58 GMT""}]","2009-10-30"
"hep-th/9710185","Sergei Ketov","Sergei V. Ketov (Institute for Theoretical Physics, Hannover) and
  Christine Unkmeir (Institute for Nuclear Physics, Mainz)","Induced scalar potentials for hypermultiplets","12 pages, LaTeX, macros included","Phys.Lett. B422 (1998) 179-186","10.1016/S0370-2693(98)00029-X","DESY 97--206 and ITP-UH-28/97","hep-th",,"  Charged BPS hypermultiplets can develop a non-trivial self-interaction in the
Coulomb branch of an N=2 supersymmetric gauge theory, whereas neutral BPS
hypermultiplets in the Higgs branch may also have a non-trivial
self-interaction in the presence of Fayet-Iliopoulos terms. The exact
hypermultiplet low-energy effective action (LEEA) takes the form of the
non-linear sigma-model (NLSM) with a hyper-K""ahler metric. A non-trivial scalar
potential is also quantum-mechanically generated at non-vanishing central
charges, either perturbatively (Coulomb branch), or non-perturbatively (Higgs
branch). We calculate the effective scalar potentials for (i) a single charged
hypermultiplet in the Coulomb branch and (ii) a single neutral hypermultiplet
in the Higgs branch. The first case corresponds to the NLSM with the Taub-NUT
(or KK-monopole) metric for the kinetic LEEA, whereas the second one is
attached to the NLSM having the Eguchi-Hanson instanton metric.
","[{""version"":""v1"",""created"":""Fri, 24 Oct 1997 10:55:59 GMT""}]","2009-10-30"
