"astro-ph/9710280","Armen Sedrakian","D. M. Sedrakian (1), A. Sedrakian (2), G. F. Zharkov (3) ((1) Yerevan
  State University, (2) CRSR Cornell University, (3) Lebedev Physical
  Institute)","Type I Superconductivity in Neutron Stars","5 pages, Latex, uses mn.sty","Mon.Not.Roy.Astron.Soc. 290 (1997) 203-207","10.1093/mnras/290.1.203",,"astro-ph",,"  The magnetic structure of neutron vortices in the superfluid cores of neutron
stars is determined assuming that the proton condensate forms a type I
superconductor. It is shown that the entrainment currents induced by the
neutron vortex circulation cause the proton superconductor to break into
successive domains of normal and superconducting regions. The Gibbs free-energy
is found in the case in which the normal domains form cylindrical tubes coaxial
with the neutron vortex. The minimum of the energy functional corresponds to a
tube radius $a\sim 0.1-0.5 ~b$, where $b$ is the outer radius of the neutron
vortex. The magnetic field within the tube is of the order of $ 5 \times
10^{14}$ G.
","[{""version"":""v1"",""created"":""Fri, 24 Oct 1997 15:30:26 GMT""}]","2015-06-24"
"cond-mat/9710251","David Senechal","David G. Shelton and David S\'en\'echal","SO(5)-Symmetric Description of the Low Energy Sector of a Ladder System","17 pages, ReVTeX, 1 eps figure included",,"10.1103/PhysRevB.58.6818","CRPS-97-24","cond-mat.str-el",,"  We study a system of two Tomonaga-Luttinger models coupled by a small
transverse hopping (a two-chain ladder). We use Abelian and non-Abelian
bosonisation to show that the strong coupling regime at low energies can be
described by an SO(5)$_1$ WZW model (or equivalently 5 massless Majorana
fermions) deformed by symmetry breaking terms that nonetheless leave the theory
critical at T=0. The SO(5) currents of the theory comprise the charge and spin
currents and linear combinations of the so-called pi operators (S.C. Zhang,
Science 275, 1089 (1997)) which are local in terms both of the original
fermions and those of the effective theory. Using bosonisation we obtain the
asymptotic behaviour of all correlation functions. We find that the 5 component
``superspin'' vector has power law correlations at T=0; other fermion bilinears
have exponentially decaying correlations and the corresponding tendencies are
suppressed. Conformal field theory also allows us to obtain the energies,
quantum numbers, and degeneracies of the low-lying states and fit them into
deformed SO(5) multiplets.
","[{""version"":""v1"",""created"":""Thu, 23 Oct 1997 22:41:25 GMT""},{""version"":""v2"",""created"":""Thu, 2 Apr 1998 13:58:56 GMT""},{""version"":""v3"",""created"":""Fri, 3 Apr 1998 02:44:42 GMT""}]","2009-10-30"
"cond-mat/9710252","Sidney Redner","L. Frachebourg(1), P. L. Krapivsky(2), and S. Redner(2) ((1) ENS,
  Paris, (2) Boston University)","Alternating Kinetics of Annihilating Random Walks Near a Free Interface","6 pages, RevTeX, 5 eps figures included","J. Phys. A 31, 2791-2799 (1998)","10.1088/0305-4470/31/12/005",,"cond-mat.stat-mech",,"  The kinetics of annihilating random walks in one dimension, with the
half-line x>0 initially filled, is investigated. The survival probability of
the nth particle from the interface exhibits power-law decay,
S_n(t)~t^{-alpha_n}, with alpha_n approximately equal to 0.225 for n=1 and all
odd values of n; for all n even, a faster decay with alpha_n approximately
equal to 0.865 is observed. From consideration of the eventual survival
probability in a finite cluster of particles, the rigorous bound alpha_1<1/4 is
derived, while a heuristic argument gives alpha_1 approximately equal to 3
sqrt{3}/8 = 0.2067.... Numerically, this latter value appears to be a stringent
lower bound for alpha_1. The average position of the first particle moves to
the right approximately as 1.7 t^{1/2}, with a relatively sharp and asymmetric
probability distribution.
","[{""version"":""v1"",""created"":""Thu, 23 Oct 1997 16:11:13 GMT""}]","2009-10-30"
"cond-mat/9710253","Michael Feigelman","L. Leylekian, M. Ocio, L. A. Gurevich and M. V. Feigel'man","Low Field Magnetic Response of the Granular Superconductor LaSrCuO","LATEX, twocolumns, 22 pages including 20 eps-figures","ZhETF 112 (1997) 2079","10.1134/1.558386",,"cond-mat.supr-con cond-mat.dis-nn",,"  The properties of the low excitation field magnetic response of the granular
high temperature (HTSC) superconductor LaSrCuO have been analyzed at low
temperatures. The response of the Josephson currents has been extracted from
the data. It is shown that intergrain current response is fully irreversible,
producing shielding response, but do not carry Meissner magnetization. Analysis
of the data shows that the system of Josephson currents freezes into a glassy
state even in the absense of external magnetic field, which is argued to be a
consequence of the d-wave nature of superconductivity in LaSrCuO. The
macroscopic diamagnetic response to very weak variations of the magnetic field
is shown to be strongly irreversible but still qualitatively different from any
previously known kind of the critical-state behaviour in superconductors.
  A phenomenological description of these data is given in terms of a newly
proposed ``fractal'' model of irreversibility in superconductors.
","[{""version"":""v1"",""created"":""Thu, 23 Oct 1997 17:44:47 GMT""}]","2009-10-30"
"cond-mat/9710254","Josef Ashkenazi","J. Ashkenazi (Physics Department, University of Miami)","Stripes, Non-Fermi-Liquid Behavior, and Two-Component Transport in the
  High-Tc Cuprates","3 pages including 3 figures, LateX",,"10.1016/S0022-3697(98)00101-2",,"cond-mat.supr-con",,"  Non-Fermi-liquid features of the high-Tc cuprates, and specifically the
systematic behavior of the resistivity, Hall constant, and thermoelectric
power, are shown to result from an electronic structure based on ""large-U"" and
""small-U"" orbitals, and the resulting striped structure.
","[{""version"":""v1"",""created"":""Thu, 23 Oct 1997 19:06:21 GMT""}]","2009-10-30"
"cond-mat/9710255","Marcel Franz","Zlatko Tesanovic (Johns Hopkins) and Pedro D. Sacramento (Lisboa)","Landau Levels and Quasiparticle Spectrum of Extreme Type-II
  Superconductors","5 pages REVTeX, 1 .ps figure included, inset available on request
  from zlatko@top.physics.arizona.edu",,,,"cond-mat.supr-con",,"  At high magnetic fields and low temperatures, numerous extreme type-II
superconductors exhibit Landau quantization of electronic motion. We present an
analytic construction of the quasiparticle spectrum in this regime, based on
the high-field expansion. The spectrum is gapless and is separated from the
familiar low-field regime by a quantum level-crossing transition. Such low
energy excitations should lead to observable effects in thermodynamics and
transport.
","[{""version"":""v1"",""created"":""Thu, 23 Oct 1997 20:13:20 GMT""}]","2007-05-23"
"cond-mat/9710256","Andre-Marie Tremblay","St\'ephane Pairault, David S\'en\'echal, and A.-M. S. Tremblay
  (CRPS,Sherbrooke)","Strong-Coupling Expansion for the Hubbard Model","4 pages, RevTex, 3 epsf figures included","Phys. Rev. Lett. 80, 5389 (1998)","10.1103/PhysRevLett.80.5389","CRPS-97-25","cond-mat.str-el",,"  A strong-coupling expansion for models of correlated electrons in any
dimension is presented. The method is applied to the Hubbard model in $d$
dimensions and compared with numerical results in $d=1$. Third order expansion
of the Green function suffices to exhibit both the Mott metal-insulator
transition and a low-temperature regime where antiferromagnetic correlations
are strong. It is predicted that some of the weak photoemission signals
observed in one-dimensional systems such as $SrCuO_2$ should become stronger as
temperature increases away from the spin-charge separated state.
","[{""version"":""v1"",""created"":""Thu, 23 Oct 1997 21:06:29 GMT""},{""version"":""v2"",""created"":""Tue, 16 Jun 1998 19:01:07 GMT""}]","2009-10-30"
"cond-mat/9710257",,"Dirk. K. Morr, Joerg Schmalian, Raivo Stern, and Charles P. Slichter
  (University of Illinois at Urbana-Champaign)","Comment on: ``Using Ni Substitution and $^{17}$O NMR to Probe the
  Susceptibility $\chi'(q)$ in Cuprates''","1 page, RevTeX, 1 eps figure embedded in the text, submitted to PRL","Phys. Rev. Lett. 80, 3662 (1998)","10.1103/PhysRevLett.80.3662",,"cond-mat.str-el",,"  In a recent letter (PRL 79, 2117 (1997)), Bobroff et al. presented novel
$^{17}$O NMR measurements for YBa_2(Cu_{1-x}Ni_x)_3O_{6+y} which offer a new
probe of the momentum dependence of the static spin susceptibility $\chi'(q)$.
They analyzed the $^{17}$O line width by assuming a Gaussian form for $\chi'$,
and came to the conclusion that the correlation length $\xi$ is independent of
temperature $T$. Furthermore, they claim that a Lorentzian form of $\chi'$
yields the same result. We will demonstrate that the Lorentzian and Gaussian
form of $\chi'$ actually yield qualitatively different results for the $^{17}$O
line width and its dependence on $\xi$. We show that their data when combined
with $T_{2G}$ data from Takigawa require that $\xi$ be T-dependent.
Furthermore, assuming a Gaussian form of $\chi'$ leads to the unphysical result
that $\xi$ increases with $T$. In contrast, the Lorentzian form of $\chi'$
yields that $\xi$ decreases with increasing $T$ and is thus fully compatible
with the experimental results.
","[{""version"":""v1"",""created"":""Thu, 23 Oct 1997 20:25:06 GMT""}]","2016-08-31"
"cond-mat/9710258","Marcel Franz","M. Franz and Z. Te\v{s}anovi\'c (Johns Hopkins)","Self-consistent electronic structure of a $d_{x^2-y^2}$ and a
  $d_{x^2-y^2}+id_{xy}$ vortex","4 pages REVTeX, 3 .ps figures included. Version to appear in PRL, May
  24, 1998. Minor changes, references added","PRL 80, 4763 (1998).","10.1103/PhysRevLett.80.4763",,"cond-mat.supr-con",,"  We investigate quasiparticle states associated with an isolated vortex in a
d-wave superconductor using a self-consistent Bogoliubov-de Gennes formalism.
For a pure $d_{x^2-y^2}$ superconductor we find that there exist no bound
states in the core; all the states are extended with continuous energy
spectrum. This result is inconsistent with the existing experimental data on
cuprates. We propose an explanation for this data in terms of a
magnetic-field-induced $d_{x^2-y^2}+id_{xy}$ state recently invoked in
connection with the thermal conductivity measurements on
Bi$_2$Sr$_2$CaCu$_2$O$_8$.
","[{""version"":""v1"",""created"":""Thu, 23 Oct 1997 20:42:12 GMT""},{""version"":""v2"",""created"":""Thu, 30 Apr 1998 18:11:27 GMT""}]","2007-05-23"
"cond-mat/9710259","David DiVincenzo","David P. DiVincenzo (IBM) and Daniel Loss (U. Basel)","Quantum Information is Physical","28 pages, Latex, 2 eps figures, Paper to be published in
  Superlattices and Microstructures, Special Issue on the Occasion of Rolf
  Landauer's 70th Birthday. V2: 11 pages, small corrections to Sect. IV and to
  figures","Superlattices and Microstructures 23, 419 (1998)","10.1006/spmi.1997.0520",,"cond-mat.mes-hall quant-ph",,"  We discuss a few current developments in the use of quantum mechanically
coherent systems for information processing. In each of these developments,
Rolf Landauer has played a crucial role in nudging us and other workers in the
field into asking the right questions, some of which we have been lucky enough
to answer. A general overview of the key ideas of quantum error correction is
given. We discuss how quantum entanglement is the key to protecting quantum
states from decoherence in a manner which, in a theoretical sense, is as
effective as the protection of digital data from bit noise. We also discuss
five general criteria which must be satisfied to implement a quantum computer
in the laboratory, and we illustrate the application of these criteria by
discussing our ideas for creating a quantum computer out of the spin states of
coupled quantum dots.
","[{""version"":""v1"",""created"":""Thu, 23 Oct 1997 21:21:57 GMT""},{""version"":""v2"",""created"":""Tue, 13 Jan 1998 14:29:03 GMT""}]","2009-10-30"
"cond-mat/9710260","Alexandre M. Zagoskin","Alexandre M Zagoskin and Masaki Oshikawa","Spontaneous Magnetic Flux and Quantum Noise in a Doubly Connected
  Mesoscopic SND Junction","5 pages, 2 figures",,,,"cond-mat.supr-con",,"  We consider spontaneous magnetic flux in a doubly connected s-wave/normal
metal/ d-wave superconductor (SND) Josephson junction. The flux magnitude is
not quantized and is determined by the parameters of the system. In an isolated
system, quantum fluctuations of the superconducting phase take place, leading
to quantum flux noise. The possibilities of experimental observation of the
effect are discussed.
","[{""version"":""v1"",""created"":""Thu, 23 Oct 1997 22:38:46 GMT""}]","2007-05-23"
"cond-mat/9710261","Liu Banggui","Bang-Gui Liu (Institute of Physics, CAS) and Gerd Czycholl (University
  of Bremen)","Infinite coupling magnon theory of quantum Heisenberg magnetic models of
  spin s","LaTex with two EPS figures included, uses epsfig and espcrc2.sty",,,,"cond-mat",,"  An infinity magnon coupling term is introduced into the Holstein-Primakoff
transformed forms of the Heisenberg ferromagnetic and antiferromagnetic models
of any spin $s$ to rigorously remove the unphysical magnon states. This term
makes the series expansion of the square root of the magnon operators become a
finite series of magnon operator products. Under a simple Hubbard-like
approximation our infinite coupling theory yields much better result than the
existing spin wave theories, especially near transition temperatures.
","[{""version"":""v1"",""created"":""Fri, 24 Oct 1997 02:02:21 GMT""}]","2007-05-23"
"cond-mat/9710262","Yu-Liang","Yu-Liang Liu","Low Temperature Behavior of the Kondo Effect in Tomonaga-Luttinger
  Liquid","15 pages, Latex",,,,"cond-mat",,"  Using the bosonization method, we study the low temperature behavior of the
Kondo effect in the Tomonaga-Luttinger liquid and clearly show that the power
law temperature dependence of the impurity susceptibility is completely
determined by the repulsive electron-electron interaction existing in the total
spin channel and is independent of the electron-electron interaction existing
in the charge channels.
","[{""version"":""v1"",""created"":""Fri, 24 Oct 1997 08:10:38 GMT""}]","2016-08-31"
"cond-mat/9710263","Haye Hinrichsen","Haye Hinrichsen and Mickael Antoni (MPI-PKS Dresden)","Identification of domain walls in coarsening systems at finite
  temperature","8 pages, revtex, including 6 encapsulated postscript figures, dynamic
  exponent corrected","Phys. Rev. E 57, 2650-2655 (1998)","10.1103/PhysRevE.57.2650","mpi-pks/9710007","cond-mat.stat-mech",,"  Recently B. Derrida [Phys. Rev. E 55, 3705 (1997)] introduced a numerical
technique that allows one to measure the fraction of persistent spins in a
coarsening nonequilibrium system at finite temperature. In the present work we
extend this method in a way that domain walls can be clearly identified. To
this end we consider three replicas instead of two. As an application we
measure the surface area of coarsening domains in the two-dimensional Ising
model at finite temperature. We also discuss the question to what extent the
results depend on the algorithmic implementation.
","[{""version"":""v1"",""created"":""Fri, 24 Oct 1997 08:13:39 GMT""},{""version"":""v2"",""created"":""Fri, 16 Jan 1998 13:59:41 GMT""}]","2009-10-30"
"cond-mat/9710264","Gabor Vattay","J. Cserti, G. Sz\'alka and G. Vattay (E\""otv\""os University
  Budapest,Hungary)","Crossover from Regular to Chaotic Behavior in the Conductance of
  Periodic Quantum Chains","5 pages Revtex",,"10.1103/PhysRevB.57.R15092","CMPLX-1","cond-mat.mes-hall chao-dyn nlin.CD",,"  The conductance of a waveguide containing finite number of periodically
placed identical point-like impurities is investigated. It has been calculated
as a function of both the impurity strength and the number of impurities using
the Landauer-B\""uttiker formula. In the case of few impurities the conductance
is proportional to the number of the open channels $N$ of the empty waveguide
and shows a regular staircase like behavior with step heights $\approx 2e^2/h$.
For large number of impurities the influence of the band structure of the
infinite periodic chain can be observed and the conductance is approximately
the number of energy bands (smaller than $N$) times the universal constant
$2e^2/h$. This lower value is reached exponentially with increasing number of
impurities. As the strength of the impurity is increased the system passes from
integrable to quantum-chaotic. The conductance, in units of $2e^2/h$, changes
from $N$ corresponding to the empty waveguide to $\sim N/2 $ corresponding to
chaotic or disordered system. It turnes out, that the conductance can be
expressed as $(1-c/2)N$ where the parameter $0<c<1$ measures the chaoticity of
the system.
","[{""version"":""v1"",""created"":""Fri, 24 Oct 1997 10:46:59 GMT""}]","2009-10-30"
"cond-mat/9710265","Gabor Vattay","J. Cserti, G. Sz\'alka and G. Vattay (E\""otv\""os University
  Budapest,Hungary)","Conductance in a periodically doped quantum wire","10 pages Latex",,,"CMPLX-2","cond-mat.mes-hall chao-dyn nlin.CD",,"  In this paper we will give a short rewiew about the conductance of a
mesoscopic waveguide strip with a few impurities. Green-function method is used
allowing to treat systems with low number of impurities, not only the completly
clean case. Investigating a wire containing Dirac-delta potentials (modelling
the impurities) we found that increasing number of impurities can cause a
transition of the structure of conductance. The staircase like structure of the
clean system vanishes and the conductance of a system containing finite number
of impurities located periodically will be determined by the band structure of
","[{""version"":""v1"",""created"":""Fri, 24 Oct 1997 11:31:50 GMT""}]","2007-05-23"
"cond-mat/9710266","Ove Jepsen","O. Jepsen, O.K. Andersen, I. Dasgupta and S. Savrasov
  (Max-Planck-Institute, Stuttgart)","Buckling and d-Wave Pairing in HiTc-Superconductors","5pages, Latex2e, 6 Postscript figures","J. Phys. Chem. Solids 59, 1718 (1998)","10.1016/S0022-3697(98)00089-4",,"cond-mat.supr-con",,"  We have investigated whether the electron-phonon interaction can support a
d-wave gap-anisotropy. On the basis of models derived from LDA calculations, as
well as LDA linear-response calculations we argue that this is the case, for
materials with buckled or dimpled CuO2 planes, for the so-called buckling
modes, which involve out-of-plane movements of the plane oxygens.
","[{""version"":""v1"",""created"":""Fri, 24 Oct 1997 12:34:32 GMT""}]","2009-10-30"
"cond-mat/9710267","Mark A. Novotny","M.A. Novotny, M. Kolesik, and P.A. Rikvold (Florida State U.)","Magnetization Switching in Single-Domain Ferromagnets","4 pages, LaTeX, 2 figures, documentstyle{elsart} More fits and
  Mathematica notebook at http://www.scri.fsu.edu/~novotny/magnetism.html To
  appear in J.Mag.Mag.Mater. Conference Proceedings of 7th International
  Conference on Magnetism Cairns, Australia, August, 1997","J. Magn. Magn. Mater., vol. 177-181, p. 917-918 (1998)","10.1016/S0304-8853(97)00312-0",,"cond-mat.mtrl-sci cond-mat.stat-mech",,"  A model for single-domain uniaxial ferromagnetic particles with high
anisotropy, the Ising model, is studied. Recent experimental observations have
been made of the probability that the magnetization has not switched. Here an
approach is described in which it is emphasized that a ferromagnetic particle
in an unfavorable field is in fact a metastable system, and the switching is
accomplished through the nucleation and subsequent growth of localized
droplets. Nucleation theory is applied to finite systems to determine the
coercivity as a function of particle size and to calculate the probability of
not switching. Both of these quantities are modified by different boundary
conditions, magnetostatic interactions, and quenched disorder.
","[{""version"":""v1"",""created"":""Fri, 24 Oct 1997 13:02:59 GMT""}]","2009-10-30"
"cond-mat/9710268","Madan Lal Mehta","Rong Wang (Institute of Biophysics, Academia Sinica, Beijing, People's
  Republic of China)","Dynamics of Bilayer Membranes. 2. Connection with Normal Fluids","12 pages, Tex, 1 figure not included, to appear in Colloids and
  Surfaces A: Physicochemical and Engineering Aspects (1997)",,,,"cond-mat",,"  The exchange of mass, momentum and energy between a membrane of liquid
crystal and its surroundings of stokesian fluids is added to the dynamic
equations of membranes which were deduced from the Ericksen-Leslie's theory of
liquid crystals [Rong Wang, Colloid. Sur. 112 (1996) 1].
","[{""version"":""v1"",""created"":""Fri, 24 Oct 1997 13:16:27 GMT""}]","2007-05-23"
"cond-mat/9710269","Madan Lal Mehta","Rong Wang (Institute of Biophysics, Academia Sinica, Beijing, People's
  Republic of China)","Dynamics of bilayer membranes. 1. Isolated membrane","18 pages, Tex, one figure not included here","Colloids and Surfaces A:Pysicochemical and Emgineering Aspects 112
  (1996) 1-18",,,"cond-mat q-bio",,"  By adopting the approximations suggested in the theory of thin shells, the
hydrodynamic theory of liquid crystals established by Eriksen [Arch. Rational
Mech. Anal. 4 (1960) 231; Trans. Soc. Rheol. 4 (1960) 29] and Leslie [Adv. Liq.
Cryst. 4 (1979) 1] is modified so that it is applicable to study the lipid
bilayer membranes.
","[{""version"":""v1"",""created"":""Fri, 24 Oct 1997 13:18:36 GMT""}]","2007-05-23"
"cond-mat/9710270","Pierre Ledoussal","Daniel Fisher, Pierre Le Doussal and Cecile Monthus","Random Walks, Reaction-Diffusion, and Nonequilibrium Dynamics of Spin
  Chains in One-dimensional Random Environments","5 pages, 1 figures, RevTex","Phys. Rev. Lett. {\bf 80} 3539 (1998).","10.1103/PhysRevLett.80.3539",,"cond-mat",,"  Sinai's model of diffusion in one-dimension with random local bias is studied
by a real space renormalization group which yields asymptotically exact long
time results. The distribution of the position of a particle and the
probability of it not returning to the origin are obtained, as well as the
two-time distribution which exhibits ""aging"" with $\frac{\ln t}{\ln t'}$
scaling and a singularity at $\ln t =\ln t'$. The effects of a small uniform
force are also studied. Extension to motion of many domain walls yields
non-equilibrium time dependent correlations for the 1D random field Ising model
with Glauber dynamics and ""persistence"" exponents of 1D reaction-diffusion
models with random forces.
","[{""version"":""v1"",""created"":""Fri, 24 Oct 1997 14:29:03 GMT""},{""version"":""v2"",""created"":""Fri, 12 Dec 1997 16:39:23 GMT""}]","2009-10-30"
"cond-mat/9710271","Zhengyu Weng","Z. Y. Weng, D. N. Sheng, and C. S. Ting","A bosonic RVB description of doped antiferromagnet","4 pages, Revtex, 2 Postscript figures",,,,"cond-mat.str-el cond-mat.supr-con",,"  We propose a theory for doped antiferromagnet based on a bosonic
resonating-valence-bond (RVB) state with incorporating the phase string effect.
Both antiferromagnetic (AF) and superconducting phase transitions occur
naturally within such a bosonic RVB phase. Two distinct metallic regions --
underdoping and optimum-doping -- are also found to be a logic consequence,
whose unique features explain the recent neutron-scattering measurements in
cuprates.
","[{""version"":""v1"",""created"":""Fri, 24 Oct 1997 15:05:22 GMT""}]","2007-05-23"
"cond-mat/9710272","Andrea Cavagna","Andrea Cavagna, Irene Giardina and Giorgio Parisi","On the stationary points of the TAP free energy","11 pages, 1 Postscript figure, plain TeX","Phys. Rev. B, 57, 11251 (1998)","10.1103/PhysRevB.57.11251",,"cond-mat.dis-nn cond-mat.stat-mech",,"  In the context of the p-spin spherical model, we introduce a method for the
computation of the number of stationary points of any nature (minima, saddles,
etc.) of the TAP free energy. In doing this we clarify the ambiguities related
to the approximations usually adopted in the standard calculations of the
number of states in mean field spin glass models.
","[{""version"":""v1"",""created"":""Fri, 24 Oct 1997 15:23:15 GMT""}]","2009-10-30"
"cond-mat/9710273","Dott. IX Sofia Regina","Raffaella Burioni, Davide Cassi, Sofia Regina","Cutting-Decimation Renormalization for diffusive and vibrational
  dynamics on fractals","10 pages Latex, 3 figures (figures are postscript files)",,,"UPRF-97-11","cond-mat.stat-mech",,"  Recently, we pointed out that on a class on non exactly decimable fractals
two different parameters are required to describe diffusive and vibrational
dynamics. This phenomenon we call dynamical dimension splitting is related to
the lack of exact decimation invariance for these structures, which turn out to
be invariant under a more complex cutting-decimation transform. In this paper
we study in details the dynamical dimension splitting on these fractals
analyzing the mathematical properties of the cutting-decimation transform. Our
results clarify how the splitting arises from the cutting transform and show
that the dynamical dimension degeneration is a very peculiar consequence of
exact decimability.
","[{""version"":""v1"",""created"":""Fri, 24 Oct 1997 15:56:01 GMT""}]","2007-05-23"
"dg-ga/9710027","Daniel Cartin","Daniel Cartin","Generalized Symplectic Manifolds","LaTeX, 26 pages",,,,"dg-ga math.DG",,"  This paper uses a generalization of symplectic geometry, known as
$n$-symplectic geometry and developed by Norris, to find observables on
three-dimensional manifolds. It will be seen that for the cases considered, the
$n$-symplectic observables are derivable from the symplectic observables of
$C^2$. The quantization of these observables, as well as those on the frame
bundle of $R^n$, is also examined.
","[{""version"":""v1"",""created"":""Fri, 24 Oct 1997 15:50:50 GMT""}]","2007-05-23"
