"hep-th/9710186","Bertfried Fauser","Bertfried Fauser","On an easy transition from operator dynamics to generating functionals
  by Clifford algebras","23p., 76kB, plain LaTeX, Bertfried.Fauser@uni-tuebingen.de","J.Math.Phys. 39 (1998) 4928-4947","10.1063/1.532500","Tue-prep-971104","hep-th",,"  Clifford geometric algebras of multivectors are treated in detail. These
algebras are build over a graded space and exhibit a grading or multivector
structure. The careful study of the endomorphisms of this space makes it clear,
that opposite Clifford algebras have to be used also. Based on this
mathematics, we give a fully Clifford algebraic account on generating
functionals, which is thereby geometric. The field operators are shown to be
Clifford and opposite Clifford maps. This picture relying on geometry does not
need positivity in principle. Furthermore, we propose a transition from
operator dynamics to corresponding generating functionals, which is based on
the algebraic techniques. As a calculational benefit, this transition is
considerable short compared to standard ones. The transition is not injective
(unique) and depends additionally on the choice of an ordering. We obtain a
direct and constructive connection between orderings and the explicit form of
the functional Hamiltonian. These orderings depend on the propagator of the
theory and thus on the ground state. This is invisible in path integral
formulations. The method is demonstrated within two examples, a non-linear
spinor field theory and spinor QED. Antisymmetrized and normal-ordered
functional equations are derived in both cases.
","[{""version"":""v1"",""created"":""Fri, 24 Oct 1997 11:17:02 GMT""}]","2015-06-26"
"hep-th/9710187","Krzysztof Gawedzki","Krzysztof Gawedzki","Scaling Laws in Turbulence","10 pages, latex, no figures",,,"IHES/P/97/66","hep-th",,"  The largely open problem of scaling laws in fully developed turbulence is
discussed, with the stress put on similarities and differences with scaling in
field theory. A soluble model of the passive advection is examined in more
detail in order to illustrate the principal ideas.
","[{""version"":""v1"",""created"":""Fri, 24 Oct 1997 12:23:38 GMT""}]","2007-05-23"
"hep-th/9710189","Harvendra Singh","Harvendra Singh","Macroscopic String-like Solutions in Massive Supergravity","latex file, 7 pages, typos corrected, version to appear in Phys.
  Lett. B","Phys.Lett. B419 (1998) 195-198","10.1016/S0370-2693(97)01506-2","DFPD/97/TH/48","hep-th",,"  In this report we obtain explicit string-like solutions of equations of
motion of massive heterotic supergravity recently obtained by Bergshoeff, Roo
and Eyras. We also find consistent string source which can be embedded in these
backgrounds when space-time dimension is greater than or equal to six.
","[{""version"":""v1"",""created"":""Fri, 24 Oct 1997 13:19:05 GMT""},{""version"":""v2"",""created"":""Wed, 29 Oct 1997 10:43:34 GMT""},{""version"":""v3"",""created"":""Tue, 25 Nov 1997 14:55:16 GMT""}]","2009-10-30"
"math/9710214","Akihiko Yukie","Akihiko Yukie","Ratner's theorem and invariant theory",,,,"OSU Math 1997-9","math.RT",,"  In this note, we consider applications of Ratner's theorem to constructions
of families of polynomials with dense values on the set of primitive integer
points from the viewpoint of invariant theory.
","[{""version"":""v1"",""created"":""Fri, 24 Oct 1997 00:00:00 GMT""}]","2007-05-23"
"nucl-th/9710056","Pedro Sarriguren","M.S. Fayache, E. Moya de Guerra, P. Sarriguren, Y.Y. Sharon, and L.
  Zamick","The Question of Low-Lying Intruder States in $^8Be$ and Neighboring
  Nuclei","16 pages (RevTeX), 1 PS figure. To appear in Phys. Rev. C","Phys.Rev.C57:2351-2358,1998","10.1103/PhysRevC.57.2351",,"nucl-th",,"  The presence of not yet detected intruder states in $^{8}Be$ e.g. a $J=2^{+}$
intruder at 9 $MeV$ excitation would affect the shape of the $\beta ^{\mp
}$-delayed alpha spectra of $^{8}Li$ and $^{8}B$. In order to test the
plausibility of this assumption, shell model calculations with up to $4\hbar
\omega $ excitations in $^{8}Be$ (and up to $2\hbar \omega $ excitations in
$^{10}Be$) were performed. With the above restrictions on the model spaces, the
calculations did not yield any low-lying intruder state in $^{8}Be$. Another
approach -the simple deformed oscillator model with self-consistent frequencies
and volume conservation gives an intruder state in $^{8}Be$ which is lower in
energy than the above shell model results, but its energy is still considerably
higher than 9 $MeV$.
","[{""version"":""v1"",""created"":""Fri, 24 Oct 1997 12:32:12 GMT""},{""version"":""v2"",""created"":""Wed, 4 Mar 1998 11:15:19 GMT""}]","2008-11-26"
"nucl-th/9710057","Igor Palichenkov","I. M. Pavlichenkov (Russian Research Center ""Kurchatov Institute"",
  Moscow, Russia)","High-j Intruder Orbitals and the $\Delta I$ = 4 Bifurcation in
  Superdeformed Bands","8 pages LaTeX and 1 PostScript figure, Talk presented at the
  International Conference ""Nuclear Structure and Related Topics"", Dubna, Sept.
  9 - 19, 1997",,,,"nucl-th",,"  All the known cases of the $\Delta I=4$ bifurcation in the SD bands are
analysed in the framework of the microscopic theory suggested by the author
[Phys. Rev. C 55 (1997) 1275]. It is shown that the intruder orbitals are of
paramount importance to the energy staggering.
","[{""version"":""v1"",""created"":""Fri, 24 Oct 1997 15:54:53 GMT""}]","2007-05-23"
"physics/9710033","Joachim Brand","Joachim Brand and Lorenz S. Cederbaum","First Order Static Excitation Potential: Scheme for Excitation Energies
  and Transition Moments","15 pages revtex, 1 eps figure included, corrections in Eq. (A1) and
  Sec. II F","Phys. Rev. A 57, 4311 (1998)","10.1103/PhysRevA.57.4311",,"physics.chem-ph nucl-th physics.atom-ph",,"  We present an approximation scheme for the calculation of the principal
excitation energies and transition moments of finite many-body systems. The
scheme is derived from a first order approximation to the self energy of a
recently proposed extended particle-hole Green's function. A hermitian
eigenvalue problem is encountered of the same size as the well-known Random
Phase Approximation (RPA). We find that it yields a size consistent description
of the excitation properties and removes an inconsistent treatment of the
ground state correlation by the RPA. By presenting a hermitian eigenvalue
problem the new scheme avoids the instabilities of the RPA and should be well
suited for large scale numerical calculations. These and additional properties
of the new approximation scheme are illuminated by a very simple exactly
solvable model.
","[{""version"":""v1"",""created"":""Thu, 23 Oct 1997 18:19:16 GMT""},{""version"":""v2"",""created"":""Tue, 2 Jun 1998 10:35:00 GMT""}]","2009-10-30"
"physics/9710034","Marie Christine Firpo","M.C. Firpo, Y. Elskens (Turbulence Plasma CNRS, Marseille)","Kinetic limit of N-body description of wave-particle self- consistent
  interaction","18 pages, LaTeX","J. Stat. Phys. 93 (1998) 193-209","10.1023/B:JOSS.0000026732.51044.87","TP-97-06","physics.plasm-ph chao-dyn nlin.CD",,"  A system of N particles eN=(x1,v1,...,xN,vN) interacting self-consistently
with M waves Zn=An*exp(iTn) is considered. Hamiltonian dynamics transports
initial data (eN(0),Zn(0)) to (eN(t),Zn(t)). In the limit of an infinite number
of particles, a Vlasov-like kinetic equation is generated for the distribution
function f(x,v,t), coupled to envelope equations for the M waves. Any initial
data (f(0),Z(0)) with finite energy is transported to a unique (f(t),Z(t)).
Moreover, for any time T>0, given a sequence of initial data with N particles
distributed so that the particle distribution fN(0)-->f(O) weakly and with
Zn(0)-->Z(O) as N tends to infinity, the states generated by the Hamiltonian
dynamics at all time 0<t<T are such that (eN(t),Zn(t)) converges weakly to
(f(t),Z(t)). Comments: Kinetic theory, Plasma physics.
","[{""version"":""v1"",""created"":""Fri, 24 Oct 1997 12:54:43 GMT""}]","2014-04-10"
"physics/9710035","Michael Zeitlin","Antonina N. Fedorova, Michael G. Zeitlin","Nonlinear Dynamics of Accelerator via Wavelet Approach","16 pages, no figures, LaTeX2e, aipproc.sty, aipproc.cls","American Institute of Physics,Conference Proc.,Beam Stability and
  Nonlinear Dynamics,vol.405,pp.87-102,1997","10.1063/1.53488",,"physics.acc-ph chao-dyn math-ph math.MP nlin.CD nlin.PS patt-sol physics.comp-ph",,"  In this paper we present the applications of methods from wavelet analysis to
polynomial approximations for a number of accelerator physics problems. In the
general case we have the solution as a multiresolution expansion in the base of
compactly supported wavelet basis. The solution is parametrized by the
solutions of two reduced algebraical problems, one is nonlinear and the second
is some linear problem, which is obtained from one of the next wavelet
constructions: Fast Wavelet Transform, Stationary Subdivision Schemes, the
method of Connection Coefficients. According to the orbit method and by using
construction from the geometric quantization theory we construct the symplectic
and Poisson structures associated with generalized wavelets by using
metaplectic structure. We consider wavelet approach to the calculations of
Melnikov functions in the theory of homoclinic chaos in perturbed Hamiltonian
systems and for parametrization of Arnold-Weinstein curves in Floer variational
approach.
","[{""version"":""v1"",""created"":""Fri, 24 Oct 1997 10:43:09 GMT""}]","2016-09-08"
"q-alg/9710029","Margit Roesler","Margit R\""osler","Positivity of Dunkl's intertwining operator","18 pages, LaTeX2e; some minor corrections made",,,,"q-alg math.QA",,"  For a finite reflection group on $\b R^N,$ the associated Dunkl operators are
parametrized first-order differential-difference operators which generalize the
usual partial derivatives. They generate a commutative algebra which is - under
weak assumptions - intertwined with the algebra of partial differential
operators by a unique linear and homogeneous isomorphism on polynomials. In
this paper it is shown that for non-negative parameter values, this
intertwining operator is positivity-preserving on polynomials and allows a
positive integral representation on certain algebras of analytic functions.
This result in particular implies that the generalized exponential kernel of
the Dunkl transform is positive-definite.
","[{""version"":""v1"",""created"":""Fri, 24 Oct 1997 13:00:21 GMT""},{""version"":""v2"",""created"":""Thu, 11 Dec 1997 14:59:24 GMT""}]","2007-05-23"
"q-alg/9710030","Lukierski Jerzy","Jerzy Lukierski, Valeryi N. Tolstoy","Cartan-Weyl basis for Quantum Affine Superalgebra U_q(^osp(1|2))","LaTeX source, 8 pages. To be published in the Proceedings of VI-th
  Colloquium ,,Quantum Groups and Integrable Systems'', June 19-21, 1997,
  Prague, Czech Republic",,"10.1023/A:1022825632425",,"q-alg math.QA",,"  Cartan-Weyl basis for the quantum affine superalgebra U_q(^osp(1|2)) is
constructed in an explicit form.
","[{""version"":""v1"",""created"":""Fri, 24 Oct 1997 15:21:55 GMT""}]","2009-10-30"
"quant-ph/9710055","Paul Slater","Paul B. Slater (University of California, Santa Barbara)","Bures Metrics for Certain High-Dimensional Quantum Systems","8 pages, LaTeX, 4 postscript figures, minor changes, to appear in
  Physics Letters A","Phys.Lett. A244 (1998) 35-42","10.1016/S0375-9601(98)00319-3",,"quant-ph",,"  Hubner's formula for the Bures (statistical distance) metric is applied to
both a one-parameter and a two-parameter series (n=2,...,7) of sets of 2^n x
2^n density matrices. In the doubly-parameterized series, the sets are
comprised of the n-fold tensor products --- corresponding to n independent,
identical quantum systems --- of the 2 x 2 density matrices with real entries.
The Gaussian curvatures of the corresponding Bures metrics are found to be
constants (4/n). In the second series of 2^n x 2^n density matrices studied,
the singly-parameterized sets are formed --- following a study of Krattenthaler
and Slater --- by averaging with respect to a certain Gibbs distribution, the
n-fold tensor products of the 2 x 2 density matrices with complex entries. For
n = 100, we are also able to compute the Bures distance between two arbitrary
(not necessarily neighboring) density matrices in this particular series,
making use of the eigenvalue formulas of Krattenthaler and Slater, together
with the knowledge that the 2^n x 2^n density matrices in this series commute.
","[{""version"":""v1"",""created"":""Thu, 23 Oct 1997 17:30:14 GMT""},{""version"":""v2"",""created"":""Fri, 27 Feb 1998 17:01:28 GMT""}]","2009-10-30"
"quant-ph/9710056","Howard Wiseman","H. M. Wiseman (University of Queensland, Australia)","Adaptive single-shot phase measurements: The full quantum theory","17 pages, LaTeX, 8 figures (concatenated), Submitted to Phys. Rev. A",,"10.1103/PhysRevA.57.2169",,"quant-ph",,"  The phase of a single-mode field can be measured in a single-shot measurement
by interfering the field with an effectively classical local oscillator of
known phase. The standard technique is to have the local oscillator detuned
from the system (heterodyne detection) so that it is sometimes in phase and
sometimes in quadrature with the system over the course of the measurement.
This enables both quadratures of the system to be measured, from which the
phase can be estimated. One of us [H.M. Wiseman, Phys. Rev. Lett. 75, 4587
(1995)] has shown recently that it is possible to make a much better estimate
of the phase by using an adaptive technique in which a resonant local
oscillator has its phase adjusted by a feedback loop during the single-shot
measurement. In Ref.~[H.M. Wiseman and R.B. Killip, Phys. Rev. A 56, 944] we
presented a semiclassical analysis of a particular adaptive scheme, which
yielded asymptotic results for the phase variance of strong fields. In this
paper we present an exact quantum mechanical treatment. This is necessary for
calculating the phase variance for fields with small photon numbers, and also
for considering figures of merit other than the phase variance. Our results
show that an adaptive scheme is always superior to heterodyne detection as far
as the variance is concerned. However the tails of the probability distribution
are surprisingly high for this adaptive measurement, so that it does not always
result in a smaller probability of error in phase-based optical communication.
","[{""version"":""v1"",""created"":""Fri, 24 Oct 1997 01:54:03 GMT""}]","2009-10-30"
"solv-int/9710019","Alex Kasman","Yu. Berest and A. Kasman","D-modules and Darboux transformations","to appear Lett. Math. Phys",,,"CRM-2499","solv-int math.QA nlin.SI q-alg",,"  A method of G. Wilson for generating commutative algebras of ordinary
differential operators is extended to higher dimensions. Our construction,
based on the theory of D-modules, leads to a new class of examples of
commutative rings of partial differential operators with rational spectral
varieties. As an application, we briefly discuss their link to the bispectral
problem and to the theory of lacunas.
","[{""version"":""v1"",""created"":""Thu, 23 Oct 1997 20:15:34 GMT""}]","2007-05-23"
"solv-int/9710020","Robert Conte","R. Conte (CEA Saclay)","The Painlev\'e approach to nonlinear ordinary differential equations","113 pages, no figure, standard Latex, to appear in The Painlev\'e
  property, one century later, ed. R. Conte, CRM series in mathematical physics
  (Springer--Verlag, Berlin, 1998) (Carg\`ese school, 3-22 June 1996)",,,"S97/103","solv-int nlin.SI",,"  The ``Painlev\'e analysis'' is quite often perceived as a collection of
tricks reserved to experts. The aim of this course is to demonstrate the
contrary and to unveil the simplicity and the beauty of a subject which is in
fact the theory of the (explicit) integration of nonlinear differential
equations.
  To achieve our goal, we will not start the exposition with a more or less
precise ``Painlev\'e test''. On the contrary, we will finish with it, after a
gradual introduction to the rich world of singularities of nonlinear
differential equations, so as to remove any cooking recipe.
  The emphasis is put on embedding each method of the test into the well known
theorem of perturbations of Poincar\'e. A summary can be found at the beginning
of each chapter.
","[{""version"":""v1"",""created"":""Fri, 24 Oct 1997 13:53:45 GMT""}]","2007-05-23"
