"astro-ph/9710335","R. H. Sanders","R.H. Sanders (Kapteyn Astronomical Institute, Groningen, NL)","Cosmology with Modified Newtonian Dynamics (MOND)","20 pages, LaTex (aaspp4.sty), 4 figures, submitted MNRAS","Mon.Not.Roy.Astron.Soc. 296 (1998) 1009-1018","10.1046/j.1365-8711.1998.01459.x",,"astro-ph",,"  It is well-known that the application of Newtonian dynamics to an expanding
spherical region leads to the correct relativistic expression (the Friedmann
equation) for the evolution of the cosmic scale factor. Here, the cosmological
implications of Milgrom's modified Newtonian dynamics (MOND) are considered by
means of a similar procedure. Earlier work by Felten demonstrated that in a
region dominated by modified dynamics, the expansion cannot be uniform
(separations cannot be expressed in terms of a scale factor) and that any such
region will eventually re-collapse regardless of the initial expansion velocity
and mean density. Here I show that, because of the acceleration threshold for
the MOND phenomenology, a region dominated by MOND will have a finite size
which, in the early Universe ($z > 3$), is smaller than the horizon scale.
Therefore, uniform expansion and homogeneity on horizon scale are consistent
with MOND-dominated non-uniform expansion and the development of
inhomogeneities on smaller scale. In the radiation-dominated era, the amplitude
of MOND-induced inhomogeneities is much smaller than that implied by
observations of the cosmic background radiation, and the thermal and dynamical
history of the Universe is identical to that of the standard Big Bang. When
matter first dominates the energy density of the Universe, the cosmology
diverges from that of the standard model. Objects of galaxy mass are the first
virialized objects to form (by z=10) and larger structure develops rapidly. At
the present epoch, the Universe would be inhomogeneous out to a substantial
fraction of the Hubble radius.
","[{""version"":""v1"",""created"":""Wed, 29 Oct 1997 14:55:04 GMT""}]","2009-10-30"
"astro-ph/9710336","GianLuca","S. Mereghetti, L. Sidoli and G.L. Israel","Discovery of X-rays from the composite supernova remnant G0.9+0.1 with
  the BeppoSAX satellite","4 pages. Using s_tables.tex macro (included). Accepted for
  publication in A&A Letters",,,,"astro-ph",,"  Using the BeppoSAX satellite we have obtained the first secure X-ray
detection of the supernova remnant G0.9+0.1. The 1-10 keV spectrum can be
described with an absorbed power law with photon index 3 and N_H = 3 times
10^{23} cm^2. The high column density supports a distance similar to that of
the Galactic Center. The X-ray emission, with a luminosity L_x = 10^{35}
d_{10kpc}^{2} erg/s, coincides with the central radio core, confirming the
composite nature of this remnant. Though a search for periodic pulsations gave
a negative result, the observed X-rays are probably related to the presence of
a young radio pulsar at the center of G0.9+0.1.
","[{""version"":""v1"",""created"":""Wed, 29 Oct 1997 15:16:19 GMT""}]","2007-05-23"
"astro-ph/9710337","GianLuca","S. Mereghetti, G.L. Israel and L. Stella","New limits on the orbital parameters of 1E1048.1-5937 and 1E2259+586
  from RossiXTE observations","5 pages (including figures). Using mn.sty and psfig.tex (included).
  Accepted for publication in MNRAS",,"10.1046/j.1365-8711.1998.01396.x",,"astro-ph",,"  We report on two RossiXTE observations of the anomalous X-ray pulsars 1E
1048.1-5937 and 1E 2259+586. Both sources have continued their almost constant
spin-down during 1995/96. We carried out a search for orbital Doppler shifts,
in their observed spin frequencies, deriving stringent limits on the projected
semi-axis. Unless these systems have unlikely small inclinations, main sequence
companions can be excluded. If 1E 1048.1-5937 and 1E 2259+586 are indeed binary
systems, their companion stars must be either white dwarfs, or helium-burning
stars with M < 0.8 Msolar, possibly underfilling their Roche lobe.
","[{""version"":""v1"",""created"":""Wed, 29 Oct 1997 15:29:52 GMT""}]","2009-10-30"
"chao-dyn/9710023","Debabrata Biswas","Santanu Pal (VECC, Calcutta) and Debabrata Biswas (Niels Bohr
  Institute, Copenhagen & B.A.R.C., Mumbai)","Symmetry Reduction and Semiclassical Analysis of Axially Symmetric
  Systems","23 pages (revtex) and a postscript file for figures; Phys. Rev. E (in
  press, scheduled for 01Jan98)",,"10.1103/PhysRevE.57.1475",,"chao-dyn nlin.CD nucl-th",,"  We derive a semiclassical trace formula for a symmetry reduced part of the
spectrum in axially symmetric systems. The classical orbits that contribute are
closed in (\rho,z,p_\rho,p_z) and have p_\phi = m\hbar where m is the azimuthal
quantum number. For m > 0, these orbits vary with energy and almost never lie
on periodic trajectories in the full phase space in contrast to the case of
discrete symmetries. The transition from m=0 to m > 0 is however not dramatic
as our numerical results indicate, suggesting that contributing orbits occur in
topologically equivalent families within which p_\phi varies smoothly.
","[{""version"":""v1"",""created"":""Wed, 29 Oct 1997 06:49:32 GMT""}]","2009-10-30"
"chao-dyn/9710024","Daniela Pierotti","L. Biferale, D. Pierotti and A. Vulpiani","Time-reversible Dynamical Systems for Turbulence","16 pages Latex, 4 PS figures, on press on J. Phys",,"10.1088/0305-4470/31/1/008",,"chao-dyn nlin.CD",,"  Dynamical Ensemble Equivalence between hydrodynamic dissipative equations and
suitable time-reversible dynamical systems has been investigated in a class of
dynamical systems for turbulence. The reversible dynamics is obtained from the
original dissipative equations by imposing a global constraint. We find that,
by increasing the input energy, the system changes from an equilibrium state to
a non-equilibrium stationary state in which an energy cascade, with the same
statistical properties of the original system, is clearly detected.
","[{""version"":""v1"",""created"":""Wed, 29 Oct 1997 15:22:41 GMT""}]","2009-10-30"
"cond-mat/9710298","Canessa Enrique","V. Lien Nguyen and Enrique Canessa (ICTP, Trieste, Italy)","Model for Anisotropic Directed Percolation","RevTeX, 9 pages, 3 figures. To appear in Phys.Rev.E",,"10.1103/PhysRevE.57.2467","ICTP/97/156","cond-mat",,"  We propose a simulation model to study the properties of directed percolation
in two-dimensional (2D) anisotropic random media. The degree of anisotropy in
the model is given by the ratio $\mu$ between the axes of a semi-ellipse
enclosing the bonds that promote percolation in one direction. At percolation,
this simple model shows that the average number of bonds per site in 2D is an
invariant equal to 2.8 independently of $\mu$. This result suggests that
Sinai's theorem proposed originally for isotropic percolation is also valid for
anisotropic directed percolation problems. The new invariant also yields a
constant fractal dimension $D_{f} \sim 1.71$ for all $\mu$, which is the same
value found in isotropic directed percolation (i.e., $\mu = 1$).
","[{""version"":""v1"",""created"":""Tue, 28 Oct 1997 16:03:47 GMT""}]","2009-10-30"
"cond-mat/9710299","Yaroslav M. Blanter","Ya. M. Blanter, F. W. J. Hekking, and M. Buttiker","Interaction Constants and Dynamic Conductance of a Gated Wire","4 pages, LaTeX, 2 figures","Phys. Rev. Lett. 81, 1925 (1998)","10.1103/PhysRevLett.81.1925",,"cond-mat.mes-hall",,"  We show that the interaction constant governing the long-range
electron-electron interaction in a quantum wire coupled to two reservoirs and
capacitively coupled to a gate can be determined by a low frequency
measurement. We present a self-consistent, charge and current conserving theory
of the full conductance matrix. The collective excitation spectrum consists of
plasma modes with a relaxation rate which increases with the interaction
strength and is inversely proportional to the length of the wire. The
interaction parameter is determined by the first two coefficients of the
out-of-phase component of the dynamic conductance measured at the gate.
","[{""version"":""v1"",""created"":""Tue, 28 Oct 1997 16:06:52 GMT""}]","2009-10-30"
"cond-mat/9710300","Asok K. Sen Asso Prof","Asok K. Sen","Amplification or Reduction of Backscattering in a Coherently Amplifying
  or Absorbing Disordered Chain","11 LaTeX pages plus 14 EPS figures",,"10.1016/S0378-4371(98)00330-6","ICTP Preprint No. IC/97/130","cond-mat.dis-nn cond-mat.mes-hall",,"  We study localization properties of a one-dimensional disordered system
characterized by a random non-hermitean hamiltonian where both the randomness
and the non-hermiticity arises in the local site-potential; its real part being
random, and a constant imaginary part implying the presence of either a
coherent absorption or amplification at each site. While the two-probe
transport properties behave seemingly very differently for the amplifying and
the absorbing chains, the logarithmic resistance $u$ = ln$(1+R_4)$ where $R_4$
is the 4-probe resistance gives a unified description of both the cases. It is
found that the ensemble-averaged $<u>$ increases linearly with length
indicating exponential growth of resistance. While in contrast to the case of
Anderson localization (random hermitean matrix), the variance of $u$ could be
orders of magnitude smaller in the non-hermitean case, the distribution of $u$
still remains non-Gaussian even in the large length limit.
","[{""version"":""v1"",""created"":""Tue, 28 Oct 1997 16:28:31 GMT""}]","2015-06-25"
"cond-mat/9710301","Shirish M. Chitanvis","Shirish M. Chitanvis","The onset of self-assembly","20 pages, accepted for publication in Phys. Rev. E",,,"LA-UR-97-1058","cond-mat.soft hep-th",,"  We have formulated a theory of self-assembly based on the notion of local
gauge invariance at the mesoscale. Local gauge invariance at the mesoscale
generates the required long- range entropic forces responsible for
self-assembly in binary systems. Our theory was applied to study the onset of
mesostructure formation above a critical temperature in estane, a diblock
copolymer. We used diagrammatic methods to transcend the Gaussian approximation
and obtain a correlation length zeta ~ (c-c*)^-gamma, where c* is the minimum
concentration below which self-assembly is impossible, c is the current
concentration, and gamma was found numerically to be close to 2/3. The
renormalized diffusion constant vanishes as the c* is approached, indicating
the occurrence of critical slowing down, while the correlation function remains
finite at the transition point.
","[{""version"":""v1"",""created"":""Tue, 28 Oct 1997 17:38:41 GMT""}]","2007-05-23"
"cond-mat/9710302","Stewart E. Barnes","S. E. Barnes","Field-induced quasi-particle coherence effects in certain small magnets","4 pages, 3 figures as separate eps files",,,"th97.1","cond-mat",,"  Small ferromagnets and anti-ferromagnets with an easy-plane anisotropy have a
ground to first excited state (tunnel) splitting which is quasi-periodic in the
magnitude of a field applied perpendicular to a principal anisotropy axis. The
associated oscillations in thermodynamic quantities might be used to prove the
existence of a coherent ground state even when the tunnel splitting itself
cannot be directly detected.
","[{""version"":""v1"",""created"":""Tue, 28 Oct 1997 22:22:25 GMT""}]","2007-05-23"
"cond-mat/9710303","Mikito Koga","Mikito Koga, Wenjian Liu, Michael Dolg and Peter Fulde (MPI-PKS
  Dresden)","Orbital Localization and Delocalization Effects in the U 5f^2
  Configuration: Impurity Problem","4 pages, REVTeX, email to mkoga@rumi.ucdavis.edu",,"10.1103/PhysRevB.57.10648",,"cond-mat.str-el",,"  Anderson models, based on quantum chemical studies of the molecule of
U(C_8H_8)_2, are applied to investigate the problem of an U impurity in a
metal. The special point here is that the U 5f-orbitals are divided into two
subsets: an almost completely localized set and a considerably delocalized one.
Due to the crystal field, both localized and delocalized U 5f-orbitals affect
the low-energy physics. A numerical renormalization group study shows that
every fixed point is characterized by a residual local spin and a phase shift.
The latter changes between 0 and \pi/2, which indicates the competition between
two different fixed points. Such a competition between the different local
spins at the fixed points reflects itself in the impurity magnetic
susceptibility at high temperatures. These different features cannot be
obtained if the special characters of U 5f-orbitals are neglected.
","[{""version"":""v1"",""created"":""Tue, 28 Oct 1997 22:41:23 GMT""}]","2009-10-30"
"cond-mat/9710304","Craig Pryor","Craig Pryor (Lund University)","Eight-band calculations of strained InAs/GaAs quantum dots compared with
  one, four, and six-band approximations","8 pages, 7 figures, revtex, epsf",,"10.1103/PhysRevB.57.7190",,"cond-mat.mtrl-sci cond-mat.mes-hall",,"  The electronic structure of pyramidal shaped InAs/GaAs quantum dots is
calculated using an eight-band strain dependent $\bf k\cdot p$ Hamiltonian. The
influence of strain on band energies and the conduction-band effective mass are
examined. Single particle bound-state energies and exciton binding energies are
computed as functions of island size. The eight-band results are compared with
those for one, four and six bands, and with results from a one-band
approximation in which m(r) is determined by the local value of the strain. The
eight-band model predicts a lower ground state energy and a larger number of
excited states than the other approximations.
","[{""version"":""v1"",""created"":""Wed, 29 Oct 1997 00:22:16 GMT""}]","2009-10-30"
"cond-mat/9710305","Chetan Nayak","C. Nayak (ITP), Matthew P.A. Fisher (ITP), A.W.W. Ludwig (ITP,UCSB),
  H.-H. Lin (UCSB)","Resonant Multi-Lead Point-Contact Tunneling","18 pages, LaTeX, 5 figures, psfig",,,"NSF-ITP-97-135","cond-mat.mes-hall",,"  We analyze a model of resonant point-contact tunneling between multiple
Luttinger liquid leads. The model is a variant of the multi-channel Kondo model
and can be related to the quantum Brownian motion of a particle on lattices
with $\pi$-flux through each plaquette (in the 3-lead case, it is a honeycomb
lattice with $\pi$-flux). By comparing the perturbative and instanton gas
expansions, we find a duality property of the model. At the boundary, this
duality exchanges Neumann and Dirichlet boundary conditions on the
Tomonaga-Luttinger bosons which describe the leads; in the bulk, it exchanges
the `momentum' and `winding' modes of these bosons. Over a certain range of
Luttinger liquid parameter, $g$, a novel non-trivial intermediate coupling
fixed point controls the low-energy physics. The finite conductance at this
fixed point can be exactly computed for two special values of $g$. For larger
values of $g$, there is a stable fixed point at strong coupling which has
enhanced conductance resulting from an analogue of Andreev reflection at the
point contact.
","[{""version"":""v1"",""created"":""Wed, 29 Oct 1997 01:39:15 GMT""}]","2007-05-23"
"cond-mat/9710306","Ulrich Hansmann","Ulrich H.E. Hansmann (IMS) and Yuko Okamoto (IMS)","Generalized-ensemble Monte carlo method for systems with rough energy
  landscape","Latex; ps-files included","Phys. Rev. E 56 (1997) 2228 - 2233","10.1103/PhysRevE.56.2228",,"cond-mat physics.chem-ph",,"  We present a novel Monte Carlo algorithm which enhances equilibrization of
low-temperature simulations and allows sampling of configurations over a large
range of energies. The method is based on a non-Boltzmann probability weight
factor and is another version of the so-called generalized-ensemble techniques.
The effectiveness of the new approach is demonstrated for the system of a small
peptide, an example of the frustrated system with a rugged energy landscape.
","[{""version"":""v1"",""created"":""Wed, 29 Oct 1997 05:19:21 GMT""}]","2009-10-30"
"cond-mat/9710307","Mats Jonson","M. Jonson, I. V. Krive, P. Sandstr\""om, and R. I. Shekhter","Nonlinear conductance of nanowires - A signature of Luttinger liquid
  effects?","13 pages, latex with supplied stylefile, 3 figures in eps format,
  submitted to Superlattices and Microstructures",,"10.1006/spmi.1997.0556","G\""oteborg preprint APR 97-22","cond-mat",,"  We analyze recent measurements of the room temperature current-voltage
characteristics of gold nanowires, whose zero current conductance is quantized
in units of $2e^2/h$. A faster than linear increase of current with voltage was
observed at low voltages beginning from $V_c=0.1$V. We analyze the nonlinear
behavior in terms of a dynamic Coulomb blockade of conducting modes and show
that it may be explained as a Luttinger-liquid effect.
","[{""version"":""v1"",""created"":""Wed, 29 Oct 1997 08:28:22 GMT""}]","2016-08-15"
"cond-mat/9710308","Matteo Beccaria","Matteo Beccaria, Giulio Soliani","Algebraic methods in the study of systems of the reaction-diffusion type","39 pages, REVTEX, 8 PostScript figures",,,"ULDF-TH-2/10/97","cond-mat.stat-mech",,"  Nonlinear systems of the reaction-diffusion type, including Gierer-Meinhardt
models of autocatalysis, are studied by using Lie algebras coming from the
prolongation structure. The consequences of this analytical approach, as the
determination of special exact solutions, are compared with the corresponding
results obtained via numerical simulations.
","[{""version"":""v1"",""created"":""Wed, 29 Oct 1997 08:55:41 GMT""}]","2007-05-23"
"cond-mat/9710309","Mahito Kohmoto","J. Shiraishi, Y.Avishai and M. Kohmoto","Charge and current oscillations in Fractional quantum Hall systems with
  edges","16 pages, 6 figures Revtex",,"10.1103/PhysRevB.57.13061",,"cond-mat.mes-hall",,"  Stationary solutions of the Chern-Simons effective field theory for the
fractional quantum Hall systems with edges are presented for Hall bar, disk and
annulus. In the infinitely long Hall bar geometry (non compact case), the
charge density is shown to be monotonic inside the sample. In sharp contrast,
spatial oscillatory modes of charge density are found for the two circular
geometries, which indicate that in systems with compact geometry, charge and
current exist also far from the edges.
","[{""version"":""v1"",""created"":""Wed, 29 Oct 1997 08:58:11 GMT""}]","2009-10-30"
"cond-mat/9710310",,"J.Dukelsky, M.A. Martin-Delgado, T. Nishino and G. Sierra","Equivalence of the Variational Matrix Product Method and the Density
  Matrix Renormalization Group applied to Spin Chains","REVTEX file, 4 pages, NO figures inserted in text. 2 Tables",,"10.1209/epl/i1998-00381-x",,"cond-mat.str-el cond-mat.supr-con",,"  We present a rotationally invariant matrix product method (MPM) of isotropic
spin chains. This allows us to deal with a larger number of variational MPM
parameters than those considered earlier by other authors. We also show the
relation between the MPM and the DMRG method of White. In our approach the
eigenstates of the density matrix associated with the MPM are used as
variational parameters together with the standard MPM parameters. We compute
the ground state energy density and the spin correlation length of the spin 1
Heisenberg chain.
","[{""version"":""v1"",""created"":""Wed, 29 Oct 1997 12:08:47 GMT""}]","2009-10-30"
"cond-mat/9710311","Vyacheslav Yukalov","V. I. Yukalov","Relaxation Regimes of Spin Maser","1 file, 10 pages, LaTex, no figures","Laser Phys. 7 (1997) 58-62",,,"cond-mat.stat-mech",,"  Spin relaxation in a microscopic model of spin maser is studied
theoretically. Seven qualitatively different regimes are found: free induction,
collective induction, free relaxation, collective relaxation, weak
superradiance, pure superradiance, and triggered superradiance. The initiation
of relaxation can be originated either by an imposed initial coherence or by
local spin fluctuations due to nonsecular dipole interactions. The Nyquist
noise of resonator does not influence processes in macroscopic samples. The
relaxation regimes not initiated by an imposed coherence cannot be described by
the standard Bloch equations.
","[{""version"":""v1"",""created"":""Wed, 29 Oct 1997 12:46:43 GMT""}]","2007-05-23"
"cond-mat/9710312","Marc-Andre Lewis","Marc-Andre Lewis","Higher moments of spin-spin correlation functions for the ferromagnetic
  random bond Potts model","6 pages, LaTeX (needs revtex); typos corrected (alpha->-alpha in
  final formula)","Eurphys. Lett. 43(2) pp.189-194 (1998)","10.1209/epl/i1998-00564-y","PAR-LPTHE 97/44","cond-mat.dis-nn cond-mat.stat-mech",,"  Using CFT techniques, we compute the disorder-averaged p-th power of the
spin-spin correlation function for the ferromagnetic random bonds Potts model.
We thus generalize the calculation of Dotsenko, Dotsenko and Picco, where the
case p=2 was considered. Perturbative calculations are made up to the second
order in epsilon (epsilon being proportional to the central charge deviation of
the pure model from the Ising model value). The explicit dependence of the
correlation function on $p$ gives an upper bound for the validity of the
expansion, which seems to be valid, in the three-states case, only if p<=4.
","[{""version"":""v1"",""created"":""Wed, 29 Oct 1997 15:04:19 GMT""},{""version"":""v2"",""created"":""Thu, 27 Nov 1997 09:33:24 GMT""},{""version"":""v3"",""created"":""Wed, 10 Jun 1998 09:00:40 GMT""},{""version"":""v4"",""created"":""Thu, 27 May 1999 07:42:03 GMT""}]","2009-10-30"
"cond-mat/9710313","S. Fujimoto","Satoshi Fujimoto(Kyoto University, University of Oxford), Norio
  Kawakami(Osaka University)","Exact Drude weight for the one-dimensional Hubbard model at finite
  temperatures","9 pages, RevTex, To appear in J. Phys. A",,"10.1088/0305-4470/31/2/008",,"cond-mat.str-el",,"  The Drude weight for the one-dimensional Hubbard model is investigated at
finite temperatures by using the Bethe ansatz solution. Evaluating finite-size
corrections to the thermodynamic Bethe ansatz equations, we obtain the formula
for the Drude weight as the response of the system to an external gauge
potential. We perform low-temperature expansions of the Drude weight in the
case of half-filling as well as away from half-filling, which clearly
distinguish the Mott-insulating state from the metallic state.
","[{""version"":""v1"",""created"":""Wed, 29 Oct 1997 14:39:10 GMT""}]","2009-10-30"
"cond-mat/9710314","Stuart Burnett","Stuart S.C. Burnett (Manitoba)","Additive renormalization of the specific heat of O(n) symmetric systems
  in three-loop order","9 pages RevTeX, 1 figure",,,,"cond-mat.stat-mech hep-th",,"  We present three-loop formulas for the additive renormalization constant
A(u,epsilon) and associated renormalization group function B(u) for the
specific heat of the O(n) symmetric phi^4 model. Using this result, we obtain
also the amplitude function above Tc within the minimally renormalied theory at
fixed d=3. At the fixed point, the three-loop correction to B(u) turns out to
be small (about 3% for n=2). We note that a correction of this size may become
important at the level of accuracy expected in future experiments.
","[{""version"":""v1"",""created"":""Wed, 29 Oct 1997 14:47:17 GMT""}]","2007-05-23"
"cond-mat/9710315","Sean Washburn","S Washburn, D Popovic, KP Li and AB Fowler (The University of North
  Carolina at Chapel Hill, National High Magnetic Field Laboratory)","Absence of Localization in Certain Field Effect Transistors","8 pages, LaTeX, figure label changed",,"10.1006/spmi.1997.0526","SW-108","cond-mat.str-el cond-mat.dis-nn cond-mat.mes-hall",,"  We review some experimental and theoretical results on the metal-to-insulator
transition (MIT) observed at zero magnetic field (B=0) in several
two-dimensional electron systems (2DES). Scaling of the conductance and
magnetic field dependence of the conductance provide convincing evidence that
the MIT is driven by Coulomb interactions among the carriers and is
dramatically sensitive to spin polarization of the carriers.
","[{""version"":""v1"",""created"":""Wed, 29 Oct 1997 14:51:44 GMT""},{""version"":""v2"",""created"":""Sat, 1 Nov 1997 01:26:07 GMT""}]","2019-08-17"
"cond-mat/9710316","Ludger Santen","N. Rajewsky, L. Santen, A. Schadschneider, M. Schreckenberg","The asymmetric exclusion process: Comparison of update procedures","47 pages (11 PostScript figures included), LATEX, Two misprints in
  equations corrected",,,,"cond-mat.stat-mech",,"  The asymmetric exclusion process (ASEP) has attracted a lot of interest not
only because its many applications, e.g. in the context of the kinetics of
biopolymerization and traffic flow theory, but also because it is a
paradigmatic model for nonequilibrium systems. Here we study the ASEP for
different types of updates, namely random-sequential, sequential,
sublattice-parallel and parallel. In order to compare the effects of the
different update procedures on the properties of the stationary state, we use
large-scale Monte Carlo simulations and analytical methods, especially the
so-called matrix-product Ansatz (MPA). We present in detail the exact solution
for the model with sublattice-parallel and sequential updates using the MPA.
For the case of parallel update, which is important for applications like
traffic flow theory, we determine the phase diagram, the current, and density
profiles based on Monte Carlo simulations. We furthermore suggest a MPA for
that case and derive the corresponding matrix algebra.
","[{""version"":""v1"",""created"":""Wed, 29 Oct 1997 14:58:09 GMT""},{""version"":""v2"",""created"":""Fri, 31 Oct 1997 17:50:48 GMT""}]","2007-05-23"
