"cond-mat/9710317","Oshanin","J.De Coninck(1), G.Oshanin(1,2) and M.Moreau(2) ((1) CRMM, Universite
  de Mons-Hainaut, Belgium; (2) LPTL, Universite Paris VI, France)","Dynamics of a driven probe molecule in a liquid monolayer","Latex, 7 pages, 1 figure","Europhys. Lett. 38 (7), 527 (1997)","10.1209/epl/i1997-00278-2",,"cond-mat.soft",,"  We study dynamics of a probe molecule, driven by an external constant force
in a liquid monolayer on top of solid surface. In terms of a microscopic,
mean-field-type approach, we calculate the terminal velocity of the probe
molecule. This allows us to establish the analog of the Stokes formula, in
which the friction coefficient is interpreted in terms of the microscopic
parameters characterizing the system. We also determine the distribution of the
monolayer particles as seen from the stationary moving probe molecule and
estimate the self-diffusion coefficient for diffusion in a liquid monolayer.
","[{""version"":""v1"",""created"":""Wed, 29 Oct 1997 15:24:42 GMT""}]","2015-06-25"
"dg-ga/9710030","Ping Xu","Kirill Mackenzie and Ping Xu","Classical lifting processes and multiplicative vector fields","Latex, 27 pages, Quarterly J. Math. (Oxford), to appear",,,,"dg-ga math.DG",,"  We extend the calculus of multiplicative vector fields and differential forms
and their intrinsic derivatives from Lie groups to Lie groupoids; this
generalization turns out to include also the classical process of complete
lifting from arbitrary manifolds to tangent and cotangent bundles. Using this
calculus we give a new description of the Lie bialgebroid structure associated
with a Poisson groupoid.
","[{""version"":""v1"",""created"":""Tue, 28 Oct 1997 21:22:45 GMT""}]","2007-05-23"
"gr-qc/9710119","Roland Steinbauer","Roland Steinbauer","Geodesics and geodesic deviation for impulsive gravitational waves","final version, minor grammatical changes","J.Math.Phys. 39 (1998) 2201-2212","10.1063/1.532283",,"gr-qc math-ph math.MP",,"  The geometry of impulsive pp-waves is explored via the analysis of the
geodesic and geodesic deviation equation using the distributional form of the
metric. The geodesic equation involves formally ill-defined products of
distributions due to the nonlinearity of the equations and the presence of the
Dirac $\de$-distribution in the space time metric. Thus, strictly speaking, it
cannot be treated within Schwartz's linear theory of distributions. To cope
with this difficulty we proceed by first regularizing the
$\de$-singularity,then solving the regularized equation within classical smooth
functions and, finally, obtaining a distributional limit as solution to the
original problem. Furthermore it is shown that this limit is independent of the
regularization without requiring any additional condition, thereby confirming
earlier results in a mathematical rigorous fashion. We also treat the Jacobi
equation which, despite being linear in the deviation vector field, involves
even more delicate singular expressions, like the ``square'' of the Dirac
$\de$-distribution. Again the same regularization procedure provides us with a
perfectly well behaved smooth regularization and a regularization-independent
distributional limit. Hence it is concluded that the geometry of impulsive
pp-waves can be described consistently using distributions as long as careful
regularization procedures are used to handle the ill-defined products.
","[{""version"":""v1"",""created"":""Tue, 28 Oct 1997 16:14:15 GMT""},{""version"":""v2"",""created"":""Fri, 27 Mar 1998 12:09:29 GMT""}]","2015-06-25"
"gr-qc/9710122","Samuel Rocha Oliveira","Patricio. S. Letelier and Samuel R. Oliveira","Superposition of Weyl solutions: The equilibrium forces","31 pages, 7 figures, psbox macro. Submitted to Classical and Quantum
  Gravity","Class.Quant.Grav. 15 (1998) 421-433","10.1088/0264-9381/15/2/015",,"gr-qc",,"  Solutions to the Einstein equation that represent the superposition of static
isolated bodies with axially symmetry are presented. The equations nonlinearity
yields singular structures (strut and membranes) to equilibrate the bodies. The
force on the strut like singularities is computed for a variety of situations.
The superposition of a ring and a particle is studied in some detail
","[{""version"":""v1"",""created"":""Tue, 28 Oct 1997 16:05:42 GMT""}]","2009-10-30"
"gr-qc/9710123","Vanzo Luciano","D. Klemm, V. Moretti and L. Vanzo","Rotating Topological Black Holes","25 pages, LateX, five ps figures added, minor errors corrected,
  addition of new references, improved discussion of the conserved charges","Phys.Rev.D57:6127-6137,1998; Erratum-ibid.D60:109902,1999","10.1103/PhysRevD.57.6127 10.1103/PhysRevD.60.109902","preprint UTF 408","gr-qc",,"  A class of metrics solving Einstein's equations with negative cosmological
constant and representing rotating, topological black holes is presented. All
such solutions are in the Petrov type-$D$ class, and can be obtained from the
most general metric known in this class by acting with suitably chosen discrete
groups of isometries. First, by analytical continuation of the Kerr-de Sitter
metric, a solution describing uncharged, rotating black holes whose event
horizon is a Riemann surface of arbitrary genus $g > 1$, is obtained. Then a
solution representing a rotating, uncharged toroidal black hole is also
presented. The higher genus black holes appear to be quite exotic objects, they
lack global axial symmetry and have an intricate causal structure. The toroidal
blackholes appear to be simpler, they have rotational symmetry and the amount
of rotation they can have is bounded by some power of the mass.
","[{""version"":""v1"",""created"":""Tue, 28 Oct 1997 16:44:30 GMT""},{""version"":""v2"",""created"":""Thu, 11 Dec 1997 14:20:23 GMT""}]","2014-11-17"
"gr-qc/9710124","Jose Wadih Maluf","J. W. Maluf (Universidade de Brasilia)","Sparling two-forms, the conformal factor and the gravitational energy
  density of the teleparallel equivalent of general relativity","12 pages, Latex file, no figures, to be published in Gen. Rel. Grav","Gen.Rel.Grav. 30 (1998) 413-423","10.1023/A:1018806825254",,"gr-qc",,"  It has been shown recently that within the framework of the teleparallel
equivalent of general relativity (TEGR) it is possible to define the energy
density of the gravitational field. The TEGR amounts to an alternative
formulation of Einstein's general relativity, not to an alternative gravity
theory. The localizability of the gravitational energy has been investigated in
a number of space-times with distinct topologies, and the outcome of these
analises agree with previously known results regarding the exact expression of
the gravitational energy, and/or with the specific properties of the space-time
manifold. In this article we establish a relationship between the expression
for the gravitational energy density of the TEGR and the Sparling two-forms,
which are known to be closely connected with the gravitational energy. We also
show that our expression of energy yields the correct value of gravitational
mass contained in the conformal factor of the metric field.
","[{""version"":""v1"",""created"":""Tue, 28 Oct 1997 17:16:07 GMT""}]","2015-06-25"
"gr-qc/9710125","Justino Martinez","L. Herrera, J. Martinez","Gravitational collapse: A case for thermal relaxation","33 pages, LaTex 2.09, 11 Postscript figures. To be published in
  General Relativity and Gravitation","Gen.Rel.Grav. 30 (1998) 445-471","10.1023/A:1018862910233",,"gr-qc astro-ph",,"  Two relativistic models for collapsing spheres at different stages of
evolution, which include pre-relaxation processes, are presented. The influence
of relaxation time on the outcome of evolution in both cases is exhibited and
established. It is shown that relaxation processes can drastically change the
final state of the collapsing system. In particular, there are cases in which
the value of the relaxation time determines the bounce or the collapse of the
sphere.
","[{""version"":""v1"",""created"":""Tue, 28 Oct 1997 21:04:21 GMT""}]","2015-06-25"
"gr-qc/9710126","Christiane Lechner","Peter C. Aichelburg, Christiane Lechner","Sigma Model on de Sitter Space","11 pages, latex2e, 1 figure","Phys.Rev. D57 (1998) 6176-6180","10.1103/PhysRevD.57.6176","UWThPh-1997-41","gr-qc",,"  We discuss spherically symmetric, static solutions to the SU(2) sigma model
on a de Sitter background. Despite of its simplicity this model reflects many
of the features exhibited by systems of non-linear matter coupled to gravity
e.g. there exists a countable set of regular solutions with finite energy; all
of the solutions show linear instability with the number of unstable modes
increasing with energy.
","[{""version"":""v1"",""created"":""Wed, 29 Oct 1997 12:08:22 GMT""}]","2009-10-30"
"gr-qc/9710127","Linux User Rhs","Orfeu Bertolami","Baryogenesis motivated on String CPT Violation","3 pages, plain Latex (requires mproc.sty available at
  http://shemesh.fiz.huji.ac.il/MG8/submition.html). Talk delivered at the
  Early Universe session at the 8th Marcel Grossmann Meeting",,,,"gr-qc",,"  We discuss a mechanism for generating the baryon asymetry of the Universe
that involves a putative violation of CPT symmetry arising from string
interactions.
","[{""version"":""v1"",""created"":""Wed, 29 Oct 1997 14:56:37 GMT""}]","2007-05-23"
"hep-ex/9710030","Siggi Bethke","Siegfried Bethke (RWTH Aachen)","QCD Tests at $e^+e^-$ Colliders","Revised version: some references added and corrected; world summary
  of $\alpha_s$ extended by result from polarized structure functions. 9 pages,
  15 EPS figures; contribution to the CQD Euroconference 97 (Montpellier 1997)","Nucl.Phys.Proc.Suppl. 64 (1998) 54-62","10.1016/S0920-5632(97)01036-0","PITHA 97/37","hep-ex hep-ph",,"  A short review of the history and a 'slide-show' of QCD tests in $e^+e^-$
annihilation is given. The world summary of measurements of $\alpha_s$ is
updated.
","[{""version"":""v1"",""created"":""Wed, 29 Oct 1997 10:51:30 GMT""},{""version"":""v2"",""created"":""Wed, 5 Nov 1997 16:57:17 GMT""}]","2009-10-30"
"hep-lat/9710094","Pilar Hernandez","P. Hernandez, Ph. Boucaud","A Wilson-Yukawa model with a chiral spectrum in 2D","3 pages, LaTeX, uses espcrc2.sty. To appear in proceedings of Lattice
  97, Edinbugh, Scotland","Nucl.Phys.Proc.Suppl.63:608-610,1998","10.1016/S0920-5632(97)00847-5","CERN-TH/97-300","hep-lat",,"  We summarize our recent study of the fermion spectrum in a fermion-scalar 2D
model with a chiral $U(1)_L \times U(1)_R$ global symmetry. This model is
obtained from a two-cutoff lattice formulation of a 2D U(1) chiral gauge
theory, in the limit of zero gauge coupling. The massless fermion spectrum
found deep in the vortex phase is undoubled and chiral.
","[{""version"":""v1"",""created"":""Wed, 29 Oct 1997 11:19:59 GMT""}]","2010-03-19"
"hep-ph/9710497",,"J.I. Illana (Institut f\""ur Theoretische Physik, Karlsruhe)","One-loop weak dipole moments of heavy fermions in the MSSM","5 pages, 1 ps figure, LaTeX using appb.sty (included) and epsf.sty.
  Contribution to the XXI School of Theoretical Physics ``Recent Progress in
  theory and phenomenology of fundamental interactions"", Ustron, Poland,
  September 1997. The complete ps-file is also available via WWW at
  http://www-itp.physik.uni-karlsruhe.de/prep/prep.html","Acta Phys.Polon.B28:2389-2394,1997",,"KA-TP-17-1997","hep-ph",,"  The MSSM predictions at the one-loop level for the weak dipole moments of the
\tau lepton and the b quark are presented. The imaginary part of the AWMDM is
of the order of the SM contribution whereas the real part may be a factor 5
(20) larger for the \tau (b) in the high \tan\beta scenario, still a factor
five below the QCD contribution in the b case. More interestingly, a
contribution up to twelve orders of magnitude larger than in the SM may be
obtained, already at the one-loop level, for the WEDM in a MSSM with complex
parameters.
","[{""version"":""v1"",""created"":""Tue, 28 Oct 1997 18:48:01 GMT""}]","2011-03-02"
"hep-ph/9710510","Robert Kaminski","Chueng-Ryong Ji, Robert Kaminski, Leonard Lesniak, Adam Szczepaniak,
  Robert Williams","Coupled Channel Analysis of S-Wave Pion-Pion and Kaon-Kaon
  Photoproduction","40 pages including 18 figures, minor modifications","Phys.Rev.C58:1205-1217,1998","10.1103/PhysRevC.58.1205","INP-1769/PH, Cracow, Poland","hep-ph",,"  We present a coupled channel partial wave analysis of nondiffractive S-wave
pi+ pi- and K+ K- photoproduction focusing on the KK threshold. Final state
interactions are included. We calculate total cross sections, angular and
effective mass distributions in both pion-pion and kaon-antikaon channels. Our
results indicate that these processes are experimentally measurable and
valuable information on the f0(980) resonance structure can be obtained.
","[{""version"":""v1"",""created"":""Tue, 28 Oct 1997 16:12:37 GMT""},{""version"":""v2"",""created"":""Wed, 29 Oct 1997 11:00:25 GMT""},{""version"":""v3"",""created"":""Wed, 3 Feb 1999 11:00:24 GMT""}]","2008-11-26"
"hep-ph/9710511","Dietmar Ebert","D.Ebert (Humboldt University, Berlin)","Bosonization in Particle Physics","12 pages, LaTeX, uses lamuphys.sty, 5 LaTeX figures, talk given at
  the Workshop ""Field Theoretical Tools in Polymer and Particle Physics"",
  University Wuppertal, June 17-19, 1997",,"10.1007/BFb0106879","HUB-EP-97/79","hep-ph",,"  Path integral techniques in collective fields are shown to be a useful
analytical tool to reformulate a field theory defined in terms of microscopic
quark (gluon) degrees of freedom as an effective theory of collective boson
(meson) fields. For illustrations, the path integral bosonization approach is
applied to derive a (non)linear sigma model from a Nambu-Jona-Lasinio (NJL)
quark model. The method can be extended to include higher order derivative
terms in meson fields or heavy-quark symmetries. It is also approximately
applicable to QCD.
","[{""version"":""v1"",""created"":""Tue, 28 Oct 1997 16:36:11 GMT""}]","2009-10-30"
"hep-ph/9710512","Ulrich Nierste","Yong-Yeon Keum and Ulrich Nierste","Probing penguin coefficients with the lifetime ratio tau(B_s)/tau(B_d)","14 pages, 6 figures, LaTex 2e, uses jeep.sty, a4wide.sty, a4.sty,
  fancyheadings.sty, cite.sty, epsf.sty, rotate.sty, times.sty","Phys. Rev. D 57, 4282 (1998)","10.1103/PhysRevD.57.4282","DESY-97-120, APCTP-97-17","hep-ph",,"  We calculate penguin contributions to the lifetime splitting between the B_s
and the B_d meson. In the Standard Model the penguin effects are found to be
opposite in sign, but of similar magnitude as the contributions of the
current-current operators, despite of the smallness of the penguin
coefficients. We predict
  tau(B_s)/tau(B_d) -1 = ( -1.2 +/- 10.0 ) * 10^(-3) * (f_{B_s}/190 MeV)^2
where the error stems from hadronic uncertainties. Since penguin coefficients
are sensitive to new physics and poorly tested experimentally, we analyze the
possibility to extract them from a future precision measurement of
tau(B_s)/tau(B_d). Anticipating progress in the determination of the hadronic
parameters epsilon_1, epsilon_2 and f_{B_s}/f_{B_d} we find that the
coefficient C_4 can be extracted with an uncertainty of order |Delta C_4|= 0.1
from the double ratio (tau(B_s)-tau(B_d))/(tau(B^+)-tau(B_d)), if
|epsilon_1-epsilon_2| is not too small.
","[{""version"":""v1"",""created"":""Tue, 28 Oct 1997 16:45:19 GMT""}]","2016-08-25"
"hep-ph/9710513","Christian Bauer","Christian Bauer","Corrections to Moments of the Photon Spectrum in the Inclusive Decay B
  \to X_s \gamma","18 pages, 6 figures, revtex, changes to analytical results,
  conclusions unchanged, submitted as an Erratum to Phys.Rev. D","Phys.Rev.D57:5611-5619,1998; Erratum-ibid.D60:099907,1999","10.1103/PhysRevD.57.5611 10.1103/PhysRevD.60.099907","UTPT--97-19","hep-ph",,"  We investigate the two main uncertainties on the extraction of the
nonperturbative matrix elements $\bar{\Lambda}$ and $\lambda_1$ from moments of
the inclusive rare FCNC decay $B \to X_s \gamma$. The first one is due to
unknown matrix elements of higher dimensional operators which are estimated by
varying the matrix elements in a range as suggested by dimensional analysis.
The effect of these terms is found to be small. A second uncertainty arises
from a cut on the photon energy and we give model independent bounds on these
uncertainties as well as their estimates from a simplified version of the ACCMM
model.
","[{""version"":""v1"",""created"":""Wed, 29 Oct 1997 01:11:29 GMT""},{""version"":""v2"",""created"":""Wed, 11 Mar 1998 20:38:05 GMT""},{""version"":""v3"",""created"":""Fri, 25 Jun 1999 00:42:38 GMT""}]","2014-11-17"
"hep-ph/9710514",,"M.A. Ivanov and T. Mizutani (Virginia Tech)","The box anomaly and radiative decays of \eta(\eta')-mesons","22 pages, Latex, 10 PS figures",,,,"hep-ph",,"  We report on a confined quark model calculation of the transition form
factors for the radiative decays of \eta(\eta')->\gamma l^+l^- and
\eta(\eta')->\gamma\pi^+\pi^-. The \eta-\eta' mixing angle \theta_P is
determined from the set of data on the electromagnetic \eta(\eta') decays. It
is found that \theta_P\sim -16.5. The analysis of the dipionic mass
distribution in the decay \eta'->\gamma\pi^+\pi^- confirms the existence of a
non-resonant contribution which is the box anomaly.
","[{""version"":""v1"",""created"":""Tue, 28 Oct 1997 21:21:22 GMT""}]","2007-05-23"
"hep-ph/9710515","Kunihiko Terasaki","K. Terasaki","Non-factorizable long distance contributions in color suppressed decays
  of B mesons","19 pages, Revtex","Int.J.Mod.Phys. A13 (1998) 4325-4338","10.1142/S0217751X98002092","YITP-97-52","hep-ph",,"  $\bar B \to D\pi$, $D^*\pi$, $J/\psi\bar K$ and $J/\psi\pi$ decays are
studied. Their amplitude is given by a sum of factorized and non-factorizable
ones. The latter which is estimated by using a hard pion approximation is
rather small in color favored $\bar B \to D\pi$ and $D^*\pi$ decays but still
can efficiently interfere with the main amplitude given by the factorization.
In the color suppressed $\bar B \to J/\psi\bar K$ and $J/\psi\pi$ decays, the
non-factorizable contribution is very important. The sum of the factorized and
non-factorizable amplitudes can reproduce well the existing experimental data
on the branching ratios for the color favored $\bar B \to D\pi$ and $D^*\pi$
and the color suppressed $\bar B \to J/\psi \bar K$ and $J/\psi\pi$ decays by
taking reasonable values of unknown parameters involved.
","[{""version"":""v1"",""created"":""Wed, 29 Oct 1997 04:44:14 GMT""}]","2009-10-30"
"hep-ph/9710516","Joe Sato","J. Sato and T. Yanagida","Large Lepton Mixing in a Coset-space Family Unification on $E_7/SU(5)
  \times U(1)^3$","8 pages, Latex2e","Phys.Lett. B430 (1998) 127-131","10.1016/S0370-2693(98)00510-3","UT-796","hep-ph",,"  We study a coset-space unification model for families based on $E_7/SU(5)
\times U(1)^3$. We find that qualitative structure of quark and lepton mass
matrices in this model describes very well the observation. We stress, in
particular, that the large mixing angle, $\sin^22\theta_{\nu_\mu\nu_\tau}
\simeq 1$, required for the atmospheric neutrino oscillation reported by the
SuperKamiokande collaboration, is naturally obtained, which is a consequence of
unparallel family structure in the present coset-space unification.
","[{""version"":""v1"",""created"":""Wed, 29 Oct 1997 05:43:00 GMT""}]","2016-09-06"
"hep-ph/9710517","Yang Chun-Bin","C.B. Yang and X. Cai","Analytical investigation for multiplicity difference correlators under
  QGP phase transition","5 pages, RevTeX, three figures in EPS format","Phys.Rev.C57:2049-2052,1998","10.1103/PhysRevC.57.2049",,"hep-ph",,"  It is suggested that the study of multiplicity difference correlators between
two well-separated bins in high-energy heavy-ion collisions can be used as a
means to detect evidence of a quark-hadron phase transition. Analytical
expressions for the scaled factorial moments of multiplicity difference
distribution are obtained in a kinetical region ${\bar s}\le 0.3$ within
Ginzburg-Landau description. It is shown that the scaling behaviors between the
moments are still valid, though the behaviors of the moments with respect to
the bin size are completely different from the so-called intermittency
patterns. A universal exponent $\gamma$ is given to describe the dynamical
fluctuations in the phase transition.
","[{""version"":""v1"",""created"":""Wed, 29 Oct 1997 07:01:32 GMT""},{""version"":""v2"",""created"":""Fri, 31 Oct 1997 06:53:42 GMT""}]","2008-11-26"
"hep-ph/9710518","Steven Bass","S. D. Bass, M. M. Brisudova and A. De Roeck","The Drell-Hearn-Gerasimov Sum-Rule at Polarized HERA","7 pages, LaTeX, 1 figure generated as fig1.tex. To appear in Proc.
  Workshop on ``Physics with Polarized Protons at HERA''",,,"TK-97-12","hep-ph hep-ex",,"  We discuss the potential of polarized HERA to measure the spin dependent part
of the total photoproduction cross-section at large $\sqrt{s_{\gamma p}}$.
","[{""version"":""v1"",""created"":""Wed, 29 Oct 1997 09:13:52 GMT""}]","2007-05-23"
"hep-ph/9710519","Stefan Hesselbach","S. Hesselbach, F. Franke and H. Fraas","Production of neutralinos in superstring-inspired E_6 models","7 pages, Latex, including 12 Postscript figures, uses rotating.sty,
  amssymb.sty; complete psfile also available at
  ftp://ftp.physik.uni-wuerzburg.de/pub/preprint/1997/WUE-ITP-97-042.ps.gz ;
  contribution to the proceedings of the ""ECFA/DESY Study on Physics and
  Detectors for the Linear Collider"", DESY 97-123E, ed. R. Settles",,,"WUE-ITP-97-042","hep-ph",,"  We study the neutralino mass spectra and production cross sections at an
e^+e^- linear collider in superstring-inspired E_6 models. These models are
characterized by the existence of new neutral gauge bosons and singlet Higgs
fields which also lead to an extended neutralino sector compared to the Minimal
Supersymmetric Standard Model (MSSM) or the Next-To-Minimal Supersymmetric
Standard Model (NMSSM). For different E_6 models we develop scenarios with new
light exotic neutralinos which may offer important possibilities to distinguish
between the models.
","[{""version"":""v1"",""created"":""Wed, 29 Oct 1997 12:12:37 GMT""}]","2007-05-23"
"hep-ph/9710520",,"N.V.Krasnikov","Supersymmetric SU(5) model with large supersymmetry breaking scale","13 pages, latex, no figures",,,"Preprint INR 869R/97","hep-ph",,"  Taking into account uncertainties related with the initial coupling constants
and threshold corrections at low and high scales we find that in standard
supersymmetric SU(5) model the supersymmetry breaking scale could be up to
$10^8$ GeV. In the extensions of the standard supersymmetric SU(5) model the
supersymmetry breaking scale could be up to $O(10^{12})$ GeV.
  In standard SU(5) supersymmetric model it is possible to increase the GUT
scale up to $5 \cdot 10^{17}$ GeV provided that the masses of chiral
superoctets and supertriplets are $m_{3,8} \sim O(10^{13})$ GeV. For SU(5)
supersymmetric model with $10^6$ GeV $\leq M_{SUSY} \leq 10^8$ GeV the Higgs
boson mass is predicted to be 120 GeV $\leq m_h \leq $ 150 GeV.
","[{""version"":""v1"",""created"":""Wed, 29 Oct 1997 12:47:06 GMT""}]","2007-05-23"
"hep-ph/9710521","Stefan Dittmaier","A. Denner, S. Dittmaier and M. Roth","Non-factorizable photonic corrections to ee->WW->4fermions","46 pages, latex, 13 eps figures, incorrect remarks concerning the
  universality of non-factorizable corrections to pure invariant-mass
  distributions discarded","Nucl.Phys.B519:39-84,1998","10.1016/S0550-3213(98)00046-7","CERN-TH/97-258, PSI-PR-97-30","hep-ph",,"  We study the non-factorizable corrections to W-pair-mediated four-fermion
production in ee annihilation in double-pole approximation. We show how these
corrections can be combined with the known corrections to the production and
the decay of on-shell W-boson pairs, and how the full off-shell Coulomb
singularity is included. Moreover, we find that the actual form of the real
non-factorizable corrections depends on the parametrization of phase space,
more precisely, on the definition of the invariant masses of the resonant W
bosons. For the usual parametrization the full analytical results for the
non-factorizable corrections are presented. Our analytical and numerical
results for the non-factorizable corrections agree with a recent calculation,
which was found to differ from a previous one. The detailed numerical
discussion covers the invariant-mass distribution, various angular
distributions, and the lepton-energy distribution for leptonic final states.
","[{""version"":""v1"",""created"":""Wed, 29 Oct 1997 14:17:21 GMT""},{""version"":""v2"",""created"":""Thu, 30 Oct 1997 08:39:01 GMT""},{""version"":""v3"",""created"":""Thu, 5 Mar 1998 15:41:45 GMT""}]","2009-09-25"
"hep-ph/9710522","Juan Cruz Estrada","Juan Estrada and Luis Masperi (Centro Atomico Bariloche and Instituto
  Balseiro)","Dynamical Cosmological Constant and Relations Among Pseudo Goldstone
  Bosons","6 pages, 1 Postscript figure","Mod.Phys.Lett. A13 (1998) 423-428","10.1142/S0217732398000486",,"hep-ph astro-ph",,"  The present apparent cosmological constant is interpreted as the potential of
the lightest pseudo Goldstone boson. Some numerical relations among
cosmological parameters and particle masses are shown to arise from the mixture
of this very light particle, whose interaction is of the gravitational order,
with other pseudo Goldstone bosons like the pion and the axion which feel the
strong interaction.
","[{""version"":""v1"",""created"":""Wed, 29 Oct 1997 13:58:30 GMT""}]","2015-06-25"
