"nucl-th/9708015","Igor Strakovsky","R. A. Arndt, C. H. Oh, I. I. Strakovsky, R. L. Workman (VPI), and F.
  Dohrmann (Univ. Hamburg)","Nucleon-Nucleon Partial Wave Analysis to 2.5 GeV","3 pages of text and 5 postscript figures. Invited talk at the 7th
  Int. Symposium on Meson-Nucleon Physics and the Structure of the Nucleon,
  Vancouver, BC, Canada, July 28 - Aug 1, 1997","piN Newslett.3:314-319,1997",,,"nucl-th",,"  A partial-wave analysis of NN elastic scattering data has been completed.
This analysis covers an expanded energy range, from threshold to a laboratory
kinetic energy of 2.5 GeV, in order to include recent elastic pp scattering
data produced by the EDDA collaboration at COSY. The results of both
single-energy and energy-dependent analyses are described.
","[{""version"":""v1"",""created"":""Fri, 8 Aug 1997 17:41:23 GMT""}]","2014-11-18"
"nucl-th/9708016","Stefan Leupold","Stefan Leupold (1), Wolfram Peters (1) and Ulrich Mosel (1,2) ((1)
  Institut fuer Theoretische Physik, Universitaet Giessen, (2) Institute for
  Nuclear Theory, University of Washington, Seattle)","What QCD sum rules tell about the rho meson","15 pages, Revtex, 2 figures included","Nucl.Phys. A628 (1998) 311-324","10.1016/S0375-9474(97)00634-9","GI-TH-97-10","nucl-th hep-ph",,"  Using a simple parametrization of Breit-Wigner type for the hadronic side of
the QCD sum rule for $\rho$ mesons in vacuum as well as in a nuclear medium we
explore the range of values for the mass and the width of the $\rho$ meson
which are compatible with the operator product expansion.
","[{""version"":""v1"",""created"":""Fri, 8 Aug 1997 18:45:36 GMT""}]","2009-10-30"
"nucl-th/9708017","Charlotte Elster","Ch. Elster, J.H. Thomas, W. Gloeckle","Two-Body T-Matrices without Angular Momentum Decomposition: Energy and
  Momentum Dependencies","19 pages (revtex), 15 figures","Few Body Syst. 24 (1998) 55-79","10.1007/s006010050076",,"nucl-th",,"  The two-body t-matrix is calculated directly as function of two vector
momenta for different Malfliet-Tjon type potentials. At a few hundred MeV
projectile energy the total amplitude is quite a smooth function showing only a
strong peak in forward direction. In contrast the corresponding partial wave
contributions, whose number increases with increasing energy, become more and
more oscillatory with increasing energy. The angular and momentum dependence of
the full amplitude is studied and displayed on as well as off the energy shell
as function of positive and negative energies. The behavior of the t-matrix in
the vicinity of bound state poles and resonance poles in the second energy
sheet is studied. It is found that the angular dependence of T exhibits a very
characteristic behavior in the vicinity of those poles, which is given by the
Legendre function corresponding to the quantum number either of the bound state
or the resonance (or virtual) state. This behavior is illustrated with
numerical examples.
","[{""version"":""v1"",""created"":""Sat, 9 Aug 1997 01:09:42 GMT""}]","2019-08-17"
"q-alg/9708010","Tomasz Brzezinski","Tomasz Brzezinski and Piotr M. Hajac","Coalgebra Extensions and Algebra Coextensions of Galois Type","21 pages, LaTeX, uses amssymb. Major revision. Version to appear in
  Commun. Algebra","Commun. Algebra, 27:1347-1367, 1999",,"DAMTP/97-76","q-alg math.QA math.RA",,"  The notion of a coalgebra-Galois extension is defined as a natural
generalisation of a Hopf-Galois extension. It is shown that any
coalgebra-Galois extension induces a unique entwining map $\psi$ compatible
with the right coaction. For the dual notion of an algebra-Galois coextension
it is also proven that there always exists a unique entwining structure
compatible with the right action.
","[{""version"":""v1"",""created"":""Sat, 9 Aug 1997 11:41:50 GMT""},{""version"":""v2"",""created"":""Sun, 21 Jun 1998 15:17:31 GMT""}]","2008-02-03"
"quant-ph/9708016","Richard Cleve","Richard Cleve, Artur Ekert, Chiara Macchiavello, and Michele Mosca","Quantum Algorithms Revisited","18 pages, LaTeX, 7 figures. Submitted to Proc. Roy. Soc. Lond. A",,"10.1098/rspa.1998.0164",,"quant-ph",,"  Quantum computers use the quantum interference of different computational
paths to enhance correct outcomes and suppress erroneous outcomes of
computations. A common pattern underpinning quantum algorithms can be
identified when quantum computation is viewed as multi-particle interference.
We use this approach to review (and improve) some of the existing quantum
algorithms and to show how they are related to different instances of quantum
phase estimation. We provide an explicit algorithm for generating any
prescribed interference pattern with an arbitrary precision.
","[{""version"":""v1"",""created"":""Fri, 8 Aug 1997 17:56:53 GMT""}]","2009-10-30"
"quant-ph/9708017","M. Dakna","T. Opatrny, M. Dakna, and D.-G. Welsch","Exponential Moments of Canonical Phase: Homodyne Measurements","Presented at the 5-th International Conference on Squeezed States and
  Uncertainty Relations (4 ps-figures)",,,,"quant-ph",,"  A method for direct sampling of the exponential moments of canonical phase
from the data recorded in balanced homodyne detection is presented. Analytical
expressions for the sampling functions are shown which are valid for arbitrary
states. A numerical simulation illustrates the applicability of the method and
compares it with the direct measurement of phase by means of double homodyning.
","[{""version"":""v1"",""created"":""Sat, 9 Aug 1997 14:40:42 GMT""}]","2007-05-23"
"quant-ph/9708018","M. Dakna","D.-G. Welsch, M. Dakna, L. Knoll, and T. Opatrny","Photon adding and subtracting and Schroedinger-cat generation in
  conditional output measurement on a beam splitter","Presented at the 5-th International Conference on Squeezed States and
  Uncertainty Relations (4 ps-figures)",,,,"quant-ph",,"  The problem of photon adding and subtracting is studied, using conditional
output measurement on a beam splitter. It is shown that for various classes of
states the corresponding photon-added and -subtracted states can be prepared.
Analytical results are presented, with special emphasis on photon-added and
-subtracted squeezed vacuum states, which are found to represent two different
types of Schroedinger-cat-like states. Effects of realistic photocounting and
Fock-state preparation are discussed.
","[{""version"":""v1"",""created"":""Sat, 9 Aug 1997 14:57:58 GMT""}]","2007-05-23"
